Airline,Date_of_Journey,Source,Destination,Route,Dep_Time,Arrival_Time,Duration,Total_Stops,Additional_Info,Price,journey_date,dep_time_obj,arr_time_obj,business_economy,duration_minutes,weekday_weekend,same_day_arrival,overnight_flight,popularity_of_airline,has_meal,has_inflight_entertainment,origin_code,destination_code,distance,is_diwali,is_eid_fitr,is_eid_adha,is_christmas_newyear,is_holi,is_ganesh_chaturthi,is_dussehra,is_republic_day,is_independence_day,is_holiday_period,month,day_of_month,week_of_year,quarter,season,is_peak_season,departure_time_of_day,arrival_time_of_day,is_morning_departure,is_evening_departure,num_stops,is_direct_flight,route_key,route_popularity,is_metro_route,days_until_month_end,is_month_start,is_month_end,average_speed,duration_per_km,is_long_haul,is_short_haul
IndiGo,24/03/2019,Banglore,New Delhi,BLR → DEL,22:20,01:10 22 Mar,2h 50m,non-stop,No info,3897,2019-03-24,22:20:00,01:10:00,0,170,1,0,1,2053,0,0,BLR,DEL,1708.6520853536679,0,0,0,0,1,0,0,0,0,1,3,24,12,1,1,1,3,0,0,1,0,1,Banglore_New Delhi,932,0,7,0,1,603.0536771836476,0.0994936309487559,1,0
Air India,1/05/2019,Kolkata,Banglore,CCU → IXR → BBI → BLR,05:50,13:15,7h 25m,2 stops,No info,7662,2019-05-01,05:50:00,13:15:00,0,445,0,1,0,1752,0,0,CCU,BLR,1546.4372901474003,0,0,0,0,0,0,0,0,0,0,5,1,18,2,1,1,0,2,0,0,2,0,Kolkata_Banglore,2871,1,30,1,0,208.50839867155958,0.2877581928702614,1,0
Jet Airways,9/06/2019,Delhi,Cochin,DEL → LKO → BOM → COK,09:25,04:25 10 Jun,19h,2 stops,No info,13882,2019-06-09,09:25:00,04:25:00,0,1140,1,0,1,3849,0,0,DEL,COK,2047.882109458646,0,1,0,0,0,0,0,0,0,1,6,9,23,2,1,0,1,0,1,0,2,0,Delhi_Cochin,4537,0,21,1,0,107.7832689188761,0.5566726691612912,1,0
IndiGo,12/05/2019,Kolkata,Banglore,CCU → NAG → BLR,18:05,23:30,5h 25m,1 stop,No info,6218,2019-05-12,18:05:00,23:30:00,0,325,1,1,0,2053,0,0,CCU,BLR,1546.4372901474003,0,0,0,0,0,0,0,0,0,0,5,12,19,2,1,1,3,3,0,1,1,0,Kolkata_Banglore,2871,1,19,0,0,285.49611510413547,0.21016047793895495,1,0
IndiGo,01/03/2019,Banglore,New Delhi,BLR → NAG → DEL,16:50,21:35,4h 45m,1 stop,No info,13302,2019-03-01,16:50:00,21:35:00,0,285,0,1,0,2053,0,0,BLR,DEL,1708.6520853536679,0,0,0,0,0,0,0,0,0,0,3,1,9,1,1,1,2,3,0,0,1,0,Banglore_New Delhi,932,0,30,1,0,359.71622849550903,0.16679814600232606,1,0
SpiceJet,24/06/2019,Kolkata,Banglore,CCU → BLR,09:00,11:25,2h 25m,non-stop,No info,3873,2019-06-24,09:00:00,11:25:00,0,145,0,1,0,818,0,0,CCU,BLR,1546.4372901474003,0,0,0,0,0,0,0,0,0,0,6,24,26,2,1,0,1,1,1,0,0,1,Kolkata_Banglore,2871,1,6,0,1,639.9050855782347,0.09376390554199529,1,0
Jet Airways,12/03/2019,Banglore,New Delhi,BLR → BOM → DEL,18:55,10:25 13 Mar,15h 30m,1 stop,In-flight meal not included,11087,2019-03-12,18:55:00,10:25:00,0,930,0,0,0,3849,0,0,BLR,DEL,1708.6520853536679,0,0,0,0,0,0,0,0,0,0,3,12,11,1,1,1,3,1,0,1,1,0,Banglore_New Delhi,932,0,19,0,0,110.23561840991405,0.5442886869549588,1,0
Jet Airways,01/03/2019,Banglore,New Delhi,BLR → BOM → DEL,08:00,05:05 02 Mar,21h 5m,1 stop,No info,22270,2019-03-01,08:00:00,05:05:00,0,1265,0,0,1,3849,0,0,BLR,DEL,1708.6520853536679,0,0,0,0,0,0,0,0,0,0,3,1,9,1,1,1,1,0,1,0,1,0,Banglore_New Delhi,932,0,30,1,0,81.04278665709096,0.7403496655892718,1,0
Jet Airways,12/03/2019,Banglore,New Delhi,BLR → BOM → DEL,08:55,10:25 13 Mar,25h 30m,1 stop,In-flight meal not included,11087,2019-03-12,08:55:00,10:25:00,0,1530,0,0,0,3849,0,0,BLR,DEL,1708.6520853536679,0,0,0,0,0,0,0,0,0,0,3,12,11,1,1,1,1,1,1,0,1,0,Banglore_New Delhi,932,0,19,0,0,67.0059641315164,0.8954426785388031,1,0
Multiple carriers,27/05/2019,Delhi,Cochin,DEL → BOM → COK,11:25,19:15,7h 50m,1 stop,No info,8625,2019-05-27,11:25:00,19:15:00,0,470,0,1,0,1196,0,0,DEL,COK,2047.882109458646,0,0,0,0,0,0,0,0,0,0,5,27,22,2,1,1,1,3,1,0,1,0,Delhi_Cochin,4537,0,4,0,1,261.4317586542952,0.22950539868930428,1,0
Air India,1/06/2019,Delhi,Cochin,DEL → BLR → COK,09:45,23:00,13h 15m,1 stop,No info,8907,2019-06-01,09:45:00,23:00:00,0,795,1,1,0,1752,0,0,DEL,COK,2047.882109458646,0,1,0,0,0,0,0,0,0,1,6,1,22,2,1,0,1,3,1,0,1,0,Delhi_Cochin,4537,0,29,1,0,154.5571403365016,0.3882059403361636,1,0
IndiGo,18/04/2019,Kolkata,Banglore,CCU → BLR,20:20,22:55,2h 35m,non-stop,No info,4174,2019-04-18,20:20:00,22:55:00,0,155,0,1,0,2053,0,0,CCU,BLR,1546.4372901474003,0,0,0,0,0,0,0,0,0,0,4,18,16,2,1,1,3,3,0,1,0,1,Kolkata_Banglore,2871,1,12,0,0,598.6208865086711,0.10023038178627082,1,0
Air India,24/06/2019,Chennai,Kolkata,MAA → CCU,11:40,13:55,2h 15m,non-stop,No info,4667,2019-06-24,11:40:00,13:55:00,0,135,0,1,0,1752,0,0,MAA,CCU,1385.198425287915,0,0,0,0,0,0,0,0,0,0,6,24,26,2,1,0,1,2,1,0,0,1,Chennai_Kolkata,381,1,6,0,1,615.6437445724066,0.09745896150000323,1,0
Jet Airways,9/05/2019,Kolkata,Banglore,CCU → BOM → BLR,21:10,09:20 10 May,12h 10m,1 stop,In-flight meal not included,9663,2019-05-09,21:10:00,09:20:00,0,730,0,0,1,3849,0,0,CCU,BLR,1546.4372901474003,0,0,0,0,0,0,0,0,0,0,5,9,19,2,1,1,3,1,0,1,1,0,Kolkata_Banglore,2871,1,22,1,0,127.10443480663565,0.4720527658321142,1,0
IndiGo,24/04/2019,Kolkata,Banglore,CCU → BLR,17:15,19:50,2h 35m,non-stop,No info,4804,2019-04-24,17:15:00,19:50:00,0,155,0,1,0,2053,0,0,CCU,BLR,1546.4372901474003,0,0,0,0,0,0,0,0,0,0,4,24,17,2,1,1,2,3,0,0,0,1,Kolkata_Banglore,2871,1,6,0,1,598.6208865086711,0.10023038178627082,1,0
Air India,3/03/2019,Delhi,Cochin,DEL → AMD → BOM → COK,16:40,19:15 04 Mar,26h 35m,2 stops,No info,14011,2019-03-03,16:40:00,19:15:00,0,1595,1,0,0,1752,0,0,DEL,COK,2047.882109458646,0,0,0,0,0,0,0,0,0,0,3,3,9,1,1,1,2,3,0,0,2,0,Delhi_Cochin,4537,0,28,1,0,77.03631759719045,0.7788534274668942,1,0
SpiceJet,15/04/2019,Delhi,Cochin,DEL → PNQ → COK,08:45,13:15,4h 30m,1 stop,No info,5830,2019-04-15,08:45:00,13:15:00,0,270,0,1,0,818,0,0,DEL,COK,2047.882109458646,0,0,0,0,0,0,0,0,0,0,4,15,16,2,1,1,1,2,1,0,1,0,Delhi_Cochin,4537,0,15,0,0,455.08491321303245,0.1318435269066216,1,0
Jet Airways,12/06/2019,Delhi,Cochin,DEL → BOM → COK,14:00,12:35 13 Jun,22h 35m,1 stop,In-flight meal not included,10262,2019-06-12,14:00:00,12:35:00,0,1355,0,0,0,3849,0,0,DEL,COK,2047.882109458646,0,0,0,0,0,0,0,0,0,0,6,12,24,2,1,0,2,2,0,0,1,0,Delhi_Cochin,4537,0,18,0,0,90.68112661809502,0.6616591813276751,1,0
Air India,12/06/2019,Delhi,Cochin,DEL → CCU → BOM → COK,20:15,19:15 13 Jun,23h,2 stops,No info,13381,2019-06-12,20:15:00,19:15:00,0,1380,0,0,0,1752,0,0,DEL,COK,2047.882109458646,0,0,0,0,0,0,0,0,0,0,6,12,24,2,1,0,3,3,0,1,2,0,Delhi_Cochin,4537,0,18,0,0,89.03835258515852,0.6738669153005103,1,0
Jet Airways,27/05/2019,Delhi,Cochin,DEL → BOM → COK,16:00,12:35 28 May,20h 35m,1 stop,In-flight meal not included,12898,2019-05-27,16:00:00,12:35:00,0,1235,0,0,0,3849,0,0,DEL,COK,2047.882109458646,0,0,0,0,0,0,0,0,0,0,5,27,22,2,1,1,2,2,0,0,1,0,Delhi_Cochin,4537,0,4,0,1,99.49224823280872,0.6030620582580655,1,0
GoAir,6/03/2019,Delhi,Cochin,DEL → BOM → COK,14:10,19:20,5h 10m,1 stop,No info,19495,2019-03-06,14:10:00,19:20:00,0,310,0,1,0,194,0,0,DEL,COK,2047.882109458646,0,0,0,0,0,0,0,0,0,0,3,6,10,1,1,1,2,3,0,0,1,0,Delhi_Cochin,4537,0,25,1,0,396.3642792500605,0.15137590126315814,1,0
Air India,21/03/2019,Banglore,New Delhi,BLR → COK → DEL,22:00,13:20 19 Mar,15h 20m,1 stop,No info,6955,2019-03-21,22:00:00,13:20:00,0,920,0,0,1,1752,0,0,BLR,DEL,1708.6520853536679,0,0,0,0,1,0,0,0,0,1,3,21,12,1,1,1,3,2,0,1,1,0,Banglore_New Delhi,932,0,10,0,1,111.43383165350008,0.5384361204285614,1,0
IndiGo,3/04/2019,Banglore,Delhi,BLR → DEL,04:00,06:50,2h 50m,non-stop,No info,3943,2019-04-03,04:00:00,06:50:00,0,170,0,1,1,2053,0,0,BLR,DEL,1708.6520853536679,0,0,0,0,0,0,0,0,0,0,4,3,14,2,1,1,0,1,0,0,0,1,Banglore_Delhi,1265,1,27,1,0,603.0536771836476,0.0994936309487559,1,0
IndiGo,1/05/2019,Banglore,Delhi,BLR → DEL,18:55,21:50,2h 55m,non-stop,No info,4823,2019-05-01,18:55:00,21:50:00,0,175,0,1,0,2053,0,0,BLR,DEL,1708.6520853536679,0,0,0,0,0,0,0,0,0,0,5,1,18,2,1,1,3,3,0,1,0,1,Banglore_Delhi,1265,1,30,1,0,585.8235721212576,0.10241991421195461,1,0
Jet Airways,6/05/2019,Kolkata,Banglore,CCU → BOM → BLR,18:55,08:15 07 May,13h 20m,1 stop,In-flight meal not included,7757,2019-05-06,18:55:00,08:15:00,0,800,0,0,0,3849,0,0,CCU,BLR,1546.4372901474003,0,0,0,0,0,0,0,0,0,0,5,6,19,2,1,1,3,1,0,1,1,0,Kolkata_Banglore,2871,1,25,1,0,115.98279676105501,0.517318099542043,1,0
Jet Airways,9/06/2019,Delhi,Cochin,DEL → IDR → BOM → COK,21:25,12:35 10 Jun,15h 10m,2 stops,No info,13292,2019-06-09,21:25:00,12:35:00,0,910,1,0,1,3849,0,0,DEL,COK,2047.882109458646,0,1,0,0,0,0,0,0,0,1,6,9,23,2,1,0,3,2,0,1,2,0,Delhi_Cochin,4537,0,21,1,0,135.02519403024039,0.44436151661120615,1,0
IndiGo,1/06/2019,Delhi,Cochin,DEL → LKO → COK,21:50,03:35 02 Jun,5h 45m,1 stop,No info,8238,2019-06-01,21:50:00,03:35:00,0,345,1,0,1,2053,0,0,DEL,COK,2047.882109458646,0,1,0,0,0,0,0,0,0,1,6,1,22,2,1,0,3,0,0,1,1,0,Delhi_Cochin,4537,0,29,1,0,356.1534103406341,0.1684667288251276,1,0
GoAir,15/05/2019,Delhi,Cochin,DEL → BOM → COK,07:00,12:55,5h 55m,1 stop,No info,7682,2019-05-15,07:00:00,12:55:00,0,355,0,1,0,194,0,0,DEL,COK,2047.882109458646,0,0,0,0,0,0,0,0,0,0,5,15,20,2,1,1,1,2,1,0,1,0,Delhi_Cochin,4537,0,16,0,0,346.12091990850354,0.17334982241426172,1,0
Vistara,18/06/2019,Banglore,Delhi,BLR → DEL,09:45,12:35,2h 50m,non-stop,No info,4668,2019-06-18,09:45:00,12:35:00,0,170,0,1,0,479,0,0,BLR,DEL,1708.6520853536679,0,0,0,0,0,0,0,0,0,0,6,18,25,2,1,0,1,2,1,0,0,1,Banglore_Delhi,1265,1,12,0,0,603.0536771836476,0.0994936309487559,1,0
Vistara,15/06/2019,Chennai,Kolkata,MAA → CCU,07:05,09:20,2h 15m,non-stop,No info,3687,2019-06-15,07:05:00,09:20:00,0,135,1,1,0,479,0,0,MAA,CCU,1385.198425287915,0,0,0,0,0,0,0,0,0,0,6,15,24,2,1,0,1,1,1,0,0,1,Chennai_Kolkata,381,1,15,0,0,615.6437445724066,0.09745896150000323,1,0
Vistara,18/06/2019,Chennai,Kolkata,MAA → CCU,07:05,09:20,2h 15m,non-stop,No info,3687,2019-06-18,07:05:00,09:20:00,0,135,0,1,0,479,0,0,MAA,CCU,1385.198425287915,0,0,0,0,0,0,0,0,0,0,6,18,25,2,1,0,1,1,1,0,0,1,Chennai_Kolkata,381,1,12,0,0,615.6437445724066,0.09745896150000323,1,0
Air India,1/05/2019,Kolkata,Banglore,CCU → GAU → DEL → BLR,09:50,23:15,13h 25m,2 stops,No info,13227,2019-05-01,09:50:00,23:15:00,0,805,0,1,0,1752,0,0,CCU,BLR,1546.4372901474003,0,0,0,0,0,0,0,0,0,0,5,1,18,2,1,1,1,3,1,0,2,0,Kolkata_Banglore,2871,1,30,1,0,115.26240671906089,0.5205513376641807,1,0
IndiGo,6/04/2019,Banglore,Delhi,BLR → DEL,04:00,06:50,2h 50m,non-stop,No info,4423,2019-04-06,04:00:00,06:50:00,0,170,1,1,1,2053,0,0,BLR,DEL,1708.6520853536679,0,0,0,0,0,0,0,0,0,0,4,6,14,2,1,1,0,1,0,0,0,1,Banglore_Delhi,1265,1,24,1,0,603.0536771836476,0.0994936309487559,1,0
Jet Airways,15/06/2019,Delhi,Cochin,DEL → NAG → BOM → COK,14:35,12:35 16 Jun,22h,2 stops,In-flight meal not included,10919,2019-06-15,14:35:00,12:35:00,0,1320,1,0,0,3849,0,0,DEL,COK,2047.882109458646,0,0,0,0,0,0,0,0,0,0,6,15,24,2,1,0,2,2,0,0,2,0,Delhi_Cochin,4537,0,15,0,0,93.08555042993845,0.6445683537657056,1,0
Jet Airways,18/05/2019,Delhi,Cochin,DEL → BOM → COK,07:05,12:35,5h 30m,1 stop,In-flight meal not included,12373,2019-05-18,07:05:00,12:35:00,0,330,1,1,0,3849,0,0,DEL,COK,2047.882109458646,0,0,0,0,0,0,0,0,0,0,5,18,20,2,1,1,1,2,1,0,1,0,Delhi_Cochin,4537,0,13,0,0,372.3422017197538,0.1611420884414264,1,0
IndiGo,27/06/2019,Delhi,Cochin,DEL → BOM → COK,10:35,21:00,10h 25m,1 stop,No info,5894,2019-06-27,10:35:00,21:00:00,0,625,0,1,0,2053,0,0,DEL,COK,2047.882109458646,0,0,0,0,0,0,0,0,0,0,6,27,26,2,1,0,1,3,1,0,1,0,Delhi_Cochin,4537,0,3,0,1,196.59668250803003,0.3051933493208833,1,0
SpiceJet,21/05/2019,Kolkata,Banglore,CCU → MAA → BLR,15:05,20:20,5h 15m,1 stop,No info,4649,2019-05-21,15:05:00,20:20:00,0,315,0,1,0,818,0,0,CCU,BLR,1546.4372901474003,0,0,0,0,0,0,0,0,0,0,5,21,21,2,1,1,2,3,0,0,1,0,Kolkata_Banglore,2871,1,10,0,1,294.55948383760006,0.2036940016946794,1,0
Air India,18/05/2019,Kolkata,Banglore,CCU → BLR,14:15,16:45,2h 30m,non-stop,No info,6245,2019-05-18,14:15:00,16:45:00,0,150,1,1,0,1752,0,0,CCU,BLR,1546.4372901474003,0,0,0,0,0,0,0,0,0,0,5,18,20,2,1,1,2,2,0,0,0,1,Kolkata_Banglore,2871,1,13,0,0,618.5749160589601,0.09699714366413306,1,0
Jet Airways,06/03/2019,Banglore,New Delhi,BLR → BOM → DEL,07:00,13:15,6h 15m,1 stop,No info,19225,2019-03-06,07:00:00,13:15:00,0,375,0,1,0,3849,0,0,BLR,DEL,1708.6520853536679,0,0,0,0,0,0,0,0,0,0,3,6,10,1,1,1,1,2,1,0,1,0,Banglore_New Delhi,932,0,25,1,0,273.3843336565868,0.21947124473990273,1,0
Jet Airways,3/06/2019,Delhi,Cochin,DEL → BOM → COK,07:05,19:00,11h 55m,1 stop,No info,14924,2019-06-03,07:05:00,19:00:00,0,715,0,1,0,3849,0,0,DEL,COK,2047.882109458646,0,1,0,0,0,0,0,0,0,1,6,3,23,2,1,0,1,3,1,0,1,0,Delhi_Cochin,4537,0,27,1,0,171.85024694757868,0.34914119162309054,1,0
Multiple carriers,21/05/2019,Delhi,Cochin,DEL → HYD → COK,07:05,18:10,11h 5m,1 stop,No info,9646,2019-05-21,07:05:00,18:10:00,0,665,0,1,0,1196,0,0,DEL,COK,2047.882109458646,0,0,0,0,0,0,0,0,0,0,5,21,21,2,1,1,1,3,1,0,1,0,Delhi_Cochin,4537,0,10,0,1,184.77131814664477,0.32472572367741986,1,0
Air India,15/03/2019,Banglore,New Delhi,BLR → BOM → DEL,06:45,15:15,8h 30m,1 stop,No info,8714,2019-03-15,06:45:00,15:15:00,0,510,0,1,0,1752,0,0,BLR,DEL,1708.6520853536679,0,0,0,0,1,0,0,0,0,1,3,15,11,1,1,1,1,2,1,0,1,0,Banglore_New Delhi,932,0,16,0,0,201.01789239454916,0.2984808928462677,1,0
Jet Airways,18/05/2019,Delhi,Cochin,DEL → BOM → COK,20:55,19:00 19 May,22h 5m,1 stop,In-flight meal not included,12373,2019-05-18,20:55:00,19:00:00,0,1325,1,0,0,3849,0,0,DEL,COK,2047.882109458646,0,0,0,0,0,0,0,0,0,0,5,18,20,2,1,1,3,3,0,1,1,0,Delhi_Cochin,4537,0,13,0,0,92.73428420190095,0.6470099005602726,1,0
Air Asia,6/05/2019,Banglore,Delhi,BLR → DEL,11:10,13:55,2h 45m,non-stop,No info,3383,2019-05-06,11:10:00,13:55:00,0,165,0,1,0,319,0,0,BLR,DEL,1708.6520853536679,0,0,0,0,0,0,0,0,0,0,5,6,19,2,1,1,1,2,1,0,0,1,Banglore_Delhi,1265,1,25,1,0,621.3280310376974,0.09656734768555719,1,0
Multiple carriers,21/03/2019,Delhi,Cochin,DEL → BOM → COK,09:00,21:00,12h,1 stop,No info,13062,2019-03-21,09:00:00,21:00:00,0,720,0,1,0,1196,0,0,DEL,COK,2047.882109458646,0,0,0,0,1,0,0,0,0,1,3,21,12,1,1,1,1,3,1,0,1,0,Delhi_Cochin,4537,0,10,0,1,170.65684245488717,0.3515827384176576,1,0
SpiceJet,24/03/2019,Banglore,New Delhi,BLR → DEL,05:45,08:35,2h 50m,non-stop,No check-in baggage included,3527,2019-03-24,05:45:00,08:35:00,0,170,1,1,0,818,0,0,BLR,DEL,1708.6520853536679,0,0,0,0,1,0,0,0,0,1,3,24,12,1,1,1,0,1,0,0,0,1,Banglore_New Delhi,932,0,7,0,1,603.0536771836476,0.0994936309487559,1,0
IndiGo,27/05/2019,Banglore,Delhi,BLR → DEL,04:00,06:50,2h 50m,non-stop,No info,3943,2019-05-27,04:00:00,06:50:00,0,170,0,1,1,2053,0,0,BLR,DEL,1708.6520853536679,0,0,0,0,0,0,0,0,0,0,5,27,22,2,1,1,0,1,0,0,0,1,Banglore_Delhi,1265,1,4,0,1,603.0536771836476,0.0994936309487559,1,0
Air India,3/05/2019,Chennai,Kolkata,MAA → CCU,11:40,13:55,2h 15m,non-stop,No info,4667,2019-05-03,11:40:00,13:55:00,0,135,0,1,0,1752,0,0,MAA,CCU,1385.198425287915,0,0,0,0,0,0,0,0,0,0,5,3,18,2,1,1,1,2,1,0,0,1,Chennai_Kolkata,381,1,28,1,0,615.6437445724066,0.09745896150000323,1,0
Air India,15/05/2019,Kolkata,Banglore,CCU → HYD → BLR,19:00,11:05 16 May,16h 5m,1 stop,No info,6117,2019-05-15,19:00:00,11:05:00,0,965,0,0,0,1752,0,0,CCU,BLR,1546.4372901474003,0,0,0,0,0,0,0,0,0,0,5,15,20,2,1,1,3,1,0,1,1,0,Kolkata_Banglore,2871,1,16,0,0,96.15154135631504,0.6240149575725893,1,0
Jet Airways,27/06/2019,Delhi,Cochin,DEL → AMD → BOM → COK,23:05,19:00 28 Jun,19h 55m,2 stops,In-flight meal not included,11150,2019-06-27,23:05:00,19:00:00,0,1195,0,0,1,3849,0,0,DEL,COK,2047.882109458646,0,0,0,0,0,0,0,0,0,0,6,27,26,2,1,0,3,3,0,1,2,0,Delhi_Cochin,4537,0,3,0,1,102.82253269248432,0.5835296839015289,1,0
Jet Airways,9/03/2019,Delhi,Cochin,DEL → COK,11:00,14:15,3h 15m,non-stop,In-flight meal not included,7202,2019-03-09,11:00:00,14:15:00,0,195,1,1,0,3849,0,0,DEL,COK,2047.882109458646,0,0,0,0,0,0,0,0,0,0,3,9,10,1,1,1,1,2,1,0,0,1,Delhi_Cochin,4537,0,22,1,0,630.1175721411219,0.0952203249881156,1,0
Jet Airways,1/05/2019,Kolkata,Banglore,CCU → DEL → BLR,09:35,10:55 02 May,25h 20m,1 stop,No info,12121,2019-05-01,09:35:00,10:55:00,0,1520,0,0,0,3849,0,0,CCU,BLR,1546.4372901474003,0,0,0,0,0,0,0,0,0,0,5,1,18,2,1,1,1,1,1,0,1,0,Kolkata_Banglore,2871,1,30,1,0,61.04357724266053,0.9829043891298817,1,0
IndiGo,24/03/2019,Banglore,New Delhi,BLR → DEL,22:20,01:10 28 Mar,2h 50m,non-stop,No info,4377,2019-03-24,22:20:00,01:10:00,0,170,1,0,1,2053,0,0,BLR,DEL,1708.6520853536679,0,0,0,0,1,0,0,0,0,1,3,24,12,1,1,1,3,0,0,1,0,1,Banglore_New Delhi,932,0,7,0,1,603.0536771836476,0.0994936309487559,1,0
IndiGo,18/06/2019,Banglore,Delhi,BLR → DEL,21:15,00:15 19 Jun,3h,non-stop,No info,3943,2019-06-18,21:15:00,00:15:00,0,180,0,0,1,2053,0,0,BLR,DEL,1708.6520853536679,0,0,0,0,0,0,0,0,0,0,6,18,25,2,1,0,3,0,0,1,0,1,Banglore_Delhi,1265,1,12,0,0,569.5506951178893,0.10534619747515331,1,0
Air Asia,3/04/2019,Banglore,Delhi,BLR → DEL,23:55,02:45 04 Apr,2h 50m,non-stop,No info,4483,2019-04-03,23:55:00,02:45:00,0,170,0,0,1,319,0,0,BLR,DEL,1708.6520853536679,0,0,0,0,0,0,0,0,0,0,4,3,14,2,1,1,3,0,0,1,0,1,Banglore_Delhi,1265,1,27,1,0,603.0536771836476,0.0994936309487559,1,0
Jet Airways,24/03/2019,Kolkata,Banglore,CCU → BOM → BLR,19:45,12:00 25 Mar,16h 15m,1 stop,No info,14231,2019-03-24,19:45:00,12:00:00,0,975,1,0,0,3849,0,0,CCU,BLR,1546.4372901474003,0,0,0,0,1,0,0,0,0,1,3,24,12,1,1,1,3,2,0,1,1,0,Kolkata_Banglore,2871,1,7,0,1,95.16537170137848,0.6304814338168648,1,0
Air India,01/03/2019,Banglore,New Delhi,BLR → BOM → AMD → DEL,08:50,23:55,15h 5m,2 stops,No info,17345,2019-03-01,08:50:00,23:55:00,0,905,0,1,0,1752,0,0,BLR,DEL,1708.6520853536679,0,0,0,0,0,0,0,0,0,0,3,1,9,1,1,1,1,3,1,0,2,0,Banglore_New Delhi,932,0,30,1,0,113.2808012389172,0.5296572706389653,1,0
Vistara,6/03/2019,Chennai,Kolkata,MAA → CCU,07:05,09:20,2h 15m,non-stop,No info,7414,2019-03-06,07:05:00,09:20:00,0,135,0,1,0,479,0,0,MAA,CCU,1385.198425287915,0,0,0,0,0,0,0,0,0,0,3,6,10,1,1,1,1,1,1,0,0,1,Chennai_Kolkata,381,1,25,1,0,615.6437445724066,0.09745896150000323,1,0
Multiple carriers,6/05/2019,Delhi,Cochin,DEL → BOM → COK,19:00,01:30 07 May,6h 30m,1 stop,No info,8073,2019-05-06,19:00:00,01:30:00,0,390,0,0,1,1196,0,0,DEL,COK,2047.882109458646,0,0,0,0,0,0,0,0,0,0,5,6,19,2,1,1,3,0,0,1,1,0,Delhi_Cochin,4537,0,25,1,0,315.0587860705609,0.1904406499762312,1,0
Vistara,6/03/2019,Mumbai,Hyderabad,BOM → DEL → HYD,15:40,16:45 07 Mar,25h 5m,1 stop,No info,12395,2019-03-06,15:40:00,16:45:00,0,1505,0,0,0,479,0,0,BOM,HYD,622.9702752863186,0,0,0,0,0,0,0,0,0,0,3,6,10,1,1,1,2,2,0,0,1,0,Mumbai_Hyderabad,697,1,25,1,0,24.83602426390639,2.4158456024379307,1,0
Air India,6/06/2019,Kolkata,Banglore,CCU → BOM → BLR,09:25,21:50,12h 25m,1 stop,No info,8366,2019-06-06,09:25:00,21:50:00,0,745,0,1,0,1752,0,0,CCU,BLR,1546.4372901474003,0,1,0,0,0,0,0,0,0,1,6,6,23,2,1,0,1,3,1,0,1,0,Kolkata_Banglore,2871,1,24,1,0,124.5452851125423,0.4817524801985275,1,0
Air India,3/04/2019,Delhi,Cochin,DEL → MAA → COK,06:05,09:25 04 Apr,27h 20m,1 stop,No info,5117,2019-04-03,06:05:00,09:25:00,0,1640,0,0,0,1752,0,0,DEL,COK,2047.882109458646,0,0,0,0,0,0,0,0,0,0,4,3,14,2,1,1,1,1,1,0,1,0,Delhi_Cochin,4537,0,27,1,0,74.92251619970656,0.8008273486179979,1,0
Multiple carriers,3/06/2019,Delhi,Cochin,DEL → BOM → COK,08:45,19:00,10h 15m,1 stop,No info,12524,2019-06-03,08:45:00,19:00:00,0,615,0,1,0,1196,0,0,DEL,COK,2047.882109458646,0,1,0,0,0,0,0,0,0,1,6,3,23,2,1,0,1,3,1,0,1,0,Delhi_Cochin,4537,0,27,1,0,199.79337653255084,0.3003102557317492,1,0
IndiGo,15/05/2019,Delhi,Cochin,DEL → BOM → COK,15:00,01:30 16 May,10h 30m,1 stop,No info,7191,2019-05-15,15:00:00,01:30:00,0,630,0,0,1,2053,0,0,DEL,COK,2047.882109458646,0,0,0,0,0,0,0,0,0,0,5,15,20,2,1,1,2,0,0,0,1,0,Delhi_Cochin,4537,0,16,0,0,195.0363913770139,0.3076348961154504,1,0
Vistara,24/05/2019,Chennai,Kolkata,MAA → CCU,07:05,09:20,2h 15m,non-stop,No info,3687,2019-05-24,07:05:00,09:20:00,0,135,0,1,0,479,0,0,MAA,CCU,1385.198425287915,0,0,0,0,0,0,0,0,0,0,5,24,21,2,1,1,1,1,1,0,0,1,Chennai_Kolkata,381,1,7,0,1,615.6437445724066,0.09745896150000323,1,0
IndiGo,24/06/2019,Delhi,Cochin,DEL → BOM → COK,10:35,21:00,10h 25m,1 stop,No info,5894,2019-06-24,10:35:00,21:00:00,0,625,0,1,0,2053,0,0,DEL,COK,2047.882109458646,0,0,0,0,0,0,0,0,0,0,6,24,26,2,1,0,1,3,1,0,1,0,Delhi_Cochin,4537,0,6,0,1,196.59668250803003,0.3051933493208833,1,0
Vistara,24/04/2019,Banglore,Delhi,BLR → DEL,09:45,12:35,2h 50m,non-stop,No info,5403,2019-04-24,09:45:00,12:35:00,0,170,0,1,0,479,0,0,BLR,DEL,1708.6520853536679,0,0,0,0,0,0,0,0,0,0,4,24,17,2,1,1,1,2,1,0,0,1,Banglore_Delhi,1265,1,6,0,1,603.0536771836476,0.0994936309487559,1,0
Air India,6/05/2019,Mumbai,Hyderabad,BOM → HYD,13:55,15:25,1h 30m,non-stop,No info,3625,2019-05-06,13:55:00,15:25:00,0,90,0,1,0,1752,0,0,BOM,HYD,622.9702752863186,0,0,0,0,0,0,0,0,0,0,5,6,19,2,1,1,2,2,0,0,0,1,Mumbai_Hyderabad,697,1,25,1,0,415.3135168575457,0.14446917223881314,0,0
Air India,21/05/2019,Delhi,Cochin,DEL → BHO → BOM → COK,05:55,19:15,13h 20m,2 stops,No info,10861,2019-05-21,05:55:00,19:15:00,0,800,0,1,0,1752,0,0,DEL,COK,2047.882109458646,0,0,0,0,0,0,0,0,0,0,5,21,21,2,1,1,0,3,0,0,2,0,Delhi_Cochin,4537,0,10,0,1,153.59115820939846,0.39064748713073066,1,0
IndiGo,12/03/2019,Chennai,Kolkata,MAA → CCU,13:20,15:35,2h 15m,non-stop,No info,6297,2019-03-12,13:20:00,15:35:00,0,135,0,1,0,2053,0,0,MAA,CCU,1385.198425287915,0,0,0,0,0,0,0,0,0,0,3,12,11,1,1,1,2,2,0,0,0,1,Chennai_Kolkata,381,1,19,0,0,615.6437445724066,0.09745896150000323,1,0
Jet Airways,1/06/2019,Mumbai,Hyderabad,BOM → HYD,07:05,08:30,1h 25m,non-stop,No info,5678,2019-06-01,07:05:00,08:30:00,0,85,1,1,0,3849,0,0,BOM,HYD,622.9702752863186,0,1,0,0,0,0,0,0,0,1,6,1,22,2,1,0,1,1,1,0,0,1,Mumbai_Hyderabad,697,1,29,1,0,439.743723731519,0.13644310711443464,0,0
Jet Airways,09/03/2019,Banglore,New Delhi,BLR → BOM → DEL,05:45,08:15 13 Mar,26h 30m,1 stop,In-flight meal not included,9134,2019-03-09,05:45:00,08:15:00,0,1590,1,0,0,3849,0,0,BLR,DEL,1708.6520853536679,0,0,0,0,0,0,0,0,0,0,3,9,10,1,1,1,0,1,0,0,1,0,Banglore_New Delhi,932,0,22,1,0,64.47743718315728,0.9305580776971876,1,0
Multiple carriers,24/06/2019,Delhi,Cochin,DEL → BOM → COK,11:40,19:00,7h 20m,1 stop,In-flight meal not included,10791,2019-06-24,11:40:00,19:00:00,0,440,0,1,0,1196,0,0,DEL,COK,2047.882109458646,0,0,0,0,0,0,0,0,0,0,6,24,26,2,1,0,1,3,1,0,1,0,Delhi_Cochin,4537,0,6,0,1,279.25665128981535,0.21485611792190187,1,0
Jet Airways,24/06/2019,Delhi,Cochin,DEL → AMD → BOM → COK,23:05,12:35 25 Jun,13h 30m,2 stops,No info,12819,2019-06-24,23:05:00,12:35:00,0,810,0,0,1,3849,0,0,DEL,COK,2047.882109458646,0,0,0,0,0,0,0,0,0,0,6,24,26,2,1,0,3,2,0,1,2,0,Delhi_Cochin,4537,0,6,0,1,151.69497107101083,0.3955305807198648,1,0
IndiGo,21/03/2019,Delhi,Cochin,DEL → BLR → COK,05:05,10:05,5h,1 stop,No info,6893,2019-03-21,05:05:00,10:05:00,0,300,0,1,0,2053,0,0,DEL,COK,2047.882109458646,0,0,0,0,1,0,0,0,0,1,3,21,12,1,1,1,0,1,0,0,1,0,Delhi_Cochin,4537,0,10,0,1,409.5764218917292,0.146492807674024,1,0
Vistara,09/03/2019,Banglore,New Delhi,BLR → DEL,09:50,12:35,2h 45m,non-stop,No info,7240,2019-03-09,09:50:00,12:35:00,0,165,1,1,0,479,0,0,BLR,DEL,1708.6520853536679,0,0,0,0,0,0,0,0,0,0,3,9,10,1,1,1,1,2,1,0,0,1,Banglore_New Delhi,932,0,22,1,0,621.3280310376974,0.09656734768555719,1,0
GoAir,3/04/2019,Banglore,Delhi,BLR → DEL,11:40,14:30,2h 50m,non-stop,No info,3898,2019-04-03,11:40:00,14:30:00,0,170,0,1,0,194,0,0,BLR,DEL,1708.6520853536679,0,0,0,0,0,0,0,0,0,0,4,3,14,2,1,1,1,2,1,0,0,1,Banglore_Delhi,1265,1,27,1,0,603.0536771836476,0.0994936309487559,1,0
IndiGo,3/04/2019,Mumbai,Hyderabad,BOM → HYD,06:25,07:55,1h 30m,non-stop,No info,4049,2019-04-03,06:25:00,07:55:00,0,90,0,1,0,2053,0,0,BOM,HYD,622.9702752863186,0,0,0,0,0,0,0,0,0,0,4,3,14,2,1,1,1,1,1,0,0,1,Mumbai_Hyderabad,697,1,27,1,0,415.3135168575457,0.14446917223881314,0,0
Jet Airways,15/06/2019,Delhi,Cochin,DEL → BOM → COK,17:30,12:35 16 Jun,19h 5m,1 stop,In-flight meal not included,10262,2019-06-15,17:30:00,12:35:00,0,1145,1,0,0,3849,0,0,DEL,COK,2047.882109458646,0,0,0,0,0,0,0,0,0,0,6,15,24,2,1,0,2,2,0,0,1,0,Delhi_Cochin,4537,0,15,0,0,107.31259962228712,0.5591142159558583,1,0
SpiceJet,21/03/2019,Chennai,Kolkata,MAA → CCU,08:20,10:35,2h 15m,non-stop,No check-in baggage included,3332,2019-03-21,08:20:00,10:35:00,0,135,0,1,0,818,0,0,MAA,CCU,1385.198425287915,0,0,0,0,1,0,0,0,0,1,3,21,12,1,1,1,1,1,1,0,0,1,Chennai_Kolkata,381,1,10,0,1,615.6437445724066,0.09745896150000323,1,0
Jet Airways,9/06/2019,Kolkata,Banglore,CCU → BOM → BLR,21:10,12:00 10 Jun,14h 50m,1 stop,In-flight meal not included,10844,2019-06-09,21:10:00,12:00:00,0,890,1,0,1,3849,0,0,CCU,BLR,1546.4372901474003,0,1,0,0,0,0,0,0,0,1,6,9,23,2,1,0,3,2,0,1,1,0,Kolkata_Banglore,2871,1,21,1,0,104.25419933577979,0.5755163857405228,1,0
Jet Airways,24/03/2019,Banglore,New Delhi,BLR → DEL,19:55,22:35,2h 40m,non-stop,No info,7229,2019-03-24,19:55:00,22:35:00,0,160,1,1,0,3849,0,0,BLR,DEL,1708.6520853536679,0,0,0,0,1,0,0,0,0,1,3,24,12,1,1,1,3,3,0,1,0,1,Banglore_New Delhi,932,0,7,0,1,640.7445320076254,0.09364106442235849,1,0
Jet Airways,6/05/2019,Kolkata,Banglore,CCU → BOM → BLR,06:30,04:40 07 May,22h 10m,1 stop,No info,13941,2019-05-06,06:30:00,04:40:00,0,1330,0,0,1,3849,0,0,CCU,BLR,1546.4372901474003,0,0,0,0,0,0,0,0,0,0,5,6,19,2,1,1,1,0,1,0,1,0,Kolkata_Banglore,2871,1,25,1,0,69.76408827732634,0.8600413404886464,1,0
IndiGo,27/06/2019,Delhi,Cochin,DEL → BOM → COK,11:25,21:00,9h 35m,1 stop,No info,5894,2019-06-27,11:25:00,21:00:00,0,575,0,1,0,2053,0,0,DEL,COK,2047.882109458646,0,0,0,0,0,0,0,0,0,0,6,27,26,2,1,0,1,3,1,0,1,0,Delhi_Cochin,4537,0,3,0,1,213.69204620438046,0.28077788137521265,1,0
Multiple carriers,18/05/2019,Delhi,Cochin,DEL → BOM → COK,09:00,19:00,10h,1 stop,No info,10197,2019-05-18,09:00:00,19:00:00,0,600,1,1,0,1196,0,0,DEL,COK,2047.882109458646,0,0,0,0,0,0,0,0,0,0,5,18,20,2,1,1,1,3,1,0,1,0,Delhi_Cochin,4537,0,13,0,0,204.7882109458646,0.292985615348048,1,0
Jet Airways,06/03/2019,Banglore,New Delhi,BLR → BOM → DEL,14:05,11:25 07 Mar,21h 20m,1 stop,In-flight meal not included,13712,2019-03-06,14:05:00,11:25:00,0,1280,0,0,0,3849,0,0,BLR,DEL,1708.6520853536679,0,0,0,0,0,0,0,0,0,0,3,6,10,1,1,1,2,1,0,0,1,0,Banglore_New Delhi,932,0,25,1,0,80.09306650095317,0.7491285153788679,1,0
IndiGo,24/06/2019,Delhi,Cochin,DEL → MAA → COK,02:00,07:25,5h 25m,1 stop,No info,5636,2019-06-24,02:00:00,07:25:00,0,325,0,1,1,2053,0,0,DEL,COK,2047.882109458646,0,0,0,0,0,0,0,0,0,0,6,24,26,2,1,0,0,1,0,0,1,0,Delhi_Cochin,4537,0,6,0,1,378.07054328467314,0.15870054164685934,1,0
Jet Airways,6/06/2019,Delhi,Cochin,DEL → JAI → BOM → COK,09:40,04:25 07 Jun,18h 45m,2 stops,No info,13014,2019-06-06,09:40:00,04:25:00,0,1125,0,0,1,3849,0,0,DEL,COK,2047.882109458646,0,1,0,0,0,0,0,0,0,1,6,6,23,2,1,0,1,0,1,0,2,0,Delhi_Cochin,4537,0,24,1,0,109.22037917112779,0.54934802877759,1,0
Jet Airways,1/04/2019,Kolkata,Banglore,CCU → BOM → BLR,08:25,20:45,12h 20m,1 stop,In-flight meal not included,7064,2019-04-01,08:25:00,20:45:00,0,740,0,1,0,3849,0,0,CCU,BLR,1546.4372901474003,0,0,0,0,0,0,0,0,0,0,4,1,14,2,1,1,1,3,1,0,1,0,Kolkata_Banglore,2871,1,29,1,0,125.38680730924868,0.47851924207638974,1,0
Jet Airways,24/05/2019,Kolkata,Banglore,CCU → DEL → BLR,20:25,14:25 25 May,18h,1 stop,In-flight meal not included,10703,2019-05-24,20:25:00,14:25:00,0,1080,0,0,0,3849,0,0,CCU,BLR,1546.4372901474003,0,0,0,0,0,0,0,0,0,0,5,24,21,2,1,1,3,2,0,1,1,0,Kolkata_Banglore,2871,1,7,0,1,85.91318278596668,0.698379434381758,1,0
Multiple carriers,27/05/2019,Delhi,Cochin,DEL → HYD → COK,13:15,22:30,9h 15m,1 stop,No info,9646,2019-05-27,13:15:00,22:30:00,0,555,0,1,0,1196,0,0,DEL,COK,2047.882109458646,0,0,0,0,0,0,0,0,0,0,5,27,22,2,1,1,2,3,0,0,1,0,Delhi_Cochin,4537,0,4,0,1,221.3926604820158,0.2710116941969444,1,0
Multiple carriers,6/03/2019,Delhi,Cochin,DEL → BOM → COK,02:15,13:20,11h 5m,1 stop,No info,17057,2019-03-06,02:15:00,13:20:00,0,665,0,1,1,1196,0,0,DEL,COK,2047.882109458646,0,0,0,0,0,0,0,0,0,0,3,6,10,1,1,1,0,2,0,0,1,0,Delhi_Cochin,4537,0,25,1,0,184.77131814664477,0.32472572367741986,1,0
Jet Airways,12/03/2019,Banglore,New Delhi,BLR → BOM → DEL,16:55,10:25 13 Mar,17h 30m,1 stop,No info,13817,2019-03-12,16:55:00,10:25:00,0,1050,0,0,0,3849,0,0,BLR,DEL,1708.6520853536679,0,0,0,0,0,0,0,0,0,0,3,12,11,1,1,1,2,1,0,0,1,0,Banglore_New Delhi,932,0,19,0,0,97.63726202020959,0.6145194852717276,1,0
Air India,6/03/2019,Delhi,Cochin,DEL → BHO → BOM → COK,05:55,19:15,13h 20m,2 stops,No info,13748,2019-03-06,05:55:00,19:15:00,0,800,0,1,0,1752,0,0,DEL,COK,2047.882109458646,0,0,0,0,0,0,0,0,0,0,3,6,10,1,1,1,0,3,0,0,2,0,Delhi_Cochin,4537,0,25,1,0,153.59115820939846,0.39064748713073066,1,0
Air India,21/04/2019,Kolkata,Banglore,CCU → BLR,20:45,23:20,2h 35m,non-stop,No info,4880,2019-04-21,20:45:00,23:20:00,0,155,1,1,0,1752,0,0,CCU,BLR,1546.4372901474003,0,0,0,0,0,0,0,0,0,0,4,21,16,2,1,1,3,3,0,1,0,1,Kolkata_Banglore,2871,1,9,0,1,598.6208865086711,0.10023038178627082,1,0
IndiGo,21/06/2019,Chennai,Kolkata,MAA → CCU,05:15,07:40,2h 25m,non-stop,No info,3540,2019-06-21,05:15:00,07:40:00,0,145,0,1,0,2053,0,0,MAA,CCU,1385.198425287915,0,0,0,0,0,0,0,0,0,0,6,21,25,2,1,0,0,1,0,0,0,1,Chennai_Kolkata,381,1,9,0,1,573.1855552915509,0.1046781438333368,1,0
SpiceJet,15/05/2019,Banglore,Delhi,BLR → DEL,05:55,08:35,2h 40m,non-stop,No check-in baggage included,3257,2019-05-15,05:55:00,08:35:00,0,160,0,1,0,818,0,0,BLR,DEL,1708.6520853536679,0,0,0,0,0,0,0,0,0,0,5,15,20,2,1,1,0,1,0,0,0,1,Banglore_Delhi,1265,1,16,0,0,640.7445320076254,0.09364106442235849,1,0
Jet Airways,3/06/2019,Banglore,Delhi,BLR → DEL,19:50,22:50,3h,non-stop,In-flight meal not included,6478,2019-06-03,19:50:00,22:50:00,0,180,0,1,0,3849,0,0,BLR,DEL,1708.6520853536679,0,1,0,0,0,0,0,0,0,1,6,3,23,2,1,0,3,3,0,1,0,1,Banglore_Delhi,1265,1,27,1,0,569.5506951178893,0.10534619747515331,1,0
Jet Airways,18/06/2019,Mumbai,Hyderabad,BOM → HYD,07:05,08:30,1h 25m,non-stop,No info,8040,2019-06-18,07:05:00,08:30:00,0,85,0,1,0,3849,0,0,BOM,HYD,622.9702752863186,0,0,0,0,0,0,0,0,0,0,6,18,25,2,1,0,1,1,1,0,0,1,Mumbai_Hyderabad,697,1,12,0,0,439.743723731519,0.13644310711443464,0,0
Jet Airways,12/06/2019,Delhi,Cochin,DEL → ATQ → BOM → COK,20:00,12:35 13 Jun,16h 35m,2 stops,No info,14300,2019-06-12,20:00:00,12:35:00,0,995,0,0,0,3849,0,0,DEL,COK,2047.882109458646,0,0,0,0,0,0,0,0,0,0,6,12,24,2,1,0,3,2,0,1,2,0,Delhi_Cochin,4537,0,18,0,0,123.49037845981786,0.4858678121188463,1,0
Jet Airways,15/05/2019,Kolkata,Banglore,CCU → BOM → BLR,08:25,20:45,12h 20m,1 stop,No info,14781,2019-05-15,08:25:00,20:45:00,0,740,0,1,0,3849,0,0,CCU,BLR,1546.4372901474003,0,0,0,0,0,0,0,0,0,0,5,15,20,2,1,1,1,3,1,0,1,0,Kolkata_Banglore,2871,1,16,0,0,125.38680730924868,0.47851924207638974,1,0
Jet Airways,9/06/2019,Kolkata,Banglore,CCU → BOM → BLR,20:00,08:15 10 Jun,12h 15m,1 stop,No info,14939,2019-06-09,20:00:00,08:15:00,0,735,1,0,0,3849,0,0,CCU,BLR,1546.4372901474003,0,1,0,0,0,0,0,0,0,1,6,9,23,2,1,0,3,1,0,1,1,0,Kolkata_Banglore,2871,1,21,1,0,126.23977878754287,0.47528600395425197,1,0
Jet Airways,24/06/2019,Delhi,Cochin,DEL → BOM → COK,20:55,04:25 25 Jun,7h 30m,1 stop,In-flight meal not included,10262,2019-06-24,20:55:00,04:25:00,0,450,0,0,1,3849,0,0,DEL,COK,2047.882109458646,0,0,0,0,0,0,0,0,0,0,6,24,26,2,1,0,3,0,0,1,1,0,Delhi_Cochin,4537,0,6,0,1,273.0509479278195,0.219739211511036,1,0
Air India,12/05/2019,Kolkata,Banglore,CCU → MAA → BLR,14:35,14:35 13 May,24h,1 stop,No info,6528,2019-05-12,14:35:00,14:35:00,0,1440,1,0,0,1752,0,0,CCU,BLR,1546.4372901474003,0,0,0,0,0,0,0,0,0,0,5,12,19,2,1,1,2,2,0,0,1,0,Kolkata_Banglore,2871,1,19,0,0,64.43488708947501,0.9311725791756773,1,0
Air India,1/05/2019,Banglore,Delhi,BLR → DEL,06:10,08:55,2h 45m,non-stop,No info,6121,2019-05-01,06:10:00,08:55:00,0,165,0,1,0,1752,0,0,BLR,DEL,1708.6520853536679,0,0,0,0,0,0,0,0,0,0,5,1,18,2,1,1,1,1,1,0,0,1,Banglore_Delhi,1265,1,30,1,0,621.3280310376974,0.09656734768555719,1,0
Jet Airways,18/05/2019,Delhi,Cochin,DEL → JAI → BOM → COK,19:30,04:25 19 May,8h 55m,2 stops,In-flight meal not included,13029,2019-05-18,19:30:00,04:25:00,0,535,1,0,1,3849,0,0,DEL,COK,2047.882109458646,0,0,0,0,0,0,0,0,0,0,5,18,20,2,1,1,3,0,0,1,2,0,Delhi_Cochin,4537,0,13,0,0,229.66902162153042,0.26124550701867616,1,0
Multiple carriers,27/03/2019,Delhi,Cochin,DEL → BOM → COK,11:40,18:50,7h 10m,1 stop,No info,11421,2019-03-27,11:40:00,18:50:00,0,430,0,1,0,1196,0,0,DEL,COK,2047.882109458646,0,0,0,0,0,0,0,0,0,0,3,27,13,1,1,1,1,3,1,0,1,0,Delhi_Cochin,4537,0,4,0,1,285.7509920174855,0.20997302433276774,1,0
Multiple carriers,27/03/2019,Delhi,Cochin,DEL → BOM → COK,04:45,19:15,14h 30m,1 stop,No info,7574,2019-03-27,04:45:00,19:15:00,0,870,0,1,0,1196,0,0,DEL,COK,2047.882109458646,0,0,0,0,0,0,0,0,0,0,3,27,13,1,1,1,0,3,0,0,1,0,Delhi_Cochin,4537,0,4,0,1,141.2332489281825,0.4248291422546696,1,0
Air India,9/05/2019,Delhi,Cochin,DEL → JDH → BOM → COK,12:55,19:15 10 May,30h 20m,2 stops,No info,11596,2019-05-09,12:55:00,19:15:00,0,1820,0,0,0,1752,0,0,DEL,COK,2047.882109458646,0,0,0,0,0,0,0,0,0,0,5,9,19,2,1,1,2,3,0,0,2,0,Delhi_Cochin,4537,0,22,1,0,67.51259701512019,0.8887230332224123,1,0
Jet Airways,24/05/2019,Delhi,Cochin,DEL → AMD → BOM → COK,23:05,19:00 25 May,19h 55m,2 stops,No info,15129,2019-05-24,23:05:00,19:00:00,0,1195,0,0,1,3849,0,0,DEL,COK,2047.882109458646,0,0,0,0,0,0,0,0,0,0,5,24,21,2,1,1,3,3,0,1,2,0,Delhi_Cochin,4537,0,7,0,1,102.82253269248432,0.5835296839015289,1,0
Jet Airways,18/03/2019,Banglore,New Delhi,BLR → BOM → DEL,14:05,05:05 16 Mar,15h,1 stop,No info,13555,2019-03-18,14:05:00,05:05:00,0,900,0,0,1,3849,0,0,BLR,DEL,1708.6520853536679,0,0,0,0,1,0,0,0,0,1,3,18,12,1,1,1,2,0,0,0,1,0,Banglore_New Delhi,932,0,13,0,0,113.91013902357786,0.5267309873757665,1,0
IndiGo,12/04/2019,Banglore,Delhi,BLR → DEL,18:55,21:50,2h 55m,non-stop,No info,5780,2019-04-12,18:55:00,21:50:00,0,175,0,1,0,2053,0,0,BLR,DEL,1708.6520853536679,0,0,0,0,0,0,0,0,0,0,4,12,15,2,1,1,3,3,0,1,0,1,Banglore_Delhi,1265,1,18,0,0,585.8235721212576,0.10241991421195461,1,0
Vistara,12/05/2019,Kolkata,Banglore,CCU → DEL → BLR,20:20,09:05 13 May,12h 45m,1 stop,No info,9397,2019-05-12,20:20:00,09:05:00,0,765,1,0,0,479,0,0,CCU,BLR,1546.4372901474003,0,0,0,0,0,0,0,0,0,0,5,12,19,2,1,1,3,1,0,1,1,0,Kolkata_Banglore,2871,1,19,0,0,121.28919922724707,0.4946854326870786,1,0
Jet Airways,6/03/2019,Delhi,Cochin,DEL → BOM → COK,18:15,04:25 07 Mar,10h 10m,1 stop,No info,17024,2019-03-06,18:15:00,04:25:00,0,610,0,0,1,3849,0,0,DEL,COK,2047.882109458646,0,0,0,0,0,0,0,0,0,0,3,6,10,1,1,1,3,0,0,1,1,0,Delhi_Cochin,4537,0,25,1,0,201.4310271598668,0.29786870893718215,1,0
GoAir,27/06/2019,Delhi,Cochin,DEL → BOM → COK,07:00,12:55,5h 55m,1 stop,No info,5281,2019-06-27,07:00:00,12:55:00,0,355,0,1,0,194,0,0,DEL,COK,2047.882109458646,0,0,0,0,0,0,0,0,0,0,6,27,26,2,1,0,1,2,1,0,1,0,Delhi_Cochin,4537,0,3,0,1,346.12091990850354,0.17334982241426172,1,0
Multiple carriers,18/05/2019,Delhi,Cochin,DEL → HYD → COK,07:05,22:30,15h 25m,1 stop,No info,10348,2019-05-18,07:05:00,22:30:00,0,925,1,1,0,1196,0,0,DEL,COK,2047.882109458646,0,0,0,0,0,0,0,0,0,0,5,18,20,2,1,1,1,3,1,0,1,0,Delhi_Cochin,4537,0,13,0,0,132.83559628920946,0.45168615699490733,1,0
Air India,6/03/2019,Delhi,Cochin,DEL → MAA → COK,17:20,09:25 07 Mar,16h 5m,1 stop,No info,12677,2019-03-06,17:20:00,09:25:00,0,965,0,0,0,1752,0,0,DEL,COK,2047.882109458646,0,0,0,0,0,0,0,0,0,0,3,6,10,1,1,1,2,1,0,0,1,0,Delhi_Cochin,4537,0,25,1,0,127.329457582921,0.47121853135144387,1,0
Multiple carriers,3/03/2019,Delhi,Cochin,DEL → BOM → COK,15:25,01:35 04 Mar,10h 10m,1 stop,No info,15147,2019-03-03,15:25:00,01:35:00,0,610,1,0,1,1196,0,0,DEL,COK,2047.882109458646,0,0,0,0,0,0,0,0,0,0,3,3,9,1,1,1,2,0,0,0,1,0,Delhi_Cochin,4537,0,28,1,0,201.4310271598668,0.29786870893718215,1,0
Vistara,12/06/2019,Banglore,Delhi,BLR → DEL,07:00,09:40,2h 40m,non-stop,No info,4668,2019-06-12,07:00:00,09:40:00,0,160,0,1,0,479,0,0,BLR,DEL,1708.6520853536679,0,0,0,0,0,0,0,0,0,0,6,12,24,2,1,0,1,1,1,0,0,1,Banglore_Delhi,1265,1,18,0,0,640.7445320076254,0.09364106442235849,1,0
Jet Airways,9/05/2019,Delhi,Cochin,DEL → BOM → COK,07:05,19:00,11h 55m,1 stop,No info,15554,2019-05-09,07:05:00,19:00:00,0,715,0,1,0,3849,0,0,DEL,COK,2047.882109458646,0,0,0,0,0,0,0,0,0,0,5,9,19,2,1,1,1,3,1,0,1,0,Delhi_Cochin,4537,0,22,1,0,171.85024694757868,0.34914119162309054,1,0
SpiceJet,9/04/2019,Banglore,Delhi,BLR → DEL,05:55,08:35,2h 40m,non-stop,No info,3971,2019-04-09,05:55:00,08:35:00,0,160,0,1,0,818,0,0,BLR,DEL,1708.6520853536679,0,0,0,0,0,0,0,0,0,0,4,9,15,2,1,1,0,1,0,0,0,1,Banglore_Delhi,1265,1,21,1,0,640.7445320076254,0.09364106442235849,1,0
Air India,3/05/2019,Mumbai,Hyderabad,BOM → HYD,15:00,16:25,1h 25m,non-stop,No info,3100,2019-05-03,15:00:00,16:25:00,0,85,0,1,0,1752,0,0,BOM,HYD,622.9702752863186,0,0,0,0,0,0,0,0,0,0,5,3,18,2,1,1,2,2,0,0,0,1,Mumbai_Hyderabad,697,1,28,1,0,439.743723731519,0.13644310711443464,0,0
Jet Airways,6/05/2019,Kolkata,Banglore,CCU → BOM → BLR,20:00,10:05 07 May,14h 5m,1 stop,In-flight meal not included,9663,2019-05-06,20:00:00,10:05:00,0,845,0,0,0,3849,0,0,CCU,BLR,1546.4372901474003,0,0,0,0,0,0,0,0,0,0,5,6,19,2,1,1,3,1,0,1,1,0,Kolkata_Banglore,2871,1,25,1,0,109.80619811697517,0.5464172426412829,1,0
Air India,1/03/2019,Delhi,Cochin,DEL → BOM → COK,23:00,19:15 02 Mar,20h 15m,1 stop,No info,27430,2019-03-01,23:00:00,19:15:00,0,1215,0,0,1,1752,0,0,DEL,COK,2047.882109458646,0,0,0,0,0,0,0,0,0,0,3,1,9,1,1,1,3,3,0,1,1,0,Delhi_Cochin,4537,0,30,1,0,101.12998071400722,0.5932958710797972,1,0
IndiGo,12/05/2019,Chennai,Kolkata,MAA → CCU,05:15,07:40,2h 25m,non-stop,No info,3540,2019-05-12,05:15:00,07:40:00,0,145,1,1,0,2053,0,0,MAA,CCU,1385.198425287915,0,0,0,0,0,0,0,0,0,0,5,12,19,2,1,1,0,1,0,0,0,1,Chennai_Kolkata,381,1,19,0,0,573.1855552915509,0.1046781438333368,1,0
Air India,21/05/2019,Kolkata,Banglore,CCU → BBI → BOM → BLR,12:00,11:10 22 May,23h 10m,2 stops,No info,10676,2019-05-21,12:00:00,11:10:00,0,1390,0,0,0,1752,0,0,CCU,BLR,1546.4372901474003,0,0,0,0,0,0,0,0,0,0,5,21,21,2,1,1,2,1,0,0,2,0,Kolkata_Banglore,2871,1,10,0,1,66.75268878334101,0.8988401979542997,1,0
Jet Airways,12/06/2019,Kolkata,Banglore,CCU → BOM → BLR,14:05,08:15 13 Jun,18h 10m,1 stop,No info,13044,2019-06-12,14:05:00,08:15:00,0,1090,0,0,0,3849,0,0,CCU,BLR,1546.4372901474003,0,0,0,0,0,0,0,0,0,0,6,12,24,2,1,0,2,1,0,0,1,0,Kolkata_Banglore,2871,1,18,0,0,85.12498844848075,0.7048459106260335,1,0
Jet Airways,6/05/2019,Kolkata,Banglore,CCU → BOM → BLR,20:00,12:00 07 May,16h,1 stop,No info,14388,2019-05-06,20:00:00,12:00:00,0,960,0,0,0,3849,0,0,CCU,BLR,1546.4372901474003,0,0,0,0,0,0,0,0,0,0,5,6,19,2,1,1,3,2,0,1,1,0,Kolkata_Banglore,2871,1,25,1,0,96.65233063421252,0.6207817194504516,1,0
IndiGo,24/06/2019,Banglore,Delhi,BLR → DEL,04:00,06:50,2h 50m,non-stop,No info,3943,2019-06-24,04:00:00,06:50:00,0,170,0,1,1,2053,0,0,BLR,DEL,1708.6520853536679,0,0,0,0,0,0,0,0,0,0,6,24,26,2,1,0,0,1,0,0,0,1,Banglore_Delhi,1265,1,6,0,1,603.0536771836476,0.0994936309487559,1,0
IndiGo,3/06/2019,Chennai,Kolkata,MAA → CCU,14:45,17:05,2h 20m,non-stop,No info,3597,2019-06-03,14:45:00,17:05:00,0,140,0,1,0,2053,0,0,MAA,CCU,1385.198425287915,0,1,0,0,0,0,0,0,0,1,6,3,23,2,1,0,2,2,0,0,0,1,Chennai_Kolkata,381,1,27,1,0,593.656467980535,0.10106855266667002,1,0
Air India,21/03/2019,Banglore,New Delhi,BLR → MAA → DEL,11:50,19:50,8h,1 stop,No info,5932,2019-03-21,11:50:00,19:50:00,0,480,0,1,0,1752,0,0,BLR,DEL,1708.6520853536679,0,0,0,0,1,0,0,0,0,1,3,21,12,1,1,1,1,3,1,0,1,0,Banglore_New Delhi,932,0,10,0,1,213.58151066920848,0.2809231932670755,1,0
Jet Airways,15/06/2019,Delhi,Cochin,DEL → BOM → COK,11:30,04:25 16 Jun,16h 55m,1 stop,In-flight meal not included,10262,2019-06-15,11:30:00,04:25:00,0,1015,1,0,1,3849,0,0,DEL,COK,2047.882109458646,0,0,0,0,0,0,0,0,0,0,6,15,24,2,1,0,1,0,1,0,1,0,Delhi_Cochin,4537,0,15,0,0,121.05707050987071,0.49563399929711455,1,0
Vistara,12/05/2019,Delhi,Cochin,DEL → COK,14:40,17:50,3h 10m,non-stop,No info,6216,2019-05-12,14:40:00,17:50:00,0,190,1,1,0,479,0,0,DEL,COK,2047.882109458646,0,0,0,0,0,0,0,0,0,0,5,12,19,2,1,1,2,2,0,0,0,1,Delhi_Cochin,4537,0,19,0,0,646.6996135132566,0.09277877819354853,1,0
IndiGo,15/06/2019,Kolkata,Banglore,CCU → BLR,20:25,23:10,2h 45m,non-stop,No info,4804,2019-06-15,20:25:00,23:10:00,0,165,1,1,0,2053,0,0,CCU,BLR,1546.4372901474003,0,0,0,0,0,0,0,0,0,0,6,15,24,2,1,0,3,3,0,1,0,1,Kolkata_Banglore,2871,1,15,0,0,562.3408327808729,0.10669685803054636,1,0
Multiple carriers,21/05/2019,Delhi,Cochin,DEL → BOM → COK,11:30,01:30 22 May,14h,1 stop,No info,14067,2019-05-21,11:30:00,01:30:00,0,840,0,0,1,1196,0,0,DEL,COK,2047.882109458646,0,0,0,0,0,0,0,0,0,0,5,21,21,2,1,1,1,0,1,0,1,0,Delhi_Cochin,4537,0,10,0,1,146.27729353276044,0.4101798614872672,1,0
Jet Airways,18/05/2019,Delhi,Cochin,DEL → AMD → BOM → COK,19:10,19:00 19 May,23h 50m,2 stops,No info,15129,2019-05-18,19:10:00,19:00:00,0,1430,1,0,0,3849,0,0,DEL,COK,2047.882109458646,0,0,0,0,0,0,0,0,0,0,5,18,20,2,1,1,3,3,0,1,2,0,Delhi_Cochin,4537,0,13,0,0,85.92512347378934,0.6982823832461811,1,0
Jet Airways,6/06/2019,Delhi,Cochin,DEL → NAG → BOM → COK,06:45,04:25 07 Jun,21h 40m,2 stops,No info,13376,2019-06-06,06:45:00,04:25:00,0,1300,0,0,1,3849,0,0,DEL,COK,2047.882109458646,0,1,0,0,0,0,0,0,0,1,6,6,23,2,1,0,1,0,1,0,2,0,Delhi_Cochin,4537,0,24,1,0,94.51763582116828,0.6348021665874374,1,0
Air India,27/06/2019,Delhi,Cochin,DEL → GOI → BOM → COK,22:00,19:15 28 Jun,21h 15m,2 stops,No info,10441,2019-06-27,22:00:00,19:15:00,0,1275,0,0,1,1752,0,0,DEL,COK,2047.882109458646,0,0,0,0,0,0,0,0,0,0,6,27,26,2,1,0,3,3,0,1,2,0,Delhi_Cochin,4537,0,3,0,1,96.37092279805394,0.622594432614602,1,0
Jet Airways,24/05/2019,Banglore,Delhi,BLR → DEL,06:00,08:45,2h 45m,non-stop,In-flight meal not included,4030,2019-05-24,06:00:00,08:45:00,0,165,0,1,0,3849,0,0,BLR,DEL,1708.6520853536679,0,0,0,0,0,0,0,0,0,0,5,24,21,2,1,1,1,1,1,0,0,1,Banglore_Delhi,1265,1,7,0,1,621.3280310376974,0.09656734768555719,1,0
Jet Airways,3/03/2019,Delhi,Cochin,DEL → BOM → COK,08:00,18:50,10h 50m,1 stop,No info,17024,2019-03-03,08:00:00,18:50:00,0,650,1,1,0,3849,0,0,DEL,COK,2047.882109458646,0,0,0,0,0,0,0,0,0,0,3,3,9,1,1,1,1,3,1,0,1,0,Delhi_Cochin,4537,0,28,1,0,189.03527164233657,0.3174010832937187,1,0
Multiple carriers,9/04/2019,Delhi,Cochin,DEL → BOM → COK,17:30,01:30 10 Apr,8h,1 stop,No info,13017,2019-04-09,17:30:00,01:30:00,0,480,0,0,1,1196,0,0,DEL,COK,2047.882109458646,0,0,0,0,0,0,0,0,0,0,4,9,15,2,1,1,2,0,0,0,1,0,Delhi_Cochin,4537,0,21,1,0,255.98526368233078,0.23438849227843842,1,0
GoAir,6/06/2019,Kolkata,Banglore,CCU → BOM → BLR,23:30,07:45 07 Jun,8h 15m,1 stop,No info,6686,2019-06-06,23:30:00,07:45:00,0,495,0,0,1,194,0,0,CCU,BLR,1546.4372901474003,0,1,0,0,0,0,0,0,0,1,6,6,23,2,1,0,3,1,0,1,1,0,Kolkata_Banglore,2871,1,24,1,0,187.44694426029093,0.3200905740916391,1,0
IndiGo,15/06/2019,Delhi,Cochin,DEL → MAA → COK,02:00,07:25,5h 25m,1 stop,No info,5636,2019-06-15,02:00:00,07:25:00,0,325,1,1,1,2053,0,0,DEL,COK,2047.882109458646,0,0,0,0,0,0,0,0,0,0,6,15,24,2,1,0,0,1,0,0,1,0,Delhi_Cochin,4537,0,15,0,0,378.07054328467314,0.15870054164685934,1,0
IndiGo,9/06/2019,Delhi,Cochin,DEL → HYD → COK,07:35,16:10,8h 35m,1 stop,No info,6442,2019-06-09,07:35:00,16:10:00,0,515,1,1,0,2053,0,0,DEL,COK,2047.882109458646,0,1,0,0,0,0,0,0,0,1,6,9,23,2,1,0,1,2,1,0,1,0,Delhi_Cochin,4537,0,21,1,0,238.5882069272209,0.2514793198404079,1,0
Multiple carriers,21/05/2019,Delhi,Cochin,DEL → HYD → COK,13:05,00:55 22 May,11h 50m,1 stop,No info,9486,2019-05-21,13:05:00,00:55:00,0,710,0,0,1,1196,0,0,DEL,COK,2047.882109458646,0,0,0,0,0,0,0,0,0,0,5,21,21,2,1,1,2,0,0,0,1,0,Delhi_Cochin,4537,0,10,0,1,173.06045995425177,0.34669964482852345,1,0
Jet Airways,21/05/2019,Kolkata,Banglore,CCU → BOM → BLR,20:00,23:35 22 May,27h 35m,1 stop,In-flight meal not included,10844,2019-05-21,20:00:00,23:35:00,0,1655,0,0,0,3849,0,0,CCU,BLR,1546.4372901474003,0,0,0,0,0,0,0,0,0,0,5,21,21,2,1,1,3,3,0,1,1,0,Kolkata_Banglore,2871,1,10,0,1,56.06419178782116,1.0702018184276014,1,0
Jet Airways,3/06/2019,Delhi,Cochin,DEL → ATQ → BOM → COK,20:00,04:25 04 Jun,8h 25m,2 stops,In-flight meal not included,15318,2019-06-03,20:00:00,04:25:00,0,505,0,0,1,3849,0,0,DEL,COK,2047.882109458646,0,1,0,0,0,0,0,0,0,1,6,3,23,2,1,0,3,0,0,1,2,0,Delhi_Cochin,4537,0,27,1,0,243.31272587627478,0.24659622625127373,1,0
Air India,3/04/2019,Delhi,Cochin,DEL → MAA → COK,12:30,09:25 04 Apr,20h 55m,1 stop,No info,5117,2019-04-03,12:30:00,09:25:00,0,1255,0,0,0,1752,0,0,DEL,COK,2047.882109458646,0,0,0,0,0,0,0,0,0,0,4,3,14,2,1,1,2,1,0,0,1,0,Delhi_Cochin,4537,0,27,1,0,97.9067143964293,0.6128282454363337,1,0
IndiGo,24/06/2019,Delhi,Cochin,DEL → BLR → COK,15:10,20:00,4h 50m,1 stop,No info,6147,2019-06-24,15:10:00,20:00:00,0,290,0,1,0,2053,0,0,DEL,COK,2047.882109458646,0,0,0,0,0,0,0,0,0,0,6,24,26,2,1,0,2,3,0,0,1,0,Delhi_Cochin,4537,0,6,0,1,423.6997467845474,0.14160971408488987,1,0
Multiple carriers,9/06/2019,Delhi,Cochin,DEL → BOM → COK,12:50,21:00,8h 10m,1 stop,No info,7005,2019-06-09,12:50:00,21:00:00,0,490,1,1,0,1196,0,0,DEL,COK,2047.882109458646,0,1,0,0,0,0,0,0,0,1,6,9,23,2,1,0,2,3,0,0,1,0,Delhi_Cochin,4537,0,21,1,0,250.7610746275893,0.23927158586757252,1,0
SpiceJet,3/04/2019,Kolkata,Banglore,CCU → BLR,22:20,00:40 04 Apr,2h 20m,non-stop,No info,3873,2019-04-03,22:20:00,00:40:00,0,140,0,0,1,818,0,0,CCU,BLR,1546.4372901474003,0,0,0,0,0,0,0,0,0,0,4,3,14,2,1,1,3,0,0,1,0,1,Kolkata_Banglore,2871,1,27,1,0,662.7588386346001,0.09053066741985752,1,0
Jet Airways,21/03/2019,Delhi,Cochin,DEL → BDQ → BOM → COK,18:25,18:50 22 Mar,24h 25m,2 stops,In-flight meal not included,9270,2019-03-21,18:25:00,18:50:00,0,1465,0,0,0,3849,0,0,DEL,COK,2047.882109458646,0,0,0,0,1,0,0,0,0,1,3,21,12,1,1,1,3,3,0,1,2,0,Delhi_Cochin,4537,0,10,0,1,83.87230482424489,0.7153732108081505,1,0
GoAir,27/06/2019,Banglore,Delhi,BLR → DEL,11:40,14:30,2h 50m,non-stop,No info,3898,2019-06-27,11:40:00,14:30:00,0,170,0,1,0,194,0,0,BLR,DEL,1708.6520853536679,0,0,0,0,0,0,0,0,0,0,6,27,26,2,1,0,1,2,1,0,0,1,Banglore_Delhi,1265,1,3,0,1,603.0536771836476,0.0994936309487559,1,0
Jet Airways,12/05/2019,Kolkata,Banglore,CCU → BOM → BLR,08:25,20:45,12h 20m,1 stop,No info,14781,2019-05-12,08:25:00,20:45:00,0,740,1,1,0,3849,0,0,CCU,BLR,1546.4372901474003,0,0,0,0,0,0,0,0,0,0,5,12,19,2,1,1,1,3,1,0,1,0,Kolkata_Banglore,2871,1,19,0,0,125.38680730924868,0.47851924207638974,1,0
Jet Airways,24/05/2019,Kolkata,Banglore,CCU → BOM → BLR,20:00,08:15 25 May,12h 15m,1 stop,In-flight meal not included,8586,2019-05-24,20:00:00,08:15:00,0,735,0,0,0,3849,0,0,CCU,BLR,1546.4372901474003,0,0,0,0,0,0,0,0,0,0,5,24,21,2,1,1,3,1,0,1,1,0,Kolkata_Banglore,2871,1,7,0,1,126.23977878754287,0.47528600395425197,1,0
Air India,9/05/2019,Kolkata,Banglore,CCU → JAI → BOM → BLR,08:20,07:55 10 May,23h 35m,2 stops,No info,10697,2019-05-09,08:20:00,07:55:00,0,1415,0,0,0,1752,0,0,CCU,BLR,1546.4372901474003,0,0,0,0,0,0,0,0,0,0,5,9,19,2,1,1,1,1,1,0,2,0,Kolkata_Banglore,2871,1,22,1,0,65.57331265642686,0.9150063885649885,1,0
Jet Airways,27/06/2019,Delhi,Cochin,DEL → ATQ → BOM → COK,20:00,12:35 28 Jun,16h 35m,2 stops,No info,14300,2019-06-27,20:00:00,12:35:00,0,995,0,0,0,3849,0,0,DEL,COK,2047.882109458646,0,0,0,0,0,0,0,0,0,0,6,27,26,2,1,0,3,2,0,1,2,0,Delhi_Cochin,4537,0,3,0,1,123.49037845981786,0.4858678121188463,1,0
IndiGo,03/03/2019,Banglore,New Delhi,BLR → DEL,18:55,21:45,2h 50m,non-stop,No info,8855,2019-03-03,18:55:00,21:45:00,0,170,1,1,0,2053,0,0,BLR,DEL,1708.6520853536679,0,0,0,0,0,0,0,0,0,0,3,3,9,1,1,1,3,3,0,1,0,1,Banglore_New Delhi,932,0,28,1,0,603.0536771836476,0.0994936309487559,1,0
Jet Airways,12/05/2019,Kolkata,Banglore,CCU → BOM → BLR,16:30,18:15 13 May,25h 45m,1 stop,In-flight meal not included,10844,2019-05-12,16:30:00,18:15:00,0,1545,1,0,0,3849,0,0,CCU,BLR,1546.4372901474003,0,0,0,0,0,0,0,0,0,0,5,12,19,2,1,1,2,3,0,0,1,0,Kolkata_Banglore,2871,1,19,0,0,60.055817093102924,0.9990705797405705,1,0
Jet Airways,6/03/2019,Delhi,Cochin,DEL → BOM → COK,02:15,04:25 07 Mar,26h 10m,1 stop,No info,17024,2019-03-06,02:15:00,04:25:00,0,1570,0,0,1,3849,0,0,DEL,COK,2047.882109458646,0,0,0,0,0,0,0,0,0,0,3,6,10,1,1,1,0,0,0,0,1,0,Delhi_Cochin,4537,0,25,1,0,78.26301055255972,0.766645693494059,1,0
Jet Airways,1/05/2019,Kolkata,Banglore,CCU → DEL → BLR,09:35,14:25 02 May,28h 50m,1 stop,In-flight meal not included,9314,2019-05-01,09:35:00,14:25:00,0,1730,0,0,0,3849,0,0,CCU,BLR,1546.4372901474003,0,0,0,0,0,0,0,0,0,0,5,1,18,2,1,1,1,2,1,0,1,0,Kolkata_Banglore,2871,1,30,1,0,53.63366324210637,1.118700390259668,1,0
IndiGo,24/03/2019,Banglore,New Delhi,BLR → DEL,00:40,03:25,2h 45m,non-stop,No info,4777,2019-03-24,00:40:00,03:25:00,0,165,1,1,1,2053,0,0,BLR,DEL,1708.6520853536679,0,0,0,0,1,0,0,0,0,1,3,24,12,1,1,1,0,0,0,0,0,1,Banglore_New Delhi,932,0,7,0,1,621.3280310376974,0.09656734768555719,1,0
Air India,9/06/2019,Kolkata,Banglore,CCU → BBI → BLR,12:00,13:15 10 Jun,25h 15m,1 stop,No info,7662,2019-06-09,12:00:00,13:15:00,0,1515,1,0,0,1752,0,0,CCU,BLR,1546.4372901474003,0,1,0,0,0,0,0,0,0,1,6,9,23,2,1,0,2,2,0,0,1,0,Kolkata_Banglore,2871,1,21,1,0,61.245041193956446,0.9796711510077438,1,0
IndiGo,9/05/2019,Delhi,Cochin,DEL → HYD → COK,06:50,16:10,9h 20m,1 stop,No info,6442,2019-05-09,06:50:00,16:10:00,0,560,0,1,0,2053,0,0,DEL,COK,2047.882109458646,0,0,0,0,0,0,0,0,0,0,5,9,19,2,1,1,1,2,1,0,1,0,Delhi_Cochin,4537,0,22,1,0,219.41594029914066,0.27345324099151147,1,0
SpiceJet,12/06/2019,Delhi,Cochin,DEL → PNQ → COK,08:45,13:15,4h 30m,1 stop,No info,5264,2019-06-12,08:45:00,13:15:00,0,270,0,1,0,818,0,0,DEL,COK,2047.882109458646,0,0,0,0,0,0,0,0,0,0,6,12,24,2,1,0,1,2,1,0,1,0,Delhi_Cochin,4537,0,18,0,0,455.08491321303245,0.1318435269066216,1,0
Jet Airways,27/05/2019,Delhi,Cochin,DEL → BOM → COK,13:00,04:25 28 May,15h 25m,1 stop,In-flight meal not included,12898,2019-05-27,13:00:00,04:25:00,0,925,0,0,1,3849,0,0,DEL,COK,2047.882109458646,0,0,0,0,0,0,0,0,0,0,5,27,22,2,1,1,2,0,0,0,1,0,Delhi_Cochin,4537,0,4,0,1,132.83559628920946,0.45168615699490733,1,0
Air India,3/03/2019,Mumbai,Hyderabad,BOM → HYD,13:55,15:25,1h 30m,non-stop,No info,6092,2019-03-03,13:55:00,15:25:00,0,90,1,1,0,1752,0,0,BOM,HYD,622.9702752863186,0,0,0,0,0,0,0,0,0,0,3,3,9,1,1,1,2,2,0,0,0,1,Mumbai_Hyderabad,697,1,28,1,0,415.3135168575457,0.14446917223881314,0,0
SpiceJet,21/05/2019,Banglore,Delhi,BLR → DEL,05:55,08:35,2h 40m,non-stop,No info,3311,2019-05-21,05:55:00,08:35:00,0,160,0,1,0,818,0,0,BLR,DEL,1708.6520853536679,0,0,0,0,0,0,0,0,0,0,5,21,21,2,1,1,0,1,0,0,0,1,Banglore_Delhi,1265,1,10,0,1,640.7445320076254,0.09364106442235849,1,0
Jet Airways,27/03/2019,Delhi,Cochin,DEL → BOM → COK,19:15,04:25 28 Mar,9h 10m,1 stop,In-flight meal not included,6540,2019-03-27,19:15:00,04:25:00,0,550,0,0,1,3849,0,0,DEL,COK,2047.882109458646,0,0,0,0,0,0,0,0,0,0,3,27,13,1,1,1,3,0,0,1,1,0,Delhi_Cochin,4537,0,4,0,1,223.4053210318523,0.26857014740237733,1,0
IndiGo,27/05/2019,Banglore,Delhi,BLR → DEL,01:30,04:15,2h 45m,non-stop,No info,3419,2019-05-27,01:30:00,04:15:00,0,165,0,1,1,2053,0,0,BLR,DEL,1708.6520853536679,0,0,0,0,0,0,0,0,0,0,5,27,22,2,1,1,0,0,0,0,0,1,Banglore_Delhi,1265,1,4,0,1,621.3280310376974,0.09656734768555719,1,0
Jet Airways,3/04/2019,Delhi,Cochin,DEL → BOM → COK,14:00,12:35 04 Apr,22h 35m,1 stop,In-flight meal not included,5177,2019-04-03,14:00:00,12:35:00,0,1355,0,0,0,3849,0,0,DEL,COK,2047.882109458646,0,0,0,0,0,0,0,0,0,0,4,3,14,2,1,1,2,2,0,0,1,0,Delhi_Cochin,4537,0,27,1,0,90.68112661809502,0.6616591813276751,1,0
Air India,18/04/2019,Delhi,Cochin,DEL → COK,18:05,21:10,3h 5m,non-stop,No info,8246,2019-04-18,18:05:00,21:10:00,0,185,0,1,0,1752,0,0,DEL,COK,2047.882109458646,0,0,0,0,0,0,0,0,0,0,4,18,16,2,1,1,3,3,0,1,0,1,Delhi_Cochin,4537,0,12,0,0,664.1779814460473,0.09033723139898146,1,0
Jet Airways,9/06/2019,Kolkata,Banglore,CCU → DEL → BLR,09:35,21:05,11h 30m,1 stop,No info,14676,2019-06-09,09:35:00,21:05:00,0,690,1,1,0,3849,0,0,CCU,BLR,1546.4372901474003,0,1,0,0,0,0,0,0,0,1,6,9,23,2,1,0,1,3,1,0,1,0,Kolkata_Banglore,2871,1,21,1,0,134.47280783890437,0.4461868608550121,1,0
Multiple carriers,27/06/2019,Delhi,Cochin,DEL → BOM → COK,11:30,21:00,9h 30m,1 stop,No info,13587,2019-06-27,11:30:00,21:00:00,0,570,0,1,0,1196,0,0,DEL,COK,2047.882109458646,0,0,0,0,0,0,0,0,0,0,6,27,26,2,1,0,1,3,1,0,1,0,Delhi_Cochin,4537,0,3,0,1,215.5665378377522,0.2783363345806456,1,0
Jet Airways,6/05/2019,Kolkata,Banglore,CCU → BOM → BLR,21:10,09:20 07 May,12h 10m,1 stop,In-flight meal not included,9663,2019-05-06,21:10:00,09:20:00,0,730,0,0,1,3849,0,0,CCU,BLR,1546.4372901474003,0,0,0,0,0,0,0,0,0,0,5,6,19,2,1,1,3,1,0,1,1,0,Kolkata_Banglore,2871,1,25,1,0,127.10443480663565,0.4720527658321142,1,0
Jet Airways,12/06/2019,Kolkata,Banglore,CCU → BOM → BLR,16:30,10:05 13 Jun,17h 35m,1 stop,No info,13044,2019-06-12,16:30:00,10:05:00,0,1055,0,0,0,3849,0,0,CCU,BLR,1546.4372901474003,0,0,0,0,0,0,0,0,0,0,6,12,24,2,1,0,2,1,0,0,1,0,Kolkata_Banglore,2871,1,18,0,0,87.9490401979564,0.6822132437710692,1,0
IndiGo,3/04/2019,Delhi,Cochin,DEL → BOM → COK,20:25,01:30 04 Apr,5h 5m,1 stop,No info,5073,2019-04-03,20:25:00,01:30:00,0,305,0,0,1,2053,0,0,DEL,COK,2047.882109458646,0,0,0,0,0,0,0,0,0,0,4,3,14,2,1,1,3,0,0,1,1,0,Delhi_Cochin,4537,0,27,1,0,402.8620543197336,0.14893435446859107,1,0
Vistara,21/05/2019,Kolkata,Banglore,CCU → DEL → BLR,17:00,18:50 22 May,25h 50m,1 stop,No info,9345,2019-05-21,17:00:00,18:50:00,0,1550,0,0,0,479,0,0,CCU,BLR,1546.4372901474003,0,0,0,0,0,0,0,0,0,0,5,21,21,2,1,1,2,3,0,0,1,0,Kolkata_Banglore,2871,1,10,0,1,59.86208865086711,1.0023038178627082,1,0
Jet Airways,6/05/2019,Kolkata,Banglore,CCU → BOM → BLR,14:05,10:05 07 May,20h,1 stop,In-flight meal not included,9663,2019-05-06,14:05:00,10:05:00,0,1200,0,0,0,3849,0,0,CCU,BLR,1546.4372901474003,0,0,0,0,0,0,0,0,0,0,5,6,19,2,1,1,2,1,0,0,1,0,Kolkata_Banglore,2871,1,25,1,0,77.32186450737001,0.7759771493130645,1,0
Multiple carriers,21/05/2019,Delhi,Cochin,DEL → BOM → COK,08:00,21:00,13h,1 stop,No info,14277,2019-05-21,08:00:00,21:00:00,0,780,0,1,0,1196,0,0,DEL,COK,2047.882109458646,0,0,0,0,0,0,0,0,0,0,5,21,21,2,1,1,1,3,1,0,1,0,Delhi_Cochin,4537,0,10,0,1,157.52939303528046,0.3808812999524624,1,0
Jet Airways,1/06/2019,Delhi,Cochin,DEL → BOM → COK,10:00,04:25 02 Jun,18h 25m,1 stop,In-flight meal not included,10262,2019-06-01,10:00:00,04:25:00,0,1105,1,0,1,3849,0,0,DEL,COK,2047.882109458646,0,1,0,0,0,0,0,0,0,1,6,1,22,2,1,0,1,0,1,0,1,0,Delhi_Cochin,4537,0,29,1,0,111.19721861313916,0.5395818415993218,1,0
Jet Airways,27/03/2019,Mumbai,Hyderabad,BOM → HYD,19:35,21:05,1h 30m,non-stop,No info,5678,2019-03-27,19:35:00,21:05:00,0,90,0,1,0,3849,0,0,BOM,HYD,622.9702752863186,0,0,0,0,0,0,0,0,0,0,3,27,13,1,1,1,3,3,0,1,0,1,Mumbai_Hyderabad,697,1,4,0,1,415.3135168575457,0.14446917223881314,0,0
Multiple carriers,15/05/2019,Delhi,Cochin,DEL → BOM → COK,16:00,01:30 16 May,9h 30m,1 stop,No info,13727,2019-05-15,16:00:00,01:30:00,0,570,0,0,1,1196,0,0,DEL,COK,2047.882109458646,0,0,0,0,0,0,0,0,0,0,5,15,20,2,1,1,2,0,0,0,1,0,Delhi_Cochin,4537,0,16,0,0,215.5665378377522,0.2783363345806456,1,0
Jet Airways,6/05/2019,Kolkata,Banglore,CCU → BOM → BLR,20:00,12:00 07 May,16h,1 stop,In-flight meal not included,9663,2019-05-06,20:00:00,12:00:00,0,960,0,0,0,3849,0,0,CCU,BLR,1546.4372901474003,0,0,0,0,0,0,0,0,0,0,5,6,19,2,1,1,3,2,0,1,1,0,Kolkata_Banglore,2871,1,25,1,0,96.65233063421252,0.6207817194504516,1,0
IndiGo,12/05/2019,Chennai,Kolkata,MAA → CCU,14:45,17:05,2h 20m,non-stop,No info,3858,2019-05-12,14:45:00,17:05:00,0,140,1,1,0,2053,0,0,MAA,CCU,1385.198425287915,0,0,0,0,0,0,0,0,0,0,5,12,19,2,1,1,2,2,0,0,0,1,Chennai_Kolkata,381,1,19,0,0,593.656467980535,0.10106855266667002,1,0
SpiceJet,24/06/2019,Delhi,Cochin,DEL → PNQ → COK,08:45,13:15,4h 30m,1 stop,No info,4812,2019-06-24,08:45:00,13:15:00,0,270,0,1,0,818,0,0,DEL,COK,2047.882109458646,0,0,0,0,0,0,0,0,0,0,6,24,26,2,1,0,1,2,1,0,1,0,Delhi_Cochin,4537,0,6,0,1,455.08491321303245,0.1318435269066216,1,0
IndiGo,27/06/2019,Delhi,Cochin,DEL → LKO → COK,21:50,03:35 28 Jun,5h 45m,1 stop,No info,5775,2019-06-27,21:50:00,03:35:00,0,345,0,0,1,2053,0,0,DEL,COK,2047.882109458646,0,0,0,0,0,0,0,0,0,0,6,27,26,2,1,0,3,0,0,1,1,0,Delhi_Cochin,4537,0,3,0,1,356.1534103406341,0.1684667288251276,1,0
Jet Airways,6/06/2019,Kolkata,Banglore,CCU → DEL → BLR,09:35,09:45 07 Jun,24h 10m,1 stop,In-flight meal not included,10539,2019-06-06,09:35:00,09:45:00,0,1450,0,0,0,3849,0,0,CCU,BLR,1546.4372901474003,0,1,0,0,0,0,0,0,0,1,6,6,23,2,1,0,1,1,1,0,1,0,Kolkata_Banglore,2871,1,24,1,0,63.99050855782347,0.9376390554199528,1,0
IndiGo,3/06/2019,Kolkata,Banglore,CCU → BLR,15:30,18:05,2h 35m,non-stop,No info,4804,2019-06-03,15:30:00,18:05:00,0,155,0,1,0,2053,0,0,CCU,BLR,1546.4372901474003,0,1,0,0,0,0,0,0,0,1,6,3,23,2,1,0,2,3,0,0,0,1,Kolkata_Banglore,2871,1,27,1,0,598.6208865086711,0.10023038178627082,1,0
Air Asia,12/06/2019,Banglore,Delhi,BLR → DEL,11:10,13:55,2h 45m,non-stop,No info,3383,2019-06-12,11:10:00,13:55:00,0,165,0,1,0,319,0,0,BLR,DEL,1708.6520853536679,0,0,0,0,0,0,0,0,0,0,6,12,24,2,1,0,1,2,1,0,0,1,Banglore_Delhi,1265,1,18,0,0,621.3280310376974,0.09656734768555719,1,0
IndiGo,03/03/2019,Banglore,New Delhi,BLR → HYD → DEL,12:10,17:05,4h 55m,1 stop,No info,8738,2019-03-03,12:10:00,17:05:00,0,295,1,1,0,2053,0,0,BLR,DEL,1708.6520853536679,0,0,0,0,0,0,0,0,0,0,3,3,9,1,1,1,2,2,0,0,1,0,Banglore_New Delhi,932,0,28,1,0,347.5224580380342,0.17265071252872347,1,0
Air India,27/03/2019,Delhi,Cochin,DEL → TRV → COK,05:15,06:50 28 Mar,25h 35m,1 stop,No info,7165,2019-03-27,05:15:00,06:50:00,0,1535,0,0,1,1752,0,0,DEL,COK,2047.882109458646,0,0,0,0,0,0,0,0,0,0,3,27,13,1,1,1,0,1,0,0,1,0,Delhi_Cochin,4537,0,4,0,1,80.04750916450735,0.7495548659320894,1,0
IndiGo,24/06/2019,Delhi,Cochin,DEL → HYD → COK,16:10,22:30,6h 20m,1 stop,No info,6412,2019-06-24,16:10:00,22:30:00,0,380,0,1,0,2053,0,0,DEL,COK,2047.882109458646,0,0,0,0,0,0,0,0,0,0,6,24,26,2,1,0,2,3,0,0,1,0,Delhi_Cochin,4537,0,6,0,1,323.3498067566283,0.18555755638709706,1,0
Jet Airways,27/06/2019,Banglore,Delhi,BLR → DEL,18:55,22:00,3h 5m,non-stop,No info,8016,2019-06-27,18:55:00,22:00:00,0,185,0,1,0,3849,0,0,BLR,DEL,1708.6520853536679,0,0,0,0,0,0,0,0,0,0,6,27,26,2,1,0,3,3,0,1,0,1,Banglore_Delhi,1265,1,3,0,1,554.157433087676,0.10827248073835201,1,0
Jet Airways,12/03/2019,Banglore,New Delhi,BLR → BOM → DEL,20:35,15:15 13 Mar,18h 40m,1 stop,In-flight meal not included,11087,2019-03-12,20:35:00,15:15:00,0,1120,0,0,0,3849,0,0,BLR,DEL,1708.6520853536679,0,0,0,0,0,0,0,0,0,0,3,12,11,1,1,1,3,2,0,1,1,0,Banglore_New Delhi,932,0,19,0,0,91.53493314394649,0.6554874509565095,1,0
SpiceJet,27/06/2019,Chennai,Kolkata,MAA → CCU,09:45,12:00,2h 15m,non-stop,No check-in baggage included,3543,2019-06-27,09:45:00,12:00:00,0,135,0,1,0,818,0,0,MAA,CCU,1385.198425287915,0,0,0,0,0,0,0,0,0,0,6,27,26,2,1,0,1,2,1,0,0,1,Chennai_Kolkata,381,1,3,0,1,615.6437445724066,0.09745896150000323,1,0
Jet Airways,12/06/2019,Kolkata,Banglore,CCU → BOM → BLR,16:30,04:40 13 Jun,12h 10m,1 stop,No info,12471,2019-06-12,16:30:00,04:40:00,0,730,0,0,1,3849,0,0,CCU,BLR,1546.4372901474003,0,0,0,0,0,0,0,0,0,0,6,12,24,2,1,0,2,0,0,0,1,0,Kolkata_Banglore,2871,1,18,0,0,127.10443480663565,0.4720527658321142,1,0
Jet Airways,24/06/2019,Delhi,Cochin,DEL → BOM → COK,09:00,04:25 25 Jun,19h 25m,1 stop,In-flight meal not included,10262,2019-06-24,09:00:00,04:25:00,0,1165,0,0,1,3849,0,0,DEL,COK,2047.882109458646,0,0,0,0,0,0,0,0,0,0,6,24,26,2,1,0,1,0,1,0,1,0,Delhi_Cochin,4537,0,6,0,1,105.47032323392169,0.5688804031341266,1,0
Air India,18/03/2019,Banglore,New Delhi,BLR → DEL,13:20,16:10,2h 50m,non-stop,No info,4441,2019-03-18,13:20:00,16:10:00,0,170,0,1,0,1752,0,0,BLR,DEL,1708.6520853536679,0,0,0,0,1,0,0,0,0,1,3,18,12,1,1,1,2,2,0,0,0,1,Banglore_New Delhi,932,0,13,0,0,603.0536771836476,0.0994936309487559,1,0
Multiple carriers,27/03/2019,Delhi,Cochin,DEL → BOM → COK,07:05,15:30,8h 25m,1 stop,No info,12537,2019-03-27,07:05:00,15:30:00,0,505,0,1,0,1196,0,0,DEL,COK,2047.882109458646,0,0,0,0,0,0,0,0,0,0,3,27,13,1,1,1,1,2,1,0,1,0,Delhi_Cochin,4537,0,4,0,1,243.31272587627478,0.24659622625127373,1,0
GoAir,24/03/2019,Kolkata,Banglore,CCU → BOM → BLR,22:25,07:40 25 Mar,9h 15m,1 stop,No info,10091,2019-03-24,22:25:00,07:40:00,0,555,1,0,1,194,0,0,CCU,BLR,1546.4372901474003,0,0,0,0,1,0,0,0,0,1,3,24,12,1,1,1,3,1,0,1,1,0,Kolkata_Banglore,2871,1,7,0,1,167.1824097456649,0.3588894315572923,1,0
Air India,3/06/2019,Banglore,Delhi,BLR → DEL,21:05,23:55,2h 50m,non-stop,No info,6961,2019-06-03,21:05:00,23:55:00,0,170,0,1,1,1752,0,0,BLR,DEL,1708.6520853536679,0,1,0,0,0,0,0,0,0,1,6,3,23,2,1,0,3,3,0,1,0,1,Banglore_Delhi,1265,1,27,1,0,603.0536771836476,0.0994936309487559,1,0
IndiGo,24/04/2019,Delhi,Cochin,DEL → COK,05:35,08:50,3h 15m,non-stop,No info,5013,2019-04-24,05:35:00,08:50:00,0,195,0,1,0,2053,0,0,DEL,COK,2047.882109458646,0,0,0,0,0,0,0,0,0,0,4,24,17,2,1,1,0,1,0,0,0,1,Delhi_Cochin,4537,0,6,0,1,630.1175721411219,0.0952203249881156,1,0
Air India,18/05/2019,Delhi,Cochin,DEL → COK,05:10,08:00,2h 50m,non-stop,No info,6934,2019-05-18,05:10:00,08:00:00,0,170,1,1,0,1752,0,0,DEL,COK,2047.882109458646,0,0,0,0,0,0,0,0,0,0,5,18,20,2,1,1,0,1,0,0,0,1,Delhi_Cochin,4537,0,13,0,0,722.7819209854044,0.08301259101528027,1,0
Multiple carriers,3/06/2019,Delhi,Cochin,DEL → BOM → COK,06:40,19:00,12h 20m,1 stop,No info,10877,2019-06-03,06:40:00,19:00:00,0,740,0,1,0,1196,0,0,DEL,COK,2047.882109458646,0,1,0,0,0,0,0,0,0,1,6,3,23,2,1,0,1,3,1,0,1,0,Delhi_Cochin,4537,0,27,1,0,166.04449536151182,0.36134892559592585,1,0
Jet Airways,18/04/2019,Banglore,Delhi,BLR → DEL,15:15,18:10,2h 55m,non-stop,No info,7229,2019-04-18,15:15:00,18:10:00,0,175,0,1,0,3849,0,0,BLR,DEL,1708.6520853536679,0,0,0,0,0,0,0,0,0,0,4,18,16,2,1,1,2,3,0,0,0,1,Banglore_Delhi,1265,1,12,0,0,585.8235721212576,0.10241991421195461,1,0
IndiGo,27/03/2019,Delhi,Cochin,DEL → BOM → COK,16:00,01:35 28 Mar,9h 35m,1 stop,No info,7048,2019-03-27,16:00:00,01:35:00,0,575,0,0,1,2053,0,0,DEL,COK,2047.882109458646,0,0,0,0,0,0,0,0,0,0,3,27,13,1,1,1,2,0,0,0,1,0,Delhi_Cochin,4537,0,4,0,1,213.69204620438046,0.28077788137521265,1,0
Vistara,27/06/2019,Banglore,Delhi,BLR → DEL,17:00,19:35,2h 35m,non-stop,No info,4878,2019-06-27,17:00:00,19:35:00,0,155,0,1,0,479,0,0,BLR,DEL,1708.6520853536679,0,0,0,0,0,0,0,0,0,0,6,27,26,2,1,0,2,3,0,0,0,1,Banglore_Delhi,1265,1,3,0,1,661.4137104594843,0.09071478115915979,1,0
Jet Airways,21/05/2019,Kolkata,Banglore,CCU → BOM → BLR,14:05,23:35,9h 30m,1 stop,In-flight meal not included,10844,2019-05-21,14:05:00,23:35:00,0,570,0,1,0,3849,0,0,CCU,BLR,1546.4372901474003,0,0,0,0,0,0,0,0,0,0,5,21,21,2,1,1,2,3,0,0,1,0,Kolkata_Banglore,2871,1,10,0,1,162.78287264709476,0.3685891459237056,1,0
Jet Airways,18/05/2019,Delhi,Cochin,DEL → AMD → BOM → COK,23:05,04:25 20 May,29h 20m,2 stops,No info,15129,2019-05-18,23:05:00,04:25:00,0,1760,1,0,1,3849,0,0,DEL,COK,2047.882109458646,0,0,0,0,0,0,0,0,0,0,5,18,20,2,1,1,3,0,0,1,2,0,Delhi_Cochin,4537,0,13,0,0,69.81416282245384,0.8594244716876075,1,0
IndiGo,12/05/2019,Banglore,Delhi,BLR → DEL,00:30,03:25,2h 55m,non-stop,No info,3943,2019-05-12,00:30:00,03:25:00,0,175,1,1,1,2053,0,0,BLR,DEL,1708.6520853536679,0,0,0,0,0,0,0,0,0,0,5,12,19,2,1,1,0,0,0,0,0,1,Banglore_Delhi,1265,1,19,0,0,585.8235721212576,0.10241991421195461,1,0
SpiceJet,6/06/2019,Delhi,Cochin,DEL → MAA → COK,06:05,11:20,5h 15m,1 stop,No info,5583,2019-06-06,06:05:00,11:20:00,0,315,0,1,0,818,0,0,DEL,COK,2047.882109458646,0,1,0,0,0,0,0,0,0,1,6,6,23,2,1,0,1,1,1,0,1,0,Delhi_Cochin,4537,0,24,1,0,390.0727827540278,0.1538174480577252,1,0
Multiple carriers,6/06/2019,Delhi,Cochin,DEL → HYD → COK,07:05,16:10,9h 5m,1 stop,No info,9646,2019-06-06,07:05:00,16:10:00,0,545,0,1,0,1196,0,0,DEL,COK,2047.882109458646,0,1,0,0,0,0,0,0,0,1,6,6,23,2,1,0,1,2,1,0,1,0,Delhi_Cochin,4537,0,24,1,0,225.45491113306196,0.2661286006078103,1,0
Multiple carriers,3/06/2019,Delhi,Cochin,DEL → BOM → COK,08:30,19:15,10h 45m,1 stop,No info,7677,2019-06-03,08:30:00,19:15:00,0,645,0,1,0,1196,0,0,DEL,COK,2047.882109458646,0,1,0,0,0,0,0,0,0,1,6,3,23,2,1,0,1,3,1,0,1,0,Delhi_Cochin,4537,0,27,1,0,190.50066134499033,0.3149595364991516,1,0
IndiGo,1/06/2019,Delhi,Cochin,DEL → BLR → COK,05:10,10:05,4h 55m,1 stop,No info,6842,2019-06-01,05:10:00,10:05:00,0,295,1,1,0,2053,0,0,DEL,COK,2047.882109458646,0,1,0,0,0,0,0,0,0,1,6,1,22,2,1,0,0,1,0,0,1,0,Delhi_Cochin,4537,0,29,1,0,416.5183951441314,0.14405126087945694,1,0
Jet Airways,24/06/2019,Mumbai,Hyderabad,BOM → HYD,08:45,10:15,1h 30m,non-stop,In-flight meal not included,4995,2019-06-24,08:45:00,10:15:00,0,90,0,1,0,3849,0,0,BOM,HYD,622.9702752863186,0,0,0,0,0,0,0,0,0,0,6,24,26,2,1,0,1,1,1,0,0,1,Mumbai_Hyderabad,697,1,6,0,1,415.3135168575457,0.14446917223881314,0,0
Vistara,9/06/2019,Kolkata,Banglore,CCU → DEL → BLR,07:10,18:50,11h 40m,1 stop,No info,9555,2019-06-09,07:10:00,18:50:00,0,700,1,1,0,479,0,0,CCU,BLR,1546.4372901474003,0,1,0,0,0,0,0,0,0,1,6,9,23,2,1,0,1,3,1,0,1,0,Kolkata_Banglore,2871,1,21,1,0,132.55176772692005,0.45265333709928757,1,0
IndiGo,1/06/2019,Banglore,Delhi,BLR → DEL,01:30,04:15,2h 45m,non-stop,No info,4077,2019-06-01,01:30:00,04:15:00,0,165,1,1,1,2053,0,0,BLR,DEL,1708.6520853536679,0,1,0,0,0,0,0,0,0,1,6,1,22,2,1,0,0,0,0,0,0,1,Banglore_Delhi,1265,1,29,1,0,621.3280310376974,0.09656734768555719,1,0
Jet Airways,12/05/2019,Banglore,Delhi,BLR → DEL,15:15,18:10,2h 55m,non-stop,No info,7229,2019-05-12,15:15:00,18:10:00,0,175,1,1,0,3849,0,0,BLR,DEL,1708.6520853536679,0,0,0,0,0,0,0,0,0,0,5,12,19,2,1,1,2,3,0,0,0,1,Banglore_Delhi,1265,1,19,0,0,585.8235721212576,0.10241991421195461,1,0
Multiple carriers,9/06/2019,Delhi,Cochin,DEL → BOM → COK,09:00,19:00,10h,1 stop,No info,12192,2019-06-09,09:00:00,19:00:00,0,600,1,1,0,1196,0,0,DEL,COK,2047.882109458646,0,1,0,0,0,0,0,0,0,1,6,9,23,2,1,0,1,3,1,0,1,0,Delhi_Cochin,4537,0,21,1,0,204.7882109458646,0.292985615348048,1,0
Air India,12/04/2019,Banglore,Delhi,BLR → DEL,10:00,12:45,2h 45m,non-stop,No info,5911,2019-04-12,10:00:00,12:45:00,0,165,0,1,0,1752,0,0,BLR,DEL,1708.6520853536679,0,0,0,0,0,0,0,0,0,0,4,12,15,2,1,1,1,2,1,0,0,1,Banglore_Delhi,1265,1,18,0,0,621.3280310376974,0.09656734768555719,1,0
Air India,12/06/2019,Delhi,Cochin,DEL → BOM → COK,09:00,19:15,10h 15m,1 stop,No info,8372,2019-06-12,09:00:00,19:15:00,0,615,0,1,0,1752,0,0,DEL,COK,2047.882109458646,0,0,0,0,0,0,0,0,0,0,6,12,24,2,1,0,1,3,1,0,1,0,Delhi_Cochin,4537,0,18,0,0,199.79337653255084,0.3003102557317492,1,0
Jet Airways,18/03/2019,Mumbai,Hyderabad,BOM → HYD,07:10,08:35,1h 25m,non-stop,In-flight meal not included,4995,2019-03-18,07:10:00,08:35:00,0,85,0,1,0,3849,0,0,BOM,HYD,622.9702752863186,0,0,0,0,1,0,0,0,0,1,3,18,12,1,1,1,1,1,1,0,0,1,Mumbai_Hyderabad,697,1,13,0,0,439.743723731519,0.13644310711443464,0,0
Multiple carriers,9/05/2019,Delhi,Cochin,DEL → BOM → COK,10:00,19:15,9h 15m,1 stop,No info,14323,2019-05-09,10:00:00,19:15:00,0,555,0,1,0,1196,0,0,DEL,COK,2047.882109458646,0,0,0,0,0,0,0,0,0,0,5,9,19,2,1,1,1,3,1,0,1,0,Delhi_Cochin,4537,0,22,1,0,221.3926604820158,0.2710116941969444,1,0
Jet Airways,9/06/2019,Delhi,Cochin,DEL → JAI → BOM → COK,05:30,04:25 10 Jun,22h 55m,2 stops,No info,13014,2019-06-09,05:30:00,04:25:00,0,1375,1,0,1,3849,0,0,DEL,COK,2047.882109458646,0,1,0,0,0,0,0,0,0,1,6,9,23,2,1,0,0,0,0,0,2,0,Delhi_Cochin,4537,0,21,1,0,89.36212841274092,0.6714253685059434,1,0
Air India,6/06/2019,Delhi,Cochin,DEL → CCU → BOM → COK,14:25,19:15 07 Jun,28h 50m,2 stops,No info,13591,2019-06-06,14:25:00,19:15:00,0,1730,0,0,0,1752,0,0,DEL,COK,2047.882109458646,0,1,0,0,0,0,0,0,0,1,6,6,23,2,1,0,2,3,0,0,2,0,Delhi_Cochin,4537,0,24,1,0,71.02481304480852,0.844775190920205,1,0
Jet Airways,3/03/2019,Delhi,Cochin,DEL → IDR → BOM → COK,05:25,18:50 04 Mar,37h 25m,2 stops,No info,18799,2019-03-03,05:25:00,18:50:00,0,2245,1,0,0,3849,0,0,DEL,COK,2047.882109458646,0,0,0,0,0,0,0,0,0,0,3,3,9,1,1,1,0,3,0,0,2,0,Delhi_Cochin,4537,0,28,1,0,54.731815842992766,1.096254510760613,1,0
IndiGo,27/04/2019,Banglore,Delhi,BLR → DEL,23:30,02:20 28 Apr,2h 50m,non-stop,No info,3943,2019-04-27,23:30:00,02:20:00,0,170,1,0,1,2053,0,0,BLR,DEL,1708.6520853536679,0,0,0,0,0,0,0,0,0,0,4,27,17,2,1,1,3,0,0,1,0,1,Banglore_Delhi,1265,1,3,0,1,603.0536771836476,0.0994936309487559,1,0
SpiceJet,21/05/2019,Mumbai,Hyderabad,BOM → HYD,05:45,07:15,1h 30m,non-stop,No check-in baggage included,1965,2019-05-21,05:45:00,07:15:00,0,90,0,1,0,818,0,0,BOM,HYD,622.9702752863186,0,0,0,0,0,0,0,0,0,0,5,21,21,2,1,1,0,1,0,0,0,1,Mumbai_Hyderabad,697,1,10,0,1,415.3135168575457,0.14446917223881314,0,0
Jet Airways,27/05/2019,Mumbai,Hyderabad,BOM → HYD,10:20,11:50,1h 30m,non-stop,In-flight meal not included,4995,2019-05-27,10:20:00,11:50:00,0,90,0,1,0,3849,0,0,BOM,HYD,622.9702752863186,0,0,0,0,0,0,0,0,0,0,5,27,22,2,1,1,1,1,1,0,0,1,Mumbai_Hyderabad,697,1,4,0,1,415.3135168575457,0.14446917223881314,0,0
Air India,24/03/2019,Kolkata,Banglore,CCU → BOM → BLR,16:50,18:30 25 Mar,25h 40m,1 stop,No info,14641,2019-03-24,16:50:00,18:30:00,0,1540,1,0,0,1752,0,0,CCU,BLR,1546.4372901474003,0,0,0,0,1,0,0,0,0,1,3,24,12,1,1,1,2,3,0,0,1,0,Kolkata_Banglore,2871,1,7,0,1,60.250803512236374,0.9958373416184327,1,0
Air India,12/04/2019,Kolkata,Banglore,CCU → BLR,20:45,23:20,2h 35m,non-stop,No info,4460,2019-04-12,20:45:00,23:20:00,0,155,0,1,0,1752,0,0,CCU,BLR,1546.4372901474003,0,0,0,0,0,0,0,0,0,0,4,12,15,2,1,1,3,3,0,1,0,1,Kolkata_Banglore,2871,1,18,0,0,598.6208865086711,0.10023038178627082,1,0
Air India,18/05/2019,Delhi,Cochin,DEL → BOM → COK,13:00,19:15,6h 15m,1 stop,No info,10191,2019-05-18,13:00:00,19:15:00,0,375,1,1,0,1752,0,0,DEL,COK,2047.882109458646,0,0,0,0,0,0,0,0,0,0,5,18,20,2,1,1,2,3,0,0,1,0,Delhi_Cochin,4537,0,13,0,0,327.6611375133833,0.18311600959253,1,0
Jet Airways,9/03/2019,Delhi,Cochin,DEL → BOM → COK,02:15,19:45,17h 30m,1 stop,In-flight meal not included,13843,2019-03-09,02:15:00,19:45:00,0,1050,1,1,1,3849,0,0,DEL,COK,2047.882109458646,0,0,0,0,0,0,0,0,0,0,3,9,10,1,1,1,0,3,0,0,1,0,Delhi_Cochin,4537,0,22,1,0,117.02183482620835,0.512724826859084,1,0
IndiGo,1/05/2019,Delhi,Cochin,DEL → LKO → COK,21:50,03:35 02 May,5h 45m,1 stop,No info,6349,2019-05-01,21:50:00,03:35:00,0,345,0,0,1,2053,0,0,DEL,COK,2047.882109458646,0,0,0,0,0,0,0,0,0,0,5,1,18,2,1,1,3,0,0,1,1,0,Delhi_Cochin,4537,0,30,1,0,356.1534103406341,0.1684667288251276,1,0
Air Asia,1/05/2019,Kolkata,Banglore,CCU → BLR,10:20,12:55,2h 35m,non-stop,No info,4409,2019-05-01,10:20:00,12:55:00,0,155,0,1,0,319,0,0,CCU,BLR,1546.4372901474003,0,0,0,0,0,0,0,0,0,0,5,1,18,2,1,1,1,2,1,0,0,1,Kolkata_Banglore,2871,1,30,1,0,598.6208865086711,0.10023038178627082,1,0
Jet Airways,6/03/2019,Delhi,Cochin,DEL → BOM → COK,18:15,19:45 07 Mar,25h 30m,1 stop,No info,17024,2019-03-06,18:15:00,19:45:00,0,1530,0,0,0,3849,0,0,DEL,COK,2047.882109458646,0,0,0,0,0,0,0,0,0,0,3,6,10,1,1,1,3,3,0,1,1,0,Delhi_Cochin,4537,0,25,1,0,80.3091023317116,0.7471133191375224,1,0
Multiple carriers,18/05/2019,Delhi,Cochin,DEL → BOM → COK,07:05,21:00,13h 55m,1 stop,No info,13727,2019-05-18,07:05:00,21:00:00,0,835,1,1,0,1196,0,0,DEL,COK,2047.882109458646,0,0,0,0,0,0,0,0,0,0,5,18,20,2,1,1,1,3,1,0,1,0,Delhi_Cochin,4537,0,13,0,0,147.15320547008236,0.4077383146927001,1,0
IndiGo,15/03/2019,Banglore,New Delhi,BLR → DEL,18:25,21:20,2h 55m,non-stop,No info,8855,2019-03-15,18:25:00,21:20:00,0,175,0,1,0,2053,0,0,BLR,DEL,1708.6520853536679,0,0,0,0,1,0,0,0,0,1,3,15,11,1,1,1,3,3,0,1,0,1,Banglore_New Delhi,932,0,16,0,0,585.8235721212576,0.10241991421195461,1,0
Multiple carriers,24/06/2019,Delhi,Cochin,DEL → BOM → COK,08:45,19:00,10h 15m,1 stop,No info,12524,2019-06-24,08:45:00,19:00:00,0,615,0,1,0,1196,0,0,DEL,COK,2047.882109458646,0,0,0,0,0,0,0,0,0,0,6,24,26,2,1,0,1,3,1,0,1,0,Delhi_Cochin,4537,0,6,0,1,199.79337653255084,0.3003102557317492,1,0
Jet Airways,18/03/2019,Banglore,New Delhi,BLR → BOM → DEL,11:40,20:20,8h 40m,1 stop,No info,13555,2019-03-18,11:40:00,20:20:00,0,520,0,1,0,3849,0,0,BLR,DEL,1708.6520853536679,0,0,0,0,1,0,0,0,0,1,3,18,12,1,1,1,1,3,1,0,1,0,Banglore_New Delhi,932,0,13,0,0,197.152163694654,0.3043334593726651,1,0
Jet Airways,6/06/2019,Kolkata,Banglore,CCU → BOM → BLR,06:30,12:00,5h 30m,1 stop,In-flight meal not included,10844,2019-06-06,06:30:00,12:00:00,0,330,0,1,0,3849,0,0,CCU,BLR,1546.4372901474003,0,1,0,0,0,0,0,0,0,1,6,6,23,2,1,0,1,2,1,0,1,0,Kolkata_Banglore,2871,1,24,1,0,281.17041639043646,0.21339371606109273,1,0
Multiple carriers,9/06/2019,Delhi,Cochin,DEL → BOM → COK,09:00,21:00,12h,1 stop,No info,13587,2019-06-09,09:00:00,21:00:00,0,720,1,1,0,1196,0,0,DEL,COK,2047.882109458646,0,1,0,0,0,0,0,0,0,1,6,9,23,2,1,0,1,3,1,0,1,0,Delhi_Cochin,4537,0,21,1,0,170.65684245488717,0.3515827384176576,1,0
SpiceJet,12/06/2019,Chennai,Kolkata,MAA → CCU,09:45,12:00,2h 15m,non-stop,No check-in baggage included,3543,2019-06-12,09:45:00,12:00:00,0,135,0,1,0,818,0,0,MAA,CCU,1385.198425287915,0,0,0,0,0,0,0,0,0,0,6,12,24,2,1,0,1,2,1,0,0,1,Chennai_Kolkata,381,1,18,0,0,615.6437445724066,0.09745896150000323,1,0
Vistara,18/03/2019,Chennai,Kolkata,MAA → CCU,07:05,09:20,2h 15m,non-stop,No info,4842,2019-03-18,07:05:00,09:20:00,0,135,0,1,0,479,0,0,MAA,CCU,1385.198425287915,0,0,0,0,1,0,0,0,0,1,3,18,12,1,1,1,1,1,1,0,0,1,Chennai_Kolkata,381,1,13,0,0,615.6437445724066,0.09745896150000323,1,0
IndiGo,24/04/2019,Banglore,Delhi,BLR → DEL,23:30,02:20 25 Apr,2h 50m,non-stop,No info,3943,2019-04-24,23:30:00,02:20:00,0,170,0,0,1,2053,0,0,BLR,DEL,1708.6520853536679,0,0,0,0,0,0,0,0,0,0,4,24,17,2,1,1,3,0,0,1,0,1,Banglore_Delhi,1265,1,6,0,1,603.0536771836476,0.0994936309487559,1,0
Jet Airways,9/06/2019,Delhi,Cochin,DEL → BOM → COK,19:15,04:25 10 Jun,9h 10m,1 stop,In-flight meal not included,10577,2019-06-09,19:15:00,04:25:00,0,550,1,0,1,3849,0,0,DEL,COK,2047.882109458646,0,1,0,0,0,0,0,0,0,1,6,9,23,2,1,0,3,0,0,1,1,0,Delhi_Cochin,4537,0,21,1,0,223.4053210318523,0.26857014740237733,1,0
IndiGo,15/05/2019,Delhi,Cochin,DEL → BOM → COK,10:35,21:00,10h 25m,1 stop,No info,6979,2019-05-15,10:35:00,21:00:00,0,625,0,1,0,2053,0,0,DEL,COK,2047.882109458646,0,0,0,0,0,0,0,0,0,0,5,15,20,2,1,1,1,3,1,0,1,0,Delhi_Cochin,4537,0,16,0,0,196.59668250803003,0.3051933493208833,1,0
Vistara,27/06/2019,Chennai,Kolkata,MAA → CCU,17:45,20:05,2h 20m,non-stop,No info,11982,2019-06-27,17:45:00,20:05:00,0,140,0,1,0,479,0,0,MAA,CCU,1385.198425287915,0,0,0,0,0,0,0,0,0,0,6,27,26,2,1,0,2,3,0,0,0,1,Chennai_Kolkata,381,1,3,0,1,593.656467980535,0.10106855266667002,1,0
SpiceJet,6/06/2019,Delhi,Cochin,DEL → PNQ → COK,08:45,13:15,4h 30m,1 stop,No info,5264,2019-06-06,08:45:00,13:15:00,0,270,0,1,0,818,0,0,DEL,COK,2047.882109458646,0,1,0,0,0,0,0,0,0,1,6,6,23,2,1,0,1,2,1,0,1,0,Delhi_Cochin,4537,0,24,1,0,455.08491321303245,0.1318435269066216,1,0
Vistara,3/03/2019,Delhi,Cochin,DEL → COK,06:00,09:10,3h 10m,non-stop,No info,8001,2019-03-03,06:00:00,09:10:00,0,190,1,1,0,479,0,0,DEL,COK,2047.882109458646,0,0,0,0,0,0,0,0,0,0,3,3,9,1,1,1,1,1,1,0,0,1,Delhi_Cochin,4537,0,28,1,0,646.6996135132566,0.09277877819354853,1,0
Air India,1/06/2019,Delhi,Cochin,DEL → AMD → BOM → COK,19:45,19:15 02 Jun,23h 30m,2 stops,No info,10651,2019-06-01,19:45:00,19:15:00,0,1410,1,0,0,1752,0,0,DEL,COK,2047.882109458646,0,1,0,0,0,0,0,0,0,1,6,1,22,2,1,0,3,3,0,1,2,0,Delhi_Cochin,4537,0,29,1,0,87.14391955143175,0.6885161960679128,1,0
Jet Airways,24/05/2019,Kolkata,Banglore,CCU → BOM → BLR,16:30,19:50 25 May,27h 20m,1 stop,In-flight meal not included,10844,2019-05-24,16:30:00,19:50:00,0,1640,0,0,0,3849,0,0,CCU,BLR,1546.4372901474003,0,0,0,0,0,0,0,0,0,0,5,24,21,2,1,1,2,3,0,0,1,0,Kolkata_Banglore,2871,1,7,0,1,56.57697402978294,1.0605021040611882,1,0
Multiple carriers,27/03/2019,Delhi,Cochin,DEL → HYD → COK,09:45,22:20,12h 35m,1 stop,No info,6601,2019-03-27,09:45:00,22:20:00,0,755,0,1,0,1196,0,0,DEL,COK,2047.882109458646,0,0,0,0,0,0,0,0,0,0,3,27,13,1,1,1,1,3,1,0,1,0,Delhi_Cochin,4537,0,4,0,1,162.74559810267385,0.3686735659796271,1,0
Air India,21/03/2019,Delhi,Cochin,DEL → BOM → COK,19:00,19:15 22 Mar,24h 15m,1 stop,No info,6587,2019-03-21,19:00:00,19:15:00,0,1455,0,0,0,1752,0,0,DEL,COK,2047.882109458646,0,0,0,0,1,0,0,0,0,1,3,21,12,1,1,1,3,3,0,1,1,0,Delhi_Cochin,4537,0,10,0,1,84.44874678179984,0.7104901172190164,1,0
SpiceJet,21/03/2019,Mumbai,Hyderabad,BOM → HYD,13:10,14:30,1h 20m,non-stop,No info,3173,2019-03-21,13:10:00,14:30:00,0,80,0,1,0,818,0,0,BOM,HYD,622.9702752863186,0,0,0,0,1,0,0,0,0,1,3,21,12,1,1,1,2,2,0,0,0,1,Mumbai_Hyderabad,697,1,10,0,1,467.22770646473896,0.12841704199005613,0,0
Air India,9/05/2019,Banglore,Delhi,BLR → DEL,10:00,12:45,2h 45m,non-stop,No info,5228,2019-05-09,10:00:00,12:45:00,0,165,0,1,0,1752,0,0,BLR,DEL,1708.6520853536679,0,0,0,0,0,0,0,0,0,0,5,9,19,2,1,1,1,2,1,0,0,1,Banglore_Delhi,1265,1,22,1,0,621.3280310376974,0.09656734768555719,1,0
Jet Airways,21/06/2019,Banglore,Delhi,BLR → DEL,07:10,10:10,3h,non-stop,In-flight meal not included,5769,2019-06-21,07:10:00,10:10:00,0,180,0,1,0,3849,0,0,BLR,DEL,1708.6520853536679,0,0,0,0,0,0,0,0,0,0,6,21,25,2,1,0,1,1,1,0,0,1,Banglore_Delhi,1265,1,9,0,1,569.5506951178893,0.10534619747515331,1,0
Jet Airways,6/06/2019,Delhi,Cochin,DEL → BOM → COK,08:00,19:00,11h,1 stop,No info,14714,2019-06-06,08:00:00,19:00:00,0,660,0,1,0,3849,0,0,DEL,COK,2047.882109458646,0,1,0,0,0,0,0,0,0,1,6,6,23,2,1,0,1,3,1,0,1,0,Delhi_Cochin,4537,0,24,1,0,186.1711008598769,0.3222841768828528,1,0
Jet Airways,3/06/2019,Delhi,Cochin,DEL → JAI → BOM → COK,05:30,19:00,13h 30m,2 stops,No info,13014,2019-06-03,05:30:00,19:00:00,0,810,0,1,0,3849,0,0,DEL,COK,2047.882109458646,0,1,0,0,0,0,0,0,0,1,6,3,23,2,1,0,0,3,0,0,2,0,Delhi_Cochin,4537,0,27,1,0,151.69497107101083,0.3955305807198648,1,0
IndiGo,3/06/2019,Banglore,Delhi,BLR → DEL,22:10,01:00 04 Jun,2h 50m,non-stop,No info,3359,2019-06-03,22:10:00,01:00:00,0,170,0,0,1,2053,0,0,BLR,DEL,1708.6520853536679,0,1,0,0,0,0,0,0,0,1,6,3,23,2,1,0,3,0,0,1,0,1,Banglore_Delhi,1265,1,27,1,0,603.0536771836476,0.0994936309487559,1,0
GoAir,03/03/2019,Banglore,New Delhi,BLR → DEL,20:55,23:50,2h 55m,non-stop,No info,6722,2019-03-03,20:55:00,23:50:00,0,175,1,1,0,194,0,0,BLR,DEL,1708.6520853536679,0,0,0,0,0,0,0,0,0,0,3,3,9,1,1,1,3,3,0,1,0,1,Banglore_New Delhi,932,0,28,1,0,585.8235721212576,0.10241991421195461,1,0
IndiGo,18/03/2019,Kolkata,Banglore,CCU → BLR,09:35,12:20,2h 45m,non-stop,No info,4462,2019-03-18,09:35:00,12:20:00,0,165,0,1,0,2053,0,0,CCU,BLR,1546.4372901474003,0,0,0,0,1,0,0,0,0,1,3,18,12,1,1,1,1,2,1,0,0,1,Kolkata_Banglore,2871,1,13,0,0,562.3408327808729,0.10669685803054636,1,0
IndiGo,9/03/2019,Delhi,Cochin,DEL → HYD → COK,04:55,16:10,11h 15m,1 stop,No info,6171,2019-03-09,04:55:00,16:10:00,0,675,1,1,0,2053,0,0,DEL,COK,2047.882109458646,0,0,0,0,0,0,0,0,0,0,3,9,10,1,1,1,0,2,0,0,1,0,Delhi_Cochin,4537,0,22,1,0,182.033965285213,0.329608817266554,1,0
Air India,21/05/2019,Kolkata,Banglore,CCU → IXR → DEL → BLR,05:50,20:25,14h 35m,2 stops,No info,12303,2019-05-21,05:50:00,20:25:00,0,875,0,1,0,1752,0,0,CCU,BLR,1546.4372901474003,0,0,0,0,0,0,0,0,0,0,5,21,21,2,1,1,0,3,0,0,2,0,Kolkata_Banglore,2871,1,10,0,1,106.04141418153601,0.5658166713741095,1,0
Multiple carriers,21/03/2019,Delhi,Cochin,DEL → BOM → COK,11:40,01:35 22 Mar,13h 55m,1 stop,No info,7695,2019-03-21,11:40:00,01:35:00,0,835,0,0,1,1196,0,0,DEL,COK,2047.882109458646,0,0,0,0,1,0,0,0,0,1,3,21,12,1,1,1,1,0,1,0,1,0,Delhi_Cochin,4537,0,10,0,1,147.15320547008236,0.4077383146927001,1,0
IndiGo,24/06/2019,Delhi,Cochin,DEL → BOM → COK,11:25,01:30 25 Jun,14h 5m,1 stop,No info,5684,2019-06-24,11:25:00,01:30:00,0,845,0,0,1,2053,0,0,DEL,COK,2047.882109458646,0,0,0,0,0,0,0,0,0,0,6,24,26,2,1,0,1,0,1,0,1,0,Delhi_Cochin,4537,0,6,0,1,145.41174741718197,0.41262140828183425,1,0
Air India,12/06/2019,Kolkata,Banglore,CCU → BOM → BLR,16:50,07:55 13 Jun,15h 5m,1 stop,No info,8366,2019-06-12,16:50:00,07:55:00,0,905,0,0,0,1752,0,0,CCU,BLR,1546.4372901474003,0,0,0,0,0,0,0,0,0,0,6,12,24,2,1,0,2,1,0,0,1,0,Kolkata_Banglore,2871,1,18,0,0,102.5262291810431,0.5852161001069361,1,0
Air India,1/03/2019,Chennai,Kolkata,MAA → CCU,11:40,13:55,2h 15m,non-stop,No info,19630,2019-03-01,11:40:00,13:55:00,0,135,0,1,0,1752,0,0,MAA,CCU,1385.198425287915,0,0,0,0,0,0,0,0,0,0,3,1,9,1,1,1,1,2,1,0,0,1,Chennai_Kolkata,381,1,30,1,0,615.6437445724066,0.09745896150000323,1,0
Jet Airways,06/03/2019,Banglore,New Delhi,BLR → BOM → DEL,14:05,05:05 07 Mar,15h,1 stop,In-flight meal not included,13502,2019-03-06,14:05:00,05:05:00,0,900,0,0,1,3849,0,0,BLR,DEL,1708.6520853536679,0,0,0,0,0,0,0,0,0,0,3,6,10,1,1,1,2,0,0,0,1,0,Banglore_New Delhi,932,0,25,1,0,113.91013902357786,0.5267309873757665,1,0
Jet Airways,1/05/2019,Kolkata,Banglore,CCU → BOM → BLR,21:10,10:05 02 May,12h 55m,1 stop,No info,14781,2019-05-01,21:10:00,10:05:00,0,775,0,0,1,3849,0,0,CCU,BLR,1546.4372901474003,0,0,0,0,0,0,0,0,0,0,5,1,18,2,1,1,3,1,0,1,1,0,Kolkata_Banglore,2871,1,30,1,0,119.72417730173422,0.5011519089313541,1,0
Multiple carriers,12/06/2019,Delhi,Cochin,DEL → HYD → COK,07:10,16:10,9h,1 stop,No info,6513,2019-06-12,07:10:00,16:10:00,0,540,0,1,0,1196,0,0,DEL,COK,2047.882109458646,0,0,0,0,0,0,0,0,0,0,6,12,24,2,1,0,1,2,1,0,1,0,Delhi_Cochin,4537,0,18,0,0,227.54245660651623,0.2636870538132432,1,0
Air India,1/06/2019,Delhi,Cochin,DEL → BOM → COK,07:00,19:15,12h 15m,1 stop,No info,9929,2019-06-01,07:00:00,19:15:00,0,735,1,1,0,1752,0,0,DEL,COK,2047.882109458646,0,1,0,0,0,0,0,0,0,1,6,1,22,2,1,0,1,3,1,0,1,0,Delhi_Cochin,4537,0,29,1,0,167.17404975172622,0.3589073788013588,1,0
Multiple carriers,6/06/2019,Delhi,Cochin,DEL → IXU → BOM → COK,17:50,01:30 07 Jun,7h 40m,2 stops,No info,18275,2019-06-06,17:50:00,01:30:00,0,460,0,0,1,1196,0,0,DEL,COK,2047.882109458646,0,1,0,0,0,0,0,0,0,1,6,6,23,2,1,0,2,0,0,0,2,0,Delhi_Cochin,4537,0,24,1,0,267.1150577554756,0.22462230510017014,1,0
Air India,9/04/2019,Delhi,Cochin,DEL → MAA → COK,06:05,09:25 10 Apr,27h 20m,1 stop,No info,4487,2019-04-09,06:05:00,09:25:00,0,1640,0,0,0,1752,0,0,DEL,COK,2047.882109458646,0,0,0,0,0,0,0,0,0,0,4,9,15,2,1,1,1,1,1,0,1,0,Delhi_Cochin,4537,0,21,1,0,74.92251619970656,0.8008273486179979,1,0
IndiGo,15/03/2019,Mumbai,Hyderabad,BOM → HYD,21:20,22:45,1h 25m,non-stop,No info,2754,2019-03-15,21:20:00,22:45:00,0,85,0,1,1,2053,0,0,BOM,HYD,622.9702752863186,0,0,0,0,1,0,0,0,0,1,3,15,11,1,1,1,3,3,0,1,0,1,Mumbai_Hyderabad,697,1,16,0,0,439.743723731519,0.13644310711443464,0,0
Air India,27/03/2019,Mumbai,Hyderabad,BOM → HYD,06:20,07:40,1h 20m,non-stop,No info,2575,2019-03-27,06:20:00,07:40:00,0,80,0,1,0,1752,0,0,BOM,HYD,622.9702752863186,0,0,0,0,0,0,0,0,0,0,3,27,13,1,1,1,1,1,1,0,0,1,Mumbai_Hyderabad,697,1,4,0,1,467.22770646473896,0.12841704199005613,0,0
SpiceJet,12/06/2019,Kolkata,Banglore,CCU → IXB → BLR,15:55,21:25,5h 30m,1 stop,No info,8224,2019-06-12,15:55:00,21:25:00,0,330,0,1,0,818,0,0,CCU,BLR,1546.4372901474003,0,0,0,0,0,0,0,0,0,0,6,12,24,2,1,0,2,3,0,0,1,0,Kolkata_Banglore,2871,1,18,0,0,281.17041639043646,0.21339371606109273,1,0
Air India,9/03/2019,Delhi,Cochin,DEL → BLR → COK,20:30,08:15 10 Mar,11h 45m,1 stop,No info,8991,2019-03-09,20:30:00,08:15:00,0,705,1,0,0,1752,0,0,DEL,COK,2047.882109458646,0,0,0,0,0,0,0,0,0,0,3,9,10,1,1,1,3,1,0,1,1,0,Delhi_Cochin,4537,0,22,1,0,174.2878391028635,0.3442580980339564,1,0
IndiGo,24/06/2019,Delhi,Cochin,DEL → COK,05:35,08:50,3h 15m,non-stop,No info,5000,2019-06-24,05:35:00,08:50:00,0,195,0,1,0,2053,0,0,DEL,COK,2047.882109458646,0,0,0,0,0,0,0,0,0,0,6,24,26,2,1,0,0,1,0,0,0,1,Delhi_Cochin,4537,0,6,0,1,630.1175721411219,0.0952203249881156,1,0
Jet Airways,12/06/2019,Kolkata,Banglore,CCU → BOM → BLR,18:55,19:50 13 Jun,24h 55m,1 stop,In-flight meal not included,8529,2019-06-12,18:55:00,19:50:00,0,1495,0,0,0,3849,0,0,CCU,BLR,1546.4372901474003,0,0,0,0,0,0,0,0,0,0,6,12,24,2,1,0,3,3,0,1,1,0,Kolkata_Banglore,2871,1,18,0,0,62.06437284872509,0.9667381985191927,1,0
Air India,3/03/2019,Delhi,Cochin,DEL → MAA → COK,06:05,09:25 04 Mar,27h 20m,1 stop,No info,14042,2019-03-03,06:05:00,09:25:00,0,1640,1,0,0,1752,0,0,DEL,COK,2047.882109458646,0,0,0,0,0,0,0,0,0,0,3,3,9,1,1,1,1,1,1,0,1,0,Delhi_Cochin,4537,0,28,1,0,74.92251619970656,0.8008273486179979,1,0
Jet Airways,24/05/2019,Banglore,Delhi,BLR → DEL,11:10,14:05,2h 55m,non-stop,In-flight meal not included,4030,2019-05-24,11:10:00,14:05:00,0,175,0,1,0,3849,0,0,BLR,DEL,1708.6520853536679,0,0,0,0,0,0,0,0,0,0,5,24,21,2,1,1,1,2,1,0,0,1,Banglore_Delhi,1265,1,7,0,1,585.8235721212576,0.10241991421195461,1,0
Jet Airways,6/06/2019,Kolkata,Banglore,CCU → BOM → BLR,18:55,12:00 07 Jun,17h 5m,1 stop,In-flight meal not included,10844,2019-06-06,18:55:00,12:00:00,0,1025,0,0,0,3849,0,0,CCU,BLR,1546.4372901474003,0,1,0,0,0,0,0,0,0,1,6,6,23,2,1,0,3,2,0,1,1,0,Kolkata_Banglore,2871,1,24,1,0,90.52315844765269,0.6628138150382425,1,0
IndiGo,6/05/2019,Kolkata,Banglore,CCU → BLR,21:25,00:05 07 May,2h 40m,non-stop,No info,4804,2019-05-06,21:25:00,00:05:00,0,160,0,0,1,2053,0,0,CCU,BLR,1546.4372901474003,0,0,0,0,0,0,0,0,0,0,5,6,19,2,1,1,3,0,0,1,0,1,Kolkata_Banglore,2871,1,25,1,0,579.913983805275,0.10346361990840859,1,0
Multiple carriers,27/05/2019,Delhi,Cochin,DEL → BOM → COK,17:30,01:30 28 May,8h,1 stop,In-flight meal not included,7308,2019-05-27,17:30:00,01:30:00,0,480,0,0,1,1196,0,0,DEL,COK,2047.882109458646,0,0,0,0,0,0,0,0,0,0,5,27,22,2,1,1,2,0,0,0,1,0,Delhi_Cochin,4537,0,4,0,1,255.98526368233078,0.23438849227843842,1,0
IndiGo,12/05/2019,Banglore,Delhi,BLR → DEL,16:55,19:55,3h,non-stop,No info,4823,2019-05-12,16:55:00,19:55:00,0,180,1,1,0,2053,0,0,BLR,DEL,1708.6520853536679,0,0,0,0,0,0,0,0,0,0,5,12,19,2,1,1,2,3,0,0,0,1,Banglore_Delhi,1265,1,19,0,0,569.5506951178893,0.10534619747515331,1,0
Jet Airways,24/06/2019,Delhi,Cochin,DEL → BOM → COK,09:00,12:35 25 Jun,27h 35m,1 stop,In-flight meal not included,10262,2019-06-24,09:00:00,12:35:00,0,1655,0,0,0,3849,0,0,DEL,COK,2047.882109458646,0,0,0,0,0,0,0,0,0,0,6,24,26,2,1,0,1,2,1,0,1,0,Delhi_Cochin,4537,0,6,0,1,74.24346016164276,0.808151989001699,1,0
Jet Airways,27/05/2019,Delhi,Cochin,DEL → BOM → COK,20:55,04:25 28 May,7h 30m,1 stop,In-flight meal not included,12898,2019-05-27,20:55:00,04:25:00,0,450,0,0,1,3849,0,0,DEL,COK,2047.882109458646,0,0,0,0,0,0,0,0,0,0,5,27,22,2,1,1,3,0,0,1,1,0,Delhi_Cochin,4537,0,4,0,1,273.0509479278195,0.219739211511036,1,0
Air India,12/03/2019,Banglore,New Delhi,BLR → BOM → JDH → DEL,17:25,16:20 13 Mar,22h 55m,2 stops,No info,12778,2019-03-12,17:25:00,16:20:00,0,1375,0,0,0,1752,0,0,BLR,DEL,1708.6520853536679,0,0,0,0,0,0,0,0,0,0,3,12,11,1,1,1,2,2,0,0,2,0,Banglore_New Delhi,932,0,19,0,0,74.55936372452369,0.8047278973796433,1,0
IndiGo,3/03/2019,Delhi,Cochin,DEL → BOM → COK,04:45,13:20,8h 35m,1 stop,No info,14871,2019-03-03,04:45:00,13:20:00,0,515,1,1,0,2053,0,0,DEL,COK,2047.882109458646,0,0,0,0,0,0,0,0,0,0,3,3,9,1,1,1,0,2,0,0,1,0,Delhi_Cochin,4537,0,28,1,0,238.5882069272209,0.2514793198404079,1,0
Air India,21/03/2019,Delhi,Cochin,DEL → UDR → BOM → COK,13:20,19:15 22 Mar,29h 55m,2 stops,No info,8708,2019-03-21,13:20:00,19:15:00,0,1795,0,0,0,1752,0,0,DEL,COK,2047.882109458646,0,0,0,0,1,0,0,0,0,1,3,21,12,1,1,1,2,3,0,0,2,0,Delhi_Cochin,4537,0,10,0,1,68.45288388162605,0.8765152992495769,1,0
Jet Airways,6/06/2019,Kolkata,Banglore,CCU → BOM → BLR,20:00,18:15 07 Jun,22h 15m,1 stop,In-flight meal not included,10844,2019-06-06,20:00:00,18:15:00,0,1335,0,0,0,3849,0,0,CCU,BLR,1546.4372901474003,0,1,0,0,0,0,0,0,0,1,6,6,23,2,1,0,3,3,0,1,1,0,Kolkata_Banglore,2871,1,24,1,0,69.50279955718653,0.8632745786107842,1,0
SpiceJet,6/03/2019,Mumbai,Hyderabad,BOM → HYD,05:45,07:05,1h 20m,non-stop,No info,4129,2019-03-06,05:45:00,07:05:00,0,80,0,1,0,818,0,0,BOM,HYD,622.9702752863186,0,0,0,0,0,0,0,0,0,0,3,6,10,1,1,1,0,1,0,0,0,1,Mumbai_Hyderabad,697,1,25,1,0,467.22770646473896,0.12841704199005613,0,0
IndiGo,18/05/2019,Kolkata,Banglore,CCU → BLR,21:25,00:05 19 May,2h 40m,non-stop,No info,4804,2019-05-18,21:25:00,00:05:00,0,160,1,0,1,2053,0,0,CCU,BLR,1546.4372901474003,0,0,0,0,0,0,0,0,0,0,5,18,20,2,1,1,3,0,0,1,0,1,Kolkata_Banglore,2871,1,13,0,0,579.913983805275,0.10346361990840859,1,0
Jet Airways,6/05/2019,Banglore,Delhi,BLR → DEL,08:20,11:20,3h,non-stop,No info,7229,2019-05-06,08:20:00,11:20:00,0,180,0,1,0,3849,0,0,BLR,DEL,1708.6520853536679,0,0,0,0,0,0,0,0,0,0,5,6,19,2,1,1,1,1,1,0,0,1,Banglore_Delhi,1265,1,25,1,0,569.5506951178893,0.10534619747515331,1,0
Jet Airways,21/03/2019,Banglore,New Delhi,BLR → BOM → DEL,07:00,19:10,12h 10m,1 stop,In-flight meal not included,7832,2019-03-21,07:00:00,19:10:00,0,730,0,1,0,3849,0,0,BLR,DEL,1708.6520853536679,0,0,0,0,1,0,0,0,0,1,3,21,12,1,1,1,1,3,1,0,1,0,Banglore_New Delhi,932,0,10,0,1,140.43715770030147,0.42723735642701066,1,0
SpiceJet,18/03/2019,Chennai,Kolkata,MAA → CCU,09:30,12:05,2h 35m,non-stop,No info,3859,2019-03-18,09:30:00,12:05:00,0,155,0,1,0,818,0,0,MAA,CCU,1385.198425287915,0,0,0,0,1,0,0,0,0,1,3,18,12,1,1,1,1,2,1,0,0,1,Chennai_Kolkata,381,1,13,0,0,536.2058420469348,0.11189732616667038,1,0
Multiple carriers,6/06/2019,Delhi,Cochin,DEL → BOM → COK,07:30,19:15,11h 45m,1 stop,No info,9001,2019-06-06,07:30:00,19:15:00,0,705,0,1,0,1196,0,0,DEL,COK,2047.882109458646,0,1,0,0,0,0,0,0,0,1,6,6,23,2,1,0,1,3,1,0,1,0,Delhi_Cochin,4537,0,24,1,0,174.2878391028635,0.3442580980339564,1,0
Vistara,9/05/2019,Banglore,Delhi,BLR → DEL,17:00,19:35,2h 35m,non-stop,No info,4878,2019-05-09,17:00:00,19:35:00,0,155,0,1,0,479,0,0,BLR,DEL,1708.6520853536679,0,0,0,0,0,0,0,0,0,0,5,9,19,2,1,1,2,3,0,0,0,1,Banglore_Delhi,1265,1,22,1,0,661.4137104594843,0.09071478115915979,1,0
IndiGo,3/05/2019,Mumbai,Hyderabad,BOM → HYD,02:35,04:05,1h 30m,non-stop,No info,2754,2019-05-03,02:35:00,04:05:00,0,90,0,1,1,2053,0,0,BOM,HYD,622.9702752863186,0,0,0,0,0,0,0,0,0,0,5,3,18,2,1,1,0,0,0,0,0,1,Mumbai_Hyderabad,697,1,28,1,0,415.3135168575457,0.14446917223881314,0,0
Vistara,27/06/2019,Banglore,Delhi,BLR → DEL,07:00,09:40,2h 40m,non-stop,No info,4668,2019-06-27,07:00:00,09:40:00,0,160,0,1,0,479,0,0,BLR,DEL,1708.6520853536679,0,0,0,0,0,0,0,0,0,0,6,27,26,2,1,0,1,1,1,0,0,1,Banglore_Delhi,1265,1,3,0,1,640.7445320076254,0.09364106442235849,1,0
Air Asia,12/05/2019,Kolkata,Banglore,CCU → BLR,10:20,12:55,2h 35m,non-stop,No info,5216,2019-05-12,10:20:00,12:55:00,0,155,1,1,0,319,0,0,CCU,BLR,1546.4372901474003,0,0,0,0,0,0,0,0,0,0,5,12,19,2,1,1,1,2,1,0,0,1,Kolkata_Banglore,2871,1,19,0,0,598.6208865086711,0.10023038178627082,1,0
Jet Airways,6/06/2019,Delhi,Cochin,DEL → JAI → BOM → COK,05:30,04:25 07 Jun,22h 55m,2 stops,In-flight meal not included,10368,2019-06-06,05:30:00,04:25:00,0,1375,0,0,1,3849,0,0,DEL,COK,2047.882109458646,0,1,0,0,0,0,0,0,0,1,6,6,23,2,1,0,0,0,0,0,2,0,Delhi_Cochin,4537,0,24,1,0,89.36212841274092,0.6714253685059434,1,0
IndiGo,9/03/2019,Delhi,Cochin,DEL → HYD → MAA → COK,06:40,21:20,14h 40m,2 stops,No info,8146,2019-03-09,06:40:00,21:20:00,0,880,1,1,0,2053,0,0,DEL,COK,2047.882109458646,0,0,0,0,0,0,0,0,0,0,3,9,10,1,1,1,1,3,1,0,2,0,Delhi_Cochin,4537,0,22,1,0,139.62832564490768,0.42971223584380375,1,0
Jet Airways,27/03/2019,Delhi,Cochin,DEL → BOM → COK,13:00,04:25 28 Mar,15h 25m,1 stop,No info,12242,2019-03-27,13:00:00,04:25:00,0,925,0,0,1,3849,0,0,DEL,COK,2047.882109458646,0,0,0,0,0,0,0,0,0,0,3,27,13,1,1,1,2,0,0,0,1,0,Delhi_Cochin,4537,0,4,0,1,132.83559628920946,0.45168615699490733,1,0
Jet Airways,15/03/2019,Banglore,New Delhi,BLR → BOM → DEL,08:00,15:15,7h 15m,1 stop,In-flight meal not included,9134,2019-03-15,08:00:00,15:15:00,0,435,0,1,0,3849,0,0,BLR,DEL,1708.6520853536679,0,0,0,0,1,0,0,0,0,1,3,15,11,1,1,1,1,2,1,0,1,0,Banglore_New Delhi,932,0,16,0,0,235.6761497039542,0.25458664389828717,1,0
Air India,6/06/2019,Delhi,Cochin,DEL → HYD → MAA → COK,13:15,09:25 07 Jun,20h 10m,2 stops,No info,10939,2019-06-06,13:15:00,09:25:00,0,1210,0,0,0,1752,0,0,DEL,COK,2047.882109458646,0,1,0,0,0,0,0,0,0,1,6,6,23,2,1,0,2,1,0,0,2,0,Delhi_Cochin,4537,0,24,1,0,101.54787319629649,0.5908543242852301,1,0
Air India,6/06/2019,Delhi,Cochin,DEL → GOI → BOM → COK,10:55,07:40 07 Jun,20h 45m,2 stops,No info,11753,2019-06-06,10:55:00,07:40:00,0,1245,0,0,0,1752,0,0,DEL,COK,2047.882109458646,0,1,0,0,0,0,0,0,0,1,6,6,23,2,1,0,1,1,1,0,2,0,Delhi_Cochin,4537,0,24,1,0,98.6931137088504,0.6079451518471995,1,0
SpiceJet,24/04/2019,Kolkata,Banglore,CCU → BLR,17:10,19:40,2h 30m,non-stop,No info,4174,2019-04-24,17:10:00,19:40:00,0,150,0,1,0,818,0,0,CCU,BLR,1546.4372901474003,0,0,0,0,0,0,0,0,0,0,4,24,17,2,1,1,2,3,0,0,0,1,Kolkata_Banglore,2871,1,6,0,1,618.5749160589601,0.09699714366413306,1,0
Jet Airways,21/05/2019,Kolkata,Banglore,CCU → BOM → BLR,20:00,19:50 22 May,23h 50m,1 stop,In-flight meal not included,10844,2019-05-21,20:00:00,19:50:00,0,1430,0,0,0,3849,0,0,CCU,BLR,1546.4372901474003,0,0,0,0,0,0,0,0,0,0,5,21,21,2,1,1,3,3,0,1,1,0,Kolkata_Banglore,2871,1,10,0,1,64.88548070548532,0.9247061029314018,1,0
Jet Airways,3/06/2019,Delhi,Cochin,DEL → BOM → COK,16:00,19:00 04 Jun,27h,1 stop,No info,14714,2019-06-03,16:00:00,19:00:00,0,1620,0,0,0,3849,0,0,DEL,COK,2047.882109458646,0,1,0,0,0,0,0,0,0,1,6,3,23,2,1,0,2,3,0,0,1,0,Delhi_Cochin,4537,0,27,1,0,75.84748553550541,0.7910611614397296,1,0
Jet Airways,12/06/2019,Kolkata,Banglore,CCU → BOM → BLR,06:30,12:00,5h 30m,1 stop,In-flight meal not included,9899,2019-06-12,06:30:00,12:00:00,0,330,0,1,0,3849,0,0,CCU,BLR,1546.4372901474003,0,0,0,0,0,0,0,0,0,0,6,12,24,2,1,0,1,2,1,0,1,0,Kolkata_Banglore,2871,1,18,0,0,281.17041639043646,0.21339371606109273,1,0
IndiGo,3/03/2019,Delhi,Cochin,DEL → BOM → COK,09:10,21:00,11h 50m,1 stop,No info,14871,2019-03-03,09:10:00,21:00:00,0,710,1,1,0,2053,0,0,DEL,COK,2047.882109458646,0,0,0,0,0,0,0,0,0,0,3,3,9,1,1,1,1,3,1,0,1,0,Delhi_Cochin,4537,0,28,1,0,173.06045995425177,0.34669964482852345,1,0
IndiGo,6/03/2019,Chennai,Kolkata,MAA → CCU,13:20,15:35,2h 15m,non-stop,No info,7295,2019-03-06,13:20:00,15:35:00,0,135,0,1,0,2053,0,0,MAA,CCU,1385.198425287915,0,0,0,0,0,0,0,0,0,0,3,6,10,1,1,1,2,2,0,0,0,1,Chennai_Kolkata,381,1,25,1,0,615.6437445724066,0.09745896150000323,1,0
Air India,6/06/2019,Delhi,Cochin,DEL → JAI → BOM → COK,18:45,19:15 07 Jun,24h 30m,2 stops,No info,13465,2019-06-06,18:45:00,19:15:00,0,1470,0,0,0,1752,0,0,DEL,COK,2047.882109458646,0,1,0,0,0,0,0,0,0,1,6,6,23,2,1,0,3,3,0,1,2,0,Delhi_Cochin,4537,0,24,1,0,83.58702487586311,0.7178147576027176,1,0
SpiceJet,21/05/2019,Chennai,Kolkata,MAA → CCU,17:45,20:05,2h 20m,non-stop,No check-in baggage included,3543,2019-05-21,17:45:00,20:05:00,0,140,0,1,0,818,0,0,MAA,CCU,1385.198425287915,0,0,0,0,0,0,0,0,0,0,5,21,21,2,1,1,2,3,0,0,0,1,Chennai_Kolkata,381,1,10,0,1,593.656467980535,0.10106855266667002,1,0
Multiple carriers,27/06/2019,Delhi,Cochin,DEL → BOM → COK,19:00,01:30 28 Jun,6h 30m,1 stop,No info,7198,2019-06-27,19:00:00,01:30:00,0,390,0,0,1,1196,0,0,DEL,COK,2047.882109458646,0,0,0,0,0,0,0,0,0,0,6,27,26,2,1,0,3,0,0,1,1,0,Delhi_Cochin,4537,0,3,0,1,315.0587860705609,0.1904406499762312,1,0
Jet Airways,1/06/2019,Delhi,Cochin,DEL → BOM → COK,08:00,04:25 02 Jun,20h 25m,1 stop,In-flight meal not included,10262,2019-06-01,08:00:00,04:25:00,0,1225,1,0,1,3849,0,0,DEL,COK,2047.882109458646,0,1,0,0,0,0,0,0,0,1,6,1,22,2,1,0,1,0,1,0,1,0,Delhi_Cochin,4537,0,29,1,0,100.30442985103572,0.5981789646689314,1,0
IndiGo,15/03/2019,Kolkata,Banglore,CCU → BLR,15:20,17:55,2h 35m,non-stop,No info,4148,2019-03-15,15:20:00,17:55:00,0,155,0,1,0,2053,0,0,CCU,BLR,1546.4372901474003,0,0,0,0,1,0,0,0,0,1,3,15,11,1,1,1,2,2,0,0,0,1,Kolkata_Banglore,2871,1,16,0,0,598.6208865086711,0.10023038178627082,1,0
Jet Airways,27/06/2019,Banglore,Delhi,BLR → DEL,15:15,18:10,2h 55m,non-stop,No info,8016,2019-06-27,15:15:00,18:10:00,0,175,0,1,0,3849,0,0,BLR,DEL,1708.6520853536679,0,0,0,0,0,0,0,0,0,0,6,27,26,2,1,0,2,3,0,0,0,1,Banglore_Delhi,1265,1,3,0,1,585.8235721212576,0.10241991421195461,1,0
Jet Airways,9/06/2019,Delhi,Cochin,DEL → BOM → COK,22:50,04:25 10 Jun,5h 35m,1 stop,In-flight meal not included,10262,2019-06-09,22:50:00,04:25:00,0,335,1,0,1,3849,0,0,DEL,COK,2047.882109458646,0,1,0,0,0,0,0,0,0,1,6,9,23,2,1,0,3,0,0,1,1,0,Delhi_Cochin,4537,0,21,1,0,366.78485542542916,0.16358363523599348,1,0
SpiceJet,15/06/2019,Kolkata,Banglore,CCU → BLR,14:55,17:25,2h 30m,non-stop,No check-in baggage included,3841,2019-06-15,14:55:00,17:25:00,0,150,1,1,0,818,0,0,CCU,BLR,1546.4372901474003,0,0,0,0,0,0,0,0,0,0,6,15,24,2,1,0,2,2,0,0,0,1,Kolkata_Banglore,2871,1,15,0,0,618.5749160589601,0.09699714366413306,1,0
Jet Airways,12/03/2019,Banglore,New Delhi,BLR → MAA → DEL,09:45,00:30 13 Mar,14h 45m,1 stop,No info,11507,2019-03-12,09:45:00,00:30:00,0,885,0,0,1,3849,0,0,BLR,DEL,1708.6520853536679,0,0,0,0,0,0,0,0,0,0,3,12,11,1,1,1,1,0,1,0,1,0,Banglore_New Delhi,932,0,19,0,0,115.84081934601137,0.5179521375861704,1,0
Jet Airways,1/05/2019,Kolkata,Banglore,CCU → BOM → BLR,08:25,20:45,12h 20m,1 stop,No info,14781,2019-05-01,08:25:00,20:45:00,0,740,0,1,0,3849,0,0,CCU,BLR,1546.4372901474003,0,0,0,0,0,0,0,0,0,0,5,1,18,2,1,1,1,3,1,0,1,0,Kolkata_Banglore,2871,1,30,1,0,125.38680730924868,0.47851924207638974,1,0
Jet Airways,27/05/2019,Delhi,Cochin,DEL → BOM → COK,17:30,19:00 28 May,25h 30m,1 stop,No info,16079,2019-05-27,17:30:00,19:00:00,0,1530,0,0,0,3849,0,0,DEL,COK,2047.882109458646,0,0,0,0,0,0,0,0,0,0,5,27,22,2,1,1,2,3,0,0,1,0,Delhi_Cochin,4537,0,4,0,1,80.3091023317116,0.7471133191375224,1,0
Jet Airways,27/05/2019,Delhi,Cochin,DEL → BOM → COK,22:50,04:25 28 May,5h 35m,1 stop,In-flight meal not included,12898,2019-05-27,22:50:00,04:25:00,0,335,0,0,1,3849,0,0,DEL,COK,2047.882109458646,0,0,0,0,0,0,0,0,0,0,5,27,22,2,1,1,3,0,0,1,1,0,Delhi_Cochin,4537,0,4,0,1,366.78485542542916,0.16358363523599348,1,0
Multiple carriers,6/03/2019,Delhi,Cochin,DEL → BOM → COK,07:30,19:15,11h 45m,1 stop,No info,15353,2019-03-06,07:30:00,19:15:00,0,705,0,1,0,1196,0,0,DEL,COK,2047.882109458646,0,0,0,0,0,0,0,0,0,0,3,6,10,1,1,1,1,3,1,0,1,0,Delhi_Cochin,4537,0,25,1,0,174.2878391028635,0.3442580980339564,1,0
IndiGo,24/03/2019,Banglore,New Delhi,BLR → DEL,18:25,21:20,2h 55m,non-stop,No info,7303,2019-03-24,18:25:00,21:20:00,0,175,1,1,0,2053,0,0,BLR,DEL,1708.6520853536679,0,0,0,0,1,0,0,0,0,1,3,24,12,1,1,1,3,3,0,1,0,1,Banglore_New Delhi,932,0,7,0,1,585.8235721212576,0.10241991421195461,1,0
SpiceJet,24/03/2019,Kolkata,Banglore,CCU → MAA → BLR,15:05,20:45,5h 40m,1 stop,No info,6197,2019-03-24,15:05:00,20:45:00,0,340,1,1,0,818,0,0,CCU,BLR,1546.4372901474003,0,0,0,0,1,0,0,0,0,1,3,24,12,1,1,1,2,3,0,0,1,0,Kolkata_Banglore,2871,1,7,0,1,272.90069826130593,0.21986019230536827,1,0
Air India,9/06/2019,Kolkata,Banglore,CCU → BBI → BLR,09:10,13:15,4h 5m,1 stop,No info,8996,2019-06-09,09:10:00,13:15:00,0,245,1,1,0,1752,0,0,CCU,BLR,1546.4372901474003,0,1,0,0,0,0,0,0,0,1,6,9,23,2,1,0,1,2,1,0,1,0,Kolkata_Banglore,2871,1,21,1,0,378.71933636262867,0.15842866798475067,1,0
IndiGo,21/03/2019,Delhi,Cochin,DEL → HYD → COK,14:20,22:20,8h,1 stop,No info,6528,2019-03-21,14:20:00,22:20:00,0,480,0,1,0,2053,0,0,DEL,COK,2047.882109458646,0,0,0,0,1,0,0,0,0,1,3,21,12,1,1,1,2,3,0,0,1,0,Delhi_Cochin,4537,0,10,0,1,255.98526368233078,0.23438849227843842,1,0
GoAir,9/04/2019,Banglore,Delhi,BLR → DEL,20:55,23:40,2h 45m,non-stop,No info,4239,2019-04-09,20:55:00,23:40:00,0,165,0,1,0,194,0,0,BLR,DEL,1708.6520853536679,0,0,0,0,0,0,0,0,0,0,4,9,15,2,1,1,3,3,0,1,0,1,Banglore_Delhi,1265,1,21,1,0,621.3280310376974,0.09656734768555719,1,0
IndiGo,12/03/2019,Kolkata,Banglore,CCU → BLR,20:25,23:05,2h 40m,non-stop,No info,4148,2019-03-12,20:25:00,23:05:00,0,160,0,1,0,2053,0,0,CCU,BLR,1546.4372901474003,0,0,0,0,0,0,0,0,0,0,3,12,11,1,1,1,3,3,0,1,0,1,Kolkata_Banglore,2871,1,19,0,0,579.913983805275,0.10346361990840859,1,0
SpiceJet,24/05/2019,Banglore,Delhi,BLR → DEL,21:10,00:05 25 May,2h 55m,non-stop,No info,3971,2019-05-24,21:10:00,00:05:00,0,175,0,0,1,818,0,0,BLR,DEL,1708.6520853536679,0,0,0,0,0,0,0,0,0,0,5,24,21,2,1,1,3,0,0,1,0,1,Banglore_Delhi,1265,1,7,0,1,585.8235721212576,0.10241991421195461,1,0
Air Asia,6/05/2019,Kolkata,Banglore,CCU → DEL → BLR,07:35,23:30,15h 55m,1 stop,No info,5192,2019-05-06,07:35:00,23:30:00,0,955,0,1,0,319,0,0,CCU,BLR,1546.4372901474003,0,0,0,0,0,0,0,0,0,0,5,6,19,2,1,1,1,3,1,0,1,0,Kolkata_Banglore,2871,1,25,1,0,97.15836377889426,0.6175484813283137,1,0
Jet Airways,9/04/2019,Delhi,Cochin,DEL → AMD → BOM → COK,13:25,12:35 10 Apr,23h 10m,2 stops,No info,9483,2019-04-09,13:25:00,12:35:00,0,1390,0,0,0,3849,0,0,DEL,COK,2047.882109458646,0,0,0,0,0,0,0,0,0,0,4,9,15,2,1,1,2,2,0,0,2,0,Delhi_Cochin,4537,0,21,1,0,88.39778889749552,0.6787500088896445,1,0
Jet Airways,3/06/2019,Delhi,Cochin,DEL → JDH → BOM → COK,11:40,19:00,7h 20m,2 stops,No info,18804,2019-06-03,11:40:00,19:00:00,0,440,0,1,0,3849,0,0,DEL,COK,2047.882109458646,0,1,0,0,0,0,0,0,0,1,6,3,23,2,1,0,1,3,1,0,2,0,Delhi_Cochin,4537,0,27,1,0,279.25665128981535,0.21485611792190187,1,0
Air India,18/06/2019,Delhi,Cochin,DEL → COK,05:10,08:00,2h 50m,non-stop,No info,5201,2019-06-18,05:10:00,08:00:00,0,170,0,1,0,1752,0,0,DEL,COK,2047.882109458646,0,0,0,0,0,0,0,0,0,0,6,18,25,2,1,0,0,1,0,0,0,1,Delhi_Cochin,4537,0,12,0,0,722.7819209854044,0.08301259101528027,1,0
Jet Airways,27/05/2019,Delhi,Cochin,DEL → BOM → COK,11:30,19:00,7h 30m,1 stop,No info,16079,2019-05-27,11:30:00,19:00:00,0,450,0,1,0,3849,0,0,DEL,COK,2047.882109458646,0,0,0,0,0,0,0,0,0,0,5,27,22,2,1,1,1,3,1,0,1,0,Delhi_Cochin,4537,0,4,0,1,273.0509479278195,0.219739211511036,1,0
Jet Airways,15/06/2019,Banglore,Delhi,BLR → DEL,19:50,22:50,3h,non-stop,In-flight meal not included,7229,2019-06-15,19:50:00,22:50:00,0,180,1,1,0,3849,0,0,BLR,DEL,1708.6520853536679,0,0,0,0,0,0,0,0,0,0,6,15,24,2,1,0,3,3,0,1,0,1,Banglore_Delhi,1265,1,15,0,0,569.5506951178893,0.10534619747515331,1,0
Multiple carriers,27/05/2019,Delhi,Cochin,DEL → BOM → COK,17:45,01:30 28 May,7h 45m,1 stop,No info,6795,2019-05-27,17:45:00,01:30:00,0,465,0,0,1,1196,0,0,DEL,COK,2047.882109458646,0,0,0,0,0,0,0,0,0,0,5,27,22,2,1,1,2,0,0,0,1,0,Delhi_Cochin,4537,0,4,0,1,264.2428528333737,0.2270638518947372,1,0
Jet Airways,9/05/2019,Kolkata,Banglore,CCU → DEL → BLR,09:35,10:55 10 May,25h 20m,1 stop,No info,10953,2019-05-09,09:35:00,10:55:00,0,1520,0,0,0,3849,0,0,CCU,BLR,1546.4372901474003,0,0,0,0,0,0,0,0,0,0,5,9,19,2,1,1,1,1,1,0,1,0,Kolkata_Banglore,2871,1,22,1,0,61.04357724266053,0.9829043891298817,1,0
Multiple carriers,24/06/2019,Delhi,Cochin,DEL → IDR → BOM → COK,15:05,01:30 25 Jun,10h 25m,2 stops,No info,15965,2019-06-24,15:05:00,01:30:00,0,625,0,0,1,1196,0,0,DEL,COK,2047.882109458646,0,0,0,0,0,0,0,0,0,0,6,24,26,2,1,0,2,0,0,0,2,0,Delhi_Cochin,4537,0,6,0,1,196.59668250803003,0.3051933493208833,1,0
Air India,9/04/2019,Delhi,Cochin,DEL → JDH → BOM → COK,12:55,19:15 10 Apr,30h 20m,2 stops,No info,9968,2019-04-09,12:55:00,19:15:00,0,1820,0,0,0,1752,0,0,DEL,COK,2047.882109458646,0,0,0,0,0,0,0,0,0,0,4,9,15,2,1,1,2,3,0,0,2,0,Delhi_Cochin,4537,0,21,1,0,67.51259701512019,0.8887230332224123,1,0
IndiGo,6/06/2019,Kolkata,Banglore,CCU → BLR,22:15,00:50 07 Jun,2h 35m,non-stop,No info,4804,2019-06-06,22:15:00,00:50:00,0,155,0,0,1,2053,0,0,CCU,BLR,1546.4372901474003,0,1,0,0,0,0,0,0,0,1,6,6,23,2,1,0,3,0,0,1,0,1,Kolkata_Banglore,2871,1,24,1,0,598.6208865086711,0.10023038178627082,1,0
Jet Airways,27/05/2019,Delhi,Cochin,DEL → BOM → COK,10:00,19:00,9h,1 stop,No info,16079,2019-05-27,10:00:00,19:00:00,0,540,0,1,0,3849,0,0,DEL,COK,2047.882109458646,0,0,0,0,0,0,0,0,0,0,5,27,22,2,1,1,1,3,1,0,1,0,Delhi_Cochin,4537,0,4,0,1,227.54245660651623,0.2636870538132432,1,0
Jet Airways,12/06/2019,Delhi,Cochin,DEL → IDR → BOM → COK,21:25,12:35 13 Jun,15h 10m,2 stops,In-flight meal not included,11507,2019-06-12,21:25:00,12:35:00,0,910,0,0,1,3849,0,0,DEL,COK,2047.882109458646,0,0,0,0,0,0,0,0,0,0,6,12,24,2,1,0,3,2,0,1,2,0,Delhi_Cochin,4537,0,18,0,0,135.02519403024039,0.44436151661120615,1,0
Air India,9/06/2019,Kolkata,Banglore,CCU → BOM → COK → BLR,09:25,13:45 10 Jun,28h 20m,2 stops,No info,11542,2019-06-09,09:25:00,13:45:00,0,1700,1,0,0,1752,0,0,CCU,BLR,1546.4372901474003,0,1,0,0,0,0,0,0,0,1,6,9,23,2,1,0,1,2,1,0,2,0,Kolkata_Banglore,2871,1,21,1,0,54.58013965226119,1.0993009615268412,1,0
Jet Airways,24/04/2019,Banglore,Delhi,BLR → DEL,17:45,20:45,3h,non-stop,No info,7229,2019-04-24,17:45:00,20:45:00,0,180,0,1,0,3849,0,0,BLR,DEL,1708.6520853536679,0,0,0,0,0,0,0,0,0,0,4,24,17,2,1,1,2,3,0,0,0,1,Banglore_Delhi,1265,1,6,0,1,569.5506951178893,0.10534619747515331,1,0
Jet Airways,27/04/2019,Banglore,Delhi,BLR → DEL,06:00,08:45,2h 45m,non-stop,In-flight meal not included,4544,2019-04-27,06:00:00,08:45:00,0,165,1,1,0,3849,0,0,BLR,DEL,1708.6520853536679,0,0,0,0,0,0,0,0,0,0,4,27,17,2,1,1,1,1,1,0,0,1,Banglore_Delhi,1265,1,3,0,1,621.3280310376974,0.09656734768555719,1,0
IndiGo,15/05/2019,Delhi,Cochin,DEL → BLR → COK,05:10,10:05,4h 55m,1 stop,No info,6496,2019-05-15,05:10:00,10:05:00,0,295,0,1,0,2053,0,0,DEL,COK,2047.882109458646,0,0,0,0,0,0,0,0,0,0,5,15,20,2,1,1,0,1,0,0,1,0,Delhi_Cochin,4537,0,16,0,0,416.5183951441314,0.14405126087945694,1,0
IndiGo,15/06/2019,Kolkata,Banglore,CCU → BLR,21:25,00:05 16 Jun,2h 40m,non-stop,No info,4804,2019-06-15,21:25:00,00:05:00,0,160,1,0,1,2053,0,0,CCU,BLR,1546.4372901474003,0,0,0,0,0,0,0,0,0,0,6,15,24,2,1,0,3,0,0,1,0,1,Kolkata_Banglore,2871,1,15,0,0,579.913983805275,0.10346361990840859,1,0
Air India,01/03/2019,Banglore,New Delhi,BLR → CCU → DEL,11:05,09:15 02 Mar,22h 10m,1 stop,No info,13439,2019-03-01,11:05:00,09:15:00,0,1330,0,0,0,1752,0,0,BLR,DEL,1708.6520853536679,0,0,0,0,0,0,0,0,0,0,3,1,9,1,1,1,1,1,1,0,1,0,Banglore_New Delhi,932,0,30,1,0,77.08204896332336,0.778391348010855,1,0
Jet Airways,27/03/2019,Delhi,Cochin,DEL → BOM → COK,18:15,04:25 28 Mar,10h 10m,1 stop,In-flight meal not included,6540,2019-03-27,18:15:00,04:25:00,0,610,0,0,1,3849,0,0,DEL,COK,2047.882109458646,0,0,0,0,0,0,0,0,0,0,3,27,13,1,1,1,3,0,0,1,1,0,Delhi_Cochin,4537,0,4,0,1,201.4310271598668,0.29786870893718215,1,0
IndiGo,1/06/2019,Banglore,Delhi,BLR → DEL,23:30,02:20 02 Jun,2h 50m,non-stop,No info,4591,2019-06-01,23:30:00,02:20:00,0,170,1,0,1,2053,0,0,BLR,DEL,1708.6520853536679,0,1,0,0,0,0,0,0,0,1,6,1,22,2,1,0,3,0,0,1,0,1,Banglore_Delhi,1265,1,29,1,0,603.0536771836476,0.0994936309487559,1,0
IndiGo,18/03/2019,Banglore,New Delhi,BLR → HYD → DEL,16:15,20:35,4h 20m,1 stop,No info,4437,2019-03-18,16:15:00,20:35:00,0,260,0,1,0,2053,0,0,BLR,DEL,1708.6520853536679,0,0,0,0,1,0,0,0,0,1,3,18,12,1,1,1,2,3,0,0,1,0,Banglore_New Delhi,932,0,13,0,0,394.304327389308,0.15216672968633255,1,0
Air Asia,21/03/2019,Delhi,Cochin,DEL → BLR → COK,20:10,07:10 22 Mar,11h,1 stop,No info,6151,2019-03-21,20:10:00,07:10:00,0,660,0,0,0,319,0,0,DEL,COK,2047.882109458646,0,0,0,0,1,0,0,0,0,1,3,21,12,1,1,1,3,1,0,1,1,0,Delhi_Cochin,4537,0,10,0,1,186.1711008598769,0.3222841768828528,1,0
Jet Airways,21/06/2019,Banglore,Delhi,BLR → DEL,17:45,20:45,3h,non-stop,In-flight meal not included,7754,2019-06-21,17:45:00,20:45:00,0,180,0,1,0,3849,0,0,BLR,DEL,1708.6520853536679,0,0,0,0,0,0,0,0,0,0,6,21,25,2,1,0,2,3,0,0,0,1,Banglore_Delhi,1265,1,9,0,1,569.5506951178893,0.10534619747515331,1,0
Jet Airways,24/06/2019,Delhi,Cochin,DEL → BOM → COK,14:00,12:35 25 Jun,22h 35m,1 stop,In-flight meal not included,10262,2019-06-24,14:00:00,12:35:00,0,1355,0,0,0,3849,0,0,DEL,COK,2047.882109458646,0,0,0,0,0,0,0,0,0,0,6,24,26,2,1,0,2,2,0,0,1,0,Delhi_Cochin,4537,0,6,0,1,90.68112661809502,0.6616591813276751,1,0
Jet Airways,9/06/2019,Banglore,Delhi,BLR → DEL,18:55,22:00,3h 5m,non-stop,No info,8016,2019-06-09,18:55:00,22:00:00,0,185,1,1,0,3849,0,0,BLR,DEL,1708.6520853536679,0,1,0,0,0,0,0,0,0,1,6,9,23,2,1,0,3,3,0,1,0,1,Banglore_Delhi,1265,1,21,1,0,554.157433087676,0.10827248073835201,1,0
SpiceJet,24/03/2019,Kolkata,Banglore,CCU → BLR,06:55,09:35,2h 40m,non-stop,No check-in baggage included,4781,2019-03-24,06:55:00,09:35:00,0,160,1,1,0,818,0,0,CCU,BLR,1546.4372901474003,0,0,0,0,1,0,0,0,0,1,3,24,12,1,1,1,1,1,1,0,0,1,Kolkata_Banglore,2871,1,7,0,1,579.913983805275,0.10346361990840859,1,0
Vistara,27/06/2019,Banglore,Delhi,BLR → DEL,11:30,14:20,2h 50m,non-stop,No info,4668,2019-06-27,11:30:00,14:20:00,0,170,0,1,0,479,0,0,BLR,DEL,1708.6520853536679,0,0,0,0,0,0,0,0,0,0,6,27,26,2,1,0,1,2,1,0,0,1,Banglore_Delhi,1265,1,3,0,1,603.0536771836476,0.0994936309487559,1,0
Air India,06/03/2019,Banglore,New Delhi,BLR → MAA → DEL,11:50,08:55 07 Mar,21h 5m,1 stop,No info,14594,2019-03-06,11:50:00,08:55:00,0,1265,0,0,0,1752,0,0,BLR,DEL,1708.6520853536679,0,0,0,0,0,0,0,0,0,0,3,6,10,1,1,1,1,1,1,0,1,0,Banglore_New Delhi,932,0,25,1,0,81.04278665709096,0.7403496655892718,1,0
Jet Airways,24/03/2019,Kolkata,Banglore,CCU → BOM → BLR,16:55,04:45 25 Mar,11h 50m,1 stop,No info,14231,2019-03-24,16:55:00,04:45:00,0,710,1,0,1,3849,0,0,CCU,BLR,1546.4372901474003,0,0,0,0,1,0,0,0,0,1,3,24,12,1,1,1,2,0,0,0,1,0,Kolkata_Banglore,2871,1,7,0,1,130.68484142090708,0.4591198133435631,1,0
Air India,15/05/2019,Delhi,Cochin,DEL → TRV → COK,05:15,06:50 16 May,25h 35m,1 stop,No info,8425,2019-05-15,05:15:00,06:50:00,0,1535,0,0,1,1752,0,0,DEL,COK,2047.882109458646,0,0,0,0,0,0,0,0,0,0,5,15,20,2,1,1,0,1,0,0,1,0,Delhi_Cochin,4537,0,16,0,0,80.04750916450735,0.7495548659320894,1,0
Multiple carriers,12/06/2019,Delhi,Cochin,DEL → HYD → COK,07:05,22:30,15h 25m,1 stop,No info,9646,2019-06-12,07:05:00,22:30:00,0,925,0,1,0,1196,0,0,DEL,COK,2047.882109458646,0,0,0,0,0,0,0,0,0,0,6,12,24,2,1,0,1,3,1,0,1,0,Delhi_Cochin,4537,0,18,0,0,132.83559628920946,0.45168615699490733,1,0
IndiGo,3/03/2019,Chennai,Kolkata,MAA → CCU,14:40,17:05,2h 25m,non-stop,No info,7295,2019-03-03,14:40:00,17:05:00,0,145,1,1,0,2053,0,0,MAA,CCU,1385.198425287915,0,0,0,0,0,0,0,0,0,0,3,3,9,1,1,1,2,2,0,0,0,1,Chennai_Kolkata,381,1,28,1,0,573.1855552915509,0.1046781438333368,1,0
Air Asia,9/04/2019,Kolkata,Banglore,CCU → BBI → BLR,06:50,10:30,3h 40m,1 stop,No info,5162,2019-04-09,06:50:00,10:30:00,0,220,0,1,0,319,0,0,CCU,BLR,1546.4372901474003,0,0,0,0,0,0,0,0,0,0,4,9,15,2,1,1,1,1,1,0,1,0,Kolkata_Banglore,2871,1,21,1,0,421.75562458565463,0.1422624773740618,1,0
IndiGo,09/03/2019,Banglore,New Delhi,BLR → DEL,18:25,21:20,2h 55m,non-stop,No info,6860,2019-03-09,18:25:00,21:20:00,0,175,1,1,0,2053,0,0,BLR,DEL,1708.6520853536679,0,0,0,0,0,0,0,0,0,0,3,9,10,1,1,1,3,3,0,1,0,1,Banglore_New Delhi,932,0,22,1,0,585.8235721212576,0.10241991421195461,1,0
Vistara,15/04/2019,Delhi,Cochin,DEL → COK,06:00,09:10,3h 10m,non-stop,No info,6216,2019-04-15,06:00:00,09:10:00,0,190,0,1,0,479,0,0,DEL,COK,2047.882109458646,0,0,0,0,0,0,0,0,0,0,4,15,16,2,1,1,1,1,1,0,0,1,Delhi_Cochin,4537,0,15,0,0,646.6996135132566,0.09277877819354853,1,0
Air Asia,24/05/2019,Kolkata,Banglore,CCU → DEL → BLR,07:35,19:25,11h 50m,1 stop,No info,5192,2019-05-24,07:35:00,19:25:00,0,710,0,1,0,319,0,0,CCU,BLR,1546.4372901474003,0,0,0,0,0,0,0,0,0,0,5,24,21,2,1,1,1,3,1,0,1,0,Kolkata_Banglore,2871,1,7,0,1,130.68484142090708,0.4591198133435631,1,0
IndiGo,9/04/2019,Banglore,Delhi,BLR → DEL,20:00,22:50,2h 50m,non-stop,No info,4823,2019-04-09,20:00:00,22:50:00,0,170,0,1,0,2053,0,0,BLR,DEL,1708.6520853536679,0,0,0,0,0,0,0,0,0,0,4,9,15,2,1,1,3,3,0,1,0,1,Banglore_Delhi,1265,1,21,1,0,603.0536771836476,0.0994936309487559,1,0
SpiceJet,3/04/2019,Banglore,Delhi,BLR → DEL,09:30,12:20,2h 50m,non-stop,No check-in baggage included,3919,2019-04-03,09:30:00,12:20:00,0,170,0,1,0,818,0,0,BLR,DEL,1708.6520853536679,0,0,0,0,0,0,0,0,0,0,4,3,14,2,1,1,1,2,1,0,0,1,Banglore_Delhi,1265,1,27,1,0,603.0536771836476,0.0994936309487559,1,0
IndiGo,3/06/2019,Mumbai,Hyderabad,BOM → HYD,19:05,20:35,1h 30m,non-stop,No info,2754,2019-06-03,19:05:00,20:35:00,0,90,0,1,0,2053,0,0,BOM,HYD,622.9702752863186,0,1,0,0,0,0,0,0,0,1,6,3,23,2,1,0,3,3,0,1,0,1,Mumbai_Hyderabad,697,1,27,1,0,415.3135168575457,0.14446917223881314,0,0
Multiple carriers,9/05/2019,Delhi,Cochin,DEL → BOM → COK,07:30,19:00,11h 30m,1 stop,No info,9315,2019-05-09,07:30:00,19:00:00,0,690,0,1,0,1196,0,0,DEL,COK,2047.882109458646,0,0,0,0,0,0,0,0,0,0,5,9,19,2,1,1,1,3,1,0,1,0,Delhi_Cochin,4537,0,22,1,0,178.07670517031704,0.3369334576502552,1,0
Multiple carriers,27/03/2019,Delhi,Cochin,DEL → BOM → COK,10:00,18:50,8h 50m,1 stop,No info,11667,2019-03-27,10:00:00,18:50:00,0,530,0,1,0,1196,0,0,DEL,COK,2047.882109458646,0,0,0,0,0,0,0,0,0,0,3,27,13,1,1,1,1,3,1,0,1,0,Delhi_Cochin,4537,0,4,0,1,231.83571050475237,0.25880396022410906,1,0
Jet Airways,12/06/2019,Kolkata,Banglore,CCU → BOM → BLR,08:25,04:40 13 Jun,20h 15m,1 stop,In-flight meal not included,6224,2019-06-12,08:25:00,04:40:00,0,1215,0,0,1,3849,0,0,CCU,BLR,1546.4372901474003,0,0,0,0,0,0,0,0,0,0,6,12,24,2,1,0,1,0,1,0,1,0,Kolkata_Banglore,2871,1,18,0,0,76.36727358752594,0.7856768636794778,1,0
Air India,24/03/2019,Kolkata,Banglore,CCU → BOM → GOI → BLR,09:25,05:35 25 Mar,20h 10m,2 stops,No info,13349,2019-03-24,09:25:00,05:35:00,0,1210,1,0,1,1752,0,0,CCU,BLR,1546.4372901474003,0,0,0,0,1,0,0,0,0,1,3,24,12,1,1,1,1,0,1,0,2,0,Kolkata_Banglore,2871,1,7,0,1,76.68284083375538,0.7824436255573399,1,0
Jet Airways,18/03/2019,Banglore,New Delhi,BLR → BOM → DEL,16:55,09:00 16 Mar,16h 5m,1 stop,In-flight meal not included,11087,2019-03-18,16:55:00,09:00:00,0,965,0,0,0,3849,0,0,BLR,DEL,1708.6520853536679,0,0,0,0,1,0,0,0,0,1,3,18,12,1,1,1,2,1,0,0,1,0,Banglore_New Delhi,932,0,13,0,0,106.23743535877728,0.5647726697973496,1,0
Multiple carriers,6/03/2019,Delhi,Cochin,DEL → BOM → COK,13:00,01:35 07 Mar,12h 35m,1 stop,No info,15603,2019-03-06,13:00:00,01:35:00,0,755,0,0,1,1196,0,0,DEL,COK,2047.882109458646,0,0,0,0,0,0,0,0,0,0,3,6,10,1,1,1,2,0,0,0,1,0,Delhi_Cochin,4537,0,25,1,0,162.74559810267385,0.3686735659796271,1,0
Jet Airways,9/05/2019,Delhi,Cochin,DEL → JAI → BOM → COK,19:30,12:35 10 May,17h 5m,2 stops,No info,15129,2019-05-09,19:30:00,12:35:00,0,1025,0,0,0,3849,0,0,DEL,COK,2047.882109458646,0,0,0,0,0,0,0,0,0,0,5,9,19,2,1,1,3,2,0,1,2,0,Delhi_Cochin,4537,0,22,1,0,119.87602591953049,0.5005170928862487,1,0
IndiGo,9/04/2019,Banglore,Delhi,BLR → DEL,16:55,19:55,3h,non-stop,No info,4823,2019-04-09,16:55:00,19:55:00,0,180,0,1,0,2053,0,0,BLR,DEL,1708.6520853536679,0,0,0,0,0,0,0,0,0,0,4,9,15,2,1,1,2,3,0,0,0,1,Banglore_Delhi,1265,1,21,1,0,569.5506951178893,0.10534619747515331,1,0
Vistara,1/05/2019,Kolkata,Banglore,CCU → DEL → BLR,07:10,22:40,15h 30m,1 stop,No info,8452,2019-05-01,07:10:00,22:40:00,0,930,0,1,0,479,0,0,CCU,BLR,1546.4372901474003,0,0,0,0,0,0,0,0,0,0,5,1,18,2,1,1,1,3,1,0,1,0,Kolkata_Banglore,2871,1,30,1,0,99.77014775144518,0.601382290717625,1,0
Multiple carriers,6/06/2019,Delhi,Cochin,DEL → BOM → COK,07:30,19:00,11h 30m,1 stop,No info,12524,2019-06-06,07:30:00,19:00:00,0,690,0,1,0,1196,0,0,DEL,COK,2047.882109458646,0,1,0,0,0,0,0,0,0,1,6,6,23,2,1,0,1,3,1,0,1,0,Delhi_Cochin,4537,0,24,1,0,178.07670517031704,0.3369334576502552,1,0
SpiceJet,27/03/2019,Chennai,Kolkata,MAA → CCU,17:45,20:05,2h 20m,non-stop,No info,3384,2019-03-27,17:45:00,20:05:00,0,140,0,1,0,818,0,0,MAA,CCU,1385.198425287915,0,0,0,0,0,0,0,0,0,0,3,27,13,1,1,1,2,3,0,0,0,1,Chennai_Kolkata,381,1,4,0,1,593.656467980535,0.10106855266667002,1,0
Jet Airways,1/06/2019,Delhi,Cochin,DEL → BOM → COK,19:15,19:00 02 Jun,23h 45m,1 stop,In-flight meal not included,10262,2019-06-01,19:15:00,19:00:00,0,1425,1,0,0,3849,0,0,DEL,COK,2047.882109458646,0,1,0,0,0,0,0,0,0,1,6,1,22,2,1,0,3,3,0,1,1,0,Delhi_Cochin,4537,0,29,1,0,86.22661513510089,0.695840836451614,1,0
SpiceJet,18/06/2019,Mumbai,Hyderabad,BOM → HYD,13:15,14:45,1h 30m,non-stop,No check-in baggage included,1965,2019-06-18,13:15:00,14:45:00,0,90,0,1,0,818,0,0,BOM,HYD,622.9702752863186,0,0,0,0,0,0,0,0,0,0,6,18,25,2,1,0,2,2,0,0,0,1,Mumbai_Hyderabad,697,1,12,0,0,415.3135168575457,0.14446917223881314,0,0
IndiGo,18/05/2019,Kolkata,Banglore,CCU → BLR,22:15,00:50 19 May,2h 35m,non-stop,No info,4804,2019-05-18,22:15:00,00:50:00,0,155,1,0,1,2053,0,0,CCU,BLR,1546.4372901474003,0,0,0,0,0,0,0,0,0,0,5,18,20,2,1,1,3,0,0,1,0,1,Kolkata_Banglore,2871,1,13,0,0,598.6208865086711,0.10023038178627082,1,0
Jet Airways,27/05/2019,Delhi,Cochin,DEL → BOM → COK,18:15,19:00 28 May,24h 45m,1 stop,No info,16079,2019-05-27,18:15:00,19:00:00,0,1485,0,0,0,3849,0,0,DEL,COK,2047.882109458646,0,0,0,0,0,0,0,0,0,0,5,27,22,2,1,1,3,3,0,1,1,0,Delhi_Cochin,4537,0,4,0,1,82.74271149327862,0.7251393979864188,1,0
Jet Airways,1/06/2019,Delhi,Cochin,DEL → IDR → BOM → COK,21:25,19:00 02 Jun,21h 35m,2 stops,No info,13292,2019-06-01,21:25:00,19:00:00,0,1295,1,0,1,3849,0,0,DEL,COK,2047.882109458646,0,1,0,0,0,0,0,0,0,1,6,1,22,2,1,0,3,3,0,1,2,0,Delhi_Cochin,4537,0,29,1,0,94.88256877800677,0.6323606197928703,1,0
Air Asia,9/05/2019,Delhi,Cochin,DEL → BLR → COK,07:55,13:25,5h 30m,1 stop,No info,6751,2019-05-09,07:55:00,13:25:00,0,330,0,1,0,319,0,0,DEL,COK,2047.882109458646,0,0,0,0,0,0,0,0,0,0,5,9,19,2,1,1,1,2,1,0,1,0,Delhi_Cochin,4537,0,22,1,0,372.3422017197538,0.1611420884414264,1,0
Air India,15/05/2019,Delhi,Cochin,DEL → BOM → COK,07:00,19:15,12h 15m,1 stop,No info,8669,2019-05-15,07:00:00,19:15:00,0,735,0,1,0,1752,0,0,DEL,COK,2047.882109458646,0,0,0,0,0,0,0,0,0,0,5,15,20,2,1,1,1,3,1,0,1,0,Delhi_Cochin,4537,0,16,0,0,167.17404975172622,0.3589073788013588,1,0
IndiGo,3/03/2019,Delhi,Cochin,DEL → BOM → COK,17:30,01:35 04 Mar,8h 5m,1 stop,No info,14871,2019-03-03,17:30:00,01:35:00,0,485,1,0,1,2053,0,0,DEL,COK,2047.882109458646,0,0,0,0,0,0,0,0,0,0,3,3,9,1,1,1,2,0,0,0,1,0,Delhi_Cochin,4537,0,28,1,0,253.3462403453995,0.23683003907300545,1,0
Jet Airways,21/05/2019,Delhi,Cochin,DEL → BOM → COK,14:00,19:00,5h,1 stop,In-flight meal not included,12898,2019-05-21,14:00:00,19:00:00,0,300,0,1,0,3849,0,0,DEL,COK,2047.882109458646,0,0,0,0,0,0,0,0,0,0,5,21,21,2,1,1,2,3,0,0,1,0,Delhi_Cochin,4537,0,10,0,1,409.5764218917292,0.146492807674024,1,0
SpiceJet,6/06/2019,Banglore,Delhi,BLR → DEL,09:30,12:20,2h 50m,non-stop,No check-in baggage included,3919,2019-06-06,09:30:00,12:20:00,0,170,0,1,0,818,0,0,BLR,DEL,1708.6520853536679,0,1,0,0,0,0,0,0,0,1,6,6,23,2,1,0,1,2,1,0,0,1,Banglore_Delhi,1265,1,24,1,0,603.0536771836476,0.0994936309487559,1,0
Multiple carriers,1/03/2019,Delhi,Cochin,DEL → BOM → COK,12:50,19:15,6h 25m,1 stop,No info,36983,2019-03-01,12:50:00,19:15:00,0,385,0,1,0,1196,0,0,DEL,COK,2047.882109458646,0,0,0,0,0,0,0,0,0,0,3,1,9,1,1,1,2,3,0,0,1,0,Delhi_Cochin,4537,0,30,1,0,319.15045861693187,0.18799910318166413,1,0
IndiGo,3/06/2019,Chennai,Kolkata,MAA → CCU,19:35,21:55,2h 20m,non-stop,No info,3597,2019-06-03,19:35:00,21:55:00,0,140,0,1,0,2053,0,0,MAA,CCU,1385.198425287915,0,1,0,0,0,0,0,0,0,1,6,3,23,2,1,0,3,3,0,1,0,1,Chennai_Kolkata,381,1,27,1,0,593.656467980535,0.10106855266667002,1,0
Air India,09/03/2019,Banglore,New Delhi,BLR → DEL,17:00,19:45,2h 45m,non-stop,No info,10741,2019-03-09,17:00:00,19:45:00,0,165,1,1,0,1752,0,0,BLR,DEL,1708.6520853536679,0,0,0,0,0,0,0,0,0,0,3,9,10,1,1,1,2,3,0,0,0,1,Banglore_New Delhi,932,0,22,1,0,621.3280310376974,0.09656734768555719,1,0
Air India,6/06/2019,Kolkata,Banglore,CCU → BOM → GOI → BLR,16:50,05:35 07 Jun,12h 45m,2 stops,No info,11432,2019-06-06,16:50:00,05:35:00,0,765,0,0,1,1752,0,0,CCU,BLR,1546.4372901474003,0,1,0,0,0,0,0,0,0,1,6,6,23,2,1,0,2,0,0,0,2,0,Kolkata_Banglore,2871,1,24,1,0,121.28919922724707,0.4946854326870786,1,0
Jet Airways,12/03/2019,Banglore,New Delhi,BLR → BOM → DEL,18:55,10:45 13 Mar,15h 50m,1 stop,In-flight meal not included,11087,2019-03-12,18:55:00,10:45:00,0,950,0,0,0,3849,0,0,BLR,DEL,1708.6520853536679,0,0,0,0,0,0,0,0,0,0,3,12,11,1,1,1,3,1,0,1,1,0,Banglore_New Delhi,932,0,19,0,0,107.9148685486527,0.5559938200077535,1,0
Jet Airways,3/06/2019,Delhi,Cochin,DEL → IDR → BOM → COK,09:35,12:35 04 Jun,27h,2 stops,No info,13292,2019-06-03,09:35:00,12:35:00,0,1620,0,0,0,3849,0,0,DEL,COK,2047.882109458646,0,1,0,0,0,0,0,0,0,1,6,3,23,2,1,0,1,2,1,0,2,0,Delhi_Cochin,4537,0,27,1,0,75.84748553550541,0.7910611614397296,1,0
Air India,15/06/2019,Delhi,Cochin,DEL → RPR → NAG → BOM → COK,05:15,07:40 16 Jun,26h 25m,3 stops,No info,10493,2019-06-15,05:15:00,07:40:00,0,1585,1,0,0,1752,0,0,DEL,COK,2047.882109458646,0,0,0,0,0,0,0,0,0,0,6,15,24,2,1,0,0,1,0,0,3,0,Delhi_Cochin,4537,0,15,0,0,77.52235114669953,0.7739703338777602,1,0
GoAir,09/03/2019,Banglore,New Delhi,BLR → DEL,07:45,10:40,2h 55m,non-stop,No info,7631,2019-03-09,07:45:00,10:40:00,0,175,1,1,0,194,0,0,BLR,DEL,1708.6520853536679,0,0,0,0,0,0,0,0,0,0,3,9,10,1,1,1,1,1,1,0,0,1,Banglore_New Delhi,932,0,22,1,0,585.8235721212576,0.10241991421195461,1,0
Air India,6/06/2019,Delhi,Cochin,DEL → CCU → BOM → COK,06:50,07:40 07 Jun,24h 50m,2 stops,No info,13381,2019-06-06,06:50:00,07:40:00,0,1490,0,0,0,1752,0,0,DEL,COK,2047.882109458646,0,1,0,0,0,0,0,0,0,1,6,6,23,2,1,0,1,1,1,0,2,0,Delhi_Cochin,4537,0,24,1,0,82.46505138759647,0.7275809447809859,1,0
Jet Airways,6/06/2019,Kolkata,Banglore,CCU → BOM → BLR,20:00,04:40 07 Jun,8h 40m,1 stop,No info,13731,2019-06-06,20:00:00,04:40:00,0,520,0,0,1,3849,0,0,CCU,BLR,1546.4372901474003,0,1,0,0,0,0,0,0,0,1,6,6,23,2,1,0,3,0,0,1,1,0,Kolkata_Banglore,2871,1,24,1,0,178.43507194008464,0.3362567647023279,1,0
Air India,21/05/2019,Delhi,Cochin,DEL → BHO → BOM → COK,05:55,07:40 22 May,25h 45m,2 stops,No info,11911,2019-05-21,05:55:00,07:40:00,0,1545,0,0,0,1752,0,0,DEL,COK,2047.882109458646,0,0,0,0,0,0,0,0,0,0,5,21,21,2,1,1,0,1,0,0,2,0,Delhi_Cochin,4537,0,10,0,1,79.52940230907363,0.7544379595212236,1,0
IndiGo,18/04/2019,Banglore,Delhi,BLR → DEL,23:30,02:20 19 Apr,2h 50m,non-stop,No info,4591,2019-04-18,23:30:00,02:20:00,0,170,0,0,1,2053,0,0,BLR,DEL,1708.6520853536679,0,0,0,0,0,0,0,0,0,0,4,18,16,2,1,1,3,0,0,1,0,1,Banglore_Delhi,1265,1,12,0,0,603.0536771836476,0.0994936309487559,1,0
Multiple carriers,3/06/2019,Delhi,Cochin,DEL → BOM → COK,13:00,19:15,6h 15m,1 stop,No info,14848,2019-06-03,13:00:00,19:15:00,0,375,0,1,0,1196,0,0,DEL,COK,2047.882109458646,0,1,0,0,0,0,0,0,0,1,6,3,23,2,1,0,2,3,0,0,1,0,Delhi_Cochin,4537,0,27,1,0,327.6611375133833,0.18311600959253,1,0
Multiple carriers,12/06/2019,Delhi,Cochin,DEL → BOM → COK,08:45,19:15,10h 30m,1 stop,No info,8266,2019-06-12,08:45:00,19:15:00,0,630,0,1,0,1196,0,0,DEL,COK,2047.882109458646,0,0,0,0,0,0,0,0,0,0,6,12,24,2,1,0,1,3,1,0,1,0,Delhi_Cochin,4537,0,18,0,0,195.0363913770139,0.3076348961154504,1,0
Air India,18/05/2019,Delhi,Cochin,DEL → HYD → BOM → COK,17:15,19:15 19 May,26h,2 stops,No info,12392,2019-05-18,17:15:00,19:15:00,0,1560,1,0,0,1752,0,0,DEL,COK,2047.882109458646,0,0,0,0,0,0,0,0,0,0,5,18,20,2,1,1,2,3,0,0,2,0,Delhi_Cochin,4537,0,13,0,0,78.76469651764023,0.7617625999049248,1,0
Jet Airways,12/06/2019,Kolkata,Banglore,CCU → BOM → BLR,18:55,12:00 13 Jun,17h 5m,1 stop,No info,13044,2019-06-12,18:55:00,12:00:00,0,1025,0,0,0,3849,0,0,CCU,BLR,1546.4372901474003,0,0,0,0,0,0,0,0,0,0,6,12,24,2,1,0,3,2,0,1,1,0,Kolkata_Banglore,2871,1,18,0,0,90.52315844765269,0.6628138150382425,1,0
Jet Airways,21/05/2019,Delhi,Cochin,DEL → BOM → COK,07:05,04:25 22 May,21h 20m,1 stop,In-flight meal not included,12898,2019-05-21,07:05:00,04:25:00,0,1280,0,0,1,3849,0,0,DEL,COK,2047.882109458646,0,0,0,0,0,0,0,0,0,0,5,21,21,2,1,1,1,0,1,0,1,0,Delhi_Cochin,4537,0,10,0,1,95.99447388087403,0.6250359794091691,1,0
Jet Airways,21/03/2019,Delhi,Cochin,DEL → BOM → COK,22:50,04:25 22 Mar,5h 35m,1 stop,No info,12242,2019-03-21,22:50:00,04:25:00,0,335,0,0,1,3849,0,0,DEL,COK,2047.882109458646,0,0,0,0,1,0,0,0,0,1,3,21,12,1,1,1,3,0,0,1,1,0,Delhi_Cochin,4537,0,10,0,1,366.78485542542916,0.16358363523599348,1,0
IndiGo,18/05/2019,Banglore,Delhi,BLR → DEL,10:10,13:00,2h 50m,non-stop,No info,3943,2019-05-18,10:10:00,13:00:00,0,170,1,1,0,2053,0,0,BLR,DEL,1708.6520853536679,0,0,0,0,0,0,0,0,0,0,5,18,20,2,1,1,1,2,1,0,0,1,Banglore_Delhi,1265,1,13,0,0,603.0536771836476,0.0994936309487559,1,0
Vistara,24/03/2019,Kolkata,Banglore,CCU → DEL → BLR,20:20,22:10 25 Mar,25h 50m,1 stop,No info,11105,2019-03-24,20:20:00,22:10:00,0,1550,1,0,0,479,0,0,CCU,BLR,1546.4372901474003,0,0,0,0,1,0,0,0,0,1,3,24,12,1,1,1,3,3,0,1,1,0,Kolkata_Banglore,2871,1,7,0,1,59.86208865086711,1.0023038178627082,1,0
Jet Airways,12/05/2019,Kolkata,Banglore,CCU → BOM → BLR,21:10,09:20 13 May,12h 10m,1 stop,No info,14388,2019-05-12,21:10:00,09:20:00,0,730,1,0,1,3849,0,0,CCU,BLR,1546.4372901474003,0,0,0,0,0,0,0,0,0,0,5,12,19,2,1,1,3,1,0,1,1,0,Kolkata_Banglore,2871,1,19,0,0,127.10443480663565,0.4720527658321142,1,0
Jet Airways,18/05/2019,Delhi,Cochin,DEL → JAI → BOM → COK,19:30,12:35 19 May,17h 5m,2 stops,No info,13014,2019-05-18,19:30:00,12:35:00,0,1025,1,0,0,3849,0,0,DEL,COK,2047.882109458646,0,0,0,0,0,0,0,0,0,0,5,18,20,2,1,1,3,2,0,1,2,0,Delhi_Cochin,4537,0,13,0,0,119.87602591953049,0.5005170928862487,1,0
Multiple carriers,6/03/2019,Delhi,Cochin,DEL → BOM → COK,10:20,18:50,8h 30m,1 stop,No info,15411,2019-03-06,10:20:00,18:50:00,0,510,0,1,0,1196,0,0,DEL,COK,2047.882109458646,0,0,0,0,0,0,0,0,0,0,3,6,10,1,1,1,1,3,1,0,1,0,Delhi_Cochin,4537,0,25,1,0,240.92730699513484,0.2490377730458408,1,0
Jet Airways,9/03/2019,Delhi,Cochin,DEL → BOM → COK,19:45,18:50 10 Mar,23h 5m,1 stop,No info,16289,2019-03-09,19:45:00,18:50:00,0,1385,1,0,0,3849,0,0,DEL,COK,2047.882109458646,0,0,0,0,0,0,0,0,0,0,3,9,10,1,1,1,3,3,0,1,1,0,Delhi_Cochin,4537,0,22,1,0,88.71691448918322,0.6763084620950774,1,0
IndiGo,15/05/2019,Delhi,Cochin,DEL → HYD → COK,06:50,16:10,9h 20m,1 stop,No info,6442,2019-05-15,06:50:00,16:10:00,0,560,0,1,0,2053,0,0,DEL,COK,2047.882109458646,0,0,0,0,0,0,0,0,0,0,5,15,20,2,1,1,1,2,1,0,1,0,Delhi_Cochin,4537,0,16,0,0,219.41594029914066,0.27345324099151147,1,0
Jet Airways,18/05/2019,Kolkata,Banglore,CCU → BOM → BLR,08:25,16:20,7h 55m,1 stop,In-flight meal not included,10844,2019-05-18,08:25:00,16:20:00,0,475,1,1,0,3849,0,0,CCU,BLR,1546.4372901474003,0,0,0,0,0,0,0,0,0,0,5,18,20,2,1,1,1,2,1,0,1,0,Kolkata_Banglore,2871,1,13,0,0,195.33944717651372,0.307157621603088,1,0
Jet Airways,18/05/2019,Mumbai,Hyderabad,BOM → HYD,10:20,11:50,1h 30m,non-stop,No info,5678,2019-05-18,10:20:00,11:50:00,0,90,1,1,0,3849,0,0,BOM,HYD,622.9702752863186,0,0,0,0,0,0,0,0,0,0,5,18,20,2,1,1,1,1,1,0,0,1,Mumbai_Hyderabad,697,1,13,0,0,415.3135168575457,0.14446917223881314,0,0
IndiGo,12/04/2019,Banglore,Delhi,BLR → DEL,23:30,02:20 13 Apr,2h 50m,non-stop,No info,6906,2019-04-12,23:30:00,02:20:00,0,170,0,0,1,2053,0,0,BLR,DEL,1708.6520853536679,0,0,0,0,0,0,0,0,0,0,4,12,15,2,1,1,3,0,0,1,0,1,Banglore_Delhi,1265,1,18,0,0,603.0536771836476,0.0994936309487559,1,0
SpiceJet,21/05/2019,Chennai,Kolkata,MAA → CCU,09:45,12:00,2h 15m,non-stop,No check-in baggage included,3543,2019-05-21,09:45:00,12:00:00,0,135,0,1,0,818,0,0,MAA,CCU,1385.198425287915,0,0,0,0,0,0,0,0,0,0,5,21,21,2,1,1,1,2,1,0,0,1,Chennai_Kolkata,381,1,10,0,1,615.6437445724066,0.09745896150000323,1,0
Jet Airways,6/06/2019,Delhi,Cochin,DEL → BOM → COK,09:00,19:00,10h,1 stop,No info,14714,2019-06-06,09:00:00,19:00:00,0,600,0,1,0,3849,0,0,DEL,COK,2047.882109458646,0,1,0,0,0,0,0,0,0,1,6,6,23,2,1,0,1,3,1,0,1,0,Delhi_Cochin,4537,0,24,1,0,204.7882109458646,0.292985615348048,1,0
Vistara Premium economy,03/03/2019,Banglore,New Delhi,BLR → DEL,16:00,18:35,2h 35m,non-stop,No info,11793,2019-03-03,16:00:00,18:35:00,0,155,1,1,0,3,0,0,BLR,DEL,1708.6520853536679,0,0,0,0,0,0,0,0,0,0,3,3,9,1,1,1,2,3,0,0,0,1,Banglore_New Delhi,932,0,28,1,0,661.4137104594843,0.09071478115915979,1,0
Multiple carriers,15/05/2019,Delhi,Cochin,DEL → BOM → COK,11:30,19:15,7h 45m,1 stop,No info,14323,2019-05-15,11:30:00,19:15:00,0,465,0,1,0,1196,0,0,DEL,COK,2047.882109458646,0,0,0,0,0,0,0,0,0,0,5,15,20,2,1,1,1,3,1,0,1,0,Delhi_Cochin,4537,0,16,0,0,264.2428528333737,0.2270638518947372,1,0
SpiceJet,9/04/2019,Banglore,Delhi,BLR → DEL,21:10,00:05 10 Apr,2h 55m,non-stop,No info,3971,2019-04-09,21:10:00,00:05:00,0,175,0,0,1,818,0,0,BLR,DEL,1708.6520853536679,0,0,0,0,0,0,0,0,0,0,4,9,15,2,1,1,3,0,0,1,0,1,Banglore_Delhi,1265,1,21,1,0,585.8235721212576,0.10241991421195461,1,0
Vistara,6/05/2019,Kolkata,Banglore,CCU → DEL → BLR,20:20,22:40 07 May,26h 20m,1 stop,No info,8452,2019-05-06,20:20:00,22:40:00,0,1580,0,0,0,479,0,0,CCU,BLR,1546.4372901474003,0,0,0,0,0,0,0,0,0,0,5,6,19,2,1,1,3,3,0,1,1,0,Kolkata_Banglore,2871,1,25,1,0,58.72546671445824,1.021703246595535,1,0
Vistara,12/04/2019,Banglore,Delhi,BLR → DEL,07:00,09:40,2h 40m,non-stop,No info,5403,2019-04-12,07:00:00,09:40:00,0,160,0,1,0,479,0,0,BLR,DEL,1708.6520853536679,0,0,0,0,0,0,0,0,0,0,4,12,15,2,1,1,1,1,1,0,0,1,Banglore_Delhi,1265,1,18,0,0,640.7445320076254,0.09364106442235849,1,0
Multiple carriers,9/05/2019,Delhi,Cochin,DEL → BOM → COK,10:00,21:00,11h,1 stop,No info,13727,2019-05-09,10:00:00,21:00:00,0,660,0,1,0,1196,0,0,DEL,COK,2047.882109458646,0,0,0,0,0,0,0,0,0,0,5,9,19,2,1,1,1,3,1,0,1,0,Delhi_Cochin,4537,0,22,1,0,186.1711008598769,0.3222841768828528,1,0
Air India,1/04/2019,Kolkata,Banglore,CCU → DEL → AMD → BLR,10:00,05:25 02 Apr,19h 25m,2 stops,No info,12639,2019-04-01,10:00:00,05:25:00,0,1165,0,0,1,1752,0,0,CCU,BLR,1546.4372901474003,0,0,0,0,0,0,0,0,0,0,4,1,14,2,1,1,1,0,1,0,2,0,Kolkata_Banglore,2871,1,29,1,0,79.6448389775485,0.7533444824581,1,0
Jet Airways,18/04/2019,Banglore,Delhi,BLR → DEL,15:15,18:10,2h 55m,non-stop,In-flight meal not included,5198,2019-04-18,15:15:00,18:10:00,0,175,0,1,0,3849,0,0,BLR,DEL,1708.6520853536679,0,0,0,0,0,0,0,0,0,0,4,18,16,2,1,1,2,3,0,0,0,1,Banglore_Delhi,1265,1,12,0,0,585.8235721212576,0.10241991421195461,1,0
Vistara,1/06/2019,Banglore,Delhi,BLR → DEL,19:30,22:15,2h 45m,non-stop,No info,4878,2019-06-01,19:30:00,22:15:00,0,165,1,1,0,479,0,0,BLR,DEL,1708.6520853536679,0,1,0,0,0,0,0,0,0,1,6,1,22,2,1,0,3,3,0,1,0,1,Banglore_Delhi,1265,1,29,1,0,621.3280310376974,0.09656734768555719,1,0
Jet Airways,18/05/2019,Delhi,Cochin,DEL → BOM → COK,19:45,19:00 19 May,23h 15m,1 stop,In-flight meal not included,12373,2019-05-18,19:45:00,19:00:00,0,1395,1,0,0,3849,0,0,DEL,COK,2047.882109458646,0,0,0,0,0,0,0,0,0,0,5,18,20,2,1,1,3,3,0,1,1,0,Delhi_Cochin,4537,0,13,0,0,88.0809509444579,0.6811915556842116,1,0
Multiple carriers,3/03/2019,Delhi,Cochin,DEL → HYD → COK,07:10,16:10,9h,1 stop,In-flight meal not included,8552,2019-03-03,07:10:00,16:10:00,0,540,1,1,0,1196,0,0,DEL,COK,2047.882109458646,0,0,0,0,0,0,0,0,0,0,3,3,9,1,1,1,1,2,1,0,1,0,Delhi_Cochin,4537,0,28,1,0,227.54245660651623,0.2636870538132432,1,0
Vistara,21/04/2019,Delhi,Cochin,DEL → COK,14:40,17:50,3h 10m,non-stop,No info,6741,2019-04-21,14:40:00,17:50:00,0,190,1,1,0,479,0,0,DEL,COK,2047.882109458646,0,0,0,0,0,0,0,0,0,0,4,21,16,2,1,1,2,2,0,0,0,1,Delhi_Cochin,4537,0,9,0,1,646.6996135132566,0.09277877819354853,1,0
Multiple carriers,9/04/2019,Delhi,Cochin,DEL → BOM → COK,12:50,19:15,6h 25m,1 stop,No info,6481,2019-04-09,12:50:00,19:15:00,0,385,0,1,0,1196,0,0,DEL,COK,2047.882109458646,0,0,0,0,0,0,0,0,0,0,4,9,15,2,1,1,2,3,0,0,1,0,Delhi_Cochin,4537,0,21,1,0,319.15045861693187,0.18799910318166413,1,0
Multiple carriers,6/06/2019,Delhi,Cochin,DEL → BOM → COK,10:35,19:15,8h 40m,1 stop,No info,7354,2019-06-06,10:35:00,19:15:00,0,520,0,1,0,1196,0,0,DEL,COK,2047.882109458646,0,1,0,0,0,0,0,0,0,1,6,6,23,2,1,0,1,3,1,0,1,0,Delhi_Cochin,4537,0,24,1,0,236.2940895529207,0.25392086663497493,1,0
Air India,21/04/2019,Banglore,Delhi,BLR → DEL,21:05,23:55,2h 50m,non-stop,No info,5228,2019-04-21,21:05:00,23:55:00,0,170,1,1,1,1752,0,0,BLR,DEL,1708.6520853536679,0,0,0,0,0,0,0,0,0,0,4,21,16,2,1,1,3,3,0,1,0,1,Banglore_Delhi,1265,1,9,0,1,603.0536771836476,0.0994936309487559,1,0
Jet Airways,12/05/2019,Kolkata,Banglore,CCU → BOM → BLR,08:25,20:45,12h 20m,1 stop,In-flight meal not included,10844,2019-05-12,08:25:00,20:45:00,0,740,1,1,0,3849,0,0,CCU,BLR,1546.4372901474003,0,0,0,0,0,0,0,0,0,0,5,12,19,2,1,1,1,3,1,0,1,0,Kolkata_Banglore,2871,1,19,0,0,125.38680730924868,0.47851924207638974,1,0
IndiGo,18/05/2019,Delhi,Cochin,DEL → HYD → COK,06:50,12:10,5h 20m,1 stop,No info,6347,2019-05-18,06:50:00,12:10:00,0,320,1,1,0,2053,0,0,DEL,COK,2047.882109458646,0,0,0,0,0,0,0,0,0,0,5,18,20,2,1,1,1,2,1,0,1,0,Delhi_Cochin,4537,0,13,0,0,383.9778955234961,0.15625899485229228,1,0
Air India,15/03/2019,Banglore,New Delhi,BLR → HYD → DEL,08:15,12:15,4h,1 stop,No info,5013,2019-03-15,08:15:00,12:15:00,0,240,0,1,0,1752,0,0,BLR,DEL,1708.6520853536679,0,0,0,0,1,0,0,0,0,1,3,15,11,1,1,1,1,2,1,0,1,0,Banglore_New Delhi,932,0,16,0,0,427.16302133841697,0.14046159663353774,1,0
Jet Airways,9/06/2019,Kolkata,Banglore,CCU → BOM → BLR,18:55,04:40 10 Jun,9h 45m,1 stop,In-flight meal not included,9663,2019-06-09,18:55:00,04:40:00,0,585,1,0,1,3849,0,0,CCU,BLR,1546.4372901474003,0,1,0,0,0,0,0,0,0,1,6,9,23,2,1,0,3,0,0,1,1,0,Kolkata_Banglore,2871,1,21,1,0,158.60895283563082,0.37828886029011893,1,0
IndiGo,6/04/2019,Banglore,Delhi,BLR → DEL,18:25,21:20,2h 55m,non-stop,No info,4823,2019-04-06,18:25:00,21:20:00,0,175,1,1,0,2053,0,0,BLR,DEL,1708.6520853536679,0,0,0,0,0,0,0,0,0,0,4,6,14,2,1,1,3,3,0,1,0,1,Banglore_Delhi,1265,1,24,1,0,585.8235721212576,0.10241991421195461,1,0
Air India,24/06/2019,Delhi,Cochin,DEL → CCU → BOM → COK,16:55,19:15 25 Jun,26h 20m,2 stops,No info,13381,2019-06-24,16:55:00,19:15:00,0,1580,0,0,0,1752,0,0,DEL,COK,2047.882109458646,0,0,0,0,0,0,0,0,0,0,6,24,26,2,1,0,2,3,0,0,2,0,Delhi_Cochin,4537,0,6,0,1,77.7676750427334,0.7715287870831931,1,0
SpiceJet,1/06/2019,Chennai,Kolkata,MAA → CCU,09:45,12:00,2h 15m,non-stop,No check-in baggage included,3543,2019-06-01,09:45:00,12:00:00,0,135,1,1,0,818,0,0,MAA,CCU,1385.198425287915,0,1,0,0,0,0,0,0,0,1,6,1,22,2,1,0,1,2,1,0,0,1,Chennai_Kolkata,381,1,29,1,0,615.6437445724066,0.09745896150000323,1,0
Jet Airways,15/05/2019,Kolkata,Banglore,CCU → BOM → BLR,18:55,04:40 16 May,9h 45m,1 stop,In-flight meal not included,9663,2019-05-15,18:55:00,04:40:00,0,585,0,0,1,3849,0,0,CCU,BLR,1546.4372901474003,0,0,0,0,0,0,0,0,0,0,5,15,20,2,1,1,3,0,0,1,1,0,Kolkata_Banglore,2871,1,16,0,0,158.60895283563082,0.37828886029011893,1,0
Jet Airways,1/04/2019,Kolkata,Banglore,CCU → BOM → BLR,18:55,19:50 02 Apr,24h 55m,1 stop,In-flight meal not included,7064,2019-04-01,18:55:00,19:50:00,0,1495,0,0,0,3849,0,0,CCU,BLR,1546.4372901474003,0,0,0,0,0,0,0,0,0,0,4,1,14,2,1,1,3,3,0,1,1,0,Kolkata_Banglore,2871,1,29,1,0,62.06437284872509,0.9667381985191927,1,0
Jet Airways,9/06/2019,Delhi,Cochin,DEL → BOM → COK,07:05,19:00,11h 55m,1 stop,In-flight meal not included,10262,2019-06-09,07:05:00,19:00:00,0,715,1,1,0,3849,0,0,DEL,COK,2047.882109458646,0,1,0,0,0,0,0,0,0,1,6,9,23,2,1,0,1,3,1,0,1,0,Delhi_Cochin,4537,0,21,1,0,171.85024694757868,0.34914119162309054,1,0
Air India,1/06/2019,Delhi,Cochin,DEL → GOI → BOM → COK,10:55,19:15,8h 20m,2 stops,No info,13013,2019-06-01,10:55:00,19:15:00,0,500,1,1,0,1752,0,0,DEL,COK,2047.882109458646,0,1,0,0,0,0,0,0,0,1,6,1,22,2,1,0,1,3,1,0,2,0,Delhi_Cochin,4537,0,29,1,0,245.74585313503752,0.24415467945670666,1,0
Jet Airways,27/06/2019,Delhi,Cochin,DEL → AMD → BOM → COK,19:10,12:35 28 Jun,17h 25m,2 stops,No info,15339,2019-06-27,19:10:00,12:35:00,0,1045,0,0,0,3849,0,0,DEL,COK,2047.882109458646,0,0,0,0,0,0,0,0,0,0,6,27,26,2,1,0,3,2,0,1,2,0,Delhi_Cochin,4537,0,3,0,1,117.58174791150121,0.510283280064517,1,0
GoAir,18/04/2019,Banglore,Delhi,BLR → DEL,11:40,14:30,2h 50m,non-stop,No info,4937,2019-04-18,11:40:00,14:30:00,0,170,0,1,0,194,0,0,BLR,DEL,1708.6520853536679,0,0,0,0,0,0,0,0,0,0,4,18,16,2,1,1,1,2,1,0,0,1,Banglore_Delhi,1265,1,12,0,0,603.0536771836476,0.0994936309487559,1,0
IndiGo,6/06/2019,Delhi,Cochin,DEL → HYD → COK,05:05,12:10,7h 5m,1 stop,No info,6818,2019-06-06,05:05:00,12:10:00,0,425,0,1,0,2053,0,0,DEL,COK,2047.882109458646,0,1,0,0,0,0,0,0,0,1,6,6,23,2,1,0,0,2,0,0,1,0,Delhi_Cochin,4537,0,24,1,0,289.11276839416183,0.20753147753820067,1,0
Air India,18/05/2019,Delhi,Cochin,DEL → GOI → BOM → COK,22:00,19:15 19 May,21h 15m,2 stops,No info,10441,2019-05-18,22:00:00,19:15:00,0,1275,1,0,1,1752,0,0,DEL,COK,2047.882109458646,0,0,0,0,0,0,0,0,0,0,5,18,20,2,1,1,3,3,0,1,2,0,Delhi_Cochin,4537,0,13,0,0,96.37092279805394,0.622594432614602,1,0
Jet Airways,3/04/2019,Delhi,Cochin,DEL → BOM → COK,14:00,19:00,5h,1 stop,In-flight meal not included,5177,2019-04-03,14:00:00,19:00:00,0,300,0,1,0,3849,0,0,DEL,COK,2047.882109458646,0,0,0,0,0,0,0,0,0,0,4,3,14,2,1,1,2,3,0,0,1,0,Delhi_Cochin,4537,0,27,1,0,409.5764218917292,0.146492807674024,1,0
IndiGo,27/06/2019,Chennai,Kolkata,MAA → CCU,11:35,14:00,2h 25m,non-stop,No info,3858,2019-06-27,11:35:00,14:00:00,0,145,0,1,0,2053,0,0,MAA,CCU,1385.198425287915,0,0,0,0,0,0,0,0,0,0,6,27,26,2,1,0,1,2,1,0,0,1,Chennai_Kolkata,381,1,3,0,1,573.1855552915509,0.1046781438333368,1,0
IndiGo,18/05/2019,Kolkata,Banglore,CCU → PNQ → BLR,21:00,02:15 19 May,5h 15m,1 stop,No info,6534,2019-05-18,21:00:00,02:15:00,0,315,1,0,1,2053,0,0,CCU,BLR,1546.4372901474003,0,0,0,0,0,0,0,0,0,0,5,18,20,2,1,1,3,0,0,1,1,0,Kolkata_Banglore,2871,1,13,0,0,294.55948383760006,0.2036940016946794,1,0
Multiple carriers,15/06/2019,Delhi,Cochin,DEL → BOM → COK,10:20,01:30 16 Jun,15h 10m,1 stop,No info,6795,2019-06-15,10:20:00,01:30:00,0,910,1,0,1,1196,0,0,DEL,COK,2047.882109458646,0,0,0,0,0,0,0,0,0,0,6,15,24,2,1,0,1,0,1,0,1,0,Delhi_Cochin,4537,0,15,0,0,135.02519403024039,0.44436151661120615,1,0
Multiple carriers,3/06/2019,Delhi,Cochin,DEL → BOM → COK,07:30,19:15,11h 45m,1 stop,No info,9736,2019-06-03,07:30:00,19:15:00,0,705,0,1,0,1196,0,0,DEL,COK,2047.882109458646,0,1,0,0,0,0,0,0,0,1,6,3,23,2,1,0,1,3,1,0,1,0,Delhi_Cochin,4537,0,27,1,0,174.2878391028635,0.3442580980339564,1,0
Jet Airways,1/05/2019,Banglore,Delhi,BLR → DEL,19:50,22:50,3h,non-stop,No info,7229,2019-05-01,19:50:00,22:50:00,0,180,0,1,0,3849,0,0,BLR,DEL,1708.6520853536679,0,0,0,0,0,0,0,0,0,0,5,1,18,2,1,1,3,3,0,1,0,1,Banglore_Delhi,1265,1,30,1,0,569.5506951178893,0.10534619747515331,1,0
SpiceJet,24/04/2019,Delhi,Cochin,DEL → BLR → COK,17:55,22:50,4h 55m,1 stop,No info,4957,2019-04-24,17:55:00,22:50:00,0,295,0,1,0,818,0,0,DEL,COK,2047.882109458646,0,0,0,0,0,0,0,0,0,0,4,24,17,2,1,1,2,3,0,0,1,0,Delhi_Cochin,4537,0,6,0,1,416.5183951441314,0.14405126087945694,1,0
IndiGo,09/03/2019,Banglore,New Delhi,BLR → DEL,06:00,08:45,2h 45m,non-stop,No info,7648,2019-03-09,06:00:00,08:45:00,0,165,1,1,0,2053,0,0,BLR,DEL,1708.6520853536679,0,0,0,0,0,0,0,0,0,0,3,9,10,1,1,1,1,1,1,0,0,1,Banglore_New Delhi,932,0,22,1,0,621.3280310376974,0.09656734768555719,1,0
SpiceJet,15/06/2019,Kolkata,Banglore,CCU → BLR,14:55,17:25,2h 30m,non-stop,No info,3873,2019-06-15,14:55:00,17:25:00,0,150,1,1,0,818,0,0,CCU,BLR,1546.4372901474003,0,0,0,0,0,0,0,0,0,0,6,15,24,2,1,0,2,2,0,0,0,1,Kolkata_Banglore,2871,1,15,0,0,618.5749160589601,0.09699714366413306,1,0
Jet Airways,12/05/2019,Kolkata,Banglore,CCU → BOM → BLR,18:55,04:40 13 May,9h 45m,1 stop,No info,14388,2019-05-12,18:55:00,04:40:00,0,585,1,0,1,3849,0,0,CCU,BLR,1546.4372901474003,0,0,0,0,0,0,0,0,0,0,5,12,19,2,1,1,3,0,0,1,1,0,Kolkata_Banglore,2871,1,19,0,0,158.60895283563082,0.37828886029011893,1,0
IndiGo,6/03/2019,Kolkata,Banglore,CCU → BLR,17:15,19:55,2h 40m,non-stop,No info,5618,2019-03-06,17:15:00,19:55:00,0,160,0,1,0,2053,0,0,CCU,BLR,1546.4372901474003,0,0,0,0,0,0,0,0,0,0,3,6,10,1,1,1,2,3,0,0,0,1,Kolkata_Banglore,2871,1,25,1,0,579.913983805275,0.10346361990840859,1,0
Multiple carriers,9/06/2019,Delhi,Cochin,DEL → BOM → COK,19:00,01:30 10 Jun,6h 30m,1 stop,No info,7408,2019-06-09,19:00:00,01:30:00,0,390,1,0,1,1196,0,0,DEL,COK,2047.882109458646,0,1,0,0,0,0,0,0,0,1,6,9,23,2,1,0,3,0,0,1,1,0,Delhi_Cochin,4537,0,21,1,0,315.0587860705609,0.1904406499762312,1,0
Air Asia,3/03/2019,Delhi,Cochin,DEL → BLR → COK,16:45,22:15,5h 30m,1 stop,No info,13774,2019-03-03,16:45:00,22:15:00,0,330,1,1,0,319,0,0,DEL,COK,2047.882109458646,0,0,0,0,0,0,0,0,0,0,3,3,9,1,1,1,2,3,0,0,1,0,Delhi_Cochin,4537,0,28,1,0,372.3422017197538,0.1611420884414264,1,0
Vistara,3/05/2019,Banglore,Delhi,BLR → DEL,07:00,09:40,2h 40m,non-stop,No info,4668,2019-05-03,07:00:00,09:40:00,0,160,0,1,0,479,0,0,BLR,DEL,1708.6520853536679,0,0,0,0,0,0,0,0,0,0,5,3,18,2,1,1,1,1,1,0,0,1,Banglore_Delhi,1265,1,28,1,0,640.7445320076254,0.09364106442235849,1,0
Jet Airways,21/03/2019,Delhi,Cochin,DEL → UDR → BOM → COK,18:20,04:25 23 Mar,34h 5m,2 stops,No info,13082,2019-03-21,18:20:00,04:25:00,0,2045,0,0,1,3849,0,0,DEL,COK,2047.882109458646,0,0,0,0,1,0,0,0,0,1,3,21,12,1,1,1,3,0,0,1,2,0,Delhi_Cochin,4537,0,10,0,1,60.08456066871333,0.9985926389779303,1,0
Air India,3/06/2019,Delhi,Cochin,DEL → BOM → COK,03:50,19:15,15h 25m,1 stop,No info,8669,2019-06-03,03:50:00,19:15:00,0,925,0,1,0,1752,0,0,DEL,COK,2047.882109458646,0,1,0,0,0,0,0,0,0,1,6,3,23,2,1,0,0,3,0,0,1,0,Delhi_Cochin,4537,0,27,1,0,132.83559628920946,0.45168615699490733,1,0
IndiGo,24/06/2019,Delhi,Cochin,DEL → BOM → COK,16:00,01:30 25 Jun,9h 30m,1 stop,No info,6316,2019-06-24,16:00:00,01:30:00,0,570,0,0,1,2053,0,0,DEL,COK,2047.882109458646,0,0,0,0,0,0,0,0,0,0,6,24,26,2,1,0,2,0,0,0,1,0,Delhi_Cochin,4537,0,6,0,1,215.5665378377522,0.2783363345806456,1,0
Jet Airways,6/03/2019,Delhi,Cochin,DEL → BOM → COK,22:20,04:25 07 Mar,6h 5m,1 stop,In-flight meal not included,12583,2019-03-06,22:20:00,04:25:00,0,365,0,0,1,3849,0,0,DEL,COK,2047.882109458646,0,0,0,0,0,0,0,0,0,0,3,6,10,1,1,1,3,0,0,1,1,0,Delhi_Cochin,4537,0,25,1,0,336.6381549795035,0.17823291600339586,1,0
Vistara,09/03/2019,Banglore,New Delhi,BLR → DEL,16:10,18:50,2h 40m,non-stop,No info,7923,2019-03-09,16:10:00,18:50:00,0,160,1,1,0,479,0,0,BLR,DEL,1708.6520853536679,0,0,0,0,0,0,0,0,0,0,3,9,10,1,1,1,2,3,0,0,0,1,Banglore_New Delhi,932,0,22,1,0,640.7445320076254,0.09364106442235849,1,0
GoAir,3/03/2019,Delhi,Cochin,DEL → BOM → COK,07:00,12:50,5h 50m,1 stop,No info,7378,2019-03-03,07:00:00,12:50:00,0,350,1,1,0,194,0,0,DEL,COK,2047.882109458646,0,0,0,0,0,0,0,0,0,0,3,3,9,1,1,1,1,2,1,0,1,0,Delhi_Cochin,4537,0,28,1,0,351.06550447862503,0.17090827561969466,1,0
Vistara,3/06/2019,Banglore,Delhi,BLR → DEL,19:30,22:15,2h 45m,non-stop,No info,4878,2019-06-03,19:30:00,22:15:00,0,165,0,1,0,479,0,0,BLR,DEL,1708.6520853536679,0,1,0,0,0,0,0,0,0,1,6,3,23,2,1,0,3,3,0,1,0,1,Banglore_Delhi,1265,1,27,1,0,621.3280310376974,0.09656734768555719,1,0
Jet Airways,18/05/2019,Kolkata,Banglore,CCU → BOM → BLR,16:30,19:50 19 May,27h 20m,1 stop,In-flight meal not included,10844,2019-05-18,16:30:00,19:50:00,0,1640,1,0,0,3849,0,0,CCU,BLR,1546.4372901474003,0,0,0,0,0,0,0,0,0,0,5,18,20,2,1,1,2,3,0,0,1,0,Kolkata_Banglore,2871,1,13,0,0,56.57697402978294,1.0605021040611882,1,0
Jet Airways,3/04/2019,Banglore,Delhi,BLR → DEL,08:20,11:20,3h,non-stop,No info,7229,2019-04-03,08:20:00,11:20:00,0,180,0,1,0,3849,0,0,BLR,DEL,1708.6520853536679,0,0,0,0,0,0,0,0,0,0,4,3,14,2,1,1,1,1,1,0,0,1,Banglore_Delhi,1265,1,27,1,0,569.5506951178893,0.10534619747515331,1,0
SpiceJet,21/05/2019,Delhi,Cochin,DEL → MAA → COK,06:05,11:20,5h 15m,1 stop,No info,6297,2019-05-21,06:05:00,11:20:00,0,315,0,1,0,818,0,0,DEL,COK,2047.882109458646,0,0,0,0,0,0,0,0,0,0,5,21,21,2,1,1,1,1,1,0,1,0,Delhi_Cochin,4537,0,10,0,1,390.0727827540278,0.1538174480577252,1,0
Jet Airways,12/06/2019,Kolkata,Banglore,CCU → BOM → BLR,20:00,12:00 13 Jun,16h,1 stop,In-flight meal not included,8529,2019-06-12,20:00:00,12:00:00,0,960,0,0,0,3849,0,0,CCU,BLR,1546.4372901474003,0,0,0,0,0,0,0,0,0,0,6,12,24,2,1,0,3,2,0,1,1,0,Kolkata_Banglore,2871,1,18,0,0,96.65233063421252,0.6207817194504516,1,0
Multiple carriers,18/05/2019,Delhi,Cochin,DEL → BOM → COK,14:00,21:00,7h,1 stop,No info,13727,2019-05-18,14:00:00,21:00:00,0,420,1,1,0,1196,0,0,DEL,COK,2047.882109458646,0,0,0,0,0,0,0,0,0,0,5,18,20,2,1,1,2,3,0,0,1,0,Delhi_Cochin,4537,0,13,0,0,292.5545870655209,0.2050899307436336,1,0
SpiceJet,24/05/2019,Kolkata,Banglore,CCU → PNQ → BLR,08:35,17:15,8h 40m,1 stop,No info,6643,2019-05-24,08:35:00,17:15:00,0,520,0,1,0,818,0,0,CCU,BLR,1546.4372901474003,0,0,0,0,0,0,0,0,0,0,5,24,21,2,1,1,1,2,1,0,1,0,Kolkata_Banglore,2871,1,7,0,1,178.43507194008464,0.3362567647023279,1,0
Multiple carriers,9/05/2019,Delhi,Cochin,DEL → BOM → COK,10:00,19:00,9h,1 stop,No info,10197,2019-05-09,10:00:00,19:00:00,0,540,0,1,0,1196,0,0,DEL,COK,2047.882109458646,0,0,0,0,0,0,0,0,0,0,5,9,19,2,1,1,1,3,1,0,1,0,Delhi_Cochin,4537,0,22,1,0,227.54245660651623,0.2636870538132432,1,0
SpiceJet,21/04/2019,Kolkata,Banglore,CCU → BLR,22:20,00:40 22 Apr,2h 20m,non-stop,No info,4911,2019-04-21,22:20:00,00:40:00,0,140,1,0,1,818,0,0,CCU,BLR,1546.4372901474003,0,0,0,0,0,0,0,0,0,0,4,21,16,2,1,1,3,0,0,1,0,1,Kolkata_Banglore,2871,1,9,0,1,662.7588386346001,0.09053066741985752,1,0
IndiGo,6/03/2019,Chennai,Kolkata,MAA → CCU,05:15,07:35,2h 20m,non-stop,No info,6482,2019-03-06,05:15:00,07:35:00,0,140,0,1,0,2053,0,0,MAA,CCU,1385.198425287915,0,0,0,0,0,0,0,0,0,0,3,6,10,1,1,1,0,1,0,0,0,1,Chennai_Kolkata,381,1,25,1,0,593.656467980535,0.10106855266667002,1,0
Jet Airways,01/03/2019,Banglore,New Delhi,BLR → BOM → DEL,08:55,15:15,6h 20m,1 stop,No info,26890,2019-03-01,08:55:00,15:15:00,0,380,0,1,0,3849,0,0,BLR,DEL,1708.6520853536679,0,0,0,0,0,0,0,0,0,0,3,1,9,1,1,1,1,2,1,0,1,0,Banglore_New Delhi,932,0,30,1,0,269.78717137163176,0.22239752800310142,1,0
IndiGo,18/05/2019,Kolkata,Banglore,CCU → HYD → BLR,19:20,23:45,4h 25m,1 stop,No info,3717,2019-05-18,19:20:00,23:45:00,0,265,1,1,0,2053,0,0,CCU,BLR,1546.4372901474003,0,0,0,0,0,0,0,0,0,0,5,18,20,2,1,1,3,3,0,1,1,0,Kolkata_Banglore,2871,1,13,0,0,350.13674493903403,0.17136162047330172,1,0
IndiGo,1/06/2019,Chennai,Kolkata,MAA → CCU,13:15,15:35,2h 20m,non-stop,No info,3597,2019-06-01,13:15:00,15:35:00,0,140,1,1,0,2053,0,0,MAA,CCU,1385.198425287915,0,1,0,0,0,0,0,0,0,1,6,1,22,2,1,0,2,2,0,0,0,1,Chennai_Kolkata,381,1,29,1,0,593.656467980535,0.10106855266667002,1,0
Air India,18/03/2019,Banglore,New Delhi,BLR → CCU → GAU → DEL,11:05,22:10,11h 5m,2 stops,No info,10846,2019-03-18,11:05:00,22:10:00,0,665,0,1,0,1752,0,0,BLR,DEL,1708.6520853536679,0,0,0,0,1,0,0,0,0,1,3,18,12,1,1,1,1,3,1,0,2,0,Banglore_New Delhi,932,0,13,0,0,154.16409792664672,0.3891956740054275,1,0
Air India,01/03/2019,Banglore,New Delhi,BLR → CCU → DEL,05:50,22:45,16h 55m,1 stop,No info,14069,2019-03-01,05:50:00,22:45:00,0,1015,0,1,0,1752,0,0,BLR,DEL,1708.6520853536679,0,0,0,0,0,0,0,0,0,0,3,1,9,1,1,1,0,3,0,0,1,0,Banglore_New Delhi,932,0,30,1,0,101.00406415883751,0.5940355024293367,1,0
Jet Airways,1/04/2019,Delhi,Cochin,DEL → BOM → COK,22:50,12:35 02 Apr,13h 45m,1 stop,In-flight meal not included,5177,2019-04-01,22:50:00,12:35:00,0,825,0,0,1,3849,0,0,DEL,COK,2047.882109458646,0,0,0,0,0,0,0,0,0,0,4,1,14,2,1,1,3,2,0,1,1,0,Delhi_Cochin,4537,0,29,1,0,148.93688068790152,0.40285522110356603,1,0
Air India,6/03/2019,Delhi,Cochin,DEL → NAG → BOM → COK,05:55,07:40 07 Mar,25h 45m,2 stops,No info,14641,2019-03-06,05:55:00,07:40:00,0,1545,0,0,0,1752,0,0,DEL,COK,2047.882109458646,0,0,0,0,0,0,0,0,0,0,3,6,10,1,1,1,0,1,0,0,2,0,Delhi_Cochin,4537,0,25,1,0,79.52940230907363,0.7544379595212236,1,0
IndiGo,6/06/2019,Delhi,Cochin,DEL → HYD → COK,08:35,22:30,13h 55m,1 stop,No info,6442,2019-06-06,08:35:00,22:30:00,0,835,0,1,0,2053,0,0,DEL,COK,2047.882109458646,0,1,0,0,0,0,0,0,0,1,6,6,23,2,1,0,1,3,1,0,1,0,Delhi_Cochin,4537,0,24,1,0,147.15320547008236,0.4077383146927001,1,0
Air India,21/03/2019,Delhi,Cochin,DEL → BLR → COK,17:45,23:00,5h 15m,1 stop,No info,5704,2019-03-21,17:45:00,23:00:00,0,315,0,1,0,1752,0,0,DEL,COK,2047.882109458646,0,0,0,0,1,0,0,0,0,1,3,21,12,1,1,1,2,3,0,0,1,0,Delhi_Cochin,4537,0,10,0,1,390.0727827540278,0.1538174480577252,1,0
Jet Airways,6/05/2019,Kolkata,Banglore,CCU → BOM → BLR,14:05,09:20 07 May,19h 15m,1 stop,In-flight meal not included,9663,2019-05-06,14:05:00,09:20:00,0,1155,0,0,0,3849,0,0,CCU,BLR,1546.4372901474003,0,0,0,0,0,0,0,0,0,0,5,6,19,2,1,1,2,1,0,0,1,0,Kolkata_Banglore,2871,1,25,1,0,80.33440468298183,0.7468780062138245,1,0
Jet Airways,6/06/2019,Delhi,Cochin,DEL → BOM → COK,20:55,04:25 07 Jun,7h 30m,1 stop,No info,14714,2019-06-06,20:55:00,04:25:00,0,450,0,0,1,3849,0,0,DEL,COK,2047.882109458646,0,1,0,0,0,0,0,0,0,1,6,6,23,2,1,0,3,0,0,1,1,0,Delhi_Cochin,4537,0,24,1,0,273.0509479278195,0.219739211511036,1,0
Jet Airways,1/04/2019,Delhi,Cochin,DEL → BOM → COK,10:00,19:00,9h,1 stop,In-flight meal not included,5406,2019-04-01,10:00:00,19:00:00,0,540,0,1,0,3849,0,0,DEL,COK,2047.882109458646,0,0,0,0,0,0,0,0,0,0,4,1,14,2,1,1,1,3,1,0,1,0,Delhi_Cochin,4537,0,29,1,0,227.54245660651623,0.2636870538132432,1,0
Vistara,15/05/2019,Kolkata,Banglore,CCU → DEL → BLR,20:20,20:20 16 May,24h,1 stop,No info,8610,2019-05-15,20:20:00,20:20:00,0,1440,0,0,0,479,0,0,CCU,BLR,1546.4372901474003,0,0,0,0,0,0,0,0,0,0,5,15,20,2,1,1,3,3,0,1,1,0,Kolkata_Banglore,2871,1,16,0,0,64.43488708947501,0.9311725791756773,1,0
Jet Airways,12/06/2019,Delhi,Cochin,DEL → BDQ → BOM → COK,18:25,12:35 13 Jun,18h 10m,2 stops,No info,14237,2019-06-12,18:25:00,12:35:00,0,1090,0,0,0,3849,0,0,DEL,COK,2047.882109458646,0,0,0,0,0,0,0,0,0,0,6,12,24,2,1,0,3,2,0,1,2,0,Delhi_Cochin,4537,0,18,0,0,112.72745556653098,0.5322572012156206,1,0
IndiGo,9/06/2019,Banglore,Delhi,BLR → DEL,07:10,10:05,2h 55m,non-stop,No info,4823,2019-06-09,07:10:00,10:05:00,0,175,1,1,0,2053,0,0,BLR,DEL,1708.6520853536679,0,1,0,0,0,0,0,0,0,1,6,9,23,2,1,0,1,1,1,0,0,1,Banglore_Delhi,1265,1,21,1,0,585.8235721212576,0.10241991421195461,1,0
IndiGo,27/03/2019,Mumbai,Hyderabad,BOM → HYD,20:05,21:35,1h 30m,non-stop,No info,2227,2019-03-27,20:05:00,21:35:00,0,90,0,1,0,2053,0,0,BOM,HYD,622.9702752863186,0,0,0,0,0,0,0,0,0,0,3,27,13,1,1,1,3,3,0,1,0,1,Mumbai_Hyderabad,697,1,4,0,1,415.3135168575457,0.14446917223881314,0,0
Jet Airways,18/05/2019,Delhi,Cochin,DEL → BOM → COK,07:05,04:25 19 May,21h 20m,1 stop,In-flight meal not included,12373,2019-05-18,07:05:00,04:25:00,0,1280,1,0,1,3849,0,0,DEL,COK,2047.882109458646,0,0,0,0,0,0,0,0,0,0,5,18,20,2,1,1,1,0,1,0,1,0,Delhi_Cochin,4537,0,13,0,0,95.99447388087403,0.6250359794091691,1,0
Air India,6/06/2019,Delhi,Cochin,DEL → BOM → COK,13:00,19:15,6h 15m,1 stop,No info,8372,2019-06-06,13:00:00,19:15:00,0,375,0,1,0,1752,0,0,DEL,COK,2047.882109458646,0,1,0,0,0,0,0,0,0,1,6,6,23,2,1,0,2,3,0,0,1,0,Delhi_Cochin,4537,0,24,1,0,327.6611375133833,0.18311600959253,1,0
Jet Airways,3/03/2019,Delhi,Cochin,DEL → BOM → COK,13:55,04:25 04 Mar,14h 30m,1 stop,No info,17024,2019-03-03,13:55:00,04:25:00,0,870,1,0,1,3849,0,0,DEL,COK,2047.882109458646,0,0,0,0,0,0,0,0,0,0,3,3,9,1,1,1,2,0,0,0,1,0,Delhi_Cochin,4537,0,28,1,0,141.2332489281825,0.4248291422546696,1,0
Air India,27/05/2019,Mumbai,Hyderabad,BOM → HYD,21:05,22:25,1h 20m,non-stop,No info,3100,2019-05-27,21:05:00,22:25:00,0,80,0,1,1,1752,0,0,BOM,HYD,622.9702752863186,0,0,0,0,0,0,0,0,0,0,5,27,22,2,1,1,3,3,0,1,0,1,Mumbai_Hyderabad,697,1,4,0,1,467.22770646473896,0.12841704199005613,0,0
Jet Airways,9/03/2019,Delhi,Cochin,DEL → BOM → COK,06:50,19:45,12h 55m,1 stop,In-flight meal not included,14053,2019-03-09,06:50:00,19:45:00,0,775,1,1,0,3849,0,0,DEL,COK,2047.882109458646,0,0,0,0,0,0,0,0,0,0,3,9,10,1,1,1,1,3,1,0,1,0,Delhi_Cochin,4537,0,22,1,0,158.5457117000242,0.37843975315789535,1,0
IndiGo,9/05/2019,Chennai,Kolkata,MAA → CCU,05:15,07:40,2h 25m,non-stop,No info,3540,2019-05-09,05:15:00,07:40:00,0,145,0,1,0,2053,0,0,MAA,CCU,1385.198425287915,0,0,0,0,0,0,0,0,0,0,5,9,19,2,1,1,0,1,0,0,0,1,Chennai_Kolkata,381,1,22,1,0,573.1855552915509,0.1046781438333368,1,0
Vistara,21/05/2019,Kolkata,Banglore,CCU → DEL → BLR,20:20,18:50 22 May,22h 30m,1 stop,No info,9345,2019-05-21,20:20:00,18:50:00,0,1350,0,0,0,479,0,0,CCU,BLR,1546.4372901474003,0,0,0,0,0,0,0,0,0,0,5,21,21,2,1,1,3,3,0,1,1,0,Kolkata_Banglore,2871,1,10,0,1,68.73054622877335,0.8729742929771975,1,0
Jet Airways,1/06/2019,Delhi,Cochin,DEL → JAI → BOM → COK,05:30,04:25 02 Jun,22h 55m,2 stops,In-flight meal not included,10368,2019-06-01,05:30:00,04:25:00,0,1375,1,0,1,3849,0,0,DEL,COK,2047.882109458646,0,1,0,0,0,0,0,0,0,1,6,1,22,2,1,0,0,0,0,0,2,0,Delhi_Cochin,4537,0,29,1,0,89.36212841274092,0.6714253685059434,1,0
Jet Airways,01/03/2019,Banglore,New Delhi,BLR → BOM → DEL,07:00,12:25,5h 25m,1 stop,No info,26890,2019-03-01,07:00:00,12:25:00,0,325,0,1,0,3849,0,0,BLR,DEL,1708.6520853536679,0,0,0,0,0,0,0,0,0,0,3,1,9,1,1,1,1,2,1,0,1,0,Banglore_New Delhi,932,0,30,1,0,315.4434619114464,0.1902084121079157,1,0
SpiceJet,9/03/2019,Mumbai,Hyderabad,BOM → HYD,08:50,10:15,1h 25m,non-stop,No info,5755,2019-03-09,08:50:00,10:15:00,0,85,1,1,0,818,0,0,BOM,HYD,622.9702752863186,0,0,0,0,0,0,0,0,0,0,3,9,10,1,1,1,1,1,1,0,0,1,Mumbai_Hyderabad,697,1,22,1,0,439.743723731519,0.13644310711443464,0,0
Jet Airways,21/03/2019,Banglore,New Delhi,BLR → BOM → DEL,08:55,16:10,7h 15m,1 stop,In-flight meal not included,7832,2019-03-21,08:55:00,16:10:00,0,435,0,1,0,3849,0,0,BLR,DEL,1708.6520853536679,0,0,0,0,1,0,0,0,0,1,3,21,12,1,1,1,1,2,1,0,1,0,Banglore_New Delhi,932,0,10,0,1,235.6761497039542,0.25458664389828717,1,0
Jet Airways,6/05/2019,Kolkata,Banglore,CCU → BOM → BLR,08:25,20:45,12h 20m,1 stop,No info,14388,2019-05-06,08:25:00,20:45:00,0,740,0,1,0,3849,0,0,CCU,BLR,1546.4372901474003,0,0,0,0,0,0,0,0,0,0,5,6,19,2,1,1,1,3,1,0,1,0,Kolkata_Banglore,2871,1,25,1,0,125.38680730924868,0.47851924207638974,1,0
Air India,27/06/2019,Delhi,Cochin,DEL → HYD → MAA → COK,13:15,09:25 28 Jun,20h 10m,2 stops,No info,8839,2019-06-27,13:15:00,09:25:00,0,1210,0,0,0,1752,0,0,DEL,COK,2047.882109458646,0,0,0,0,0,0,0,0,0,0,6,27,26,2,1,0,2,1,0,0,2,0,Delhi_Cochin,4537,0,3,0,1,101.54787319629649,0.5908543242852301,1,0
Air India,3/03/2019,Delhi,Cochin,DEL → GOI → BOM → COK,22:00,19:15 04 Mar,21h 15m,2 stops,No info,22096,2019-03-03,22:00:00,19:15:00,0,1275,1,0,1,1752,0,0,DEL,COK,2047.882109458646,0,0,0,0,0,0,0,0,0,0,3,3,9,1,1,1,3,3,0,1,2,0,Delhi_Cochin,4537,0,28,1,0,96.37092279805394,0.622594432614602,1,0
Vistara,27/05/2019,Chennai,Kolkata,MAA → CCU,07:05,09:20,2h 15m,non-stop,No info,3687,2019-05-27,07:05:00,09:20:00,0,135,0,1,0,479,0,0,MAA,CCU,1385.198425287915,0,0,0,0,0,0,0,0,0,0,5,27,22,2,1,1,1,1,1,0,0,1,Chennai_Kolkata,381,1,4,0,1,615.6437445724066,0.09745896150000323,1,0
Multiple carriers,15/05/2019,Delhi,Cochin,DEL → BOM → COK,08:30,19:00,10h 30m,1 stop,No info,9627,2019-05-15,08:30:00,19:00:00,0,630,0,1,0,1196,0,0,DEL,COK,2047.882109458646,0,0,0,0,0,0,0,0,0,0,5,15,20,2,1,1,1,3,1,0,1,0,Delhi_Cochin,4537,0,16,0,0,195.0363913770139,0.3076348961154504,1,0
Multiple carriers,21/03/2019,Delhi,Cochin,DEL → BOM → COK,11:30,01:35 22 Mar,14h 5m,1 stop,No info,13542,2019-03-21,11:30:00,01:35:00,0,845,0,0,1,1196,0,0,DEL,COK,2047.882109458646,0,0,0,0,1,0,0,0,0,1,3,21,12,1,1,1,1,0,1,0,1,0,Delhi_Cochin,4537,0,10,0,1,145.41174741718197,0.41262140828183425,1,0
IndiGo,27/04/2019,Banglore,Delhi,BLR → DEL,04:00,06:50,2h 50m,non-stop,No info,4423,2019-04-27,04:00:00,06:50:00,0,170,1,1,1,2053,0,0,BLR,DEL,1708.6520853536679,0,0,0,0,0,0,0,0,0,0,4,27,17,2,1,1,0,1,0,0,0,1,Banglore_Delhi,1265,1,3,0,1,603.0536771836476,0.0994936309487559,1,0
IndiGo,3/03/2019,Delhi,Cochin,DEL → HYD → MAA → COK,04:55,21:20,16h 25m,2 stops,No info,8899,2019-03-03,04:55:00,21:20:00,0,985,1,1,0,2053,0,0,DEL,COK,2047.882109458646,0,0,0,0,0,0,0,0,0,0,3,3,9,1,1,1,0,3,0,0,2,0,Delhi_Cochin,4537,0,28,1,0,124.74408788580584,0.48098471852971214,1,0
SpiceJet,21/04/2019,Delhi,Cochin,DEL → MAA → COK,06:05,11:20,5h 15m,1 stop,No info,5583,2019-04-21,06:05:00,11:20:00,0,315,1,1,0,818,0,0,DEL,COK,2047.882109458646,0,0,0,0,0,0,0,0,0,0,4,21,16,2,1,1,1,1,1,0,1,0,Delhi_Cochin,4537,0,9,0,1,390.0727827540278,0.1538174480577252,1,0
Air Asia,27/05/2019,Delhi,Cochin,DEL → BLR → COK,16:45,06:35 28 May,13h 50m,1 stop,No info,6752,2019-05-27,16:45:00,06:35:00,0,830,0,0,1,319,0,0,DEL,COK,2047.882109458646,0,0,0,0,0,0,0,0,0,0,5,27,22,2,1,1,2,1,0,0,1,0,Delhi_Cochin,4537,0,4,0,1,148.03967056327562,0.40529676789813307,1,0
SpiceJet,21/05/2019,Chennai,Kolkata,MAA → CCU,08:20,10:35,2h 15m,non-stop,No check-in baggage included,3543,2019-05-21,08:20:00,10:35:00,0,135,0,1,0,818,0,0,MAA,CCU,1385.198425287915,0,0,0,0,0,0,0,0,0,0,5,21,21,2,1,1,1,1,1,0,0,1,Chennai_Kolkata,381,1,10,0,1,615.6437445724066,0.09745896150000323,1,0
Jet Airways,21/03/2019,Banglore,New Delhi,BLR → BOM → DEL,08:00,15:15,7h 15m,1 stop,In-flight meal not included,7832,2019-03-21,08:00:00,15:15:00,0,435,0,1,0,3849,0,0,BLR,DEL,1708.6520853536679,0,0,0,0,1,0,0,0,0,1,3,21,12,1,1,1,1,2,1,0,1,0,Banglore_New Delhi,932,0,10,0,1,235.6761497039542,0.25458664389828717,1,0
Air India,1/05/2019,Kolkata,Banglore,CCU → IXR → DEL → BLR,05:50,08:55 02 May,27h 5m,2 stops,No info,10991,2019-05-01,05:50:00,08:55:00,0,1625,0,0,0,1752,0,0,CCU,BLR,1546.4372901474003,0,0,0,0,0,0,0,0,0,0,5,1,18,2,1,1,0,1,0,0,2,0,Kolkata_Banglore,2871,1,30,1,0,57.09922302082708,1.0508023896947747,1,0
Jet Airways,27/05/2019,Delhi,Cochin,DEL → BOM → COK,09:00,12:35 28 May,27h 35m,1 stop,In-flight meal not included,12898,2019-05-27,09:00:00,12:35:00,0,1655,0,0,0,3849,0,0,DEL,COK,2047.882109458646,0,0,0,0,0,0,0,0,0,0,5,27,22,2,1,1,1,2,1,0,1,0,Delhi_Cochin,4537,0,4,0,1,74.24346016164276,0.808151989001699,1,0
Jet Airways,27/05/2019,Delhi,Cochin,DEL → BOM → COK,14:00,19:00,5h,1 stop,In-flight meal not included,12898,2019-05-27,14:00:00,19:00:00,0,300,0,1,0,3849,0,0,DEL,COK,2047.882109458646,0,0,0,0,0,0,0,0,0,0,5,27,22,2,1,1,2,3,0,0,1,0,Delhi_Cochin,4537,0,4,0,1,409.5764218917292,0.146492807674024,1,0
GoAir,24/05/2019,Banglore,Delhi,BLR → DEL,11:40,14:30,2h 50m,non-stop,No info,3398,2019-05-24,11:40:00,14:30:00,0,170,0,1,0,194,0,0,BLR,DEL,1708.6520853536679,0,0,0,0,0,0,0,0,0,0,5,24,21,2,1,1,1,2,1,0,0,1,Banglore_Delhi,1265,1,7,0,1,603.0536771836476,0.0994936309487559,1,0
Air India,24/04/2019,Delhi,Cochin,DEL → COK,05:10,08:00,2h 50m,non-stop,No info,5201,2019-04-24,05:10:00,08:00:00,0,170,0,1,0,1752,0,0,DEL,COK,2047.882109458646,0,0,0,0,0,0,0,0,0,0,4,24,17,2,1,1,0,1,0,0,0,1,Delhi_Cochin,4537,0,6,0,1,722.7819209854044,0.08301259101528027,1,0
Air India,6/05/2019,Kolkata,Banglore,CCU → DEL → COK → BLR,10:00,01:20 07 May,15h 20m,2 stops,No info,13873,2019-05-06,10:00:00,01:20:00,0,920,0,0,1,1752,0,0,CCU,BLR,1546.4372901474003,0,0,0,0,0,0,0,0,0,0,5,6,19,2,1,1,1,0,1,0,2,0,Kolkata_Banglore,2871,1,25,1,0,100.85460587917828,0.5949158144733494,1,0
Air India,15/06/2019,Delhi,Cochin,DEL → BLR → COK,17:40,23:00,5h 20m,1 stop,No info,7384,2019-06-15,17:40:00,23:00:00,0,320,1,1,0,1752,0,0,DEL,COK,2047.882109458646,0,0,0,0,0,0,0,0,0,0,6,15,24,2,1,0,2,3,0,0,1,0,Delhi_Cochin,4537,0,15,0,0,383.9778955234961,0.15625899485229228,1,0
Jet Airways,6/06/2019,Delhi,Cochin,DEL → BOM → COK,18:15,04:25 07 Jun,10h 10m,1 stop,In-flight meal not included,10262,2019-06-06,18:15:00,04:25:00,0,610,0,0,1,3849,0,0,DEL,COK,2047.882109458646,0,1,0,0,0,0,0,0,0,1,6,6,23,2,1,0,3,0,0,1,1,0,Delhi_Cochin,4537,0,24,1,0,201.4310271598668,0.29786870893718215,1,0
Jet Airways,24/03/2019,Kolkata,Banglore,CCU → BOM → BLR,08:25,12:00 25 Mar,27h 35m,1 stop,In-flight meal not included,10031,2019-03-24,08:25:00,12:00:00,0,1655,1,0,0,3849,0,0,CCU,BLR,1546.4372901474003,0,0,0,0,1,0,0,0,0,1,3,24,12,1,1,1,1,2,1,0,1,0,Kolkata_Banglore,2871,1,7,0,1,56.06419178782116,1.0702018184276014,1,0
Jet Airways,6/05/2019,Kolkata,Banglore,CCU → DEL → BLR,09:35,19:10,9h 35m,1 stop,In-flight meal not included,12384,2019-05-06,09:35:00,19:10:00,0,575,0,1,0,3849,0,0,CCU,BLR,1546.4372901474003,0,0,0,0,0,0,0,0,0,0,5,6,19,2,1,1,1,3,1,0,1,0,Kolkata_Banglore,2871,1,25,1,0,161.36736940668524,0.3718223840458434,1,0
Jet Airways,9/05/2019,Kolkata,Banglore,CCU → BOM → BLR,14:05,18:15 10 May,28h 10m,1 stop,In-flight meal not included,7757,2019-05-09,14:05:00,18:15:00,0,1690,0,0,0,3849,0,0,CCU,BLR,1546.4372901474003,0,0,0,0,0,0,0,0,0,0,5,9,19,2,1,1,2,3,0,0,1,0,Kolkata_Banglore,2871,1,22,1,0,54.903099058487584,1.0928344852825658,1,0
Jet Airways,06/03/2019,Banglore,New Delhi,BLR → BOM → DEL,21:25,11:25 07 Mar,14h,1 stop,No info,17261,2019-03-06,21:25:00,11:25:00,0,840,0,0,1,3849,0,0,BLR,DEL,1708.6520853536679,0,0,0,0,0,0,0,0,0,0,3,6,10,1,1,1,3,1,0,1,1,0,Banglore_New Delhi,932,0,25,1,0,122.046577525262,0.4916155882173821,1,0
SpiceJet,1/03/2019,Chennai,Kolkata,MAA → CCU,09:30,12:05,2h 35m,non-stop,No info,7298,2019-03-01,09:30:00,12:05:00,0,155,0,1,0,818,0,0,MAA,CCU,1385.198425287915,0,0,0,0,0,0,0,0,0,0,3,1,9,1,1,1,1,2,1,0,0,1,Chennai_Kolkata,381,1,30,1,0,536.2058420469348,0.11189732616667038,1,0
Jet Airways,6/04/2019,Banglore,Delhi,BLR → DEL,15:15,18:10,2h 55m,non-stop,No info,7229,2019-04-06,15:15:00,18:10:00,0,175,1,1,0,3849,0,0,BLR,DEL,1708.6520853536679,0,0,0,0,0,0,0,0,0,0,4,6,14,2,1,1,2,3,0,0,0,1,Banglore_Delhi,1265,1,24,1,0,585.8235721212576,0.10241991421195461,1,0
IndiGo,1/04/2019,Kolkata,Banglore,CCU → BLR,04:40,07:15,2h 35m,non-stop,No info,4174,2019-04-01,04:40:00,07:15:00,0,155,0,1,0,2053,0,0,CCU,BLR,1546.4372901474003,0,0,0,0,0,0,0,0,0,0,4,1,14,2,1,1,0,1,0,0,0,1,Kolkata_Banglore,2871,1,29,1,0,598.6208865086711,0.10023038178627082,1,0
IndiGo,18/05/2019,Kolkata,Banglore,CCU → MAA → BLR,17:35,22:15,4h 40m,1 stop,No info,5699,2019-05-18,17:35:00,22:15:00,0,280,1,1,0,2053,0,0,CCU,BLR,1546.4372901474003,0,0,0,0,0,0,0,0,0,0,5,18,20,2,1,1,2,3,0,0,1,0,Kolkata_Banglore,2871,1,13,0,0,331.37941931730006,0.18106133483971504,1,0
Air India,24/04/2019,Kolkata,Banglore,CCU → BLR,14:15,16:45,2h 30m,non-stop,No info,4880,2019-04-24,14:15:00,16:45:00,0,150,0,1,0,1752,0,0,CCU,BLR,1546.4372901474003,0,0,0,0,0,0,0,0,0,0,4,24,17,2,1,1,2,2,0,0,0,1,Kolkata_Banglore,2871,1,6,0,1,618.5749160589601,0.09699714366413306,1,0
Air India,6/03/2019,Delhi,Cochin,DEL → BOM → COK,08:00,19:15,11h 15m,1 stop,No info,15284,2019-03-06,08:00:00,19:15:00,0,675,0,1,0,1752,0,0,DEL,COK,2047.882109458646,0,0,0,0,0,0,0,0,0,0,3,6,10,1,1,1,1,3,1,0,1,0,Delhi_Cochin,4537,0,25,1,0,182.033965285213,0.329608817266554,1,0
Jet Airways,24/03/2019,Kolkata,Banglore,CCU → BOM → BLR,08:25,16:20,7h 55m,1 stop,No info,13759,2019-03-24,08:25:00,16:20:00,0,475,1,1,0,3849,0,0,CCU,BLR,1546.4372901474003,0,0,0,0,1,0,0,0,0,1,3,24,12,1,1,1,1,2,1,0,1,0,Kolkata_Banglore,2871,1,7,0,1,195.33944717651372,0.307157621603088,1,0
Vistara,24/03/2019,Kolkata,Banglore,CCU → DEL → BLR,09:55,18:45,8h 50m,1 stop,No info,16092,2019-03-24,09:55:00,18:45:00,0,530,1,1,0,479,0,0,CCU,BLR,1546.4372901474003,0,0,0,0,1,0,0,0,0,1,3,24,12,1,1,1,1,3,1,0,1,0,Kolkata_Banglore,2871,1,7,0,1,175.06837246951702,0.34272324094660345,1,0
IndiGo,9/03/2019,Mumbai,Hyderabad,BOM → HYD,06:20,07:45,1h 25m,non-stop,No info,4392,2019-03-09,06:20:00,07:45:00,0,85,1,1,0,2053,0,0,BOM,HYD,622.9702752863186,0,0,0,0,0,0,0,0,0,0,3,9,10,1,1,1,1,1,1,0,0,1,Mumbai_Hyderabad,697,1,22,1,0,439.743723731519,0.13644310711443464,0,0
Jet Airways,24/06/2019,Delhi,Cochin,DEL → BOM → COK,20:55,12:35 25 Jun,15h 40m,1 stop,In-flight meal not included,10262,2019-06-24,20:55:00,12:35:00,0,940,0,0,0,3849,0,0,DEL,COK,2047.882109458646,0,0,0,0,0,0,0,0,0,0,6,24,26,2,1,0,3,2,0,1,1,0,Delhi_Cochin,4537,0,6,0,1,130.7158793271476,0.45901079737860856,1,0
SpiceJet,12/06/2019,Kolkata,Banglore,CCU → BLR,06:55,09:30,2h 35m,non-stop,No check-in baggage included,3841,2019-06-12,06:55:00,09:30:00,0,155,0,1,0,818,0,0,CCU,BLR,1546.4372901474003,0,0,0,0,0,0,0,0,0,0,6,12,24,2,1,0,1,1,1,0,0,1,Kolkata_Banglore,2871,1,18,0,0,598.6208865086711,0.10023038178627082,1,0
GoAir,1/06/2019,Banglore,Delhi,BLR → DEL,07:45,10:40,2h 55m,non-stop,No info,5048,2019-06-01,07:45:00,10:40:00,0,175,1,1,0,194,0,0,BLR,DEL,1708.6520853536679,0,1,0,0,0,0,0,0,0,1,6,1,22,2,1,0,1,1,1,0,0,1,Banglore_Delhi,1265,1,29,1,0,585.8235721212576,0.10241991421195461,1,0
Air India,21/05/2019,Kolkata,Banglore,CCU → DEL → BLR,07:00,20:25,13h 25m,1 stop,No info,11096,2019-05-21,07:00:00,20:25:00,0,805,0,1,0,1752,0,0,CCU,BLR,1546.4372901474003,0,0,0,0,0,0,0,0,0,0,5,21,21,2,1,1,1,3,1,0,1,0,Kolkata_Banglore,2871,1,10,0,1,115.26240671906089,0.5205513376641807,1,0
IndiGo,24/04/2019,Delhi,Cochin,DEL → HYD → COK,07:35,12:10,4h 35m,1 stop,No info,5073,2019-04-24,07:35:00,12:10:00,0,275,0,1,0,2053,0,0,DEL,COK,2047.882109458646,0,0,0,0,0,0,0,0,0,0,4,24,17,2,1,1,1,2,1,0,1,0,Delhi_Cochin,4537,0,6,0,1,446.8106420637046,0.13428507370118867,1,0
Jet Airways,3/03/2019,Delhi,Cochin,DEL → BOM → COK,09:55,04:25 04 Mar,18h 30m,1 stop,No info,19828,2019-03-03,09:55:00,04:25:00,0,1110,1,0,1,3849,0,0,DEL,COK,2047.882109458646,0,0,0,0,0,0,0,0,0,0,3,3,9,1,1,1,1,0,1,0,1,0,Delhi_Cochin,4537,0,28,1,0,110.6963302410079,0.5420233883938887,1,0
Vistara,21/03/2019,Chennai,Kolkata,MAA → CCU,07:05,09:20,2h 15m,non-stop,No info,3739,2019-03-21,07:05:00,09:20:00,0,135,0,1,0,479,0,0,MAA,CCU,1385.198425287915,0,0,0,0,1,0,0,0,0,1,3,21,12,1,1,1,1,1,1,0,0,1,Chennai_Kolkata,381,1,10,0,1,615.6437445724066,0.09745896150000323,1,0
Air India,9/03/2019,Delhi,Cochin,DEL → AMD → BOM → COK,05:00,19:15 10 Mar,38h 15m,2 stops,No info,10598,2019-03-09,05:00:00,19:15:00,0,2295,1,0,0,1752,0,0,DEL,COK,2047.882109458646,0,0,0,0,0,0,0,0,0,0,3,9,10,1,1,1,0,3,0,0,2,0,Delhi_Cochin,4537,0,22,1,0,53.5394015544744,1.1206699787062837,1,0
Jet Airways,15/06/2019,Banglore,Delhi,BLR → DEL,18:55,22:00,3h 5m,non-stop,In-flight meal not included,7229,2019-06-15,18:55:00,22:00:00,0,185,1,1,0,3849,0,0,BLR,DEL,1708.6520853536679,0,0,0,0,0,0,0,0,0,0,6,15,24,2,1,0,3,3,0,1,0,1,Banglore_Delhi,1265,1,15,0,0,554.157433087676,0.10827248073835201,1,0
Vistara,1/04/2019,Kolkata,Banglore,CCU → DEL → BLR,17:00,18:50 02 Apr,25h 50m,1 stop,No info,8610,2019-04-01,17:00:00,18:50:00,0,1550,0,0,0,479,0,0,CCU,BLR,1546.4372901474003,0,0,0,0,0,0,0,0,0,0,4,1,14,2,1,1,2,3,0,0,1,0,Kolkata_Banglore,2871,1,29,1,0,59.86208865086711,1.0023038178627082,1,0
Vistara,9/05/2019,Delhi,Cochin,DEL → COK,14:40,17:50,3h 10m,non-stop,No info,6216,2019-05-09,14:40:00,17:50:00,0,190,0,1,0,479,0,0,DEL,COK,2047.882109458646,0,0,0,0,0,0,0,0,0,0,5,9,19,2,1,1,2,2,0,0,0,1,Delhi_Cochin,4537,0,22,1,0,646.6996135132566,0.09277877819354853,1,0
Air India,9/06/2019,Banglore,Delhi,BLR → DEL,13:20,16:10,2h 50m,non-stop,No info,6961,2019-06-09,13:20:00,16:10:00,0,170,1,1,0,1752,0,0,BLR,DEL,1708.6520853536679,0,1,0,0,0,0,0,0,0,1,6,9,23,2,1,0,2,2,0,0,0,1,Banglore_Delhi,1265,1,21,1,0,603.0536771836476,0.0994936309487559,1,0
Jet Airways,6/05/2019,Kolkata,Banglore,CCU → DEL → BLR,09:35,21:05,11h 30m,1 stop,In-flight meal not included,10703,2019-05-06,09:35:00,21:05:00,0,690,0,1,0,3849,0,0,CCU,BLR,1546.4372901474003,0,0,0,0,0,0,0,0,0,0,5,6,19,2,1,1,1,3,1,0,1,0,Kolkata_Banglore,2871,1,25,1,0,134.47280783890437,0.4461868608550121,1,0
Jet Airways,15/05/2019,Kolkata,Banglore,CCU → DEL → BLR,17:00,23:35,6h 35m,1 stop,No info,14151,2019-05-15,17:00:00,23:35:00,0,395,0,1,0,3849,0,0,CCU,BLR,1546.4372901474003,0,0,0,0,0,0,0,0,0,0,5,15,20,2,1,1,2,3,0,0,1,0,Kolkata_Banglore,2871,1,16,0,0,234.90186685783297,0.2554258116488837,1,0
Jet Airways,9/05/2019,Kolkata,Banglore,CCU → BOM → BLR,06:30,10:05 10 May,27h 35m,1 stop,In-flight meal not included,8586,2019-05-09,06:30:00,10:05:00,0,1655,0,0,0,3849,0,0,CCU,BLR,1546.4372901474003,0,0,0,0,0,0,0,0,0,0,5,9,19,2,1,1,1,1,1,0,1,0,Kolkata_Banglore,2871,1,22,1,0,56.06419178782116,1.0702018184276014,1,0
IndiGo,12/04/2019,Kolkata,Banglore,CCU → BLR,20:20,22:55,2h 35m,non-stop,No info,4488,2019-04-12,20:20:00,22:55:00,0,155,0,1,0,2053,0,0,CCU,BLR,1546.4372901474003,0,0,0,0,0,0,0,0,0,0,4,12,15,2,1,1,3,3,0,1,0,1,Kolkata_Banglore,2871,1,18,0,0,598.6208865086711,0.10023038178627082,1,0
Multiple carriers,15/06/2019,Delhi,Cochin,DEL → BOM → COK,18:00,01:30 16 Jun,7h 30m,1 stop,No info,7408,2019-06-15,18:00:00,01:30:00,0,450,1,0,1,1196,0,0,DEL,COK,2047.882109458646,0,0,0,0,0,0,0,0,0,0,6,15,24,2,1,0,3,0,0,1,1,0,Delhi_Cochin,4537,0,15,0,0,273.0509479278195,0.219739211511036,1,0
Jet Airways,18/04/2019,Delhi,Cochin,DEL → COK,11:00,14:15,3h 15m,non-stop,In-flight meal not included,5443,2019-04-18,11:00:00,14:15:00,0,195,0,1,0,3849,0,0,DEL,COK,2047.882109458646,0,0,0,0,0,0,0,0,0,0,4,18,16,2,1,1,1,2,1,0,0,1,Delhi_Cochin,4537,0,12,0,0,630.1175721411219,0.0952203249881156,1,0
Jet Airways,12/06/2019,Kolkata,Banglore,CCU → DEL → BLR,09:35,19:10,9h 35m,1 stop,In-flight meal not included,10539,2019-06-12,09:35:00,19:10:00,0,575,0,1,0,3849,0,0,CCU,BLR,1546.4372901474003,0,0,0,0,0,0,0,0,0,0,6,12,24,2,1,0,1,3,1,0,1,0,Kolkata_Banglore,2871,1,18,0,0,161.36736940668524,0.3718223840458434,1,0
Multiple carriers,1/06/2019,Delhi,Cochin,DEL → BOM → COK,13:00,01:30 02 Jun,12h 30m,1 stop,No info,7723,2019-06-01,13:00:00,01:30:00,0,750,1,0,1,1196,0,0,DEL,COK,2047.882109458646,0,1,0,0,0,0,0,0,0,1,6,1,22,2,1,0,2,0,0,0,1,0,Delhi_Cochin,4537,0,29,1,0,163.83056875669166,0.36623201918506,1,0
Multiple carriers,6/03/2019,Delhi,Cochin,DEL → BOM → COK,07:30,18:50,11h 20m,1 stop,No info,15411,2019-03-06,07:30:00,18:50:00,0,680,0,1,0,1196,0,0,DEL,COK,2047.882109458646,0,0,0,0,0,0,0,0,0,0,3,6,10,1,1,1,1,3,1,0,1,0,Delhi_Cochin,4537,0,25,1,0,180.6954802463511,0.3320503640611211,1,0
Jet Airways,21/05/2019,Banglore,Delhi,BLR → DEL,07:10,10:10,3h,non-stop,No info,7229,2019-05-21,07:10:00,10:10:00,0,180,0,1,0,3849,0,0,BLR,DEL,1708.6520853536679,0,0,0,0,0,0,0,0,0,0,5,21,21,2,1,1,1,1,1,0,0,1,Banglore_Delhi,1265,1,10,0,1,569.5506951178893,0.10534619747515331,1,0
IndiGo,21/06/2019,Kolkata,Banglore,CCU → BLR,20:20,22:55,2h 35m,non-stop,No info,4804,2019-06-21,20:20:00,22:55:00,0,155,0,1,0,2053,0,0,CCU,BLR,1546.4372901474003,0,0,0,0,0,0,0,0,0,0,6,21,25,2,1,0,3,3,0,1,0,1,Kolkata_Banglore,2871,1,9,0,1,598.6208865086711,0.10023038178627082,1,0
Jet Airways,3/03/2019,Mumbai,Hyderabad,BOM → HYD,02:55,04:25,1h 30m,non-stop,In-flight meal not included,4050,2019-03-03,02:55:00,04:25:00,0,90,1,1,1,3849,0,0,BOM,HYD,622.9702752863186,0,0,0,0,0,0,0,0,0,0,3,3,9,1,1,1,0,0,0,0,0,1,Mumbai_Hyderabad,697,1,28,1,0,415.3135168575457,0.14446917223881314,0,0
Jet Airways,18/05/2019,Kolkata,Banglore,CCU → DEL → BLR,17:00,19:10 19 May,26h 10m,1 stop,No info,14151,2019-05-18,17:00:00,19:10:00,0,1570,1,0,0,3849,0,0,CCU,BLR,1546.4372901474003,0,0,0,0,0,0,0,0,0,0,5,18,20,2,1,1,2,3,0,0,1,0,Kolkata_Banglore,2871,1,13,0,0,59.09951427314906,1.0152367703512593,1,0
SpiceJet,6/04/2019,Delhi,Cochin,DEL → BLR → COK,17:55,22:50,4h 55m,1 stop,No info,4957,2019-04-06,17:55:00,22:50:00,0,295,1,1,0,818,0,0,DEL,COK,2047.882109458646,0,0,0,0,0,0,0,0,0,0,4,6,14,2,1,1,2,3,0,0,1,0,Delhi_Cochin,4537,0,24,1,0,416.5183951441314,0.14405126087945694,1,0
Air India,03/03/2019,Banglore,New Delhi,BLR → DEL,21:10,23:55,2h 45m,non-stop,No info,7591,2019-03-03,21:10:00,23:55:00,0,165,1,1,1,1752,0,0,BLR,DEL,1708.6520853536679,0,0,0,0,0,0,0,0,0,0,3,3,9,1,1,1,3,3,0,1,0,1,Banglore_New Delhi,932,0,28,1,0,621.3280310376974,0.09656734768555719,1,0
Jet Airways,24/03/2019,Kolkata,Banglore,CCU → BOM → BLR,13:55,22:35,8h 40m,1 stop,In-flight meal not included,11134,2019-03-24,13:55:00,22:35:00,0,520,1,1,0,3849,0,0,CCU,BLR,1546.4372901474003,0,0,0,0,1,0,0,0,0,1,3,24,12,1,1,1,2,3,0,0,1,0,Kolkata_Banglore,2871,1,7,0,1,178.43507194008464,0.3362567647023279,1,0
IndiGo,27/05/2019,Delhi,Cochin,DEL → HYD → COK,05:05,12:10,7h 5m,1 stop,No info,6600,2019-05-27,05:05:00,12:10:00,0,425,0,1,0,2053,0,0,DEL,COK,2047.882109458646,0,0,0,0,0,0,0,0,0,0,5,27,22,2,1,1,0,2,0,0,1,0,Delhi_Cochin,4537,0,4,0,1,289.11276839416183,0.20753147753820067,1,0
Air India,09/03/2019,Banglore,New Delhi,BLR → DEL,21:10,23:55,2h 45m,non-stop,No info,4966,2019-03-09,21:10:00,23:55:00,0,165,1,1,1,1752,0,0,BLR,DEL,1708.6520853536679,0,0,0,0,0,0,0,0,0,0,3,9,10,1,1,1,3,3,0,1,0,1,Banglore_New Delhi,932,0,22,1,0,621.3280310376974,0.09656734768555719,1,0
Air India,1/06/2019,Delhi,Cochin,DEL → CCU → BOM → COK,06:50,07:40 02 Jun,24h 50m,2 stops,No info,15481,2019-06-01,06:50:00,07:40:00,0,1490,1,0,0,1752,0,0,DEL,COK,2047.882109458646,0,1,0,0,0,0,0,0,0,1,6,1,22,2,1,0,1,1,1,0,2,0,Delhi_Cochin,4537,0,29,1,0,82.46505138759647,0.7275809447809859,1,0
SpiceJet,1/03/2019,Kolkata,Banglore,CCU → BLR,22:20,00:40 02 Mar,2h 20m,non-stop,No info,5515,2019-03-01,22:20:00,00:40:00,0,140,0,0,1,818,0,0,CCU,BLR,1546.4372901474003,0,0,0,0,0,0,0,0,0,0,3,1,9,1,1,1,3,0,0,1,0,1,Kolkata_Banglore,2871,1,30,1,0,662.7588386346001,0.09053066741985752,1,0
Jet Airways,15/06/2019,Delhi,Cochin,DEL → BOM → COK,08:00,19:00,11h,1 stop,No info,14714,2019-06-15,08:00:00,19:00:00,0,660,1,1,0,3849,0,0,DEL,COK,2047.882109458646,0,0,0,0,0,0,0,0,0,0,6,15,24,2,1,0,1,3,1,0,1,0,Delhi_Cochin,4537,0,15,0,0,186.1711008598769,0.3222841768828528,1,0
GoAir,15/06/2019,Delhi,Cochin,DEL → BOM → COK,10:35,19:35,9h,1 stop,No info,4959,2019-06-15,10:35:00,19:35:00,0,540,1,1,0,194,0,0,DEL,COK,2047.882109458646,0,0,0,0,0,0,0,0,0,0,6,15,24,2,1,0,1,3,1,0,1,0,Delhi_Cochin,4537,0,15,0,0,227.54245660651623,0.2636870538132432,1,0
Jet Airways,21/04/2019,Banglore,Delhi,BLR → DEL,11:10,14:05,2h 55m,non-stop,No info,7229,2019-04-21,11:10:00,14:05:00,0,175,1,1,0,3849,0,0,BLR,DEL,1708.6520853536679,0,0,0,0,0,0,0,0,0,0,4,21,16,2,1,1,1,2,1,0,0,1,Banglore_Delhi,1265,1,9,0,1,585.8235721212576,0.10241991421195461,1,0
Air India,15/05/2019,Delhi,Cochin,DEL → COK,18:05,21:10,3h 5m,non-stop,No info,6094,2019-05-15,18:05:00,21:10:00,0,185,0,1,0,1752,0,0,DEL,COK,2047.882109458646,0,0,0,0,0,0,0,0,0,0,5,15,20,2,1,1,3,3,0,1,0,1,Delhi_Cochin,4537,0,16,0,0,664.1779814460473,0.09033723139898146,1,0
Air Asia,24/04/2019,Kolkata,Banglore,CCU → BLR,10:20,12:55,2h 35m,non-stop,No info,4409,2019-04-24,10:20:00,12:55:00,0,155,0,1,0,319,0,0,CCU,BLR,1546.4372901474003,0,0,0,0,0,0,0,0,0,0,4,24,17,2,1,1,1,2,1,0,0,1,Kolkata_Banglore,2871,1,6,0,1,598.6208865086711,0.10023038178627082,1,0
Multiple carriers,18/05/2019,Delhi,Cochin,DEL → BOM → COK,06:00,19:00,13h,1 stop,No info,9794,2019-05-18,06:00:00,19:00:00,0,780,1,1,0,1196,0,0,DEL,COK,2047.882109458646,0,0,0,0,0,0,0,0,0,0,5,18,20,2,1,1,1,3,1,0,1,0,Delhi_Cochin,4537,0,13,0,0,157.52939303528046,0.3808812999524624,1,0
Jet Airways,3/04/2019,Mumbai,Hyderabad,BOM → HYD,02:55,04:20,1h 25m,non-stop,No info,5678,2019-04-03,02:55:00,04:20:00,0,85,0,1,1,3849,0,0,BOM,HYD,622.9702752863186,0,0,0,0,0,0,0,0,0,0,4,3,14,2,1,1,0,0,0,0,0,1,Mumbai_Hyderabad,697,1,27,1,0,439.743723731519,0.13644310711443464,0,0
IndiGo,15/06/2019,Delhi,Cochin,DEL → HYD → COK,08:35,16:10,7h 35m,1 stop,No info,6442,2019-06-15,08:35:00,16:10:00,0,455,1,1,0,2053,0,0,DEL,COK,2047.882109458646,0,0,0,0,0,0,0,0,0,0,6,15,24,2,1,0,1,2,1,0,1,0,Delhi_Cochin,4537,0,15,0,0,270.05038806048077,0.22218075830560308,1,0
Vistara,18/05/2019,Banglore,Delhi,BLR → DEL,07:00,09:40,2h 40m,non-stop,No info,4878,2019-05-18,07:00:00,09:40:00,0,160,1,1,0,479,0,0,BLR,DEL,1708.6520853536679,0,0,0,0,0,0,0,0,0,0,5,18,20,2,1,1,1,1,1,0,0,1,Banglore_Delhi,1265,1,13,0,0,640.7445320076254,0.09364106442235849,1,0
Jet Airways,24/03/2019,Kolkata,Banglore,CCU → BOM → BLR,21:10,10:05 25 Mar,12h 55m,1 stop,In-flight meal not included,12446,2019-03-24,21:10:00,10:05:00,0,775,1,0,1,3849,0,0,CCU,BLR,1546.4372901474003,0,0,0,0,1,0,0,0,0,1,3,24,12,1,1,1,3,1,0,1,1,0,Kolkata_Banglore,2871,1,7,0,1,119.72417730173422,0.5011519089313541,1,0
Jet Airways,9/05/2019,Delhi,Cochin,DEL → AMD → BOM → COK,23:05,04:25 11 May,29h 20m,2 stops,No info,16704,2019-05-09,23:05:00,04:25:00,0,1760,0,0,1,3849,0,0,DEL,COK,2047.882109458646,0,0,0,0,0,0,0,0,0,0,5,9,19,2,1,1,3,0,0,1,2,0,Delhi_Cochin,4537,0,22,1,0,69.81416282245384,0.8594244716876075,1,0
Jet Airways,15/03/2019,Banglore,New Delhi,BLR → BOM → DEL,05:45,10:45,5h,1 stop,In-flight meal not included,9134,2019-03-15,05:45:00,10:45:00,0,300,0,1,0,3849,0,0,BLR,DEL,1708.6520853536679,0,0,0,0,1,0,0,0,0,1,3,15,11,1,1,1,0,1,0,0,1,0,Banglore_New Delhi,932,0,16,0,0,341.73041707073355,0.17557699579192218,1,0
Jet Airways,15/05/2019,Kolkata,Banglore,CCU → BOM → BLR,20:00,04:40 16 May,8h 40m,1 stop,In-flight meal not included,8586,2019-05-15,20:00:00,04:40:00,0,520,0,0,1,3849,0,0,CCU,BLR,1546.4372901474003,0,0,0,0,0,0,0,0,0,0,5,15,20,2,1,1,3,0,0,1,1,0,Kolkata_Banglore,2871,1,16,0,0,178.43507194008464,0.3362567647023279,1,0
Jet Airways,1/06/2019,Banglore,Delhi,BLR → DEL,07:10,10:10,3h,non-stop,In-flight meal not included,7229,2019-06-01,07:10:00,10:10:00,0,180,1,1,0,3849,0,0,BLR,DEL,1708.6520853536679,0,1,0,0,0,0,0,0,0,1,6,1,22,2,1,0,1,1,1,0,0,1,Banglore_Delhi,1265,1,29,1,0,569.5506951178893,0.10534619747515331,1,0
Jet Airways,21/04/2019,Banglore,Delhi,BLR → DEL,07:10,10:10,3h,non-stop,In-flight meal not included,6144,2019-04-21,07:10:00,10:10:00,0,180,1,1,0,3849,0,0,BLR,DEL,1708.6520853536679,0,0,0,0,0,0,0,0,0,0,4,21,16,2,1,1,1,1,1,0,0,1,Banglore_Delhi,1265,1,9,0,1,569.5506951178893,0.10534619747515331,1,0
Air India,18/05/2019,Banglore,Delhi,BLR → DEL,10:00,12:45,2h 45m,non-stop,No info,6961,2019-05-18,10:00:00,12:45:00,0,165,1,1,0,1752,0,0,BLR,DEL,1708.6520853536679,0,0,0,0,0,0,0,0,0,0,5,18,20,2,1,1,1,2,1,0,0,1,Banglore_Delhi,1265,1,13,0,0,621.3280310376974,0.09656734768555719,1,0
Jet Airways,9/05/2019,Kolkata,Banglore,CCU → BOM → BLR,16:30,04:40 10 May,12h 10m,1 stop,In-flight meal not included,10844,2019-05-09,16:30:00,04:40:00,0,730,0,0,1,3849,0,0,CCU,BLR,1546.4372901474003,0,0,0,0,0,0,0,0,0,0,5,9,19,2,1,1,2,0,0,0,1,0,Kolkata_Banglore,2871,1,22,1,0,127.10443480663565,0.4720527658321142,1,0
IndiGo,21/05/2019,Chennai,Kolkata,MAA → CCU,19:35,21:55,2h 20m,non-stop,No info,3597,2019-05-21,19:35:00,21:55:00,0,140,0,1,0,2053,0,0,MAA,CCU,1385.198425287915,0,0,0,0,0,0,0,0,0,0,5,21,21,2,1,1,3,3,0,1,0,1,Chennai_Kolkata,381,1,10,0,1,593.656467980535,0.10106855266667002,1,0
SpiceJet,21/03/2019,Banglore,New Delhi,BLR → PNQ → DEL,10:20,18:15,7h 55m,1 stop,No info,7139,2019-03-21,10:20:00,18:15:00,0,475,0,1,0,818,0,0,BLR,DEL,1708.6520853536679,0,0,0,0,1,0,0,0,0,1,3,21,12,1,1,1,1,3,1,0,1,0,Banglore_New Delhi,932,0,10,0,1,215.8297370973054,0.2779969100038768,1,0
Air India,6/03/2019,Mumbai,Hyderabad,BOM → JDH → DEL → HYD,09:40,15:15 07 Mar,29h 35m,2 stops,No info,25139,2019-03-06,09:40:00,15:15:00,0,1775,0,0,0,1752,0,0,BOM,HYD,622.9702752863186,0,0,0,0,0,0,0,0,0,0,3,6,10,1,1,1,1,2,1,0,2,0,Mumbai_Hyderabad,697,1,25,1,0,21.058150150523446,2.8492531191543704,1,0
Jet Airways,1/06/2019,Delhi,Cochin,DEL → JAI → BOM → COK,09:40,12:35 02 Jun,26h 55m,2 stops,In-flight meal not included,10368,2019-06-01,09:40:00,12:35:00,0,1615,1,0,0,3849,0,0,DEL,COK,2047.882109458646,0,1,0,0,0,0,0,0,0,1,6,1,22,2,1,0,1,2,1,0,2,0,Delhi_Cochin,4537,0,29,1,0,76.08230747214783,0.7886196146451625,1,0
Air India,6/04/2019,Delhi,Cochin,DEL → MAA → COK,20:40,09:25 07 Apr,12h 45m,1 stop,No info,5117,2019-04-06,20:40:00,09:25:00,0,765,1,0,0,1752,0,0,DEL,COK,2047.882109458646,0,0,0,0,0,0,0,0,0,0,4,6,14,2,1,1,3,1,0,1,1,0,Delhi_Cochin,4537,0,24,1,0,160.6182046634232,0.3735566595687612,1,0
Multiple carriers,18/05/2019,Delhi,Cochin,DEL → BOM → COK,11:40,19:15,7h 35m,1 stop,No info,9211,2019-05-18,11:40:00,19:15:00,0,455,1,1,0,1196,0,0,DEL,COK,2047.882109458646,0,0,0,0,0,0,0,0,0,0,5,18,20,2,1,1,1,3,1,0,1,0,Delhi_Cochin,4537,0,13,0,0,270.05038806048077,0.22218075830560308,1,0
SpiceJet,15/04/2019,Kolkata,Banglore,CCU → BLR,17:10,19:40,2h 30m,non-stop,No info,4174,2019-04-15,17:10:00,19:40:00,0,150,0,1,0,818,0,0,CCU,BLR,1546.4372901474003,0,0,0,0,0,0,0,0,0,0,4,15,16,2,1,1,2,3,0,0,0,1,Kolkata_Banglore,2871,1,15,0,0,618.5749160589601,0.09699714366413306,1,0
Multiple carriers,27/05/2019,Delhi,Cochin,DEL → BOM → COK,07:30,19:15,11h 45m,1 stop,No info,10786,2019-05-27,07:30:00,19:15:00,0,705,0,1,0,1196,0,0,DEL,COK,2047.882109458646,0,0,0,0,0,0,0,0,0,0,5,27,22,2,1,1,1,3,1,0,1,0,Delhi_Cochin,4537,0,4,0,1,174.2878391028635,0.3442580980339564,1,0
Jet Airways,15/03/2019,Banglore,New Delhi,BLR → BOM → DEL,08:00,07:40 16 Mar,23h 40m,1 stop,In-flight meal not included,9134,2019-03-15,08:00:00,07:40:00,0,1420,0,0,0,3849,0,0,BLR,DEL,1708.6520853536679,0,0,0,0,1,0,0,0,0,1,3,15,11,1,1,1,1,1,1,0,1,0,Banglore_New Delhi,932,0,16,0,0,72.1965669867747,0.8310644467484316,1,0
Jet Airways,1/06/2019,Delhi,Cochin,DEL → NAG → BOM → COK,14:35,04:25 02 Jun,13h 50m,2 stops,No info,13376,2019-06-01,14:35:00,04:25:00,0,830,1,0,1,3849,0,0,DEL,COK,2047.882109458646,0,1,0,0,0,0,0,0,0,1,6,1,22,2,1,0,2,0,0,0,2,0,Delhi_Cochin,4537,0,29,1,0,148.03967056327562,0.40529676789813307,1,0
Air India,21/03/2019,Banglore,New Delhi,BLR → COK → DEL,22:00,10:50 19 Mar,12h 50m,1 stop,No info,6955,2019-03-21,22:00:00,10:50:00,0,770,0,0,1,1752,0,0,BLR,DEL,1708.6520853536679,0,0,0,0,1,0,0,0,0,1,3,21,12,1,1,1,3,1,0,1,1,0,Banglore_New Delhi,932,0,10,0,1,133.14172093664945,0.45064762253260027,1,0
Jet Airways,9/05/2019,Kolkata,Banglore,CCU → BOM → BLR,08:25,18:15,9h 50m,1 stop,In-flight meal not included,10844,2019-05-09,08:25:00,18:15:00,0,590,0,1,0,3849,0,0,CCU,BLR,1546.4372901474003,0,0,0,0,0,0,0,0,0,0,5,9,19,2,1,1,1,3,1,0,1,0,Kolkata_Banglore,2871,1,22,1,0,157.26480916753223,0.3815220984122567,1,0
Air Asia,1/04/2019,Kolkata,Banglore,CCU → BLR,19:55,22:25,2h 30m,non-stop,No info,3807,2019-04-01,19:55:00,22:25:00,0,150,0,1,0,319,0,0,CCU,BLR,1546.4372901474003,0,0,0,0,0,0,0,0,0,0,4,1,14,2,1,1,3,3,0,1,0,1,Kolkata_Banglore,2871,1,29,1,0,618.5749160589601,0.09699714366413306,1,0
Jet Airways,1/05/2019,Kolkata,Banglore,CCU → BOM → BLR,14:05,12:00 02 May,21h 55m,1 stop,In-flight meal not included,9663,2019-05-01,14:05:00,12:00:00,0,1315,0,0,0,3849,0,0,CCU,BLR,1546.4372901474003,0,0,0,0,0,0,0,0,0,0,5,1,18,2,1,1,2,2,0,0,1,0,Kolkata_Banglore,2871,1,30,1,0,70.55987635653537,0.8503416261222331,1,0
Jet Airways,9/05/2019,Delhi,Cochin,DEL → BOM → COK,02:15,04:25 10 May,26h 10m,1 stop,In-flight meal not included,12373,2019-05-09,02:15:00,04:25:00,0,1570,0,0,1,3849,0,0,DEL,COK,2047.882109458646,0,0,0,0,0,0,0,0,0,0,5,9,19,2,1,1,0,0,0,0,1,0,Delhi_Cochin,4537,0,22,1,0,78.26301055255972,0.766645693494059,1,0
SpiceJet,1/05/2019,Banglore,Delhi,BLR → DEL,21:10,00:05 02 May,2h 55m,non-stop,No info,4991,2019-05-01,21:10:00,00:05:00,0,175,0,0,1,818,0,0,BLR,DEL,1708.6520853536679,0,0,0,0,0,0,0,0,0,0,5,1,18,2,1,1,3,0,0,1,0,1,Banglore_Delhi,1265,1,30,1,0,585.8235721212576,0.10241991421195461,1,0
Air India,21/03/2019,Delhi,Cochin,DEL → BOM → COK,23:00,19:15 22 Mar,20h 15m,1 stop,No info,6745,2019-03-21,23:00:00,19:15:00,0,1215,0,0,1,1752,0,0,DEL,COK,2047.882109458646,0,0,0,0,1,0,0,0,0,1,3,21,12,1,1,1,3,3,0,1,1,0,Delhi_Cochin,4537,0,10,0,1,101.12998071400722,0.5932958710797972,1,0
Jet Airways,15/06/2019,Delhi,Cochin,DEL → BOM → COK,22:50,19:00 16 Jun,20h 10m,1 stop,In-flight meal not included,10262,2019-06-15,22:50:00,19:00:00,0,1210,1,0,1,3849,0,0,DEL,COK,2047.882109458646,0,0,0,0,0,0,0,0,0,0,6,15,24,2,1,0,3,3,0,1,1,0,Delhi_Cochin,4537,0,15,0,0,101.54787319629649,0.5908543242852301,1,0
Jet Airways,27/03/2019,Delhi,Cochin,DEL → BOM → COK,17:30,04:25 28 Mar,10h 55m,1 stop,In-flight meal not included,6540,2019-03-27,17:30:00,04:25:00,0,655,0,0,1,3849,0,0,DEL,COK,2047.882109458646,0,0,0,0,0,0,0,0,0,0,3,27,13,1,1,1,2,0,0,0,1,0,Delhi_Cochin,4537,0,4,0,1,187.59225430155536,0.31984263008828573,1,0
SpiceJet,6/04/2019,Kolkata,Banglore,CCU → BLR,17:10,19:40,2h 30m,non-stop,No info,3873,2019-04-06,17:10:00,19:40:00,0,150,1,1,0,818,0,0,CCU,BLR,1546.4372901474003,0,0,0,0,0,0,0,0,0,0,4,6,14,2,1,1,2,3,0,0,0,1,Kolkata_Banglore,2871,1,24,1,0,618.5749160589601,0.09699714366413306,1,0
Jet Airways,9/05/2019,Delhi,Cochin,DEL → BOM → COK,21:50,19:00 10 May,21h 10m,1 stop,No info,15554,2019-05-09,21:50:00,19:00:00,0,1270,0,0,1,3849,0,0,DEL,COK,2047.882109458646,0,0,0,0,0,0,0,0,0,0,5,9,19,2,1,1,3,3,0,1,1,0,Delhi_Cochin,4537,0,22,1,0,96.75033587993603,0.6201528858200349,1,0
IndiGo,27/05/2019,Kolkata,Banglore,CCU → BLR,20:20,22:55,2h 35m,non-stop,No info,4804,2019-05-27,20:20:00,22:55:00,0,155,0,1,0,2053,0,0,CCU,BLR,1546.4372901474003,0,0,0,0,0,0,0,0,0,0,5,27,22,2,1,1,3,3,0,1,0,1,Kolkata_Banglore,2871,1,4,0,1,598.6208865086711,0.10023038178627082,1,0
Jet Airways,27/03/2019,Delhi,Cochin,DEL → BOM → COK,23:05,19:45 28 Mar,20h 40m,1 stop,In-flight meal not included,7438,2019-03-27,23:05:00,19:45:00,0,1240,0,0,1,3849,0,0,DEL,COK,2047.882109458646,0,0,0,0,0,0,0,0,0,0,3,27,13,1,1,1,3,3,0,1,1,0,Delhi_Cochin,4537,0,4,0,1,99.09106981251513,0.6055036050526326,1,0
Air Asia,3/05/2019,Banglore,Delhi,BLR → DEL,04:55,07:45,2h 50m,non-stop,No info,6181,2019-05-03,04:55:00,07:45:00,0,170,0,1,0,319,0,0,BLR,DEL,1708.6520853536679,0,0,0,0,0,0,0,0,0,0,5,3,18,2,1,1,0,1,0,0,0,1,Banglore_Delhi,1265,1,28,1,0,603.0536771836476,0.0994936309487559,1,0
Multiple carriers,1/05/2019,Delhi,Cochin,DEL → BOM → COK,19:00,01:30 02 May,6h 30m,1 stop,No info,9424,2019-05-01,19:00:00,01:30:00,0,390,0,0,1,1196,0,0,DEL,COK,2047.882109458646,0,0,0,0,0,0,0,0,0,0,5,1,18,2,1,1,3,0,0,1,1,0,Delhi_Cochin,4537,0,30,1,0,315.0587860705609,0.1904406499762312,1,0
Air India,12/03/2019,Banglore,New Delhi,BLR → BOM → BHO → DEL,17:25,23:25 13 Mar,30h,2 stops,No info,12725,2019-03-12,17:25:00,23:25:00,0,1800,0,0,0,1752,0,0,BLR,DEL,1708.6520853536679,0,0,0,0,0,0,0,0,0,0,3,12,11,1,1,1,2,3,0,0,2,0,Banglore_New Delhi,932,0,19,0,0,56.95506951178893,1.053461974751533,1,0
Air India,15/03/2019,Banglore,New Delhi,BLR → HYD → DEL,08:15,21:25,13h 10m,1 stop,No info,6046,2019-03-15,08:15:00,21:25:00,0,790,0,1,0,1752,0,0,BLR,DEL,1708.6520853536679,0,0,0,0,1,0,0,0,0,1,3,15,11,1,1,1,1,3,1,0,1,0,Banglore_New Delhi,932,0,16,0,0,129.77104445724058,0.46235275558539507,1,0
SpiceJet,15/06/2019,Banglore,Delhi,BLR → DEL,21:10,00:05 16 Jun,2h 55m,non-stop,No info,3971,2019-06-15,21:10:00,00:05:00,0,175,1,0,1,818,0,0,BLR,DEL,1708.6520853536679,0,0,0,0,0,0,0,0,0,0,6,15,24,2,1,0,3,0,0,1,0,1,Banglore_Delhi,1265,1,15,0,0,585.8235721212576,0.10241991421195461,1,0
Jet Airways,6/06/2019,Kolkata,Banglore,CCU → DEL → BLR,20:25,14:25 07 Jun,18h,1 stop,No info,12692,2019-06-06,20:25:00,14:25:00,0,1080,0,0,0,3849,0,0,CCU,BLR,1546.4372901474003,0,1,0,0,0,0,0,0,0,1,6,6,23,2,1,0,3,2,0,1,1,0,Kolkata_Banglore,2871,1,24,1,0,85.91318278596668,0.698379434381758,1,0
IndiGo,6/03/2019,Delhi,Cochin,DEL → HYD → COK,14:20,22:20,8h,1 stop,No info,7451,2019-03-06,14:20:00,22:20:00,0,480,0,1,0,2053,0,0,DEL,COK,2047.882109458646,0,0,0,0,0,0,0,0,0,0,3,6,10,1,1,1,2,3,0,0,1,0,Delhi_Cochin,4537,0,25,1,0,255.98526368233078,0.23438849227843842,1,0
Jet Airways,12/03/2019,Banglore,New Delhi,BLR → BOM → DEL,22:55,07:40 13 Mar,8h 45m,1 stop,No info,13817,2019-03-12,22:55:00,07:40:00,0,525,0,0,1,3849,0,0,BLR,DEL,1708.6520853536679,0,0,0,0,0,0,0,0,0,0,3,12,11,1,1,1,3,1,0,1,1,0,Banglore_New Delhi,932,0,19,0,0,195.27452404041918,0.3072597426358638,1,0
Jet Airways,6/05/2019,Kolkata,Banglore,CCU → DEL → BLR,09:35,22:05,12h 30m,1 stop,In-flight meal not included,10703,2019-05-06,09:35:00,22:05:00,0,750,0,1,0,3849,0,0,CCU,BLR,1546.4372901474003,0,0,0,0,0,0,0,0,0,0,5,6,19,2,1,1,1,3,1,0,1,0,Kolkata_Banglore,2871,1,25,1,0,123.71498321179202,0.4849857183206653,1,0
Jet Airways,12/03/2019,Banglore,New Delhi,BLR → BOM → DEL,21:25,10:45 13 Mar,13h 20m,1 stop,No info,13817,2019-03-12,21:25:00,10:45:00,0,800,0,0,1,3849,0,0,BLR,DEL,1708.6520853536679,0,0,0,0,0,0,0,0,0,0,3,12,11,1,1,1,3,1,0,1,1,0,Banglore_New Delhi,932,0,19,0,0,128.1489064015251,0.4682053221117925,1,0
Jet Airways,15/03/2019,Banglore,New Delhi,BLR → BOM → DEL,22:55,05:05 13 Mar,6h 10m,1 stop,No info,27210,2019-03-15,22:55:00,05:05:00,0,370,0,0,1,3849,0,0,BLR,DEL,1708.6520853536679,0,0,0,0,1,0,0,0,0,1,3,15,11,1,1,1,3,0,0,1,1,0,Banglore_New Delhi,932,0,16,0,0,277.078716543838,0.21654496147670402,1,0
Jet Airways,18/05/2019,Kolkata,Banglore,CCU → BOM → BLR,21:10,04:40 19 May,7h 30m,1 stop,No info,13941,2019-05-18,21:10:00,04:40:00,0,450,1,0,1,3849,0,0,CCU,BLR,1546.4372901474003,0,0,0,0,0,0,0,0,0,0,5,18,20,2,1,1,3,0,0,1,1,0,Kolkata_Banglore,2871,1,13,0,0,206.19163868632003,0.29099143099239916,1,0
Air India,01/03/2019,Banglore,New Delhi,BLR → HYD → DEL,17:00,12:15 02 Mar,19h 15m,1 stop,No info,10246,2019-03-01,17:00:00,12:15:00,0,1155,0,0,0,1752,0,0,BLR,DEL,1708.6520853536679,0,0,0,0,0,0,0,0,0,0,3,1,9,1,1,1,2,2,0,0,1,0,Banglore_New Delhi,932,0,30,1,0,88.76114729109963,0.6759714337989003,1,0
IndiGo,6/05/2019,Kolkata,Banglore,CCU → BLR,17:15,19:50,2h 35m,non-stop,No info,4804,2019-05-06,17:15:00,19:50:00,0,155,0,1,0,2053,0,0,CCU,BLR,1546.4372901474003,0,0,0,0,0,0,0,0,0,0,5,6,19,2,1,1,2,3,0,0,0,1,Kolkata_Banglore,2871,1,25,1,0,598.6208865086711,0.10023038178627082,1,0
Air Asia,6/06/2019,Kolkata,Banglore,CCU → DEL → BLR,22:40,10:40 07 Jun,12h,1 stop,No info,6810,2019-06-06,22:40:00,10:40:00,0,720,0,0,1,319,0,0,CCU,BLR,1546.4372901474003,0,1,0,0,0,0,0,0,0,1,6,6,23,2,1,0,3,1,0,1,1,0,Kolkata_Banglore,2871,1,24,1,0,128.86977417895002,0.46558628958783865,1,0
Jet Airways,1/05/2019,Banglore,Delhi,BLR → DEL,08:20,11:20,3h,non-stop,In-flight meal not included,5198,2019-05-01,08:20:00,11:20:00,0,180,0,1,0,3849,0,0,BLR,DEL,1708.6520853536679,0,0,0,0,0,0,0,0,0,0,5,1,18,2,1,1,1,1,1,0,0,1,Banglore_Delhi,1265,1,30,1,0,569.5506951178893,0.10534619747515331,1,0
Vistara,3/05/2019,Banglore,Delhi,BLR → DEL,21:00,23:50,2h 50m,non-stop,No info,5613,2019-05-03,21:00:00,23:50:00,0,170,0,1,1,479,0,0,BLR,DEL,1708.6520853536679,0,0,0,0,0,0,0,0,0,0,5,3,18,2,1,1,3,3,0,1,0,1,Banglore_Delhi,1265,1,28,1,0,603.0536771836476,0.0994936309487559,1,0
IndiGo,3/03/2019,Mumbai,Hyderabad,BOM → HYD,21:20,22:45,1h 25m,non-stop,No info,4784,2019-03-03,21:20:00,22:45:00,0,85,1,1,1,2053,0,0,BOM,HYD,622.9702752863186,0,0,0,0,0,0,0,0,0,0,3,3,9,1,1,1,3,3,0,1,0,1,Mumbai_Hyderabad,697,1,28,1,0,439.743723731519,0.13644310711443464,0,0
Jet Airways,21/03/2019,Delhi,Cochin,DEL → BOM → COK,19:45,18:50 22 Mar,23h 5m,1 stop,In-flight meal not included,5406,2019-03-21,19:45:00,18:50:00,0,1385,0,0,0,3849,0,0,DEL,COK,2047.882109458646,0,0,0,0,1,0,0,0,0,1,3,21,12,1,1,1,3,3,0,1,1,0,Delhi_Cochin,4537,0,10,0,1,88.71691448918322,0.6763084620950774,1,0
Air India,27/04/2019,Banglore,Delhi,BLR → DEL,13:20,16:10,2h 50m,non-stop,No info,5228,2019-04-27,13:20:00,16:10:00,0,170,1,1,0,1752,0,0,BLR,DEL,1708.6520853536679,0,0,0,0,0,0,0,0,0,0,4,27,17,2,1,1,2,2,0,0,0,1,Banglore_Delhi,1265,1,3,0,1,603.0536771836476,0.0994936309487559,1,0
Jet Airways,27/05/2019,Delhi,Cochin,DEL → BOM → COK,20:55,19:00 28 May,22h 5m,1 stop,In-flight meal not included,12898,2019-05-27,20:55:00,19:00:00,0,1325,0,0,0,3849,0,0,DEL,COK,2047.882109458646,0,0,0,0,0,0,0,0,0,0,5,27,22,2,1,1,3,3,0,1,1,0,Delhi_Cochin,4537,0,4,0,1,92.73428420190095,0.6470099005602726,1,0
Air India,15/06/2019,Chennai,Kolkata,MAA → CCU,11:40,13:55,2h 15m,non-stop,No info,4667,2019-06-15,11:40:00,13:55:00,0,135,1,1,0,1752,0,0,MAA,CCU,1385.198425287915,0,0,0,0,0,0,0,0,0,0,6,15,24,2,1,0,1,2,1,0,0,1,Chennai_Kolkata,381,1,15,0,0,615.6437445724066,0.09745896150000323,1,0
Jet Airways,21/05/2019,Kolkata,Banglore,CCU → BOM → BLR,14:05,19:50,5h 45m,1 stop,No info,14781,2019-05-21,14:05:00,19:50:00,0,345,0,1,0,3849,0,0,CCU,BLR,1546.4372901474003,0,0,0,0,0,0,0,0,0,0,5,21,21,2,1,1,2,3,0,0,1,0,Kolkata_Banglore,2871,1,10,0,1,268.94561567780875,0.22309343042750604,1,0
Vistara,21/04/2019,Banglore,Delhi,BLR → DEL,09:45,12:35,2h 50m,non-stop,No info,5403,2019-04-21,09:45:00,12:35:00,0,170,1,1,0,479,0,0,BLR,DEL,1708.6520853536679,0,0,0,0,0,0,0,0,0,0,4,21,16,2,1,1,1,2,1,0,0,1,Banglore_Delhi,1265,1,9,0,1,603.0536771836476,0.0994936309487559,1,0
Jet Airways,12/06/2019,Kolkata,Banglore,CCU → BOM → BLR,14:05,23:35,9h 30m,1 stop,In-flight meal not included,9899,2019-06-12,14:05:00,23:35:00,0,570,0,1,0,3849,0,0,CCU,BLR,1546.4372901474003,0,0,0,0,0,0,0,0,0,0,6,12,24,2,1,0,2,3,0,0,1,0,Kolkata_Banglore,2871,1,18,0,0,162.78287264709476,0.3685891459237056,1,0
Jet Airways,21/05/2019,Delhi,Cochin,DEL → JAI → BOM → COK,19:30,04:25 22 May,8h 55m,2 stops,In-flight meal not included,13029,2019-05-21,19:30:00,04:25:00,0,535,0,0,1,3849,0,0,DEL,COK,2047.882109458646,0,0,0,0,0,0,0,0,0,0,5,21,21,2,1,1,3,0,0,1,2,0,Delhi_Cochin,4537,0,10,0,1,229.66902162153042,0.26124550701867616,1,0
Vistara,18/05/2019,Kolkata,Banglore,CCU → DEL → BLR,17:00,10:45 19 May,17h 45m,1 stop,No info,9187,2019-05-18,17:00:00,10:45:00,0,1065,1,0,0,479,0,0,CCU,BLR,1546.4372901474003,0,0,0,0,0,0,0,0,0,0,5,18,20,2,1,1,2,1,0,0,1,0,Kolkata_Banglore,2871,1,13,0,0,87.12322761393804,0.6886797200153447,1,0
IndiGo,24/05/2019,Banglore,Delhi,BLR → DEL,20:00,22:50,2h 50m,non-stop,No info,4823,2019-05-24,20:00:00,22:50:00,0,170,0,1,0,2053,0,0,BLR,DEL,1708.6520853536679,0,0,0,0,0,0,0,0,0,0,5,24,21,2,1,1,3,3,0,1,0,1,Banglore_Delhi,1265,1,7,0,1,603.0536771836476,0.0994936309487559,1,0
Air India,27/03/2019,Delhi,Cochin,DEL → HYD → BOM → COK,21:30,19:15 28 Mar,21h 45m,2 stops,No info,8665,2019-03-27,21:30:00,19:15:00,0,1305,0,0,1,1752,0,0,DEL,COK,2047.882109458646,0,0,0,0,0,0,0,0,0,0,3,27,13,1,1,1,3,3,0,1,2,0,Delhi_Cochin,4537,0,4,0,1,94.155499285455,0.6372437133820044,1,0
IndiGo,6/03/2019,Delhi,Cochin,DEL → BOM → COK,08:25,21:00,12h 35m,1 stop,No info,14871,2019-03-06,08:25:00,21:00:00,0,755,0,1,0,2053,0,0,DEL,COK,2047.882109458646,0,0,0,0,0,0,0,0,0,0,3,6,10,1,1,1,1,3,1,0,1,0,Delhi_Cochin,4537,0,25,1,0,162.74559810267385,0.3686735659796271,1,0
IndiGo,21/06/2019,Mumbai,Hyderabad,BOM → HYD,06:25,07:55,1h 30m,non-stop,No info,4049,2019-06-21,06:25:00,07:55:00,0,90,0,1,0,2053,0,0,BOM,HYD,622.9702752863186,0,0,0,0,0,0,0,0,0,0,6,21,25,2,1,0,1,1,1,0,0,1,Mumbai_Hyderabad,697,1,9,0,1,415.3135168575457,0.14446917223881314,0,0
Air India,12/06/2019,Chennai,Kolkata,MAA → CCU,11:40,13:55,2h 15m,non-stop,No info,4667,2019-06-12,11:40:00,13:55:00,0,135,0,1,0,1752,0,0,MAA,CCU,1385.198425287915,0,0,0,0,0,0,0,0,0,0,6,12,24,2,1,0,1,2,1,0,0,1,Chennai_Kolkata,381,1,18,0,0,615.6437445724066,0.09745896150000323,1,0
IndiGo,9/04/2019,Kolkata,Banglore,CCU → BBI → BLR,19:55,23:50,3h 55m,1 stop,No info,4226,2019-04-09,19:55:00,23:50:00,0,235,0,1,0,2053,0,0,CCU,BLR,1546.4372901474003,0,0,0,0,0,0,0,0,0,0,4,9,15,2,1,1,3,3,0,1,1,0,Kolkata_Banglore,2871,1,21,1,0,394.83505280359157,0.15196219174047512,1,0
Air India,03/03/2019,Banglore,New Delhi,BLR → DEL,06:10,08:55,2h 45m,non-stop,No info,7591,2019-03-03,06:10:00,08:55:00,0,165,1,1,0,1752,0,0,BLR,DEL,1708.6520853536679,0,0,0,0,0,0,0,0,0,0,3,3,9,1,1,1,1,1,1,0,0,1,Banglore_New Delhi,932,0,28,1,0,621.3280310376974,0.09656734768555719,1,0
Jet Airways,06/03/2019,Banglore,New Delhi,BLR → BOM → DEL,05:45,13:15,7h 30m,1 stop,No info,19225,2019-03-06,05:45:00,13:15:00,0,450,0,1,0,3849,0,0,BLR,DEL,1708.6520853536679,0,0,0,0,0,0,0,0,0,0,3,6,10,1,1,1,0,2,0,0,1,0,Banglore_New Delhi,932,0,25,1,0,227.8202780471557,0.26336549368788326,1,0
Jet Airways,27/05/2019,Delhi,Cochin,DEL → BOM → COK,19:15,12:35 28 May,17h 20m,1 stop,In-flight meal not included,12898,2019-05-27,19:15:00,12:35:00,0,1040,0,0,0,3849,0,0,DEL,COK,2047.882109458646,0,0,0,0,0,0,0,0,0,0,5,27,22,2,1,1,3,2,0,1,1,0,Delhi_Cochin,4537,0,4,0,1,118.14704477646035,0.5078417332699499,1,0
IndiGo,9/06/2019,Mumbai,Hyderabad,BOM → HYD,12:00,13:30,1h 30m,non-stop,No info,2754,2019-06-09,12:00:00,13:30:00,0,90,1,1,0,2053,0,0,BOM,HYD,622.9702752863186,0,1,0,0,0,0,0,0,0,1,6,9,23,2,1,0,2,2,0,0,0,1,Mumbai_Hyderabad,697,1,21,1,0,415.3135168575457,0.14446917223881314,0,0
SpiceJet,3/05/2019,Mumbai,Hyderabad,BOM → HYD,13:15,14:45,1h 30m,non-stop,No check-in baggage included,1965,2019-05-03,13:15:00,14:45:00,0,90,0,1,0,818,0,0,BOM,HYD,622.9702752863186,0,0,0,0,0,0,0,0,0,0,5,3,18,2,1,1,2,2,0,0,0,1,Mumbai_Hyderabad,697,1,28,1,0,415.3135168575457,0.14446917223881314,0,0
Air India,24/03/2019,Kolkata,Banglore,CCU → GAU → DEL → BLR,16:45,23:15 25 Mar,30h 30m,2 stops,No info,12835,2019-03-24,16:45:00,23:15:00,0,1830,1,0,0,1752,0,0,CCU,BLR,1546.4372901474003,0,0,0,0,1,0,0,0,0,1,3,24,12,1,1,1,2,3,0,0,2,0,Kolkata_Banglore,2871,1,7,0,1,50.70286197204591,1.1833651527024234,1,0
Jet Airways Business,01/03/2019,Banglore,New Delhi,BLR → BOM → DEL,05:45,10:45,5h,1 stop,No info,52229,2019-03-01,05:45:00,10:45:00,0,300,0,1,0,6,0,0,BLR,DEL,1708.6520853536679,0,0,0,0,0,0,0,0,0,0,3,1,9,1,1,1,0,1,0,0,1,0,Banglore_New Delhi,932,0,30,1,0,341.73041707073355,0.17557699579192218,1,0
Multiple carriers,15/05/2019,Delhi,Cochin,DEL → BOM → COK,08:00,19:15,11h 15m,1 stop,No info,14533,2019-05-15,08:00:00,19:15:00,0,675,0,1,0,1196,0,0,DEL,COK,2047.882109458646,0,0,0,0,0,0,0,0,0,0,5,15,20,2,1,1,1,3,1,0,1,0,Delhi_Cochin,4537,0,16,0,0,182.033965285213,0.329608817266554,1,0
Vistara,24/06/2019,Banglore,Delhi,BLR → DEL,09:45,12:35,2h 50m,non-stop,No info,4668,2019-06-24,09:45:00,12:35:00,0,170,0,1,0,479,0,0,BLR,DEL,1708.6520853536679,0,0,0,0,0,0,0,0,0,0,6,24,26,2,1,0,1,2,1,0,0,1,Banglore_Delhi,1265,1,6,0,1,603.0536771836476,0.0994936309487559,1,0
Jet Airways,9/04/2019,Delhi,Cochin,DEL → BOM → COK,17:30,12:35 10 Apr,19h 5m,1 stop,No info,11822,2019-04-09,17:30:00,12:35:00,0,1145,0,0,0,3849,0,0,DEL,COK,2047.882109458646,0,0,0,0,0,0,0,0,0,0,4,9,15,2,1,1,2,2,0,0,1,0,Delhi_Cochin,4537,0,21,1,0,107.31259962228712,0.5591142159558583,1,0
Jet Airways,27/03/2019,Delhi,Cochin,DEL → BOM → COK,21:50,04:25 28 Mar,6h 35m,1 stop,In-flight meal not included,6017,2019-03-27,21:50:00,04:25:00,0,395,0,0,1,3849,0,0,DEL,COK,2047.882109458646,0,0,0,0,0,0,0,0,0,0,3,27,13,1,1,1,3,0,0,1,1,0,Delhi_Cochin,4537,0,4,0,1,311.0707001709336,0.19288219677079826,1,0
Jet Airways,9/06/2019,Delhi,Cochin,DEL → BOM → COK,11:30,19:00,7h 30m,1 stop,No info,14714,2019-06-09,11:30:00,19:00:00,0,450,1,1,0,3849,0,0,DEL,COK,2047.882109458646,0,1,0,0,0,0,0,0,0,1,6,9,23,2,1,0,1,3,1,0,1,0,Delhi_Cochin,4537,0,21,1,0,273.0509479278195,0.219739211511036,1,0
SpiceJet,9/06/2019,Chennai,Kolkata,MAA → CCU,08:20,10:35,2h 15m,non-stop,No info,3597,2019-06-09,08:20:00,10:35:00,0,135,1,1,0,818,0,0,MAA,CCU,1385.198425287915,0,1,0,0,0,0,0,0,0,1,6,9,23,2,1,0,1,1,1,0,0,1,Chennai_Kolkata,381,1,21,1,0,615.6437445724066,0.09745896150000323,1,0
Air Asia,24/04/2019,Banglore,Delhi,BLR → DEL,11:10,13:55,2h 45m,non-stop,No info,3383,2019-04-24,11:10:00,13:55:00,0,165,0,1,0,319,0,0,BLR,DEL,1708.6520853536679,0,0,0,0,0,0,0,0,0,0,4,24,17,2,1,1,1,2,1,0,0,1,Banglore_Delhi,1265,1,6,0,1,621.3280310376974,0.09656734768555719,1,0
Air India,18/05/2019,Kolkata,Banglore,CCU → BOM → GOI → BLR,16:50,05:35 19 May,12h 45m,2 stops,No info,11642,2019-05-18,16:50:00,05:35:00,0,765,1,0,1,1752,0,0,CCU,BLR,1546.4372901474003,0,0,0,0,0,0,0,0,0,0,5,18,20,2,1,1,2,0,0,0,2,0,Kolkata_Banglore,2871,1,13,0,0,121.28919922724707,0.4946854326870786,1,0
Vistara,27/04/2019,Banglore,Delhi,BLR → DEL,21:00,23:50,2h 50m,non-stop,No info,5403,2019-04-27,21:00:00,23:50:00,0,170,1,1,1,479,0,0,BLR,DEL,1708.6520853536679,0,0,0,0,0,0,0,0,0,0,4,27,17,2,1,1,3,3,0,1,0,1,Banglore_Delhi,1265,1,3,0,1,603.0536771836476,0.0994936309487559,1,0
Air India,3/03/2019,Delhi,Cochin,DEL → AMD → BOM → COK,16:40,19:15 04 Mar,26h 35m,2 stops,No info,14221,2019-03-03,16:40:00,19:15:00,0,1595,1,0,0,1752,0,0,DEL,COK,2047.882109458646,0,0,0,0,0,0,0,0,0,0,3,3,9,1,1,1,2,3,0,0,2,0,Delhi_Cochin,4537,0,28,1,0,77.03631759719045,0.7788534274668942,1,0
Jet Airways,18/05/2019,Kolkata,Banglore,CCU → BOM → BLR,21:10,10:05 19 May,12h 55m,1 stop,In-flight meal not included,8586,2019-05-18,21:10:00,10:05:00,0,775,1,0,1,3849,0,0,CCU,BLR,1546.4372901474003,0,0,0,0,0,0,0,0,0,0,5,18,20,2,1,1,3,1,0,1,1,0,Kolkata_Banglore,2871,1,13,0,0,119.72417730173422,0.5011519089313541,1,0
IndiGo,12/06/2019,Mumbai,Hyderabad,BOM → HYD,09:10,10:40,1h 30m,non-stop,No info,4049,2019-06-12,09:10:00,10:40:00,0,90,0,1,0,2053,0,0,BOM,HYD,622.9702752863186,0,0,0,0,0,0,0,0,0,0,6,12,24,2,1,0,1,1,1,0,0,1,Mumbai_Hyderabad,697,1,18,0,0,415.3135168575457,0.14446917223881314,0,0
Jet Airways,3/06/2019,Delhi,Cochin,DEL → BOM → COK,19:45,04:25 04 Jun,8h 40m,1 stop,In-flight meal not included,10262,2019-06-03,19:45:00,04:25:00,0,520,0,0,1,3849,0,0,DEL,COK,2047.882109458646,0,1,0,0,0,0,0,0,0,1,6,3,23,2,1,0,3,0,0,1,1,0,Delhi_Cochin,4537,0,27,1,0,236.2940895529207,0.25392086663497493,1,0
Multiple carriers,21/05/2019,Delhi,Cochin,DEL → BOM → COK,07:00,21:00,14h,1 stop,No info,7888,2019-05-21,07:00:00,21:00:00,0,840,0,1,0,1196,0,0,DEL,COK,2047.882109458646,0,0,0,0,0,0,0,0,0,0,5,21,21,2,1,1,1,3,1,0,1,0,Delhi_Cochin,4537,0,10,0,1,146.27729353276044,0.4101798614872672,1,0
Air India,21/03/2019,Delhi,Cochin,DEL → AMD → BOM → COK,19:45,19:15 22 Mar,23h 30m,2 stops,No info,8236,2019-03-21,19:45:00,19:15:00,0,1410,0,0,0,1752,0,0,DEL,COK,2047.882109458646,0,0,0,0,1,0,0,0,0,1,3,21,12,1,1,1,3,3,0,1,2,0,Delhi_Cochin,4537,0,10,0,1,87.14391955143175,0.6885161960679128,1,0
Air India,6/06/2019,Delhi,Cochin,DEL → UDR → BOM → COK,13:20,19:15 07 Jun,29h 55m,2 stops,No info,12961,2019-06-06,13:20:00,19:15:00,0,1795,0,0,0,1752,0,0,DEL,COK,2047.882109458646,0,1,0,0,0,0,0,0,0,1,6,6,23,2,1,0,2,3,0,0,2,0,Delhi_Cochin,4537,0,24,1,0,68.45288388162605,0.8765152992495769,1,0
Jet Airways,9/05/2019,Kolkata,Banglore,CCU → BOM → BLR,06:30,04:40 10 May,22h 10m,1 stop,In-flight meal not included,8586,2019-05-09,06:30:00,04:40:00,0,1330,0,0,1,3849,0,0,CCU,BLR,1546.4372901474003,0,0,0,0,0,0,0,0,0,0,5,9,19,2,1,1,1,0,1,0,1,0,Kolkata_Banglore,2871,1,22,1,0,69.76408827732634,0.8600413404886464,1,0
IndiGo,18/05/2019,Kolkata,Banglore,CCU → MAA → BLR,08:10,13:00,4h 50m,1 stop,No info,5279,2019-05-18,08:10:00,13:00:00,0,290,1,1,0,2053,0,0,CCU,BLR,1546.4372901474003,0,0,0,0,0,0,0,0,0,0,5,18,20,2,1,1,1,2,1,0,1,0,Kolkata_Banglore,2871,1,13,0,0,319.95254278911733,0.18752781108399058,1,0
GoAir,18/06/2019,Banglore,Delhi,BLR → DEL,20:55,23:40,2h 45m,non-stop,No info,3419,2019-06-18,20:55:00,23:40:00,0,165,0,1,0,194,0,0,BLR,DEL,1708.6520853536679,0,0,0,0,0,0,0,0,0,0,6,18,25,2,1,0,3,3,0,1,0,1,Banglore_Delhi,1265,1,12,0,0,621.3280310376974,0.09656734768555719,1,0
Jet Airways,15/06/2019,Delhi,Cochin,DEL → IDR → BOM → COK,05:30,19:00,13h 30m,2 stops,No info,13292,2019-06-15,05:30:00,19:00:00,0,810,1,1,0,3849,0,0,DEL,COK,2047.882109458646,0,0,0,0,0,0,0,0,0,0,6,15,24,2,1,0,0,3,0,0,2,0,Delhi_Cochin,4537,0,15,0,0,151.69497107101083,0.3955305807198648,1,0
Jet Airways,15/05/2019,Kolkata,Banglore,CCU → DEL → BLR,20:25,09:45 16 May,13h 20m,1 stop,No info,13067,2019-05-15,20:25:00,09:45:00,0,800,0,0,0,3849,0,0,CCU,BLR,1546.4372901474003,0,0,0,0,0,0,0,0,0,0,5,15,20,2,1,1,3,1,0,1,1,0,Kolkata_Banglore,2871,1,16,0,0,115.98279676105501,0.517318099542043,1,0
IndiGo,3/05/2019,Chennai,Kolkata,MAA → CCU,13:15,15:35,2h 20m,non-stop,No info,3597,2019-05-03,13:15:00,15:35:00,0,140,0,1,0,2053,0,0,MAA,CCU,1385.198425287915,0,0,0,0,0,0,0,0,0,0,5,3,18,2,1,1,2,2,0,0,0,1,Chennai_Kolkata,381,1,28,1,0,593.656467980535,0.10106855266667002,1,0
Jet Airways,18/05/2019,Delhi,Cochin,DEL → BOM → COK,07:05,19:00,11h 55m,1 stop,No info,15554,2019-05-18,07:05:00,19:00:00,0,715,1,1,0,3849,0,0,DEL,COK,2047.882109458646,0,0,0,0,0,0,0,0,0,0,5,18,20,2,1,1,1,3,1,0,1,0,Delhi_Cochin,4537,0,13,0,0,171.85024694757868,0.34914119162309054,1,0
IndiGo,15/05/2019,Delhi,Cochin,DEL → BLR → COK,17:05,22:15,5h 10m,1 stop,No info,6027,2019-05-15,17:05:00,22:15:00,0,310,0,1,0,2053,0,0,DEL,COK,2047.882109458646,0,0,0,0,0,0,0,0,0,0,5,15,20,2,1,1,2,3,0,0,1,0,Delhi_Cochin,4537,0,16,0,0,396.3642792500605,0.15137590126315814,1,0
Jet Airways,9/05/2019,Kolkata,Banglore,CCU → BOM → BLR,06:30,18:15,11h 45m,1 stop,No info,14781,2019-05-09,06:30:00,18:15:00,0,705,0,1,0,3849,0,0,CCU,BLR,1546.4372901474003,0,0,0,0,0,0,0,0,0,0,5,9,19,2,1,1,1,3,1,0,1,0,Kolkata_Banglore,2871,1,22,1,0,131.61168426786386,0.45588657522142534,1,0
Jet Airways,1/06/2019,Delhi,Cochin,DEL → NAG → BOM → COK,14:35,04:25 02 Jun,13h 50m,2 stops,No info,13376,2019-06-01,14:35:00,04:25:00,0,830,1,0,1,3849,0,0,DEL,COK,2047.882109458646,0,1,0,0,0,0,0,0,0,1,6,1,22,2,1,0,2,0,0,0,2,0,Delhi_Cochin,4537,0,29,1,0,148.03967056327562,0.40529676789813307,1,0
IndiGo,27/05/2019,Banglore,Delhi,BLR → DEL,21:15,00:15 28 May,3h,non-stop,No info,3943,2019-05-27,21:15:00,00:15:00,0,180,0,0,1,2053,0,0,BLR,DEL,1708.6520853536679,0,0,0,0,0,0,0,0,0,0,5,27,22,2,1,1,3,0,0,1,0,1,Banglore_Delhi,1265,1,4,0,1,569.5506951178893,0.10534619747515331,1,0
GoAir,12/06/2019,Delhi,Cochin,DEL → AMD → COK,07:25,13:35,6h 10m,1 stop,No info,5842,2019-06-12,07:25:00,13:35:00,0,370,0,1,0,194,0,0,DEL,COK,2047.882109458646,0,0,0,0,0,0,0,0,0,0,6,12,24,2,1,0,1,2,1,0,1,0,Delhi_Cochin,4537,0,18,0,0,332.08899072302364,0.18067446279796293,1,0
IndiGo,15/03/2019,Chennai,Kolkata,MAA → CCU,05:15,07:35,2h 20m,non-stop,No info,4326,2019-03-15,05:15:00,07:35:00,0,140,0,1,0,2053,0,0,MAA,CCU,1385.198425287915,0,0,0,0,1,0,0,0,0,1,3,15,11,1,1,1,0,1,0,0,0,1,Chennai_Kolkata,381,1,16,0,0,593.656467980535,0.10106855266667002,1,0
Multiple carriers,1/06/2019,Delhi,Cochin,DEL → BOM → COK,08:30,19:15,10h 45m,1 stop,No info,8937,2019-06-01,08:30:00,19:15:00,0,645,1,1,0,1196,0,0,DEL,COK,2047.882109458646,0,1,0,0,0,0,0,0,0,1,6,1,22,2,1,0,1,3,1,0,1,0,Delhi_Cochin,4537,0,29,1,0,190.50066134499033,0.3149595364991516,1,0
Air India,21/03/2019,Chennai,Kolkata,MAA → CCU,11:40,13:55,2h 15m,non-stop,No info,3670,2019-03-21,11:40:00,13:55:00,0,135,0,1,0,1752,0,0,MAA,CCU,1385.198425287915,0,0,0,0,1,0,0,0,0,1,3,21,12,1,1,1,1,2,1,0,0,1,Chennai_Kolkata,381,1,10,0,1,615.6437445724066,0.09745896150000323,1,0
IndiGo,18/06/2019,Banglore,Delhi,BLR → DEL,18:25,21:20,2h 55m,non-stop,No info,4823,2019-06-18,18:25:00,21:20:00,0,175,0,1,0,2053,0,0,BLR,DEL,1708.6520853536679,0,0,0,0,0,0,0,0,0,0,6,18,25,2,1,0,3,3,0,1,0,1,Banglore_Delhi,1265,1,12,0,0,585.8235721212576,0.10241991421195461,1,0
Jet Airways,3/04/2019,Mumbai,Hyderabad,BOM → HYD,19:35,21:05,1h 30m,non-stop,In-flight meal not included,2071,2019-04-03,19:35:00,21:05:00,0,90,0,1,0,3849,0,0,BOM,HYD,622.9702752863186,0,0,0,0,0,0,0,0,0,0,4,3,14,2,1,1,3,3,0,1,0,1,Mumbai_Hyderabad,697,1,27,1,0,415.3135168575457,0.14446917223881314,0,0
Multiple carriers,27/06/2019,Delhi,Cochin,DEL → HYD → COK,14:55,22:30,7h 35m,1 stop,In-flight meal not included,6093,2019-06-27,14:55:00,22:30:00,0,455,0,1,0,1196,0,0,DEL,COK,2047.882109458646,0,0,0,0,0,0,0,0,0,0,6,27,26,2,1,0,2,3,0,0,1,0,Delhi_Cochin,4537,0,3,0,1,270.05038806048077,0.22218075830560308,1,0
Vistara,24/03/2019,Kolkata,Banglore,CCU → DEL → BLR,20:20,22:55 25 Mar,26h 35m,1 stop,No info,11682,2019-03-24,20:20:00,22:55:00,0,1595,1,0,0,479,0,0,CCU,BLR,1546.4372901474003,0,0,0,0,1,0,0,0,0,1,3,24,12,1,1,1,3,3,0,1,1,0,Kolkata_Banglore,2871,1,7,0,1,58.173189598021324,1.0314029609619482,1,0
IndiGo,03/03/2019,Banglore,New Delhi,BLR → LKO → DEL,05:25,10:10,4h 45m,1 stop,No info,7774,2019-03-03,05:25:00,10:10:00,0,285,1,1,0,2053,0,0,BLR,DEL,1708.6520853536679,0,0,0,0,0,0,0,0,0,0,3,3,9,1,1,1,0,1,0,0,1,0,Banglore_New Delhi,932,0,28,1,0,359.71622849550903,0.16679814600232606,1,0
Jet Airways,12/05/2019,Kolkata,Banglore,CCU → DEL → BLR,17:00,14:25 13 May,21h 25m,1 stop,No info,13067,2019-05-12,17:00:00,14:25:00,0,1285,1,0,0,3849,0,0,CCU,BLR,1546.4372901474003,0,0,0,0,0,0,0,0,0,0,5,12,19,2,1,1,2,2,0,0,1,0,Kolkata_Banglore,2871,1,19,0,0,72.20718864501481,0.8309421973894066,1,0
IndiGo,27/05/2019,Delhi,Cochin,DEL → HYD → COK,07:35,16:10,8h 35m,1 stop,No info,7514,2019-05-27,07:35:00,16:10:00,0,515,0,1,0,2053,0,0,DEL,COK,2047.882109458646,0,0,0,0,0,0,0,0,0,0,5,27,22,2,1,1,1,2,1,0,1,0,Delhi_Cochin,4537,0,4,0,1,238.5882069272209,0.2514793198404079,1,0
Multiple carriers,9/04/2019,Delhi,Cochin,DEL → BOM → COK,17:00,01:30 10 Apr,8h 30m,1 stop,No info,6838,2019-04-09,17:00:00,01:30:00,0,510,0,0,1,1196,0,0,DEL,COK,2047.882109458646,0,0,0,0,0,0,0,0,0,0,4,9,15,2,1,1,2,0,0,0,1,0,Delhi_Cochin,4537,0,21,1,0,240.92730699513484,0.2490377730458408,1,0
IndiGo,18/03/2019,Chennai,Kolkata,MAA → CCU,13:20,15:35,2h 15m,non-stop,No info,3858,2019-03-18,13:20:00,15:35:00,0,135,0,1,0,2053,0,0,MAA,CCU,1385.198425287915,0,0,0,0,1,0,0,0,0,1,3,18,12,1,1,1,2,2,0,0,0,1,Chennai_Kolkata,381,1,13,0,0,615.6437445724066,0.09745896150000323,1,0
Multiple carriers,15/06/2019,Delhi,Cochin,DEL → BOM → COK,12:50,01:30 16 Jun,12h 40m,1 stop,No info,6795,2019-06-15,12:50:00,01:30:00,0,760,1,0,1,1196,0,0,DEL,COK,2047.882109458646,0,0,0,0,0,0,0,0,0,0,6,15,24,2,1,0,2,0,0,0,1,0,Delhi_Cochin,4537,0,15,0,0,161.67490337831416,0.3711151127741941,1,0
Jet Airways,27/05/2019,Delhi,Cochin,DEL → ATQ → BOM → COK,20:00,04:25 28 May,8h 25m,2 stops,No info,16263,2019-05-27,20:00:00,04:25:00,0,505,0,0,1,3849,0,0,DEL,COK,2047.882109458646,0,0,0,0,0,0,0,0,0,0,5,27,22,2,1,1,3,0,0,1,2,0,Delhi_Cochin,4537,0,4,0,1,243.31272587627478,0.24659622625127373,1,0
Air India,9/05/2019,Kolkata,Banglore,CCU → BOM → BLR,16:50,18:30 10 May,25h 40m,1 stop,No info,8576,2019-05-09,16:50:00,18:30:00,0,1540,0,0,0,1752,0,0,CCU,BLR,1546.4372901474003,0,0,0,0,0,0,0,0,0,0,5,9,19,2,1,1,2,3,0,0,1,0,Kolkata_Banglore,2871,1,22,1,0,60.250803512236374,0.9958373416184327,1,0
Air India,6/05/2019,Banglore,Delhi,BLR → DEL,10:00,12:45,2h 45m,non-stop,No info,5228,2019-05-06,10:00:00,12:45:00,0,165,0,1,0,1752,0,0,BLR,DEL,1708.6520853536679,0,0,0,0,0,0,0,0,0,0,5,6,19,2,1,1,1,2,1,0,0,1,Banglore_Delhi,1265,1,25,1,0,621.3280310376974,0.09656734768555719,1,0
Jet Airways,1/05/2019,Delhi,Cochin,DEL → AMD → BOM → COK,23:05,04:25 03 May,29h 20m,2 stops,No info,16704,2019-05-01,23:05:00,04:25:00,0,1760,0,0,1,3849,0,0,DEL,COK,2047.882109458646,0,0,0,0,0,0,0,0,0,0,5,1,18,2,1,1,3,0,0,1,2,0,Delhi_Cochin,4537,0,30,1,0,69.81416282245384,0.8594244716876075,1,0
IndiGo,24/03/2019,Kolkata,Banglore,CCU → BLR,20:25,23:05,2h 40m,non-stop,No info,8872,2019-03-24,20:25:00,23:05:00,0,160,1,1,0,2053,0,0,CCU,BLR,1546.4372901474003,0,0,0,0,1,0,0,0,0,1,3,24,12,1,1,1,3,3,0,1,0,1,Kolkata_Banglore,2871,1,7,0,1,579.913983805275,0.10346361990840859,1,0
GoAir,3/05/2019,Banglore,Delhi,BLR → DEL,11:40,14:30,2h 50m,non-stop,No info,3898,2019-05-03,11:40:00,14:30:00,0,170,0,1,0,194,0,0,BLR,DEL,1708.6520853536679,0,0,0,0,0,0,0,0,0,0,5,3,18,2,1,1,1,2,1,0,0,1,Banglore_Delhi,1265,1,28,1,0,603.0536771836476,0.0994936309487559,1,0
SpiceJet,21/03/2019,Chennai,Kolkata,MAA → CCU,17:45,20:05,2h 20m,non-stop,No check-in baggage included,3332,2019-03-21,17:45:00,20:05:00,0,140,0,1,0,818,0,0,MAA,CCU,1385.198425287915,0,0,0,0,1,0,0,0,0,1,3,21,12,1,1,1,2,3,0,0,0,1,Chennai_Kolkata,381,1,10,0,1,593.656467980535,0.10106855266667002,1,0
Jet Airways,21/05/2019,Kolkata,Banglore,CCU → GAU → BLR,10:20,17:35,7h 15m,1 stop,In-flight meal not included,5608,2019-05-21,10:20:00,17:35:00,0,435,0,1,0,3849,0,0,CCU,BLR,1546.4372901474003,0,0,0,0,0,0,0,0,0,0,5,21,21,2,1,1,1,2,1,0,1,0,Kolkata_Banglore,2871,1,10,0,1,213.3016951927449,0.28129171662598584,1,0
Jet Airways,9/05/2019,Kolkata,Banglore,CCU → BOM → BLR,08:25,04:40 10 May,20h 15m,1 stop,No info,13941,2019-05-09,08:25:00,04:40:00,0,1215,0,0,1,3849,0,0,CCU,BLR,1546.4372901474003,0,0,0,0,0,0,0,0,0,0,5,9,19,2,1,1,1,0,1,0,1,0,Kolkata_Banglore,2871,1,22,1,0,76.36727358752594,0.7856768636794778,1,0
Multiple carriers,21/03/2019,Delhi,Cochin,DEL → BOM → COK,07:30,19:15,11h 45m,1 stop,No info,9100,2019-03-21,07:30:00,19:15:00,0,705,0,1,0,1196,0,0,DEL,COK,2047.882109458646,0,0,0,0,1,0,0,0,0,1,3,21,12,1,1,1,1,3,1,0,1,0,Delhi_Cochin,4537,0,10,0,1,174.2878391028635,0.3442580980339564,1,0
Vistara,15/06/2019,Banglore,Delhi,BLR → DEL,17:00,19:35,2h 35m,non-stop,No info,4878,2019-06-15,17:00:00,19:35:00,0,155,1,1,0,479,0,0,BLR,DEL,1708.6520853536679,0,0,0,0,0,0,0,0,0,0,6,15,24,2,1,0,2,3,0,0,0,1,Banglore_Delhi,1265,1,15,0,0,661.4137104594843,0.09071478115915979,1,0
IndiGo,1/06/2019,Delhi,Cochin,DEL → BOM → COK,07:30,21:00,13h 30m,1 stop,No info,6416,2019-06-01,07:30:00,21:00:00,0,810,1,1,0,2053,0,0,DEL,COK,2047.882109458646,0,1,0,0,0,0,0,0,0,1,6,1,22,2,1,0,1,3,1,0,1,0,Delhi_Cochin,4537,0,29,1,0,151.69497107101083,0.3955305807198648,1,0
SpiceJet,12/05/2019,Mumbai,Hyderabad,BOM → HYD,05:45,07:15,1h 30m,non-stop,No info,2017,2019-05-12,05:45:00,07:15:00,0,90,1,1,0,818,0,0,BOM,HYD,622.9702752863186,0,0,0,0,0,0,0,0,0,0,5,12,19,2,1,1,0,1,0,0,0,1,Mumbai_Hyderabad,697,1,19,0,0,415.3135168575457,0.14446917223881314,0,0
Jet Airways,27/03/2019,Delhi,Cochin,DEL → AMD → BOM → COK,19:10,19:45 28 Mar,24h 35m,2 stops,No info,10976,2019-03-27,19:10:00,19:45:00,0,1475,0,0,0,3849,0,0,DEL,COK,2047.882109458646,0,0,0,0,0,0,0,0,0,0,3,27,13,1,1,1,3,3,0,1,2,0,Delhi_Cochin,4537,0,4,0,1,83.30367902882628,0.7202563043972847,1,0
Jet Airways,24/03/2019,Kolkata,Banglore,CCU → BOM → BLR,19:45,16:20 25 Mar,20h 35m,1 stop,In-flight meal not included,10031,2019-03-24,19:45:00,16:20:00,0,1235,1,0,0,3849,0,0,CCU,BLR,1546.4372901474003,0,0,0,0,1,0,0,0,0,1,3,24,12,1,1,1,3,2,0,1,1,0,Kolkata_Banglore,2871,1,7,0,1,75.13055660635143,0.7986098161680288,1,0
IndiGo,18/03/2019,Kolkata,Banglore,CCU → BLR,05:30,08:20,2h 50m,non-stop,No info,4462,2019-03-18,05:30:00,08:20:00,0,170,0,1,0,2053,0,0,CCU,BLR,1546.4372901474003,0,0,0,0,1,0,0,0,0,1,3,18,12,1,1,1,0,1,0,0,0,1,Kolkata_Banglore,2871,1,13,0,0,545.8013965226119,0.10993009615268413,1,0
IndiGo,1/04/2019,Delhi,Cochin,DEL → HYD → COK,07:35,12:10,4h 35m,1 stop,No info,5073,2019-04-01,07:35:00,12:10:00,0,275,0,1,0,2053,0,0,DEL,COK,2047.882109458646,0,0,0,0,0,0,0,0,0,0,4,1,14,2,1,1,1,2,1,0,1,0,Delhi_Cochin,4537,0,29,1,0,446.8106420637046,0.13428507370118867,1,0
IndiGo,27/03/2019,Chennai,Kolkata,MAA → CCU,05:15,07:35,2h 20m,non-stop,No info,4326,2019-03-27,05:15:00,07:35:00,0,140,0,1,0,2053,0,0,MAA,CCU,1385.198425287915,0,0,0,0,0,0,0,0,0,0,3,27,13,1,1,1,0,1,0,0,0,1,Chennai_Kolkata,381,1,4,0,1,593.656467980535,0.10106855266667002,1,0
Multiple carriers Premium economy,21/03/2019,Delhi,Cochin,DEL → BOM → COK,07:30,19:15,11h 45m,1 stop,No info,10161,2019-03-21,07:30:00,19:15:00,0,705,0,1,0,13,0,0,DEL,COK,2047.882109458646,0,0,0,0,1,0,0,0,0,1,3,21,12,1,1,1,1,3,1,0,1,0,Delhi_Cochin,4537,0,10,0,1,174.2878391028635,0.3442580980339564,1,0
IndiGo,12/06/2019,Mumbai,Hyderabad,BOM → HYD,16:55,18:25,1h 30m,non-stop,No info,3175,2019-06-12,16:55:00,18:25:00,0,90,0,1,0,2053,0,0,BOM,HYD,622.9702752863186,0,0,0,0,0,0,0,0,0,0,6,12,24,2,1,0,2,3,0,0,0,1,Mumbai_Hyderabad,697,1,18,0,0,415.3135168575457,0.14446917223881314,0,0
Vistara,24/03/2019,Kolkata,Banglore,CCU → DEL → BLR,20:20,09:10 25 Mar,12h 50m,1 stop,No info,12312,2019-03-24,20:20:00,09:10:00,0,770,1,0,0,479,0,0,CCU,BLR,1546.4372901474003,0,0,0,0,1,0,0,0,0,1,3,24,12,1,1,1,3,1,0,1,1,0,Kolkata_Banglore,2871,1,7,0,1,120.50160702447275,0.49791867080921637,1,0
Jet Airways,21/03/2019,Delhi,Cochin,DEL → UDR → BOM → COK,18:20,18:50 22 Mar,24h 30m,2 stops,No info,12604,2019-03-21,18:20:00,18:50:00,0,1470,0,0,0,3849,0,0,DEL,COK,2047.882109458646,0,0,0,0,1,0,0,0,0,1,3,21,12,1,1,1,3,3,0,1,2,0,Delhi_Cochin,4537,0,10,0,1,83.58702487586311,0.7178147576027176,1,0
Multiple carriers,15/06/2019,Delhi,Cochin,DEL → BOM → COK,07:30,19:00,11h 30m,1 stop,No info,10877,2019-06-15,07:30:00,19:00:00,0,690,1,1,0,1196,0,0,DEL,COK,2047.882109458646,0,0,0,0,0,0,0,0,0,0,6,15,24,2,1,0,1,3,1,0,1,0,Delhi_Cochin,4537,0,15,0,0,178.07670517031704,0.3369334576502552,1,0
IndiGo,18/05/2019,Kolkata,Banglore,CCU → MAA → BLR,06:20,10:20,4h,1 stop,No info,4226,2019-05-18,06:20:00,10:20:00,0,240,1,1,0,2053,0,0,CCU,BLR,1546.4372901474003,0,0,0,0,0,0,0,0,0,0,5,18,20,2,1,1,1,1,1,0,1,0,Kolkata_Banglore,2871,1,13,0,0,386.6093225368501,0.1551954298626129,1,0
Jet Airways,6/04/2019,Delhi,Cochin,DEL → BOM → COK,08:00,19:00,11h,1 stop,In-flight meal not included,5406,2019-04-06,08:00:00,19:00:00,0,660,1,1,0,3849,0,0,DEL,COK,2047.882109458646,0,0,0,0,0,0,0,0,0,0,4,6,14,2,1,1,1,3,1,0,1,0,Delhi_Cochin,4537,0,24,1,0,186.1711008598769,0.3222841768828528,1,0
IndiGo,15/05/2019,Delhi,Cochin,DEL → MAA → COK,02:00,07:25,5h 25m,1 stop,No info,8618,2019-05-15,02:00:00,07:25:00,0,325,0,1,1,2053,0,0,DEL,COK,2047.882109458646,0,0,0,0,0,0,0,0,0,0,5,15,20,2,1,1,0,1,0,0,1,0,Delhi_Cochin,4537,0,16,0,0,378.07054328467314,0.15870054164685934,1,0
IndiGo,18/04/2019,Kolkata,Banglore,CCU → BLR,17:15,19:50,2h 35m,non-stop,No info,4174,2019-04-18,17:15:00,19:50:00,0,155,0,1,0,2053,0,0,CCU,BLR,1546.4372901474003,0,0,0,0,0,0,0,0,0,0,4,18,16,2,1,1,2,3,0,0,0,1,Kolkata_Banglore,2871,1,12,0,0,598.6208865086711,0.10023038178627082,1,0
GoAir,1/06/2019,Delhi,Cochin,DEL → BOM → COK,14:25,19:35,5h 10m,1 stop,No info,10651,2019-06-01,14:25:00,19:35:00,0,310,1,1,0,194,0,0,DEL,COK,2047.882109458646,0,1,0,0,0,0,0,0,0,1,6,1,22,2,1,0,2,3,0,0,1,0,Delhi_Cochin,4537,0,29,1,0,396.3642792500605,0.15137590126315814,1,0
Jet Airways,21/03/2019,Delhi,Cochin,DEL → BOM → COK,18:15,04:25 22 Mar,10h 10m,1 stop,In-flight meal not included,5963,2019-03-21,18:15:00,04:25:00,0,610,0,0,1,3849,0,0,DEL,COK,2047.882109458646,0,0,0,0,1,0,0,0,0,1,3,21,12,1,1,1,3,0,0,1,1,0,Delhi_Cochin,4537,0,10,0,1,201.4310271598668,0.29786870893718215,1,0
Jet Airways,12/06/2019,Delhi,Cochin,DEL → JAI → BOM → COK,09:40,12:35 13 Jun,26h 55m,2 stops,In-flight meal not included,10368,2019-06-12,09:40:00,12:35:00,0,1615,0,0,0,3849,0,0,DEL,COK,2047.882109458646,0,0,0,0,0,0,0,0,0,0,6,12,24,2,1,0,1,2,1,0,2,0,Delhi_Cochin,4537,0,18,0,0,76.08230747214783,0.7886196146451625,1,0
IndiGo,6/03/2019,Mumbai,Hyderabad,BOM → GOI → HYD,15:45,23:00,7h 15m,1 stop,No info,7681,2019-03-06,15:45:00,23:00:00,0,435,0,1,0,2053,0,0,BOM,HYD,622.9702752863186,0,0,0,0,0,0,0,0,0,0,3,6,10,1,1,1,2,3,0,0,1,0,Mumbai_Hyderabad,697,1,25,1,0,85.92693452225085,0.6982676658209301,1,0
Multiple carriers,21/05/2019,Delhi,Cochin,DEL → BOM → COK,12:50,21:00,8h 10m,1 stop,No info,7485,2019-05-21,12:50:00,21:00:00,0,490,0,1,0,1196,0,0,DEL,COK,2047.882109458646,0,0,0,0,0,0,0,0,0,0,5,21,21,2,1,1,2,3,0,0,1,0,Delhi_Cochin,4537,0,10,0,1,250.7610746275893,0.23927158586757252,1,0
Jet Airways,3/04/2019,Banglore,Delhi,BLR → DEL,15:15,18:10,2h 55m,non-stop,In-flight meal not included,4544,2019-04-03,15:15:00,18:10:00,0,175,0,1,0,3849,0,0,BLR,DEL,1708.6520853536679,0,0,0,0,0,0,0,0,0,0,4,3,14,2,1,1,2,3,0,0,0,1,Banglore_Delhi,1265,1,27,1,0,585.8235721212576,0.10241991421195461,1,0
SpiceJet,15/04/2019,Kolkata,Banglore,CCU → MAA → BLR,15:05,20:20,5h 15m,1 stop,No info,4649,2019-04-15,15:05:00,20:20:00,0,315,0,1,0,818,0,0,CCU,BLR,1546.4372901474003,0,0,0,0,0,0,0,0,0,0,4,15,16,2,1,1,2,3,0,0,1,0,Kolkata_Banglore,2871,1,15,0,0,294.55948383760006,0.2036940016946794,1,0
Vistara,12/05/2019,Chennai,Kolkata,MAA → CCU,17:45,20:05,2h 20m,non-stop,No info,11982,2019-05-12,17:45:00,20:05:00,0,140,1,1,0,479,0,0,MAA,CCU,1385.198425287915,0,0,0,0,0,0,0,0,0,0,5,12,19,2,1,1,2,3,0,0,0,1,Chennai_Kolkata,381,1,19,0,0,593.656467980535,0.10106855266667002,1,0
Jet Airways,24/06/2019,Mumbai,Hyderabad,BOM → HYD,07:05,08:30,1h 25m,non-stop,In-flight meal not included,4995,2019-06-24,07:05:00,08:30:00,0,85,0,1,0,3849,0,0,BOM,HYD,622.9702752863186,0,0,0,0,0,0,0,0,0,0,6,24,26,2,1,0,1,1,1,0,0,1,Mumbai_Hyderabad,697,1,6,0,1,439.743723731519,0.13644310711443464,0,0
IndiGo,9/05/2019,Kolkata,Banglore,CCU → MAA → BLR,08:10,13:00,4h 50m,1 stop,No info,5069,2019-05-09,08:10:00,13:00:00,0,290,0,1,0,2053,0,0,CCU,BLR,1546.4372901474003,0,0,0,0,0,0,0,0,0,0,5,9,19,2,1,1,1,2,1,0,1,0,Kolkata_Banglore,2871,1,22,1,0,319.95254278911733,0.18752781108399058,1,0
SpiceJet,1/06/2019,Kolkata,Banglore,CCU → BLR,22:20,00:40 02 Jun,2h 20m,non-stop,No info,3873,2019-06-01,22:20:00,00:40:00,0,140,1,0,1,818,0,0,CCU,BLR,1546.4372901474003,0,1,0,0,0,0,0,0,0,1,6,1,22,2,1,0,3,0,0,1,0,1,Kolkata_Banglore,2871,1,29,1,0,662.7588386346001,0.09053066741985752,1,0
SpiceJet,27/04/2019,Kolkata,Banglore,CCU → BLR,22:20,00:40 28 Apr,2h 20m,non-stop,No info,3873,2019-04-27,22:20:00,00:40:00,0,140,1,0,1,818,0,0,CCU,BLR,1546.4372901474003,0,0,0,0,0,0,0,0,0,0,4,27,17,2,1,1,3,0,0,1,0,1,Kolkata_Banglore,2871,1,3,0,1,662.7588386346001,0.09053066741985752,1,0
Air India,27/05/2019,Delhi,Cochin,DEL → BLR → COK,09:45,23:00,13h 15m,1 stop,No info,8907,2019-05-27,09:45:00,23:00:00,0,795,0,1,0,1752,0,0,DEL,COK,2047.882109458646,0,0,0,0,0,0,0,0,0,0,5,27,22,2,1,1,1,3,1,0,1,0,Delhi_Cochin,4537,0,4,0,1,154.5571403365016,0.3882059403361636,1,0
Jet Airways,9/06/2019,Kolkata,Banglore,CCU → BOM → BLR,21:10,16:20 10 Jun,19h 10m,1 stop,In-flight meal not included,10844,2019-06-09,21:10:00,16:20:00,0,1150,1,0,1,3849,0,0,CCU,BLR,1546.4372901474003,0,1,0,0,0,0,0,0,0,1,6,9,23,2,1,0,3,2,0,1,1,0,Kolkata_Banglore,2871,1,21,1,0,80.68368470334262,0.7436447680916868,1,0
Jet Airways,15/05/2019,Kolkata,Banglore,CCU → BOM → BLR,21:10,19:50 16 May,22h 40m,1 stop,In-flight meal not included,10844,2019-05-15,21:10:00,19:50:00,0,1360,0,0,1,3849,0,0,CCU,BLR,1546.4372901474003,0,0,0,0,0,0,0,0,0,0,5,15,20,2,1,1,3,3,0,1,1,0,Kolkata_Banglore,2871,1,16,0,0,68.22517456532648,0.8794407692214731,1,0
Jet Airways,6/05/2019,Kolkata,Banglore,CCU → BOM → BLR,21:10,12:00 07 May,14h 50m,1 stop,In-flight meal not included,9663,2019-05-06,21:10:00,12:00:00,0,890,0,0,1,3849,0,0,CCU,BLR,1546.4372901474003,0,0,0,0,0,0,0,0,0,0,5,6,19,2,1,1,3,2,0,1,1,0,Kolkata_Banglore,2871,1,25,1,0,104.25419933577979,0.5755163857405228,1,0
Jet Airways,1/06/2019,Delhi,Cochin,DEL → IDR → BOM → COK,21:25,12:35 02 Jun,15h 10m,2 stops,No info,13292,2019-06-01,21:25:00,12:35:00,0,910,1,0,1,3849,0,0,DEL,COK,2047.882109458646,0,1,0,0,0,0,0,0,0,1,6,1,22,2,1,0,3,2,0,1,2,0,Delhi_Cochin,4537,0,29,1,0,135.02519403024039,0.44436151661120615,1,0
Jet Airways,12/06/2019,Delhi,Cochin,DEL → BHO → BOM → COK,05:30,12:35,7h 5m,2 stops,No info,14441,2019-06-12,05:30:00,12:35:00,0,425,0,1,0,3849,0,0,DEL,COK,2047.882109458646,0,0,0,0,0,0,0,0,0,0,6,12,24,2,1,0,0,2,0,0,2,0,Delhi_Cochin,4537,0,18,0,0,289.11276839416183,0.20753147753820067,1,0
Jet Airways,9/06/2019,Mumbai,Hyderabad,BOM → HYD,02:55,04:20,1h 25m,non-stop,In-flight meal not included,4050,2019-06-09,02:55:00,04:20:00,0,85,1,1,1,3849,0,0,BOM,HYD,622.9702752863186,0,1,0,0,0,0,0,0,0,1,6,9,23,2,1,0,0,0,0,0,0,1,Mumbai_Hyderabad,697,1,21,1,0,439.743723731519,0.13644310711443464,0,0
IndiGo,09/03/2019,Banglore,New Delhi,BLR → DEL,21:20,00:15 10 Mar,2h 55m,non-stop,No info,6144,2019-03-09,21:20:00,00:15:00,0,175,1,0,1,2053,0,0,BLR,DEL,1708.6520853536679,0,0,0,0,0,0,0,0,0,0,3,9,10,1,1,1,3,0,0,1,0,1,Banglore_New Delhi,932,0,22,1,0,585.8235721212576,0.10241991421195461,1,0
IndiGo,6/03/2019,Delhi,Cochin,DEL → BOM → COK,07:30,15:30,8h,1 stop,No info,14871,2019-03-06,07:30:00,15:30:00,0,480,0,1,0,2053,0,0,DEL,COK,2047.882109458646,0,0,0,0,0,0,0,0,0,0,3,6,10,1,1,1,1,2,1,0,1,0,Delhi_Cochin,4537,0,25,1,0,255.98526368233078,0.23438849227843842,1,0
Air Asia,18/04/2019,Banglore,Delhi,BLR → DEL,11:10,13:55,2h 45m,non-stop,No info,4483,2019-04-18,11:10:00,13:55:00,0,165,0,1,0,319,0,0,BLR,DEL,1708.6520853536679,0,0,0,0,0,0,0,0,0,0,4,18,16,2,1,1,1,2,1,0,0,1,Banglore_Delhi,1265,1,12,0,0,621.3280310376974,0.09656734768555719,1,0
IndiGo,15/05/2019,Delhi,Cochin,DEL → BOM → COK,10:35,01:30 16 May,14h 55m,1 stop,No info,6979,2019-05-15,10:35:00,01:30:00,0,895,0,0,1,2053,0,0,DEL,COK,2047.882109458646,0,0,0,0,0,0,0,0,0,0,5,15,20,2,1,1,1,0,1,0,1,0,Delhi_Cochin,4537,0,16,0,0,137.2881861089595,0.4370368762275049,1,0
Jet Airways,27/06/2019,Mumbai,Hyderabad,BOM → HYD,10:20,11:50,1h 30m,non-stop,No info,8040,2019-06-27,10:20:00,11:50:00,0,90,0,1,0,3849,0,0,BOM,HYD,622.9702752863186,0,0,0,0,0,0,0,0,0,0,6,27,26,2,1,0,1,1,1,0,0,1,Mumbai_Hyderabad,697,1,3,0,1,415.3135168575457,0.14446917223881314,0,0
IndiGo,1/06/2019,Delhi,Cochin,DEL → BOM → COK,09:15,01:30 02 Jun,16h 15m,1 stop,No info,7048,2019-06-01,09:15:00,01:30:00,0,975,1,0,1,2053,0,0,DEL,COK,2047.882109458646,0,1,0,0,0,0,0,0,0,1,6,1,22,2,1,0,1,0,1,0,1,0,Delhi_Cochin,4537,0,29,1,0,126.02351442822436,0.476101624940578,1,0
SpiceJet,27/06/2019,Banglore,Delhi,BLR → DEL,09:30,12:20,2h 50m,non-stop,No check-in baggage included,3573,2019-06-27,09:30:00,12:20:00,0,170,0,1,0,818,0,0,BLR,DEL,1708.6520853536679,0,0,0,0,0,0,0,0,0,0,6,27,26,2,1,0,1,2,1,0,0,1,Banglore_Delhi,1265,1,3,0,1,603.0536771836476,0.0994936309487559,1,0
IndiGo,27/05/2019,Delhi,Cochin,DEL → BOM → COK,16:00,21:00,5h,1 stop,No info,5054,2019-05-27,16:00:00,21:00:00,0,300,0,1,0,2053,0,0,DEL,COK,2047.882109458646,0,0,0,0,0,0,0,0,0,0,5,27,22,2,1,1,2,3,0,0,1,0,Delhi_Cochin,4537,0,4,0,1,409.5764218917292,0.146492807674024,1,0
Air India,1/06/2019,Delhi,Cochin,DEL → BOM → COK,21:00,19:15 02 Jun,22h 15m,1 stop,No info,8582,2019-06-01,21:00:00,19:15:00,0,1335,1,0,1,1752,0,0,DEL,COK,2047.882109458646,0,1,0,0,0,0,0,0,0,1,6,1,22,2,1,0,3,3,0,1,1,0,Delhi_Cochin,4537,0,29,1,0,92.0396453689279,0.6518929941494068,1,0
Air Asia,9/06/2019,Delhi,Cochin,DEL → BLR → COK,07:55,13:25,5h 30m,1 stop,No info,8759,2019-06-09,07:55:00,13:25:00,0,330,1,1,0,319,0,0,DEL,COK,2047.882109458646,0,1,0,0,0,0,0,0,0,1,6,9,23,2,1,0,1,2,1,0,1,0,Delhi_Cochin,4537,0,21,1,0,372.3422017197538,0.1611420884414264,1,0
IndiGo,27/04/2019,Delhi,Cochin,DEL → HYD → COK,07:35,16:10,8h 35m,1 stop,No info,6442,2019-04-27,07:35:00,16:10:00,0,515,1,1,0,2053,0,0,DEL,COK,2047.882109458646,0,0,0,0,0,0,0,0,0,0,4,27,17,2,1,1,1,2,1,0,1,0,Delhi_Cochin,4537,0,3,0,1,238.5882069272209,0.2514793198404079,1,0
Air India,18/05/2019,Delhi,Cochin,DEL → BOM → COK,03:50,19:15,15h 25m,1 stop,No info,8879,2019-05-18,03:50:00,19:15:00,0,925,1,1,0,1752,0,0,DEL,COK,2047.882109458646,0,0,0,0,0,0,0,0,0,0,5,18,20,2,1,1,0,3,0,0,1,0,Delhi_Cochin,4537,0,13,0,0,132.83559628920946,0.45168615699490733,1,0
Jet Airways,24/03/2019,Kolkata,Banglore,CCU → BOM → BLR,21:10,18:10 25 Mar,21h,1 stop,In-flight meal not included,10031,2019-03-24,21:10:00,18:10:00,0,1260,1,0,1,3849,0,0,CCU,BLR,1546.4372901474003,0,0,0,0,1,0,0,0,0,1,3,24,12,1,1,1,3,3,0,1,1,0,Kolkata_Banglore,2871,1,7,0,1,73.63987095940001,0.8147760067787176,1,0
Jet Airways,3/06/2019,Delhi,Cochin,DEL → JAI → BOM → COK,05:30,19:00,13h 30m,2 stops,In-flight meal not included,10368,2019-06-03,05:30:00,19:00:00,0,810,0,1,0,3849,0,0,DEL,COK,2047.882109458646,0,1,0,0,0,0,0,0,0,1,6,3,23,2,1,0,0,3,0,0,2,0,Delhi_Cochin,4537,0,27,1,0,151.69497107101083,0.3955305807198648,1,0
IndiGo,24/06/2019,Banglore,Delhi,BLR → DEL,13:00,15:50,2h 50m,non-stop,No info,3943,2019-06-24,13:00:00,15:50:00,0,170,0,1,0,2053,0,0,BLR,DEL,1708.6520853536679,0,0,0,0,0,0,0,0,0,0,6,24,26,2,1,0,2,2,0,0,0,1,Banglore_Delhi,1265,1,6,0,1,603.0536771836476,0.0994936309487559,1,0
IndiGo,3/03/2019,Delhi,Cochin,DEL → BOM → COK,04:45,11:30,6h 45m,1 stop,No info,14871,2019-03-03,04:45:00,11:30:00,0,405,1,1,0,2053,0,0,DEL,COK,2047.882109458646,0,0,0,0,0,0,0,0,0,0,3,3,9,1,1,1,0,1,0,0,1,0,Delhi_Cochin,4537,0,28,1,0,303.38994214202165,0.1977652903599324,1,0
Jet Airways,18/06/2019,Mumbai,Hyderabad,BOM → HYD,08:45,10:15,1h 30m,non-stop,In-flight meal not included,4995,2019-06-18,08:45:00,10:15:00,0,90,0,1,0,3849,0,0,BOM,HYD,622.9702752863186,0,0,0,0,0,0,0,0,0,0,6,18,25,2,1,0,1,1,1,0,0,1,Mumbai_Hyderabad,697,1,12,0,0,415.3135168575457,0.14446917223881314,0,0
Multiple carriers,24/06/2019,Delhi,Cochin,DEL → BOM → COK,10:20,19:00,8h 40m,1 stop,In-flight meal not included,10791,2019-06-24,10:20:00,19:00:00,0,520,0,1,0,1196,0,0,DEL,COK,2047.882109458646,0,0,0,0,0,0,0,0,0,0,6,24,26,2,1,0,1,3,1,0,1,0,Delhi_Cochin,4537,0,6,0,1,236.2940895529207,0.25392086663497493,1,0
SpiceJet,3/06/2019,Mumbai,Hyderabad,BOM → HYD,05:45,07:15,1h 30m,non-stop,No info,2753,2019-06-03,05:45:00,07:15:00,0,90,0,1,0,818,0,0,BOM,HYD,622.9702752863186,0,1,0,0,0,0,0,0,0,1,6,3,23,2,1,0,0,1,0,0,0,1,Mumbai_Hyderabad,697,1,27,1,0,415.3135168575457,0.14446917223881314,0,0
IndiGo,9/04/2019,Banglore,Delhi,BLR → DEL,10:10,13:00,2h 50m,non-stop,No info,4423,2019-04-09,10:10:00,13:00:00,0,170,0,1,0,2053,0,0,BLR,DEL,1708.6520853536679,0,0,0,0,0,0,0,0,0,0,4,9,15,2,1,1,1,2,1,0,0,1,Banglore_Delhi,1265,1,21,1,0,603.0536771836476,0.0994936309487559,1,0
Air Asia,27/05/2019,Kolkata,Banglore,CCU → BLR,10:20,12:55,2h 35m,non-stop,No info,4409,2019-05-27,10:20:00,12:55:00,0,155,0,1,0,319,0,0,CCU,BLR,1546.4372901474003,0,0,0,0,0,0,0,0,0,0,5,27,22,2,1,1,1,2,1,0,0,1,Kolkata_Banglore,2871,1,4,0,1,598.6208865086711,0.10023038178627082,1,0
Air India,9/05/2019,Kolkata,Banglore,CCU → HYD → BLR,19:00,11:05 10 May,16h 5m,1 stop,No info,6117,2019-05-09,19:00:00,11:05:00,0,965,0,0,0,1752,0,0,CCU,BLR,1546.4372901474003,0,0,0,0,0,0,0,0,0,0,5,9,19,2,1,1,3,1,0,1,1,0,Kolkata_Banglore,2871,1,22,1,0,96.15154135631504,0.6240149575725893,1,0
Jet Airways,21/05/2019,Delhi,Cochin,DEL → AMD → BOM → COK,19:10,19:00 22 May,23h 50m,2 stops,No info,15129,2019-05-21,19:10:00,19:00:00,0,1430,0,0,0,3849,0,0,DEL,COK,2047.882109458646,0,0,0,0,0,0,0,0,0,0,5,21,21,2,1,1,3,3,0,1,2,0,Delhi_Cochin,4537,0,10,0,1,85.92512347378934,0.6982823832461811,1,0
Vistara,6/06/2019,Kolkata,Banglore,CCU → DEL → BLR,20:20,23:25 07 Jun,27h 5m,1 stop,No info,9345,2019-06-06,20:20:00,23:25:00,0,1625,0,0,0,479,0,0,CCU,BLR,1546.4372901474003,0,1,0,0,0,0,0,0,0,1,6,6,23,2,1,0,3,3,0,1,1,0,Kolkata_Banglore,2871,1,24,1,0,57.09922302082708,1.0508023896947747,1,0
Vistara,9/05/2019,Kolkata,Banglore,CCU → DEL → BLR,07:10,23:25,16h 15m,1 stop,No info,8085,2019-05-09,07:10:00,23:25:00,0,975,0,1,0,479,0,0,CCU,BLR,1546.4372901474003,0,0,0,0,0,0,0,0,0,0,5,9,19,2,1,1,1,3,1,0,1,0,Kolkata_Banglore,2871,1,22,1,0,95.16537170137848,0.6304814338168648,1,0
Jet Airways,6/05/2019,Delhi,Cochin,DEL → BOM → COK,13:00,04:25 07 May,15h 25m,1 stop,No info,15554,2019-05-06,13:00:00,04:25:00,0,925,0,0,1,3849,0,0,DEL,COK,2047.882109458646,0,0,0,0,0,0,0,0,0,0,5,6,19,2,1,1,2,0,0,0,1,0,Delhi_Cochin,4537,0,25,1,0,132.83559628920946,0.45168615699490733,1,0
SpiceJet,21/05/2019,Banglore,Delhi,BLR → DEL,09:30,12:20,2h 50m,non-stop,No check-in baggage included,3573,2019-05-21,09:30:00,12:20:00,0,170,0,1,0,818,0,0,BLR,DEL,1708.6520853536679,0,0,0,0,0,0,0,0,0,0,5,21,21,2,1,1,1,2,1,0,0,1,Banglore_Delhi,1265,1,10,0,1,603.0536771836476,0.0994936309487559,1,0
Multiple carriers,3/03/2019,Delhi,Cochin,DEL → BOM → COK,17:00,01:35 04 Mar,8h 35m,1 stop,No info,17073,2019-03-03,17:00:00,01:35:00,0,515,1,0,1,1196,0,0,DEL,COK,2047.882109458646,0,0,0,0,0,0,0,0,0,0,3,3,9,1,1,1,2,0,0,0,1,0,Delhi_Cochin,4537,0,28,1,0,238.5882069272209,0.2514793198404079,1,0
Multiple carriers,9/06/2019,Delhi,Cochin,DEL → BOM → COK,11:40,01:30 10 Jun,13h 50m,1 stop,No info,6795,2019-06-09,11:40:00,01:30:00,0,830,1,0,1,1196,0,0,DEL,COK,2047.882109458646,0,1,0,0,0,0,0,0,0,1,6,9,23,2,1,0,1,0,1,0,1,0,Delhi_Cochin,4537,0,21,1,0,148.03967056327562,0.40529676789813307,1,0
Vistara,21/03/2019,Banglore,New Delhi,BLR → DEL,07:00,09:40,2h 40m,non-stop,No info,5403,2019-03-21,07:00:00,09:40:00,0,160,0,1,0,479,0,0,BLR,DEL,1708.6520853536679,0,0,0,0,1,0,0,0,0,1,3,21,12,1,1,1,1,1,1,0,0,1,Banglore_New Delhi,932,0,10,0,1,640.7445320076254,0.09364106442235849,1,0
IndiGo,15/05/2019,Chennai,Kolkata,MAA → CCU,05:15,07:40,2h 25m,non-stop,No info,3540,2019-05-15,05:15:00,07:40:00,0,145,0,1,0,2053,0,0,MAA,CCU,1385.198425287915,0,0,0,0,0,0,0,0,0,0,5,15,20,2,1,1,0,1,0,0,0,1,Chennai_Kolkata,381,1,16,0,0,573.1855552915509,0.1046781438333368,1,0
Vistara,24/04/2019,Delhi,Cochin,DEL → COK,14:40,17:50,3h 10m,non-stop,No info,6216,2019-04-24,14:40:00,17:50:00,0,190,0,1,0,479,0,0,DEL,COK,2047.882109458646,0,0,0,0,0,0,0,0,0,0,4,24,17,2,1,1,2,2,0,0,0,1,Delhi_Cochin,4537,0,6,0,1,646.6996135132566,0.09277877819354853,1,0
Jet Airways,21/05/2019,Banglore,Delhi,BLR → DEL,15:50,18:45,2h 55m,non-stop,In-flight meal not included,3359,2019-05-21,15:50:00,18:45:00,0,175,0,1,0,3849,0,0,BLR,DEL,1708.6520853536679,0,0,0,0,0,0,0,0,0,0,5,21,21,2,1,1,2,3,0,0,0,1,Banglore_Delhi,1265,1,10,0,1,585.8235721212576,0.10241991421195461,1,0
Jet Airways,24/05/2019,Kolkata,Banglore,CCU → BOM → BLR,18:55,23:35 25 May,28h 40m,1 stop,In-flight meal not included,10844,2019-05-24,18:55:00,23:35:00,0,1720,0,0,0,3849,0,0,CCU,BLR,1546.4372901474003,0,0,0,0,0,0,0,0,0,0,5,24,21,2,1,1,3,3,0,1,1,0,Kolkata_Banglore,2871,1,7,0,1,53.94548686560698,1.1122339140153923,1,0
Air India,15/06/2019,Banglore,Delhi,BLR → DEL,13:20,16:10,2h 50m,non-stop,No info,6961,2019-06-15,13:20:00,16:10:00,0,170,1,1,0,1752,0,0,BLR,DEL,1708.6520853536679,0,0,0,0,0,0,0,0,0,0,6,15,24,2,1,0,2,2,0,0,0,1,Banglore_Delhi,1265,1,15,0,0,603.0536771836476,0.0994936309487559,1,0
Air Asia,3/04/2019,Kolkata,Banglore,CCU → BLR,10:20,12:55,2h 35m,non-stop,No info,4107,2019-04-03,10:20:00,12:55:00,0,155,0,1,0,319,0,0,CCU,BLR,1546.4372901474003,0,0,0,0,0,0,0,0,0,0,4,3,14,2,1,1,1,2,1,0,0,1,Kolkata_Banglore,2871,1,27,1,0,598.6208865086711,0.10023038178627082,1,0
Multiple carriers,21/03/2019,Delhi,Cochin,DEL → BOM → COK,09:10,18:50,9h 40m,1 stop,No info,13069,2019-03-21,09:10:00,18:50:00,0,580,0,1,0,1196,0,0,DEL,COK,2047.882109458646,0,0,0,0,1,0,0,0,0,1,3,21,12,1,1,1,1,3,1,0,1,0,Delhi_Cochin,4537,0,10,0,1,211.8498733922737,0.28321942816977974,1,0
Jet Airways,24/06/2019,Delhi,Cochin,DEL → LKO → BOM → COK,11:45,04:25 25 Jun,16h 40m,2 stops,No info,13357,2019-06-24,11:45:00,04:25:00,0,1000,0,0,1,3849,0,0,DEL,COK,2047.882109458646,0,0,0,0,0,0,0,0,0,0,6,24,26,2,1,0,1,0,1,0,2,0,Delhi_Cochin,4537,0,6,0,1,122.87292656751876,0.4883093589134133,1,0
IndiGo,1/06/2019,Delhi,Cochin,DEL → HYD → COK,16:10,22:30,6h 20m,1 stop,No info,6938,2019-06-01,16:10:00,22:30:00,0,380,1,1,0,2053,0,0,DEL,COK,2047.882109458646,0,1,0,0,0,0,0,0,0,1,6,1,22,2,1,0,2,3,0,0,1,0,Delhi_Cochin,4537,0,29,1,0,323.3498067566283,0.18555755638709706,1,0
Jet Airways,27/06/2019,Delhi,Cochin,DEL → IDR → BOM → COK,09:35,12:35 28 Jun,27h,2 stops,No info,13292,2019-06-27,09:35:00,12:35:00,0,1620,0,0,0,3849,0,0,DEL,COK,2047.882109458646,0,0,0,0,0,0,0,0,0,0,6,27,26,2,1,0,1,2,1,0,2,0,Delhi_Cochin,4537,0,3,0,1,75.84748553550541,0.7910611614397296,1,0
Air India,01/03/2019,Banglore,New Delhi,BLR → BOM → BHO → DEL,08:50,23:25,14h 35m,2 stops,1 Short layover,26743,2019-03-01,08:50:00,23:25:00,0,875,0,1,0,1752,0,0,BLR,DEL,1708.6520853536679,0,0,0,0,0,0,0,0,0,0,3,1,9,1,1,1,1,3,1,0,2,0,Banglore_New Delhi,932,0,30,1,0,117.16471442425151,0.512099571059773,1,0
Multiple carriers,21/03/2019,Delhi,Cochin,DEL → BOM → COK,06:40,18:50,12h 10m,1 stop,No info,13568,2019-03-21,06:40:00,18:50:00,0,730,0,1,0,1196,0,0,DEL,COK,2047.882109458646,0,0,0,0,1,0,0,0,0,1,3,21,12,1,1,1,1,3,1,0,1,0,Delhi_Cochin,4537,0,10,0,1,168.31907748975175,0.3564658320067917,1,0
Multiple carriers,6/03/2019,Delhi,Cochin,DEL → BOM → COK,11:40,19:15,7h 35m,1 stop,No info,15353,2019-03-06,11:40:00,19:15:00,0,455,0,1,0,1196,0,0,DEL,COK,2047.882109458646,0,0,0,0,0,0,0,0,0,0,3,6,10,1,1,1,1,3,1,0,1,0,Delhi_Cochin,4537,0,25,1,0,270.05038806048077,0.22218075830560308,1,0
IndiGo,15/05/2019,Chennai,Kolkata,MAA → CCU,14:45,17:05,2h 20m,non-stop,No info,3597,2019-05-15,14:45:00,17:05:00,0,140,0,1,0,2053,0,0,MAA,CCU,1385.198425287915,0,0,0,0,0,0,0,0,0,0,5,15,20,2,1,1,2,2,0,0,0,1,Chennai_Kolkata,381,1,16,0,0,593.656467980535,0.10106855266667002,1,0
Jet Airways,24/03/2019,Kolkata,Banglore,CCU → BOM → BLR,21:10,16:20 25 Mar,19h 10m,1 stop,In-flight meal not included,10031,2019-03-24,21:10:00,16:20:00,0,1150,1,0,1,3849,0,0,CCU,BLR,1546.4372901474003,0,0,0,0,1,0,0,0,0,1,3,24,12,1,1,1,3,2,0,1,1,0,Kolkata_Banglore,2871,1,7,0,1,80.68368470334262,0.7436447680916868,1,0
Air India,9/05/2019,Kolkata,Banglore,CCU → BOM → AMD → BLR,09:25,05:25 10 May,20h,2 stops,No info,14687,2019-05-09,09:25:00,05:25:00,0,1200,0,0,1,1752,0,0,CCU,BLR,1546.4372901474003,0,0,0,0,0,0,0,0,0,0,5,9,19,2,1,1,1,0,1,0,2,0,Kolkata_Banglore,2871,1,22,1,0,77.32186450737001,0.7759771493130645,1,0
Jet Airways,6/06/2019,Banglore,Delhi,BLR → DEL,19:50,22:50,3h,non-stop,In-flight meal not included,7229,2019-06-06,19:50:00,22:50:00,0,180,0,1,0,3849,0,0,BLR,DEL,1708.6520853536679,0,1,0,0,0,0,0,0,0,1,6,6,23,2,1,0,3,3,0,1,0,1,Banglore_Delhi,1265,1,24,1,0,569.5506951178893,0.10534619747515331,1,0
GoAir,9/05/2019,Delhi,Cochin,DEL → BOM → COK,14:25,19:35,5h 10m,1 stop,No info,10188,2019-05-09,14:25:00,19:35:00,0,310,0,1,0,194,0,0,DEL,COK,2047.882109458646,0,0,0,0,0,0,0,0,0,0,5,9,19,2,1,1,2,3,0,0,1,0,Delhi_Cochin,4537,0,22,1,0,396.3642792500605,0.15137590126315814,1,0
Vistara,09/03/2019,Banglore,New Delhi,BLR → DEL,07:00,09:40,2h 40m,non-stop,No info,7398,2019-03-09,07:00:00,09:40:00,0,160,1,1,0,479,0,0,BLR,DEL,1708.6520853536679,0,0,0,0,0,0,0,0,0,0,3,9,10,1,1,1,1,1,1,0,0,1,Banglore_New Delhi,932,0,22,1,0,640.7445320076254,0.09364106442235849,1,0
Jet Airways,18/05/2019,Delhi,Cochin,DEL → AMD → BOM → COK,13:25,19:00 19 May,29h 35m,2 stops,No info,16704,2019-05-18,13:25:00,19:00:00,0,1775,1,0,0,3849,0,0,DEL,COK,2047.882109458646,0,0,0,0,0,0,0,0,0,0,5,18,20,2,1,1,2,3,0,0,2,0,Delhi_Cochin,4537,0,13,0,0,69.2241839817007,0.8667491120713087,1,0
IndiGo,01/03/2019,Banglore,New Delhi,BLR → HYD → DEL,16:55,21:50,4h 55m,1 stop,No Info,8153,2019-03-01,16:55:00,21:50:00,0,295,0,1,0,2053,0,0,BLR,DEL,1708.6520853536679,0,0,0,0,0,0,0,0,0,0,3,1,9,1,1,1,2,3,0,0,1,0,Banglore_New Delhi,932,0,30,1,0,347.5224580380342,0.17265071252872347,1,0
Jet Airways,9/04/2019,Banglore,Delhi,BLR → DEL,07:10,10:10,3h,non-stop,No info,7229,2019-04-09,07:10:00,10:10:00,0,180,0,1,0,3849,0,0,BLR,DEL,1708.6520853536679,0,0,0,0,0,0,0,0,0,0,4,9,15,2,1,1,1,1,1,0,0,1,Banglore_Delhi,1265,1,21,1,0,569.5506951178893,0.10534619747515331,1,0
Multiple carriers,27/05/2019,Delhi,Cochin,DEL → BOM → COK,13:00,01:30 28 May,12h 30m,1 stop,In-flight meal not included,6943,2019-05-27,13:00:00,01:30:00,0,750,0,0,1,1196,0,0,DEL,COK,2047.882109458646,0,0,0,0,0,0,0,0,0,0,5,27,22,2,1,1,2,0,0,0,1,0,Delhi_Cochin,4537,0,4,0,1,163.83056875669166,0.36623201918506,1,0
Multiple carriers,1/06/2019,Delhi,Cochin,DEL → BOM → COK,06:40,19:15,12h 35m,1 stop,No info,8937,2019-06-01,06:40:00,19:15:00,0,755,1,1,0,1196,0,0,DEL,COK,2047.882109458646,0,1,0,0,0,0,0,0,0,1,6,1,22,2,1,0,1,3,1,0,1,0,Delhi_Cochin,4537,0,29,1,0,162.74559810267385,0.3686735659796271,1,0
Air India,3/03/2019,Delhi,Cochin,DEL → HYD → MAA → COK,07:05,09:25 04 Mar,26h 20m,2 stops,No info,9400,2019-03-03,07:05:00,09:25:00,0,1580,1,0,0,1752,0,0,DEL,COK,2047.882109458646,0,0,0,0,0,0,0,0,0,0,3,3,9,1,1,1,1,1,1,0,2,0,Delhi_Cochin,4537,0,28,1,0,77.7676750427334,0.7715287870831931,1,0
Vistara,24/03/2019,Kolkata,Banglore,CCU → DEL → BLR,07:10,20:25,13h 15m,1 stop,No info,13152,2019-03-24,07:10:00,20:25:00,0,795,1,1,0,479,0,0,CCU,BLR,1546.4372901474003,0,0,0,0,1,0,0,0,0,1,3,24,12,1,1,1,1,3,1,0,1,0,Kolkata_Banglore,2871,1,7,0,1,116.71224831301134,0.5140848614199052,1,0
IndiGo,1/06/2019,Banglore,Delhi,BLR → DEL,22:10,01:00 02 Jun,2h 50m,non-stop,No info,3419,2019-06-01,22:10:00,01:00:00,0,170,1,0,1,2053,0,0,BLR,DEL,1708.6520853536679,0,1,0,0,0,0,0,0,0,1,6,1,22,2,1,0,3,0,0,1,0,1,Banglore_Delhi,1265,1,29,1,0,603.0536771836476,0.0994936309487559,1,0
Vistara,12/06/2019,Kolkata,Banglore,CCU → DEL → BLR,20:20,09:05 13 Jun,12h 45m,1 stop,No info,7927,2019-06-12,20:20:00,09:05:00,0,765,0,0,0,479,0,0,CCU,BLR,1546.4372901474003,0,0,0,0,0,0,0,0,0,0,6,12,24,2,1,0,3,1,0,1,1,0,Kolkata_Banglore,2871,1,18,0,0,121.28919922724707,0.4946854326870786,1,0
Air India,15/03/2019,Banglore,New Delhi,BLR → CCU → GAU → DEL,05:50,22:10,16h 20m,2 stops,No info,9796,2019-03-15,05:50:00,22:10:00,0,980,0,1,0,1752,0,0,BLR,DEL,1708.6520853536679,0,0,0,0,1,0,0,0,0,1,3,15,11,1,1,1,0,3,0,0,2,0,Banglore_New Delhi,932,0,16,0,0,104.61135216451028,0.5735515195869458,1,0
Vistara,03/03/2019,Banglore,New Delhi,BLR → DEL,11:30,14:10,2h 40m,non-stop,No info,8028,2019-03-03,11:30:00,14:10:00,0,160,1,1,0,479,0,0,BLR,DEL,1708.6520853536679,0,0,0,0,0,0,0,0,0,0,3,3,9,1,1,1,1,2,1,0,0,1,Banglore_New Delhi,932,0,28,1,0,640.7445320076254,0.09364106442235849,1,0
Multiple carriers,6/03/2019,Delhi,Cochin,DEL → HYD → MAA → COK,13:05,21:20,8h 15m,2 stops,No info,10759,2019-03-06,13:05:00,21:20:00,0,495,0,1,0,1196,0,0,DEL,COK,2047.882109458646,0,0,0,0,0,0,0,0,0,0,3,6,10,1,1,1,2,3,0,0,2,0,Delhi_Cochin,4537,0,25,1,0,248.2281344798359,0.2417131326621396,1,0
Multiple carriers,21/05/2019,Delhi,Cochin,DEL → BOM → COK,07:00,19:00,12h,1 stop,No info,10197,2019-05-21,07:00:00,19:00:00,0,720,0,1,0,1196,0,0,DEL,COK,2047.882109458646,0,0,0,0,0,0,0,0,0,0,5,21,21,2,1,1,1,3,1,0,1,0,Delhi_Cochin,4537,0,10,0,1,170.65684245488717,0.3515827384176576,1,0
Air India,1/06/2019,Banglore,Delhi,BLR → DEL,21:05,23:55,2h 50m,non-stop,No info,5228,2019-06-01,21:05:00,23:55:00,0,170,1,1,1,1752,0,0,BLR,DEL,1708.6520853536679,0,1,0,0,0,0,0,0,0,1,6,1,22,2,1,0,3,3,0,1,0,1,Banglore_Delhi,1265,1,29,1,0,603.0536771836476,0.0994936309487559,1,0
Multiple carriers,18/05/2019,Delhi,Cochin,DEL → BOM → COK,10:00,21:00,11h,1 stop,In-flight meal not included,9275,2019-05-18,10:00:00,21:00:00,0,660,1,1,0,1196,0,0,DEL,COK,2047.882109458646,0,0,0,0,0,0,0,0,0,0,5,18,20,2,1,1,1,3,1,0,1,0,Delhi_Cochin,4537,0,13,0,0,186.1711008598769,0.3222841768828528,1,0
IndiGo,3/03/2019,Chennai,Kolkata,MAA → CCU,22:05,00:25 04 Mar,2h 20m,non-stop,No info,5277,2019-03-03,22:05:00,00:25:00,0,140,1,0,1,2053,0,0,MAA,CCU,1385.198425287915,0,0,0,0,0,0,0,0,0,0,3,3,9,1,1,1,3,0,0,1,0,1,Chennai_Kolkata,381,1,28,1,0,593.656467980535,0.10106855266667002,1,0
Jet Airways,18/05/2019,Delhi,Cochin,DEL → NAG → BOM → COK,14:35,04:25 19 May,13h 50m,2 stops,In-flight meal not included,13848,2019-05-18,14:35:00,04:25:00,0,830,1,0,1,3849,0,0,DEL,COK,2047.882109458646,0,0,0,0,0,0,0,0,0,0,5,18,20,2,1,1,2,0,0,0,2,0,Delhi_Cochin,4537,0,13,0,0,148.03967056327562,0.40529676789813307,1,0
IndiGo,15/05/2019,Delhi,Cochin,DEL → HYD → COK,14:20,22:30,8h 10m,1 stop,No info,6412,2019-05-15,14:20:00,22:30:00,0,490,0,1,0,2053,0,0,DEL,COK,2047.882109458646,0,0,0,0,0,0,0,0,0,0,5,15,20,2,1,1,2,3,0,0,1,0,Delhi_Cochin,4537,0,16,0,0,250.7610746275893,0.23927158586757252,1,0
Jet Airways,18/05/2019,Kolkata,Banglore,CCU → BOM → BLR,16:30,04:40 19 May,12h 10m,1 stop,No info,13941,2019-05-18,16:30:00,04:40:00,0,730,1,0,1,3849,0,0,CCU,BLR,1546.4372901474003,0,0,0,0,0,0,0,0,0,0,5,18,20,2,1,1,2,0,0,0,1,0,Kolkata_Banglore,2871,1,13,0,0,127.10443480663565,0.4720527658321142,1,0
Vistara,6/05/2019,Banglore,Delhi,BLR → DEL,07:00,09:40,2h 40m,non-stop,No info,4668,2019-05-06,07:00:00,09:40:00,0,160,0,1,0,479,0,0,BLR,DEL,1708.6520853536679,0,0,0,0,0,0,0,0,0,0,5,6,19,2,1,1,1,1,1,0,0,1,Banglore_Delhi,1265,1,25,1,0,640.7445320076254,0.09364106442235849,1,0
IndiGo,18/06/2019,Banglore,Delhi,BLR → DEL,01:30,04:15,2h 45m,non-stop,No info,3419,2019-06-18,01:30:00,04:15:00,0,165,0,1,1,2053,0,0,BLR,DEL,1708.6520853536679,0,0,0,0,0,0,0,0,0,0,6,18,25,2,1,0,0,0,0,0,0,1,Banglore_Delhi,1265,1,12,0,0,621.3280310376974,0.09656734768555719,1,0
IndiGo,6/04/2019,Banglore,Delhi,BLR → DEL,22:10,01:00 07 Apr,2h 50m,non-stop,No info,3943,2019-04-06,22:10:00,01:00:00,0,170,1,0,1,2053,0,0,BLR,DEL,1708.6520853536679,0,0,0,0,0,0,0,0,0,0,4,6,14,2,1,1,3,0,0,1,0,1,Banglore_Delhi,1265,1,24,1,0,603.0536771836476,0.0994936309487559,1,0
Air India,24/05/2019,Kolkata,Banglore,CCU → MAA → BLR,14:35,14:35 25 May,24h,1 stop,No info,6528,2019-05-24,14:35:00,14:35:00,0,1440,0,0,0,1752,0,0,CCU,BLR,1546.4372901474003,0,0,0,0,0,0,0,0,0,0,5,24,21,2,1,1,2,2,0,0,1,0,Kolkata_Banglore,2871,1,7,0,1,64.43488708947501,0.9311725791756773,1,0
Jet Airways,21/05/2019,Banglore,Delhi,BLR → DEL,17:45,20:45,3h,non-stop,No info,7229,2019-05-21,17:45:00,20:45:00,0,180,0,1,0,3849,0,0,BLR,DEL,1708.6520853536679,0,0,0,0,0,0,0,0,0,0,5,21,21,2,1,1,2,3,0,0,0,1,Banglore_Delhi,1265,1,10,0,1,569.5506951178893,0.10534619747515331,1,0
Multiple carriers,21/03/2019,Delhi,Cochin,DEL → BOM → COK,13:00,01:35 22 Mar,12h 35m,1 stop,No info,13542,2019-03-21,13:00:00,01:35:00,0,755,0,0,1,1196,0,0,DEL,COK,2047.882109458646,0,0,0,0,1,0,0,0,0,1,3,21,12,1,1,1,2,0,0,0,1,0,Delhi_Cochin,4537,0,10,0,1,162.74559810267385,0.3686735659796271,1,0
Jet Airways,12/06/2019,Kolkata,Banglore,CCU → BOM → BLR,18:55,20:45 13 Jun,25h 50m,1 stop,In-flight meal not included,8529,2019-06-12,18:55:00,20:45:00,0,1550,0,0,0,3849,0,0,CCU,BLR,1546.4372901474003,0,0,0,0,0,0,0,0,0,0,6,12,24,2,1,0,3,3,0,1,1,0,Kolkata_Banglore,2871,1,18,0,0,59.86208865086711,1.0023038178627082,1,0
Jet Airways,21/06/2019,Banglore,Delhi,BLR → DEL,15:15,18:10,2h 55m,non-stop,No info,8016,2019-06-21,15:15:00,18:10:00,0,175,0,1,0,3849,0,0,BLR,DEL,1708.6520853536679,0,0,0,0,0,0,0,0,0,0,6,21,25,2,1,0,2,3,0,0,0,1,Banglore_Delhi,1265,1,9,0,1,585.8235721212576,0.10241991421195461,1,0
Jet Airways,9/05/2019,Delhi,Cochin,DEL → JAI → BOM → COK,19:30,12:35 10 May,17h 5m,2 stops,In-flight meal not included,13029,2019-05-09,19:30:00,12:35:00,0,1025,0,0,0,3849,0,0,DEL,COK,2047.882109458646,0,0,0,0,0,0,0,0,0,0,5,9,19,2,1,1,3,2,0,1,2,0,Delhi_Cochin,4537,0,22,1,0,119.87602591953049,0.5005170928862487,1,0
Jet Airways,9/05/2019,Delhi,Cochin,DEL → AMD → BOM → COK,23:05,04:25 11 May,29h 20m,2 stops,No info,15129,2019-05-09,23:05:00,04:25:00,0,1760,0,0,1,3849,0,0,DEL,COK,2047.882109458646,0,0,0,0,0,0,0,0,0,0,5,9,19,2,1,1,3,0,0,1,2,0,Delhi_Cochin,4537,0,22,1,0,69.81416282245384,0.8594244716876075,1,0
Jet Airways,9/06/2019,Delhi,Cochin,DEL → JAI → BOM → COK,19:30,04:25 10 Jun,8h 55m,2 stops,In-flight meal not included,10368,2019-06-09,19:30:00,04:25:00,0,535,1,0,1,3849,0,0,DEL,COK,2047.882109458646,0,1,0,0,0,0,0,0,0,1,6,9,23,2,1,0,3,0,0,1,2,0,Delhi_Cochin,4537,0,21,1,0,229.66902162153042,0.26124550701867616,1,0
Air India,3/03/2019,Delhi,Cochin,DEL → COK,18:05,21:10,3h 5m,non-stop,No info,8666,2019-03-03,18:05:00,21:10:00,0,185,1,1,0,1752,0,0,DEL,COK,2047.882109458646,0,0,0,0,0,0,0,0,0,0,3,3,9,1,1,1,3,3,0,1,0,1,Delhi_Cochin,4537,0,28,1,0,664.1779814460473,0.09033723139898146,1,0
Jet Airways,18/05/2019,Delhi,Cochin,DEL → BOM → COK,10:00,19:00,9h,1 stop,No info,15554,2019-05-18,10:00:00,19:00:00,0,540,1,1,0,3849,0,0,DEL,COK,2047.882109458646,0,0,0,0,0,0,0,0,0,0,5,18,20,2,1,1,1,3,1,0,1,0,Delhi_Cochin,4537,0,13,0,0,227.54245660651623,0.2636870538132432,1,0
Jet Airways,01/03/2019,Banglore,New Delhi,BLR → BOM → DEL,05:45,16:10,10h 25m,1 stop,No info,26890,2019-03-01,05:45:00,16:10:00,0,625,0,1,0,3849,0,0,BLR,DEL,1708.6520853536679,0,0,0,0,0,0,0,0,0,0,3,1,9,1,1,1,0,2,0,0,1,0,Banglore_New Delhi,932,0,30,1,0,164.03060019395213,0.3657854078998379,1,0
Jet Airways,21/05/2019,Kolkata,Banglore,CCU → DEL → BLR,17:00,09:45 22 May,16h 45m,1 stop,No info,13067,2019-05-21,17:00:00,09:45:00,0,1005,0,0,0,3849,0,0,CCU,BLR,1546.4372901474003,0,0,0,0,0,0,0,0,0,0,5,21,21,2,1,1,2,1,0,0,1,0,Kolkata_Banglore,2871,1,10,0,1,92.32461433715822,0.6498808625496915,1,0
Jet Airways,1/04/2019,Banglore,Delhi,BLR → DEL,06:00,08:45,2h 45m,non-stop,In-flight meal not included,4544,2019-04-01,06:00:00,08:45:00,0,165,0,1,0,3849,0,0,BLR,DEL,1708.6520853536679,0,0,0,0,0,0,0,0,0,0,4,1,14,2,1,1,1,1,1,0,0,1,Banglore_Delhi,1265,1,29,1,0,621.3280310376974,0.09656734768555719,1,0
Vistara,21/05/2019,Kolkata,Banglore,CCU → DEL → BLR,20:20,22:40 22 May,26h 20m,1 stop,No info,8452,2019-05-21,20:20:00,22:40:00,0,1580,0,0,0,479,0,0,CCU,BLR,1546.4372901474003,0,0,0,0,0,0,0,0,0,0,5,21,21,2,1,1,3,3,0,1,1,0,Kolkata_Banglore,2871,1,10,0,1,58.72546671445824,1.021703246595535,1,0
Multiple carriers,27/06/2019,Delhi,Cochin,DEL → BOM → COK,06:00,19:15,13h 15m,1 stop,In-flight meal not included,7268,2019-06-27,06:00:00,19:15:00,0,795,0,1,0,1196,0,0,DEL,COK,2047.882109458646,0,0,0,0,0,0,0,0,0,0,6,27,26,2,1,0,1,3,1,0,1,0,Delhi_Cochin,4537,0,3,0,1,154.5571403365016,0.3882059403361636,1,0
Multiple carriers,9/05/2019,Delhi,Cochin,DEL → BOM → COK,08:30,19:00,10h 30m,1 stop,No info,9627,2019-05-09,08:30:00,19:00:00,0,630,0,1,0,1196,0,0,DEL,COK,2047.882109458646,0,0,0,0,0,0,0,0,0,0,5,9,19,2,1,1,1,3,1,0,1,0,Delhi_Cochin,4537,0,22,1,0,195.0363913770139,0.3076348961154504,1,0
Multiple carriers,9/05/2019,Delhi,Cochin,DEL → BOM → COK,11:25,19:00,7h 35m,1 stop,No info,9103,2019-05-09,11:25:00,19:00:00,0,455,0,1,0,1196,0,0,DEL,COK,2047.882109458646,0,0,0,0,0,0,0,0,0,0,5,9,19,2,1,1,1,3,1,0,1,0,Delhi_Cochin,4537,0,22,1,0,270.05038806048077,0.22218075830560308,1,0
Multiple carriers,9/04/2019,Delhi,Cochin,DEL → BOM → COK,08:00,19:00,11h,1 stop,No info,11142,2019-04-09,08:00:00,19:00:00,0,660,0,1,0,1196,0,0,DEL,COK,2047.882109458646,0,0,0,0,0,0,0,0,0,0,4,9,15,2,1,1,1,3,1,0,1,0,Delhi_Cochin,4537,0,21,1,0,186.1711008598769,0.3222841768828528,1,0
IndiGo,9/03/2019,Kolkata,Banglore,CCU → BLR,05:30,08:20,2h 50m,non-stop,No info,4148,2019-03-09,05:30:00,08:20:00,0,170,1,1,0,2053,0,0,CCU,BLR,1546.4372901474003,0,0,0,0,0,0,0,0,0,0,3,9,10,1,1,1,0,1,0,0,0,1,Kolkata_Banglore,2871,1,22,1,0,545.8013965226119,0.10993009615268413,1,0
Jet Airways,18/05/2019,Kolkata,Banglore,CCU → BOM → BLR,16:30,18:15 19 May,25h 45m,1 stop,In-flight meal not included,10844,2019-05-18,16:30:00,18:15:00,0,1545,1,0,0,3849,0,0,CCU,BLR,1546.4372901474003,0,0,0,0,0,0,0,0,0,0,5,18,20,2,1,1,2,3,0,0,1,0,Kolkata_Banglore,2871,1,13,0,0,60.055817093102924,0.9990705797405705,1,0
Multiple carriers,6/06/2019,Delhi,Cochin,DEL → HYD → COK,09:45,16:10,6h 25m,1 stop,No info,9646,2019-06-06,09:45:00,16:10:00,0,385,0,1,0,1196,0,0,DEL,COK,2047.882109458646,0,1,0,0,0,0,0,0,0,1,6,6,23,2,1,0,1,2,1,0,1,0,Delhi_Cochin,4537,0,24,1,0,319.15045861693187,0.18799910318166413,1,0
IndiGo,1/03/2019,Mumbai,Hyderabad,BOM → HYD,12:00,13:25,1h 25m,non-stop,No info,12475,2019-03-01,12:00:00,13:25:00,0,85,0,1,0,2053,0,0,BOM,HYD,622.9702752863186,0,0,0,0,0,0,0,0,0,0,3,1,9,1,1,1,2,2,0,0,0,1,Mumbai_Hyderabad,697,1,30,1,0,439.743723731519,0.13644310711443464,0,0
Jet Airways,18/05/2019,Delhi,Cochin,DEL → BOM → COK,22:50,19:00 19 May,20h 10m,1 stop,No info,15554,2019-05-18,22:50:00,19:00:00,0,1210,1,0,1,3849,0,0,DEL,COK,2047.882109458646,0,0,0,0,0,0,0,0,0,0,5,18,20,2,1,1,3,3,0,1,1,0,Delhi_Cochin,4537,0,13,0,0,101.54787319629649,0.5908543242852301,1,0
Jet Airways,27/06/2019,Delhi,Cochin,DEL → BOM → COK,07:05,19:00,11h 55m,1 stop,In-flight meal not included,10262,2019-06-27,07:05:00,19:00:00,0,715,0,1,0,3849,0,0,DEL,COK,2047.882109458646,0,0,0,0,0,0,0,0,0,0,6,27,26,2,1,0,1,3,1,0,1,0,Delhi_Cochin,4537,0,3,0,1,171.85024694757868,0.34914119162309054,1,0
Air India,12/06/2019,Banglore,Delhi,BLR → DEL,13:20,16:10,2h 50m,non-stop,No info,6961,2019-06-12,13:20:00,16:10:00,0,170,0,1,0,1752,0,0,BLR,DEL,1708.6520853536679,0,0,0,0,0,0,0,0,0,0,6,12,24,2,1,0,2,2,0,0,0,1,Banglore_Delhi,1265,1,18,0,0,603.0536771836476,0.0994936309487559,1,0
Jet Airways,15/06/2019,Delhi,Cochin,DEL → BOM → COK,14:00,19:00,5h,1 stop,In-flight meal not included,10262,2019-06-15,14:00:00,19:00:00,0,300,1,1,0,3849,0,0,DEL,COK,2047.882109458646,0,0,0,0,0,0,0,0,0,0,6,15,24,2,1,0,2,3,0,0,1,0,Delhi_Cochin,4537,0,15,0,0,409.5764218917292,0.146492807674024,1,0
Jet Airways,27/06/2019,Delhi,Cochin,DEL → BOM → COK,16:00,19:00 28 Jun,27h,1 stop,In-flight meal not included,10262,2019-06-27,16:00:00,19:00:00,0,1620,0,0,0,3849,0,0,DEL,COK,2047.882109458646,0,0,0,0,0,0,0,0,0,0,6,27,26,2,1,0,2,3,0,0,1,0,Delhi_Cochin,4537,0,3,0,1,75.84748553550541,0.7910611614397296,1,0
IndiGo,9/05/2019,Banglore,Delhi,BLR → DEL,23:30,02:20 10 May,2h 50m,non-stop,No info,3943,2019-05-09,23:30:00,02:20:00,0,170,0,0,1,2053,0,0,BLR,DEL,1708.6520853536679,0,0,0,0,0,0,0,0,0,0,5,9,19,2,1,1,3,0,0,1,0,1,Banglore_Delhi,1265,1,22,1,0,603.0536771836476,0.0994936309487559,1,0
Air India,24/05/2019,Mumbai,Hyderabad,BOM → HYD,19:30,20:45,1h 15m,non-stop,No info,3625,2019-05-24,19:30:00,20:45:00,0,75,0,1,0,1752,0,0,BOM,HYD,622.9702752863186,0,0,0,0,0,0,0,0,0,0,5,24,21,2,1,1,3,3,0,1,0,1,Mumbai_Hyderabad,697,1,7,0,1,498.37622022905487,0.12039097686567761,0,0
Multiple carriers,21/03/2019,Delhi,Cochin,DEL → BOM → COK,09:00,19:15,10h 15m,1 stop,No info,13378,2019-03-21,09:00:00,19:15:00,0,615,0,1,0,1196,0,0,DEL,COK,2047.882109458646,0,0,0,0,1,0,0,0,0,1,3,21,12,1,1,1,1,3,1,0,1,0,Delhi_Cochin,4537,0,10,0,1,199.79337653255084,0.3003102557317492,1,0
Jet Airways,15/06/2019,Delhi,Cochin,DEL → LKO → BOM → COK,11:45,12:35 16 Jun,24h 50m,2 stops,No info,13882,2019-06-15,11:45:00,12:35:00,0,1490,1,0,0,3849,0,0,DEL,COK,2047.882109458646,0,0,0,0,0,0,0,0,0,0,6,15,24,2,1,0,1,2,1,0,2,0,Delhi_Cochin,4537,0,15,0,0,82.46505138759647,0.7275809447809859,1,0
IndiGo,18/06/2019,Banglore,Delhi,BLR → DEL,05:30,08:20,2h 50m,non-stop,No info,3943,2019-06-18,05:30:00,08:20:00,0,170,0,1,0,2053,0,0,BLR,DEL,1708.6520853536679,0,0,0,0,0,0,0,0,0,0,6,18,25,2,1,0,0,1,0,0,0,1,Banglore_Delhi,1265,1,12,0,0,603.0536771836476,0.0994936309487559,1,0
Air India,15/05/2019,Kolkata,Banglore,CCU → BOM → AMD → BLR,09:25,05:25 16 May,20h,2 stops,No info,14687,2019-05-15,09:25:00,05:25:00,0,1200,0,0,1,1752,0,0,CCU,BLR,1546.4372901474003,0,0,0,0,0,0,0,0,0,0,5,15,20,2,1,1,1,0,1,0,2,0,Kolkata_Banglore,2871,1,16,0,0,77.32186450737001,0.7759771493130645,1,0
Air Asia,27/05/2019,Delhi,Cochin,DEL → BLR → COK,07:55,13:25,5h 30m,1 stop,No info,6451,2019-05-27,07:55:00,13:25:00,0,330,0,1,0,319,0,0,DEL,COK,2047.882109458646,0,0,0,0,0,0,0,0,0,0,5,27,22,2,1,1,1,2,1,0,1,0,Delhi_Cochin,4537,0,4,0,1,372.3422017197538,0.1611420884414264,1,0
Vistara,9/06/2019,Banglore,Delhi,BLR → DEL,19:30,22:15,2h 45m,non-stop,No info,4878,2019-06-09,19:30:00,22:15:00,0,165,1,1,0,479,0,0,BLR,DEL,1708.6520853536679,0,1,0,0,0,0,0,0,0,1,6,9,23,2,1,0,3,3,0,1,0,1,Banglore_Delhi,1265,1,21,1,0,621.3280310376974,0.09656734768555719,1,0
IndiGo,9/05/2019,Delhi,Cochin,DEL → BOM → COK,18:35,01:30 10 May,6h 55m,1 stop,No info,8542,2019-05-09,18:35:00,01:30:00,0,415,0,0,1,2053,0,0,DEL,COK,2047.882109458646,0,0,0,0,0,0,0,0,0,0,5,9,19,2,1,1,3,0,0,1,1,0,Delhi_Cochin,4537,0,22,1,0,296.07934112655124,0.20264838394906654,1,0
IndiGo,24/05/2019,Kolkata,Banglore,CCU → BLR,09:35,12:20,2h 45m,non-stop,No info,4804,2019-05-24,09:35:00,12:20:00,0,165,0,1,0,2053,0,0,CCU,BLR,1546.4372901474003,0,0,0,0,0,0,0,0,0,0,5,24,21,2,1,1,1,2,1,0,0,1,Kolkata_Banglore,2871,1,7,0,1,562.3408327808729,0.10669685803054636,1,0
IndiGo,6/06/2019,Kolkata,Banglore,CCU → PNQ → BLR,21:00,02:15 07 Jun,5h 15m,1 stop,No info,6711,2019-06-06,21:00:00,02:15:00,0,315,0,0,1,2053,0,0,CCU,BLR,1546.4372901474003,0,1,0,0,0,0,0,0,0,1,6,6,23,2,1,0,3,0,0,1,1,0,Kolkata_Banglore,2871,1,24,1,0,294.55948383760006,0.2036940016946794,1,0
Multiple carriers,15/06/2019,Delhi,Cochin,DEL → BOM → COK,13:00,19:15,6h 15m,1 stop,No info,16108,2019-06-15,13:00:00,19:15:00,0,375,1,1,0,1196,0,0,DEL,COK,2047.882109458646,0,0,0,0,0,0,0,0,0,0,6,15,24,2,1,0,2,3,0,0,1,0,Delhi_Cochin,4537,0,15,0,0,327.6611375133833,0.18311600959253,1,0
IndiGo,6/06/2019,Banglore,Delhi,BLR → DEL,00:25,03:15,2h 50m,non-stop,No info,3943,2019-06-06,00:25:00,03:15:00,0,170,0,1,1,2053,0,0,BLR,DEL,1708.6520853536679,0,1,0,0,0,0,0,0,0,1,6,6,23,2,1,0,0,0,0,0,0,1,Banglore_Delhi,1265,1,24,1,0,603.0536771836476,0.0994936309487559,1,0
Air India,24/05/2019,Kolkata,Banglore,CCU → DEL → AMD → BLR,10:00,05:25 25 May,19h 25m,2 stops,No info,15422,2019-05-24,10:00:00,05:25:00,0,1165,0,0,1,1752,0,0,CCU,BLR,1546.4372901474003,0,0,0,0,0,0,0,0,0,0,5,24,21,2,1,1,1,0,1,0,2,0,Kolkata_Banglore,2871,1,7,0,1,79.6448389775485,0.7533444824581,1,0
IndiGo,24/03/2019,Banglore,New Delhi,BLR → DEL,21:20,00:15 28 Mar,2h 55m,non-stop,No info,5694,2019-03-24,21:20:00,00:15:00,0,175,1,0,1,2053,0,0,BLR,DEL,1708.6520853536679,0,0,0,0,1,0,0,0,0,1,3,24,12,1,1,1,3,0,0,1,0,1,Banglore_New Delhi,932,0,7,0,1,585.8235721212576,0.10241991421195461,1,0
Jet Airways,1/04/2019,Kolkata,Banglore,CCU → BOM → BLR,08:25,19:50,11h 25m,1 stop,No info,12681,2019-04-01,08:25:00,19:50:00,0,685,0,1,0,3849,0,0,CCU,BLR,1546.4372901474003,0,0,0,0,0,0,0,0,0,0,4,1,14,2,1,1,1,3,1,0,1,0,Kolkata_Banglore,2871,1,29,1,0,135.4543611807942,0.4429536227328743,1,0
Jet Airways,1/05/2019,Kolkata,Banglore,CCU → BOM → BLR,20:00,10:05 02 May,14h 5m,1 stop,In-flight meal not included,8586,2019-05-01,20:00:00,10:05:00,0,845,0,0,0,3849,0,0,CCU,BLR,1546.4372901474003,0,0,0,0,0,0,0,0,0,0,5,1,18,2,1,1,3,1,0,1,1,0,Kolkata_Banglore,2871,1,30,1,0,109.80619811697517,0.5464172426412829,1,0
IndiGo,03/03/2019,Banglore,New Delhi,BLR → DEL,00:40,03:25,2h 45m,non-stop,No info,6144,2019-03-03,00:40:00,03:25:00,0,165,1,1,1,2053,0,0,BLR,DEL,1708.6520853536679,0,0,0,0,0,0,0,0,0,0,3,3,9,1,1,1,0,0,0,0,0,1,Banglore_New Delhi,932,0,28,1,0,621.3280310376974,0.09656734768555719,1,0
IndiGo,27/04/2019,Delhi,Cochin,DEL → COK,05:35,08:50,3h 15m,non-stop,No info,6015,2019-04-27,05:35:00,08:50:00,0,195,1,1,0,2053,0,0,DEL,COK,2047.882109458646,0,0,0,0,0,0,0,0,0,0,4,27,17,2,1,1,0,1,0,0,0,1,Delhi_Cochin,4537,0,3,0,1,630.1175721411219,0.0952203249881156,1,0
Multiple carriers,27/06/2019,Delhi,Cochin,DEL → BOM → COK,04:55,19:15,14h 20m,1 stop,No info,7155,2019-06-27,04:55:00,19:15:00,0,860,0,1,0,1196,0,0,DEL,COK,2047.882109458646,0,0,0,0,0,0,0,0,0,0,6,27,26,2,1,0,0,3,0,0,1,0,Delhi_Cochin,4537,0,3,0,1,142.87549600874274,0.4199460486655355,1,0
Jet Airways,12/06/2019,Kolkata,Banglore,CCU → DEL → BLR,09:35,22:05,12h 30m,1 stop,No info,12692,2019-06-12,09:35:00,22:05:00,0,750,0,1,0,3849,0,0,CCU,BLR,1546.4372901474003,0,0,0,0,0,0,0,0,0,0,6,12,24,2,1,0,1,3,1,0,1,0,Kolkata_Banglore,2871,1,18,0,0,123.71498321179202,0.4849857183206653,1,0
Air India,18/05/2019,Delhi,Cochin,DEL → BLR → COK,17:40,23:00,5h 20m,1 stop,No info,8277,2019-05-18,17:40:00,23:00:00,0,320,1,1,0,1752,0,0,DEL,COK,2047.882109458646,0,0,0,0,0,0,0,0,0,0,5,18,20,2,1,1,2,3,0,0,1,0,Delhi_Cochin,4537,0,13,0,0,383.9778955234961,0.15625899485229228,1,0
Air India,9/05/2019,Delhi,Cochin,DEL → HYD → MAA → COK,07:05,09:25 10 May,26h 20m,2 stops,No info,9347,2019-05-09,07:05:00,09:25:00,0,1580,0,0,0,1752,0,0,DEL,COK,2047.882109458646,0,0,0,0,0,0,0,0,0,0,5,9,19,2,1,1,1,1,1,0,2,0,Delhi_Cochin,4537,0,22,1,0,77.7676750427334,0.7715287870831931,1,0
Air India,15/03/2019,Delhi,Cochin,DEL → COK,18:05,21:10,3h 5m,non-stop,No info,4939,2019-03-15,18:05:00,21:10:00,0,185,0,1,0,1752,0,0,DEL,COK,2047.882109458646,0,0,0,0,1,0,0,0,0,1,3,15,11,1,1,1,3,3,0,1,0,1,Delhi_Cochin,4537,0,16,0,0,664.1779814460473,0.09033723139898146,1,0
Jet Airways,12/03/2019,Mumbai,Hyderabad,BOM → HYD,19:40,21:10,1h 30m,non-stop,No info,5678,2019-03-12,19:40:00,21:10:00,0,90,0,1,0,3849,0,0,BOM,HYD,622.9702752863186,0,0,0,0,0,0,0,0,0,0,3,12,11,1,1,1,3,3,0,1,0,1,Mumbai_Hyderabad,697,1,19,0,0,415.3135168575457,0.14446917223881314,0,0
Jet Airways,6/06/2019,Kolkata,Banglore,CCU → BOM → BLR,16:30,23:35,7h 5m,1 stop,In-flight meal not included,10844,2019-06-06,16:30:00,23:35:00,0,425,0,1,0,3849,0,0,CCU,BLR,1546.4372901474003,0,1,0,0,0,0,0,0,0,1,6,6,23,2,1,0,2,3,0,0,1,0,Kolkata_Banglore,2871,1,24,1,0,218.32055860904475,0.2748252403817103,1,0
Jet Airways,21/03/2019,Banglore,New Delhi,BLR → MAA → DEL,09:45,15:55,6h 10m,1 stop,In-flight meal not included,7280,2019-03-21,09:45:00,15:55:00,0,370,0,1,0,3849,0,0,BLR,DEL,1708.6520853536679,0,0,0,0,1,0,0,0,0,1,3,21,12,1,1,1,1,2,1,0,1,0,Banglore_New Delhi,932,0,10,0,1,277.078716543838,0.21654496147670402,1,0
Multiple carriers,21/03/2019,Delhi,Cochin,DEL → BOM → COK,13:00,21:00,8h,1 stop,No info,7618,2019-03-21,13:00:00,21:00:00,0,480,0,1,0,1196,0,0,DEL,COK,2047.882109458646,0,0,0,0,1,0,0,0,0,1,3,21,12,1,1,1,2,3,0,0,1,0,Delhi_Cochin,4537,0,10,0,1,255.98526368233078,0.23438849227843842,1,0
Multiple carriers,6/03/2019,Delhi,Cochin,DEL → BOM → COK,08:55,21:00,12h 5m,1 stop,No info,15147,2019-03-06,08:55:00,21:00:00,0,725,0,1,0,1196,0,0,DEL,COK,2047.882109458646,0,0,0,0,0,0,0,0,0,0,3,6,10,1,1,1,1,3,1,0,1,0,Delhi_Cochin,4537,0,25,1,0,169.47989871381898,0.3540242852122247,1,0
Jet Airways,18/05/2019,Kolkata,Banglore,CCU → BOM → BLR,21:10,10:05 19 May,12h 55m,1 stop,No info,13941,2019-05-18,21:10:00,10:05:00,0,775,1,0,1,3849,0,0,CCU,BLR,1546.4372901474003,0,0,0,0,0,0,0,0,0,0,5,18,20,2,1,1,3,1,0,1,1,0,Kolkata_Banglore,2871,1,13,0,0,119.72417730173422,0.5011519089313541,1,0
Jet Airways,1/04/2019,Kolkata,Banglore,CCU → DEL → BLR,09:35,19:10,9h 35m,1 stop,No info,11467,2019-04-01,09:35:00,19:10:00,0,575,0,1,0,3849,0,0,CCU,BLR,1546.4372901474003,0,0,0,0,0,0,0,0,0,0,4,1,14,2,1,1,1,3,1,0,1,0,Kolkata_Banglore,2871,1,29,1,0,161.36736940668524,0.3718223840458434,1,0
Multiple carriers,27/06/2019,Delhi,Cochin,DEL → BOM → COK,10:20,01:30 28 Jun,15h 10m,1 stop,No info,6270,2019-06-27,10:20:00,01:30:00,0,910,0,0,1,1196,0,0,DEL,COK,2047.882109458646,0,0,0,0,0,0,0,0,0,0,6,27,26,2,1,0,1,0,1,0,1,0,Delhi_Cochin,4537,0,3,0,1,135.02519403024039,0.44436151661120615,1,0
Multiple carriers,3/03/2019,Delhi,Cochin,DEL → BOM → COK,13:55,01:35 04 Mar,11h 40m,1 stop,No info,17057,2019-03-03,13:55:00,01:35:00,0,700,1,0,1,1196,0,0,DEL,COK,2047.882109458646,0,0,0,0,0,0,0,0,0,0,3,3,9,1,1,1,2,0,0,0,1,0,Delhi_Cochin,4537,0,28,1,0,175.53275223931252,0.3418165512393893,1,0
Jet Airways,3/06/2019,Banglore,Delhi,BLR → DEL,15:15,18:10,2h 55m,non-stop,No info,8016,2019-06-03,15:15:00,18:10:00,0,175,0,1,0,3849,0,0,BLR,DEL,1708.6520853536679,0,1,0,0,0,0,0,0,0,1,6,3,23,2,1,0,2,3,0,0,0,1,Banglore_Delhi,1265,1,27,1,0,585.8235721212576,0.10241991421195461,1,0
SpiceJet,27/06/2019,Delhi,Cochin,DEL → PNQ → COK,08:45,13:15,4h 30m,1 stop,No check-in baggage included,4760,2019-06-27,08:45:00,13:15:00,0,270,0,1,0,818,0,0,DEL,COK,2047.882109458646,0,0,0,0,0,0,0,0,0,0,6,27,26,2,1,0,1,2,1,0,1,0,Delhi_Cochin,4537,0,3,0,1,455.08491321303245,0.1318435269066216,1,0
SpiceJet,21/03/2019,Kolkata,Banglore,CCU → BLR,06:55,09:35,2h 40m,non-stop,No check-in baggage included,3815,2019-03-21,06:55:00,09:35:00,0,160,0,1,0,818,0,0,CCU,BLR,1546.4372901474003,0,0,0,0,1,0,0,0,0,1,3,21,12,1,1,1,1,1,1,0,0,1,Kolkata_Banglore,2871,1,10,0,1,579.913983805275,0.10346361990840859,1,0
SpiceJet,1/05/2019,Kolkata,Banglore,CCU → BLR,17:10,19:40,2h 30m,non-stop,No info,4174,2019-05-01,17:10:00,19:40:00,0,150,0,1,0,818,0,0,CCU,BLR,1546.4372901474003,0,0,0,0,0,0,0,0,0,0,5,1,18,2,1,1,2,3,0,0,0,1,Kolkata_Banglore,2871,1,30,1,0,618.5749160589601,0.09699714366413306,1,0
Jet Airways,6/06/2019,Kolkata,Banglore,CCU → DEL → BLR,09:35,09:45 07 Jun,24h 10m,1 stop,No info,12692,2019-06-06,09:35:00,09:45:00,0,1450,0,0,0,3849,0,0,CCU,BLR,1546.4372901474003,0,1,0,0,0,0,0,0,0,1,6,6,23,2,1,0,1,1,1,0,1,0,Kolkata_Banglore,2871,1,24,1,0,63.99050855782347,0.9376390554199528,1,0
Air India,15/05/2019,Kolkata,Banglore,CCU → BOM → COK → BLR,09:25,13:45 16 May,28h 20m,2 stops,No info,15532,2019-05-15,09:25:00,13:45:00,0,1700,0,0,0,1752,0,0,CCU,BLR,1546.4372901474003,0,0,0,0,0,0,0,0,0,0,5,15,20,2,1,1,1,2,1,0,2,0,Kolkata_Banglore,2871,1,16,0,0,54.58013965226119,1.0993009615268412,1,0
Jet Airways,6/06/2019,Mumbai,Hyderabad,BOM → HYD,07:05,08:30,1h 25m,non-stop,In-flight meal not included,4995,2019-06-06,07:05:00,08:30:00,0,85,0,1,0,3849,0,0,BOM,HYD,622.9702752863186,0,1,0,0,0,0,0,0,0,1,6,6,23,2,1,0,1,1,1,0,0,1,Mumbai_Hyderabad,697,1,24,1,0,439.743723731519,0.13644310711443464,0,0
Jet Airways,27/05/2019,Delhi,Cochin,DEL → BOM → COK,18:15,04:25 28 May,10h 10m,1 stop,In-flight meal not included,12898,2019-05-27,18:15:00,04:25:00,0,610,0,0,1,3849,0,0,DEL,COK,2047.882109458646,0,0,0,0,0,0,0,0,0,0,5,27,22,2,1,1,3,0,0,1,1,0,Delhi_Cochin,4537,0,4,0,1,201.4310271598668,0.29786870893718215,1,0
Multiple carriers,9/05/2019,Delhi,Cochin,DEL → BOM → COK,07:30,19:00,11h 30m,1 stop,No info,9794,2019-05-09,07:30:00,19:00:00,0,690,0,1,0,1196,0,0,DEL,COK,2047.882109458646,0,0,0,0,0,0,0,0,0,0,5,9,19,2,1,1,1,3,1,0,1,0,Delhi_Cochin,4537,0,22,1,0,178.07670517031704,0.3369334576502552,1,0
Air India,15/05/2019,Banglore,Delhi,BLR → DEL,13:20,16:10,2h 50m,non-stop,No info,5228,2019-05-15,13:20:00,16:10:00,0,170,0,1,0,1752,0,0,BLR,DEL,1708.6520853536679,0,0,0,0,0,0,0,0,0,0,5,15,20,2,1,1,2,2,0,0,0,1,Banglore_Delhi,1265,1,16,0,0,603.0536771836476,0.0994936309487559,1,0
Jet Airways,27/06/2019,Delhi,Cochin,DEL → BOM → COK,22:50,12:35 28 Jun,13h 45m,1 stop,In-flight meal not included,10262,2019-06-27,22:50:00,12:35:00,0,825,0,0,1,3849,0,0,DEL,COK,2047.882109458646,0,0,0,0,0,0,0,0,0,0,6,27,26,2,1,0,3,2,0,1,1,0,Delhi_Cochin,4537,0,3,0,1,148.93688068790152,0.40285522110356603,1,0
Multiple carriers,24/06/2019,Delhi,Cochin,DEL → HYD → COK,09:45,16:10,6h 25m,1 stop,No info,9646,2019-06-24,09:45:00,16:10:00,0,385,0,1,0,1196,0,0,DEL,COK,2047.882109458646,0,0,0,0,0,0,0,0,0,0,6,24,26,2,1,0,1,2,1,0,1,0,Delhi_Cochin,4537,0,6,0,1,319.15045861693187,0.18799910318166413,1,0
Jet Airways,15/05/2019,Kolkata,Banglore,CCU → BOM → BLR,21:10,10:05 16 May,12h 55m,1 stop,No info,15149,2019-05-15,21:10:00,10:05:00,0,775,0,0,1,3849,0,0,CCU,BLR,1546.4372901474003,0,0,0,0,0,0,0,0,0,0,5,15,20,2,1,1,3,1,0,1,1,0,Kolkata_Banglore,2871,1,16,0,0,119.72417730173422,0.5011519089313541,1,0
IndiGo,9/06/2019,Kolkata,Banglore,CCU → HYD → BLR,19:20,23:45,4h 25m,1 stop,No info,4205,2019-06-09,19:20:00,23:45:00,0,265,1,1,0,2053,0,0,CCU,BLR,1546.4372901474003,0,1,0,0,0,0,0,0,0,1,6,9,23,2,1,0,3,3,0,1,1,0,Kolkata_Banglore,2871,1,21,1,0,350.13674493903403,0.17136162047330172,1,0
Multiple carriers,6/03/2019,Delhi,Cochin,DEL → BOM → COK,07:30,21:00,13h 30m,1 stop,No info,15147,2019-03-06,07:30:00,21:00:00,0,810,0,1,0,1196,0,0,DEL,COK,2047.882109458646,0,0,0,0,0,0,0,0,0,0,3,6,10,1,1,1,1,3,1,0,1,0,Delhi_Cochin,4537,0,25,1,0,151.69497107101083,0.3955305807198648,1,0
Jet Airways,06/03/2019,Banglore,New Delhi,BLR → BOM → DEL,08:55,09:00 07 Mar,24h 5m,1 stop,In-flight meal not included,13712,2019-03-06,08:55:00,09:00:00,0,1445,0,0,0,3849,0,0,BLR,DEL,1708.6520853536679,0,0,0,0,0,0,0,0,0,0,3,6,10,1,1,1,1,1,1,0,1,0,Banglore_New Delhi,932,0,25,1,0,70.94749143337029,0.8456958630644251,1,0
Air India,9/03/2019,Delhi,Cochin,DEL → MAA → COK,17:20,09:25 10 Mar,16h 5m,1 stop,No info,12415,2019-03-09,17:20:00,09:25:00,0,965,1,0,0,1752,0,0,DEL,COK,2047.882109458646,0,0,0,0,0,0,0,0,0,0,3,9,10,1,1,1,2,1,0,0,1,0,Delhi_Cochin,4537,0,22,1,0,127.329457582921,0.47121853135144387,1,0
Air Asia,15/05/2019,Kolkata,Banglore,CCU → IXR → DEL → BLR,15:10,23:30,8h 20m,2 stops,No info,5192,2019-05-15,15:10:00,23:30:00,0,500,0,1,0,319,0,0,CCU,BLR,1546.4372901474003,0,0,0,0,0,0,0,0,0,0,5,15,20,2,1,1,2,3,0,0,2,0,Kolkata_Banglore,2871,1,16,0,0,185.57247481768803,0.3233238122137769,1,0
Air Asia,15/05/2019,Kolkata,Banglore,CCU → BBI → BLR,06:50,10:30,3h 40m,1 stop,No info,5162,2019-05-15,06:50:00,10:30:00,0,220,0,1,0,319,0,0,CCU,BLR,1546.4372901474003,0,0,0,0,0,0,0,0,0,0,5,15,20,2,1,1,1,1,1,0,1,0,Kolkata_Banglore,2871,1,16,0,0,421.75562458565463,0.1422624773740618,1,0
IndiGo,3/03/2019,Delhi,Cochin,DEL → HYD → COK,06:40,16:10,9h 30m,1 stop,No info,9027,2019-03-03,06:40:00,16:10:00,0,570,1,1,0,2053,0,0,DEL,COK,2047.882109458646,0,0,0,0,0,0,0,0,0,0,3,3,9,1,1,1,1,2,1,0,1,0,Delhi_Cochin,4537,0,28,1,0,215.5665378377522,0.2783363345806456,1,0
Jet Airways,24/03/2019,Kolkata,Banglore,CCU → BOM → BLR,13:55,18:10 25 Mar,28h 15m,1 stop,In-flight meal not included,11134,2019-03-24,13:55:00,18:10:00,0,1695,1,0,0,3849,0,0,CCU,BLR,1546.4372901474003,0,0,0,0,1,0,0,0,0,1,3,24,12,1,1,1,2,3,0,0,1,0,Kolkata_Banglore,2871,1,7,0,1,54.74114301406727,1.0960677234047036,1,0
Jet Airways,24/05/2019,Kolkata,Banglore,CCU → BOM → BLR,20:00,09:20 25 May,13h 20m,1 stop,In-flight meal not included,10844,2019-05-24,20:00:00,09:20:00,0,800,0,0,0,3849,0,0,CCU,BLR,1546.4372901474003,0,0,0,0,0,0,0,0,0,0,5,24,21,2,1,1,3,1,0,1,1,0,Kolkata_Banglore,2871,1,7,0,1,115.98279676105501,0.517318099542043,1,0
Vistara,24/03/2019,Kolkata,Banglore,CCU → DEL → BLR,17:00,10:50 25 Mar,17h 50m,1 stop,No info,12890,2019-03-24,17:00:00,10:50:00,0,1070,1,0,0,479,0,0,CCU,BLR,1546.4372901474003,0,0,0,0,1,0,0,0,0,1,3,24,12,1,1,1,2,1,0,0,1,0,Kolkata_Banglore,2871,1,7,0,1,86.7161097278916,0.6919129581374824,1,0
Jet Airways,9/06/2019,Kolkata,Banglore,CCU → BOM → BLR,20:00,16:20 10 Jun,20h 20m,1 stop,No info,14571,2019-06-09,20:00:00,16:20:00,0,1220,1,0,0,3849,0,0,CCU,BLR,1546.4372901474003,0,1,0,0,0,0,0,0,0,1,6,9,23,2,1,0,3,2,0,1,1,0,Kolkata_Banglore,2871,1,21,1,0,76.05429295806886,0.7889101018016155,1,0
Jet Airways,12/05/2019,Kolkata,Banglore,CCU → DEL → BLR,17:00,21:05 13 May,28h 5m,1 stop,No info,12121,2019-05-12,17:00:00,21:05:00,0,1685,1,0,0,3849,0,0,CCU,BLR,1546.4372901474003,0,0,0,0,0,0,0,0,0,0,5,12,19,2,1,1,2,3,0,0,1,0,Kolkata_Banglore,2871,1,19,0,0,55.066016266376266,1.089601247160428,1,0
Jet Airways,9/05/2019,Delhi,Cochin,DEL → BOM → COK,13:00,04:25 10 May,15h 25m,1 stop,In-flight meal not included,12373,2019-05-09,13:00:00,04:25:00,0,925,0,0,1,3849,0,0,DEL,COK,2047.882109458646,0,0,0,0,0,0,0,0,0,0,5,9,19,2,1,1,2,0,0,0,1,0,Delhi_Cochin,4537,0,22,1,0,132.83559628920946,0.45168615699490733,1,0
Air India,09/03/2019,Banglore,New Delhi,BLR → MAA → DEL,11:50,23:55,12h 5m,1 stop,No info,10972,2019-03-09,11:50:00,23:55:00,0,725,1,1,0,1752,0,0,BLR,DEL,1708.6520853536679,0,0,0,0,0,0,0,0,0,0,3,9,10,1,1,1,1,3,1,0,1,0,Banglore_New Delhi,932,0,22,1,0,141.40568982237252,0.42431107316381195,1,0
Jet Airways,1/06/2019,Delhi,Cochin,DEL → BOM → COK,02:15,12:35,10h 20m,1 stop,In-flight meal not included,10262,2019-06-01,02:15:00,12:35:00,0,620,1,1,1,3849,0,0,DEL,COK,2047.882109458646,0,1,0,0,0,0,0,0,0,1,6,1,22,2,1,0,0,2,0,0,1,0,Delhi_Cochin,4537,0,29,1,0,198.18213962503026,0.3027518025263163,1,0
Jet Airways,27/05/2019,Delhi,Cochin,DEL → BOM → COK,16:00,04:25 28 May,12h 25m,1 stop,In-flight meal not included,12898,2019-05-27,16:00:00,04:25:00,0,745,0,0,1,3849,0,0,DEL,COK,2047.882109458646,0,0,0,0,0,0,0,0,0,0,5,27,22,2,1,1,2,0,0,0,1,0,Delhi_Cochin,4537,0,4,0,1,164.93010277519295,0.36379047239049295,1,0
IndiGo,18/05/2019,Delhi,Cochin,DEL → HYD → COK,08:35,16:10,7h 35m,1 stop,No info,6442,2019-05-18,08:35:00,16:10:00,0,455,1,1,0,2053,0,0,DEL,COK,2047.882109458646,0,0,0,0,0,0,0,0,0,0,5,18,20,2,1,1,1,2,1,0,1,0,Delhi_Cochin,4537,0,13,0,0,270.05038806048077,0.22218075830560308,1,0
Vistara,3/04/2019,Banglore,Delhi,BLR → DEL,09:45,12:35,2h 50m,non-stop,No info,5403,2019-04-03,09:45:00,12:35:00,0,170,0,1,0,479,0,0,BLR,DEL,1708.6520853536679,0,0,0,0,0,0,0,0,0,0,4,3,14,2,1,1,1,2,1,0,0,1,Banglore_Delhi,1265,1,27,1,0,603.0536771836476,0.0994936309487559,1,0
IndiGo,21/04/2019,Delhi,Cochin,DEL → HYD → COK,07:35,12:10,4h 35m,1 stop,No info,5703,2019-04-21,07:35:00,12:10:00,0,275,1,1,0,2053,0,0,DEL,COK,2047.882109458646,0,0,0,0,0,0,0,0,0,0,4,21,16,2,1,1,1,2,1,0,1,0,Delhi_Cochin,4537,0,9,0,1,446.8106420637046,0.13428507370118867,1,0
Multiple carriers,9/05/2019,Delhi,Cochin,DEL → BOM → COK,08:00,19:15,11h 15m,1 stop,In-flight meal not included,9871,2019-05-09,08:00:00,19:15:00,0,675,0,1,0,1196,0,0,DEL,COK,2047.882109458646,0,0,0,0,0,0,0,0,0,0,5,9,19,2,1,1,1,3,1,0,1,0,Delhi_Cochin,4537,0,22,1,0,182.033965285213,0.329608817266554,1,0
IndiGo,15/04/2019,Kolkata,Banglore,CCU → BLR,15:30,18:05,2h 35m,non-stop,No info,4174,2019-04-15,15:30:00,18:05:00,0,155,0,1,0,2053,0,0,CCU,BLR,1546.4372901474003,0,0,0,0,0,0,0,0,0,0,4,15,16,2,1,1,2,3,0,0,0,1,Kolkata_Banglore,2871,1,15,0,0,598.6208865086711,0.10023038178627082,1,0
Air India,21/05/2019,Delhi,Cochin,DEL → HYD → BOM → COK,17:15,19:15 22 May,26h,2 stops,No info,11972,2019-05-21,17:15:00,19:15:00,0,1560,0,0,0,1752,0,0,DEL,COK,2047.882109458646,0,0,0,0,0,0,0,0,0,0,5,21,21,2,1,1,2,3,0,0,2,0,Delhi_Cochin,4537,0,10,0,1,78.76469651764023,0.7617625999049248,1,0
SpiceJet,18/04/2019,Kolkata,Banglore,CCU → BLR,09:00,11:25,2h 25m,non-stop,No info,4174,2019-04-18,09:00:00,11:25:00,0,145,0,1,0,818,0,0,CCU,BLR,1546.4372901474003,0,0,0,0,0,0,0,0,0,0,4,18,16,2,1,1,1,1,1,0,0,1,Kolkata_Banglore,2871,1,12,0,0,639.9050855782347,0.09376390554199529,1,0
IndiGo,21/05/2019,Kolkata,Banglore,CCU → BLR,17:15,19:50,2h 35m,non-stop,No info,4804,2019-05-21,17:15:00,19:50:00,0,155,0,1,0,2053,0,0,CCU,BLR,1546.4372901474003,0,0,0,0,0,0,0,0,0,0,5,21,21,2,1,1,2,3,0,0,0,1,Kolkata_Banglore,2871,1,10,0,1,598.6208865086711,0.10023038178627082,1,0
Jet Airways,1/04/2019,Kolkata,Banglore,CCU → BOM → BLR,06:30,20:45,14h 15m,1 stop,No info,12681,2019-04-01,06:30:00,20:45:00,0,855,0,1,0,3849,0,0,CCU,BLR,1546.4372901474003,0,0,0,0,0,0,0,0,0,0,4,1,14,2,1,1,1,3,1,0,1,0,Kolkata_Banglore,2871,1,29,1,0,108.52191509806319,0.5528837188855584,1,0
Air Asia,6/06/2019,Kolkata,Banglore,CCU → BLR,10:20,12:55,2h 35m,non-stop,No info,4508,2019-06-06,10:20:00,12:55:00,0,155,0,1,0,319,0,0,CCU,BLR,1546.4372901474003,0,1,0,0,0,0,0,0,0,1,6,6,23,2,1,0,1,2,1,0,0,1,Kolkata_Banglore,2871,1,24,1,0,598.6208865086711,0.10023038178627082,1,0
Jet Airways,3/06/2019,Delhi,Cochin,DEL → BOM → COK,20:55,19:00 04 Jun,22h 5m,1 stop,In-flight meal not included,10262,2019-06-03,20:55:00,19:00:00,0,1325,0,0,0,3849,0,0,DEL,COK,2047.882109458646,0,1,0,0,0,0,0,0,0,1,6,3,23,2,1,0,3,3,0,1,1,0,Delhi_Cochin,4537,0,27,1,0,92.73428420190095,0.6470099005602726,1,0
Multiple carriers,3/03/2019,Delhi,Cochin,DEL → BOM → COK,19:00,01:35 04 Mar,6h 35m,1 stop,No info,16775,2019-03-03,19:00:00,01:35:00,0,395,1,0,1,1196,0,0,DEL,COK,2047.882109458646,0,0,0,0,0,0,0,0,0,0,3,3,9,1,1,1,3,0,0,1,1,0,Delhi_Cochin,4537,0,28,1,0,311.0707001709336,0.19288219677079826,1,0
Multiple carriers,12/06/2019,Delhi,Cochin,DEL → BOM → COK,17:00,01:30 13 Jun,8h 30m,1 stop,No info,7198,2019-06-12,17:00:00,01:30:00,0,510,0,0,1,1196,0,0,DEL,COK,2047.882109458646,0,0,0,0,0,0,0,0,0,0,6,12,24,2,1,0,2,0,0,0,1,0,Delhi_Cochin,4537,0,18,0,0,240.92730699513484,0.2490377730458408,1,0
Jet Airways,15/06/2019,Delhi,Cochin,DEL → JAI → BOM → COK,09:40,04:25 16 Jun,18h 45m,2 stops,No info,13014,2019-06-15,09:40:00,04:25:00,0,1125,1,0,1,3849,0,0,DEL,COK,2047.882109458646,0,0,0,0,0,0,0,0,0,0,6,15,24,2,1,0,1,0,1,0,2,0,Delhi_Cochin,4537,0,15,0,0,109.22037917112779,0.54934802877759,1,0
Air India,12/05/2019,Kolkata,Banglore,CCU → BBI → IXR → DEL → BLR,12:00,23:15 13 May,35h 15m,3 stops,No info,10991,2019-05-12,12:00:00,23:15:00,0,2115,1,0,0,1752,0,0,CCU,BLR,1546.4372901474003,0,0,0,0,0,0,0,0,0,0,5,12,19,2,1,1,2,3,0,0,3,0,Kolkata_Banglore,2871,1,19,0,0,43.870561422621286,1.3676597256642762,1,0
Vistara,21/06/2019,Chennai,Kolkata,MAA → CCU,07:05,09:20,2h 15m,non-stop,No info,3687,2019-06-21,07:05:00,09:20:00,0,135,0,1,0,479,0,0,MAA,CCU,1385.198425287915,0,0,0,0,0,0,0,0,0,0,6,21,25,2,1,0,1,1,1,0,0,1,Chennai_Kolkata,381,1,9,0,1,615.6437445724066,0.09745896150000323,1,0
Air Asia,12/05/2019,Kolkata,Banglore,CCU → BLR,19:55,22:25,2h 30m,non-stop,No info,5530,2019-05-12,19:55:00,22:25:00,0,150,1,1,0,319,0,0,CCU,BLR,1546.4372901474003,0,0,0,0,0,0,0,0,0,0,5,12,19,2,1,1,3,3,0,1,0,1,Kolkata_Banglore,2871,1,19,0,0,618.5749160589601,0.09699714366413306,1,0
SpiceJet,27/03/2019,Kolkata,Banglore,CCU → BLR,22:20,00:40 28 Mar,2h 20m,non-stop,No check-in baggage included,3815,2019-03-27,22:20:00,00:40:00,0,140,0,0,1,818,0,0,CCU,BLR,1546.4372901474003,0,0,0,0,0,0,0,0,0,0,3,27,13,1,1,1,3,0,0,1,0,1,Kolkata_Banglore,2871,1,4,0,1,662.7588386346001,0.09053066741985752,1,0
Air India,1/03/2019,Kolkata,Banglore,CCU → BLR,14:15,16:45,2h 30m,non-stop,No info,6535,2019-03-01,14:15:00,16:45:00,0,150,0,1,0,1752,0,0,CCU,BLR,1546.4372901474003,0,0,0,0,0,0,0,0,0,0,3,1,9,1,1,1,2,2,0,0,0,1,Kolkata_Banglore,2871,1,30,1,0,618.5749160589601,0.09699714366413306,1,0
Jet Airways,3/03/2019,Delhi,Cochin,DEL → BOM → COK,20:50,04:25 04 Mar,7h 35m,1 stop,No info,17234,2019-03-03,20:50:00,04:25:00,0,455,1,0,1,3849,0,0,DEL,COK,2047.882109458646,0,0,0,0,0,0,0,0,0,0,3,3,9,1,1,1,3,0,0,1,1,0,Delhi_Cochin,4537,0,28,1,0,270.05038806048077,0.22218075830560308,1,0
Jet Airways,6/03/2019,Delhi,Cochin,DEL → DED → BOM → COK,16:50,04:25 08 Mar,35h 35m,2 stops,No info,19907,2019-03-06,16:50:00,04:25:00,0,2135,0,0,1,3849,0,0,DEL,COK,2047.882109458646,0,0,0,0,0,0,0,0,0,0,3,6,10,1,1,1,2,0,0,0,2,0,Delhi_Cochin,4537,0,25,1,0,57.55172204567623,1.0425404812801375,1,0
Air India,27/03/2019,Delhi,Cochin,DEL → BLR → COK,20:30,23:00 28 Mar,26h 30m,1 stop,No info,5022,2019-03-27,20:30:00,23:00:00,0,1590,0,0,0,1752,0,0,DEL,COK,2047.882109458646,0,0,0,0,0,0,0,0,0,0,3,27,13,1,1,1,3,3,0,1,1,0,Delhi_Cochin,4537,0,4,0,1,77.2785701682508,0.7764118806723272,1,0
Multiple carriers,27/03/2019,Delhi,Cochin,DEL → BOM → COK,04:00,15:30,11h 30m,1 stop,No info,6305,2019-03-27,04:00:00,15:30:00,0,690,0,1,0,1196,0,0,DEL,COK,2047.882109458646,0,0,0,0,0,0,0,0,0,0,3,27,13,1,1,1,0,2,0,0,1,0,Delhi_Cochin,4537,0,4,0,1,178.07670517031704,0.3369334576502552,1,0
Jet Airways,21/03/2019,Delhi,Cochin,DEL → MAA → BOM → COK,16:10,18:50 22 Mar,26h 40m,2 stops,In-flight meal not included,8728,2019-03-21,16:10:00,18:50:00,0,1600,0,0,0,3849,0,0,DEL,COK,2047.882109458646,0,0,0,0,1,0,0,0,0,1,3,21,12,1,1,1,2,3,0,0,2,0,Delhi_Cochin,4537,0,10,0,1,76.79557910469923,0.7812949742614613,1,0
IndiGo,1/06/2019,Banglore,Delhi,BLR → DEL,21:15,00:15 02 Jun,3h,non-stop,No info,3943,2019-06-01,21:15:00,00:15:00,0,180,1,0,1,2053,0,0,BLR,DEL,1708.6520853536679,0,1,0,0,0,0,0,0,0,1,6,1,22,2,1,0,3,0,0,1,0,1,Banglore_Delhi,1265,1,29,1,0,569.5506951178893,0.10534619747515331,1,0
IndiGo,18/03/2019,Mumbai,Hyderabad,BOM → HYD,16:55,18:25,1h 30m,non-stop,No info,3175,2019-03-18,16:55:00,18:25:00,0,90,0,1,0,2053,0,0,BOM,HYD,622.9702752863186,0,0,0,0,1,0,0,0,0,1,3,18,12,1,1,1,2,3,0,0,0,1,Mumbai_Hyderabad,697,1,13,0,0,415.3135168575457,0.14446917223881314,0,0
Jet Airways,24/03/2019,Banglore,New Delhi,BLR → DEL,11:10,14:05,2h 55m,non-stop,No info,7229,2019-03-24,11:10:00,14:05:00,0,175,1,1,0,3849,0,0,BLR,DEL,1708.6520853536679,0,0,0,0,1,0,0,0,0,1,3,24,12,1,1,1,1,2,1,0,0,1,Banglore_New Delhi,932,0,7,0,1,585.8235721212576,0.10241991421195461,1,0
Multiple carriers,9/03/2019,Delhi,Cochin,DEL → HYD → MAA → COK,07:05,21:20,14h 15m,2 stops,No info,8620,2019-03-09,07:05:00,21:20:00,0,855,1,1,0,1196,0,0,DEL,COK,2047.882109458646,0,0,0,0,0,0,0,0,0,0,3,9,10,1,1,1,1,3,1,0,2,0,Delhi_Cochin,4537,0,22,1,0,143.71102522516813,0.4175045018709684,1,0
Air India,09/03/2019,Banglore,New Delhi,BLR → CCU → DEL,05:50,22:45,16h 55m,1 stop,No info,10657,2019-03-09,05:50:00,22:45:00,0,1015,1,1,0,1752,0,0,BLR,DEL,1708.6520853536679,0,0,0,0,0,0,0,0,0,0,3,9,10,1,1,1,0,3,0,0,1,0,Banglore_New Delhi,932,0,22,1,0,101.00406415883751,0.5940355024293367,1,0
Jet Airways,21/03/2019,Banglore,New Delhi,BLR → BOM → DEL,08:00,20:20,12h 20m,1 stop,In-flight meal not included,7832,2019-03-21,08:00:00,20:20:00,0,740,0,1,0,3849,0,0,BLR,DEL,1708.6520853536679,0,0,0,0,1,0,0,0,0,1,3,21,12,1,1,1,1,3,1,0,1,0,Banglore_New Delhi,932,0,10,0,1,138.539358271919,0.43308992295340804,1,0
Jet Airways,27/06/2019,Delhi,Cochin,DEL → AMD → BOM → COK,13:25,19:00 28 Jun,29h 35m,2 stops,In-flight meal not included,11150,2019-06-27,13:25:00,19:00:00,0,1775,0,0,0,3849,0,0,DEL,COK,2047.882109458646,0,0,0,0,0,0,0,0,0,0,6,27,26,2,1,0,2,3,0,0,2,0,Delhi_Cochin,4537,0,3,0,1,69.2241839817007,0.8667491120713087,1,0
Jet Airways,01/03/2019,Banglore,New Delhi,BLR → BOM → DEL,22:50,19:10 02 Mar,20h 20m,1 stop,No info,25735,2019-03-01,22:50:00,19:10:00,0,1220,0,0,1,3849,0,0,BLR,DEL,1708.6520853536679,0,0,0,0,0,0,0,0,0,0,3,1,9,1,1,1,3,3,0,1,1,0,Banglore_New Delhi,932,0,30,1,0,84.03206977149186,0.7140131162204836,1,0
Jet Airways,9/05/2019,Delhi,Cochin,DEL → ATQ → BOM → COK,20:00,04:25 10 May,8h 25m,2 stops,No info,16263,2019-05-09,20:00:00,04:25:00,0,505,0,0,1,3849,0,0,DEL,COK,2047.882109458646,0,0,0,0,0,0,0,0,0,0,5,9,19,2,1,1,3,0,0,1,2,0,Delhi_Cochin,4537,0,22,1,0,243.31272587627478,0.24659622625127373,1,0
Multiple carriers,24/06/2019,Delhi,Cochin,DEL → BOM → COK,11:40,01:30 25 Jun,13h 50m,1 stop,In-flight meal not included,5797,2019-06-24,11:40:00,01:30:00,0,830,0,0,1,1196,0,0,DEL,COK,2047.882109458646,0,0,0,0,0,0,0,0,0,0,6,24,26,2,1,0,1,0,1,0,1,0,Delhi_Cochin,4537,0,6,0,1,148.03967056327562,0.40529676789813307,1,0
Jet Airways,6/06/2019,Delhi,Cochin,DEL → BDQ → BOM → COK,18:25,04:25 07 Jun,10h,2 stops,No info,14237,2019-06-06,18:25:00,04:25:00,0,600,0,0,1,3849,0,0,DEL,COK,2047.882109458646,0,1,0,0,0,0,0,0,0,1,6,6,23,2,1,0,3,0,0,1,2,0,Delhi_Cochin,4537,0,24,1,0,204.7882109458646,0.292985615348048,1,0
Jet Airways,9/06/2019,Delhi,Cochin,DEL → BOM → COK,09:00,04:25 10 Jun,19h 25m,1 stop,In-flight meal not included,10262,2019-06-09,09:00:00,04:25:00,0,1165,1,0,1,3849,0,0,DEL,COK,2047.882109458646,0,1,0,0,0,0,0,0,0,1,6,9,23,2,1,0,1,0,1,0,1,0,Delhi_Cochin,4537,0,21,1,0,105.47032323392169,0.5688804031341266,1,0
Jet Airways,9/06/2019,Delhi,Cochin,DEL → BOM → COK,15:00,19:00 10 Jun,28h,1 stop,In-flight meal not included,10262,2019-06-09,15:00:00,19:00:00,0,1680,1,0,0,3849,0,0,DEL,COK,2047.882109458646,0,1,0,0,0,0,0,0,0,1,6,9,23,2,1,0,2,3,0,0,1,0,Delhi_Cochin,4537,0,21,1,0,73.13864676638022,0.8203597229745344,1,0
IndiGo,12/05/2019,Banglore,Delhi,BLR → DEL,04:00,06:50,2h 50m,non-stop,No info,3943,2019-05-12,04:00:00,06:50:00,0,170,1,1,1,2053,0,0,BLR,DEL,1708.6520853536679,0,0,0,0,0,0,0,0,0,0,5,12,19,2,1,1,0,1,0,0,0,1,Banglore_Delhi,1265,1,19,0,0,603.0536771836476,0.0994936309487559,1,0
Jet Airways,21/05/2019,Delhi,Cochin,DEL → BOM → COK,19:15,12:35 22 May,17h 20m,1 stop,In-flight meal not included,12898,2019-05-21,19:15:00,12:35:00,0,1040,0,0,0,3849,0,0,DEL,COK,2047.882109458646,0,0,0,0,0,0,0,0,0,0,5,21,21,2,1,1,3,2,0,1,1,0,Delhi_Cochin,4537,0,10,0,1,118.14704477646035,0.5078417332699499,1,0
IndiGo,15/05/2019,Banglore,Delhi,BLR → DEL,01:30,04:15,2h 45m,non-stop,No info,3419,2019-05-15,01:30:00,04:15:00,0,165,0,1,1,2053,0,0,BLR,DEL,1708.6520853536679,0,0,0,0,0,0,0,0,0,0,5,15,20,2,1,1,0,0,0,0,0,1,Banglore_Delhi,1265,1,16,0,0,621.3280310376974,0.09656734768555719,1,0
IndiGo,15/03/2019,Banglore,New Delhi,BLR → DEL,21:20,00:15 16 Mar,2h 55m,non-stop,No info,8033,2019-03-15,21:20:00,00:15:00,0,175,0,0,1,2053,0,0,BLR,DEL,1708.6520853536679,0,0,0,0,1,0,0,0,0,1,3,15,11,1,1,1,3,0,0,1,0,1,Banglore_New Delhi,932,0,16,0,0,585.8235721212576,0.10241991421195461,1,0
Jet Airways,01/03/2019,Banglore,New Delhi,BLR → BOM → DEL,05:45,19:10,13h 25m,1 stop,No info,27992,2019-03-01,05:45:00,19:10:00,0,805,0,1,0,3849,0,0,BLR,DEL,1708.6520853536679,0,0,0,0,0,0,0,0,0,0,3,1,9,1,1,1,0,3,0,0,1,0,Banglore_New Delhi,932,0,30,1,0,127.35295046114295,0.47113160537499116,1,0
Jet Airways,12/05/2019,Kolkata,Banglore,CCU → BOM → BLR,21:10,10:05 13 May,12h 55m,1 stop,No info,13941,2019-05-12,21:10:00,10:05:00,0,775,1,0,1,3849,0,0,CCU,BLR,1546.4372901474003,0,0,0,0,0,0,0,0,0,0,5,12,19,2,1,1,3,1,0,1,1,0,Kolkata_Banglore,2871,1,19,0,0,119.72417730173422,0.5011519089313541,1,0
Jet Airways,21/05/2019,Kolkata,Banglore,CCU → BOM → BLR,18:55,04:40 22 May,9h 45m,1 stop,No info,14388,2019-05-21,18:55:00,04:40:00,0,585,0,0,1,3849,0,0,CCU,BLR,1546.4372901474003,0,0,0,0,0,0,0,0,0,0,5,21,21,2,1,1,3,0,0,1,1,0,Kolkata_Banglore,2871,1,10,0,1,158.60895283563082,0.37828886029011893,1,0
Jet Airways,12/05/2019,Kolkata,Banglore,CCU → BOM → BLR,18:55,16:20 13 May,21h 25m,1 stop,In-flight meal not included,10844,2019-05-12,18:55:00,16:20:00,0,1285,1,0,0,3849,0,0,CCU,BLR,1546.4372901474003,0,0,0,0,0,0,0,0,0,0,5,12,19,2,1,1,3,2,0,1,1,0,Kolkata_Banglore,2871,1,19,0,0,72.20718864501481,0.8309421973894066,1,0
IndiGo,3/03/2019,Delhi,Cochin,DEL → HYD → COK,06:40,22:20,15h 40m,1 stop,No info,11600,2019-03-03,06:40:00,22:20:00,0,940,1,1,0,2053,0,0,DEL,COK,2047.882109458646,0,0,0,0,0,0,0,0,0,0,3,3,9,1,1,1,1,3,1,0,1,0,Delhi_Cochin,4537,0,28,1,0,130.7158793271476,0.45901079737860856,1,0
IndiGo,6/06/2019,Chennai,Kolkata,MAA → CCU,22:05,00:25 07 Jun,2h 20m,non-stop,No info,5277,2019-06-06,22:05:00,00:25:00,0,140,0,0,1,2053,0,0,MAA,CCU,1385.198425287915,0,1,0,0,0,0,0,0,0,1,6,6,23,2,1,0,3,0,0,1,0,1,Chennai_Kolkata,381,1,24,1,0,593.656467980535,0.10106855266667002,1,0
Jet Airways,3/06/2019,Delhi,Cochin,DEL → BOM → COK,14:00,04:25 04 Jun,14h 25m,1 stop,In-flight meal not included,10262,2019-06-03,14:00:00,04:25:00,0,865,0,0,1,3849,0,0,DEL,COK,2047.882109458646,0,1,0,0,0,0,0,0,0,1,6,3,23,2,1,0,2,0,0,0,1,0,Delhi_Cochin,4537,0,27,1,0,142.04962608961705,0.4223875954601025,1,0
IndiGo,03/03/2019,Banglore,New Delhi,BLR → DEL,04:00,06:50,2h 50m,non-stop,No info,6144,2019-03-03,04:00:00,06:50:00,0,170,1,1,1,2053,0,0,BLR,DEL,1708.6520853536679,0,0,0,0,0,0,0,0,0,0,3,3,9,1,1,1,0,1,0,0,0,1,Banglore_New Delhi,932,0,28,1,0,603.0536771836476,0.0994936309487559,1,0
Jet Airways,3/06/2019,Delhi,Cochin,DEL → BOM → COK,21:50,04:25 04 Jun,6h 35m,1 stop,In-flight meal not included,12898,2019-06-03,21:50:00,04:25:00,0,395,0,0,1,3849,0,0,DEL,COK,2047.882109458646,0,1,0,0,0,0,0,0,0,1,6,3,23,2,1,0,3,0,0,1,1,0,Delhi_Cochin,4537,0,27,1,0,311.0707001709336,0.19288219677079826,1,0
Jet Airways,12/05/2019,Kolkata,Banglore,CCU → BOM → BLR,06:30,04:40 13 May,22h 10m,1 stop,No info,13941,2019-05-12,06:30:00,04:40:00,0,1330,1,0,1,3849,0,0,CCU,BLR,1546.4372901474003,0,0,0,0,0,0,0,0,0,0,5,12,19,2,1,1,1,0,1,0,1,0,Kolkata_Banglore,2871,1,19,0,0,69.76408827732634,0.8600413404886464,1,0
Jet Airways,18/05/2019,Delhi,Cochin,DEL → BOM → COK,14:00,04:25 19 May,14h 25m,1 stop,In-flight meal not included,12373,2019-05-18,14:00:00,04:25:00,0,865,1,0,1,3849,0,0,DEL,COK,2047.882109458646,0,0,0,0,0,0,0,0,0,0,5,18,20,2,1,1,2,0,0,0,1,0,Delhi_Cochin,4537,0,13,0,0,142.04962608961705,0.4223875954601025,1,0
SpiceJet,3/04/2019,Kolkata,Banglore,CCU → BLR,17:10,19:40,2h 30m,non-stop,No check-in baggage included,3841,2019-04-03,17:10:00,19:40:00,0,150,0,1,0,818,0,0,CCU,BLR,1546.4372901474003,0,0,0,0,0,0,0,0,0,0,4,3,14,2,1,1,2,3,0,0,0,1,Kolkata_Banglore,2871,1,27,1,0,618.5749160589601,0.09699714366413306,1,0
Air India,18/05/2019,Kolkata,Banglore,CCU → JAI → BOM → BLR,08:20,07:55 19 May,23h 35m,2 stops,No info,10697,2019-05-18,08:20:00,07:55:00,0,1415,1,0,0,1752,0,0,CCU,BLR,1546.4372901474003,0,0,0,0,0,0,0,0,0,0,5,18,20,2,1,1,1,1,1,0,2,0,Kolkata_Banglore,2871,1,13,0,0,65.57331265642686,0.9150063885649885,1,0
Jet Airways,01/03/2019,Banglore,New Delhi,BLR → BOM → DEL,11:40,00:45 02 Mar,13h 5m,1 stop,No info,26890,2019-03-01,11:40:00,00:45:00,0,785,0,0,1,3849,0,0,BLR,DEL,1708.6520853536679,0,0,0,0,0,0,0,0,0,0,3,1,9,1,1,1,1,0,1,0,1,0,Banglore_New Delhi,932,0,30,1,0,130.5976116193886,0.45942647232219636,1,0
SpiceJet,1/06/2019,Mumbai,Hyderabad,BOM → HYD,13:15,14:45,1h 30m,non-stop,No check-in baggage included,2175,2019-06-01,13:15:00,14:45:00,0,90,1,1,0,818,0,0,BOM,HYD,622.9702752863186,0,1,0,0,0,0,0,0,0,1,6,1,22,2,1,0,2,2,0,0,0,1,Mumbai_Hyderabad,697,1,29,1,0,415.3135168575457,0.14446917223881314,0,0
IndiGo,27/05/2019,Delhi,Cochin,DEL → PNQ → COK,23:30,04:35 28 May,5h 5m,1 stop,No info,9476,2019-05-27,23:30:00,04:35:00,0,305,0,0,1,2053,0,0,DEL,COK,2047.882109458646,0,0,0,0,0,0,0,0,0,0,5,27,22,2,1,1,3,0,0,1,1,0,Delhi_Cochin,4537,0,4,0,1,402.8620543197336,0.14893435446859107,1,0
Air India,24/05/2019,Mumbai,Hyderabad,BOM → HYD,21:05,22:25,1h 20m,non-stop,No info,3100,2019-05-24,21:05:00,22:25:00,0,80,0,1,1,1752,0,0,BOM,HYD,622.9702752863186,0,0,0,0,0,0,0,0,0,0,5,24,21,2,1,1,3,3,0,1,0,1,Mumbai_Hyderabad,697,1,7,0,1,467.22770646473896,0.12841704199005613,0,0
Jet Airways,15/06/2019,Delhi,Cochin,DEL → JAI → BOM → COK,05:30,04:25 16 Jun,22h 55m,2 stops,In-flight meal not included,10368,2019-06-15,05:30:00,04:25:00,0,1375,1,0,1,3849,0,0,DEL,COK,2047.882109458646,0,0,0,0,0,0,0,0,0,0,6,15,24,2,1,0,0,0,0,0,2,0,Delhi_Cochin,4537,0,15,0,0,89.36212841274092,0.6714253685059434,1,0
SpiceJet,18/05/2019,Mumbai,Hyderabad,BOM → HYD,22:45,00:15 19 May,1h 30m,non-stop,No info,2017,2019-05-18,22:45:00,00:15:00,0,90,1,0,1,818,0,0,BOM,HYD,622.9702752863186,0,0,0,0,0,0,0,0,0,0,5,18,20,2,1,1,3,0,0,1,0,1,Mumbai_Hyderabad,697,1,13,0,0,415.3135168575457,0.14446917223881314,0,0
SpiceJet,15/04/2019,Kolkata,Banglore,CCU → BLR,06:55,09:30,2h 35m,non-stop,No check-in baggage included,3841,2019-04-15,06:55:00,09:30:00,0,155,0,1,0,818,0,0,CCU,BLR,1546.4372901474003,0,0,0,0,0,0,0,0,0,0,4,15,16,2,1,1,1,1,1,0,0,1,Kolkata_Banglore,2871,1,15,0,0,598.6208865086711,0.10023038178627082,1,0
Air India,21/05/2019,Delhi,Cochin,DEL → NAG → BOM → COK,05:55,19:15 22 May,37h 20m,2 stops,No info,10493,2019-05-21,05:55:00,19:15:00,0,2240,0,0,0,1752,0,0,DEL,COK,2047.882109458646,0,0,0,0,0,0,0,0,0,0,5,21,21,2,1,1,0,3,0,0,2,0,Delhi_Cochin,4537,0,10,0,1,54.853985074785164,1.0938129639660459,1,0
SpiceJet,09/03/2019,Banglore,New Delhi,BLR → DEL,05:45,08:35,2h 50m,non-stop,No info,5126,2019-03-09,05:45:00,08:35:00,0,170,1,1,0,818,0,0,BLR,DEL,1708.6520853536679,0,0,0,0,0,0,0,0,0,0,3,9,10,1,1,1,0,1,0,0,0,1,Banglore_New Delhi,932,0,22,1,0,603.0536771836476,0.0994936309487559,1,0
IndiGo,18/06/2019,Banglore,Delhi,BLR → DEL,23:30,02:20 19 Jun,2h 50m,non-stop,No info,3943,2019-06-18,23:30:00,02:20:00,0,170,0,0,1,2053,0,0,BLR,DEL,1708.6520853536679,0,0,0,0,0,0,0,0,0,0,6,18,25,2,1,0,3,0,0,1,0,1,Banglore_Delhi,1265,1,12,0,0,603.0536771836476,0.0994936309487559,1,0
Air India,6/03/2019,Delhi,Cochin,DEL → HYD → BOM → COK,07:05,19:15 07 Mar,36h 10m,2 stops,No info,11552,2019-03-06,07:05:00,19:15:00,0,2170,0,0,0,1752,0,0,DEL,COK,2047.882109458646,0,0,0,0,0,0,0,0,0,0,3,6,10,1,1,1,1,3,1,0,2,0,Delhi_Cochin,4537,0,25,1,0,56.62346846429436,1.059631308842107,1,0
Air India,21/03/2019,Delhi,Cochin,DEL → BOM → COK,10:00,19:15,9h 15m,1 stop,No info,7934,2019-03-21,10:00:00,19:15:00,0,555,0,1,0,1752,0,0,DEL,COK,2047.882109458646,0,0,0,0,1,0,0,0,0,1,3,21,12,1,1,1,1,3,1,0,1,0,Delhi_Cochin,4537,0,10,0,1,221.3926604820158,0.2710116941969444,1,0
Air India,1/03/2019,Mumbai,Hyderabad,BOM → HYD,15:00,16:25,1h 25m,non-stop,No info,6092,2019-03-01,15:00:00,16:25:00,0,85,0,1,0,1752,0,0,BOM,HYD,622.9702752863186,0,0,0,0,0,0,0,0,0,0,3,1,9,1,1,1,2,2,0,0,0,1,Mumbai_Hyderabad,697,1,30,1,0,439.743723731519,0.13644310711443464,0,0
IndiGo,12/06/2019,Delhi,Cochin,DEL → PNQ → COK,23:30,04:35 13 Jun,5h 5m,1 stop,No info,10112,2019-06-12,23:30:00,04:35:00,0,305,0,0,1,2053,0,0,DEL,COK,2047.882109458646,0,0,0,0,0,0,0,0,0,0,6,12,24,2,1,0,3,0,0,1,1,0,Delhi_Cochin,4537,0,18,0,0,402.8620543197336,0.14893435446859107,1,0
Vistara,9/03/2019,Chennai,Kolkata,MAA → CCU,07:05,09:20,2h 15m,non-stop,No info,6627,2019-03-09,07:05:00,09:20:00,0,135,1,1,0,479,0,0,MAA,CCU,1385.198425287915,0,0,0,0,0,0,0,0,0,0,3,9,10,1,1,1,1,1,1,0,0,1,Chennai_Kolkata,381,1,22,1,0,615.6437445724066,0.09745896150000323,1,0
Jet Airways,3/06/2019,Delhi,Cochin,DEL → IDR → BOM → COK,21:25,12:35 04 Jun,15h 10m,2 stops,In-flight meal not included,11507,2019-06-03,21:25:00,12:35:00,0,910,0,0,1,3849,0,0,DEL,COK,2047.882109458646,0,1,0,0,0,0,0,0,0,1,6,3,23,2,1,0,3,2,0,1,2,0,Delhi_Cochin,4537,0,27,1,0,135.02519403024039,0.44436151661120615,1,0
Jet Airways,01/03/2019,Banglore,New Delhi,BLR → BOM → DEL,22:50,00:45 03 Mar,25h 55m,1 stop,No info,26890,2019-03-01,22:50:00,00:45:00,0,1555,0,0,1,3849,0,0,BLR,DEL,1708.6520853536679,0,0,0,0,0,0,0,0,0,0,3,1,9,1,1,1,3,0,0,1,1,0,Banglore_New Delhi,932,0,30,1,0,65.92869782715117,0.9100740948547966,1,0
Jet Airways,12/03/2019,Banglore,New Delhi,BLR → BOM → DEL,05:45,11:25,5h 40m,1 stop,No info,13817,2019-03-12,05:45:00,11:25:00,0,340,0,1,0,3849,0,0,BLR,DEL,1708.6520853536679,0,0,0,0,0,0,0,0,0,0,3,12,11,1,1,1,0,1,0,0,1,0,Banglore_New Delhi,932,0,19,0,0,301.5268385918238,0.1989872618975118,1,0
Jet Airways,1/04/2019,Kolkata,Banglore,CCU → BOM → BLR,21:10,04:40 02 Apr,7h 30m,1 stop,No info,13364,2019-04-01,21:10:00,04:40:00,0,450,0,0,1,3849,0,0,CCU,BLR,1546.4372901474003,0,0,0,0,0,0,0,0,0,0,4,1,14,2,1,1,3,0,0,1,1,0,Kolkata_Banglore,2871,1,29,1,0,206.19163868632003,0.29099143099239916,1,0
Vistara,6/06/2019,Kolkata,Banglore,CCU → DEL → BLR,17:00,10:45 07 Jun,17h 45m,1 stop,No info,9187,2019-06-06,17:00:00,10:45:00,0,1065,0,0,0,479,0,0,CCU,BLR,1546.4372901474003,0,1,0,0,0,0,0,0,0,1,6,6,23,2,1,0,2,1,0,0,1,0,Kolkata_Banglore,2871,1,24,1,0,87.12322761393804,0.6886797200153447,1,0
IndiGo,9/05/2019,Chennai,Kolkata,MAA → CCU,22:05,00:25 10 May,2h 20m,non-stop,No info,5277,2019-05-09,22:05:00,00:25:00,0,140,0,0,1,2053,0,0,MAA,CCU,1385.198425287915,0,0,0,0,0,0,0,0,0,0,5,9,19,2,1,1,3,0,0,1,0,1,Chennai_Kolkata,381,1,22,1,0,593.656467980535,0.10106855266667002,1,0
Air India,12/03/2019,Banglore,New Delhi,BLR → AMD → DEL,00:30,08:45,8h 15m,1 stop,No info,13492,2019-03-12,00:30:00,08:45:00,0,495,0,1,1,1752,0,0,BLR,DEL,1708.6520853536679,0,0,0,0,0,0,0,0,0,0,3,12,11,1,1,1,0,1,0,0,1,0,Banglore_New Delhi,932,0,19,0,0,207.10934367923247,0.2897020430566716,1,0
Air Asia,12/06/2019,Kolkata,Banglore,CCU → BBI → BLR,06:50,10:30,3h 40m,1 stop,No info,5162,2019-06-12,06:50:00,10:30:00,0,220,0,1,0,319,0,0,CCU,BLR,1546.4372901474003,0,0,0,0,0,0,0,0,0,0,6,12,24,2,1,0,1,1,1,0,1,0,Kolkata_Banglore,2871,1,18,0,0,421.75562458565463,0.1422624773740618,1,0
GoAir,9/06/2019,Delhi,Cochin,DEL → BOM → COK,07:00,12:55,5h 55m,1 stop,No info,5897,2019-06-09,07:00:00,12:55:00,0,355,1,1,0,194,0,0,DEL,COK,2047.882109458646,0,1,0,0,0,0,0,0,0,1,6,9,23,2,1,0,1,2,1,0,1,0,Delhi_Cochin,4537,0,21,1,0,346.12091990850354,0.17334982241426172,1,0
Air India,3/06/2019,Kolkata,Banglore,CCU → BLR,14:15,16:45,2h 30m,non-stop,No info,5510,2019-06-03,14:15:00,16:45:00,0,150,0,1,0,1752,0,0,CCU,BLR,1546.4372901474003,0,1,0,0,0,0,0,0,0,1,6,3,23,2,1,0,2,2,0,0,0,1,Kolkata_Banglore,2871,1,27,1,0,618.5749160589601,0.09699714366413306,1,0
Jet Airways,06/03/2019,Banglore,New Delhi,BLR → BOM → DEL,16:55,10:25 07 Mar,17h 30m,1 stop,No info,17261,2019-03-06,16:55:00,10:25:00,0,1050,0,0,0,3849,0,0,BLR,DEL,1708.6520853536679,0,0,0,0,0,0,0,0,0,0,3,6,10,1,1,1,2,1,0,0,1,0,Banglore_New Delhi,932,0,25,1,0,97.63726202020959,0.6145194852717276,1,0
Multiple carriers,21/05/2019,Delhi,Cochin,DEL → BOM → COK,11:40,01:30 22 May,13h 50m,1 stop,No info,7485,2019-05-21,11:40:00,01:30:00,0,830,0,0,1,1196,0,0,DEL,COK,2047.882109458646,0,0,0,0,0,0,0,0,0,0,5,21,21,2,1,1,1,0,1,0,1,0,Delhi_Cochin,4537,0,10,0,1,148.03967056327562,0.40529676789813307,1,0
Air India,21/06/2019,Chennai,Kolkata,MAA → CCU,11:40,13:55,2h 15m,non-stop,No info,4667,2019-06-21,11:40:00,13:55:00,0,135,0,1,0,1752,0,0,MAA,CCU,1385.198425287915,0,0,0,0,0,0,0,0,0,0,6,21,25,2,1,0,1,2,1,0,0,1,Chennai_Kolkata,381,1,9,0,1,615.6437445724066,0.09745896150000323,1,0
Jet Airways,15/05/2019,Kolkata,Banglore,CCU → DEL → BLR,20:25,18:00 16 May,21h 35m,1 stop,No info,14151,2019-05-15,20:25:00,18:00:00,0,1295,0,0,0,3849,0,0,CCU,BLR,1546.4372901474003,0,0,0,0,0,0,0,0,0,0,5,15,20,2,1,1,3,3,0,1,1,0,Kolkata_Banglore,2871,1,16,0,0,71.64960417671352,0.8374086736336821,1,0
IndiGo,27/05/2019,Delhi,Cochin,DEL → BOM → COK,16:00,01:30 28 May,9h 30m,1 stop,No info,7048,2019-05-27,16:00:00,01:30:00,0,570,0,0,1,2053,0,0,DEL,COK,2047.882109458646,0,0,0,0,0,0,0,0,0,0,5,27,22,2,1,1,2,0,0,0,1,0,Delhi_Cochin,4537,0,4,0,1,215.5665378377522,0.2783363345806456,1,0
Jet Airways,21/03/2019,Delhi,Cochin,DEL → BOM → COK,19:45,04:25 22 Mar,8h 40m,1 stop,No info,12557,2019-03-21,19:45:00,04:25:00,0,520,0,0,1,3849,0,0,DEL,COK,2047.882109458646,0,0,0,0,1,0,0,0,0,1,3,21,12,1,1,1,3,0,0,1,1,0,Delhi_Cochin,4537,0,10,0,1,236.2940895529207,0.25392086663497493,1,0
Multiple carriers,15/06/2019,Delhi,Cochin,DEL → IDR → BOM → COK,15:05,01:30 16 Jun,10h 25m,2 stops,No info,15965,2019-06-15,15:05:00,01:30:00,0,625,1,0,1,1196,0,0,DEL,COK,2047.882109458646,0,0,0,0,0,0,0,0,0,0,6,15,24,2,1,0,2,0,0,0,2,0,Delhi_Cochin,4537,0,15,0,0,196.59668250803003,0.3051933493208833,1,0
Air India,03/03/2019,Banglore,New Delhi,BLR → CCU → GAU → DEL,11:05,22:10 07 Mar,35h 5m,2 stops,No info,11791,2019-03-03,11:05:00,22:10:00,0,2105,1,0,0,1752,0,0,BLR,DEL,1708.6520853536679,0,0,0,0,0,0,0,0,0,0,3,3,9,1,1,1,1,3,1,0,2,0,Banglore_New Delhi,932,0,28,1,0,48.702672266612865,1.231965253806654,1,0
Multiple carriers,3/03/2019,Delhi,Cochin,DEL → HYD → MAA → COK,07:05,21:20,14h 15m,2 stops,No info,8291,2019-03-03,07:05:00,21:20:00,0,855,1,1,0,1196,0,0,DEL,COK,2047.882109458646,0,0,0,0,0,0,0,0,0,0,3,3,9,1,1,1,1,3,1,0,2,0,Delhi_Cochin,4537,0,28,1,0,143.71102522516813,0.4175045018709684,1,0
IndiGo,21/04/2019,Banglore,Delhi,BLR → DEL,16:55,19:55,3h,non-stop,No info,4990,2019-04-21,16:55:00,19:55:00,0,180,1,1,0,2053,0,0,BLR,DEL,1708.6520853536679,0,0,0,0,0,0,0,0,0,0,4,21,16,2,1,1,2,3,0,0,0,1,Banglore_Delhi,1265,1,9,0,1,569.5506951178893,0.10534619747515331,1,0
Vistara,12/05/2019,Kolkata,Banglore,CCU → DEL → BLR,17:00,18:50 13 May,25h 50m,1 stop,No info,9135,2019-05-12,17:00:00,18:50:00,0,1550,1,0,0,479,0,0,CCU,BLR,1546.4372901474003,0,0,0,0,0,0,0,0,0,0,5,12,19,2,1,1,2,3,0,0,1,0,Kolkata_Banglore,2871,1,19,0,0,59.86208865086711,1.0023038178627082,1,0
Air Asia,12/04/2019,Kolkata,Banglore,CCU → BLR,22:50,01:20 13 Apr,2h 30m,non-stop,No info,4409,2019-04-12,22:50:00,01:20:00,0,150,0,0,1,319,0,0,CCU,BLR,1546.4372901474003,0,0,0,0,0,0,0,0,0,0,4,12,15,2,1,1,3,0,0,1,0,1,Kolkata_Banglore,2871,1,18,0,0,618.5749160589601,0.09699714366413306,1,0
Jet Airways,21/05/2019,Kolkata,Banglore,CCU → BOM → BLR,20:00,04:40 22 May,8h 40m,1 stop,In-flight meal not included,10844,2019-05-21,20:00:00,04:40:00,0,520,0,0,1,3849,0,0,CCU,BLR,1546.4372901474003,0,0,0,0,0,0,0,0,0,0,5,21,21,2,1,1,3,0,0,1,1,0,Kolkata_Banglore,2871,1,10,0,1,178.43507194008464,0.3362567647023279,1,0
Multiple carriers,27/05/2019,Delhi,Cochin,DEL → BOM → COK,09:00,19:00,10h,1 stop,No info,10407,2019-05-27,09:00:00,19:00:00,0,600,0,1,0,1196,0,0,DEL,COK,2047.882109458646,0,0,0,0,0,0,0,0,0,0,5,27,22,2,1,1,1,3,1,0,1,0,Delhi_Cochin,4537,0,4,0,1,204.7882109458646,0.292985615348048,1,0
Multiple carriers,27/05/2019,Delhi,Cochin,DEL → BOM → COK,07:30,19:00,11h 30m,1 stop,No info,9315,2019-05-27,07:30:00,19:00:00,0,690,0,1,0,1196,0,0,DEL,COK,2047.882109458646,0,0,0,0,0,0,0,0,0,0,5,27,22,2,1,1,1,3,1,0,1,0,Delhi_Cochin,4537,0,4,0,1,178.07670517031704,0.3369334576502552,1,0
Jet Airways,24/05/2019,Kolkata,Banglore,CCU → BOM → BLR,21:10,04:40 25 May,7h 30m,1 stop,In-flight meal not included,9663,2019-05-24,21:10:00,04:40:00,0,450,0,0,1,3849,0,0,CCU,BLR,1546.4372901474003,0,0,0,0,0,0,0,0,0,0,5,24,21,2,1,1,3,0,0,1,1,0,Kolkata_Banglore,2871,1,7,0,1,206.19163868632003,0.29099143099239916,1,0
IndiGo,21/03/2019,Delhi,Cochin,DEL → BOM → COK,18:35,01:35 22 Mar,7h,1 stop,No info,9264,2019-03-21,18:35:00,01:35:00,0,420,0,0,1,2053,0,0,DEL,COK,2047.882109458646,0,0,0,0,1,0,0,0,0,1,3,21,12,1,1,1,3,0,0,1,1,0,Delhi_Cochin,4537,0,10,0,1,292.5545870655209,0.2050899307436336,1,0
SpiceJet,15/05/2019,Chennai,Kolkata,MAA → CCU,09:45,12:00,2h 15m,non-stop,No info,3597,2019-05-15,09:45:00,12:00:00,0,135,0,1,0,818,0,0,MAA,CCU,1385.198425287915,0,0,0,0,0,0,0,0,0,0,5,15,20,2,1,1,1,2,1,0,0,1,Chennai_Kolkata,381,1,16,0,0,615.6437445724066,0.09745896150000323,1,0
IndiGo,24/06/2019,Delhi,Cochin,DEL → HYD → COK,05:05,12:10,7h 5m,1 stop,No info,6442,2019-06-24,05:05:00,12:10:00,0,425,0,1,0,2053,0,0,DEL,COK,2047.882109458646,0,0,0,0,0,0,0,0,0,0,6,24,26,2,1,0,0,2,0,0,1,0,Delhi_Cochin,4537,0,6,0,1,289.11276839416183,0.20753147753820067,1,0
Multiple carriers,9/05/2019,Delhi,Cochin,DEL → BOM → COK,17:30,01:30 10 May,8h,1 stop,No info,15078,2019-05-09,17:30:00,01:30:00,0,480,0,0,1,1196,0,0,DEL,COK,2047.882109458646,0,0,0,0,0,0,0,0,0,0,5,9,19,2,1,1,2,0,0,0,1,0,Delhi_Cochin,4537,0,22,1,0,255.98526368233078,0.23438849227843842,1,0
IndiGo,1/05/2019,Kolkata,Banglore,CCU → NAG → BLR,18:05,23:30,5h 25m,1 stop,No info,6218,2019-05-01,18:05:00,23:30:00,0,325,0,1,0,2053,0,0,CCU,BLR,1546.4372901474003,0,0,0,0,0,0,0,0,0,0,5,1,18,2,1,1,3,3,0,1,1,0,Kolkata_Banglore,2871,1,30,1,0,285.49611510413547,0.21016047793895495,1,0
Jet Airways,12/06/2019,Delhi,Cochin,DEL → BOM → COK,13:00,12:35 13 Jun,23h 35m,1 stop,In-flight meal not included,10262,2019-06-12,13:00:00,12:35:00,0,1415,0,0,0,3849,0,0,DEL,COK,2047.882109458646,0,0,0,0,0,0,0,0,0,0,6,12,24,2,1,0,2,2,0,0,1,0,Delhi_Cochin,4537,0,18,0,0,86.8359905070804,0.6909577428624799,1,0
Multiple carriers,9/03/2019,Delhi,Cochin,DEL → BOM → COK,19:00,01:35 10 Mar,6h 35m,1 stop,No info,13677,2019-03-09,19:00:00,01:35:00,0,395,1,0,1,1196,0,0,DEL,COK,2047.882109458646,0,0,0,0,0,0,0,0,0,0,3,9,10,1,1,1,3,0,0,1,1,0,Delhi_Cochin,4537,0,22,1,0,311.0707001709336,0.19288219677079826,1,0
Jet Airways,24/06/2019,Banglore,Delhi,BLR → DEL,07:10,10:10,3h,non-stop,No info,8016,2019-06-24,07:10:00,10:10:00,0,180,0,1,0,3849,0,0,BLR,DEL,1708.6520853536679,0,0,0,0,0,0,0,0,0,0,6,24,26,2,1,0,1,1,1,0,0,1,Banglore_Delhi,1265,1,6,0,1,569.5506951178893,0.10534619747515331,1,0
Jet Airways,3/06/2019,Delhi,Cochin,DEL → BOM → COK,17:30,12:35 04 Jun,19h 5m,1 stop,In-flight meal not included,10262,2019-06-03,17:30:00,12:35:00,0,1145,0,0,0,3849,0,0,DEL,COK,2047.882109458646,0,1,0,0,0,0,0,0,0,1,6,3,23,2,1,0,2,2,0,0,1,0,Delhi_Cochin,4537,0,27,1,0,107.31259962228712,0.5591142159558583,1,0
SpiceJet,27/06/2019,Kolkata,Banglore,CCU → BLR,06:55,09:30,2h 35m,non-stop,No info,3873,2019-06-27,06:55:00,09:30:00,0,155,0,1,0,818,0,0,CCU,BLR,1546.4372901474003,0,0,0,0,0,0,0,0,0,0,6,27,26,2,1,0,1,1,1,0,0,1,Kolkata_Banglore,2871,1,3,0,1,598.6208865086711,0.10023038178627082,1,0
SpiceJet,27/06/2019,Delhi,Cochin,DEL → PNQ → COK,08:45,13:15,4h 30m,1 stop,No info,4812,2019-06-27,08:45:00,13:15:00,0,270,0,1,0,818,0,0,DEL,COK,2047.882109458646,0,0,0,0,0,0,0,0,0,0,6,27,26,2,1,0,1,2,1,0,1,0,Delhi_Cochin,4537,0,3,0,1,455.08491321303245,0.1318435269066216,1,0
SpiceJet,15/05/2019,Mumbai,Hyderabad,BOM → HYD,22:45,00:15 16 May,1h 30m,non-stop,No info,2017,2019-05-15,22:45:00,00:15:00,0,90,0,0,1,818,0,0,BOM,HYD,622.9702752863186,0,0,0,0,0,0,0,0,0,0,5,15,20,2,1,1,3,0,0,1,0,1,Mumbai_Hyderabad,697,1,16,0,0,415.3135168575457,0.14446917223881314,0,0
IndiGo,21/03/2019,Kolkata,Banglore,CCU → BLR,20:25,23:05,2h 40m,non-stop,No info,4462,2019-03-21,20:25:00,23:05:00,0,160,0,1,0,2053,0,0,CCU,BLR,1546.4372901474003,0,0,0,0,1,0,0,0,0,1,3,21,12,1,1,1,3,3,0,1,0,1,Kolkata_Banglore,2871,1,10,0,1,579.913983805275,0.10346361990840859,1,0
Air India,15/06/2019,Delhi,Cochin,DEL → AMD → BOM → COK,05:00,07:40 16 Jun,26h 40m,2 stops,No info,10231,2019-06-15,05:00:00,07:40:00,0,1600,1,0,0,1752,0,0,DEL,COK,2047.882109458646,0,0,0,0,0,0,0,0,0,0,6,15,24,2,1,0,0,1,0,0,2,0,Delhi_Cochin,4537,0,15,0,0,76.79557910469923,0.7812949742614613,1,0
Air India,21/03/2019,Banglore,New Delhi,BLR → VGA → DEL,10:30,22:55,12h 25m,1 stop,No info,6383,2019-03-21,10:30:00,22:55:00,0,745,0,1,0,1752,0,0,BLR,DEL,1708.6520853536679,0,0,0,0,1,0,0,0,0,1,3,21,12,1,1,1,1,3,1,0,1,0,Banglore_New Delhi,932,0,10,0,1,137.60956392110077,0.43601620621660675,1,0
Air India,24/06/2019,Delhi,Cochin,DEL → HYD → BOM → COK,17:15,07:40 25 Jun,14h 25m,2 stops,No info,11989,2019-06-24,17:15:00,07:40:00,0,865,0,0,0,1752,0,0,DEL,COK,2047.882109458646,0,0,0,0,0,0,0,0,0,0,6,24,26,2,1,0,2,1,0,0,2,0,Delhi_Cochin,4537,0,6,0,1,142.04962608961705,0.4223875954601025,1,0
IndiGo,24/03/2019,Banglore,New Delhi,BLR → DEL,18:55,21:45,2h 50m,non-stop,No info,7303,2019-03-24,18:55:00,21:45:00,0,170,1,1,0,2053,0,0,BLR,DEL,1708.6520853536679,0,0,0,0,1,0,0,0,0,1,3,24,12,1,1,1,3,3,0,1,0,1,Banglore_New Delhi,932,0,7,0,1,603.0536771836476,0.0994936309487559,1,0
Jet Airways,21/04/2019,Banglore,Delhi,BLR → DEL,18:55,22:00,3h 5m,non-stop,No info,7229,2019-04-21,18:55:00,22:00:00,0,185,1,1,0,3849,0,0,BLR,DEL,1708.6520853536679,0,0,0,0,0,0,0,0,0,0,4,21,16,2,1,1,3,3,0,1,0,1,Banglore_Delhi,1265,1,9,0,1,554.157433087676,0.10827248073835201,1,0
Jet Airways,21/06/2019,Mumbai,Hyderabad,BOM → HYD,08:45,10:15,1h 30m,non-stop,In-flight meal not included,4995,2019-06-21,08:45:00,10:15:00,0,90,0,1,0,3849,0,0,BOM,HYD,622.9702752863186,0,0,0,0,0,0,0,0,0,0,6,21,25,2,1,0,1,1,1,0,0,1,Mumbai_Hyderabad,697,1,9,0,1,415.3135168575457,0.14446917223881314,0,0
Multiple carriers,15/06/2019,Delhi,Cochin,DEL → BOM → COK,13:00,21:00,8h,1 stop,No info,7408,2019-06-15,13:00:00,21:00:00,0,480,1,1,0,1196,0,0,DEL,COK,2047.882109458646,0,0,0,0,0,0,0,0,0,0,6,15,24,2,1,0,2,3,0,0,1,0,Delhi_Cochin,4537,0,15,0,0,255.98526368233078,0.23438849227843842,1,0
Air India,15/05/2019,Kolkata,Banglore,CCU → GAU → DEL → BLR,16:45,12:30 16 May,19h 45m,2 stops,No info,14960,2019-05-15,16:45:00,12:30:00,0,1185,0,0,0,1752,0,0,CCU,BLR,1546.4372901474003,0,0,0,0,0,0,0,0,0,0,5,15,20,2,1,1,2,2,0,0,2,0,Kolkata_Banglore,2871,1,16,0,0,78.30062228594431,0.7662774349466511,1,0
Air Asia,24/03/2019,Banglore,New Delhi,BLR → DEL,23:25,02:10 28 Mar,2h 45m,non-stop,No info,4482,2019-03-24,23:25:00,02:10:00,0,165,1,0,1,319,0,0,BLR,DEL,1708.6520853536679,0,0,0,0,1,0,0,0,0,1,3,24,12,1,1,1,3,0,0,1,0,1,Banglore_New Delhi,932,0,7,0,1,621.3280310376974,0.09656734768555719,1,0
IndiGo,1/06/2019,Delhi,Cochin,DEL → HYD → COK,06:50,16:10,9h 20m,1 stop,No info,6442,2019-06-01,06:50:00,16:10:00,0,560,1,1,0,2053,0,0,DEL,COK,2047.882109458646,0,1,0,0,0,0,0,0,0,1,6,1,22,2,1,0,1,2,1,0,1,0,Delhi_Cochin,4537,0,29,1,0,219.41594029914066,0.27345324099151147,1,0
Jet Airways,12/05/2019,Banglore,Delhi,BLR → DEL,08:20,11:20,3h,non-stop,In-flight meal not included,6144,2019-05-12,08:20:00,11:20:00,0,180,1,1,0,3849,0,0,BLR,DEL,1708.6520853536679,0,0,0,0,0,0,0,0,0,0,5,12,19,2,1,1,1,1,1,0,0,1,Banglore_Delhi,1265,1,19,0,0,569.5506951178893,0.10534619747515331,1,0
Jet Airways,27/05/2019,Delhi,Cochin,DEL → JAI → BOM → COK,09:40,12:35 28 May,26h 55m,2 stops,No info,15129,2019-05-27,09:40:00,12:35:00,0,1615,0,0,0,3849,0,0,DEL,COK,2047.882109458646,0,0,0,0,0,0,0,0,0,0,5,27,22,2,1,1,1,2,1,0,2,0,Delhi_Cochin,4537,0,4,0,1,76.08230747214783,0.7886196146451625,1,0
Air India,21/05/2019,Delhi,Cochin,DEL → GOI → BOM → COK,22:00,19:15 22 May,21h 15m,2 stops,No info,10231,2019-05-21,22:00:00,19:15:00,0,1275,0,0,1,1752,0,0,DEL,COK,2047.882109458646,0,0,0,0,0,0,0,0,0,0,5,21,21,2,1,1,3,3,0,1,2,0,Delhi_Cochin,4537,0,10,0,1,96.37092279805394,0.622594432614602,1,0
IndiGo,3/04/2019,Banglore,Delhi,BLR → DEL,20:00,22:50,2h 50m,non-stop,No info,4823,2019-04-03,20:00:00,22:50:00,0,170,0,1,0,2053,0,0,BLR,DEL,1708.6520853536679,0,0,0,0,0,0,0,0,0,0,4,3,14,2,1,1,3,3,0,1,0,1,Banglore_Delhi,1265,1,27,1,0,603.0536771836476,0.0994936309487559,1,0
IndiGo,9/06/2019,Banglore,Delhi,BLR → DEL,08:30,11:20,2h 50m,non-stop,No info,4823,2019-06-09,08:30:00,11:20:00,0,170,1,1,0,2053,0,0,BLR,DEL,1708.6520853536679,0,1,0,0,0,0,0,0,0,1,6,9,23,2,1,0,1,1,1,0,0,1,Banglore_Delhi,1265,1,21,1,0,603.0536771836476,0.0994936309487559,1,0
Jet Airways,21/05/2019,Delhi,Cochin,DEL → BOM → COK,11:30,04:25 22 May,16h 55m,1 stop,In-flight meal not included,12898,2019-05-21,11:30:00,04:25:00,0,1015,0,0,1,3849,0,0,DEL,COK,2047.882109458646,0,0,0,0,0,0,0,0,0,0,5,21,21,2,1,1,1,0,1,0,1,0,Delhi_Cochin,4537,0,10,0,1,121.05707050987071,0.49563399929711455,1,0
Jet Airways,1/05/2019,Mumbai,Hyderabad,BOM → HYD,19:35,21:05,1h 30m,non-stop,No info,5678,2019-05-01,19:35:00,21:05:00,0,90,0,1,0,3849,0,0,BOM,HYD,622.9702752863186,0,0,0,0,0,0,0,0,0,0,5,1,18,2,1,1,3,3,0,1,0,1,Mumbai_Hyderabad,697,1,30,1,0,415.3135168575457,0.14446917223881314,0,0
Air India,9/03/2019,Delhi,Cochin,DEL → BHO → BOM → COK,05:55,07:40 10 Mar,25h 45m,2 stops,No info,14483,2019-03-09,05:55:00,07:40:00,0,1545,1,0,0,1752,0,0,DEL,COK,2047.882109458646,0,0,0,0,0,0,0,0,0,0,3,9,10,1,1,1,0,1,0,0,2,0,Delhi_Cochin,4537,0,22,1,0,79.52940230907363,0.7544379595212236,1,0
Jet Airways,15/05/2019,Mumbai,Hyderabad,BOM → HYD,19:35,21:05,1h 30m,non-stop,In-flight meal not included,2228,2019-05-15,19:35:00,21:05:00,0,90,0,1,0,3849,0,0,BOM,HYD,622.9702752863186,0,0,0,0,0,0,0,0,0,0,5,15,20,2,1,1,3,3,0,1,0,1,Mumbai_Hyderabad,697,1,16,0,0,415.3135168575457,0.14446917223881314,0,0
Multiple carriers,15/06/2019,Delhi,Cochin,DEL → HYD → COK,13:15,22:30,9h 15m,1 stop,No info,8018,2019-06-15,13:15:00,22:30:00,0,555,1,1,0,1196,0,0,DEL,COK,2047.882109458646,0,0,0,0,0,0,0,0,0,0,6,15,24,2,1,0,2,3,0,0,1,0,Delhi_Cochin,4537,0,15,0,0,221.3926604820158,0.2710116941969444,1,0
Multiple carriers,6/03/2019,Delhi,Cochin,DEL → BOM → COK,09:55,21:00,11h 5m,1 stop,In-flight meal not included,15136,2019-03-06,09:55:00,21:00:00,0,665,0,1,0,1196,0,0,DEL,COK,2047.882109458646,0,0,0,0,0,0,0,0,0,0,3,6,10,1,1,1,1,3,1,0,1,0,Delhi_Cochin,4537,0,25,1,0,184.77131814664477,0.32472572367741986,1,0
SpiceJet,24/04/2019,Delhi,Cochin,DEL → MAA → COK,15:45,22:05,6h 20m,1 stop,No info,5583,2019-04-24,15:45:00,22:05:00,0,380,0,1,0,818,0,0,DEL,COK,2047.882109458646,0,0,0,0,0,0,0,0,0,0,4,24,17,2,1,1,2,3,0,0,1,0,Delhi_Cochin,4537,0,6,0,1,323.3498067566283,0.18555755638709706,1,0
Air India,12/06/2019,Delhi,Cochin,DEL → CCU → BOM → COK,14:25,19:15 13 Jun,28h 50m,2 stops,No info,13381,2019-06-12,14:25:00,19:15:00,0,1730,0,0,0,1752,0,0,DEL,COK,2047.882109458646,0,0,0,0,0,0,0,0,0,0,6,12,24,2,1,0,2,3,0,0,2,0,Delhi_Cochin,4537,0,18,0,0,71.02481304480852,0.844775190920205,1,0
Air India,15/03/2019,Banglore,New Delhi,BLR → COK → DEL,06:55,10:50 16 Mar,27h 55m,1 stop,No info,7932,2019-03-15,06:55:00,10:50:00,0,1675,0,0,0,1752,0,0,BLR,DEL,1708.6520853536679,0,0,0,0,1,0,0,0,0,1,3,15,11,1,1,1,1,1,1,0,1,0,Banglore_New Delhi,932,0,16,0,0,61.20544783356423,0.9803048931715656,1,0
Jet Airways,9/05/2019,Kolkata,Banglore,CCU → BOM → BLR,20:00,08:15 10 May,12h 15m,1 stop,In-flight meal not included,7757,2019-05-09,20:00:00,08:15:00,0,735,0,0,0,3849,0,0,CCU,BLR,1546.4372901474003,0,0,0,0,0,0,0,0,0,0,5,9,19,2,1,1,3,1,0,1,1,0,Kolkata_Banglore,2871,1,22,1,0,126.23977878754287,0.47528600395425197,1,0
Jet Airways,18/05/2019,Delhi,Cochin,DEL → JAI → BOM → COK,05:30,04:25 19 May,22h 55m,2 stops,In-flight meal not included,13029,2019-05-18,05:30:00,04:25:00,0,1375,1,0,1,3849,0,0,DEL,COK,2047.882109458646,0,0,0,0,0,0,0,0,0,0,5,18,20,2,1,1,0,0,0,0,2,0,Delhi_Cochin,4537,0,13,0,0,89.36212841274092,0.6714253685059434,1,0
SpiceJet,9/06/2019,Kolkata,Banglore,CCU → BLR,06:55,09:30,2h 35m,non-stop,No check-in baggage included,3841,2019-06-09,06:55:00,09:30:00,0,155,1,1,0,818,0,0,CCU,BLR,1546.4372901474003,0,1,0,0,0,0,0,0,0,1,6,9,23,2,1,0,1,1,1,0,0,1,Kolkata_Banglore,2871,1,21,1,0,598.6208865086711,0.10023038178627082,1,0
Air India,03/03/2019,Banglore,New Delhi,BLR → DEL,13:20,16:10,2h 50m,non-stop,No info,10216,2019-03-03,13:20:00,16:10:00,0,170,1,1,0,1752,0,0,BLR,DEL,1708.6520853536679,0,0,0,0,0,0,0,0,0,0,3,3,9,1,1,1,2,2,0,0,0,1,Banglore_New Delhi,932,0,28,1,0,603.0536771836476,0.0994936309487559,1,0
Air India,21/05/2019,Mumbai,Hyderabad,BOM → HYD,21:05,22:25,1h 20m,non-stop,No info,3100,2019-05-21,21:05:00,22:25:00,0,80,0,1,1,1752,0,0,BOM,HYD,622.9702752863186,0,0,0,0,0,0,0,0,0,0,5,21,21,2,1,1,3,3,0,1,0,1,Mumbai_Hyderabad,697,1,10,0,1,467.22770646473896,0.12841704199005613,0,0
Air India,21/03/2019,Delhi,Cochin,DEL → HYD → BOM → COK,17:15,19:15 22 Mar,26h,2 stops,No info,8245,2019-03-21,17:15:00,19:15:00,0,1560,0,0,0,1752,0,0,DEL,COK,2047.882109458646,0,0,0,0,1,0,0,0,0,1,3,21,12,1,1,1,2,3,0,0,2,0,Delhi_Cochin,4537,0,10,0,1,78.76469651764023,0.7617625999049248,1,0
Air India,01/03/2019,Banglore,New Delhi,BLR → CCU → DEL,11:05,19:50,8h 45m,1 stop,1 Long layover,14594,2019-03-01,11:05:00,19:50:00,0,525,0,1,0,1752,0,0,BLR,DEL,1708.6520853536679,0,0,0,0,0,0,0,0,0,0,3,1,9,1,1,1,1,3,1,0,1,0,Banglore_New Delhi,932,0,30,1,0,195.27452404041918,0.3072597426358638,1,0
Jet Airways,1/06/2019,Delhi,Cochin,DEL → BDQ → BOM → COK,18:25,12:35 02 Jun,18h 10m,2 stops,No info,14237,2019-06-01,18:25:00,12:35:00,0,1090,1,0,0,3849,0,0,DEL,COK,2047.882109458646,0,1,0,0,0,0,0,0,0,1,6,1,22,2,1,0,3,2,0,1,2,0,Delhi_Cochin,4537,0,29,1,0,112.72745556653098,0.5322572012156206,1,0
Air India,21/05/2019,Kolkata,Banglore,CCU → JAI → DEL → BLR,08:20,23:15,14h 55m,2 stops,No info,13164,2019-05-21,08:20:00,23:15:00,0,895,0,1,0,1752,0,0,CCU,BLR,1546.4372901474003,0,0,0,0,0,0,0,0,0,0,5,21,21,2,1,1,1,3,1,0,2,0,Kolkata_Banglore,2871,1,10,0,1,103.6717736411665,0.5787496238626606,1,0
Jet Airways,9/06/2019,Delhi,Cochin,DEL → BOM → COK,20:55,04:25 10 Jun,7h 30m,1 stop,No info,14924,2019-06-09,20:55:00,04:25:00,0,450,1,0,1,3849,0,0,DEL,COK,2047.882109458646,0,1,0,0,0,0,0,0,0,1,6,9,23,2,1,0,3,0,0,1,1,0,Delhi_Cochin,4537,0,21,1,0,273.0509479278195,0.219739211511036,1,0
Jet Airways,21/05/2019,Kolkata,Banglore,CCU → BOM → BLR,21:10,16:20 22 May,19h 10m,1 stop,In-flight meal not included,10844,2019-05-21,21:10:00,16:20:00,0,1150,0,0,1,3849,0,0,CCU,BLR,1546.4372901474003,0,0,0,0,0,0,0,0,0,0,5,21,21,2,1,1,3,2,0,1,1,0,Kolkata_Banglore,2871,1,10,0,1,80.68368470334262,0.7436447680916868,1,0
Jet Airways,6/05/2019,Kolkata,Banglore,CCU → GAU → BLR,10:20,17:35,7h 15m,1 stop,In-flight meal not included,7064,2019-05-06,10:20:00,17:35:00,0,435,0,1,0,3849,0,0,CCU,BLR,1546.4372901474003,0,0,0,0,0,0,0,0,0,0,5,6,19,2,1,1,1,2,1,0,1,0,Kolkata_Banglore,2871,1,25,1,0,213.3016951927449,0.28129171662598584,1,0
Vistara,24/05/2019,Kolkata,Banglore,CCU → DEL → BLR,07:10,18:50,11h 40m,1 stop,No info,9555,2019-05-24,07:10:00,18:50:00,0,700,0,1,0,479,0,0,CCU,BLR,1546.4372901474003,0,0,0,0,0,0,0,0,0,0,5,24,21,2,1,1,1,3,1,0,1,0,Kolkata_Banglore,2871,1,7,0,1,132.55176772692005,0.45265333709928757,1,0
Multiple carriers,24/06/2019,Delhi,Cochin,DEL → BOM → COK,10:35,19:15,8h 40m,1 stop,No info,7155,2019-06-24,10:35:00,19:15:00,0,520,0,1,0,1196,0,0,DEL,COK,2047.882109458646,0,0,0,0,0,0,0,0,0,0,6,24,26,2,1,0,1,3,1,0,1,0,Delhi_Cochin,4537,0,6,0,1,236.2940895529207,0.25392086663497493,1,0
Multiple carriers,9/06/2019,Delhi,Cochin,DEL → BOM → COK,08:00,19:00,11h,1 stop,No info,12192,2019-06-09,08:00:00,19:00:00,0,660,1,1,0,1196,0,0,DEL,COK,2047.882109458646,0,1,0,0,0,0,0,0,0,1,6,9,23,2,1,0,1,3,1,0,1,0,Delhi_Cochin,4537,0,21,1,0,186.1711008598769,0.3222841768828528,1,0
Air Asia,18/05/2019,Delhi,Cochin,DEL → BLR → COK,16:45,07:10 19 May,14h 25m,1 stop,No info,7353,2019-05-18,16:45:00,07:10:00,0,865,1,0,0,319,0,0,DEL,COK,2047.882109458646,0,0,0,0,0,0,0,0,0,0,5,18,20,2,1,1,2,1,0,0,1,0,Delhi_Cochin,4537,0,13,0,0,142.04962608961705,0.4223875954601025,1,0
IndiGo,27/06/2019,Delhi,Cochin,DEL → HYD → COK,07:35,12:10,4h 35m,1 stop,No info,5054,2019-06-27,07:35:00,12:10:00,0,275,0,1,0,2053,0,0,DEL,COK,2047.882109458646,0,0,0,0,0,0,0,0,0,0,6,27,26,2,1,0,1,2,1,0,1,0,Delhi_Cochin,4537,0,3,0,1,446.8106420637046,0.13428507370118867,1,0
Multiple carriers,15/06/2019,Delhi,Cochin,DEL → IXU → BOM → COK,17:50,01:30 16 Jun,7h 40m,2 stops,No info,18485,2019-06-15,17:50:00,01:30:00,0,460,1,0,1,1196,0,0,DEL,COK,2047.882109458646,0,0,0,0,0,0,0,0,0,0,6,15,24,2,1,0,2,0,0,0,2,0,Delhi_Cochin,4537,0,15,0,0,267.1150577554756,0.22462230510017014,1,0
Jet Airways,6/06/2019,Kolkata,Banglore,CCU → BOM → BLR,06:30,18:15,11h 45m,1 stop,In-flight meal not included,10844,2019-06-06,06:30:00,18:15:00,0,705,0,1,0,3849,0,0,CCU,BLR,1546.4372901474003,0,1,0,0,0,0,0,0,0,1,6,6,23,2,1,0,1,3,1,0,1,0,Kolkata_Banglore,2871,1,24,1,0,131.61168426786386,0.45588657522142534,1,0
Jet Airways,18/05/2019,Banglore,Delhi,BLR → DEL,08:20,11:20,3h,non-stop,In-flight meal not included,6144,2019-05-18,08:20:00,11:20:00,0,180,1,1,0,3849,0,0,BLR,DEL,1708.6520853536679,0,0,0,0,0,0,0,0,0,0,5,18,20,2,1,1,1,1,1,0,0,1,Banglore_Delhi,1265,1,13,0,0,569.5506951178893,0.10534619747515331,1,0
IndiGo,1/05/2019,Mumbai,Hyderabad,BOM → HYD,19:05,20:35,1h 30m,non-stop,No info,2754,2019-05-01,19:05:00,20:35:00,0,90,0,1,0,2053,0,0,BOM,HYD,622.9702752863186,0,0,0,0,0,0,0,0,0,0,5,1,18,2,1,1,3,3,0,1,0,1,Mumbai_Hyderabad,697,1,30,1,0,415.3135168575457,0.14446917223881314,0,0
Multiple carriers,27/03/2019,Delhi,Cochin,DEL → BOM → COK,15:05,01:35 28 Mar,10h 30m,1 stop,No info,12327,2019-03-27,15:05:00,01:35:00,0,630,0,0,1,1196,0,0,DEL,COK,2047.882109458646,0,0,0,0,0,0,0,0,0,0,3,27,13,1,1,1,2,0,0,0,1,0,Delhi_Cochin,4537,0,4,0,1,195.0363913770139,0.3076348961154504,1,0
SpiceJet,6/05/2019,Kolkata,Banglore,CCU → BLR,06:55,09:30,2h 35m,non-stop,No check-in baggage included,3841,2019-05-06,06:55:00,09:30:00,0,155,0,1,0,818,0,0,CCU,BLR,1546.4372901474003,0,0,0,0,0,0,0,0,0,0,5,6,19,2,1,1,1,1,1,0,0,1,Kolkata_Banglore,2871,1,25,1,0,598.6208865086711,0.10023038178627082,1,0
Jet Airways,18/05/2019,Delhi,Cochin,DEL → BOM → COK,22:50,04:25 19 May,5h 35m,1 stop,In-flight meal not included,12373,2019-05-18,22:50:00,04:25:00,0,335,1,0,1,3849,0,0,DEL,COK,2047.882109458646,0,0,0,0,0,0,0,0,0,0,5,18,20,2,1,1,3,0,0,1,1,0,Delhi_Cochin,4537,0,13,0,0,366.78485542542916,0.16358363523599348,1,0
Air India,21/05/2019,Delhi,Cochin,DEL → GOI → BOM → COK,22:00,19:15 22 May,21h 15m,2 stops,No info,10231,2019-05-21,22:00:00,19:15:00,0,1275,0,0,1,1752,0,0,DEL,COK,2047.882109458646,0,0,0,0,0,0,0,0,0,0,5,21,21,2,1,1,3,3,0,1,2,0,Delhi_Cochin,4537,0,10,0,1,96.37092279805394,0.622594432614602,1,0
IndiGo,21/05/2019,Delhi,Cochin,DEL → BOM → COK,09:15,21:00,11h 45m,1 stop,No info,7318,2019-05-21,09:15:00,21:00:00,0,705,0,1,0,2053,0,0,DEL,COK,2047.882109458646,0,0,0,0,0,0,0,0,0,0,5,21,21,2,1,1,1,3,1,0,1,0,Delhi_Cochin,4537,0,10,0,1,174.2878391028635,0.3442580980339564,1,0
Jet Airways,06/03/2019,Banglore,New Delhi,BLR → BOM → DEL,11:40,07:40 07 Mar,20h,1 stop,No info,16736,2019-03-06,11:40:00,07:40:00,0,1200,0,0,0,3849,0,0,BLR,DEL,1708.6520853536679,0,0,0,0,0,0,0,0,0,0,3,6,10,1,1,1,1,1,1,0,1,0,Banglore_New Delhi,932,0,25,1,0,85.43260426768339,0.7023079831676887,1,0
IndiGo,9/06/2019,Delhi,Cochin,DEL → LKO → COK,21:50,03:35 10 Jun,5h 45m,1 stop,No info,6195,2019-06-09,21:50:00,03:35:00,0,345,1,0,1,2053,0,0,DEL,COK,2047.882109458646,0,1,0,0,0,0,0,0,0,1,6,9,23,2,1,0,3,0,0,1,1,0,Delhi_Cochin,4537,0,21,1,0,356.1534103406341,0.1684667288251276,1,0
SpiceJet,6/06/2019,Mumbai,Hyderabad,BOM → HYD,05:45,07:15,1h 30m,non-stop,No info,2753,2019-06-06,05:45:00,07:15:00,0,90,0,1,0,818,0,0,BOM,HYD,622.9702752863186,0,1,0,0,0,0,0,0,0,1,6,6,23,2,1,0,0,1,0,0,0,1,Mumbai_Hyderabad,697,1,24,1,0,415.3135168575457,0.14446917223881314,0,0
SpiceJet,24/03/2019,Chennai,Kolkata,MAA → CCU,09:30,12:05,2h 35m,non-stop,No check-in baggage included,3807,2019-03-24,09:30:00,12:05:00,0,155,1,1,0,818,0,0,MAA,CCU,1385.198425287915,0,0,0,0,1,0,0,0,0,1,3,24,12,1,1,1,1,2,1,0,0,1,Chennai_Kolkata,381,1,7,0,1,536.2058420469348,0.11189732616667038,1,0
Jet Airways,3/03/2019,Delhi,Cochin,DEL → IDR → BOM → COK,05:25,04:25 05 Mar,47h,2 stops,No info,20064,2019-03-03,05:25:00,04:25:00,0,2820,1,0,1,3849,0,0,DEL,COK,2047.882109458646,0,0,0,0,0,0,0,0,0,0,3,3,9,1,1,1,0,0,0,0,2,0,Delhi_Cochin,4537,0,28,1,0,43.571959775715875,1.3770323921358256,1,0
IndiGo,21/06/2019,Delhi,Cochin,DEL → COK,21:05,00:20 22 Jun,3h 15m,non-stop,No info,5406,2019-06-21,21:05:00,00:20:00,0,195,0,0,1,2053,0,0,DEL,COK,2047.882109458646,0,0,0,0,0,0,0,0,0,0,6,21,25,2,1,0,3,0,0,1,0,1,Delhi_Cochin,4537,0,9,0,1,630.1175721411219,0.0952203249881156,1,0
Air India,1/06/2019,Delhi,Cochin,DEL → GOI → BOM → COK,22:00,19:15 02 Jun,21h 15m,2 stops,No info,10441,2019-06-01,22:00:00,19:15:00,0,1275,1,0,1,1752,0,0,DEL,COK,2047.882109458646,0,1,0,0,0,0,0,0,0,1,6,1,22,2,1,0,3,3,0,1,2,0,Delhi_Cochin,4537,0,29,1,0,96.37092279805394,0.622594432614602,1,0
Jet Airways,6/05/2019,Kolkata,Banglore,CCU → DEL → BLR,20:25,09:45 07 May,13h 20m,1 stop,In-flight meal not included,8066,2019-05-06,20:25:00,09:45:00,0,800,0,0,0,3849,0,0,CCU,BLR,1546.4372901474003,0,0,0,0,0,0,0,0,0,0,5,6,19,2,1,1,3,1,0,1,1,0,Kolkata_Banglore,2871,1,25,1,0,115.98279676105501,0.517318099542043,1,0
Air India,27/06/2019,Banglore,Delhi,BLR → DEL,17:00,19:45,2h 45m,non-stop,No info,6961,2019-06-27,17:00:00,19:45:00,0,165,0,1,0,1752,0,0,BLR,DEL,1708.6520853536679,0,0,0,0,0,0,0,0,0,0,6,27,26,2,1,0,2,3,0,0,0,1,Banglore_Delhi,1265,1,3,0,1,621.3280310376974,0.09656734768555719,1,0
Vistara,21/03/2019,Delhi,Cochin,DEL → COK,14:55,17:50,2h 55m,non-stop,No info,5586,2019-03-21,14:55:00,17:50:00,0,175,0,1,0,479,0,0,DEL,COK,2047.882109458646,0,0,0,0,1,0,0,0,0,1,3,21,12,1,1,1,2,2,0,0,0,1,Delhi_Cochin,4537,0,10,0,1,702.1310089572501,0.08545413780984733,1,0
Air India,1/06/2019,Delhi,Cochin,DEL → BLR → COK,17:40,23:00,5h 20m,1 stop,No info,7384,2019-06-01,17:40:00,23:00:00,0,320,1,1,0,1752,0,0,DEL,COK,2047.882109458646,0,1,0,0,0,0,0,0,0,1,6,1,22,2,1,0,2,3,0,0,1,0,Delhi_Cochin,4537,0,29,1,0,383.9778955234961,0.15625899485229228,1,0
Jet Airways,01/03/2019,Banglore,New Delhi,BLR → BOM → DEL,11:40,09:00 02 Mar,21h 20m,1 stop,No info,20800,2019-03-01,11:40:00,09:00:00,0,1280,0,0,0,3849,0,0,BLR,DEL,1708.6520853536679,0,0,0,0,0,0,0,0,0,0,3,1,9,1,1,1,1,1,1,0,1,0,Banglore_New Delhi,932,0,30,1,0,80.09306650095317,0.7491285153788679,1,0
Jet Airways,12/05/2019,Kolkata,Banglore,CCU → BOM → BLR,06:30,12:00,5h 30m,1 stop,No info,13941,2019-05-12,06:30:00,12:00:00,0,330,1,1,0,3849,0,0,CCU,BLR,1546.4372901474003,0,0,0,0,0,0,0,0,0,0,5,12,19,2,1,1,1,2,1,0,1,0,Kolkata_Banglore,2871,1,19,0,0,281.17041639043646,0.21339371606109273,1,0
Jet Airways,3/05/2019,Banglore,Delhi,BLR → DEL,08:20,11:20,3h,non-stop,In-flight meal not included,5198,2019-05-03,08:20:00,11:20:00,0,180,0,1,0,3849,0,0,BLR,DEL,1708.6520853536679,0,0,0,0,0,0,0,0,0,0,5,3,18,2,1,1,1,1,1,0,0,1,Banglore_Delhi,1265,1,28,1,0,569.5506951178893,0.10534619747515331,1,0
SpiceJet,18/03/2019,Chennai,Kolkata,MAA → CCU,09:30,12:05,2h 35m,non-stop,No check-in baggage included,3807,2019-03-18,09:30:00,12:05:00,0,155,0,1,0,818,0,0,MAA,CCU,1385.198425287915,0,0,0,0,1,0,0,0,0,1,3,18,12,1,1,1,1,2,1,0,0,1,Chennai_Kolkata,381,1,13,0,0,536.2058420469348,0.11189732616667038,1,0
Multiple carriers,3/03/2019,Delhi,Cochin,DEL → HYD → COK,09:45,22:20,12h 35m,1 stop,No info,13838,2019-03-03,09:45:00,22:20:00,0,755,1,1,0,1196,0,0,DEL,COK,2047.882109458646,0,0,0,0,0,0,0,0,0,0,3,3,9,1,1,1,1,3,1,0,1,0,Delhi_Cochin,4537,0,28,1,0,162.74559810267385,0.3686735659796271,1,0
Air India,24/06/2019,Delhi,Cochin,DEL → HYD → MAA → COK,07:05,09:25 25 Jun,26h 20m,2 stops,No info,11185,2019-06-24,07:05:00,09:25:00,0,1580,0,0,0,1752,0,0,DEL,COK,2047.882109458646,0,0,0,0,0,0,0,0,0,0,6,24,26,2,1,0,1,1,1,0,2,0,Delhi_Cochin,4537,0,6,0,1,77.7676750427334,0.7715287870831931,1,0
Jet Airways,21/06/2019,Banglore,Delhi,BLR → DEL,15:15,18:10,2h 55m,non-stop,In-flight meal not included,7229,2019-06-21,15:15:00,18:10:00,0,175,0,1,0,3849,0,0,BLR,DEL,1708.6520853536679,0,0,0,0,0,0,0,0,0,0,6,21,25,2,1,0,2,3,0,0,0,1,Banglore_Delhi,1265,1,9,0,1,585.8235721212576,0.10241991421195461,1,0
Jet Airways,12/06/2019,Delhi,Cochin,DEL → BOM → COK,21:50,04:25 13 Jun,6h 35m,1 stop,In-flight meal not included,10262,2019-06-12,21:50:00,04:25:00,0,395,0,0,1,3849,0,0,DEL,COK,2047.882109458646,0,0,0,0,0,0,0,0,0,0,6,12,24,2,1,0,3,0,0,1,1,0,Delhi_Cochin,4537,0,18,0,0,311.0707001709336,0.19288219677079826,1,0
Air Asia,9/03/2019,Kolkata,Banglore,CCU → BLR,19:35,22:05,2h 30m,non-stop,No info,4384,2019-03-09,19:35:00,22:05:00,0,150,1,1,0,319,0,0,CCU,BLR,1546.4372901474003,0,0,0,0,0,0,0,0,0,0,3,9,10,1,1,1,3,3,0,1,0,1,Kolkata_Banglore,2871,1,22,1,0,618.5749160589601,0.09699714366413306,1,0
Jet Airways,27/06/2019,Delhi,Cochin,DEL → AMD → BOM → COK,13:25,12:35 28 Jun,23h 10m,2 stops,No info,12819,2019-06-27,13:25:00,12:35:00,0,1390,0,0,0,3849,0,0,DEL,COK,2047.882109458646,0,0,0,0,0,0,0,0,0,0,6,27,26,2,1,0,2,2,0,0,2,0,Delhi_Cochin,4537,0,3,0,1,88.39778889749552,0.6787500088896445,1,0
Jet Airways,6/05/2019,Kolkata,Banglore,CCU → BOM → BLR,21:10,10:05 07 May,12h 55m,1 stop,In-flight meal not included,7757,2019-05-06,21:10:00,10:05:00,0,775,0,0,1,3849,0,0,CCU,BLR,1546.4372901474003,0,0,0,0,0,0,0,0,0,0,5,6,19,2,1,1,3,1,0,1,1,0,Kolkata_Banglore,2871,1,25,1,0,119.72417730173422,0.5011519089313541,1,0
Air India,21/04/2019,Delhi,Cochin,DEL → BLR → COK,20:30,23:00 22 Apr,26h 30m,1 stop,No info,7174,2019-04-21,20:30:00,23:00:00,0,1590,1,0,0,1752,0,0,DEL,COK,2047.882109458646,0,0,0,0,0,0,0,0,0,0,4,21,16,2,1,1,3,3,0,1,1,0,Delhi_Cochin,4537,0,9,0,1,77.2785701682508,0.7764118806723272,1,0
IndiGo,1/06/2019,Delhi,Cochin,DEL → HYD → COK,11:55,22:30,10h 35m,1 stop,No info,6674,2019-06-01,11:55:00,22:30:00,0,635,1,1,0,2053,0,0,DEL,COK,2047.882109458646,0,1,0,0,0,0,0,0,0,1,6,1,22,2,1,0,1,3,1,0,1,0,Delhi_Cochin,4537,0,29,1,0,193.50067175987206,0.31007644291001746,1,0
IndiGo,18/05/2019,Mumbai,Hyderabad,BOM → HYD,20:05,21:40,1h 35m,non-stop,No info,2227,2019-05-18,20:05:00,21:40:00,0,95,1,1,0,2053,0,0,BOM,HYD,622.9702752863186,0,0,0,0,0,0,0,0,0,0,5,18,20,2,1,1,3,3,0,1,0,1,Mumbai_Hyderabad,697,1,13,0,0,393.4549107071486,0.15249523736319165,0,0
Jet Airways,12/06/2019,Delhi,Cochin,DEL → JAI → BOM → COK,19:30,12:35 13 Jun,17h 5m,2 stops,No info,13014,2019-06-12,19:30:00,12:35:00,0,1025,0,0,0,3849,0,0,DEL,COK,2047.882109458646,0,0,0,0,0,0,0,0,0,0,6,12,24,2,1,0,3,2,0,1,2,0,Delhi_Cochin,4537,0,18,0,0,119.87602591953049,0.5005170928862487,1,0
IndiGo,21/03/2019,Mumbai,Hyderabad,BOM → HYD,16:55,18:25,1h 30m,non-stop,No info,3175,2019-03-21,16:55:00,18:25:00,0,90,0,1,0,2053,0,0,BOM,HYD,622.9702752863186,0,0,0,0,1,0,0,0,0,1,3,21,12,1,1,1,2,3,0,0,0,1,Mumbai_Hyderabad,697,1,10,0,1,415.3135168575457,0.14446917223881314,0,0
IndiGo,1/03/2019,Kolkata,Banglore,CCU → BLR,09:35,12:20,2h 45m,non-stop,No info,6565,2019-03-01,09:35:00,12:20:00,0,165,0,1,0,2053,0,0,CCU,BLR,1546.4372901474003,0,0,0,0,0,0,0,0,0,0,3,1,9,1,1,1,1,2,1,0,0,1,Kolkata_Banglore,2871,1,30,1,0,562.3408327808729,0.10669685803054636,1,0
Jet Airways,1/04/2019,Kolkata,Banglore,CCU → BOM → BLR,18:55,23:35 02 Apr,28h 40m,1 stop,No info,12681,2019-04-01,18:55:00,23:35:00,0,1720,0,0,0,3849,0,0,CCU,BLR,1546.4372901474003,0,0,0,0,0,0,0,0,0,0,4,1,14,2,1,1,3,3,0,1,1,0,Kolkata_Banglore,2871,1,29,1,0,53.94548686560698,1.1122339140153923,1,0
Vistara,1/06/2019,Chennai,Kolkata,MAA → CCU,07:05,09:20,2h 15m,non-stop,No info,3687,2019-06-01,07:05:00,09:20:00,0,135,1,1,0,479,0,0,MAA,CCU,1385.198425287915,0,1,0,0,0,0,0,0,0,1,6,1,22,2,1,0,1,1,1,0,0,1,Chennai_Kolkata,381,1,29,1,0,615.6437445724066,0.09745896150000323,1,0
Jet Airways,15/06/2019,Mumbai,Hyderabad,BOM → HYD,19:35,21:05,1h 30m,non-stop,In-flight meal not included,3210,2019-06-15,19:35:00,21:05:00,0,90,1,1,0,3849,0,0,BOM,HYD,622.9702752863186,0,0,0,0,0,0,0,0,0,0,6,15,24,2,1,0,3,3,0,1,0,1,Mumbai_Hyderabad,697,1,15,0,0,415.3135168575457,0.14446917223881314,0,0
IndiGo,6/03/2019,Kolkata,Banglore,CCU → BLR,20:25,23:05,2h 40m,non-stop,No info,4778,2019-03-06,20:25:00,23:05:00,0,160,0,1,0,2053,0,0,CCU,BLR,1546.4372901474003,0,0,0,0,0,0,0,0,0,0,3,6,10,1,1,1,3,3,0,1,0,1,Kolkata_Banglore,2871,1,25,1,0,579.913983805275,0.10346361990840859,1,0
Multiple carriers,3/06/2019,Delhi,Cochin,DEL → BOM → COK,11:25,19:00,7h 35m,1 stop,No info,10877,2019-06-03,11:25:00,19:00:00,0,455,0,1,0,1196,0,0,DEL,COK,2047.882109458646,0,1,0,0,0,0,0,0,0,1,6,3,23,2,1,0,1,3,1,0,1,0,Delhi_Cochin,4537,0,27,1,0,270.05038806048077,0.22218075830560308,1,0
Vistara,24/05/2019,Kolkata,Banglore,CCU → DEL → BLR,20:20,10:45 25 May,14h 25m,1 stop,No info,9187,2019-05-24,20:20:00,10:45:00,0,865,0,0,0,479,0,0,CCU,BLR,1546.4372901474003,0,0,0,0,0,0,0,0,0,0,5,24,21,2,1,1,3,1,0,1,1,0,Kolkata_Banglore,2871,1,7,0,1,107.26732648421275,0.559350195129834,1,0
Air India,15/03/2019,Banglore,New Delhi,BLR → COK → DEL,22:00,23:20 16 Mar,25h 20m,1 stop,No info,6850,2019-03-15,22:00:00,23:20:00,0,1520,0,0,1,1752,0,0,BLR,DEL,1708.6520853536679,0,0,0,0,1,0,0,0,0,1,3,15,11,1,1,1,3,3,0,1,1,0,Banglore_New Delhi,932,0,16,0,0,67.44679284290794,0.8895901120124057,1,0
Jet Airways,12/05/2019,Kolkata,Banglore,CCU → BOM → BLR,08:25,18:15,9h 50m,1 stop,No info,14781,2019-05-12,08:25:00,18:15:00,0,590,1,1,0,3849,0,0,CCU,BLR,1546.4372901474003,0,0,0,0,0,0,0,0,0,0,5,12,19,2,1,1,1,3,1,0,1,0,Kolkata_Banglore,2871,1,19,0,0,157.26480916753223,0.3815220984122567,1,0
Air India,6/05/2019,Kolkata,Banglore,CCU → GAU → DEL → BLR,16:45,08:55 07 May,16h 10m,2 stops,No info,13227,2019-05-06,16:45:00,08:55:00,0,970,0,0,0,1752,0,0,CCU,BLR,1546.4372901474003,0,0,0,0,0,0,0,0,0,0,5,6,19,2,1,1,2,1,0,0,2,0,Kolkata_Banglore,2871,1,25,1,0,95.65591485447837,0.6272481956947271,1,0
Vistara,9/05/2019,Banglore,Delhi,BLR → DEL,07:00,09:40,2h 40m,non-stop,No info,4668,2019-05-09,07:00:00,09:40:00,0,160,0,1,0,479,0,0,BLR,DEL,1708.6520853536679,0,0,0,0,0,0,0,0,0,0,5,9,19,2,1,1,1,1,1,0,0,1,Banglore_Delhi,1265,1,22,1,0,640.7445320076254,0.09364106442235849,1,0
Jet Airways,24/05/2019,Kolkata,Banglore,CCU → BOM → BLR,06:30,12:00,5h 30m,1 stop,No info,14178,2019-05-24,06:30:00,12:00:00,0,330,0,1,0,3849,0,0,CCU,BLR,1546.4372901474003,0,0,0,0,0,0,0,0,0,0,5,24,21,2,1,1,1,2,1,0,1,0,Kolkata_Banglore,2871,1,7,0,1,281.17041639043646,0.21339371606109273,1,0
Jet Airways,6/05/2019,Kolkata,Banglore,CCU → DEL → BLR,17:00,09:45 07 May,16h 45m,1 stop,In-flight meal not included,8066,2019-05-06,17:00:00,09:45:00,0,1005,0,0,0,3849,0,0,CCU,BLR,1546.4372901474003,0,0,0,0,0,0,0,0,0,0,5,6,19,2,1,1,2,1,0,0,1,0,Kolkata_Banglore,2871,1,25,1,0,92.32461433715822,0.6498808625496915,1,0
IndiGo,6/05/2019,Banglore,Delhi,BLR → DEL,13:00,15:50,2h 50m,non-stop,No info,3943,2019-05-06,13:00:00,15:50:00,0,170,0,1,0,2053,0,0,BLR,DEL,1708.6520853536679,0,0,0,0,0,0,0,0,0,0,5,6,19,2,1,1,2,2,0,0,0,1,Banglore_Delhi,1265,1,25,1,0,603.0536771836476,0.0994936309487559,1,0
Multiple carriers,1/06/2019,Delhi,Cochin,DEL → BOM → COK,07:30,19:00,11h 30m,1 stop,No info,11200,2019-06-01,07:30:00,19:00:00,0,690,1,1,0,1196,0,0,DEL,COK,2047.882109458646,0,1,0,0,0,0,0,0,0,1,6,1,22,2,1,0,1,3,1,0,1,0,Delhi_Cochin,4537,0,29,1,0,178.07670517031704,0.3369334576502552,1,0
Jet Airways,18/05/2019,Kolkata,Banglore,CCU → BOM → BLR,18:55,04:40 19 May,9h 45m,1 stop,In-flight meal not included,8586,2019-05-18,18:55:00,04:40:00,0,585,1,0,1,3849,0,0,CCU,BLR,1546.4372901474003,0,0,0,0,0,0,0,0,0,0,5,18,20,2,1,1,3,0,0,1,1,0,Kolkata_Banglore,2871,1,13,0,0,158.60895283563082,0.37828886029011893,1,0
Jet Airways,12/06/2019,Kolkata,Banglore,CCU → BOM → BLR,21:10,10:05 13 Jun,12h 55m,1 stop,No info,13044,2019-06-12,21:10:00,10:05:00,0,775,0,0,1,3849,0,0,CCU,BLR,1546.4372901474003,0,0,0,0,0,0,0,0,0,0,6,12,24,2,1,0,3,1,0,1,1,0,Kolkata_Banglore,2871,1,18,0,0,119.72417730173422,0.5011519089313541,1,0
Multiple carriers,3/06/2019,Delhi,Cochin,DEL → BOM → COK,09:15,19:15,10h,1 stop,No info,8099,2019-06-03,09:15:00,19:15:00,0,600,0,1,0,1196,0,0,DEL,COK,2047.882109458646,0,1,0,0,0,0,0,0,0,1,6,3,23,2,1,0,1,3,1,0,1,0,Delhi_Cochin,4537,0,27,1,0,204.7882109458646,0.292985615348048,1,0
Jet Airways,15/06/2019,Delhi,Cochin,DEL → BOM → COK,17:30,04:25 16 Jun,10h 55m,1 stop,In-flight meal not included,10262,2019-06-15,17:30:00,04:25:00,0,655,1,0,1,3849,0,0,DEL,COK,2047.882109458646,0,0,0,0,0,0,0,0,0,0,6,15,24,2,1,0,2,0,0,0,1,0,Delhi_Cochin,4537,0,15,0,0,187.59225430155536,0.31984263008828573,1,0
Multiple carriers,24/06/2019,Delhi,Cochin,DEL → IXU → BOM → COK,17:50,01:30 25 Jun,7h 40m,2 stops,No info,18275,2019-06-24,17:50:00,01:30:00,0,460,0,0,1,1196,0,0,DEL,COK,2047.882109458646,0,0,0,0,0,0,0,0,0,0,6,24,26,2,1,0,2,0,0,0,2,0,Delhi_Cochin,4537,0,6,0,1,267.1150577554756,0.22462230510017014,1,0
Multiple carriers,27/05/2019,Delhi,Cochin,DEL → BOM → COK,06:00,21:00,15h,1 stop,No info,8475,2019-05-27,06:00:00,21:00:00,0,900,0,1,0,1196,0,0,DEL,COK,2047.882109458646,0,0,0,0,0,0,0,0,0,0,5,27,22,2,1,1,1,3,1,0,1,0,Delhi_Cochin,4537,0,4,0,1,136.52547396390975,0.439478423022072,1,0
SpiceJet,6/04/2019,Kolkata,Banglore,CCU → BLR,22:20,00:40 07 Apr,2h 20m,non-stop,No info,3873,2019-04-06,22:20:00,00:40:00,0,140,1,0,1,818,0,0,CCU,BLR,1546.4372901474003,0,0,0,0,0,0,0,0,0,0,4,6,14,2,1,1,3,0,0,1,0,1,Kolkata_Banglore,2871,1,24,1,0,662.7588386346001,0.09053066741985752,1,0
IndiGo,21/06/2019,Mumbai,Hyderabad,BOM → HYD,21:20,22:50,1h 30m,non-stop,No info,2227,2019-06-21,21:20:00,22:50:00,0,90,0,1,1,2053,0,0,BOM,HYD,622.9702752863186,0,0,0,0,0,0,0,0,0,0,6,21,25,2,1,0,3,3,0,1,0,1,Mumbai_Hyderabad,697,1,9,0,1,415.3135168575457,0.14446917223881314,0,0
Jet Airways,6/03/2019,Delhi,Cochin,DEL → IDR → BOM → COK,05:25,19:45 07 Mar,38h 20m,2 stops,In-flight meal not included,16389,2019-03-06,05:25:00,19:45:00,0,2300,0,0,0,3849,0,0,DEL,COK,2047.882109458646,0,0,0,0,0,0,0,0,0,0,3,6,10,1,1,1,0,3,0,0,2,0,Delhi_Cochin,4537,0,25,1,0,53.423011551095115,1.1231115255008506,1,0
Air India,3/05/2019,Banglore,Delhi,BLR → DEL,06:10,08:55,2h 45m,non-stop,No info,5228,2019-05-03,06:10:00,08:55:00,0,165,0,1,0,1752,0,0,BLR,DEL,1708.6520853536679,0,0,0,0,0,0,0,0,0,0,5,3,18,2,1,1,1,1,1,0,0,1,Banglore_Delhi,1265,1,28,1,0,621.3280310376974,0.09656734768555719,1,0
Air India,21/03/2019,Banglore,New Delhi,BLR → MAA → DEL,11:50,08:55 19 Mar,21h 5m,1 stop,No info,5092,2019-03-21,11:50:00,08:55:00,0,1265,0,0,0,1752,0,0,BLR,DEL,1708.6520853536679,0,0,0,0,1,0,0,0,0,1,3,21,12,1,1,1,1,1,1,0,1,0,Banglore_New Delhi,932,0,10,0,1,81.04278665709096,0.7403496655892718,1,0
IndiGo,09/03/2019,Banglore,New Delhi,BLR → DEL,21:20,00:15 13 Mar,2h 55m,non-stop,No info,4777,2019-03-09,21:20:00,00:15:00,0,175,1,0,1,2053,0,0,BLR,DEL,1708.6520853536679,0,0,0,0,0,0,0,0,0,0,3,9,10,1,1,1,3,0,0,1,0,1,Banglore_New Delhi,932,0,22,1,0,585.8235721212576,0.10241991421195461,1,0
Air Asia,24/03/2019,Banglore,New Delhi,BLR → DEL,05:50,08:40,2h 50m,non-stop,No info,3383,2019-03-24,05:50:00,08:40:00,0,170,1,1,0,319,0,0,BLR,DEL,1708.6520853536679,0,0,0,0,1,0,0,0,0,1,3,24,12,1,1,1,0,1,0,0,0,1,Banglore_New Delhi,932,0,7,0,1,603.0536771836476,0.0994936309487559,1,0
Vistara,21/05/2019,Kolkata,Banglore,CCU → DEL → BLR,07:10,09:05 22 May,25h 55m,1 stop,No info,8452,2019-05-21,07:10:00,09:05:00,0,1555,0,0,0,479,0,0,CCU,BLR,1546.4372901474003,0,0,0,0,0,0,0,0,0,0,5,21,21,2,1,1,1,1,1,0,1,0,Kolkata_Banglore,2871,1,10,0,1,59.66960605070354,1.005537055984846,1,0
IndiGo,27/05/2019,Banglore,Delhi,BLR → DEL,23:30,02:20 28 May,2h 50m,non-stop,No info,3943,2019-05-27,23:30:00,02:20:00,0,170,0,0,1,2053,0,0,BLR,DEL,1708.6520853536679,0,0,0,0,0,0,0,0,0,0,5,27,22,2,1,1,3,0,0,1,0,1,Banglore_Delhi,1265,1,4,0,1,603.0536771836476,0.0994936309487559,1,0
Air India,24/06/2019,Mumbai,Hyderabad,BOM → HYD,21:05,22:25,1h 20m,non-stop,No info,3100,2019-06-24,21:05:00,22:25:00,0,80,0,1,1,1752,0,0,BOM,HYD,622.9702752863186,0,0,0,0,0,0,0,0,0,0,6,24,26,2,1,0,3,3,0,1,0,1,Mumbai_Hyderabad,697,1,6,0,1,467.22770646473896,0.12841704199005613,0,0
IndiGo,6/03/2019,Delhi,Cochin,DEL → BOM → COK,09:10,01:35 07 Mar,16h 25m,1 stop,No info,14871,2019-03-06,09:10:00,01:35:00,0,985,0,0,1,2053,0,0,DEL,COK,2047.882109458646,0,0,0,0,0,0,0,0,0,0,3,6,10,1,1,1,1,0,1,0,1,0,Delhi_Cochin,4537,0,25,1,0,124.74408788580584,0.48098471852971214,1,0
Jet Airways,21/06/2019,Banglore,Delhi,BLR → DEL,11:10,14:05,2h 55m,non-stop,No info,8016,2019-06-21,11:10:00,14:05:00,0,175,0,1,0,3849,0,0,BLR,DEL,1708.6520853536679,0,0,0,0,0,0,0,0,0,0,6,21,25,2,1,0,1,2,1,0,0,1,Banglore_Delhi,1265,1,9,0,1,585.8235721212576,0.10241991421195461,1,0
Multiple carriers,12/06/2019,Delhi,Cochin,DEL → BOM → COK,06:00,19:00,13h,1 stop,No info,11789,2019-06-12,06:00:00,19:00:00,0,780,0,1,0,1196,0,0,DEL,COK,2047.882109458646,0,0,0,0,0,0,0,0,0,0,6,12,24,2,1,0,1,3,1,0,1,0,Delhi_Cochin,4537,0,18,0,0,157.52939303528046,0.3808812999524624,1,0
Multiple carriers,15/05/2019,Delhi,Cochin,DEL → BOM → COK,11:40,19:00,7h 20m,1 stop,No info,10529,2019-05-15,11:40:00,19:00:00,0,440,0,1,0,1196,0,0,DEL,COK,2047.882109458646,0,0,0,0,0,0,0,0,0,0,5,15,20,2,1,1,1,3,1,0,1,0,Delhi_Cochin,4537,0,16,0,0,279.25665128981535,0.21485611792190187,1,0
Air Asia,15/03/2019,Banglore,New Delhi,BLR → DEL,05:50,08:40,2h 50m,non-stop,No info,5615,2019-03-15,05:50:00,08:40:00,0,170,0,1,0,319,0,0,BLR,DEL,1708.6520853536679,0,0,0,0,1,0,0,0,0,1,3,15,11,1,1,1,0,1,0,0,0,1,Banglore_New Delhi,932,0,16,0,0,603.0536771836476,0.0994936309487559,1,0
SpiceJet,6/06/2019,Kolkata,Banglore,CCU → MAA → BLR,15:05,20:20,5h 15m,1 stop,No info,4649,2019-06-06,15:05:00,20:20:00,0,315,0,1,0,818,0,0,CCU,BLR,1546.4372901474003,0,1,0,0,0,0,0,0,0,1,6,6,23,2,1,0,2,3,0,0,1,0,Kolkata_Banglore,2871,1,24,1,0,294.55948383760006,0.2036940016946794,1,0
Air India,9/06/2019,Kolkata,Banglore,CCU → IXR → DEL → BLR,05:50,23:15,17h 25m,2 stops,No info,12723,2019-06-09,05:50:00,23:15:00,0,1045,1,1,0,1752,0,0,CCU,BLR,1546.4372901474003,0,1,0,0,0,0,0,0,0,1,6,9,23,2,1,0,0,3,0,0,2,0,Kolkata_Banglore,2871,1,21,1,0,88.79065780750624,0.6757467675267936,1,0
Jet Airways,24/05/2019,Kolkata,Banglore,CCU → BOM → BLR,06:30,18:15,11h 45m,1 stop,In-flight meal not included,10844,2019-05-24,06:30:00,18:15:00,0,705,0,1,0,3849,0,0,CCU,BLR,1546.4372901474003,0,0,0,0,0,0,0,0,0,0,5,24,21,2,1,1,1,3,1,0,1,0,Kolkata_Banglore,2871,1,7,0,1,131.61168426786386,0.45588657522142534,1,0
Jet Airways,3/06/2019,Delhi,Cochin,DEL → BOM → COK,20:55,19:00 04 Jun,22h 5m,1 stop,No info,14714,2019-06-03,20:55:00,19:00:00,0,1325,0,0,0,3849,0,0,DEL,COK,2047.882109458646,0,1,0,0,0,0,0,0,0,1,6,3,23,2,1,0,3,3,0,1,1,0,Delhi_Cochin,4537,0,27,1,0,92.73428420190095,0.6470099005602726,1,0
Vistara,12/06/2019,Delhi,Cochin,DEL → COK,14:40,17:50,3h 10m,non-stop,No info,6216,2019-06-12,14:40:00,17:50:00,0,190,0,1,0,479,0,0,DEL,COK,2047.882109458646,0,0,0,0,0,0,0,0,0,0,6,12,24,2,1,0,2,2,0,0,0,1,Delhi_Cochin,4537,0,18,0,0,646.6996135132566,0.09277877819354853,1,0
IndiGo,15/03/2019,Kolkata,Banglore,CCU → BLR,09:35,12:20,2h 45m,non-stop,No info,4148,2019-03-15,09:35:00,12:20:00,0,165,0,1,0,2053,0,0,CCU,BLR,1546.4372901474003,0,0,0,0,1,0,0,0,0,1,3,15,11,1,1,1,1,2,1,0,0,1,Kolkata_Banglore,2871,1,16,0,0,562.3408327808729,0.10669685803054636,1,0
IndiGo,6/03/2019,Delhi,Cochin,DEL → HYD → COK,06:40,12:00,5h 20m,1 stop,No info,5647,2019-03-06,06:40:00,12:00:00,0,320,0,1,0,2053,0,0,DEL,COK,2047.882109458646,0,0,0,0,0,0,0,0,0,0,3,6,10,1,1,1,1,2,1,0,1,0,Delhi_Cochin,4537,0,25,1,0,383.9778955234961,0.15625899485229228,1,0
Jet Airways,15/05/2019,Kolkata,Banglore,CCU → BOM → BLR,08:25,18:15,9h 50m,1 stop,In-flight meal not included,10844,2019-05-15,08:25:00,18:15:00,0,590,0,1,0,3849,0,0,CCU,BLR,1546.4372901474003,0,0,0,0,0,0,0,0,0,0,5,15,20,2,1,1,1,3,1,0,1,0,Kolkata_Banglore,2871,1,16,0,0,157.26480916753223,0.3815220984122567,1,0
IndiGo,9/05/2019,Delhi,Cochin,DEL → HYD → COK,05:05,12:10,7h 5m,1 stop,No info,6818,2019-05-09,05:05:00,12:10:00,0,425,0,1,0,2053,0,0,DEL,COK,2047.882109458646,0,0,0,0,0,0,0,0,0,0,5,9,19,2,1,1,0,2,0,0,1,0,Delhi_Cochin,4537,0,22,1,0,289.11276839416183,0.20753147753820067,1,0
Air India,27/05/2019,Delhi,Cochin,DEL → GOI → BOM → COK,10:55,07:40 28 May,20h 45m,2 stops,No info,13643,2019-05-27,10:55:00,07:40:00,0,1245,0,0,0,1752,0,0,DEL,COK,2047.882109458646,0,0,0,0,0,0,0,0,0,0,5,27,22,2,1,1,1,1,1,0,2,0,Delhi_Cochin,4537,0,4,0,1,98.6931137088504,0.6079451518471995,1,0
Multiple carriers,27/03/2019,Delhi,Cochin,DEL → BOM → COK,07:00,21:00,14h,1 stop,No info,6358,2019-03-27,07:00:00,21:00:00,0,840,0,1,0,1196,0,0,DEL,COK,2047.882109458646,0,0,0,0,0,0,0,0,0,0,3,27,13,1,1,1,1,3,1,0,1,0,Delhi_Cochin,4537,0,4,0,1,146.27729353276044,0.4101798614872672,1,0
Jet Airways,1/06/2019,Delhi,Cochin,DEL → BOM → COK,13:00,19:00,6h,1 stop,No info,14714,2019-06-01,13:00:00,19:00:00,0,360,1,1,0,3849,0,0,DEL,COK,2047.882109458646,0,1,0,0,0,0,0,0,0,1,6,1,22,2,1,0,2,3,0,0,1,0,Delhi_Cochin,4537,0,29,1,0,341.31368490977434,0.1757913692088288,1,0
SpiceJet,21/04/2019,Delhi,Cochin,DEL → PNQ → COK,08:45,13:15,4h 30m,1 stop,No info,6460,2019-04-21,08:45:00,13:15:00,0,270,1,1,0,818,0,0,DEL,COK,2047.882109458646,0,0,0,0,0,0,0,0,0,0,4,21,16,2,1,1,1,2,1,0,1,0,Delhi_Cochin,4537,0,9,0,1,455.08491321303245,0.1318435269066216,1,0
Jet Airways,12/05/2019,Kolkata,Banglore,CCU → BOM → BLR,21:10,12:00 13 May,14h 50m,1 stop,In-flight meal not included,9663,2019-05-12,21:10:00,12:00:00,0,890,1,0,1,3849,0,0,CCU,BLR,1546.4372901474003,0,0,0,0,0,0,0,0,0,0,5,12,19,2,1,1,3,2,0,1,1,0,Kolkata_Banglore,2871,1,19,0,0,104.25419933577979,0.5755163857405228,1,0
Jet Airways,21/05/2019,Kolkata,Banglore,CCU → BOM → BLR,06:30,10:05 22 May,27h 35m,1 stop,No info,13941,2019-05-21,06:30:00,10:05:00,0,1655,0,0,0,3849,0,0,CCU,BLR,1546.4372901474003,0,0,0,0,0,0,0,0,0,0,5,21,21,2,1,1,1,1,1,0,1,0,Kolkata_Banglore,2871,1,10,0,1,56.06419178782116,1.0702018184276014,1,0
Jet Airways,27/03/2019,Delhi,Cochin,DEL → BOM → COK,19:45,19:45 28 Mar,24h,1 stop,In-flight meal not included,5963,2019-03-27,19:45:00,19:45:00,0,1440,0,0,0,3849,0,0,DEL,COK,2047.882109458646,0,0,0,0,0,0,0,0,0,0,3,27,13,1,1,1,3,3,0,1,1,0,Delhi_Cochin,4537,0,4,0,1,85.32842122744358,0.7031654768353152,1,0
Jet Airways,15/06/2019,Delhi,Cochin,DEL → JAI → BOM → COK,19:30,12:35 16 Jun,17h 5m,2 stops,No info,13014,2019-06-15,19:30:00,12:35:00,0,1025,1,0,0,3849,0,0,DEL,COK,2047.882109458646,0,0,0,0,0,0,0,0,0,0,6,15,24,2,1,0,3,2,0,1,2,0,Delhi_Cochin,4537,0,15,0,0,119.87602591953049,0.5005170928862487,1,0
Jet Airways,9/05/2019,Kolkata,Banglore,CCU → BOM → BLR,16:30,09:20 10 May,16h 50m,1 stop,In-flight meal not included,9663,2019-05-09,16:30:00,09:20:00,0,1010,0,0,0,3849,0,0,CCU,BLR,1546.4372901474003,0,0,0,0,0,0,0,0,0,0,5,9,19,2,1,1,2,1,0,0,1,0,Kolkata_Banglore,2871,1,22,1,0,91.86756179093467,0.6531141006718293,1,0
IndiGo,6/04/2019,Banglore,Delhi,BLR → DEL,13:00,15:50,2h 50m,non-stop,No info,4423,2019-04-06,13:00:00,15:50:00,0,170,1,1,0,2053,0,0,BLR,DEL,1708.6520853536679,0,0,0,0,0,0,0,0,0,0,4,6,14,2,1,1,2,2,0,0,0,1,Banglore_Delhi,1265,1,24,1,0,603.0536771836476,0.0994936309487559,1,0
Jet Airways,6/05/2019,Delhi,Cochin,DEL → JDH → BOM → COK,11:40,19:00,7h 20m,2 stops,No info,21219,2019-05-06,11:40:00,19:00:00,0,440,0,1,0,3849,0,0,DEL,COK,2047.882109458646,0,0,0,0,0,0,0,0,0,0,5,6,19,2,1,1,1,3,1,0,2,0,Delhi_Cochin,4537,0,25,1,0,279.25665128981535,0.21485611792190187,1,0
IndiGo,24/05/2019,Delhi,Cochin,DEL → BOM → COK,18:35,01:30 25 May,6h 55m,1 stop,No info,7503,2019-05-24,18:35:00,01:30:00,0,415,0,0,1,2053,0,0,DEL,COK,2047.882109458646,0,0,0,0,0,0,0,0,0,0,5,24,21,2,1,1,3,0,0,1,1,0,Delhi_Cochin,4537,0,7,0,1,296.07934112655124,0.20264838394906654,1,0
IndiGo,24/06/2019,Kolkata,Banglore,CCU → BLR,21:25,00:05 25 Jun,2h 40m,non-stop,No info,4804,2019-06-24,21:25:00,00:05:00,0,160,0,0,1,2053,0,0,CCU,BLR,1546.4372901474003,0,0,0,0,0,0,0,0,0,0,6,24,26,2,1,0,3,0,0,1,0,1,Kolkata_Banglore,2871,1,6,0,1,579.913983805275,0.10346361990840859,1,0
Jet Airways,9/05/2019,Delhi,Cochin,DEL → JAI → BOM → COK,09:40,12:35 10 May,26h 55m,2 stops,No info,15129,2019-05-09,09:40:00,12:35:00,0,1615,0,0,0,3849,0,0,DEL,COK,2047.882109458646,0,0,0,0,0,0,0,0,0,0,5,9,19,2,1,1,1,2,1,0,2,0,Delhi_Cochin,4537,0,22,1,0,76.08230747214783,0.7886196146451625,1,0
Multiple carriers,27/03/2019,Delhi,Cochin,DEL → HYD → MAA → COK,07:10,21:20,14h 10m,2 stops,No info,6197,2019-03-27,07:10:00,21:20:00,0,850,0,1,0,1196,0,0,DEL,COK,2047.882109458646,0,0,0,0,0,0,0,0,0,0,3,27,13,1,1,1,1,3,1,0,2,0,Delhi_Cochin,4537,0,4,0,1,144.55638419708092,0.41506295507640134,1,0
SpiceJet,27/05/2019,Chennai,Kolkata,MAA → CCU,17:45,20:05,2h 20m,non-stop,No info,3597,2019-05-27,17:45:00,20:05:00,0,140,0,1,0,818,0,0,MAA,CCU,1385.198425287915,0,0,0,0,0,0,0,0,0,0,5,27,22,2,1,1,2,3,0,0,0,1,Chennai_Kolkata,381,1,4,0,1,593.656467980535,0.10106855266667002,1,0
Multiple carriers,27/03/2019,Delhi,Cochin,DEL → BOM → COK,07:30,19:15,11h 45m,1 stop,No info,9100,2019-03-27,07:30:00,19:15:00,0,705,0,1,0,1196,0,0,DEL,COK,2047.882109458646,0,0,0,0,0,0,0,0,0,0,3,27,13,1,1,1,1,3,1,0,1,0,Delhi_Cochin,4537,0,4,0,1,174.2878391028635,0.3442580980339564,1,0
Jet Airways,1/06/2019,Mumbai,Hyderabad,BOM → HYD,07:05,08:30,1h 25m,non-stop,In-flight meal not included,4050,2019-06-01,07:05:00,08:30:00,0,85,1,1,0,3849,0,0,BOM,HYD,622.9702752863186,0,1,0,0,0,0,0,0,0,1,6,1,22,2,1,0,1,1,1,0,0,1,Mumbai_Hyderabad,697,1,29,1,0,439.743723731519,0.13644310711443464,0,0
Multiple carriers,6/06/2019,Delhi,Cochin,DEL → BOM → COK,10:00,01:30 07 Jun,15h 30m,1 stop,No info,7723,2019-06-06,10:00:00,01:30:00,0,930,0,0,1,1196,0,0,DEL,COK,2047.882109458646,0,1,0,0,0,0,0,0,0,1,6,6,23,2,1,0,1,0,1,0,1,0,Delhi_Cochin,4537,0,24,1,0,132.12142641668686,0.4541277037894744,1,0
Jet Airways,9/05/2019,Delhi,Cochin,DEL → AMD → BOM → COK,23:05,19:00 10 May,19h 55m,2 stops,No info,15129,2019-05-09,23:05:00,19:00:00,0,1195,0,0,1,3849,0,0,DEL,COK,2047.882109458646,0,0,0,0,0,0,0,0,0,0,5,9,19,2,1,1,3,3,0,1,2,0,Delhi_Cochin,4537,0,22,1,0,102.82253269248432,0.5835296839015289,1,0
Jet Airways,18/05/2019,Delhi,Cochin,DEL → BOM → COK,08:00,19:00,11h,1 stop,In-flight meal not included,12373,2019-05-18,08:00:00,19:00:00,0,660,1,1,0,3849,0,0,DEL,COK,2047.882109458646,0,0,0,0,0,0,0,0,0,0,5,18,20,2,1,1,1,3,1,0,1,0,Delhi_Cochin,4537,0,13,0,0,186.1711008598769,0.3222841768828528,1,0
IndiGo,3/05/2019,Banglore,Delhi,BLR → DEL,23:30,02:20 04 May,2h 50m,non-stop,No info,4591,2019-05-03,23:30:00,02:20:00,0,170,0,0,1,2053,0,0,BLR,DEL,1708.6520853536679,0,0,0,0,0,0,0,0,0,0,5,3,18,2,1,1,3,0,0,1,0,1,Banglore_Delhi,1265,1,28,1,0,603.0536771836476,0.0994936309487559,1,0
SpiceJet,9/03/2019,Chennai,Kolkata,MAA → CCU,08:20,10:35,2h 15m,non-stop,No info,6300,2019-03-09,08:20:00,10:35:00,0,135,1,1,0,818,0,0,MAA,CCU,1385.198425287915,0,0,0,0,0,0,0,0,0,0,3,9,10,1,1,1,1,1,1,0,0,1,Chennai_Kolkata,381,1,22,1,0,615.6437445724066,0.09745896150000323,1,0
Air India,24/03/2019,Banglore,New Delhi,BLR → DEL,17:00,19:45,2h 45m,non-stop,No info,5176,2019-03-24,17:00:00,19:45:00,0,165,1,1,0,1752,0,0,BLR,DEL,1708.6520853536679,0,0,0,0,1,0,0,0,0,1,3,24,12,1,1,1,2,3,0,0,0,1,Banglore_New Delhi,932,0,7,0,1,621.3280310376974,0.09656734768555719,1,0
Multiple carriers,15/06/2019,Delhi,Cochin,DEL → BOM → COK,09:00,19:00,10h,1 stop,No info,12717,2019-06-15,09:00:00,19:00:00,0,600,1,1,0,1196,0,0,DEL,COK,2047.882109458646,0,0,0,0,0,0,0,0,0,0,6,15,24,2,1,0,1,3,1,0,1,0,Delhi_Cochin,4537,0,15,0,0,204.7882109458646,0.292985615348048,1,0
Air India,18/03/2019,Chennai,Kolkata,MAA → CCU,11:40,13:55,2h 15m,non-stop,No info,4405,2019-03-18,11:40:00,13:55:00,0,135,0,1,0,1752,0,0,MAA,CCU,1385.198425287915,0,0,0,0,1,0,0,0,0,1,3,18,12,1,1,1,1,2,1,0,0,1,Chennai_Kolkata,381,1,13,0,0,615.6437445724066,0.09745896150000323,1,0
SpiceJet,21/04/2019,Delhi,Cochin,DEL → MAA → COK,15:45,22:05,6h 20m,1 stop,No info,6749,2019-04-21,15:45:00,22:05:00,0,380,1,1,0,818,0,0,DEL,COK,2047.882109458646,0,0,0,0,0,0,0,0,0,0,4,21,16,2,1,1,2,3,0,0,1,0,Delhi_Cochin,4537,0,9,0,1,323.3498067566283,0.18555755638709706,1,0
Jet Airways,12/05/2019,Kolkata,Banglore,CCU → GAU → BLR,10:20,17:35,7h 15m,1 stop,In-flight meal not included,7064,2019-05-12,10:20:00,17:35:00,0,435,1,1,0,3849,0,0,CCU,BLR,1546.4372901474003,0,0,0,0,0,0,0,0,0,0,5,12,19,2,1,1,1,2,1,0,1,0,Kolkata_Banglore,2871,1,19,0,0,213.3016951927449,0.28129171662598584,1,0
Jet Airways,21/05/2019,Delhi,Cochin,DEL → BOM → COK,07:05,12:35,5h 30m,1 stop,No info,16289,2019-05-21,07:05:00,12:35:00,0,330,0,1,0,3849,0,0,DEL,COK,2047.882109458646,0,0,0,0,0,0,0,0,0,0,5,21,21,2,1,1,1,2,1,0,1,0,Delhi_Cochin,4537,0,10,0,1,372.3422017197538,0.1611420884414264,1,0
IndiGo,15/03/2019,Chennai,Kolkata,MAA → CCU,11:35,14:00,2h 25m,non-stop,No info,6297,2019-03-15,11:35:00,14:00:00,0,145,0,1,0,2053,0,0,MAA,CCU,1385.198425287915,0,0,0,0,1,0,0,0,0,1,3,15,11,1,1,1,1,2,1,0,0,1,Chennai_Kolkata,381,1,16,0,0,573.1855552915509,0.1046781438333368,1,0
Jet Airways,12/05/2019,Mumbai,Hyderabad,BOM → HYD,19:35,21:05,1h 30m,non-stop,No info,5678,2019-05-12,19:35:00,21:05:00,0,90,1,1,0,3849,0,0,BOM,HYD,622.9702752863186,0,0,0,0,0,0,0,0,0,0,5,12,19,2,1,1,3,3,0,1,0,1,Mumbai_Hyderabad,697,1,19,0,0,415.3135168575457,0.14446917223881314,0,0
Jet Airways,1/05/2019,Kolkata,Banglore,CCU → BOM → BLR,20:00,09:20 02 May,13h 20m,1 stop,No info,14388,2019-05-01,20:00:00,09:20:00,0,800,0,0,0,3849,0,0,CCU,BLR,1546.4372901474003,0,0,0,0,0,0,0,0,0,0,5,1,18,2,1,1,3,1,0,1,1,0,Kolkata_Banglore,2871,1,30,1,0,115.98279676105501,0.517318099542043,1,0
Jet Airways,18/04/2019,Banglore,Delhi,BLR → DEL,06:00,08:45,2h 45m,non-stop,No info,7229,2019-04-18,06:00:00,08:45:00,0,165,0,1,0,3849,0,0,BLR,DEL,1708.6520853536679,0,0,0,0,0,0,0,0,0,0,4,18,16,2,1,1,1,1,1,0,0,1,Banglore_Delhi,1265,1,12,0,0,621.3280310376974,0.09656734768555719,1,0
IndiGo,24/03/2019,Kolkata,Banglore,CCU → BBI → BLR,11:55,16:25,4h 30m,1 stop,No info,9806,2019-03-24,11:55:00,16:25:00,0,270,1,1,0,2053,0,0,CCU,BLR,1546.4372901474003,0,0,0,0,1,0,0,0,0,1,3,24,12,1,1,1,1,2,1,0,1,0,Kolkata_Banglore,2871,1,7,0,1,343.65273114386673,0.1745948585954395,1,0
IndiGo,6/06/2019,Delhi,Cochin,DEL → LKO → COK,21:50,03:35 07 Jun,5h 45m,1 stop,No info,6195,2019-06-06,21:50:00,03:35:00,0,345,0,0,1,2053,0,0,DEL,COK,2047.882109458646,0,1,0,0,0,0,0,0,0,1,6,6,23,2,1,0,3,0,0,1,1,0,Delhi_Cochin,4537,0,24,1,0,356.1534103406341,0.1684667288251276,1,0
Jet Airways,12/06/2019,Kolkata,Banglore,CCU → BOM → BLR,18:55,18:15 13 Jun,23h 20m,1 stop,No info,13044,2019-06-12,18:55:00,18:15:00,0,1400,0,0,0,3849,0,0,CCU,BLR,1546.4372901474003,0,0,0,0,0,0,0,0,0,0,6,12,24,2,1,0,3,3,0,1,1,0,Kolkata_Banglore,2871,1,18,0,0,66.27588386346002,0.9053066741985751,1,0
Jet Airways,27/06/2019,Delhi,Cochin,DEL → LKO → BOM → COK,11:45,04:25 28 Jun,16h 40m,2 stops,No info,13882,2019-06-27,11:45:00,04:25:00,0,1000,0,0,1,3849,0,0,DEL,COK,2047.882109458646,0,0,0,0,0,0,0,0,0,0,6,27,26,2,1,0,1,0,1,0,2,0,Delhi_Cochin,4537,0,3,0,1,122.87292656751876,0.4883093589134133,1,0
Jet Airways,24/03/2019,Banglore,New Delhi,BLR → BOM → DEL,05:45,10:45,5h,1 stop,In-flight meal not included,8147,2019-03-24,05:45:00,10:45:00,0,300,1,1,0,3849,0,0,BLR,DEL,1708.6520853536679,0,0,0,0,1,0,0,0,0,1,3,24,12,1,1,1,0,1,0,0,1,0,Banglore_New Delhi,932,0,7,0,1,341.73041707073355,0.17557699579192218,1,0
Air India,9/04/2019,Delhi,Cochin,DEL → HYD → BOM → COK,17:15,07:40 10 Apr,14h 25m,2 stops,No info,8052,2019-04-09,17:15:00,07:40:00,0,865,0,0,0,1752,0,0,DEL,COK,2047.882109458646,0,0,0,0,0,0,0,0,0,0,4,9,15,2,1,1,2,1,0,0,2,0,Delhi_Cochin,4537,0,21,1,0,142.04962608961705,0.4223875954601025,1,0
Jet Airways,1/05/2019,Kolkata,Banglore,CCU → BOM → BLR,06:30,19:50,13h 20m,1 stop,No info,14781,2019-05-01,06:30:00,19:50:00,0,800,0,1,0,3849,0,0,CCU,BLR,1546.4372901474003,0,0,0,0,0,0,0,0,0,0,5,1,18,2,1,1,1,3,1,0,1,0,Kolkata_Banglore,2871,1,30,1,0,115.98279676105501,0.517318099542043,1,0
Jet Airways,24/05/2019,Kolkata,Banglore,CCU → DEL → BLR,09:35,22:05,12h 30m,1 stop,No info,14151,2019-05-24,09:35:00,22:05:00,0,750,0,1,0,3849,0,0,CCU,BLR,1546.4372901474003,0,0,0,0,0,0,0,0,0,0,5,24,21,2,1,1,1,3,1,0,1,0,Kolkata_Banglore,2871,1,7,0,1,123.71498321179202,0.4849857183206653,1,0
IndiGo,18/05/2019,Kolkata,Banglore,CCU → NAG → BLR,18:05,23:30,5h 25m,1 stop,No info,6704,2019-05-18,18:05:00,23:30:00,0,325,1,1,0,2053,0,0,CCU,BLR,1546.4372901474003,0,0,0,0,0,0,0,0,0,0,5,18,20,2,1,1,3,3,0,1,1,0,Kolkata_Banglore,2871,1,13,0,0,285.49611510413547,0.21016047793895495,1,0
Jet Airways,1/05/2019,Kolkata,Banglore,CCU → BOM → BLR,08:25,12:00 02 May,27h 35m,1 stop,In-flight meal not included,9663,2019-05-01,08:25:00,12:00:00,0,1655,0,0,0,3849,0,0,CCU,BLR,1546.4372901474003,0,0,0,0,0,0,0,0,0,0,5,1,18,2,1,1,1,2,1,0,1,0,Kolkata_Banglore,2871,1,30,1,0,56.06419178782116,1.0702018184276014,1,0
IndiGo,18/03/2019,Kolkata,Banglore,CCU → BLR,15:20,17:55,2h 35m,non-stop,No info,4462,2019-03-18,15:20:00,17:55:00,0,155,0,1,0,2053,0,0,CCU,BLR,1546.4372901474003,0,0,0,0,1,0,0,0,0,1,3,18,12,1,1,1,2,2,0,0,0,1,Kolkata_Banglore,2871,1,13,0,0,598.6208865086711,0.10023038178627082,1,0
Jet Airways,21/03/2019,Delhi,Cochin,DEL → BDQ → BOM → COK,10:45,04:25 22 Mar,17h 40m,2 stops,In-flight meal not included,8367,2019-03-21,10:45:00,04:25:00,0,1060,0,0,1,3849,0,0,DEL,COK,2047.882109458646,0,0,0,0,1,0,0,0,0,1,3,21,12,1,1,1,1,0,1,0,2,0,Delhi_Cochin,4537,0,10,0,1,115.91785525237619,0.5176079204482181,1,0
Jet Airways,9/06/2019,Delhi,Cochin,DEL → NAG → BOM → COK,06:45,04:25 10 Jun,21h 40m,2 stops,No info,13376,2019-06-09,06:45:00,04:25:00,0,1300,1,0,1,3849,0,0,DEL,COK,2047.882109458646,0,1,0,0,0,0,0,0,0,1,6,9,23,2,1,0,1,0,1,0,2,0,Delhi_Cochin,4537,0,21,1,0,94.51763582116828,0.6348021665874374,1,0
Jet Airways,21/05/2019,Kolkata,Banglore,CCU → DEL → BLR,20:25,09:45 22 May,13h 20m,1 stop,No info,13067,2019-05-21,20:25:00,09:45:00,0,800,0,0,0,3849,0,0,CCU,BLR,1546.4372901474003,0,0,0,0,0,0,0,0,0,0,5,21,21,2,1,1,3,1,0,1,1,0,Kolkata_Banglore,2871,1,10,0,1,115.98279676105501,0.517318099542043,1,0
IndiGo,21/05/2019,Kolkata,Banglore,CCU → BLR,14:25,16:55,2h 30m,non-stop,No info,5224,2019-05-21,14:25:00,16:55:00,0,150,0,1,0,2053,0,0,CCU,BLR,1546.4372901474003,0,0,0,0,0,0,0,0,0,0,5,21,21,2,1,1,2,2,0,0,0,1,Kolkata_Banglore,2871,1,10,0,1,618.5749160589601,0.09699714366413306,1,0
Multiple carriers,21/03/2019,Delhi,Cochin,DEL → BOM → COK,16:00,01:35 22 Mar,9h 35m,1 stop,No info,13542,2019-03-21,16:00:00,01:35:00,0,575,0,0,1,1196,0,0,DEL,COK,2047.882109458646,0,0,0,0,1,0,0,0,0,1,3,21,12,1,1,1,2,0,0,0,1,0,Delhi_Cochin,4537,0,10,0,1,213.69204620438046,0.28077788137521265,1,0
GoAir,24/05/2019,Banglore,Delhi,BLR → DEL,07:45,10:40,2h 55m,non-stop,No info,3419,2019-05-24,07:45:00,10:40:00,0,175,0,1,0,194,0,0,BLR,DEL,1708.6520853536679,0,0,0,0,0,0,0,0,0,0,5,24,21,2,1,1,1,1,1,0,0,1,Banglore_Delhi,1265,1,7,0,1,585.8235721212576,0.10241991421195461,1,0
Multiple carriers,6/03/2019,Delhi,Cochin,DEL → HYD → MAA → COK,09:45,21:20,11h 35m,2 stops,No info,10444,2019-03-06,09:45:00,21:20:00,0,695,0,1,0,1196,0,0,DEL,COK,2047.882109458646,0,0,0,0,0,0,0,0,0,0,3,6,10,1,1,1,1,3,1,0,2,0,Delhi_Cochin,4537,0,25,1,0,176.79557779499103,0.33937500444482227,1,0
IndiGo,1/06/2019,Kolkata,Banglore,CCU → BLR,09:35,12:10,2h 35m,non-stop,No info,4804,2019-06-01,09:35:00,12:10:00,0,155,1,1,0,2053,0,0,CCU,BLR,1546.4372901474003,0,1,0,0,0,0,0,0,0,1,6,1,22,2,1,0,1,2,1,0,0,1,Kolkata_Banglore,2871,1,29,1,0,598.6208865086711,0.10023038178627082,1,0
Jet Airways,21/05/2019,Mumbai,Hyderabad,BOM → HYD,07:05,08:30,1h 25m,non-stop,In-flight meal not included,4995,2019-05-21,07:05:00,08:30:00,0,85,0,1,0,3849,0,0,BOM,HYD,622.9702752863186,0,0,0,0,0,0,0,0,0,0,5,21,21,2,1,1,1,1,1,0,0,1,Mumbai_Hyderabad,697,1,10,0,1,439.743723731519,0.13644310711443464,0,0
SpiceJet,27/04/2019,Delhi,Cochin,DEL → BLR → COK,17:55,22:50,4h 55m,1 stop,No info,4957,2019-04-27,17:55:00,22:50:00,0,295,1,1,0,818,0,0,DEL,COK,2047.882109458646,0,0,0,0,0,0,0,0,0,0,4,27,17,2,1,1,2,3,0,0,1,0,Delhi_Cochin,4537,0,3,0,1,416.5183951441314,0.14405126087945694,1,0
Jet Airways,9/05/2019,Delhi,Cochin,DEL → BOM → COK,20:55,04:25 10 May,7h 30m,1 stop,No info,15554,2019-05-09,20:55:00,04:25:00,0,450,0,0,1,3849,0,0,DEL,COK,2047.882109458646,0,0,0,0,0,0,0,0,0,0,5,9,19,2,1,1,3,0,0,1,1,0,Delhi_Cochin,4537,0,22,1,0,273.0509479278195,0.219739211511036,1,0
Jet Airways,1/05/2019,Kolkata,Banglore,CCU → BOM → BLR,20:00,12:00 02 May,16h,1 stop,In-flight meal not included,9663,2019-05-01,20:00:00,12:00:00,0,960,0,0,0,3849,0,0,CCU,BLR,1546.4372901474003,0,0,0,0,0,0,0,0,0,0,5,1,18,2,1,1,3,2,0,1,1,0,Kolkata_Banglore,2871,1,30,1,0,96.65233063421252,0.6207817194504516,1,0
Jet Airways,18/05/2019,Kolkata,Banglore,CCU → DEL → BLR,09:35,09:45 19 May,24h 10m,1 stop,No info,14151,2019-05-18,09:35:00,09:45:00,0,1450,1,0,0,3849,0,0,CCU,BLR,1546.4372901474003,0,0,0,0,0,0,0,0,0,0,5,18,20,2,1,1,1,1,1,0,1,0,Kolkata_Banglore,2871,1,13,0,0,63.99050855782347,0.9376390554199528,1,0
IndiGo,6/06/2019,Delhi,Cochin,DEL → COK,05:35,08:50,3h 15m,non-stop,No info,5601,2019-06-06,05:35:00,08:50:00,0,195,0,1,0,2053,0,0,DEL,COK,2047.882109458646,0,1,0,0,0,0,0,0,0,1,6,6,23,2,1,0,0,1,0,0,0,1,Delhi_Cochin,4537,0,24,1,0,630.1175721411219,0.0952203249881156,1,0
Multiple carriers,15/05/2019,Delhi,Cochin,DEL → BOM → COK,06:40,19:15,12h 35m,1 stop,No info,7787,2019-05-15,06:40:00,19:15:00,0,755,0,1,0,1196,0,0,DEL,COK,2047.882109458646,0,0,0,0,0,0,0,0,0,0,5,15,20,2,1,1,1,3,1,0,1,0,Delhi_Cochin,4537,0,16,0,0,162.74559810267385,0.3686735659796271,1,0
Air India,21/03/2019,Banglore,New Delhi,BLR → MAA → DEL,11:50,23:55,12h 5m,1 stop,No info,5092,2019-03-21,11:50:00,23:55:00,0,725,0,1,0,1752,0,0,BLR,DEL,1708.6520853536679,0,0,0,0,1,0,0,0,0,1,3,21,12,1,1,1,1,3,1,0,1,0,Banglore_New Delhi,932,0,10,0,1,141.40568982237252,0.42431107316381195,1,0
Jet Airways,6/06/2019,Kolkata,Banglore,CCU → BOM → BLR,21:10,09:20 07 Jun,12h 10m,1 stop,In-flight meal not included,10844,2019-06-06,21:10:00,09:20:00,0,730,0,0,1,3849,0,0,CCU,BLR,1546.4372901474003,0,1,0,0,0,0,0,0,0,1,6,6,23,2,1,0,3,1,0,1,1,0,Kolkata_Banglore,2871,1,24,1,0,127.10443480663565,0.4720527658321142,1,0
Multiple carriers,9/03/2019,Delhi,Cochin,DEL → IXU → BOM → COK,17:50,01:35 10 Mar,7h 45m,2 stops,No info,23583,2019-03-09,17:50:00,01:35:00,0,465,1,0,1,1196,0,0,DEL,COK,2047.882109458646,0,0,0,0,0,0,0,0,0,0,3,9,10,1,1,1,2,0,0,0,2,0,Delhi_Cochin,4537,0,22,1,0,264.2428528333737,0.2270638518947372,1,0
Air India,12/05/2019,Kolkata,Banglore,CCU → BBI → BOM → BLR,12:00,18:30 13 May,30h 30m,2 stops,No info,10676,2019-05-12,12:00:00,18:30:00,0,1830,1,0,0,1752,0,0,CCU,BLR,1546.4372901474003,0,0,0,0,0,0,0,0,0,0,5,12,19,2,1,1,2,3,0,0,2,0,Kolkata_Banglore,2871,1,19,0,0,50.70286197204591,1.1833651527024234,1,0
SpiceJet,6/06/2019,Kolkata,Banglore,CCU → IXB → BLR,11:15,18:30,7h 15m,1 stop,No info,10156,2019-06-06,11:15:00,18:30:00,0,435,0,1,0,818,0,0,CCU,BLR,1546.4372901474003,0,1,0,0,0,0,0,0,0,1,6,6,23,2,1,0,1,3,1,0,1,0,Kolkata_Banglore,2871,1,24,1,0,213.3016951927449,0.28129171662598584,1,0
Air Asia,6/03/2019,Delhi,Cochin,DEL → BLR → COK,16:45,07:10 07 Mar,14h 25m,1 stop,No info,8627,2019-03-06,16:45:00,07:10:00,0,865,0,0,0,319,0,0,DEL,COK,2047.882109458646,0,0,0,0,0,0,0,0,0,0,3,6,10,1,1,1,2,1,0,0,1,0,Delhi_Cochin,4537,0,25,1,0,142.04962608961705,0.4223875954601025,1,0
Air Asia,21/05/2019,Kolkata,Banglore,CCU → BLR,09:45,12:15,2h 30m,non-stop,No info,4409,2019-05-21,09:45:00,12:15:00,0,150,0,1,0,319,0,0,CCU,BLR,1546.4372901474003,0,0,0,0,0,0,0,0,0,0,5,21,21,2,1,1,1,2,1,0,0,1,Kolkata_Banglore,2871,1,10,0,1,618.5749160589601,0.09699714366413306,1,0
Multiple carriers,18/05/2019,Delhi,Cochin,DEL → HYD → COK,09:45,16:10,6h 25m,1 stop,No info,9646,2019-05-18,09:45:00,16:10:00,0,385,1,1,0,1196,0,0,DEL,COK,2047.882109458646,0,0,0,0,0,0,0,0,0,0,5,18,20,2,1,1,1,2,1,0,1,0,Delhi_Cochin,4537,0,13,0,0,319.15045861693187,0.18799910318166413,1,0
Jet Airways,12/03/2019,Banglore,New Delhi,BLR → BOM → DEL,21:25,12:25 13 Mar,15h,1 stop,No info,13817,2019-03-12,21:25:00,12:25:00,0,900,0,0,1,3849,0,0,BLR,DEL,1708.6520853536679,0,0,0,0,0,0,0,0,0,0,3,12,11,1,1,1,3,2,0,1,1,0,Banglore_New Delhi,932,0,19,0,0,113.91013902357786,0.5267309873757665,1,0
Air India,9/05/2019,Delhi,Cochin,DEL → UDR → BOM → COK,13:20,07:40 10 May,18h 20m,2 stops,No info,13538,2019-05-09,13:20:00,07:40:00,0,1100,0,0,0,1752,0,0,DEL,COK,2047.882109458646,0,0,0,0,0,0,0,0,0,0,5,9,19,2,1,1,2,1,0,0,2,0,Delhi_Cochin,4537,0,22,1,0,111.70266051592615,0.5371402948047547,1,0
Air India,9/05/2019,Kolkata,Banglore,CCU → BBI → BOM → BLR,12:00,07:55 10 May,19h 55m,2 stops,No info,9416,2019-05-09,12:00:00,07:55:00,0,1195,0,0,0,1752,0,0,CCU,BLR,1546.4372901474003,0,0,0,0,0,0,0,0,0,0,5,9,19,2,1,1,2,1,0,0,2,0,Kolkata_Banglore,2871,1,22,1,0,77.64538695300755,0.7727439111909267,1,0
Jet Airways,27/04/2019,Banglore,Delhi,BLR → DEL,11:10,14:05,2h 55m,non-stop,No info,7229,2019-04-27,11:10:00,14:05:00,0,175,1,1,0,3849,0,0,BLR,DEL,1708.6520853536679,0,0,0,0,0,0,0,0,0,0,4,27,17,2,1,1,1,2,1,0,0,1,Banglore_Delhi,1265,1,3,0,1,585.8235721212576,0.10241991421195461,1,0
Air India,1/05/2019,Kolkata,Banglore,CCU → DEL → BLR,10:00,23:15,13h 15m,1 stop,No info,10203,2019-05-01,10:00:00,23:15:00,0,795,0,1,0,1752,0,0,CCU,BLR,1546.4372901474003,0,0,0,0,0,0,0,0,0,0,5,1,18,2,1,1,1,3,1,0,1,0,Kolkata_Banglore,2871,1,30,1,0,116.71224831301134,0.5140848614199052,1,0
IndiGo,21/05/2019,Delhi,Cochin,DEL → HYD → COK,16:10,00:55 22 May,8h 45m,1 stop,No info,6778,2019-05-21,16:10:00,00:55:00,0,525,0,0,1,2053,0,0,DEL,COK,2047.882109458646,0,0,0,0,0,0,0,0,0,0,5,21,21,2,1,1,2,0,0,0,1,0,Delhi_Cochin,4537,0,10,0,1,234.0436696524167,0.256362413429542,1,0
IndiGo,15/06/2019,Mumbai,Hyderabad,BOM → HYD,12:00,13:30,1h 30m,non-stop,No info,2754,2019-06-15,12:00:00,13:30:00,0,90,1,1,0,2053,0,0,BOM,HYD,622.9702752863186,0,0,0,0,0,0,0,0,0,0,6,15,24,2,1,0,2,2,0,0,0,1,Mumbai_Hyderabad,697,1,15,0,0,415.3135168575457,0.14446917223881314,0,0
Air India,1/05/2019,Kolkata,Banglore,CCU → IXR → DEL → BLR,05:50,20:25,14h 35m,2 stops,No info,10991,2019-05-01,05:50:00,20:25:00,0,875,0,1,0,1752,0,0,CCU,BLR,1546.4372901474003,0,0,0,0,0,0,0,0,0,0,5,1,18,2,1,1,0,3,0,0,2,0,Kolkata_Banglore,2871,1,30,1,0,106.04141418153601,0.5658166713741095,1,0
Vistara,27/05/2019,Banglore,Delhi,BLR → DEL,11:30,14:20,2h 50m,non-stop,No info,4668,2019-05-27,11:30:00,14:20:00,0,170,0,1,0,479,0,0,BLR,DEL,1708.6520853536679,0,0,0,0,0,0,0,0,0,0,5,27,22,2,1,1,1,2,1,0,0,1,Banglore_Delhi,1265,1,4,0,1,603.0536771836476,0.0994936309487559,1,0
SpiceJet,3/06/2019,Delhi,Cochin,DEL → PNQ → COK,08:45,13:15,4h 30m,1 stop,No check-in baggage included,5726,2019-06-03,08:45:00,13:15:00,0,270,0,1,0,818,0,0,DEL,COK,2047.882109458646,0,1,0,0,0,0,0,0,0,1,6,3,23,2,1,0,1,2,1,0,1,0,Delhi_Cochin,4537,0,27,1,0,455.08491321303245,0.1318435269066216,1,0
Air India,12/06/2019,Kolkata,Banglore,CCU → GAU → DEL → BLR,09:50,23:15,13h 25m,2 stops,No info,14960,2019-06-12,09:50:00,23:15:00,0,805,0,1,0,1752,0,0,CCU,BLR,1546.4372901474003,0,0,0,0,0,0,0,0,0,0,6,12,24,2,1,0,1,3,1,0,2,0,Kolkata_Banglore,2871,1,18,0,0,115.26240671906089,0.5205513376641807,1,0
Air India,21/05/2019,Delhi,Cochin,DEL → MAA → COK,20:40,09:25 22 May,12h 45m,1 stop,No info,7480,2019-05-21,20:40:00,09:25:00,0,765,0,0,0,1752,0,0,DEL,COK,2047.882109458646,0,0,0,0,0,0,0,0,0,0,5,21,21,2,1,1,3,1,0,1,1,0,Delhi_Cochin,4537,0,10,0,1,160.6182046634232,0.3735566595687612,1,0
Air Asia,21/05/2019,Kolkata,Banglore,CCU → BLR,19:55,22:25,2h 30m,non-stop,No info,4107,2019-05-21,19:55:00,22:25:00,0,150,0,1,0,319,0,0,CCU,BLR,1546.4372901474003,0,0,0,0,0,0,0,0,0,0,5,21,21,2,1,1,3,3,0,1,0,1,Kolkata_Banglore,2871,1,10,0,1,618.5749160589601,0.09699714366413306,1,0
Jet Airways,1/05/2019,Kolkata,Banglore,CCU → DEL → BLR,09:35,09:45 02 May,24h 10m,1 stop,No info,11467,2019-05-01,09:35:00,09:45:00,0,1450,0,0,0,3849,0,0,CCU,BLR,1546.4372901474003,0,0,0,0,0,0,0,0,0,0,5,1,18,2,1,1,1,1,1,0,1,0,Kolkata_Banglore,2871,1,30,1,0,63.99050855782347,0.9376390554199528,1,0
IndiGo,27/04/2019,Delhi,Cochin,DEL → MAA → COK,02:00,07:25,5h 25m,1 stop,No info,5796,2019-04-27,02:00:00,07:25:00,0,325,1,1,1,2053,0,0,DEL,COK,2047.882109458646,0,0,0,0,0,0,0,0,0,0,4,27,17,2,1,1,0,1,0,0,1,0,Delhi_Cochin,4537,0,3,0,1,378.07054328467314,0.15870054164685934,1,0
Jet Airways,6/06/2019,Delhi,Cochin,DEL → BOM → COK,02:15,19:00,16h 45m,1 stop,In-flight meal not included,10262,2019-06-06,02:15:00,19:00:00,0,1005,0,1,1,3849,0,0,DEL,COK,2047.882109458646,0,1,0,0,0,0,0,0,0,1,6,6,23,2,1,0,0,3,0,0,1,0,Delhi_Cochin,4537,0,24,1,0,122.26161847514304,0.4907509057079804,1,0
Air India,27/06/2019,Delhi,Cochin,DEL → RPR → NAG → BOM → COK,05:15,07:40 28 Jun,26h 25m,3 stops,No info,11543,2019-06-27,05:15:00,07:40:00,0,1585,0,0,0,1752,0,0,DEL,COK,2047.882109458646,0,0,0,0,0,0,0,0,0,0,6,27,26,2,1,0,0,1,0,0,3,0,Delhi_Cochin,4537,0,3,0,1,77.52235114669953,0.7739703338777602,1,0
IndiGo,24/04/2019,Delhi,Cochin,DEL → HYD → COK,06:50,12:10,5h 20m,1 stop,No info,5298,2019-04-24,06:50:00,12:10:00,0,320,0,1,0,2053,0,0,DEL,COK,2047.882109458646,0,0,0,0,0,0,0,0,0,0,4,24,17,2,1,1,1,2,1,0,1,0,Delhi_Cochin,4537,0,6,0,1,383.9778955234961,0.15625899485229228,1,0
Air Asia,27/04/2019,Delhi,Cochin,DEL → BLR → COK,20:45,07:10 28 Apr,10h 25m,1 stop,No info,6451,2019-04-27,20:45:00,07:10:00,0,625,1,0,0,319,0,0,DEL,COK,2047.882109458646,0,0,0,0,0,0,0,0,0,0,4,27,17,2,1,1,3,1,0,1,1,0,Delhi_Cochin,4537,0,3,0,1,196.59668250803003,0.3051933493208833,1,0
Air India,9/06/2019,Kolkata,Banglore,CCU → BLR,14:15,16:45,2h 30m,non-stop,No info,6245,2019-06-09,14:15:00,16:45:00,0,150,1,1,0,1752,0,0,CCU,BLR,1546.4372901474003,0,1,0,0,0,0,0,0,0,1,6,9,23,2,1,0,2,2,0,0,0,1,Kolkata_Banglore,2871,1,21,1,0,618.5749160589601,0.09699714366413306,1,0
Jet Airways,27/03/2019,Mumbai,Hyderabad,BOM → HYD,19:35,21:05,1h 30m,non-stop,In-flight meal not included,2071,2019-03-27,19:35:00,21:05:00,0,90,0,1,0,3849,0,0,BOM,HYD,622.9702752863186,0,0,0,0,0,0,0,0,0,0,3,27,13,1,1,1,3,3,0,1,0,1,Mumbai_Hyderabad,697,1,4,0,1,415.3135168575457,0.14446917223881314,0,0
IndiGo,15/05/2019,Kolkata,Banglore,CCU → BLR,09:35,12:20,2h 45m,non-stop,No info,4804,2019-05-15,09:35:00,12:20:00,0,165,0,1,0,2053,0,0,CCU,BLR,1546.4372901474003,0,0,0,0,0,0,0,0,0,0,5,15,20,2,1,1,1,2,1,0,0,1,Kolkata_Banglore,2871,1,16,0,0,562.3408327808729,0.10669685803054636,1,0
Multiple carriers,27/06/2019,Delhi,Cochin,DEL → BOM → COK,07:30,21:00,13h 30m,1 stop,No info,7005,2019-06-27,07:30:00,21:00:00,0,810,0,1,0,1196,0,0,DEL,COK,2047.882109458646,0,0,0,0,0,0,0,0,0,0,6,27,26,2,1,0,1,3,1,0,1,0,Delhi_Cochin,4537,0,3,0,1,151.69497107101083,0.3955305807198648,1,0
Jet Airways,18/03/2019,Banglore,New Delhi,BLR → BOM → DEL,05:45,12:25,6h 40m,1 stop,No info,12284,2019-03-18,05:45:00,12:25:00,0,400,0,1,0,3849,0,0,BLR,DEL,1708.6520853536679,0,0,0,0,1,0,0,0,0,1,3,18,12,1,1,1,0,2,0,0,1,0,Banglore_New Delhi,932,0,13,0,0,256.2978128030502,0.23410266105589625,1,0
Air India,9/05/2019,Kolkata,Banglore,CCU → DEL → BLR,07:00,20:25,13h 25m,1 stop,No info,10203,2019-05-09,07:00:00,20:25:00,0,805,0,1,0,1752,0,0,CCU,BLR,1546.4372901474003,0,0,0,0,0,0,0,0,0,0,5,9,19,2,1,1,1,3,1,0,1,0,Kolkata_Banglore,2871,1,22,1,0,115.26240671906089,0.5205513376641807,1,0
IndiGo,27/05/2019,Delhi,Cochin,DEL → HYD → COK,14:20,22:30,8h 10m,1 stop,No info,6938,2019-05-27,14:20:00,22:30:00,0,490,0,1,0,2053,0,0,DEL,COK,2047.882109458646,0,0,0,0,0,0,0,0,0,0,5,27,22,2,1,1,2,3,0,0,1,0,Delhi_Cochin,4537,0,4,0,1,250.7610746275893,0.23927158586757252,1,0
Multiple carriers,12/06/2019,Delhi,Cochin,DEL → BOM → COK,10:00,01:30 13 Jun,15h 30m,1 stop,No info,13377,2019-06-12,10:00:00,01:30:00,0,930,0,0,1,1196,0,0,DEL,COK,2047.882109458646,0,0,0,0,0,0,0,0,0,0,6,12,24,2,1,0,1,0,1,0,1,0,Delhi_Cochin,4537,0,18,0,0,132.12142641668686,0.4541277037894744,1,0
Multiple carriers,1/06/2019,Delhi,Cochin,DEL → BOM → COK,09:15,19:15,10h,1 stop,No info,9779,2019-06-01,09:15:00,19:15:00,0,600,1,1,0,1196,0,0,DEL,COK,2047.882109458646,0,1,0,0,0,0,0,0,0,1,6,1,22,2,1,0,1,3,1,0,1,0,Delhi_Cochin,4537,0,29,1,0,204.7882109458646,0.292985615348048,1,0
Air India,15/05/2019,Chennai,Kolkata,MAA → CCU,11:40,13:55,2h 15m,non-stop,No info,4667,2019-05-15,11:40:00,13:55:00,0,135,0,1,0,1752,0,0,MAA,CCU,1385.198425287915,0,0,0,0,0,0,0,0,0,0,5,15,20,2,1,1,1,2,1,0,0,1,Chennai_Kolkata,381,1,16,0,0,615.6437445724066,0.09745896150000323,1,0
Jet Airways,3/04/2019,Banglore,Delhi,BLR → DEL,19:50,22:50,3h,non-stop,In-flight meal not included,4544,2019-04-03,19:50:00,22:50:00,0,180,0,1,0,3849,0,0,BLR,DEL,1708.6520853536679,0,0,0,0,0,0,0,0,0,0,4,3,14,2,1,1,3,3,0,1,0,1,Banglore_Delhi,1265,1,27,1,0,569.5506951178893,0.10534619747515331,1,0
Jet Airways,27/06/2019,Delhi,Cochin,DEL → BOM → COK,21:50,04:25 28 Jun,6h 35m,1 stop,No info,16079,2019-06-27,21:50:00,04:25:00,0,395,0,0,1,3849,0,0,DEL,COK,2047.882109458646,0,0,0,0,0,0,0,0,0,0,6,27,26,2,1,0,3,0,0,1,1,0,Delhi_Cochin,4537,0,3,0,1,311.0707001709336,0.19288219677079826,1,0
Jet Airways,1/04/2019,Kolkata,Banglore,CCU → BOM → BLR,16:30,19:50 02 Apr,27h 20m,1 stop,In-flight meal not included,7064,2019-04-01,16:30:00,19:50:00,0,1640,0,0,0,3849,0,0,CCU,BLR,1546.4372901474003,0,0,0,0,0,0,0,0,0,0,4,1,14,2,1,1,2,3,0,0,1,0,Kolkata_Banglore,2871,1,29,1,0,56.57697402978294,1.0605021040611882,1,0
Jet Airways,18/05/2019,Delhi,Cochin,DEL → BOM → COK,14:00,19:00,5h,1 stop,No info,15554,2019-05-18,14:00:00,19:00:00,0,300,1,1,0,3849,0,0,DEL,COK,2047.882109458646,0,0,0,0,0,0,0,0,0,0,5,18,20,2,1,1,2,3,0,0,1,0,Delhi_Cochin,4537,0,13,0,0,409.5764218917292,0.146492807674024,1,0
SpiceJet,18/05/2019,Chennai,Kolkata,MAA → CCU,09:45,12:00,2h 15m,non-stop,No check-in baggage included,3543,2019-05-18,09:45:00,12:00:00,0,135,1,1,0,818,0,0,MAA,CCU,1385.198425287915,0,0,0,0,0,0,0,0,0,0,5,18,20,2,1,1,1,2,1,0,0,1,Chennai_Kolkata,381,1,13,0,0,615.6437445724066,0.09745896150000323,1,0
Air India,18/04/2019,Banglore,Delhi,BLR → DEL,13:20,16:10,2h 50m,non-stop,No info,6121,2019-04-18,13:20:00,16:10:00,0,170,0,1,0,1752,0,0,BLR,DEL,1708.6520853536679,0,0,0,0,0,0,0,0,0,0,4,18,16,2,1,1,2,2,0,0,0,1,Banglore_Delhi,1265,1,12,0,0,603.0536771836476,0.0994936309487559,1,0
IndiGo,27/03/2019,Delhi,Cochin,DEL → BOM → COK,08:25,15:30,7h 5m,1 stop,No info,8075,2019-03-27,08:25:00,15:30:00,0,425,0,1,0,2053,0,0,DEL,COK,2047.882109458646,0,0,0,0,0,0,0,0,0,0,3,27,13,1,1,1,1,2,1,0,1,0,Delhi_Cochin,4537,0,4,0,1,289.11276839416183,0.20753147753820067,1,0
Multiple carriers,3/06/2019,Delhi,Cochin,DEL → BOM → COK,11:30,01:30 04 Jun,14h,1 stop,No info,13377,2019-06-03,11:30:00,01:30:00,0,840,0,0,1,1196,0,0,DEL,COK,2047.882109458646,0,1,0,0,0,0,0,0,0,1,6,3,23,2,1,0,1,0,1,0,1,0,Delhi_Cochin,4537,0,27,1,0,146.27729353276044,0.4101798614872672,1,0
Jet Airways,24/05/2019,Kolkata,Banglore,CCU → BOM → BLR,14:05,19:50,5h 45m,1 stop,No info,14571,2019-05-24,14:05:00,19:50:00,0,345,0,1,0,3849,0,0,CCU,BLR,1546.4372901474003,0,0,0,0,0,0,0,0,0,0,5,24,21,2,1,1,2,3,0,0,1,0,Kolkata_Banglore,2871,1,7,0,1,268.94561567780875,0.22309343042750604,1,0
SpiceJet,24/04/2019,Banglore,Delhi,BLR → DEL,05:55,08:35,2h 40m,non-stop,No check-in baggage included,3919,2019-04-24,05:55:00,08:35:00,0,160,0,1,0,818,0,0,BLR,DEL,1708.6520853536679,0,0,0,0,0,0,0,0,0,0,4,24,17,2,1,1,0,1,0,0,0,1,Banglore_Delhi,1265,1,6,0,1,640.7445320076254,0.09364106442235849,1,0
Jet Airways,24/03/2019,Kolkata,Banglore,CCU → BOM → BLR,18:55,04:45 25 Mar,9h 50m,1 stop,No info,14231,2019-03-24,18:55:00,04:45:00,0,590,1,0,1,3849,0,0,CCU,BLR,1546.4372901474003,0,0,0,0,1,0,0,0,0,1,3,24,12,1,1,1,3,0,0,1,1,0,Kolkata_Banglore,2871,1,7,0,1,157.26480916753223,0.3815220984122567,1,0
IndiGo,15/03/2019,Mumbai,Hyderabad,BOM → HYD,19:05,20:30,1h 25m,non-stop,No info,2754,2019-03-15,19:05:00,20:30:00,0,85,0,1,0,2053,0,0,BOM,HYD,622.9702752863186,0,0,0,0,1,0,0,0,0,1,3,15,11,1,1,1,3,3,0,1,0,1,Mumbai_Hyderabad,697,1,16,0,0,439.743723731519,0.13644310711443464,0,0
Air India,21/05/2019,Delhi,Cochin,DEL → BLR → COK,17:40,23:00,5h 20m,1 stop,No info,8067,2019-05-21,17:40:00,23:00:00,0,320,0,1,0,1752,0,0,DEL,COK,2047.882109458646,0,0,0,0,0,0,0,0,0,0,5,21,21,2,1,1,2,3,0,0,1,0,Delhi_Cochin,4537,0,10,0,1,383.9778955234961,0.15625899485229228,1,0
Vistara,6/05/2019,Kolkata,Banglore,CCU → DEL → BLR,07:10,22:40,15h 30m,1 stop,No info,8452,2019-05-06,07:10:00,22:40:00,0,930,0,1,0,479,0,0,CCU,BLR,1546.4372901474003,0,0,0,0,0,0,0,0,0,0,5,6,19,2,1,1,1,3,1,0,1,0,Kolkata_Banglore,2871,1,25,1,0,99.77014775144518,0.601382290717625,1,0
Jet Airways,06/03/2019,Banglore,New Delhi,BLR → BOM → DEL,14:05,11:25 07 Mar,21h 20m,1 stop,No info,15025,2019-03-06,14:05:00,11:25:00,0,1280,0,0,0,3849,0,0,BLR,DEL,1708.6520853536679,0,0,0,0,0,0,0,0,0,0,3,6,10,1,1,1,2,1,0,0,1,0,Banglore_New Delhi,932,0,25,1,0,80.09306650095317,0.7491285153788679,1,0
Jet Airways,01/03/2019,Banglore,New Delhi,BLR → BOM → DEL,08:55,16:10,7h 15m,1 stop,No info,26890,2019-03-01,08:55:00,16:10:00,0,435,0,1,0,3849,0,0,BLR,DEL,1708.6520853536679,0,0,0,0,0,0,0,0,0,0,3,1,9,1,1,1,1,2,1,0,1,0,Banglore_New Delhi,932,0,30,1,0,235.6761497039542,0.25458664389828717,1,0
Jet Airways,6/03/2019,Delhi,Cochin,DEL → BOM → COK,13:00,18:50,5h 50m,1 stop,In-flight meal not included,15103,2019-03-06,13:00:00,18:50:00,0,350,0,1,0,3849,0,0,DEL,COK,2047.882109458646,0,0,0,0,0,0,0,0,0,0,3,6,10,1,1,1,2,3,0,0,1,0,Delhi_Cochin,4537,0,25,1,0,351.06550447862503,0.17090827561969466,1,0
Jet Airways,24/05/2019,Kolkata,Banglore,CCU → BOM → BLR,14:05,04:40 25 May,14h 35m,1 stop,In-flight meal not included,8586,2019-05-24,14:05:00,04:40:00,0,875,0,0,1,3849,0,0,CCU,BLR,1546.4372901474003,0,0,0,0,0,0,0,0,0,0,5,24,21,2,1,1,2,0,0,0,1,0,Kolkata_Banglore,2871,1,7,0,1,106.04141418153601,0.5658166713741095,1,0
Jet Airways,9/06/2019,Kolkata,Banglore,CCU → BOM → BLR,08:25,16:20,7h 55m,1 stop,In-flight meal not included,10844,2019-06-09,08:25:00,16:20:00,0,475,1,1,0,3849,0,0,CCU,BLR,1546.4372901474003,0,1,0,0,0,0,0,0,0,1,6,9,23,2,1,0,1,2,1,0,1,0,Kolkata_Banglore,2871,1,21,1,0,195.33944717651372,0.307157621603088,1,0
Jet Airways,21/05/2019,Delhi,Cochin,DEL → BOM → COK,21:50,04:25 22 May,6h 35m,1 stop,In-flight meal not included,12898,2019-05-21,21:50:00,04:25:00,0,395,0,0,1,3849,0,0,DEL,COK,2047.882109458646,0,0,0,0,0,0,0,0,0,0,5,21,21,2,1,1,3,0,0,1,1,0,Delhi_Cochin,4537,0,10,0,1,311.0707001709336,0.19288219677079826,1,0
Jet Airways,12/05/2019,Kolkata,Banglore,CCU → BOM → BLR,06:30,08:15 13 May,25h 45m,1 stop,In-flight meal not included,8586,2019-05-12,06:30:00,08:15:00,0,1545,1,0,0,3849,0,0,CCU,BLR,1546.4372901474003,0,0,0,0,0,0,0,0,0,0,5,12,19,2,1,1,1,1,1,0,1,0,Kolkata_Banglore,2871,1,19,0,0,60.055817093102924,0.9990705797405705,1,0
Multiple carriers,9/06/2019,Delhi,Cochin,DEL → BOM → COK,08:30,19:00,10h 30m,1 stop,No info,11622,2019-06-09,08:30:00,19:00:00,0,630,1,1,0,1196,0,0,DEL,COK,2047.882109458646,0,1,0,0,0,0,0,0,0,1,6,9,23,2,1,0,1,3,1,0,1,0,Delhi_Cochin,4537,0,21,1,0,195.0363913770139,0.3076348961154504,1,0
Air India,6/05/2019,Delhi,Cochin,DEL → LKO → BOM → COK,12:20,19:15 07 May,30h 55m,2 stops,No info,13538,2019-05-06,12:20:00,19:15:00,0,1855,0,0,0,1752,0,0,DEL,COK,2047.882109458646,0,0,0,0,0,0,0,0,0,0,5,6,19,2,1,1,2,3,0,0,2,0,Delhi_Cochin,4537,0,25,1,0,66.23877442992925,0.9058138607843818,1,0
Jet Airways,1/06/2019,Delhi,Cochin,DEL → JAI → BOM → COK,05:30,04:25 02 Jun,22h 55m,2 stops,No info,13014,2019-06-01,05:30:00,04:25:00,0,1375,1,0,1,3849,0,0,DEL,COK,2047.882109458646,0,1,0,0,0,0,0,0,0,1,6,1,22,2,1,0,0,0,0,0,2,0,Delhi_Cochin,4537,0,29,1,0,89.36212841274092,0.6714253685059434,1,0
Jet Airways,9/05/2019,Kolkata,Banglore,CCU → BOM → BLR,18:55,10:05 10 May,15h 10m,1 stop,No info,13941,2019-05-09,18:55:00,10:05:00,0,910,0,0,0,3849,0,0,CCU,BLR,1546.4372901474003,0,0,0,0,0,0,0,0,0,0,5,9,19,2,1,1,3,1,0,1,1,0,Kolkata_Banglore,2871,1,22,1,0,101.96289825147694,0.5884493382290739,1,0
Jet Airways,18/05/2019,Kolkata,Banglore,CCU → DEL → BLR,09:35,10:55 19 May,25h 20m,1 stop,No info,14151,2019-05-18,09:35:00,10:55:00,0,1520,1,0,0,3849,0,0,CCU,BLR,1546.4372901474003,0,0,0,0,0,0,0,0,0,0,5,18,20,2,1,1,1,1,1,0,1,0,Kolkata_Banglore,2871,1,13,0,0,61.04357724266053,0.9829043891298817,1,0
Multiple carriers,21/03/2019,Delhi,Cochin,DEL → BOM → COK,17:30,01:35 22 Mar,8h 5m,1 stop,No info,13542,2019-03-21,17:30:00,01:35:00,0,485,0,0,1,1196,0,0,DEL,COK,2047.882109458646,0,0,0,0,1,0,0,0,0,1,3,21,12,1,1,1,2,0,0,0,1,0,Delhi_Cochin,4537,0,10,0,1,253.3462403453995,0.23683003907300545,1,0
IndiGo,21/03/2019,Delhi,Cochin,DEL → HYD → COK,06:40,22:20,15h 40m,1 stop,No info,6558,2019-03-21,06:40:00,22:20:00,0,940,0,1,0,2053,0,0,DEL,COK,2047.882109458646,0,0,0,0,1,0,0,0,0,1,3,21,12,1,1,1,1,3,1,0,1,0,Delhi_Cochin,4537,0,10,0,1,130.7158793271476,0.45901079737860856,1,0
Air Asia,18/05/2019,Kolkata,Banglore,CCU → DEL → BLR,07:35,19:25,11h 50m,1 stop,No info,5192,2019-05-18,07:35:00,19:25:00,0,710,1,1,0,319,0,0,CCU,BLR,1546.4372901474003,0,0,0,0,0,0,0,0,0,0,5,18,20,2,1,1,1,3,1,0,1,0,Kolkata_Banglore,2871,1,13,0,0,130.68484142090708,0.4591198133435631,1,0
Vistara,1/06/2019,Banglore,Delhi,BLR → DEL,07:00,09:40,2h 40m,non-stop,No info,4878,2019-06-01,07:00:00,09:40:00,0,160,1,1,0,479,0,0,BLR,DEL,1708.6520853536679,0,1,0,0,0,0,0,0,0,1,6,1,22,2,1,0,1,1,1,0,0,1,Banglore_Delhi,1265,1,29,1,0,640.7445320076254,0.09364106442235849,1,0
Jet Airways,27/05/2019,Delhi,Cochin,DEL → BOM → COK,15:00,12:35 28 May,21h 35m,1 stop,In-flight meal not included,12898,2019-05-27,15:00:00,12:35:00,0,1295,0,0,0,3849,0,0,DEL,COK,2047.882109458646,0,0,0,0,0,0,0,0,0,0,5,27,22,2,1,1,2,2,0,0,1,0,Delhi_Cochin,4537,0,4,0,1,94.88256877800677,0.6323606197928703,1,0
Air India,9/06/2019,Delhi,Cochin,DEL → BLR → COK,17:40,23:00,5h 20m,1 stop,No info,7384,2019-06-09,17:40:00,23:00:00,0,320,1,1,0,1752,0,0,DEL,COK,2047.882109458646,0,1,0,0,0,0,0,0,0,1,6,9,23,2,1,0,2,3,0,0,1,0,Delhi_Cochin,4537,0,21,1,0,383.9778955234961,0.15625899485229228,1,0
GoAir,3/05/2019,Banglore,Delhi,BLR → DEL,07:45,10:40,2h 55m,non-stop,No info,3898,2019-05-03,07:45:00,10:40:00,0,175,0,1,0,194,0,0,BLR,DEL,1708.6520853536679,0,0,0,0,0,0,0,0,0,0,5,3,18,2,1,1,1,1,1,0,0,1,Banglore_Delhi,1265,1,28,1,0,585.8235721212576,0.10241991421195461,1,0
Air Asia,6/05/2019,Banglore,Delhi,BLR → DEL,23:55,02:45 07 May,2h 50m,non-stop,No info,3383,2019-05-06,23:55:00,02:45:00,0,170,0,0,1,319,0,0,BLR,DEL,1708.6520853536679,0,0,0,0,0,0,0,0,0,0,5,6,19,2,1,1,3,0,0,1,0,1,Banglore_Delhi,1265,1,25,1,0,603.0536771836476,0.0994936309487559,1,0
IndiGo,24/06/2019,Delhi,Cochin,DEL → BOM → COK,06:40,21:00,14h 20m,1 stop,No info,6093,2019-06-24,06:40:00,21:00:00,0,860,0,1,0,2053,0,0,DEL,COK,2047.882109458646,0,0,0,0,0,0,0,0,0,0,6,24,26,2,1,0,1,3,1,0,1,0,Delhi_Cochin,4537,0,6,0,1,142.87549600874274,0.4199460486655355,1,0
Multiple carriers,12/06/2019,Delhi,Cochin,DEL → BOM → COK,08:00,19:00,11h,1 stop,No info,12192,2019-06-12,08:00:00,19:00:00,0,660,0,1,0,1196,0,0,DEL,COK,2047.882109458646,0,0,0,0,0,0,0,0,0,0,6,12,24,2,1,0,1,3,1,0,1,0,Delhi_Cochin,4537,0,18,0,0,186.1711008598769,0.3222841768828528,1,0
Multiple carriers,12/06/2019,Delhi,Cochin,DEL → BOM → COK,12:50,01:30 13 Jun,12h 40m,1 stop,No info,6795,2019-06-12,12:50:00,01:30:00,0,760,0,0,1,1196,0,0,DEL,COK,2047.882109458646,0,0,0,0,0,0,0,0,0,0,6,12,24,2,1,0,2,0,0,0,1,0,Delhi_Cochin,4537,0,18,0,0,161.67490337831416,0.3711151127741941,1,0
Jet Airways,18/03/2019,Banglore,New Delhi,BLR → BOM → DEL,07:00,07:40 16 Mar,24h 40m,1 stop,No info,11455,2019-03-18,07:00:00,07:40:00,0,1480,0,0,0,3849,0,0,BLR,DEL,1708.6520853536679,0,0,0,0,1,0,0,0,0,1,3,18,12,1,1,1,1,1,1,0,1,0,Banglore_New Delhi,932,0,13,0,0,69.2696791359595,0.8661798459068161,1,0
IndiGo,1/06/2019,Chennai,Kolkata,MAA → CCU,15:40,18:25,2h 45m,non-stop,No info,3540,2019-06-01,15:40:00,18:25:00,0,165,1,1,0,2053,0,0,MAA,CCU,1385.198425287915,0,1,0,0,0,0,0,0,0,1,6,1,22,2,1,0,2,3,0,0,0,1,Chennai_Kolkata,381,1,29,1,0,503.7085182865145,0.11911650850000395,1,0
Multiple carriers,27/05/2019,Delhi,Cochin,DEL → BOM → COK,09:00,19:15,10h 15m,1 stop,No info,15898,2019-05-27,09:00:00,19:15:00,0,615,0,1,0,1196,0,0,DEL,COK,2047.882109458646,0,0,0,0,0,0,0,0,0,0,5,27,22,2,1,1,1,3,1,0,1,0,Delhi_Cochin,4537,0,4,0,1,199.79337653255084,0.3003102557317492,1,0
Multiple carriers,3/06/2019,Delhi,Cochin,DEL → BOM → COK,10:00,21:00,11h,1 stop,No info,9718,2019-06-03,10:00:00,21:00:00,0,660,0,1,0,1196,0,0,DEL,COK,2047.882109458646,0,1,0,0,0,0,0,0,0,1,6,3,23,2,1,0,1,3,1,0,1,0,Delhi_Cochin,4537,0,27,1,0,186.1711008598769,0.3222841768828528,1,0
GoAir,15/05/2019,Kolkata,Banglore,CCU → AMD → BLR,16:40,00:15 16 May,7h 35m,1 stop,No info,7831,2019-05-15,16:40:00,00:15:00,0,455,0,0,1,194,0,0,CCU,BLR,1546.4372901474003,0,0,0,0,0,0,0,0,0,0,5,15,20,2,1,1,2,0,0,0,1,0,Kolkata_Banglore,2871,1,16,0,0,203.9257965029539,0.29422466911453693,1,0
IndiGo,3/06/2019,Delhi,Cochin,DEL → BOM → COK,08:30,21:00,12h 30m,1 stop,No info,6416,2019-06-03,08:30:00,21:00:00,0,750,0,1,0,2053,0,0,DEL,COK,2047.882109458646,0,1,0,0,0,0,0,0,0,1,6,3,23,2,1,0,1,3,1,0,1,0,Delhi_Cochin,4537,0,27,1,0,163.83056875669166,0.36623201918506,1,0
Vistara,27/03/2019,Chennai,Kolkata,MAA → CCU,07:05,09:20,2h 15m,non-stop,No info,3739,2019-03-27,07:05:00,09:20:00,0,135,0,1,0,479,0,0,MAA,CCU,1385.198425287915,0,0,0,0,0,0,0,0,0,0,3,27,13,1,1,1,1,1,1,0,0,1,Chennai_Kolkata,381,1,4,0,1,615.6437445724066,0.09745896150000323,1,0
Vistara,6/05/2019,Kolkata,Banglore,CCU → DEL → BLR,07:10,23:25,16h 15m,1 stop,No info,8085,2019-05-06,07:10:00,23:25:00,0,975,0,1,0,479,0,0,CCU,BLR,1546.4372901474003,0,0,0,0,0,0,0,0,0,0,5,6,19,2,1,1,1,3,1,0,1,0,Kolkata_Banglore,2871,1,25,1,0,95.16537170137848,0.6304814338168648,1,0
IndiGo,3/05/2019,Banglore,Delhi,BLR → DEL,16:55,19:55,3h,non-stop,No info,4823,2019-05-03,16:55:00,19:55:00,0,180,0,1,0,2053,0,0,BLR,DEL,1708.6520853536679,0,0,0,0,0,0,0,0,0,0,5,3,18,2,1,1,2,3,0,0,0,1,Banglore_Delhi,1265,1,28,1,0,569.5506951178893,0.10534619747515331,1,0
Jet Airways,9/06/2019,Delhi,Cochin,DEL → NAG → BOM → COK,14:35,12:35 10 Jun,22h,2 stops,No info,13376,2019-06-09,14:35:00,12:35:00,0,1320,1,0,0,3849,0,0,DEL,COK,2047.882109458646,0,1,0,0,0,0,0,0,0,1,6,9,23,2,1,0,2,2,0,0,2,0,Delhi_Cochin,4537,0,21,1,0,93.08555042993845,0.6445683537657056,1,0
Vistara,15/05/2019,Kolkata,Banglore,CCU → DEL → BLR,20:20,10:45 16 May,14h 25m,1 stop,No info,8452,2019-05-15,20:20:00,10:45:00,0,865,0,0,0,479,0,0,CCU,BLR,1546.4372901474003,0,0,0,0,0,0,0,0,0,0,5,15,20,2,1,1,3,1,0,1,1,0,Kolkata_Banglore,2871,1,16,0,0,107.26732648421275,0.559350195129834,1,0
Jet Airways,6/06/2019,Kolkata,Banglore,CCU → BOM → BLR,20:00,22:35 07 Jun,26h 35m,1 stop,In-flight meal not included,10844,2019-06-06,20:00:00,22:35:00,0,1595,0,0,0,3849,0,0,CCU,BLR,1546.4372901474003,0,1,0,0,0,0,0,0,0,1,6,6,23,2,1,0,3,3,0,1,1,0,Kolkata_Banglore,2871,1,24,1,0,58.173189598021324,1.0314029609619482,1,0
Vistara,27/03/2019,Delhi,Cochin,DEL → COK,06:00,09:10,3h 10m,non-stop,No info,4851,2019-03-27,06:00:00,09:10:00,0,190,0,1,0,479,0,0,DEL,COK,2047.882109458646,0,0,0,0,0,0,0,0,0,0,3,27,13,1,1,1,1,1,1,0,0,1,Delhi_Cochin,4537,0,4,0,1,646.6996135132566,0.09277877819354853,1,0
Multiple carriers,15/06/2019,Delhi,Cochin,DEL → BOM → COK,19:00,01:30 16 Jun,6h 30m,1 stop,No info,6795,2019-06-15,19:00:00,01:30:00,0,390,1,0,1,1196,0,0,DEL,COK,2047.882109458646,0,0,0,0,0,0,0,0,0,0,6,15,24,2,1,0,3,0,0,1,1,0,Delhi_Cochin,4537,0,15,0,0,315.0587860705609,0.1904406499762312,1,0
IndiGo,18/05/2019,Banglore,Delhi,BLR → DEL,08:30,11:20,2h 50m,non-stop,No info,4823,2019-05-18,08:30:00,11:20:00,0,170,1,1,0,2053,0,0,BLR,DEL,1708.6520853536679,0,0,0,0,0,0,0,0,0,0,5,18,20,2,1,1,1,1,1,0,0,1,Banglore_Delhi,1265,1,13,0,0,603.0536771836476,0.0994936309487559,1,0
Jet Airways,9/06/2019,Delhi,Cochin,DEL → BOM → COK,20:55,04:25 10 Jun,7h 30m,1 stop,In-flight meal not included,10577,2019-06-09,20:55:00,04:25:00,0,450,1,0,1,3849,0,0,DEL,COK,2047.882109458646,0,1,0,0,0,0,0,0,0,1,6,9,23,2,1,0,3,0,0,1,1,0,Delhi_Cochin,4537,0,21,1,0,273.0509479278195,0.219739211511036,1,0
Jet Airways,27/03/2019,Delhi,Cochin,DEL → BOM → COK,20:50,19:45 28 Mar,22h 55m,1 stop,No info,12032,2019-03-27,20:50:00,19:45:00,0,1375,0,0,0,3849,0,0,DEL,COK,2047.882109458646,0,0,0,0,0,0,0,0,0,0,3,27,13,1,1,1,3,3,0,1,1,0,Delhi_Cochin,4537,0,4,0,1,89.36212841274092,0.6714253685059434,1,0
Air Asia,1/06/2019,Delhi,Cochin,DEL → BLR → COK,07:55,13:25,5h 30m,1 stop,No info,9330,2019-06-01,07:55:00,13:25:00,0,330,1,1,0,319,0,0,DEL,COK,2047.882109458646,0,1,0,0,0,0,0,0,0,1,6,1,22,2,1,0,1,2,1,0,1,0,Delhi_Cochin,4537,0,29,1,0,372.3422017197538,0.1611420884414264,1,0
Vistara,1/04/2019,Kolkata,Banglore,CCU → DEL → BLR,17:00,22:55,5h 55m,1 stop,No info,8977,2019-04-01,17:00:00,22:55:00,0,355,0,1,0,479,0,0,CCU,BLR,1546.4372901474003,0,0,0,0,0,0,0,0,0,0,4,1,14,2,1,1,2,3,0,0,1,0,Kolkata_Banglore,2871,1,29,1,0,261.36968284181415,0.22955990667178156,1,0
Multiple carriers,1/06/2019,Delhi,Cochin,DEL → BOM → COK,12:50,21:00,8h 10m,1 stop,No info,7005,2019-06-01,12:50:00,21:00:00,0,490,1,1,0,1196,0,0,DEL,COK,2047.882109458646,0,1,0,0,0,0,0,0,0,1,6,1,22,2,1,0,2,3,0,0,1,0,Delhi_Cochin,4537,0,29,1,0,250.7610746275893,0.23927158586757252,1,0
Jet Airways,18/05/2019,Kolkata,Banglore,CCU → BOM → BLR,14:05,20:45,6h 40m,1 stop,In-flight meal not included,10844,2019-05-18,14:05:00,20:45:00,0,400,1,1,0,3849,0,0,CCU,BLR,1546.4372901474003,0,0,0,0,0,0,0,0,0,0,5,18,20,2,1,1,2,3,0,0,1,0,Kolkata_Banglore,2871,1,13,0,0,231.96559352211003,0.2586590497710215,1,0
Multiple carriers,24/06/2019,Delhi,Cochin,DEL → BOM → COK,03:50,12:35,8h 45m,1 stop,No info,12192,2019-06-24,03:50:00,12:35:00,0,525,0,1,0,1196,0,0,DEL,COK,2047.882109458646,0,0,0,0,0,0,0,0,0,0,6,24,26,2,1,0,0,2,0,0,1,0,Delhi_Cochin,4537,0,6,0,1,234.0436696524167,0.256362413429542,1,0
Air India,24/03/2019,Banglore,New Delhi,BLR → DEL,10:00,12:45,2h 45m,non-stop,No info,4441,2019-03-24,10:00:00,12:45:00,0,165,1,1,0,1752,0,0,BLR,DEL,1708.6520853536679,0,0,0,0,1,0,0,0,0,1,3,24,12,1,1,1,1,2,1,0,0,1,Banglore_New Delhi,932,0,7,0,1,621.3280310376974,0.09656734768555719,1,0
Multiple carriers,9/05/2019,Delhi,Cochin,DEL → BOM → COK,10:35,19:15,8h 40m,1 stop,No info,7575,2019-05-09,10:35:00,19:15:00,0,520,0,1,0,1196,0,0,DEL,COK,2047.882109458646,0,0,0,0,0,0,0,0,0,0,5,9,19,2,1,1,1,3,1,0,1,0,Delhi_Cochin,4537,0,22,1,0,236.2940895529207,0.25392086663497493,1,0
IndiGo,21/06/2019,Kolkata,Banglore,CCU → BLR,04:40,07:15,2h 35m,non-stop,No info,4804,2019-06-21,04:40:00,07:15:00,0,155,0,1,0,2053,0,0,CCU,BLR,1546.4372901474003,0,0,0,0,0,0,0,0,0,0,6,21,25,2,1,0,0,1,0,0,0,1,Kolkata_Banglore,2871,1,9,0,1,598.6208865086711,0.10023038178627082,1,0
SpiceJet,6/06/2019,Chennai,Kolkata,MAA → CCU,09:45,12:00,2h 15m,non-stop,No info,3597,2019-06-06,09:45:00,12:00:00,0,135,0,1,0,818,0,0,MAA,CCU,1385.198425287915,0,1,0,0,0,0,0,0,0,1,6,6,23,2,1,0,1,2,1,0,0,1,Chennai_Kolkata,381,1,24,1,0,615.6437445724066,0.09745896150000323,1,0
Air India,6/06/2019,Kolkata,Banglore,CCU → DEL → BLR,17:30,20:25 07 Jun,26h 55m,1 stop,No info,10413,2019-06-06,17:30:00,20:25:00,0,1615,0,0,0,1752,0,0,CCU,BLR,1546.4372901474003,0,1,0,0,0,0,0,0,0,1,6,6,23,2,1,0,2,3,0,0,1,0,Kolkata_Banglore,2871,1,24,1,0,57.452778581327564,1.0443359134504993,1,0
Jet Airways,9/06/2019,Banglore,Delhi,BLR → DEL,06:00,08:45,2h 45m,non-stop,No info,8016,2019-06-09,06:00:00,08:45:00,0,165,1,1,0,3849,0,0,BLR,DEL,1708.6520853536679,0,1,0,0,0,0,0,0,0,1,6,9,23,2,1,0,1,1,1,0,0,1,Banglore_Delhi,1265,1,21,1,0,621.3280310376974,0.09656734768555719,1,0
Jet Airways,9/06/2019,Kolkata,Banglore,CCU → BOM → BLR,20:00,12:00 10 Jun,16h,1 stop,In-flight meal not included,10844,2019-06-09,20:00:00,12:00:00,0,960,1,0,0,3849,0,0,CCU,BLR,1546.4372901474003,0,1,0,0,0,0,0,0,0,1,6,9,23,2,1,0,3,2,0,1,1,0,Kolkata_Banglore,2871,1,21,1,0,96.65233063421252,0.6207817194504516,1,0
Jet Airways,12/05/2019,Kolkata,Banglore,CCU → BOM → BLR,16:30,09:20 13 May,16h 50m,1 stop,In-flight meal not included,9663,2019-05-12,16:30:00,09:20:00,0,1010,1,0,0,3849,0,0,CCU,BLR,1546.4372901474003,0,0,0,0,0,0,0,0,0,0,5,12,19,2,1,1,2,1,0,0,1,0,Kolkata_Banglore,2871,1,19,0,0,91.86756179093467,0.6531141006718293,1,0
IndiGo,18/05/2019,Delhi,Cochin,DEL → BOM → COK,20:25,01:30 19 May,5h 5m,1 stop,No info,6069,2019-05-18,20:25:00,01:30:00,0,305,1,0,1,2053,0,0,DEL,COK,2047.882109458646,0,0,0,0,0,0,0,0,0,0,5,18,20,2,1,1,3,0,0,1,1,0,Delhi_Cochin,4537,0,13,0,0,402.8620543197336,0.14893435446859107,1,0
IndiGo,27/05/2019,Delhi,Cochin,DEL → HYD → COK,11:55,22:30,10h 35m,1 stop,No info,6442,2019-05-27,11:55:00,22:30:00,0,635,0,1,0,2053,0,0,DEL,COK,2047.882109458646,0,0,0,0,0,0,0,0,0,0,5,27,22,2,1,1,1,3,1,0,1,0,Delhi_Cochin,4537,0,4,0,1,193.50067175987206,0.31007644291001746,1,0
Multiple carriers,1/06/2019,Delhi,Cochin,DEL → BOM → COK,09:00,21:00,12h,1 stop,No info,13587,2019-06-01,09:00:00,21:00:00,0,720,1,1,0,1196,0,0,DEL,COK,2047.882109458646,0,1,0,0,0,0,0,0,0,1,6,1,22,2,1,0,1,3,1,0,1,0,Delhi_Cochin,4537,0,29,1,0,170.65684245488717,0.3515827384176576,1,0
Air India,9/05/2019,Mumbai,Hyderabad,BOM → HYD,19:30,20:45,1h 15m,non-stop,No info,3100,2019-05-09,19:30:00,20:45:00,0,75,0,1,0,1752,0,0,BOM,HYD,622.9702752863186,0,0,0,0,0,0,0,0,0,0,5,9,19,2,1,1,3,3,0,1,0,1,Mumbai_Hyderabad,697,1,22,1,0,498.37622022905487,0.12039097686567761,0,0
Jet Airways,21/05/2019,Kolkata,Banglore,CCU → BOM → BLR,06:30,18:15,11h 45m,1 stop,No info,14781,2019-05-21,06:30:00,18:15:00,0,705,0,1,0,3849,0,0,CCU,BLR,1546.4372901474003,0,0,0,0,0,0,0,0,0,0,5,21,21,2,1,1,1,3,1,0,1,0,Kolkata_Banglore,2871,1,10,0,1,131.61168426786386,0.45588657522142534,1,0
Jet Airways,21/05/2019,Delhi,Cochin,DEL → BOM → COK,21:50,19:00 22 May,21h 10m,1 stop,In-flight meal not included,12898,2019-05-21,21:50:00,19:00:00,0,1270,0,0,1,3849,0,0,DEL,COK,2047.882109458646,0,0,0,0,0,0,0,0,0,0,5,21,21,2,1,1,3,3,0,1,1,0,Delhi_Cochin,4537,0,10,0,1,96.75033587993603,0.6201528858200349,1,0
IndiGo,18/06/2019,Kolkata,Banglore,CCU → BLR,14:25,16:55,2h 30m,non-stop,No info,4804,2019-06-18,14:25:00,16:55:00,0,150,0,1,0,2053,0,0,CCU,BLR,1546.4372901474003,0,0,0,0,0,0,0,0,0,0,6,18,25,2,1,0,2,2,0,0,0,1,Kolkata_Banglore,2871,1,12,0,0,618.5749160589601,0.09699714366413306,1,0
SpiceJet,15/04/2019,Kolkata,Banglore,CCU → BLR,09:00,11:25,2h 25m,non-stop,No info,4174,2019-04-15,09:00:00,11:25:00,0,145,0,1,0,818,0,0,CCU,BLR,1546.4372901474003,0,0,0,0,0,0,0,0,0,0,4,15,16,2,1,1,1,1,1,0,0,1,Kolkata_Banglore,2871,1,15,0,0,639.9050855782347,0.09376390554199529,1,0
IndiGo,24/05/2019,Banglore,Delhi,BLR → DEL,23:30,02:20 25 May,2h 50m,non-stop,No info,4591,2019-05-24,23:30:00,02:20:00,0,170,0,0,1,2053,0,0,BLR,DEL,1708.6520853536679,0,0,0,0,0,0,0,0,0,0,5,24,21,2,1,1,3,0,0,1,0,1,Banglore_Delhi,1265,1,7,0,1,603.0536771836476,0.0994936309487559,1,0
Jet Airways,6/05/2019,Kolkata,Banglore,CCU → BOM → BLR,16:30,19:50 07 May,27h 20m,1 stop,In-flight meal not included,9663,2019-05-06,16:30:00,19:50:00,0,1640,0,0,0,3849,0,0,CCU,BLR,1546.4372901474003,0,0,0,0,0,0,0,0,0,0,5,6,19,2,1,1,2,3,0,0,1,0,Kolkata_Banglore,2871,1,25,1,0,56.57697402978294,1.0605021040611882,1,0
Multiple carriers,15/05/2019,Delhi,Cochin,DEL → BOM → COK,08:45,19:15,10h 30m,1 stop,No info,8266,2019-05-15,08:45:00,19:15:00,0,630,0,1,0,1196,0,0,DEL,COK,2047.882109458646,0,0,0,0,0,0,0,0,0,0,5,15,20,2,1,1,1,3,1,0,1,0,Delhi_Cochin,4537,0,16,0,0,195.0363913770139,0.3076348961154504,1,0
IndiGo,6/05/2019,Banglore,Delhi,BLR → DEL,07:10,10:05,2h 55m,non-stop,No info,4823,2019-05-06,07:10:00,10:05:00,0,175,0,1,0,2053,0,0,BLR,DEL,1708.6520853536679,0,0,0,0,0,0,0,0,0,0,5,6,19,2,1,1,1,1,1,0,0,1,Banglore_Delhi,1265,1,25,1,0,585.8235721212576,0.10241991421195461,1,0
Air India,21/05/2019,Delhi,Cochin,DEL → COK,18:05,21:10,3h 5m,non-stop,No info,6094,2019-05-21,18:05:00,21:10:00,0,185,0,1,0,1752,0,0,DEL,COK,2047.882109458646,0,0,0,0,0,0,0,0,0,0,5,21,21,2,1,1,3,3,0,1,0,1,Delhi_Cochin,4537,0,10,0,1,664.1779814460473,0.09033723139898146,1,0
Jet Airways,24/05/2019,Kolkata,Banglore,CCU → BOM → BLR,21:10,04:40 25 May,7h 30m,1 stop,No info,14178,2019-05-24,21:10:00,04:40:00,0,450,0,0,1,3849,0,0,CCU,BLR,1546.4372901474003,0,0,0,0,0,0,0,0,0,0,5,24,21,2,1,1,3,0,0,1,1,0,Kolkata_Banglore,2871,1,7,0,1,206.19163868632003,0.29099143099239916,1,0
Jet Airways,9/06/2019,Delhi,Cochin,DEL → NAG → BOM → COK,06:45,12:35 10 Jun,29h 50m,2 stops,No info,13376,2019-06-09,06:45:00,12:35:00,0,1790,1,0,0,3849,0,0,DEL,COK,2047.882109458646,0,1,0,0,0,0,0,0,0,1,6,9,23,2,1,0,1,2,1,0,2,0,Delhi_Cochin,4537,0,21,1,0,68.64409305447975,0.8740737524550098,1,0
Air India,24/03/2019,Mumbai,Hyderabad,BOM → HYD,21:05,22:25,1h 20m,non-stop,No info,2575,2019-03-24,21:05:00,22:25:00,0,80,1,1,1,1752,0,0,BOM,HYD,622.9702752863186,0,0,0,0,1,0,0,0,0,1,3,24,12,1,1,1,3,3,0,1,0,1,Mumbai_Hyderabad,697,1,7,0,1,467.22770646473896,0.12841704199005613,0,0
Vistara,6/03/2019,Mumbai,Hyderabad,BOM → DEL → HYD,07:30,19:55,12h 25m,1 stop,No info,12395,2019-03-06,07:30:00,19:55:00,0,745,0,1,0,479,0,0,BOM,HYD,622.9702752863186,0,0,0,0,0,0,0,0,0,0,3,6,10,1,1,1,1,3,1,0,1,0,Mumbai_Hyderabad,697,1,25,1,0,50.172102707622976,1.1958837035323977,1,0
IndiGo,27/03/2019,Delhi,Cochin,DEL → BOM → COK,09:10,21:00,11h 50m,1 stop,No info,10351,2019-03-27,09:10:00,21:00:00,0,710,0,1,0,2053,0,0,DEL,COK,2047.882109458646,0,0,0,0,0,0,0,0,0,0,3,27,13,1,1,1,1,3,1,0,1,0,Delhi_Cochin,4537,0,4,0,1,173.06045995425177,0.34669964482852345,1,0
Air Asia,21/05/2019,Kolkata,Banglore,CCU → DEL → BLR,07:35,23:30,15h 55m,1 stop,No info,5192,2019-05-21,07:35:00,23:30:00,0,955,0,1,0,319,0,0,CCU,BLR,1546.4372901474003,0,0,0,0,0,0,0,0,0,0,5,21,21,2,1,1,1,3,1,0,1,0,Kolkata_Banglore,2871,1,10,0,1,97.15836377889426,0.6175484813283137,1,0
Multiple carriers,15/05/2019,Delhi,Cochin,DEL → BOM → COK,12:50,21:00,8h 10m,1 stop,No info,7670,2019-05-15,12:50:00,21:00:00,0,490,0,1,0,1196,0,0,DEL,COK,2047.882109458646,0,0,0,0,0,0,0,0,0,0,5,15,20,2,1,1,2,3,0,0,1,0,Delhi_Cochin,4537,0,16,0,0,250.7610746275893,0.23927158586757252,1,0
Air India,18/03/2019,Banglore,New Delhi,BLR → CCU → GAU → DEL,11:05,22:10 16 Mar,35h 5m,2 stops,No info,11161,2019-03-18,11:05:00,22:10:00,0,2105,0,0,0,1752,0,0,BLR,DEL,1708.6520853536679,0,0,0,0,1,0,0,0,0,1,3,18,12,1,1,1,1,3,1,0,2,0,Banglore_New Delhi,932,0,13,0,0,48.702672266612865,1.231965253806654,1,0
Jet Airways,24/05/2019,Kolkata,Banglore,CCU → DEL → BLR,20:25,18:00 25 May,21h 35m,1 stop,No info,14151,2019-05-24,20:25:00,18:00:00,0,1295,0,0,0,3849,0,0,CCU,BLR,1546.4372901474003,0,0,0,0,0,0,0,0,0,0,5,24,21,2,1,1,3,3,0,1,1,0,Kolkata_Banglore,2871,1,7,0,1,71.64960417671352,0.8374086736336821,1,0
IndiGo,6/05/2019,Kolkata,Banglore,CCU → HYD → BLR,15:15,20:05,4h 50m,1 stop,No info,4775,2019-05-06,15:15:00,20:05:00,0,290,0,1,0,2053,0,0,CCU,BLR,1546.4372901474003,0,0,0,0,0,0,0,0,0,0,5,6,19,2,1,1,2,3,0,0,1,0,Kolkata_Banglore,2871,1,25,1,0,319.95254278911733,0.18752781108399058,1,0
Air India,6/03/2019,Delhi,Cochin,DEL → HYD → MAA → COK,13:05,09:25 07 Mar,20h 20m,2 stops,No info,12865,2019-03-06,13:05:00,09:25:00,0,1220,0,0,0,1752,0,0,DEL,COK,2047.882109458646,0,0,0,0,0,0,0,0,0,0,3,6,10,1,1,1,2,1,0,0,2,0,Delhi_Cochin,4537,0,25,1,0,100.7155135799334,0.5957374178743643,1,0
Air India,6/03/2019,Mumbai,Hyderabad,BOM → HYD,19:30,20:45,1h 15m,non-stop,No info,5462,2019-03-06,19:30:00,20:45:00,0,75,0,1,0,1752,0,0,BOM,HYD,622.9702752863186,0,0,0,0,0,0,0,0,0,0,3,6,10,1,1,1,3,3,0,1,0,1,Mumbai_Hyderabad,697,1,25,1,0,498.37622022905487,0.12039097686567761,0,0
SpiceJet,9/03/2019,Delhi,Cochin,DEL → MAA → COK,06:10,11:20,5h 10m,1 stop,No info,8382,2019-03-09,06:10:00,11:20:00,0,310,1,1,0,818,0,0,DEL,COK,2047.882109458646,0,0,0,0,0,0,0,0,0,0,3,9,10,1,1,1,1,1,1,0,1,0,Delhi_Cochin,4537,0,22,1,0,396.3642792500605,0.15137590126315814,1,0
Jet Airways,24/04/2019,Banglore,Delhi,BLR → DEL,17:45,20:45,3h,non-stop,In-flight meal not included,4544,2019-04-24,17:45:00,20:45:00,0,180,0,1,0,3849,0,0,BLR,DEL,1708.6520853536679,0,0,0,0,0,0,0,0,0,0,4,24,17,2,1,1,2,3,0,0,0,1,Banglore_Delhi,1265,1,6,0,1,569.5506951178893,0.10534619747515331,1,0
Jet Airways,1/04/2019,Banglore,Delhi,BLR → DEL,15:15,18:10,2h 55m,non-stop,In-flight meal not included,4544,2019-04-01,15:15:00,18:10:00,0,175,0,1,0,3849,0,0,BLR,DEL,1708.6520853536679,0,0,0,0,0,0,0,0,0,0,4,1,14,2,1,1,2,3,0,0,0,1,Banglore_Delhi,1265,1,29,1,0,585.8235721212576,0.10241991421195461,1,0
Jet Airways,18/05/2019,Kolkata,Banglore,CCU → BOM → BLR,16:30,23:35,7h 5m,1 stop,No info,14781,2019-05-18,16:30:00,23:35:00,0,425,1,1,0,3849,0,0,CCU,BLR,1546.4372901474003,0,0,0,0,0,0,0,0,0,0,5,18,20,2,1,1,2,3,0,0,1,0,Kolkata_Banglore,2871,1,13,0,0,218.32055860904475,0.2748252403817103,1,0
SpiceJet,27/05/2019,Delhi,Cochin,DEL → PNQ → COK,08:45,13:15,4h 30m,1 stop,No check-in baggage included,5158,2019-05-27,08:45:00,13:15:00,0,270,0,1,0,818,0,0,DEL,COK,2047.882109458646,0,0,0,0,0,0,0,0,0,0,5,27,22,2,1,1,1,2,1,0,1,0,Delhi_Cochin,4537,0,4,0,1,455.08491321303245,0.1318435269066216,1,0
Jet Airways,21/03/2019,Mumbai,Hyderabad,BOM → HYD,15:50,17:20,1h 30m,non-stop,No info,5678,2019-03-21,15:50:00,17:20:00,0,90,0,1,0,3849,0,0,BOM,HYD,622.9702752863186,0,0,0,0,1,0,0,0,0,1,3,21,12,1,1,1,2,2,0,0,0,1,Mumbai_Hyderabad,697,1,10,0,1,415.3135168575457,0.14446917223881314,0,0
Jet Airways,9/06/2019,Delhi,Cochin,DEL → JDH → BOM → COK,11:40,19:00,7h 20m,2 stops,No info,18804,2019-06-09,11:40:00,19:00:00,0,440,1,1,0,3849,0,0,DEL,COK,2047.882109458646,0,1,0,0,0,0,0,0,0,1,6,9,23,2,1,0,1,3,1,0,2,0,Delhi_Cochin,4537,0,21,1,0,279.25665128981535,0.21485611792190187,1,0
IndiGo,3/06/2019,Mumbai,Hyderabad,BOM → HYD,09:10,10:40,1h 30m,non-stop,No info,4049,2019-06-03,09:10:00,10:40:00,0,90,0,1,0,2053,0,0,BOM,HYD,622.9702752863186,0,1,0,0,0,0,0,0,0,1,6,3,23,2,1,0,1,1,1,0,0,1,Mumbai_Hyderabad,697,1,27,1,0,415.3135168575457,0.14446917223881314,0,0
IndiGo,24/03/2019,Kolkata,Banglore,CCU → BLR,10:10,12:55,2h 45m,non-stop,No info,6565,2019-03-24,10:10:00,12:55:00,0,165,1,1,0,2053,0,0,CCU,BLR,1546.4372901474003,0,0,0,0,1,0,0,0,0,1,3,24,12,1,1,1,1,2,1,0,0,1,Kolkata_Banglore,2871,1,7,0,1,562.3408327808729,0.10669685803054636,1,0
Jet Airways,18/05/2019,Delhi,Cochin,DEL → BOM → COK,18:15,12:35 19 May,18h 20m,1 stop,In-flight meal not included,12373,2019-05-18,18:15:00,12:35:00,0,1100,1,0,0,3849,0,0,DEL,COK,2047.882109458646,0,0,0,0,0,0,0,0,0,0,5,18,20,2,1,1,3,2,0,1,1,0,Delhi_Cochin,4537,0,13,0,0,111.70266051592615,0.5371402948047547,1,0
Air India,18/03/2019,Banglore,New Delhi,BLR → DEL,17:00,19:45,2h 45m,non-stop,No info,4441,2019-03-18,17:00:00,19:45:00,0,165,0,1,0,1752,0,0,BLR,DEL,1708.6520853536679,0,0,0,0,1,0,0,0,0,1,3,18,12,1,1,1,2,3,0,0,0,1,Banglore_New Delhi,932,0,13,0,0,621.3280310376974,0.09656734768555719,1,0
SpiceJet,18/05/2019,Chennai,Kolkata,MAA → CCU,17:45,20:05,2h 20m,non-stop,No info,3597,2019-05-18,17:45:00,20:05:00,0,140,1,1,0,818,0,0,MAA,CCU,1385.198425287915,0,0,0,0,0,0,0,0,0,0,5,18,20,2,1,1,2,3,0,0,0,1,Chennai_Kolkata,381,1,13,0,0,593.656467980535,0.10106855266667002,1,0
Jet Airways,18/06/2019,Mumbai,Hyderabad,BOM → HYD,19:35,21:05,1h 30m,non-stop,No info,5678,2019-06-18,19:35:00,21:05:00,0,90,0,1,0,3849,0,0,BOM,HYD,622.9702752863186,0,0,0,0,0,0,0,0,0,0,6,18,25,2,1,0,3,3,0,1,0,1,Mumbai_Hyderabad,697,1,12,0,0,415.3135168575457,0.14446917223881314,0,0
Air India,9/03/2019,Delhi,Cochin,DEL → HYD → MAA → COK,09:45,09:25 10 Mar,23h 40m,2 stops,No info,10660,2019-03-09,09:45:00,09:25:00,0,1420,1,0,0,1752,0,0,DEL,COK,2047.882109458646,0,0,0,0,0,0,0,0,0,0,3,9,10,1,1,1,1,1,1,0,2,0,Delhi_Cochin,4537,0,22,1,0,86.53022997712588,0.6933992896570469,1,0
Jet Airways,21/04/2019,Banglore,Delhi,BLR → DEL,06:00,08:45,2h 45m,non-stop,In-flight meal not included,4544,2019-04-21,06:00:00,08:45:00,0,165,1,1,0,3849,0,0,BLR,DEL,1708.6520853536679,0,0,0,0,0,0,0,0,0,0,4,21,16,2,1,1,1,1,1,0,0,1,Banglore_Delhi,1265,1,9,0,1,621.3280310376974,0.09656734768555719,1,0
IndiGo,24/05/2019,Banglore,Delhi,BLR → DEL,08:30,11:20,2h 50m,non-stop,No info,4823,2019-05-24,08:30:00,11:20:00,0,170,0,1,0,2053,0,0,BLR,DEL,1708.6520853536679,0,0,0,0,0,0,0,0,0,0,5,24,21,2,1,1,1,1,1,0,0,1,Banglore_Delhi,1265,1,7,0,1,603.0536771836476,0.0994936309487559,1,0
Air India,9/05/2019,Kolkata,Banglore,CCU → VNS → DEL → BLR,14:30,23:15,8h 45m,2 stops,No info,14214,2019-05-09,14:30:00,23:15:00,0,525,0,1,0,1752,0,0,CCU,BLR,1546.4372901474003,0,0,0,0,0,0,0,0,0,0,5,9,19,2,1,1,2,3,0,0,2,0,Kolkata_Banglore,2871,1,22,1,0,176.73569030256002,0.3394900028244657,1,0
Jet Airways,1/05/2019,Kolkata,Banglore,CCU → BOM → BLR,08:25,16:20,7h 55m,1 stop,No info,14781,2019-05-01,08:25:00,16:20:00,0,475,0,1,0,3849,0,0,CCU,BLR,1546.4372901474003,0,0,0,0,0,0,0,0,0,0,5,1,18,2,1,1,1,2,1,0,1,0,Kolkata_Banglore,2871,1,30,1,0,195.33944717651372,0.307157621603088,1,0
Multiple carriers,1/03/2019,Delhi,Cochin,DEL → BOM → COK,19:00,01:35 02 Mar,6h 35m,1 stop,No info,23533,2019-03-01,19:00:00,01:35:00,0,395,0,0,1,1196,0,0,DEL,COK,2047.882109458646,0,0,0,0,0,0,0,0,0,0,3,1,9,1,1,1,3,0,0,1,1,0,Delhi_Cochin,4537,0,30,1,0,311.0707001709336,0.19288219677079826,1,0
Jet Airways,9/03/2019,Delhi,Cochin,DEL → BOM → COK,19:15,18:50 10 Mar,23h 35m,1 stop,In-flight meal not included,14053,2019-03-09,19:15:00,18:50:00,0,1415,1,0,0,3849,0,0,DEL,COK,2047.882109458646,0,0,0,0,0,0,0,0,0,0,3,9,10,1,1,1,3,3,0,1,1,0,Delhi_Cochin,4537,0,22,1,0,86.8359905070804,0.6909577428624799,1,0
Jet Airways,27/06/2019,Delhi,Cochin,DEL → BOM → COK,21:50,19:00 28 Jun,21h 10m,1 stop,In-flight meal not included,10262,2019-06-27,21:50:00,19:00:00,0,1270,0,0,1,3849,0,0,DEL,COK,2047.882109458646,0,0,0,0,0,0,0,0,0,0,6,27,26,2,1,0,3,3,0,1,1,0,Delhi_Cochin,4537,0,3,0,1,96.75033587993603,0.6201528858200349,1,0
IndiGo,21/06/2019,Banglore,Delhi,BLR → DEL,20:00,22:50,2h 50m,non-stop,No info,4823,2019-06-21,20:00:00,22:50:00,0,170,0,1,0,2053,0,0,BLR,DEL,1708.6520853536679,0,0,0,0,0,0,0,0,0,0,6,21,25,2,1,0,3,3,0,1,0,1,Banglore_Delhi,1265,1,9,0,1,603.0536771836476,0.0994936309487559,1,0
Air India,18/05/2019,Delhi,Cochin,DEL → BLR → COK,17:40,08:15 19 May,14h 35m,1 stop,No info,8361,2019-05-18,17:40:00,08:15:00,0,875,1,0,0,1752,0,0,DEL,COK,2047.882109458646,0,0,0,0,0,0,0,0,0,0,5,18,20,2,1,1,2,1,0,0,1,0,Delhi_Cochin,4537,0,13,0,0,140.42620179145,0.42727068904923665,1,0
Air India,9/06/2019,Delhi,Cochin,DEL → NAG → BOM → COK,05:55,19:15 10 Jun,37h 20m,2 stops,No info,10493,2019-06-09,05:55:00,19:15:00,0,2240,1,0,0,1752,0,0,DEL,COK,2047.882109458646,0,1,0,0,0,0,0,0,0,1,6,9,23,2,1,0,0,3,0,0,2,0,Delhi_Cochin,4537,0,21,1,0,54.853985074785164,1.0938129639660459,1,0
Multiple carriers,3/03/2019,Delhi,Cochin,DEL → BOM → COK,07:05,13:20,6h 15m,1 stop,No info,17057,2019-03-03,07:05:00,13:20:00,0,375,1,1,0,1196,0,0,DEL,COK,2047.882109458646,0,0,0,0,0,0,0,0,0,0,3,3,9,1,1,1,1,2,1,0,1,0,Delhi_Cochin,4537,0,28,1,0,327.6611375133833,0.18311600959253,1,0
Air India,18/05/2019,Delhi,Cochin,DEL → HYD → BOM → COK,17:15,19:15 19 May,26h,2 stops,No info,12392,2019-05-18,17:15:00,19:15:00,0,1560,1,0,0,1752,0,0,DEL,COK,2047.882109458646,0,0,0,0,0,0,0,0,0,0,5,18,20,2,1,1,2,3,0,0,2,0,Delhi_Cochin,4537,0,13,0,0,78.76469651764023,0.7617625999049248,1,0
IndiGo,12/06/2019,Delhi,Cochin,DEL → BOM → COK,11:25,01:30 13 Jun,14h 5m,1 stop,No info,5883,2019-06-12,11:25:00,01:30:00,0,845,0,0,1,2053,0,0,DEL,COK,2047.882109458646,0,0,0,0,0,0,0,0,0,0,6,12,24,2,1,0,1,0,1,0,1,0,Delhi_Cochin,4537,0,18,0,0,145.41174741718197,0.41262140828183425,1,0
Jet Airways,21/05/2019,Delhi,Cochin,DEL → BOM → COK,11:30,19:00,7h 30m,1 stop,In-flight meal not included,12898,2019-05-21,11:30:00,19:00:00,0,450,0,1,0,3849,0,0,DEL,COK,2047.882109458646,0,0,0,0,0,0,0,0,0,0,5,21,21,2,1,1,1,3,1,0,1,0,Delhi_Cochin,4537,0,10,0,1,273.0509479278195,0.219739211511036,1,0
Jet Airways,21/05/2019,Delhi,Cochin,DEL → BOM → COK,02:15,19:00,16h 45m,1 stop,No info,16079,2019-05-21,02:15:00,19:00:00,0,1005,0,1,1,3849,0,0,DEL,COK,2047.882109458646,0,0,0,0,0,0,0,0,0,0,5,21,21,2,1,1,0,3,0,0,1,0,Delhi_Cochin,4537,0,10,0,1,122.26161847514304,0.4907509057079804,1,0
Multiple carriers,12/06/2019,Delhi,Cochin,DEL → BOM → COK,04:55,12:35,7h 40m,1 stop,No info,10678,2019-06-12,04:55:00,12:35:00,0,460,0,1,0,1196,0,0,DEL,COK,2047.882109458646,0,0,0,0,0,0,0,0,0,0,6,12,24,2,1,0,0,2,0,0,1,0,Delhi_Cochin,4537,0,18,0,0,267.1150577554756,0.22462230510017014,1,0
Air India,01/03/2019,Banglore,New Delhi,BLR → BOM → IDR → DEL,06:45,11:10 02 Mar,28h 25m,2 stops,No info,20999,2019-03-01,06:45:00,11:10:00,0,1705,0,0,0,1752,0,0,BLR,DEL,1708.6520853536679,0,0,0,0,0,0,0,0,0,0,3,1,9,1,1,1,1,1,1,0,2,0,Banglore_New Delhi,932,0,30,1,0,60.12851913268039,0.9978625927507577,1,0
IndiGo,21/03/2019,Banglore,New Delhi,BLR → BOM → DEL,19:35,00:35 19 Mar,5h,1 stop,No info,6575,2019-03-21,19:35:00,00:35:00,0,300,0,0,1,2053,0,0,BLR,DEL,1708.6520853536679,0,0,0,0,1,0,0,0,0,1,3,21,12,1,1,1,3,0,0,1,1,0,Banglore_New Delhi,932,0,10,0,1,341.73041707073355,0.17557699579192218,1,0
Jet Airways,21/05/2019,Delhi,Cochin,DEL → JAI → BOM → COK,19:30,04:25 22 May,8h 55m,2 stops,No info,15129,2019-05-21,19:30:00,04:25:00,0,535,0,0,1,3849,0,0,DEL,COK,2047.882109458646,0,0,0,0,0,0,0,0,0,0,5,21,21,2,1,1,3,0,0,1,2,0,Delhi_Cochin,4537,0,10,0,1,229.66902162153042,0.26124550701867616,1,0
Jet Airways,6/06/2019,Kolkata,Banglore,CCU → BOM → BLR,18:55,18:15 07 Jun,23h 20m,1 stop,In-flight meal not included,10844,2019-06-06,18:55:00,18:15:00,0,1400,0,0,0,3849,0,0,CCU,BLR,1546.4372901474003,0,1,0,0,0,0,0,0,0,1,6,6,23,2,1,0,3,3,0,1,1,0,Kolkata_Banglore,2871,1,24,1,0,66.27588386346002,0.9053066741985751,1,0
Air India,03/03/2019,Banglore,New Delhi,BLR → BBI → DEL,09:30,23:45,14h 15m,1 stop,No info,11654,2019-03-03,09:30:00,23:45:00,0,855,1,1,0,1752,0,0,BLR,DEL,1708.6520853536679,0,0,0,0,0,0,0,0,0,0,3,3,9,1,1,1,1,3,1,0,1,0,Banglore_New Delhi,932,0,28,1,0,119.905409498503,0.5003944380069782,1,0
IndiGo,1/04/2019,Kolkata,Banglore,CCU → MAA → BLR,08:10,13:00,4h 50m,1 stop,No info,5069,2019-04-01,08:10:00,13:00:00,0,290,0,1,0,2053,0,0,CCU,BLR,1546.4372901474003,0,0,0,0,0,0,0,0,0,0,4,1,14,2,1,1,1,2,1,0,1,0,Kolkata_Banglore,2871,1,29,1,0,319.95254278911733,0.18752781108399058,1,0
Air India,1/04/2019,Banglore,Delhi,BLR → DEL,06:10,08:55,2h 45m,non-stop,No info,5176,2019-04-01,06:10:00,08:55:00,0,165,0,1,0,1752,0,0,BLR,DEL,1708.6520853536679,0,0,0,0,0,0,0,0,0,0,4,1,14,2,1,1,1,1,1,0,0,1,Banglore_Delhi,1265,1,29,1,0,621.3280310376974,0.09656734768555719,1,0
Jet Airways,9/06/2019,Delhi,Cochin,DEL → IDR → BOM → COK,05:30,04:25 10 Jun,22h 55m,2 stops,No info,13292,2019-06-09,05:30:00,04:25:00,0,1375,1,0,1,3849,0,0,DEL,COK,2047.882109458646,0,1,0,0,0,0,0,0,0,1,6,9,23,2,1,0,0,0,0,0,2,0,Delhi_Cochin,4537,0,21,1,0,89.36212841274092,0.6714253685059434,1,0
IndiGo,6/06/2019,Delhi,Cochin,DEL → BLR → COK,02:00,07:45,5h 45m,1 stop,No info,6386,2019-06-06,02:00:00,07:45:00,0,345,0,1,1,2053,0,0,DEL,COK,2047.882109458646,0,1,0,0,0,0,0,0,0,1,6,6,23,2,1,0,0,1,0,0,1,0,Delhi_Cochin,4537,0,24,1,0,356.1534103406341,0.1684667288251276,1,0
Jet Airways,21/05/2019,Delhi,Cochin,DEL → AMD → BOM → COK,13:25,19:00 22 May,29h 35m,2 stops,No info,15129,2019-05-21,13:25:00,19:00:00,0,1775,0,0,0,3849,0,0,DEL,COK,2047.882109458646,0,0,0,0,0,0,0,0,0,0,5,21,21,2,1,1,2,3,0,0,2,0,Delhi_Cochin,4537,0,10,0,1,69.2241839817007,0.8667491120713087,1,0
Air India,6/03/2019,Kolkata,Banglore,CCU → BLR,20:45,23:20,2h 35m,non-stop,No info,4435,2019-03-06,20:45:00,23:20:00,0,155,0,1,0,1752,0,0,CCU,BLR,1546.4372901474003,0,0,0,0,0,0,0,0,0,0,3,6,10,1,1,1,3,3,0,1,0,1,Kolkata_Banglore,2871,1,25,1,0,598.6208865086711,0.10023038178627082,1,0
IndiGo,18/05/2019,Banglore,Delhi,BLR → DEL,23:30,02:20 19 May,2h 50m,non-stop,No info,4591,2019-05-18,23:30:00,02:20:00,0,170,1,0,1,2053,0,0,BLR,DEL,1708.6520853536679,0,0,0,0,0,0,0,0,0,0,5,18,20,2,1,1,3,0,0,1,0,1,Banglore_Delhi,1265,1,13,0,0,603.0536771836476,0.0994936309487559,1,0
Jet Airways,21/03/2019,Banglore,New Delhi,BLR → BOM → DEL,05:45,23:00,17h 15m,1 stop,In-flight meal not included,7832,2019-03-21,05:45:00,23:00:00,0,1035,0,1,0,3849,0,0,BLR,DEL,1708.6520853536679,0,0,0,0,1,0,0,0,0,1,3,21,12,1,1,1,0,3,0,0,1,0,Banglore_New Delhi,932,0,10,0,1,99.05229480311118,0.6057406354821315,1,0
IndiGo,12/04/2019,Kolkata,Banglore,CCU → BLR,04:40,07:15,2h 35m,non-stop,No info,4174,2019-04-12,04:40:00,07:15:00,0,155,0,1,0,2053,0,0,CCU,BLR,1546.4372901474003,0,0,0,0,0,0,0,0,0,0,4,12,15,2,1,1,0,1,0,0,0,1,Kolkata_Banglore,2871,1,18,0,0,598.6208865086711,0.10023038178627082,1,0
Multiple carriers,27/03/2019,Delhi,Cochin,DEL → BOM → COK,07:00,15:30,8h 30m,1 stop,No info,6148,2019-03-27,07:00:00,15:30:00,0,510,0,1,0,1196,0,0,DEL,COK,2047.882109458646,0,0,0,0,0,0,0,0,0,0,3,27,13,1,1,1,1,2,1,0,1,0,Delhi_Cochin,4537,0,4,0,1,240.92730699513484,0.2490377730458408,1,0
Multiple carriers,27/05/2019,Delhi,Cochin,DEL → BOM → COK,09:15,19:15,10h,1 stop,No info,9149,2019-05-27,09:15:00,19:15:00,0,600,0,1,0,1196,0,0,DEL,COK,2047.882109458646,0,0,0,0,0,0,0,0,0,0,5,27,22,2,1,1,1,3,1,0,1,0,Delhi_Cochin,4537,0,4,0,1,204.7882109458646,0.292985615348048,1,0
Multiple carriers,27/03/2019,Delhi,Cochin,DEL → HYD → MAA → COK,13:05,21:20,8h 15m,2 stops,No info,6128,2019-03-27,13:05:00,21:20:00,0,495,0,1,0,1196,0,0,DEL,COK,2047.882109458646,0,0,0,0,0,0,0,0,0,0,3,27,13,1,1,1,2,3,0,0,2,0,Delhi_Cochin,4537,0,4,0,1,248.2281344798359,0.2417131326621396,1,0
IndiGo,27/03/2019,Delhi,Cochin,DEL → HYD → COK,16:10,22:20,6h 10m,1 stop,No info,6412,2019-03-27,16:10:00,22:20:00,0,370,0,1,0,2053,0,0,DEL,COK,2047.882109458646,0,0,0,0,0,0,0,0,0,0,3,27,13,1,1,1,2,3,0,0,1,0,Delhi_Cochin,4537,0,4,0,1,332.08899072302364,0.18067446279796293,1,0
Multiple carriers,18/05/2019,Delhi,Cochin,DEL → BOM → COK,08:00,21:00,13h,1 stop,No info,8073,2019-05-18,08:00:00,21:00:00,0,780,1,1,0,1196,0,0,DEL,COK,2047.882109458646,0,0,0,0,0,0,0,0,0,0,5,18,20,2,1,1,1,3,1,0,1,0,Delhi_Cochin,4537,0,13,0,0,157.52939303528046,0.3808812999524624,1,0
Jet Airways,24/06/2019,Delhi,Cochin,DEL → COK,11:00,14:15,3h 15m,non-stop,In-flight meal not included,4256,2019-06-24,11:00:00,14:15:00,0,195,0,1,0,3849,0,0,DEL,COK,2047.882109458646,0,0,0,0,0,0,0,0,0,0,6,24,26,2,1,0,1,2,1,0,0,1,Delhi_Cochin,4537,0,6,0,1,630.1175721411219,0.0952203249881156,1,0
Air India,12/05/2019,Kolkata,Banglore,CCU → DEL → AMD → BLR,10:00,05:25 13 May,19h 25m,2 stops,No info,14634,2019-05-12,10:00:00,05:25:00,0,1165,1,0,1,1752,0,0,CCU,BLR,1546.4372901474003,0,0,0,0,0,0,0,0,0,0,5,12,19,2,1,1,1,0,1,0,2,0,Kolkata_Banglore,2871,1,19,0,0,79.6448389775485,0.7533444824581,1,0
Multiple carriers,21/05/2019,Delhi,Cochin,DEL → BOM → COK,13:00,21:00,8h,1 stop,No info,14067,2019-05-21,13:00:00,21:00:00,0,480,0,1,0,1196,0,0,DEL,COK,2047.882109458646,0,0,0,0,0,0,0,0,0,0,5,21,21,2,1,1,2,3,0,0,1,0,Delhi_Cochin,4537,0,10,0,1,255.98526368233078,0.23438849227843842,1,0
IndiGo,6/05/2019,Kolkata,Banglore,CCU → BLR,15:30,18:05,2h 35m,non-stop,No info,4804,2019-05-06,15:30:00,18:05:00,0,155,0,1,0,2053,0,0,CCU,BLR,1546.4372901474003,0,0,0,0,0,0,0,0,0,0,5,6,19,2,1,1,2,3,0,0,0,1,Kolkata_Banglore,2871,1,25,1,0,598.6208865086711,0.10023038178627082,1,0
SpiceJet,21/04/2019,Kolkata,Banglore,CCU → BLR,17:10,19:40,2h 30m,non-stop,No info,4911,2019-04-21,17:10:00,19:40:00,0,150,1,1,0,818,0,0,CCU,BLR,1546.4372901474003,0,0,0,0,0,0,0,0,0,0,4,21,16,2,1,1,2,3,0,0,0,1,Kolkata_Banglore,2871,1,9,0,1,618.5749160589601,0.09699714366413306,1,0
IndiGo,9/06/2019,Delhi,Cochin,DEL → HYD → COK,16:10,22:30,6h 20m,1 stop,No info,6412,2019-06-09,16:10:00,22:30:00,0,380,1,1,0,2053,0,0,DEL,COK,2047.882109458646,0,1,0,0,0,0,0,0,0,1,6,9,23,2,1,0,2,3,0,0,1,0,Delhi_Cochin,4537,0,21,1,0,323.3498067566283,0.18555755638709706,1,0
SpiceJet,15/06/2019,Chennai,Kolkata,MAA → CCU,08:20,10:35,2h 15m,non-stop,No check-in baggage included,3543,2019-06-15,08:20:00,10:35:00,0,135,1,1,0,818,0,0,MAA,CCU,1385.198425287915,0,0,0,0,0,0,0,0,0,0,6,15,24,2,1,0,1,1,1,0,0,1,Chennai_Kolkata,381,1,15,0,0,615.6437445724066,0.09745896150000323,1,0
IndiGo,6/06/2019,Chennai,Kolkata,MAA → CCU,11:35,14:00,2h 25m,non-stop,No info,3858,2019-06-06,11:35:00,14:00:00,0,145,0,1,0,2053,0,0,MAA,CCU,1385.198425287915,0,1,0,0,0,0,0,0,0,1,6,6,23,2,1,0,1,2,1,0,0,1,Chennai_Kolkata,381,1,24,1,0,573.1855552915509,0.1046781438333368,1,0
Air India,15/05/2019,Kolkata,Banglore,CCU → BBI → BOM → BLR,12:00,07:55 16 May,19h 55m,2 stops,No info,9941,2019-05-15,12:00:00,07:55:00,0,1195,0,0,0,1752,0,0,CCU,BLR,1546.4372901474003,0,0,0,0,0,0,0,0,0,0,5,15,20,2,1,1,2,1,0,0,2,0,Kolkata_Banglore,2871,1,16,0,0,77.64538695300755,0.7727439111909267,1,0
Jet Airways,9/04/2019,Banglore,Delhi,BLR → DEL,08:20,11:20,3h,non-stop,No info,7229,2019-04-09,08:20:00,11:20:00,0,180,0,1,0,3849,0,0,BLR,DEL,1708.6520853536679,0,0,0,0,0,0,0,0,0,0,4,9,15,2,1,1,1,1,1,0,0,1,Banglore_Delhi,1265,1,21,1,0,569.5506951178893,0.10534619747515331,1,0
GoAir,03/03/2019,Banglore,New Delhi,BLR → GOI → DEL,15:45,20:15,4h 30m,1 stop,No info,8352,2019-03-03,15:45:00,20:15:00,0,270,1,1,0,194,0,0,BLR,DEL,1708.6520853536679,0,0,0,0,0,0,0,0,0,0,3,3,9,1,1,1,2,3,0,0,1,0,Banglore_New Delhi,932,0,28,1,0,379.7004634119262,0.15801929621272995,1,0
Jet Airways,12/05/2019,Kolkata,Banglore,CCU → DEL → BLR,09:35,22:05,12h 30m,1 stop,No info,14151,2019-05-12,09:35:00,22:05:00,0,750,1,1,0,3849,0,0,CCU,BLR,1546.4372901474003,0,0,0,0,0,0,0,0,0,0,5,12,19,2,1,1,1,3,1,0,1,0,Kolkata_Banglore,2871,1,19,0,0,123.71498321179202,0.4849857183206653,1,0
Multiple carriers,6/06/2019,Delhi,Cochin,DEL → BOM → COK,17:45,01:30 07 Jun,7h 45m,1 stop,No info,6795,2019-06-06,17:45:00,01:30:00,0,465,0,0,1,1196,0,0,DEL,COK,2047.882109458646,0,1,0,0,0,0,0,0,0,1,6,6,23,2,1,0,2,0,0,0,1,0,Delhi_Cochin,4537,0,24,1,0,264.2428528333737,0.2270638518947372,1,0
IndiGo,3/05/2019,Kolkata,Banglore,CCU → BLR,20:20,22:55,2h 35m,non-stop,No info,4804,2019-05-03,20:20:00,22:55:00,0,155,0,1,0,2053,0,0,CCU,BLR,1546.4372901474003,0,0,0,0,0,0,0,0,0,0,5,3,18,2,1,1,3,3,0,1,0,1,Kolkata_Banglore,2871,1,28,1,0,598.6208865086711,0.10023038178627082,1,0
Air India,6/06/2019,Delhi,Cochin,DEL → TRV → COK,05:15,06:50 07 Jun,25h 35m,1 stop,No info,6587,2019-06-06,05:15:00,06:50:00,0,1535,0,0,1,1752,0,0,DEL,COK,2047.882109458646,0,1,0,0,0,0,0,0,0,1,6,6,23,2,1,0,0,1,0,0,1,0,Delhi_Cochin,4537,0,24,1,0,80.04750916450735,0.7495548659320894,1,0
GoAir,3/04/2019,Delhi,Cochin,DEL → AMD → COK,07:25,13:35,6h 10m,1 stop,No info,4106,2019-04-03,07:25:00,13:35:00,0,370,0,1,0,194,0,0,DEL,COK,2047.882109458646,0,0,0,0,0,0,0,0,0,0,4,3,14,2,1,1,1,2,1,0,1,0,Delhi_Cochin,4537,0,27,1,0,332.08899072302364,0.18067446279796293,1,0
Air India,18/04/2019,Kolkata,Banglore,CCU → BLR,14:15,16:45,2h 30m,non-stop,No info,5510,2019-04-18,14:15:00,16:45:00,0,150,0,1,0,1752,0,0,CCU,BLR,1546.4372901474003,0,0,0,0,0,0,0,0,0,0,4,18,16,2,1,1,2,2,0,0,0,1,Kolkata_Banglore,2871,1,12,0,0,618.5749160589601,0.09699714366413306,1,0
Jet Airways,9/05/2019,Delhi,Cochin,DEL → JAI → BOM → COK,09:40,19:00,9h 20m,2 stops,No info,15129,2019-05-09,09:40:00,19:00:00,0,560,0,1,0,3849,0,0,DEL,COK,2047.882109458646,0,0,0,0,0,0,0,0,0,0,5,9,19,2,1,1,1,3,1,0,2,0,Delhi_Cochin,4537,0,22,1,0,219.41594029914066,0.27345324099151147,1,0
Jet Airways,9/05/2019,Delhi,Cochin,DEL → JAI → BOM → COK,09:40,04:25 10 May,18h 45m,2 stops,In-flight meal not included,13029,2019-05-09,09:40:00,04:25:00,0,1125,0,0,1,3849,0,0,DEL,COK,2047.882109458646,0,0,0,0,0,0,0,0,0,0,5,9,19,2,1,1,1,0,1,0,2,0,Delhi_Cochin,4537,0,22,1,0,109.22037917112779,0.54934802877759,1,0
IndiGo,15/06/2019,Delhi,Cochin,DEL → MAA → COK,07:15,12:30,5h 15m,1 stop,No info,6582,2019-06-15,07:15:00,12:30:00,0,315,1,1,0,2053,0,0,DEL,COK,2047.882109458646,0,0,0,0,0,0,0,0,0,0,6,15,24,2,1,0,1,2,1,0,1,0,Delhi_Cochin,4537,0,15,0,0,390.0727827540278,0.1538174480577252,1,0
Multiple carriers,27/06/2019,Delhi,Cochin,DEL → BOM → COK,17:45,01:30 28 Jun,7h 45m,1 stop,In-flight meal not included,5797,2019-06-27,17:45:00,01:30:00,0,465,0,0,1,1196,0,0,DEL,COK,2047.882109458646,0,0,0,0,0,0,0,0,0,0,6,27,26,2,1,0,2,0,0,0,1,0,Delhi_Cochin,4537,0,3,0,1,264.2428528333737,0.2270638518947372,1,0
Jet Airways,12/06/2019,Kolkata,Banglore,CCU → DEL → BLR,20:25,10:55 13 Jun,14h 30m,1 stop,No info,12692,2019-06-12,20:25:00,10:55:00,0,870,0,0,0,3849,0,0,CCU,BLR,1546.4372901474003,0,0,0,0,0,0,0,0,0,0,6,12,24,2,1,0,3,1,0,1,1,0,Kolkata_Banglore,2871,1,18,0,0,106.65084759637244,0.5625834332519717,1,0
SpiceJet,27/03/2019,Chennai,Kolkata,MAA → CCU,08:20,10:35,2h 15m,non-stop,No check-in baggage included,3332,2019-03-27,08:20:00,10:35:00,0,135,0,1,0,818,0,0,MAA,CCU,1385.198425287915,0,0,0,0,0,0,0,0,0,0,3,27,13,1,1,1,1,1,1,0,0,1,Chennai_Kolkata,381,1,4,0,1,615.6437445724066,0.09745896150000323,1,0
Air India,9/06/2019,Kolkata,Banglore,CCU → BBI → BOM → BLR,12:00,07:55 10 Jun,19h 55m,2 stops,No info,10151,2019-06-09,12:00:00,07:55:00,0,1195,1,0,0,1752,0,0,CCU,BLR,1546.4372901474003,0,1,0,0,0,0,0,0,0,1,6,9,23,2,1,0,2,1,0,0,2,0,Kolkata_Banglore,2871,1,21,1,0,77.64538695300755,0.7727439111909267,1,0
IndiGo,6/04/2019,Delhi,Cochin,DEL → MAA → COK,02:00,07:25,5h 25m,1 stop,No info,5046,2019-04-06,02:00:00,07:25:00,0,325,1,1,1,2053,0,0,DEL,COK,2047.882109458646,0,0,0,0,0,0,0,0,0,0,4,6,14,2,1,1,0,1,0,0,1,0,Delhi_Cochin,4537,0,24,1,0,378.07054328467314,0.15870054164685934,1,0
Air India,15/06/2019,Delhi,Cochin,DEL → BLR → COK,06:10,23:00,16h 50m,1 stop,No info,8907,2019-06-15,06:10:00,23:00:00,0,1010,1,1,0,1752,0,0,DEL,COK,2047.882109458646,0,0,0,0,0,0,0,0,0,0,6,15,24,2,1,0,1,3,1,0,1,0,Delhi_Cochin,4537,0,15,0,0,121.65636293813739,0.49319245250254745,1,0
Air India,6/05/2019,Banglore,Delhi,BLR → DEL,21:05,23:55,2h 50m,non-stop,No info,5228,2019-05-06,21:05:00,23:55:00,0,170,0,1,1,1752,0,0,BLR,DEL,1708.6520853536679,0,0,0,0,0,0,0,0,0,0,5,6,19,2,1,1,3,3,0,1,0,1,Banglore_Delhi,1265,1,25,1,0,603.0536771836476,0.0994936309487559,1,0
IndiGo,3/03/2019,Delhi,Cochin,DEL → LKO → COK,05:35,10:10,4h 35m,1 stop,No info,13753,2019-03-03,05:35:00,10:10:00,0,275,1,1,0,2053,0,0,DEL,COK,2047.882109458646,0,0,0,0,0,0,0,0,0,0,3,3,9,1,1,1,0,1,0,0,1,0,Delhi_Cochin,4537,0,28,1,0,446.8106420637046,0.13428507370118867,1,0
Jet Airways,09/03/2019,Banglore,New Delhi,BLR → BOM → DEL,08:55,21:20,12h 25m,1 stop,In-flight meal not included,11087,2019-03-09,08:55:00,21:20:00,0,745,1,1,0,3849,0,0,BLR,DEL,1708.6520853536679,0,0,0,0,0,0,0,0,0,0,3,9,10,1,1,1,1,3,1,0,1,0,Banglore_New Delhi,932,0,22,1,0,137.60956392110077,0.43601620621660675,1,0
Jet Airways,18/05/2019,Kolkata,Banglore,CCU → BOM → BLR,14:05,23:35,9h 30m,1 stop,No info,14781,2019-05-18,14:05:00,23:35:00,0,570,1,1,0,3849,0,0,CCU,BLR,1546.4372901474003,0,0,0,0,0,0,0,0,0,0,5,18,20,2,1,1,2,3,0,0,1,0,Kolkata_Banglore,2871,1,13,0,0,162.78287264709476,0.3685891459237056,1,0
IndiGo,6/05/2019,Kolkata,Banglore,CCU → BLR,11:30,14:05,2h 35m,non-stop,No info,5224,2019-05-06,11:30:00,14:05:00,0,155,0,1,0,2053,0,0,CCU,BLR,1546.4372901474003,0,0,0,0,0,0,0,0,0,0,5,6,19,2,1,1,1,2,1,0,0,1,Kolkata_Banglore,2871,1,25,1,0,598.6208865086711,0.10023038178627082,1,0
Jet Airways,6/05/2019,Banglore,Delhi,BLR → DEL,15:15,18:10,2h 55m,non-stop,In-flight meal not included,3702,2019-05-06,15:15:00,18:10:00,0,175,0,1,0,3849,0,0,BLR,DEL,1708.6520853536679,0,0,0,0,0,0,0,0,0,0,5,6,19,2,1,1,2,3,0,0,0,1,Banglore_Delhi,1265,1,25,1,0,585.8235721212576,0.10241991421195461,1,0
IndiGo,18/03/2019,Mumbai,Hyderabad,BOM → HYD,19:05,20:30,1h 25m,non-stop,No info,2754,2019-03-18,19:05:00,20:30:00,0,85,0,1,0,2053,0,0,BOM,HYD,622.9702752863186,0,0,0,0,1,0,0,0,0,1,3,18,12,1,1,1,3,3,0,1,0,1,Mumbai_Hyderabad,697,1,13,0,0,439.743723731519,0.13644310711443464,0,0
Air Asia,24/05/2019,Banglore,Delhi,BLR → DEL,11:10,13:55,2h 45m,non-stop,No info,3383,2019-05-24,11:10:00,13:55:00,0,165,0,1,0,319,0,0,BLR,DEL,1708.6520853536679,0,0,0,0,0,0,0,0,0,0,5,24,21,2,1,1,1,2,1,0,0,1,Banglore_Delhi,1265,1,7,0,1,621.3280310376974,0.09656734768555719,1,0
Air India,15/04/2019,Banglore,Delhi,BLR → DEL,13:20,16:10,2h 50m,non-stop,No info,5228,2019-04-15,13:20:00,16:10:00,0,170,0,1,0,1752,0,0,BLR,DEL,1708.6520853536679,0,0,0,0,0,0,0,0,0,0,4,15,16,2,1,1,2,2,0,0,0,1,Banglore_Delhi,1265,1,15,0,0,603.0536771836476,0.0994936309487559,1,0
IndiGo,27/05/2019,Delhi,Cochin,DEL → BOM → COK,20:25,01:30 28 May,5h 5m,1 stop,No info,5054,2019-05-27,20:25:00,01:30:00,0,305,0,0,1,2053,0,0,DEL,COK,2047.882109458646,0,0,0,0,0,0,0,0,0,0,5,27,22,2,1,1,3,0,0,1,1,0,Delhi_Cochin,4537,0,4,0,1,402.8620543197336,0.14893435446859107,1,0
Jet Airways,18/03/2019,Banglore,New Delhi,BLR → BOM → DEL,08:55,19:10,10h 15m,1 stop,No info,13555,2019-03-18,08:55:00,19:10:00,0,615,0,1,0,3849,0,0,BLR,DEL,1708.6520853536679,0,0,0,0,1,0,0,0,0,1,3,18,12,1,1,1,1,3,1,0,1,0,Banglore_New Delhi,932,0,13,0,0,166.6977644247481,0.35993284137344045,1,0
Multiple carriers,1/06/2019,Delhi,Cochin,DEL → BOM → COK,17:00,01:30 02 Jun,8h 30m,1 stop,No info,7408,2019-06-01,17:00:00,01:30:00,0,510,1,0,1,1196,0,0,DEL,COK,2047.882109458646,0,1,0,0,0,0,0,0,0,1,6,1,22,2,1,0,2,0,0,0,1,0,Delhi_Cochin,4537,0,29,1,0,240.92730699513484,0.2490377730458408,1,0
IndiGo,24/05/2019,Kolkata,Banglore,CCU → BLR,14:25,16:55,2h 30m,non-stop,No info,5224,2019-05-24,14:25:00,16:55:00,0,150,0,1,0,2053,0,0,CCU,BLR,1546.4372901474003,0,0,0,0,0,0,0,0,0,0,5,24,21,2,1,1,2,2,0,0,0,1,Kolkata_Banglore,2871,1,7,0,1,618.5749160589601,0.09699714366413306,1,0
IndiGo,01/03/2019,Banglore,New Delhi,BLR → HYD → DEL,12:10,17:05,4h 55m,1 stop,No info,9694,2019-03-01,12:10:00,17:05:00,0,295,0,1,0,2053,0,0,BLR,DEL,1708.6520853536679,0,0,0,0,0,0,0,0,0,0,3,1,9,1,1,1,2,2,0,0,1,0,Banglore_New Delhi,932,0,30,1,0,347.5224580380342,0.17265071252872347,1,0
IndiGo,21/03/2019,Delhi,Cochin,DEL → BOM → COK,17:10,01:35 22 Mar,8h 25m,1 stop,No info,7318,2019-03-21,17:10:00,01:35:00,0,505,0,0,1,2053,0,0,DEL,COK,2047.882109458646,0,0,0,0,1,0,0,0,0,1,3,21,12,1,1,1,2,0,0,0,1,0,Delhi_Cochin,4537,0,10,0,1,243.31272587627478,0.24659622625127373,1,0
IndiGo,21/05/2019,Delhi,Cochin,DEL → HYD → COK,07:35,12:10,4h 35m,1 stop,No info,5054,2019-05-21,07:35:00,12:10:00,0,275,0,1,0,2053,0,0,DEL,COK,2047.882109458646,0,0,0,0,0,0,0,0,0,0,5,21,21,2,1,1,1,2,1,0,1,0,Delhi_Cochin,4537,0,10,0,1,446.8106420637046,0.13428507370118867,1,0
Jet Airways,1/05/2019,Banglore,Delhi,BLR → DEL,18:55,22:00,3h 5m,non-stop,In-flight meal not included,4030,2019-05-01,18:55:00,22:00:00,0,185,0,1,0,3849,0,0,BLR,DEL,1708.6520853536679,0,0,0,0,0,0,0,0,0,0,5,1,18,2,1,1,3,3,0,1,0,1,Banglore_Delhi,1265,1,30,1,0,554.157433087676,0.10827248073835201,1,0
Jet Airways,06/03/2019,Banglore,New Delhi,BLR → BOM → DEL,08:00,18:25,10h 25m,1 stop,No info,16736,2019-03-06,08:00:00,18:25:00,0,625,0,1,0,3849,0,0,BLR,DEL,1708.6520853536679,0,0,0,0,0,0,0,0,0,0,3,6,10,1,1,1,1,3,1,0,1,0,Banglore_New Delhi,932,0,25,1,0,164.03060019395213,0.3657854078998379,1,0
Air India,18/03/2019,Mumbai,Hyderabad,BOM → HYD,19:30,20:45,1h 15m,non-stop,No info,2050,2019-03-18,19:30:00,20:45:00,0,75,0,1,0,1752,0,0,BOM,HYD,622.9702752863186,0,0,0,0,1,0,0,0,0,1,3,18,12,1,1,1,3,3,0,1,0,1,Mumbai_Hyderabad,697,1,13,0,0,498.37622022905487,0.12039097686567761,0,0
Air India,12/03/2019,Mumbai,Hyderabad,BOM → AMD → ISK → HYD,01:35,14:50,13h 15m,2 stops,No info,9977,2019-03-12,01:35:00,14:50:00,0,795,0,1,1,1752,0,0,BOM,HYD,622.9702752863186,0,0,0,0,0,0,0,0,0,0,3,12,11,1,1,1,0,2,0,0,2,0,Mumbai_Hyderabad,697,1,19,0,0,47.01662454991084,1.2761443547761828,1,0
Jet Airways,6/06/2019,Delhi,Cochin,DEL → JAI → BOM → COK,05:30,04:25 07 Jun,22h 55m,2 stops,In-flight meal not included,10368,2019-06-06,05:30:00,04:25:00,0,1375,0,0,1,3849,0,0,DEL,COK,2047.882109458646,0,1,0,0,0,0,0,0,0,1,6,6,23,2,1,0,0,0,0,0,2,0,Delhi_Cochin,4537,0,24,1,0,89.36212841274092,0.6714253685059434,1,0
IndiGo,9/03/2019,Delhi,Cochin,DEL → AMD → COK,07:45,13:40,5h 55m,1 stop,No info,6755,2019-03-09,07:45:00,13:40:00,0,355,1,1,0,2053,0,0,DEL,COK,2047.882109458646,0,0,0,0,0,0,0,0,0,0,3,9,10,1,1,1,1,2,1,0,1,0,Delhi_Cochin,4537,0,22,1,0,346.12091990850354,0.17334982241426172,1,0
Jet Airways,15/05/2019,Banglore,Delhi,BLR → DEL,15:15,18:10,2h 55m,non-stop,In-flight meal not included,3502,2019-05-15,15:15:00,18:10:00,0,175,0,1,0,3849,0,0,BLR,DEL,1708.6520853536679,0,0,0,0,0,0,0,0,0,0,5,15,20,2,1,1,2,3,0,0,0,1,Banglore_Delhi,1265,1,16,0,0,585.8235721212576,0.10241991421195461,1,0
Air India,24/06/2019,Banglore,Delhi,BLR → DEL,10:00,12:45,2h 45m,non-stop,No info,6961,2019-06-24,10:00:00,12:45:00,0,165,0,1,0,1752,0,0,BLR,DEL,1708.6520853536679,0,0,0,0,0,0,0,0,0,0,6,24,26,2,1,0,1,2,1,0,0,1,Banglore_Delhi,1265,1,6,0,1,621.3280310376974,0.09656734768555719,1,0
Jet Airways,9/04/2019,Banglore,Delhi,BLR → DEL,15:50,18:45,2h 55m,non-stop,In-flight meal not included,4544,2019-04-09,15:50:00,18:45:00,0,175,0,1,0,3849,0,0,BLR,DEL,1708.6520853536679,0,0,0,0,0,0,0,0,0,0,4,9,15,2,1,1,2,3,0,0,0,1,Banglore_Delhi,1265,1,21,1,0,585.8235721212576,0.10241991421195461,1,0
SpiceJet,18/05/2019,Kolkata,Banglore,CCU → BLR,14:55,17:25,2h 30m,non-stop,No check-in baggage included,3841,2019-05-18,14:55:00,17:25:00,0,150,1,1,0,818,0,0,CCU,BLR,1546.4372901474003,0,0,0,0,0,0,0,0,0,0,5,18,20,2,1,1,2,2,0,0,0,1,Kolkata_Banglore,2871,1,13,0,0,618.5749160589601,0.09699714366413306,1,0
Jet Airways,6/03/2019,Mumbai,Hyderabad,BOM → DED → DEL → HYD,14:20,16:50 07 Mar,26h 30m,2 stops,No info,24115,2019-03-06,14:20:00,16:50:00,0,1590,0,0,0,3849,0,0,BOM,HYD,622.9702752863186,0,0,0,0,0,0,0,0,0,0,3,6,10,1,1,1,2,2,0,0,2,0,Mumbai_Hyderabad,697,1,25,1,0,23.50831227495542,2.5522887095523656,1,0
Vistara,24/05/2019,Kolkata,Banglore,CCU → DEL → BLR,07:10,09:05 25 May,25h 55m,1 stop,No info,9502,2019-05-24,07:10:00,09:05:00,0,1555,0,0,0,479,0,0,CCU,BLR,1546.4372901474003,0,0,0,0,0,0,0,0,0,0,5,24,21,2,1,1,1,1,1,0,1,0,Kolkata_Banglore,2871,1,7,0,1,59.66960605070354,1.005537055984846,1,0
Air India,1/04/2019,Mumbai,Hyderabad,BOM → HYD,06:20,07:40,1h 20m,non-stop,No info,3100,2019-04-01,06:20:00,07:40:00,0,80,0,1,0,1752,0,0,BOM,HYD,622.9702752863186,0,0,0,0,0,0,0,0,0,0,4,1,14,2,1,1,1,1,1,0,0,1,Mumbai_Hyderabad,697,1,29,1,0,467.22770646473896,0.12841704199005613,0,0
SpiceJet,15/04/2019,Banglore,Delhi,BLR → DEL,05:55,08:35,2h 40m,non-stop,No check-in baggage included,4319,2019-04-15,05:55:00,08:35:00,0,160,0,1,0,818,0,0,BLR,DEL,1708.6520853536679,0,0,0,0,0,0,0,0,0,0,4,15,16,2,1,1,0,1,0,0,0,1,Banglore_Delhi,1265,1,15,0,0,640.7445320076254,0.09364106442235849,1,0
IndiGo,1/05/2019,Mumbai,Hyderabad,BOM → HYD,20:05,21:40,1h 35m,non-stop,No info,2227,2019-05-01,20:05:00,21:40:00,0,95,0,1,0,2053,0,0,BOM,HYD,622.9702752863186,0,0,0,0,0,0,0,0,0,0,5,1,18,2,1,1,3,3,0,1,0,1,Mumbai_Hyderabad,697,1,30,1,0,393.4549107071486,0.15249523736319165,0,0
SpiceJet,24/03/2019,Kolkata,Banglore,CCU → BLR,22:20,00:40 25 Mar,2h 20m,non-stop,No info,5831,2019-03-24,22:20:00,00:40:00,0,140,1,0,1,818,0,0,CCU,BLR,1546.4372901474003,0,0,0,0,1,0,0,0,0,1,3,24,12,1,1,1,3,0,0,1,0,1,Kolkata_Banglore,2871,1,7,0,1,662.7588386346001,0.09053066741985752,1,0
IndiGo,9/06/2019,Kolkata,Banglore,CCU → BLR,21:25,00:05 10 Jun,2h 40m,non-stop,No info,4804,2019-06-09,21:25:00,00:05:00,0,160,1,0,1,2053,0,0,CCU,BLR,1546.4372901474003,0,1,0,0,0,0,0,0,0,1,6,9,23,2,1,0,3,0,0,1,0,1,Kolkata_Banglore,2871,1,21,1,0,579.913983805275,0.10346361990840859,1,0
IndiGo,6/06/2019,Delhi,Cochin,DEL → HYD → COK,07:35,12:10,4h 35m,1 stop,No info,5458,2019-06-06,07:35:00,12:10:00,0,275,0,1,0,2053,0,0,DEL,COK,2047.882109458646,0,1,0,0,0,0,0,0,0,1,6,6,23,2,1,0,1,2,1,0,1,0,Delhi_Cochin,4537,0,24,1,0,446.8106420637046,0.13428507370118867,1,0
Jet Airways,9/06/2019,Banglore,Delhi,BLR → DEL,18:55,22:00,3h 5m,non-stop,In-flight meal not included,7229,2019-06-09,18:55:00,22:00:00,0,185,1,1,0,3849,0,0,BLR,DEL,1708.6520853536679,0,1,0,0,0,0,0,0,0,1,6,9,23,2,1,0,3,3,0,1,0,1,Banglore_Delhi,1265,1,21,1,0,554.157433087676,0.10827248073835201,1,0
Jet Airways,6/06/2019,Kolkata,Banglore,CCU → BOM → BLR,18:55,10:05 07 Jun,15h 10m,1 stop,No info,14571,2019-06-06,18:55:00,10:05:00,0,910,0,0,0,3849,0,0,CCU,BLR,1546.4372901474003,0,1,0,0,0,0,0,0,0,1,6,6,23,2,1,0,3,1,0,1,1,0,Kolkata_Banglore,2871,1,24,1,0,101.96289825147694,0.5884493382290739,1,0
SpiceJet,9/06/2019,Banglore,Delhi,BLR → DEL,21:10,00:05 10 Jun,2h 55m,non-stop,No check-in baggage included,3919,2019-06-09,21:10:00,00:05:00,0,175,1,0,1,818,0,0,BLR,DEL,1708.6520853536679,0,1,0,0,0,0,0,0,0,1,6,9,23,2,1,0,3,0,0,1,0,1,Banglore_Delhi,1265,1,21,1,0,585.8235721212576,0.10241991421195461,1,0
Multiple carriers,9/03/2019,Delhi,Cochin,DEL → HYD → COK,07:05,16:10,9h 5m,1 stop,No info,6916,2019-03-09,07:05:00,16:10:00,0,545,1,1,0,1196,0,0,DEL,COK,2047.882109458646,0,0,0,0,0,0,0,0,0,0,3,9,10,1,1,1,1,2,1,0,1,0,Delhi_Cochin,4537,0,22,1,0,225.45491113306196,0.2661286006078103,1,0
Jet Airways,27/03/2019,Delhi,Cochin,DEL → BOM → COK,13:00,04:25 28 Mar,15h 25m,1 stop,In-flight meal not included,6960,2019-03-27,13:00:00,04:25:00,0,925,0,0,1,3849,0,0,DEL,COK,2047.882109458646,0,0,0,0,0,0,0,0,0,0,3,27,13,1,1,1,2,0,0,0,1,0,Delhi_Cochin,4537,0,4,0,1,132.83559628920946,0.45168615699490733,1,0
Jet Airways,06/03/2019,Banglore,New Delhi,BLR → MAA → DEL,09:45,14:25,4h 40m,1 stop,No info,16757,2019-03-06,09:45:00,14:25:00,0,280,0,1,0,3849,0,0,BLR,DEL,1708.6520853536679,0,0,0,0,0,0,0,0,0,0,3,6,10,1,1,1,1,2,1,0,1,0,Banglore_New Delhi,932,0,25,1,0,366.13973257578596,0.16387186273912738,1,0
IndiGo,6/03/2019,Delhi,Cochin,DEL → BOM → COK,16:00,01:35 07 Mar,9h 35m,1 stop,No info,14871,2019-03-06,16:00:00,01:35:00,0,575,0,0,1,2053,0,0,DEL,COK,2047.882109458646,0,0,0,0,0,0,0,0,0,0,3,6,10,1,1,1,2,0,0,0,1,0,Delhi_Cochin,4537,0,25,1,0,213.69204620438046,0.28077788137521265,1,0
IndiGo,12/06/2019,Delhi,Cochin,DEL → HYD → COK,07:35,12:10,4h 35m,1 stop,No info,5054,2019-06-12,07:35:00,12:10:00,0,275,0,1,0,2053,0,0,DEL,COK,2047.882109458646,0,0,0,0,0,0,0,0,0,0,6,12,24,2,1,0,1,2,1,0,1,0,Delhi_Cochin,4537,0,18,0,0,446.8106420637046,0.13428507370118867,1,0
Air India,3/06/2019,Delhi,Cochin,DEL → LKO → BOM → COK,12:20,19:15 04 Jun,30h 55m,2 stops,No info,12488,2019-06-03,12:20:00,19:15:00,0,1855,0,0,0,1752,0,0,DEL,COK,2047.882109458646,0,1,0,0,0,0,0,0,0,1,6,3,23,2,1,0,2,3,0,0,2,0,Delhi_Cochin,4537,0,27,1,0,66.23877442992925,0.9058138607843818,1,0
IndiGo,15/04/2019,Banglore,Delhi,BLR → DEL,18:25,21:20,2h 55m,non-stop,No info,4823,2019-04-15,18:25:00,21:20:00,0,175,0,1,0,2053,0,0,BLR,DEL,1708.6520853536679,0,0,0,0,0,0,0,0,0,0,4,15,16,2,1,1,3,3,0,1,0,1,Banglore_Delhi,1265,1,15,0,0,585.8235721212576,0.10241991421195461,1,0
Air India,9/03/2019,Delhi,Cochin,DEL → BHO → BOM → COK,05:55,19:15 10 Mar,37h 20m,2 stops,No info,14483,2019-03-09,05:55:00,19:15:00,0,2240,1,0,0,1752,0,0,DEL,COK,2047.882109458646,0,0,0,0,0,0,0,0,0,0,3,9,10,1,1,1,0,3,0,0,2,0,Delhi_Cochin,4537,0,22,1,0,54.853985074785164,1.0938129639660459,1,0
Air India,24/06/2019,Delhi,Cochin,DEL → HYD → BOM → COK,17:15,19:15 25 Jun,26h,2 stops,No info,11989,2019-06-24,17:15:00,19:15:00,0,1560,0,0,0,1752,0,0,DEL,COK,2047.882109458646,0,0,0,0,0,0,0,0,0,0,6,24,26,2,1,0,2,3,0,0,2,0,Delhi_Cochin,4537,0,6,0,1,78.76469651764023,0.7617625999049248,1,0
Jet Airways,21/05/2019,Delhi,Cochin,DEL → BOM → COK,22:50,19:00 22 May,20h 10m,1 stop,No info,16079,2019-05-21,22:50:00,19:00:00,0,1210,0,0,1,3849,0,0,DEL,COK,2047.882109458646,0,0,0,0,0,0,0,0,0,0,5,21,21,2,1,1,3,3,0,1,1,0,Delhi_Cochin,4537,0,10,0,1,101.54787319629649,0.5908543242852301,1,0
Jet Airways,6/05/2019,Kolkata,Banglore,CCU → DEL → BLR,09:35,10:55 07 May,25h 20m,1 stop,No info,13067,2019-05-06,09:35:00,10:55:00,0,1520,0,0,0,3849,0,0,CCU,BLR,1546.4372901474003,0,0,0,0,0,0,0,0,0,0,5,6,19,2,1,1,1,1,1,0,1,0,Kolkata_Banglore,2871,1,25,1,0,61.04357724266053,0.9829043891298817,1,0
IndiGo,12/06/2019,Delhi,Cochin,DEL → HYD → COK,05:05,16:10,11h 5m,1 stop,No info,6818,2019-06-12,05:05:00,16:10:00,0,665,0,1,0,2053,0,0,DEL,COK,2047.882109458646,0,0,0,0,0,0,0,0,0,0,6,12,24,2,1,0,0,2,0,0,1,0,Delhi_Cochin,4537,0,18,0,0,184.77131814664477,0.32472572367741986,1,0
Jet Airways,12/05/2019,Kolkata,Banglore,CCU → BOM → BLR,08:25,08:15 13 May,23h 50m,1 stop,No info,13941,2019-05-12,08:25:00,08:15:00,0,1430,1,0,0,3849,0,0,CCU,BLR,1546.4372901474003,0,0,0,0,0,0,0,0,0,0,5,12,19,2,1,1,1,1,1,0,1,0,Kolkata_Banglore,2871,1,19,0,0,64.88548070548532,0.9247061029314018,1,0
Multiple carriers,24/06/2019,Delhi,Cochin,DEL → BOM → COK,09:00,19:00,10h,1 stop,No info,12927,2019-06-24,09:00:00,19:00:00,0,600,0,1,0,1196,0,0,DEL,COK,2047.882109458646,0,0,0,0,0,0,0,0,0,0,6,24,26,2,1,0,1,3,1,0,1,0,Delhi_Cochin,4537,0,6,0,1,204.7882109458646,0.292985615348048,1,0
IndiGo,15/05/2019,Kolkata,Banglore,CCU → BLR,22:15,00:50 16 May,2h 35m,non-stop,No info,4804,2019-05-15,22:15:00,00:50:00,0,155,0,0,1,2053,0,0,CCU,BLR,1546.4372901474003,0,0,0,0,0,0,0,0,0,0,5,15,20,2,1,1,3,0,0,1,0,1,Kolkata_Banglore,2871,1,16,0,0,598.6208865086711,0.10023038178627082,1,0
Jet Airways,1/04/2019,Delhi,Cochin,DEL → BOM → COK,16:00,12:35 02 Apr,20h 35m,1 stop,In-flight meal not included,5406,2019-04-01,16:00:00,12:35:00,0,1235,0,0,0,3849,0,0,DEL,COK,2047.882109458646,0,0,0,0,0,0,0,0,0,0,4,1,14,2,1,1,2,2,0,0,1,0,Delhi_Cochin,4537,0,29,1,0,99.49224823280872,0.6030620582580655,1,0
IndiGo,21/03/2019,Delhi,Cochin,DEL → BOM → COK,10:45,01:35 22 Mar,14h 50m,1 stop,No info,7318,2019-03-21,10:45:00,01:35:00,0,890,0,0,1,2053,0,0,DEL,COK,2047.882109458646,0,0,0,0,1,0,0,0,0,1,3,21,12,1,1,1,1,0,1,0,1,0,Delhi_Cochin,4537,0,10,0,1,138.05946805339187,0.4345953294329379,1,0
IndiGo,21/03/2019,Chennai,Kolkata,MAA → CCU,07:55,10:15,2h 20m,non-stop,No info,3384,2019-03-21,07:55:00,10:15:00,0,140,0,1,0,2053,0,0,MAA,CCU,1385.198425287915,0,0,0,0,1,0,0,0,0,1,3,21,12,1,1,1,1,1,1,0,0,1,Chennai_Kolkata,381,1,10,0,1,593.656467980535,0.10106855266667002,1,0
Air Asia,3/06/2019,Delhi,Cochin,DEL → BLR → COK,20:45,06:35 04 Jun,9h 50m,1 stop,No info,11410,2019-06-03,20:45:00,06:35:00,0,590,0,0,1,319,0,0,DEL,COK,2047.882109458646,0,1,0,0,0,0,0,0,0,1,6,3,23,2,1,0,3,1,0,1,1,0,Delhi_Cochin,4537,0,27,1,0,208.2591975720657,0.2881025217589139,1,0
Jet Airways,15/03/2019,Banglore,New Delhi,BLR → BOM → DEL,05:45,13:15,7h 30m,1 stop,In-flight meal not included,9134,2019-03-15,05:45:00,13:15:00,0,450,0,1,0,3849,0,0,BLR,DEL,1708.6520853536679,0,0,0,0,1,0,0,0,0,1,3,15,11,1,1,1,0,2,0,0,1,0,Banglore_New Delhi,932,0,16,0,0,227.8202780471557,0.26336549368788326,1,0
Jet Airways,21/03/2019,Banglore,New Delhi,BLR → BOM → DEL,14:05,21:20,7h 15m,1 stop,In-flight meal not included,7832,2019-03-21,14:05:00,21:20:00,0,435,0,1,0,3849,0,0,BLR,DEL,1708.6520853536679,0,0,0,0,1,0,0,0,0,1,3,21,12,1,1,1,2,3,0,0,1,0,Banglore_New Delhi,932,0,10,0,1,235.6761497039542,0.25458664389828717,1,0
Jet Airways,06/03/2019,Banglore,New Delhi,BLR → BOM → DEL,08:55,07:40 07 Mar,22h 45m,1 stop,No info,14815,2019-03-06,08:55:00,07:40:00,0,1365,0,0,0,3849,0,0,BLR,DEL,1708.6520853536679,0,0,0,0,0,0,0,0,0,0,3,6,10,1,1,1,1,1,1,0,1,0,Banglore_New Delhi,932,0,25,1,0,75.105586169392,0.7988753308532459,1,0
IndiGo,3/06/2019,Banglore,Delhi,BLR → DEL,23:30,02:20 04 Jun,2h 50m,non-stop,No info,4591,2019-06-03,23:30:00,02:20:00,0,170,0,0,1,2053,0,0,BLR,DEL,1708.6520853536679,0,1,0,0,0,0,0,0,0,1,6,3,23,2,1,0,3,0,0,1,0,1,Banglore_Delhi,1265,1,27,1,0,603.0536771836476,0.0994936309487559,1,0
Jet Airways,9/05/2019,Delhi,Cochin,DEL → BOM → COK,22:50,19:00 10 May,20h 10m,1 stop,In-flight meal not included,12373,2019-05-09,22:50:00,19:00:00,0,1210,0,0,1,3849,0,0,DEL,COK,2047.882109458646,0,0,0,0,0,0,0,0,0,0,5,9,19,2,1,1,3,3,0,1,1,0,Delhi_Cochin,4537,0,22,1,0,101.54787319629649,0.5908543242852301,1,0
Air Asia,09/03/2019,Banglore,New Delhi,BLR → DEL,05:50,08:40,2h 50m,non-stop,No info,4284,2019-03-09,05:50:00,08:40:00,0,170,1,1,0,319,0,0,BLR,DEL,1708.6520853536679,0,0,0,0,0,0,0,0,0,0,3,9,10,1,1,1,0,1,0,0,0,1,Banglore_New Delhi,932,0,22,1,0,603.0536771836476,0.0994936309487559,1,0
Jet Airways,18/05/2019,Kolkata,Banglore,CCU → BOM → BLR,05:45,04:40 19 May,22h 55m,1 stop,No info,13941,2019-05-18,05:45:00,04:40:00,0,1375,1,0,1,3849,0,0,CCU,BLR,1546.4372901474003,0,0,0,0,0,0,0,0,0,0,5,18,20,2,1,1,0,0,0,0,1,0,Kolkata_Banglore,2871,1,13,0,0,67.48089993370475,0.8891404835878863,1,0
Jet Airways,9/03/2019,Delhi,Cochin,DEL → BOM → COK,17:25,18:50 10 Mar,25h 25m,1 stop,No info,16289,2019-03-09,17:25:00,18:50:00,0,1525,1,0,0,3849,0,0,DEL,COK,2047.882109458646,0,0,0,0,0,0,0,0,0,0,3,9,10,1,1,1,2,3,0,0,1,0,Delhi_Cochin,4537,0,22,1,0,80.57241086394673,0.7446717723429553,1,0
IndiGo,24/06/2019,Delhi,Cochin,DEL → PNQ → COK,23:30,04:35 25 Jun,5h 5m,1 stop,No info,9165,2019-06-24,23:30:00,04:35:00,0,305,0,0,1,2053,0,0,DEL,COK,2047.882109458646,0,0,0,0,0,0,0,0,0,0,6,24,26,2,1,0,3,0,0,1,1,0,Delhi_Cochin,4537,0,6,0,1,402.8620543197336,0.14893435446859107,1,0
Jet Airways,21/06/2019,Banglore,Delhi,BLR → DEL,06:00,08:45,2h 45m,non-stop,No info,8016,2019-06-21,06:00:00,08:45:00,0,165,0,1,0,3849,0,0,BLR,DEL,1708.6520853536679,0,0,0,0,0,0,0,0,0,0,6,21,25,2,1,0,1,1,1,0,0,1,Banglore_Delhi,1265,1,9,0,1,621.3280310376974,0.09656734768555719,1,0
Air Asia,1/04/2019,Kolkata,Banglore,CCU → DEL → BLR,22:40,10:40 02 Apr,12h,1 stop,No info,5192,2019-04-01,22:40:00,10:40:00,0,720,0,0,1,319,0,0,CCU,BLR,1546.4372901474003,0,0,0,0,0,0,0,0,0,0,4,1,14,2,1,1,3,1,0,1,1,0,Kolkata_Banglore,2871,1,29,1,0,128.86977417895002,0.46558628958783865,1,0
Jet Airways,9/06/2019,Kolkata,Banglore,CCU → BOM → BLR,21:10,08:15 10 Jun,11h 5m,1 stop,No info,14939,2019-06-09,21:10:00,08:15:00,0,665,1,0,1,3849,0,0,CCU,BLR,1546.4372901474003,0,1,0,0,0,0,0,0,0,1,6,9,23,2,1,0,3,1,0,1,1,0,Kolkata_Banglore,2871,1,21,1,0,139.52817655465267,0.4300206702443232,1,0
Jet Airways,01/03/2019,Banglore,New Delhi,BLR → BOM → DEL,11:40,09:30 02 Mar,21h 50m,1 stop,No info,25735,2019-03-01,11:40:00,09:30:00,0,1310,0,0,0,3849,0,0,BLR,DEL,1708.6520853536679,0,0,0,0,0,0,0,0,0,0,3,1,9,1,1,1,1,1,1,0,1,0,Banglore_New Delhi,932,0,30,1,0,78.25887413833593,0.7666862149580602,1,0
Multiple carriers,3/06/2019,Delhi,Cochin,DEL → BOM → COK,10:00,19:00,9h,1 stop,No info,14502,2019-06-03,10:00:00,19:00:00,0,540,0,1,0,1196,0,0,DEL,COK,2047.882109458646,0,1,0,0,0,0,0,0,0,1,6,3,23,2,1,0,1,3,1,0,1,0,Delhi_Cochin,4537,0,27,1,0,227.54245660651623,0.2636870538132432,1,0
Jet Airways,12/03/2019,Banglore,New Delhi,BLR → BOM → DEL,22:55,12:25 13 Mar,13h 30m,1 stop,No info,13817,2019-03-12,22:55:00,12:25:00,0,810,0,0,1,3849,0,0,BLR,DEL,1708.6520853536679,0,0,0,0,0,0,0,0,0,0,3,12,11,1,1,1,3,2,0,1,1,0,Banglore_New Delhi,932,0,19,0,0,126.56682113730872,0.4740578886381899,1,0
Jet Airways,24/05/2019,Kolkata,Banglore,CCU → DEL → BLR,09:35,18:00,8h 25m,1 stop,No info,14151,2019-05-24,09:35:00,18:00:00,0,505,0,1,0,3849,0,0,CCU,BLR,1546.4372901474003,0,0,0,0,0,0,0,0,0,0,5,24,21,2,1,1,1,3,1,0,1,0,Kolkata_Banglore,2871,1,7,0,1,183.73512358186935,0.32655705033591464,1,0
Multiple carriers,6/03/2019,Delhi,Cochin,DEL → BOM → COK,10:45,19:15,8h 30m,1 stop,No info,15077,2019-03-06,10:45:00,19:15:00,0,510,0,1,0,1196,0,0,DEL,COK,2047.882109458646,0,0,0,0,0,0,0,0,0,0,3,6,10,1,1,1,1,3,1,0,1,0,Delhi_Cochin,4537,0,25,1,0,240.92730699513484,0.2490377730458408,1,0
Multiple carriers,12/06/2019,Delhi,Cochin,DEL → BOM → COK,09:00,19:00,10h,1 stop,No info,12192,2019-06-12,09:00:00,19:00:00,0,600,0,1,0,1196,0,0,DEL,COK,2047.882109458646,0,0,0,0,0,0,0,0,0,0,6,12,24,2,1,0,1,3,1,0,1,0,Delhi_Cochin,4537,0,18,0,0,204.7882109458646,0.292985615348048,1,0
SpiceJet,21/05/2019,Mumbai,Hyderabad,BOM → HYD,13:15,14:45,1h 30m,non-stop,No check-in baggage included,1965,2019-05-21,13:15:00,14:45:00,0,90,0,1,0,818,0,0,BOM,HYD,622.9702752863186,0,0,0,0,0,0,0,0,0,0,5,21,21,2,1,1,2,2,0,0,0,1,Mumbai_Hyderabad,697,1,10,0,1,415.3135168575457,0.14446917223881314,0,0
IndiGo,18/05/2019,Chennai,Kolkata,MAA → CCU,07:55,10:15,2h 20m,non-stop,No info,3850,2019-05-18,07:55:00,10:15:00,0,140,1,1,0,2053,0,0,MAA,CCU,1385.198425287915,0,0,0,0,0,0,0,0,0,0,5,18,20,2,1,1,1,1,1,0,0,1,Chennai_Kolkata,381,1,13,0,0,593.656467980535,0.10106855266667002,1,0
IndiGo,1/06/2019,Mumbai,Hyderabad,BOM → HYD,16:55,18:25,1h 30m,non-stop,No info,3175,2019-06-01,16:55:00,18:25:00,0,90,1,1,0,2053,0,0,BOM,HYD,622.9702752863186,0,1,0,0,0,0,0,0,0,1,6,1,22,2,1,0,2,3,0,0,0,1,Mumbai_Hyderabad,697,1,29,1,0,415.3135168575457,0.14446917223881314,0,0
Jet Airways,21/05/2019,Banglore,Delhi,BLR → DEL,18:55,22:00,3h 5m,non-stop,No info,7229,2019-05-21,18:55:00,22:00:00,0,185,0,1,0,3849,0,0,BLR,DEL,1708.6520853536679,0,0,0,0,0,0,0,0,0,0,5,21,21,2,1,1,3,3,0,1,0,1,Banglore_Delhi,1265,1,10,0,1,554.157433087676,0.10827248073835201,1,0
Jet Airways,27/05/2019,Delhi,Cochin,DEL → BOM → COK,19:15,19:00 28 May,23h 45m,1 stop,No info,16079,2019-05-27,19:15:00,19:00:00,0,1425,0,0,0,3849,0,0,DEL,COK,2047.882109458646,0,0,0,0,0,0,0,0,0,0,5,27,22,2,1,1,3,3,0,1,1,0,Delhi_Cochin,4537,0,4,0,1,86.22661513510089,0.695840836451614,1,0
IndiGo,27/03/2019,Mumbai,Hyderabad,BOM → HYD,09:10,10:40,1h 30m,non-stop,No info,4392,2019-03-27,09:10:00,10:40:00,0,90,0,1,0,2053,0,0,BOM,HYD,622.9702752863186,0,0,0,0,0,0,0,0,0,0,3,27,13,1,1,1,1,1,1,0,0,1,Mumbai_Hyderabad,697,1,4,0,1,415.3135168575457,0.14446917223881314,0,0
Jet Airways,18/03/2019,Banglore,New Delhi,BLR → BOM → DEL,18:40,00:45 16 Mar,6h 5m,1 stop,No info,54826,2019-03-18,18:40:00,00:45:00,0,365,0,0,1,3849,0,0,BLR,DEL,1708.6520853536679,0,0,0,0,1,0,0,0,0,1,3,18,12,1,1,1,3,0,0,1,1,0,Banglore_New Delhi,932,0,13,0,0,280.87431540060294,0.21361867821350533,1,0
Jet Airways,15/06/2019,Delhi,Cochin,DEL → JAI → BOM → COK,09:40,19:00,9h 20m,2 stops,In-flight meal not included,10368,2019-06-15,09:40:00,19:00:00,0,560,1,1,0,3849,0,0,DEL,COK,2047.882109458646,0,0,0,0,0,0,0,0,0,0,6,15,24,2,1,0,1,3,1,0,2,0,Delhi_Cochin,4537,0,15,0,0,219.41594029914066,0.27345324099151147,1,0
Jet Airways,27/05/2019,Delhi,Cochin,DEL → BOM → COK,22:50,19:00 28 May,20h 10m,1 stop,In-flight meal not included,12898,2019-05-27,22:50:00,19:00:00,0,1210,0,0,1,3849,0,0,DEL,COK,2047.882109458646,0,0,0,0,0,0,0,0,0,0,5,27,22,2,1,1,3,3,0,1,1,0,Delhi_Cochin,4537,0,4,0,1,101.54787319629649,0.5908543242852301,1,0
Air India,1/05/2019,Kolkata,Banglore,CCU → GAU → DEL → BLR,16:45,12:30 02 May,19h 45m,2 stops,No info,14960,2019-05-01,16:45:00,12:30:00,0,1185,0,0,0,1752,0,0,CCU,BLR,1546.4372901474003,0,0,0,0,0,0,0,0,0,0,5,1,18,2,1,1,2,2,0,0,2,0,Kolkata_Banglore,2871,1,30,1,0,78.30062228594431,0.7662774349466511,1,0
IndiGo,27/05/2019,Delhi,Cochin,DEL → HYD → COK,08:35,22:30,13h 55m,1 stop,No info,6442,2019-05-27,08:35:00,22:30:00,0,835,0,1,0,2053,0,0,DEL,COK,2047.882109458646,0,0,0,0,0,0,0,0,0,0,5,27,22,2,1,1,1,3,1,0,1,0,Delhi_Cochin,4537,0,4,0,1,147.15320547008236,0.4077383146927001,1,0
SpiceJet,21/05/2019,Chennai,Kolkata,MAA → CCU,08:20,10:35,2h 15m,non-stop,No info,3597,2019-05-21,08:20:00,10:35:00,0,135,0,1,0,818,0,0,MAA,CCU,1385.198425287915,0,0,0,0,0,0,0,0,0,0,5,21,21,2,1,1,1,1,1,0,0,1,Chennai_Kolkata,381,1,10,0,1,615.6437445724066,0.09745896150000323,1,0
Jet Airways,6/06/2019,Delhi,Cochin,DEL → JDH → BOM → COK,11:40,19:00,7h 20m,2 stops,No info,18804,2019-06-06,11:40:00,19:00:00,0,440,0,1,0,3849,0,0,DEL,COK,2047.882109458646,0,1,0,0,0,0,0,0,0,1,6,6,23,2,1,0,1,3,1,0,2,0,Delhi_Cochin,4537,0,24,1,0,279.25665128981535,0.21485611792190187,1,0
Vistara,15/03/2019,Delhi,Cochin,DEL → COK,06:00,09:10,3h 10m,non-stop,No info,6111,2019-03-15,06:00:00,09:10:00,0,190,0,1,0,479,0,0,DEL,COK,2047.882109458646,0,0,0,0,1,0,0,0,0,1,3,15,11,1,1,1,1,1,1,0,0,1,Delhi_Cochin,4537,0,16,0,0,646.6996135132566,0.09277877819354853,1,0
IndiGo,9/06/2019,Delhi,Cochin,DEL → COK,21:05,00:20 10 Jun,3h 15m,non-stop,No info,6015,2019-06-09,21:05:00,00:20:00,0,195,1,0,1,2053,0,0,DEL,COK,2047.882109458646,0,1,0,0,0,0,0,0,0,1,6,9,23,2,1,0,3,0,0,1,0,1,Delhi_Cochin,4537,0,21,1,0,630.1175721411219,0.0952203249881156,1,0
Air India,18/05/2019,Banglore,Delhi,BLR → DEL,13:20,16:10,2h 50m,non-stop,No info,6121,2019-05-18,13:20:00,16:10:00,0,170,1,1,0,1752,0,0,BLR,DEL,1708.6520853536679,0,0,0,0,0,0,0,0,0,0,5,18,20,2,1,1,2,2,0,0,0,1,Banglore_Delhi,1265,1,13,0,0,603.0536771836476,0.0994936309487559,1,0
Jet Airways,24/05/2019,Kolkata,Banglore,CCU → GAU → BLR,10:20,17:35,7h 15m,1 stop,In-flight meal not included,6287,2019-05-24,10:20:00,17:35:00,0,435,0,1,0,3849,0,0,CCU,BLR,1546.4372901474003,0,0,0,0,0,0,0,0,0,0,5,24,21,2,1,1,1,2,1,0,1,0,Kolkata_Banglore,2871,1,7,0,1,213.3016951927449,0.28129171662598584,1,0
Jet Airways,9/05/2019,Banglore,Delhi,BLR → DEL,15:15,18:10,2h 55m,non-stop,No info,7229,2019-05-09,15:15:00,18:10:00,0,175,0,1,0,3849,0,0,BLR,DEL,1708.6520853536679,0,0,0,0,0,0,0,0,0,0,5,9,19,2,1,1,2,3,0,0,0,1,Banglore_Delhi,1265,1,22,1,0,585.8235721212576,0.10241991421195461,1,0
IndiGo,12/06/2019,Delhi,Cochin,DEL → HYD → COK,08:35,16:10,7h 35m,1 stop,No info,6442,2019-06-12,08:35:00,16:10:00,0,455,0,1,0,2053,0,0,DEL,COK,2047.882109458646,0,0,0,0,0,0,0,0,0,0,6,12,24,2,1,0,1,2,1,0,1,0,Delhi_Cochin,4537,0,18,0,0,270.05038806048077,0.22218075830560308,1,0
Jet Airways,27/04/2019,Banglore,Delhi,BLR → DEL,15:15,18:10,2h 55m,non-stop,In-flight meal not included,4544,2019-04-27,15:15:00,18:10:00,0,175,1,1,0,3849,0,0,BLR,DEL,1708.6520853536679,0,0,0,0,0,0,0,0,0,0,4,27,17,2,1,1,2,3,0,0,0,1,Banglore_Delhi,1265,1,3,0,1,585.8235721212576,0.10241991421195461,1,0
Air India,12/06/2019,Kolkata,Banglore,CCU → BOM → COK → BLR,09:25,13:45 13 Jun,28h 20m,2 stops,No info,11542,2019-06-12,09:25:00,13:45:00,0,1700,0,0,0,1752,0,0,CCU,BLR,1546.4372901474003,0,0,0,0,0,0,0,0,0,0,6,12,24,2,1,0,1,2,1,0,2,0,Kolkata_Banglore,2871,1,18,0,0,54.58013965226119,1.0993009615268412,1,0
Jet Airways,21/05/2019,Delhi,Cochin,DEL → BOM → COK,19:45,04:25 22 May,8h 40m,1 stop,No info,16079,2019-05-21,19:45:00,04:25:00,0,520,0,0,1,3849,0,0,DEL,COK,2047.882109458646,0,0,0,0,0,0,0,0,0,0,5,21,21,2,1,1,3,0,0,1,1,0,Delhi_Cochin,4537,0,10,0,1,236.2940895529207,0.25392086663497493,1,0
Multiple carriers,27/03/2019,Delhi,Cochin,DEL → HYD → COK,07:05,16:10,9h 5m,1 stop,No info,6076,2019-03-27,07:05:00,16:10:00,0,545,0,1,0,1196,0,0,DEL,COK,2047.882109458646,0,0,0,0,0,0,0,0,0,0,3,27,13,1,1,1,1,2,1,0,1,0,Delhi_Cochin,4537,0,4,0,1,225.45491113306196,0.2661286006078103,1,0
Air India,1/04/2019,Kolkata,Banglore,CCU → DEL → COK → BLR,10:00,01:20 02 Apr,15h 20m,2 stops,No info,10408,2019-04-01,10:00:00,01:20:00,0,920,0,0,1,1752,0,0,CCU,BLR,1546.4372901474003,0,0,0,0,0,0,0,0,0,0,4,1,14,2,1,1,1,0,1,0,2,0,Kolkata_Banglore,2871,1,29,1,0,100.85460587917828,0.5949158144733494,1,0
Air India,27/03/2019,Delhi,Cochin,DEL → NAG → BOM → COK,05:55,19:15 28 Mar,37h 20m,2 stops,No info,8446,2019-03-27,05:55:00,19:15:00,0,2240,0,0,0,1752,0,0,DEL,COK,2047.882109458646,0,0,0,0,0,0,0,0,0,0,3,27,13,1,1,1,0,3,0,0,2,0,Delhi_Cochin,4537,0,4,0,1,54.853985074785164,1.0938129639660459,1,0
GoAir,01/03/2019,Banglore,New Delhi,BLR → DEL,07:45,10:40,2h 55m,non-stop,No info,13663,2019-03-01,07:45:00,10:40:00,0,175,0,1,0,194,0,0,BLR,DEL,1708.6520853536679,0,0,0,0,0,0,0,0,0,0,3,1,9,1,1,1,1,1,1,0,0,1,Banglore_New Delhi,932,0,30,1,0,585.8235721212576,0.10241991421195461,1,0
Air India,15/05/2019,Delhi,Cochin,DEL → BLR → COK,20:30,08:15 16 May,11h 45m,1 stop,No info,10671,2019-05-15,20:30:00,08:15:00,0,705,0,0,0,1752,0,0,DEL,COK,2047.882109458646,0,0,0,0,0,0,0,0,0,0,5,15,20,2,1,1,3,1,0,1,1,0,Delhi_Cochin,4537,0,16,0,0,174.2878391028635,0.3442580980339564,1,0
Air Asia,18/06/2019,Banglore,Delhi,BLR → DEL,23:55,02:45 19 Jun,2h 50m,non-stop,No info,3383,2019-06-18,23:55:00,02:45:00,0,170,0,0,1,319,0,0,BLR,DEL,1708.6520853536679,0,0,0,0,0,0,0,0,0,0,6,18,25,2,1,0,3,0,0,1,0,1,Banglore_Delhi,1265,1,12,0,0,603.0536771836476,0.0994936309487559,1,0
Multiple carriers,9/05/2019,Delhi,Cochin,DEL → BOM → COK,10:20,01:30 10 May,15h 10m,1 stop,No info,9021,2019-05-09,10:20:00,01:30:00,0,910,0,0,1,1196,0,0,DEL,COK,2047.882109458646,0,0,0,0,0,0,0,0,0,0,5,9,19,2,1,1,1,0,1,0,1,0,Delhi_Cochin,4537,0,22,1,0,135.02519403024039,0.44436151661120615,1,0
Multiple carriers,18/05/2019,Delhi,Cochin,DEL → BOM → COK,09:00,19:15,10h 15m,1 stop,No info,14533,2019-05-18,09:00:00,19:15:00,0,615,1,1,0,1196,0,0,DEL,COK,2047.882109458646,0,0,0,0,0,0,0,0,0,0,5,18,20,2,1,1,1,3,1,0,1,0,Delhi_Cochin,4537,0,13,0,0,199.79337653255084,0.3003102557317492,1,0
Jet Airways,6/06/2019,Delhi,Cochin,DEL → LKO → BOM → COK,11:45,04:25 07 Jun,16h 40m,2 stops,In-flight meal not included,11992,2019-06-06,11:45:00,04:25:00,0,1000,0,0,1,3849,0,0,DEL,COK,2047.882109458646,0,1,0,0,0,0,0,0,0,1,6,6,23,2,1,0,1,0,1,0,2,0,Delhi_Cochin,4537,0,24,1,0,122.87292656751876,0.4883093589134133,1,0
IndiGo,12/05/2019,Chennai,Kolkata,MAA → CCU,13:15,15:35,2h 20m,non-stop,No info,3597,2019-05-12,13:15:00,15:35:00,0,140,1,1,0,2053,0,0,MAA,CCU,1385.198425287915,0,0,0,0,0,0,0,0,0,0,5,12,19,2,1,1,2,2,0,0,0,1,Chennai_Kolkata,381,1,19,0,0,593.656467980535,0.10106855266667002,1,0
IndiGo,9/06/2019,Banglore,Delhi,BLR → DEL,01:30,04:15,2h 45m,non-stop,No info,4077,2019-06-09,01:30:00,04:15:00,0,165,1,1,1,2053,0,0,BLR,DEL,1708.6520853536679,0,1,0,0,0,0,0,0,0,1,6,9,23,2,1,0,0,0,0,0,0,1,Banglore_Delhi,1265,1,21,1,0,621.3280310376974,0.09656734768555719,1,0
Multiple carriers,12/06/2019,Delhi,Cochin,DEL → HYD → COK,07:05,16:10,9h 5m,1 stop,No info,9646,2019-06-12,07:05:00,16:10:00,0,545,0,1,0,1196,0,0,DEL,COK,2047.882109458646,0,0,0,0,0,0,0,0,0,0,6,12,24,2,1,0,1,2,1,0,1,0,Delhi_Cochin,4537,0,18,0,0,225.45491113306196,0.2661286006078103,1,0
SpiceJet,1/04/2019,Kolkata,Banglore,CCU → BLR,22:20,00:40 02 Apr,2h 20m,non-stop,No info,3873,2019-04-01,22:20:00,00:40:00,0,140,0,0,1,818,0,0,CCU,BLR,1546.4372901474003,0,0,0,0,0,0,0,0,0,0,4,1,14,2,1,1,3,0,0,1,0,1,Kolkata_Banglore,2871,1,29,1,0,662.7588386346001,0.09053066741985752,1,0
Jet Airways,9/05/2019,Delhi,Cochin,DEL → AMD → BOM → COK,19:10,19:00 10 May,23h 50m,2 stops,No info,15129,2019-05-09,19:10:00,19:00:00,0,1430,0,0,0,3849,0,0,DEL,COK,2047.882109458646,0,0,0,0,0,0,0,0,0,0,5,9,19,2,1,1,3,3,0,1,2,0,Delhi_Cochin,4537,0,22,1,0,85.92512347378934,0.6982823832461811,1,0
IndiGo,9/06/2019,Delhi,Cochin,DEL → BOM → COK,17:30,01:30 10 Jun,8h,1 stop,No info,6104,2019-06-09,17:30:00,01:30:00,0,480,1,0,1,2053,0,0,DEL,COK,2047.882109458646,0,1,0,0,0,0,0,0,0,1,6,9,23,2,1,0,2,0,0,0,1,0,Delhi_Cochin,4537,0,21,1,0,255.98526368233078,0.23438849227843842,1,0
Jet Airways,6/03/2019,Delhi,Cochin,DEL → AMD → BOM → COK,19:10,04:25 08 Mar,33h 15m,2 stops,In-flight meal not included,16022,2019-03-06,19:10:00,04:25:00,0,1995,0,0,1,3849,0,0,DEL,COK,2047.882109458646,0,0,0,0,0,0,0,0,0,0,3,6,10,1,1,1,3,0,0,1,2,0,Delhi_Cochin,4537,0,25,1,0,61.59043938221492,0.9741771710322596,1,0
Jet Airways,09/03/2019,Banglore,New Delhi,BLR → MAA → DEL,09:45,00:30 13 Mar,14h 45m,1 stop,In-flight meal not included,10562,2019-03-09,09:45:00,00:30:00,0,885,1,0,1,3849,0,0,BLR,DEL,1708.6520853536679,0,0,0,0,0,0,0,0,0,0,3,9,10,1,1,1,1,0,1,0,1,0,Banglore_New Delhi,932,0,22,1,0,115.84081934601137,0.5179521375861704,1,0
Air India,9/03/2019,Delhi,Cochin,DEL → MAA → COK,06:05,09:25 10 Mar,27h 20m,1 stop,No info,10945,2019-03-09,06:05:00,09:25:00,0,1640,1,0,0,1752,0,0,DEL,COK,2047.882109458646,0,0,0,0,0,0,0,0,0,0,3,9,10,1,1,1,1,1,1,0,1,0,Delhi_Cochin,4537,0,22,1,0,74.92251619970656,0.8008273486179979,1,0
SpiceJet,27/05/2019,Kolkata,Banglore,CCU → BLR,09:00,11:25,2h 25m,non-stop,No info,3873,2019-05-27,09:00:00,11:25:00,0,145,0,1,0,818,0,0,CCU,BLR,1546.4372901474003,0,0,0,0,0,0,0,0,0,0,5,27,22,2,1,1,1,1,1,0,0,1,Kolkata_Banglore,2871,1,4,0,1,639.9050855782347,0.09376390554199529,1,0
Jet Airways,27/03/2019,Mumbai,Hyderabad,BOM → HYD,02:55,04:25,1h 30m,non-stop,In-flight meal not included,1840,2019-03-27,02:55:00,04:25:00,0,90,0,1,1,3849,0,0,BOM,HYD,622.9702752863186,0,0,0,0,0,0,0,0,0,0,3,27,13,1,1,1,0,0,0,0,0,1,Mumbai_Hyderabad,697,1,4,0,1,415.3135168575457,0.14446917223881314,0,0
IndiGo,3/03/2019,Delhi,Cochin,DEL → HYD → COK,04:55,12:00,7h 5m,1 stop,No info,9585,2019-03-03,04:55:00,12:00:00,0,425,1,1,0,2053,0,0,DEL,COK,2047.882109458646,0,0,0,0,0,0,0,0,0,0,3,3,9,1,1,1,0,2,0,0,1,0,Delhi_Cochin,4537,0,28,1,0,289.11276839416183,0.20753147753820067,1,0
Jet Airways,18/05/2019,Mumbai,Hyderabad,BOM → HYD,19:35,21:05,1h 30m,non-stop,In-flight meal not included,3210,2019-05-18,19:35:00,21:05:00,0,90,1,1,0,3849,0,0,BOM,HYD,622.9702752863186,0,0,0,0,0,0,0,0,0,0,5,18,20,2,1,1,3,3,0,1,0,1,Mumbai_Hyderabad,697,1,13,0,0,415.3135168575457,0.14446917223881314,0,0
IndiGo,9/05/2019,Delhi,Cochin,DEL → BLR → COK,15:10,20:00,4h 50m,1 stop,No info,6147,2019-05-09,15:10:00,20:00:00,0,290,0,1,0,2053,0,0,DEL,COK,2047.882109458646,0,0,0,0,0,0,0,0,0,0,5,9,19,2,1,1,2,3,0,0,1,0,Delhi_Cochin,4537,0,22,1,0,423.6997467845474,0.14160971408488987,1,0
Jet Airways,9/05/2019,Kolkata,Banglore,CCU → DEL → BLR,17:00,23:35,6h 35m,1 stop,In-flight meal not included,7341,2019-05-09,17:00:00,23:35:00,0,395,0,1,0,3849,0,0,CCU,BLR,1546.4372901474003,0,0,0,0,0,0,0,0,0,0,5,9,19,2,1,1,2,3,0,0,1,0,Kolkata_Banglore,2871,1,22,1,0,234.90186685783297,0.2554258116488837,1,0
Air India,21/05/2019,Delhi,Cochin,DEL → BOM → COK,09:00,19:15,10h 15m,1 stop,No info,8372,2019-05-21,09:00:00,19:15:00,0,615,0,1,0,1752,0,0,DEL,COK,2047.882109458646,0,0,0,0,0,0,0,0,0,0,5,21,21,2,1,1,1,3,1,0,1,0,Delhi_Cochin,4537,0,10,0,1,199.79337653255084,0.3003102557317492,1,0
Multiple carriers,27/06/2019,Delhi,Cochin,DEL → BOM → COK,07:30,19:00,11h 30m,1 stop,No info,10877,2019-06-27,07:30:00,19:00:00,0,690,0,1,0,1196,0,0,DEL,COK,2047.882109458646,0,0,0,0,0,0,0,0,0,0,6,27,26,2,1,0,1,3,1,0,1,0,Delhi_Cochin,4537,0,3,0,1,178.07670517031704,0.3369334576502552,1,0
Air India,9/05/2019,Delhi,Cochin,DEL → GOI → BOM → COK,22:00,19:15 10 May,21h 15m,2 stops,No info,10441,2019-05-09,22:00:00,19:15:00,0,1275,0,0,1,1752,0,0,DEL,COK,2047.882109458646,0,0,0,0,0,0,0,0,0,0,5,9,19,2,1,1,3,3,0,1,2,0,Delhi_Cochin,4537,0,22,1,0,96.37092279805394,0.622594432614602,1,0
IndiGo,6/03/2019,Delhi,Cochin,DEL → BOM → COK,04:45,21:00,16h 15m,1 stop,No info,13611,2019-03-06,04:45:00,21:00:00,0,975,0,1,0,2053,0,0,DEL,COK,2047.882109458646,0,0,0,0,0,0,0,0,0,0,3,6,10,1,1,1,0,3,0,0,1,0,Delhi_Cochin,4537,0,25,1,0,126.02351442822436,0.476101624940578,1,0
Jet Airways,09/03/2019,Banglore,New Delhi,BLR → BOM → DEL,08:55,10:45 13 Mar,25h 50m,1 stop,In-flight meal not included,11087,2019-03-09,08:55:00,10:45:00,0,1550,1,0,0,3849,0,0,BLR,DEL,1708.6520853536679,0,0,0,0,0,0,0,0,0,0,3,9,10,1,1,1,1,1,1,0,1,0,Banglore_New Delhi,932,0,22,1,0,66.14137104594843,0.907147811591598,1,0
Jet Airways,27/03/2019,Delhi,Cochin,DEL → BOM → COK,19:15,19:45 28 Mar,24h 30m,1 stop,In-flight meal not included,5963,2019-03-27,19:15:00,19:45:00,0,1470,0,0,0,3849,0,0,DEL,COK,2047.882109458646,0,0,0,0,0,0,0,0,0,0,3,27,13,1,1,1,3,3,0,1,1,0,Delhi_Cochin,4537,0,4,0,1,83.58702487586311,0.7178147576027176,1,0
IndiGo,24/05/2019,Chennai,Kolkata,MAA → CCU,13:15,15:35,2h 20m,non-stop,No info,3597,2019-05-24,13:15:00,15:35:00,0,140,0,1,0,2053,0,0,MAA,CCU,1385.198425287915,0,0,0,0,0,0,0,0,0,0,5,24,21,2,1,1,2,2,0,0,0,1,Chennai_Kolkata,381,1,7,0,1,593.656467980535,0.10106855266667002,1,0
Jet Airways,12/06/2019,Kolkata,Banglore,CCU → BOM → BLR,18:55,10:05 13 Jun,15h 10m,1 stop,In-flight meal not included,8529,2019-06-12,18:55:00,10:05:00,0,910,0,0,0,3849,0,0,CCU,BLR,1546.4372901474003,0,0,0,0,0,0,0,0,0,0,6,12,24,2,1,0,3,1,0,1,1,0,Kolkata_Banglore,2871,1,18,0,0,101.96289825147694,0.5884493382290739,1,0
Multiple carriers,12/06/2019,Delhi,Cochin,DEL → BOM → COK,04:55,19:00,14h 5m,1 stop,No info,10678,2019-06-12,04:55:00,19:00:00,0,845,0,1,0,1196,0,0,DEL,COK,2047.882109458646,0,0,0,0,0,0,0,0,0,0,6,12,24,2,1,0,0,3,0,0,1,0,Delhi_Cochin,4537,0,18,0,0,145.41174741718197,0.41262140828183425,1,0
IndiGo,27/03/2019,Delhi,Cochin,DEL → BOM → COK,08:25,21:00,12h 35m,1 stop,No info,8285,2019-03-27,08:25:00,21:00:00,0,755,0,1,0,2053,0,0,DEL,COK,2047.882109458646,0,0,0,0,0,0,0,0,0,0,3,27,13,1,1,1,1,3,1,0,1,0,Delhi_Cochin,4537,0,4,0,1,162.74559810267385,0.3686735659796271,1,0
Jet Airways,12/06/2019,Delhi,Cochin,DEL → BOM → COK,02:15,12:35,10h 20m,1 stop,No info,18371,2019-06-12,02:15:00,12:35:00,0,620,0,1,1,3849,0,0,DEL,COK,2047.882109458646,0,0,0,0,0,0,0,0,0,0,6,12,24,2,1,0,0,2,0,0,1,0,Delhi_Cochin,4537,0,18,0,0,198.18213962503026,0.3027518025263163,1,0
Jet Airways,6/06/2019,Kolkata,Banglore,CCU → DEL → BLR,20:25,09:45 07 Jun,13h 20m,1 stop,No info,12692,2019-06-06,20:25:00,09:45:00,0,800,0,0,0,3849,0,0,CCU,BLR,1546.4372901474003,0,1,0,0,0,0,0,0,0,1,6,6,23,2,1,0,3,1,0,1,1,0,Kolkata_Banglore,2871,1,24,1,0,115.98279676105501,0.517318099542043,1,0
IndiGo,24/04/2019,Banglore,Delhi,BLR → DEL,06:05,08:50,2h 45m,non-stop,No info,4423,2019-04-24,06:05:00,08:50:00,0,165,0,1,0,2053,0,0,BLR,DEL,1708.6520853536679,0,0,0,0,0,0,0,0,0,0,4,24,17,2,1,1,1,1,1,0,0,1,Banglore_Delhi,1265,1,6,0,1,621.3280310376974,0.09656734768555719,1,0
Jet Airways,9/06/2019,Banglore,Delhi,BLR → DEL,19:50,22:50,3h,non-stop,In-flight meal not included,7229,2019-06-09,19:50:00,22:50:00,0,180,1,1,0,3849,0,0,BLR,DEL,1708.6520853536679,0,1,0,0,0,0,0,0,0,1,6,9,23,2,1,0,3,3,0,1,0,1,Banglore_Delhi,1265,1,21,1,0,569.5506951178893,0.10534619747515331,1,0
IndiGo,03/03/2019,Banglore,New Delhi,BLR → DEL,23:30,02:20 04 Mar,2h 50m,non-stop,No info,6144,2019-03-03,23:30:00,02:20:00,0,170,1,0,1,2053,0,0,BLR,DEL,1708.6520853536679,0,0,0,0,0,0,0,0,0,0,3,3,9,1,1,1,3,0,0,1,0,1,Banglore_New Delhi,932,0,28,1,0,603.0536771836476,0.0994936309487559,1,0
Jet Airways,1/06/2019,Delhi,Cochin,DEL → NAG → BOM → COK,06:45,04:25 02 Jun,21h 40m,2 stops,In-flight meal not included,10919,2019-06-01,06:45:00,04:25:00,0,1300,1,0,1,3849,0,0,DEL,COK,2047.882109458646,0,1,0,0,0,0,0,0,0,1,6,1,22,2,1,0,1,0,1,0,2,0,Delhi_Cochin,4537,0,29,1,0,94.51763582116828,0.6348021665874374,1,0
IndiGo,27/03/2019,Kolkata,Banglore,CCU → BLR,21:25,00:05 28 Mar,2h 40m,non-stop,No info,4148,2019-03-27,21:25:00,00:05:00,0,160,0,0,1,2053,0,0,CCU,BLR,1546.4372901474003,0,0,0,0,0,0,0,0,0,0,3,27,13,1,1,1,3,0,0,1,0,1,Kolkata_Banglore,2871,1,4,0,1,579.913983805275,0.10346361990840859,1,0
SpiceJet,24/03/2019,Banglore,New Delhi,BLR → DEL,20:30,23:20,2h 50m,non-stop,No check-in baggage included,3873,2019-03-24,20:30:00,23:20:00,0,170,1,1,0,818,0,0,BLR,DEL,1708.6520853536679,0,0,0,0,1,0,0,0,0,1,3,24,12,1,1,1,3,3,0,1,0,1,Banglore_New Delhi,932,0,7,0,1,603.0536771836476,0.0994936309487559,1,0
Jet Airways,21/03/2019,Delhi,Cochin,DEL → JAI → BOM → COK,09:40,18:50,9h 10m,2 stops,No info,11702,2019-03-21,09:40:00,18:50:00,0,550,0,1,0,3849,0,0,DEL,COK,2047.882109458646,0,0,0,0,1,0,0,0,0,1,3,21,12,1,1,1,1,3,1,0,2,0,Delhi_Cochin,4537,0,10,0,1,223.4053210318523,0.26857014740237733,1,0
IndiGo,6/03/2019,Delhi,Cochin,DEL → BOM → COK,17:10,01:35 07 Mar,8h 25m,1 stop,No info,14871,2019-03-06,17:10:00,01:35:00,0,505,0,0,1,2053,0,0,DEL,COK,2047.882109458646,0,0,0,0,0,0,0,0,0,0,3,6,10,1,1,1,2,0,0,0,1,0,Delhi_Cochin,4537,0,25,1,0,243.31272587627478,0.24659622625127373,1,0
Air India,18/03/2019,Banglore,New Delhi,BLR → BOM → IDR → DEL,06:45,11:10 16 Mar,28h 25m,2 stops,No info,11234,2019-03-18,06:45:00,11:10:00,0,1705,0,0,0,1752,0,0,BLR,DEL,1708.6520853536679,0,0,0,0,1,0,0,0,0,1,3,18,12,1,1,1,1,1,1,0,2,0,Banglore_New Delhi,932,0,13,0,0,60.12851913268039,0.9978625927507577,1,0
IndiGo,6/06/2019,Delhi,Cochin,DEL → HYD → COK,14:20,22:30,8h 10m,1 stop,No info,6938,2019-06-06,14:20:00,22:30:00,0,490,0,1,0,2053,0,0,DEL,COK,2047.882109458646,0,1,0,0,0,0,0,0,0,1,6,6,23,2,1,0,2,3,0,0,1,0,Delhi_Cochin,4537,0,24,1,0,250.7610746275893,0.23927158586757252,1,0
IndiGo,12/06/2019,Delhi,Cochin,DEL → BOM → COK,08:30,21:00,12h 30m,1 stop,No info,6093,2019-06-12,08:30:00,21:00:00,0,750,0,1,0,2053,0,0,DEL,COK,2047.882109458646,0,0,0,0,0,0,0,0,0,0,6,12,24,2,1,0,1,3,1,0,1,0,Delhi_Cochin,4537,0,18,0,0,163.83056875669166,0.36623201918506,1,0
IndiGo,15/05/2019,Banglore,Delhi,BLR → DEL,10:10,13:00,2h 50m,non-stop,No info,3943,2019-05-15,10:10:00,13:00:00,0,170,0,1,0,2053,0,0,BLR,DEL,1708.6520853536679,0,0,0,0,0,0,0,0,0,0,5,15,20,2,1,1,1,2,1,0,0,1,Banglore_Delhi,1265,1,16,0,0,603.0536771836476,0.0994936309487559,1,0
Jet Airways,6/06/2019,Mumbai,Hyderabad,BOM → HYD,10:20,11:50,1h 30m,non-stop,No info,8040,2019-06-06,10:20:00,11:50:00,0,90,0,1,0,3849,0,0,BOM,HYD,622.9702752863186,0,1,0,0,0,0,0,0,0,1,6,6,23,2,1,0,1,1,1,0,0,1,Mumbai_Hyderabad,697,1,24,1,0,415.3135168575457,0.14446917223881314,0,0
Jet Airways,9/05/2019,Delhi,Cochin,DEL → AMD → BOM → COK,23:05,12:35 10 May,13h 30m,2 stops,No info,15129,2019-05-09,23:05:00,12:35:00,0,810,0,0,1,3849,0,0,DEL,COK,2047.882109458646,0,0,0,0,0,0,0,0,0,0,5,9,19,2,1,1,3,2,0,1,2,0,Delhi_Cochin,4537,0,22,1,0,151.69497107101083,0.3955305807198648,1,0
SpiceJet,9/05/2019,Chennai,Kolkata,MAA → CCU,17:45,20:05,2h 20m,non-stop,No info,3597,2019-05-09,17:45:00,20:05:00,0,140,0,1,0,818,0,0,MAA,CCU,1385.198425287915,0,0,0,0,0,0,0,0,0,0,5,9,19,2,1,1,2,3,0,0,0,1,Chennai_Kolkata,381,1,22,1,0,593.656467980535,0.10106855266667002,1,0
Vistara,6/05/2019,Kolkata,Banglore,CCU → DEL → BLR,07:10,18:50,11h 40m,1 stop,No info,8610,2019-05-06,07:10:00,18:50:00,0,700,0,1,0,479,0,0,CCU,BLR,1546.4372901474003,0,0,0,0,0,0,0,0,0,0,5,6,19,2,1,1,1,3,1,0,1,0,Kolkata_Banglore,2871,1,25,1,0,132.55176772692005,0.45265333709928757,1,0
Jet Airways,1/05/2019,Kolkata,Banglore,CCU → DEL → BLR,17:00,23:35,6h 35m,1 stop,No info,13067,2019-05-01,17:00:00,23:35:00,0,395,0,1,0,3849,0,0,CCU,BLR,1546.4372901474003,0,0,0,0,0,0,0,0,0,0,5,1,18,2,1,1,2,3,0,0,1,0,Kolkata_Banglore,2871,1,30,1,0,234.90186685783297,0.2554258116488837,1,0
SpiceJet,9/05/2019,Banglore,Delhi,BLR → DEL,09:30,12:20,2h 50m,non-stop,No info,4991,2019-05-09,09:30:00,12:20:00,0,170,0,1,0,818,0,0,BLR,DEL,1708.6520853536679,0,0,0,0,0,0,0,0,0,0,5,9,19,2,1,1,1,2,1,0,0,1,Banglore_Delhi,1265,1,22,1,0,603.0536771836476,0.0994936309487559,1,0
SpiceJet,1/04/2019,Kolkata,Banglore,CCU → MAA → BLR,15:05,20:20,5h 15m,1 stop,No info,4649,2019-04-01,15:05:00,20:20:00,0,315,0,1,0,818,0,0,CCU,BLR,1546.4372901474003,0,0,0,0,0,0,0,0,0,0,4,1,14,2,1,1,2,3,0,0,1,0,Kolkata_Banglore,2871,1,29,1,0,294.55948383760006,0.2036940016946794,1,0
SpiceJet,18/05/2019,Chennai,Kolkata,MAA → CCU,08:20,10:35,2h 15m,non-stop,No info,3597,2019-05-18,08:20:00,10:35:00,0,135,1,1,0,818,0,0,MAA,CCU,1385.198425287915,0,0,0,0,0,0,0,0,0,0,5,18,20,2,1,1,1,1,1,0,0,1,Chennai_Kolkata,381,1,13,0,0,615.6437445724066,0.09745896150000323,1,0
Jet Airways,21/05/2019,Delhi,Cochin,DEL → BOM → COK,08:00,19:00,11h,1 stop,In-flight meal not included,12898,2019-05-21,08:00:00,19:00:00,0,660,0,1,0,3849,0,0,DEL,COK,2047.882109458646,0,0,0,0,0,0,0,0,0,0,5,21,21,2,1,1,1,3,1,0,1,0,Delhi_Cochin,4537,0,10,0,1,186.1711008598769,0.3222841768828528,1,0
Jet Airways,27/03/2019,Delhi,Cochin,DEL → IXC → BOM → COK,06:20,19:45 28 Mar,37h 25m,2 stops,In-flight meal not included,9296,2019-03-27,06:20:00,19:45:00,0,2245,0,0,0,3849,0,0,DEL,COK,2047.882109458646,0,0,0,0,0,0,0,0,0,0,3,27,13,1,1,1,1,3,1,0,2,0,Delhi_Cochin,4537,0,4,0,1,54.731815842992766,1.096254510760613,1,0
IndiGo,03/03/2019,Banglore,New Delhi,BLR → DEL,16:55,19:45,2h 50m,non-stop,No info,8855,2019-03-03,16:55:00,19:45:00,0,170,1,1,0,2053,0,0,BLR,DEL,1708.6520853536679,0,0,0,0,0,0,0,0,0,0,3,3,9,1,1,1,2,3,0,0,0,1,Banglore_New Delhi,932,0,28,1,0,603.0536771836476,0.0994936309487559,1,0
Jet Airways,6/06/2019,Delhi,Cochin,DEL → BOM → COK,21:50,19:00 07 Jun,21h 10m,1 stop,In-flight meal not included,10262,2019-06-06,21:50:00,19:00:00,0,1270,0,0,1,3849,0,0,DEL,COK,2047.882109458646,0,1,0,0,0,0,0,0,0,1,6,6,23,2,1,0,3,3,0,1,1,0,Delhi_Cochin,4537,0,24,1,0,96.75033587993603,0.6201528858200349,1,0
IndiGo,24/06/2019,Banglore,Delhi,BLR → DEL,06:05,08:50,2h 45m,non-stop,No info,3943,2019-06-24,06:05:00,08:50:00,0,165,0,1,0,2053,0,0,BLR,DEL,1708.6520853536679,0,0,0,0,0,0,0,0,0,0,6,24,26,2,1,0,1,1,1,0,0,1,Banglore_Delhi,1265,1,6,0,1,621.3280310376974,0.09656734768555719,1,0
Multiple carriers,3/06/2019,Delhi,Cochin,DEL → BOM → COK,12:50,19:15,6h 25m,1 stop,No info,9001,2019-06-03,12:50:00,19:15:00,0,385,0,1,0,1196,0,0,DEL,COK,2047.882109458646,0,1,0,0,0,0,0,0,0,1,6,3,23,2,1,0,2,3,0,0,1,0,Delhi_Cochin,4537,0,27,1,0,319.15045861693187,0.18799910318166413,1,0
Multiple carriers,18/05/2019,Delhi,Cochin,DEL → BOM → COK,10:20,01:30 19 May,15h 10m,1 stop,No info,7670,2019-05-18,10:20:00,01:30:00,0,910,1,0,1,1196,0,0,DEL,COK,2047.882109458646,0,0,0,0,0,0,0,0,0,0,5,18,20,2,1,1,1,0,1,0,1,0,Delhi_Cochin,4537,0,13,0,0,135.02519403024039,0.44436151661120615,1,0
Multiple carriers,3/06/2019,Delhi,Cochin,DEL → BOM → COK,17:45,01:30 04 Jun,7h 45m,1 stop,No info,7530,2019-06-03,17:45:00,01:30:00,0,465,0,0,1,1196,0,0,DEL,COK,2047.882109458646,0,1,0,0,0,0,0,0,0,1,6,3,23,2,1,0,2,0,0,0,1,0,Delhi_Cochin,4537,0,27,1,0,264.2428528333737,0.2270638518947372,1,0
IndiGo,1/05/2019,Kolkata,Banglore,CCU → PAT → BLR,09:20,14:15,4h 55m,1 stop,No info,8443,2019-05-01,09:20:00,14:15:00,0,295,0,1,0,2053,0,0,CCU,BLR,1546.4372901474003,0,0,0,0,0,0,0,0,0,0,5,1,18,2,1,1,1,2,1,0,1,0,Kolkata_Banglore,2871,1,30,1,0,314.52961833506447,0.19076104920612835,1,0
SpiceJet,1/04/2019,Delhi,Cochin,DEL → MAA → COK,06:05,11:20,5h 15m,1 stop,No info,5351,2019-04-01,06:05:00,11:20:00,0,315,0,1,0,818,0,0,DEL,COK,2047.882109458646,0,0,0,0,0,0,0,0,0,0,4,1,14,2,1,1,1,1,1,0,1,0,Delhi_Cochin,4537,0,29,1,0,390.0727827540278,0.1538174480577252,1,0
Vistara,21/03/2019,Delhi,Cochin,DEL → COK,06:00,09:10,3h 10m,non-stop,No info,6688,2019-03-21,06:00:00,09:10:00,0,190,0,1,0,479,0,0,DEL,COK,2047.882109458646,0,0,0,0,1,0,0,0,0,1,3,21,12,1,1,1,1,1,1,0,0,1,Delhi_Cochin,4537,0,10,0,1,646.6996135132566,0.09277877819354853,1,0
Jet Airways,12/03/2019,Banglore,New Delhi,BLR → BOM → DEL,20:35,19:10 13 Mar,22h 35m,1 stop,In-flight meal not included,11087,2019-03-12,20:35:00,19:10:00,0,1355,0,0,0,3849,0,0,BLR,DEL,1708.6520853536679,0,0,0,0,0,0,0,0,0,0,3,12,11,1,1,1,3,3,0,1,1,0,Banglore_New Delhi,932,0,19,0,0,75.6598709381698,0.7930227643268485,1,0
Air India,15/03/2019,Banglore,New Delhi,BLR → CCU → BBI → DEL,05:50,12:05 16 Mar,30h 15m,2 stops,No info,7664,2019-03-15,05:50:00,12:05:00,0,1815,0,0,0,1752,0,0,BLR,DEL,1708.6520853536679,0,0,0,0,1,0,0,0,0,1,3,15,11,1,1,1,0,2,0,0,2,0,Banglore_New Delhi,932,0,16,0,0,56.48436645797249,1.0622408245411292,1,0
IndiGo,15/04/2019,Kolkata,Banglore,CCU → HYD → BLR,15:15,20:30,5h 15m,1 stop,No info,4775,2019-04-15,15:15:00,20:30:00,0,315,0,1,0,2053,0,0,CCU,BLR,1546.4372901474003,0,0,0,0,0,0,0,0,0,0,4,15,16,2,1,1,2,3,0,0,1,0,Kolkata_Banglore,2871,1,15,0,0,294.55948383760006,0.2036940016946794,1,0
GoAir,27/06/2019,Kolkata,Banglore,CCU → BLR,15:20,17:55,2h 35m,non-stop,No info,3514,2019-06-27,15:20:00,17:55:00,0,155,0,1,0,194,0,0,CCU,BLR,1546.4372901474003,0,0,0,0,0,0,0,0,0,0,6,27,26,2,1,0,2,2,0,0,0,1,Kolkata_Banglore,2871,1,3,0,1,598.6208865086711,0.10023038178627082,1,0
Jet Airways,24/06/2019,Delhi,Cochin,DEL → NAG → BOM → COK,06:45,04:25 25 Jun,21h 40m,2 stops,No info,13376,2019-06-24,06:45:00,04:25:00,0,1300,0,0,1,3849,0,0,DEL,COK,2047.882109458646,0,0,0,0,0,0,0,0,0,0,6,24,26,2,1,0,1,0,1,0,2,0,Delhi_Cochin,4537,0,6,0,1,94.51763582116828,0.6348021665874374,1,0
Jet Airways,12/06/2019,Delhi,Cochin,DEL → ATQ → BOM → COK,08:10,12:35 13 Jun,28h 25m,2 stops,No info,14300,2019-06-12,08:10:00,12:35:00,0,1705,0,0,0,3849,0,0,DEL,COK,2047.882109458646,0,0,0,0,0,0,0,0,0,0,6,12,24,2,1,0,1,2,1,0,2,0,Delhi_Cochin,4537,0,18,0,0,72.0662325909201,0.8325674569473698,1,0
Air India,27/06/2019,Delhi,Cochin,DEL → MAA → COK,20:40,09:25 28 Jun,12h 45m,1 stop,No info,7480,2019-06-27,20:40:00,09:25:00,0,765,0,0,0,1752,0,0,DEL,COK,2047.882109458646,0,0,0,0,0,0,0,0,0,0,6,27,26,2,1,0,3,1,0,1,1,0,Delhi_Cochin,4537,0,3,0,1,160.6182046634232,0.3735566595687612,1,0
IndiGo,12/05/2019,Mumbai,Hyderabad,BOM → HYD,21:20,22:50,1h 30m,non-stop,No info,2227,2019-05-12,21:20:00,22:50:00,0,90,1,1,1,2053,0,0,BOM,HYD,622.9702752863186,0,0,0,0,0,0,0,0,0,0,5,12,19,2,1,1,3,3,0,1,0,1,Mumbai_Hyderabad,697,1,19,0,0,415.3135168575457,0.14446917223881314,0,0
Air Asia,18/05/2019,Delhi,Cochin,DEL → BLR → COK,07:55,22:25,14h 30m,1 stop,No info,7452,2019-05-18,07:55:00,22:25:00,0,870,1,1,0,319,0,0,DEL,COK,2047.882109458646,0,0,0,0,0,0,0,0,0,0,5,18,20,2,1,1,1,3,1,0,1,0,Delhi_Cochin,4537,0,13,0,0,141.2332489281825,0.4248291422546696,1,0
Air Asia,24/05/2019,Kolkata,Banglore,CCU → BLR,10:20,12:55,2h 35m,non-stop,No info,4409,2019-05-24,10:20:00,12:55:00,0,155,0,1,0,319,0,0,CCU,BLR,1546.4372901474003,0,0,0,0,0,0,0,0,0,0,5,24,21,2,1,1,1,2,1,0,0,1,Kolkata_Banglore,2871,1,7,0,1,598.6208865086711,0.10023038178627082,1,0
Air India,3/04/2019,Kolkata,Banglore,CCU → BBI → HYD → BLR,09:10,11:05 04 Apr,25h 55m,2 stops,No info,4647,2019-04-03,09:10:00,11:05:00,0,1555,0,0,0,1752,0,0,CCU,BLR,1546.4372901474003,0,0,0,0,0,0,0,0,0,0,4,3,14,2,1,1,1,1,1,0,2,0,Kolkata_Banglore,2871,1,27,1,0,59.66960605070354,1.005537055984846,1,0
SpiceJet,21/03/2019,Chennai,Kolkata,MAA → CCU,09:30,12:05,2h 35m,non-stop,No check-in baggage included,3332,2019-03-21,09:30:00,12:05:00,0,155,0,1,0,818,0,0,MAA,CCU,1385.198425287915,0,0,0,0,1,0,0,0,0,1,3,21,12,1,1,1,1,2,1,0,0,1,Chennai_Kolkata,381,1,10,0,1,536.2058420469348,0.11189732616667038,1,0
Air India,27/03/2019,Delhi,Cochin,DEL → BOM → COK,10:00,19:15,9h 15m,1 stop,No info,6902,2019-03-27,10:00:00,19:15:00,0,555,0,1,0,1752,0,0,DEL,COK,2047.882109458646,0,0,0,0,0,0,0,0,0,0,3,27,13,1,1,1,1,3,1,0,1,0,Delhi_Cochin,4537,0,4,0,1,221.3926604820158,0.2710116941969444,1,0
Air Asia,6/06/2019,Kolkata,Banglore,CCU → BBI → BLR,19:55,23:30,3h 35m,1 stop,No info,6857,2019-06-06,19:55:00,23:30:00,0,215,0,1,0,319,0,0,CCU,BLR,1546.4372901474003,0,1,0,0,0,0,0,0,0,1,6,6,23,2,1,0,3,3,0,1,1,0,Kolkata_Banglore,2871,1,24,1,0,431.56389492485584,0.13902923925192404,1,0
Jet Airways,9/05/2019,Delhi,Cochin,DEL → BOM → COK,19:15,04:25 10 May,9h 10m,1 stop,In-flight meal not included,12373,2019-05-09,19:15:00,04:25:00,0,550,0,0,1,3849,0,0,DEL,COK,2047.882109458646,0,0,0,0,0,0,0,0,0,0,5,9,19,2,1,1,3,0,0,1,1,0,Delhi_Cochin,4537,0,22,1,0,223.4053210318523,0.26857014740237733,1,0
Multiple carriers,15/06/2019,Delhi,Cochin,DEL → BOM → COK,11:40,19:00,7h 20m,1 stop,No info,11789,2019-06-15,11:40:00,19:00:00,0,440,1,1,0,1196,0,0,DEL,COK,2047.882109458646,0,0,0,0,0,0,0,0,0,0,6,15,24,2,1,0,1,3,1,0,1,0,Delhi_Cochin,4537,0,15,0,0,279.25665128981535,0.21485611792190187,1,0
Air India,9/05/2019,Delhi,Cochin,DEL → HYD → BOM → COK,17:15,07:40 10 May,14h 25m,2 stops,No info,13039,2019-05-09,17:15:00,07:40:00,0,865,0,0,0,1752,0,0,DEL,COK,2047.882109458646,0,0,0,0,0,0,0,0,0,0,5,9,19,2,1,1,2,1,0,0,2,0,Delhi_Cochin,4537,0,22,1,0,142.04962608961705,0.4223875954601025,1,0
Jet Airways,12/03/2019,Banglore,New Delhi,BLR → BOM → DEL,22:55,11:25 13 Mar,12h 30m,1 stop,In-flight meal not included,11087,2019-03-12,22:55:00,11:25:00,0,750,0,0,1,3849,0,0,BLR,DEL,1708.6520853536679,0,0,0,0,0,0,0,0,0,0,3,12,11,1,1,1,3,1,0,1,1,0,Banglore_New Delhi,932,0,19,0,0,136.6921668282934,0.43894248947980546,1,0
Vistara,18/05/2019,Kolkata,Banglore,CCU → DEL → BLR,20:20,23:25 19 May,27h 5m,1 stop,No info,9345,2019-05-18,20:20:00,23:25:00,0,1625,1,0,0,479,0,0,CCU,BLR,1546.4372901474003,0,0,0,0,0,0,0,0,0,0,5,18,20,2,1,1,3,3,0,1,1,0,Kolkata_Banglore,2871,1,13,0,0,57.09922302082708,1.0508023896947747,1,0
SpiceJet,24/06/2019,Mumbai,Hyderabad,BOM → HYD,22:45,00:15 25 Jun,1h 30m,non-stop,No check-in baggage included,1965,2019-06-24,22:45:00,00:15:00,0,90,0,0,1,818,0,0,BOM,HYD,622.9702752863186,0,0,0,0,0,0,0,0,0,0,6,24,26,2,1,0,3,0,0,1,0,1,Mumbai_Hyderabad,697,1,6,0,1,415.3135168575457,0.14446917223881314,0,0
IndiGo,3/06/2019,Delhi,Cochin,DEL → BOM → COK,07:30,21:00,13h 30m,1 stop,No info,6093,2019-06-03,07:30:00,21:00:00,0,810,0,1,0,2053,0,0,DEL,COK,2047.882109458646,0,1,0,0,0,0,0,0,0,1,6,3,23,2,1,0,1,3,1,0,1,0,Delhi_Cochin,4537,0,27,1,0,151.69497107101083,0.3955305807198648,1,0
Jet Airways,9/06/2019,Kolkata,Banglore,CCU → BOM → BLR,18:55,08:15 10 Jun,13h 20m,1 stop,In-flight meal not included,11841,2019-06-09,18:55:00,08:15:00,0,800,1,0,0,3849,0,0,CCU,BLR,1546.4372901474003,0,1,0,0,0,0,0,0,0,1,6,9,23,2,1,0,3,1,0,1,1,0,Kolkata_Banglore,2871,1,21,1,0,115.98279676105501,0.517318099542043,1,0
Jet Airways,9/05/2019,Kolkata,Banglore,CCU → BOM → BLR,21:10,10:05 10 May,12h 55m,1 stop,In-flight meal not included,9663,2019-05-09,21:10:00,10:05:00,0,775,0,0,1,3849,0,0,CCU,BLR,1546.4372901474003,0,0,0,0,0,0,0,0,0,0,5,9,19,2,1,1,3,1,0,1,1,0,Kolkata_Banglore,2871,1,22,1,0,119.72417730173422,0.5011519089313541,1,0
Jet Airways,6/06/2019,Delhi,Cochin,DEL → BOM → COK,19:15,19:00 07 Jun,23h 45m,1 stop,No info,14714,2019-06-06,19:15:00,19:00:00,0,1425,0,0,0,3849,0,0,DEL,COK,2047.882109458646,0,1,0,0,0,0,0,0,0,1,6,6,23,2,1,0,3,3,0,1,1,0,Delhi_Cochin,4537,0,24,1,0,86.22661513510089,0.695840836451614,1,0
Jet Airways,12/06/2019,Kolkata,Banglore,CCU → BOM → BLR,18:55,22:35 13 Jun,27h 40m,1 stop,In-flight meal not included,8529,2019-06-12,18:55:00,22:35:00,0,1660,0,0,0,3849,0,0,CCU,BLR,1546.4372901474003,0,0,0,0,0,0,0,0,0,0,6,12,24,2,1,0,3,3,0,1,1,0,Kolkata_Banglore,2871,1,18,0,0,55.89532374026748,1.0734350565497393,1,0
IndiGo,6/04/2019,Delhi,Cochin,DEL → HYD → COK,07:35,12:10,4h 35m,1 stop,No info,5073,2019-04-06,07:35:00,12:10:00,0,275,1,1,0,2053,0,0,DEL,COK,2047.882109458646,0,0,0,0,0,0,0,0,0,0,4,6,14,2,1,1,1,2,1,0,1,0,Delhi_Cochin,4537,0,24,1,0,446.8106420637046,0.13428507370118867,1,0
Jet Airways,24/04/2019,Banglore,Delhi,BLR → DEL,07:10,10:10,3h,non-stop,No info,7229,2019-04-24,07:10:00,10:10:00,0,180,0,1,0,3849,0,0,BLR,DEL,1708.6520853536679,0,0,0,0,0,0,0,0,0,0,4,24,17,2,1,1,1,1,1,0,0,1,Banglore_Delhi,1265,1,6,0,1,569.5506951178893,0.10534619747515331,1,0
Air India,6/06/2019,Delhi,Cochin,DEL → BOM → COK,10:00,19:15,9h 15m,1 stop,No info,9194,2019-06-06,10:00:00,19:15:00,0,555,0,1,0,1752,0,0,DEL,COK,2047.882109458646,0,1,0,0,0,0,0,0,0,1,6,6,23,2,1,0,1,3,1,0,1,0,Delhi_Cochin,4537,0,24,1,0,221.3926604820158,0.2710116941969444,1,0
Multiple carriers,12/06/2019,Delhi,Cochin,DEL → BOM → COK,11:40,19:00,7h 20m,1 stop,No info,11789,2019-06-12,11:40:00,19:00:00,0,440,0,1,0,1196,0,0,DEL,COK,2047.882109458646,0,0,0,0,0,0,0,0,0,0,6,12,24,2,1,0,1,3,1,0,1,0,Delhi_Cochin,4537,0,18,0,0,279.25665128981535,0.21485611792190187,1,0
SpiceJet,12/06/2019,Mumbai,Hyderabad,BOM → HYD,13:15,14:45,1h 30m,non-stop,No info,2017,2019-06-12,13:15:00,14:45:00,0,90,0,1,0,818,0,0,BOM,HYD,622.9702752863186,0,0,0,0,0,0,0,0,0,0,6,12,24,2,1,0,2,2,0,0,0,1,Mumbai_Hyderabad,697,1,18,0,0,415.3135168575457,0.14446917223881314,0,0
Air India,6/06/2019,Kolkata,Banglore,CCU → VNS → DEL → BLR,14:30,12:30 07 Jun,22h,2 stops,No info,15894,2019-06-06,14:30:00,12:30:00,0,1320,0,0,0,1752,0,0,CCU,BLR,1546.4372901474003,0,1,0,0,0,0,0,0,0,1,6,6,23,2,1,0,2,2,0,0,2,0,Kolkata_Banglore,2871,1,24,1,0,70.29260409760911,0.8535748642443709,1,0
IndiGo,9/05/2019,Banglore,Delhi,BLR → DEL,01:30,04:15,2h 45m,non-stop,No info,3419,2019-05-09,01:30:00,04:15:00,0,165,0,1,1,2053,0,0,BLR,DEL,1708.6520853536679,0,0,0,0,0,0,0,0,0,0,5,9,19,2,1,1,0,0,0,0,0,1,Banglore_Delhi,1265,1,22,1,0,621.3280310376974,0.09656734768555719,1,0
Jet Airways,9/06/2019,Delhi,Cochin,DEL → JAI → BOM → COK,05:30,04:25 10 Jun,22h 55m,2 stops,In-flight meal not included,10368,2019-06-09,05:30:00,04:25:00,0,1375,1,0,1,3849,0,0,DEL,COK,2047.882109458646,0,1,0,0,0,0,0,0,0,1,6,9,23,2,1,0,0,0,0,0,2,0,Delhi_Cochin,4537,0,21,1,0,89.36212841274092,0.6714253685059434,1,0
IndiGo,24/04/2019,Delhi,Cochin,DEL → BLR → COK,15:10,20:00,4h 50m,1 stop,No info,6027,2019-04-24,15:10:00,20:00:00,0,290,0,1,0,2053,0,0,DEL,COK,2047.882109458646,0,0,0,0,0,0,0,0,0,0,4,24,17,2,1,1,2,3,0,0,1,0,Delhi_Cochin,4537,0,6,0,1,423.6997467845474,0.14160971408488987,1,0
Air India,18/05/2019,Delhi,Cochin,DEL → MAA → COK,20:40,09:25 19 May,12h 45m,1 stop,No info,7480,2019-05-18,20:40:00,09:25:00,0,765,1,0,0,1752,0,0,DEL,COK,2047.882109458646,0,0,0,0,0,0,0,0,0,0,5,18,20,2,1,1,3,1,0,1,1,0,Delhi_Cochin,4537,0,13,0,0,160.6182046634232,0.3735566595687612,1,0
SpiceJet,12/06/2019,Kolkata,Banglore,CCU → PNQ → BLR,08:35,17:15,8h 40m,1 stop,No info,7189,2019-06-12,08:35:00,17:15:00,0,520,0,1,0,818,0,0,CCU,BLR,1546.4372901474003,0,0,0,0,0,0,0,0,0,0,6,12,24,2,1,0,1,2,1,0,1,0,Kolkata_Banglore,2871,1,18,0,0,178.43507194008464,0.3362567647023279,1,0
Air India,15/03/2019,Banglore,New Delhi,BLR → DEL,10:00,12:45,2h 45m,non-stop,No info,7276,2019-03-15,10:00:00,12:45:00,0,165,0,1,0,1752,0,0,BLR,DEL,1708.6520853536679,0,0,0,0,1,0,0,0,0,1,3,15,11,1,1,1,1,2,1,0,0,1,Banglore_New Delhi,932,0,16,0,0,621.3280310376974,0.09656734768555719,1,0
Jet Airways,6/03/2019,Delhi,Cochin,DEL → BOM → COK,11:30,04:25 07 Mar,16h 55m,1 stop,No info,15764,2019-03-06,11:30:00,04:25:00,0,1015,0,0,1,3849,0,0,DEL,COK,2047.882109458646,0,0,0,0,0,0,0,0,0,0,3,6,10,1,1,1,1,0,1,0,1,0,Delhi_Cochin,4537,0,25,1,0,121.05707050987071,0.49563399929711455,1,0
Jet Airways,6/06/2019,Delhi,Cochin,DEL → BOM → COK,19:15,04:25 07 Jun,9h 10m,1 stop,No info,14714,2019-06-06,19:15:00,04:25:00,0,550,0,0,1,3849,0,0,DEL,COK,2047.882109458646,0,1,0,0,0,0,0,0,0,1,6,6,23,2,1,0,3,0,0,1,1,0,Delhi_Cochin,4537,0,24,1,0,223.4053210318523,0.26857014740237733,1,0
Multiple carriers,21/05/2019,Delhi,Cochin,DEL → BOM → COK,17:00,01:30 22 May,8h 30m,1 stop,No info,7888,2019-05-21,17:00:00,01:30:00,0,510,0,0,1,1196,0,0,DEL,COK,2047.882109458646,0,0,0,0,0,0,0,0,0,0,5,21,21,2,1,1,2,0,0,0,1,0,Delhi_Cochin,4537,0,10,0,1,240.92730699513484,0.2490377730458408,1,0
Jet Airways,6/06/2019,Delhi,Cochin,DEL → BOM → COK,08:00,04:25 07 Jun,20h 25m,1 stop,In-flight meal not included,10262,2019-06-06,08:00:00,04:25:00,0,1225,0,0,1,3849,0,0,DEL,COK,2047.882109458646,0,1,0,0,0,0,0,0,0,1,6,6,23,2,1,0,1,0,1,0,1,0,Delhi_Cochin,4537,0,24,1,0,100.30442985103572,0.5981789646689314,1,0
Jet Airways,18/05/2019,Delhi,Cochin,DEL → ATQ → BOM → COK,20:00,04:25 19 May,8h 25m,2 stops,In-flight meal not included,15318,2019-05-18,20:00:00,04:25:00,0,505,1,0,1,3849,0,0,DEL,COK,2047.882109458646,0,0,0,0,0,0,0,0,0,0,5,18,20,2,1,1,3,0,0,1,2,0,Delhi_Cochin,4537,0,13,0,0,243.31272587627478,0.24659622625127373,1,0
Jet Airways,1/05/2019,Kolkata,Banglore,CCU → GAU → BLR,10:20,17:35,7h 15m,1 stop,In-flight meal not included,5608,2019-05-01,10:20:00,17:35:00,0,435,0,1,0,3849,0,0,CCU,BLR,1546.4372901474003,0,0,0,0,0,0,0,0,0,0,5,1,18,2,1,1,1,2,1,0,1,0,Kolkata_Banglore,2871,1,30,1,0,213.3016951927449,0.28129171662598584,1,0
Jet Airways,1/04/2019,Kolkata,Banglore,CCU → BOM → BLR,08:25,18:15,9h 50m,1 stop,No info,12681,2019-04-01,08:25:00,18:15:00,0,590,0,1,0,3849,0,0,CCU,BLR,1546.4372901474003,0,0,0,0,0,0,0,0,0,0,4,1,14,2,1,1,1,3,1,0,1,0,Kolkata_Banglore,2871,1,29,1,0,157.26480916753223,0.3815220984122567,1,0
Air India,6/03/2019,Delhi,Cochin,DEL → HYD → MAA → COK,17:15,09:25 07 Mar,16h 10m,2 stops,No info,9417,2019-03-06,17:15:00,09:25:00,0,970,0,0,0,1752,0,0,DEL,COK,2047.882109458646,0,0,0,0,0,0,0,0,0,0,3,6,10,1,1,1,2,1,0,0,2,0,Delhi_Cochin,4537,0,25,1,0,126.67312017269975,0.4736600781460109,1,0
Multiple carriers,3/03/2019,Delhi,Cochin,DEL → BOM → COK,07:05,21:00,13h 55m,1 stop,No info,17057,2019-03-03,07:05:00,21:00:00,0,835,1,1,0,1196,0,0,DEL,COK,2047.882109458646,0,0,0,0,0,0,0,0,0,0,3,3,9,1,1,1,1,3,1,0,1,0,Delhi_Cochin,4537,0,28,1,0,147.15320547008236,0.4077383146927001,1,0
Multiple carriers,27/03/2019,Delhi,Cochin,DEL → BOM → COK,13:00,21:00,8h,1 stop,No info,12537,2019-03-27,13:00:00,21:00:00,0,480,0,1,0,1196,0,0,DEL,COK,2047.882109458646,0,0,0,0,0,0,0,0,0,0,3,27,13,1,1,1,2,3,0,0,1,0,Delhi_Cochin,4537,0,4,0,1,255.98526368233078,0.23438849227843842,1,0
Air India,27/05/2019,Delhi,Cochin,DEL → GOI → BOM → COK,22:00,19:15 28 May,21h 15m,2 stops,No info,10651,2019-05-27,22:00:00,19:15:00,0,1275,0,0,1,1752,0,0,DEL,COK,2047.882109458646,0,0,0,0,0,0,0,0,0,0,5,27,22,2,1,1,3,3,0,1,2,0,Delhi_Cochin,4537,0,4,0,1,96.37092279805394,0.622594432614602,1,0
Vistara,1/06/2019,Delhi,Cochin,DEL → COK,06:00,09:10,3h 10m,non-stop,No info,6741,2019-06-01,06:00:00,09:10:00,0,190,1,1,0,479,0,0,DEL,COK,2047.882109458646,0,1,0,0,0,0,0,0,0,1,6,1,22,2,1,0,1,1,1,0,0,1,Delhi_Cochin,4537,0,29,1,0,646.6996135132566,0.09277877819354853,1,0
Jet Airways,24/05/2019,Kolkata,Banglore,CCU → BOM → BLR,20:00,22:35 25 May,26h 35m,1 stop,In-flight meal not included,10844,2019-05-24,20:00:00,22:35:00,0,1595,0,0,0,3849,0,0,CCU,BLR,1546.4372901474003,0,0,0,0,0,0,0,0,0,0,5,24,21,2,1,1,3,3,0,1,1,0,Kolkata_Banglore,2871,1,7,0,1,58.173189598021324,1.0314029609619482,1,0
Air India,27/05/2019,Delhi,Cochin,DEL → CCU → BOM → COK,14:25,19:15 28 May,28h 50m,2 stops,No info,13381,2019-05-27,14:25:00,19:15:00,0,1730,0,0,0,1752,0,0,DEL,COK,2047.882109458646,0,0,0,0,0,0,0,0,0,0,5,27,22,2,1,1,2,3,0,0,2,0,Delhi_Cochin,4537,0,4,0,1,71.02481304480852,0.844775190920205,1,0
IndiGo,6/04/2019,Banglore,Delhi,BLR → DEL,06:05,08:50,2h 45m,non-stop,No info,4423,2019-04-06,06:05:00,08:50:00,0,165,1,1,0,2053,0,0,BLR,DEL,1708.6520853536679,0,0,0,0,0,0,0,0,0,0,4,6,14,2,1,1,1,1,1,0,0,1,Banglore_Delhi,1265,1,24,1,0,621.3280310376974,0.09656734768555719,1,0
Jet Airways,27/05/2019,Mumbai,Hyderabad,BOM → HYD,19:35,21:05,1h 30m,non-stop,No info,5678,2019-05-27,19:35:00,21:05:00,0,90,0,1,0,3849,0,0,BOM,HYD,622.9702752863186,0,0,0,0,0,0,0,0,0,0,5,27,22,2,1,1,3,3,0,1,0,1,Mumbai_Hyderabad,697,1,4,0,1,415.3135168575457,0.14446917223881314,0,0
Jet Airways,21/05/2019,Delhi,Cochin,DEL → IDR → BOM → COK,09:35,12:35 22 May,27h,2 stops,In-flight meal not included,12719,2019-05-21,09:35:00,12:35:00,0,1620,0,0,0,3849,0,0,DEL,COK,2047.882109458646,0,0,0,0,0,0,0,0,0,0,5,21,21,2,1,1,1,2,1,0,2,0,Delhi_Cochin,4537,0,10,0,1,75.84748553550541,0.7910611614397296,1,0
IndiGo,1/06/2019,Delhi,Cochin,DEL → HYD → COK,07:35,12:10,4h 35m,1 stop,No info,5054,2019-06-01,07:35:00,12:10:00,0,275,1,1,0,2053,0,0,DEL,COK,2047.882109458646,0,1,0,0,0,0,0,0,0,1,6,1,22,2,1,0,1,2,1,0,1,0,Delhi_Cochin,4537,0,29,1,0,446.8106420637046,0.13428507370118867,1,0
Air India,24/05/2019,Delhi,Cochin,DEL → MAA → COK,09:45,09:25 25 May,23h 40m,1 stop,No info,7480,2019-05-24,09:45:00,09:25:00,0,1420,0,0,0,1752,0,0,DEL,COK,2047.882109458646,0,0,0,0,0,0,0,0,0,0,5,24,21,2,1,1,1,1,1,0,1,0,Delhi_Cochin,4537,0,7,0,1,86.53022997712588,0.6933992896570469,1,0
Air India,3/06/2019,Banglore,Delhi,BLR → DEL,17:00,19:45,2h 45m,non-stop,No info,6961,2019-06-03,17:00:00,19:45:00,0,165,0,1,0,1752,0,0,BLR,DEL,1708.6520853536679,0,1,0,0,0,0,0,0,0,1,6,3,23,2,1,0,2,3,0,0,0,1,Banglore_Delhi,1265,1,27,1,0,621.3280310376974,0.09656734768555719,1,0
SpiceJet,24/04/2019,Kolkata,Banglore,CCU → BLR,17:10,19:40,2h 30m,non-stop,No check-in baggage included,3841,2019-04-24,17:10:00,19:40:00,0,150,0,1,0,818,0,0,CCU,BLR,1546.4372901474003,0,0,0,0,0,0,0,0,0,0,4,24,17,2,1,1,2,3,0,0,0,1,Kolkata_Banglore,2871,1,6,0,1,618.5749160589601,0.09699714366413306,1,0
IndiGo,3/06/2019,Banglore,Delhi,BLR → DEL,21:15,00:15 04 Jun,3h,non-stop,No info,3943,2019-06-03,21:15:00,00:15:00,0,180,0,0,1,2053,0,0,BLR,DEL,1708.6520853536679,0,1,0,0,0,0,0,0,0,1,6,3,23,2,1,0,3,0,0,1,0,1,Banglore_Delhi,1265,1,27,1,0,569.5506951178893,0.10534619747515331,1,0
Jet Airways,3/05/2019,Banglore,Delhi,BLR → DEL,08:20,11:20,3h,non-stop,No info,7229,2019-05-03,08:20:00,11:20:00,0,180,0,1,0,3849,0,0,BLR,DEL,1708.6520853536679,0,0,0,0,0,0,0,0,0,0,5,3,18,2,1,1,1,1,1,0,0,1,Banglore_Delhi,1265,1,28,1,0,569.5506951178893,0.10534619747515331,1,0
SpiceJet,15/05/2019,Banglore,Delhi,BLR → DEL,09:30,12:20,2h 50m,non-stop,No check-in baggage included,4319,2019-05-15,09:30:00,12:20:00,0,170,0,1,0,818,0,0,BLR,DEL,1708.6520853536679,0,0,0,0,0,0,0,0,0,0,5,15,20,2,1,1,1,2,1,0,0,1,Banglore_Delhi,1265,1,16,0,0,603.0536771836476,0.0994936309487559,1,0
IndiGo,24/04/2019,Banglore,Delhi,BLR → DEL,13:00,15:50,2h 50m,non-stop,No info,4423,2019-04-24,13:00:00,15:50:00,0,170,0,1,0,2053,0,0,BLR,DEL,1708.6520853536679,0,0,0,0,0,0,0,0,0,0,4,24,17,2,1,1,2,2,0,0,0,1,Banglore_Delhi,1265,1,6,0,1,603.0536771836476,0.0994936309487559,1,0
Jet Airways,21/05/2019,Delhi,Cochin,DEL → BOM → COK,22:50,04:25 22 May,5h 35m,1 stop,No info,16079,2019-05-21,22:50:00,04:25:00,0,335,0,0,1,3849,0,0,DEL,COK,2047.882109458646,0,0,0,0,0,0,0,0,0,0,5,21,21,2,1,1,3,0,0,1,1,0,Delhi_Cochin,4537,0,10,0,1,366.78485542542916,0.16358363523599348,1,0
Jet Airways,21/06/2019,Banglore,Delhi,BLR → DEL,19:50,22:50,3h,non-stop,In-flight meal not included,7754,2019-06-21,19:50:00,22:50:00,0,180,0,1,0,3849,0,0,BLR,DEL,1708.6520853536679,0,0,0,0,0,0,0,0,0,0,6,21,25,2,1,0,3,3,0,1,0,1,Banglore_Delhi,1265,1,9,0,1,569.5506951178893,0.10534619747515331,1,0
Air India,1/06/2019,Delhi,Cochin,DEL → HYD → MAA → COK,13:15,09:25 02 Jun,20h 10m,2 stops,No info,10467,2019-06-01,13:15:00,09:25:00,0,1210,1,0,0,1752,0,0,DEL,COK,2047.882109458646,0,1,0,0,0,0,0,0,0,1,6,1,22,2,1,0,2,1,0,0,2,0,Delhi_Cochin,4537,0,29,1,0,101.54787319629649,0.5908543242852301,1,0
Jet Airways,3/06/2019,Delhi,Cochin,DEL → BOM → COK,17:30,12:35 04 Jun,19h 5m,1 stop,No info,14714,2019-06-03,17:30:00,12:35:00,0,1145,0,0,0,3849,0,0,DEL,COK,2047.882109458646,0,1,0,0,0,0,0,0,0,1,6,3,23,2,1,0,2,2,0,0,1,0,Delhi_Cochin,4537,0,27,1,0,107.31259962228712,0.5591142159558583,1,0
Air India,1/05/2019,Kolkata,Banglore,CCU → GAU → BLR,16:45,21:05 02 May,28h 20m,1 stop,No info,7452,2019-05-01,16:45:00,21:05:00,0,1700,0,0,0,1752,0,0,CCU,BLR,1546.4372901474003,0,0,0,0,0,0,0,0,0,0,5,1,18,2,1,1,2,3,0,0,1,0,Kolkata_Banglore,2871,1,30,1,0,54.58013965226119,1.0993009615268412,1,0
Air India,21/05/2019,Delhi,Cochin,DEL → UDR → BOM → COK,13:20,19:15 22 May,29h 55m,2 stops,No info,13276,2019-05-21,13:20:00,19:15:00,0,1795,0,0,0,1752,0,0,DEL,COK,2047.882109458646,0,0,0,0,0,0,0,0,0,0,5,21,21,2,1,1,2,3,0,0,2,0,Delhi_Cochin,4537,0,10,0,1,68.45288388162605,0.8765152992495769,1,0
Air India,01/03/2019,Banglore,New Delhi,BLR → BOM → NAG → DEL,08:50,10:35 02 Mar,25h 45m,2 stops,No info,31783,2019-03-01,08:50:00,10:35:00,0,1545,0,0,0,1752,0,0,BLR,DEL,1708.6520853536679,0,0,0,0,0,0,0,0,0,0,3,1,9,1,1,1,1,1,1,0,2,0,Banglore_New Delhi,932,0,30,1,0,66.35542079043371,0.9042215283283992,1,0
Air India,1/05/2019,Chennai,Kolkata,MAA → CCU,11:40,13:55,2h 15m,non-stop,No info,4667,2019-05-01,11:40:00,13:55:00,0,135,0,1,0,1752,0,0,MAA,CCU,1385.198425287915,0,0,0,0,0,0,0,0,0,0,5,1,18,2,1,1,1,2,1,0,0,1,Chennai_Kolkata,381,1,30,1,0,615.6437445724066,0.09745896150000323,1,0
Jet Airways,15/06/2019,Banglore,Delhi,BLR → DEL,15:15,18:10,2h 55m,non-stop,In-flight meal not included,7229,2019-06-15,15:15:00,18:10:00,0,175,1,1,0,3849,0,0,BLR,DEL,1708.6520853536679,0,0,0,0,0,0,0,0,0,0,6,15,24,2,1,0,2,3,0,0,0,1,Banglore_Delhi,1265,1,15,0,0,585.8235721212576,0.10241991421195461,1,0
Jet Airways,15/06/2019,Delhi,Cochin,DEL → BDQ → BOM → COK,18:25,12:35 16 Jun,18h 10m,2 stops,No info,14237,2019-06-15,18:25:00,12:35:00,0,1090,1,0,0,3849,0,0,DEL,COK,2047.882109458646,0,0,0,0,0,0,0,0,0,0,6,15,24,2,1,0,3,2,0,1,2,0,Delhi_Cochin,4537,0,15,0,0,112.72745556653098,0.5322572012156206,1,0
Multiple carriers,15/05/2019,Delhi,Cochin,DEL → BOM → COK,10:20,19:15,8h 55m,1 stop,No info,8266,2019-05-15,10:20:00,19:15:00,0,535,0,1,0,1196,0,0,DEL,COK,2047.882109458646,0,0,0,0,0,0,0,0,0,0,5,15,20,2,1,1,1,3,1,0,1,0,Delhi_Cochin,4537,0,16,0,0,229.66902162153042,0.26124550701867616,1,0
Jet Airways,24/06/2019,Delhi,Cochin,DEL → LKO → BOM → COK,09:25,04:25 25 Jun,19h,2 stops,No info,13882,2019-06-24,09:25:00,04:25:00,0,1140,0,0,1,3849,0,0,DEL,COK,2047.882109458646,0,0,0,0,0,0,0,0,0,0,6,24,26,2,1,0,1,0,1,0,2,0,Delhi_Cochin,4537,0,6,0,1,107.7832689188761,0.5566726691612912,1,0
IndiGo,6/05/2019,Banglore,Delhi,BLR → DEL,20:00,22:50,2h 50m,non-stop,No info,4823,2019-05-06,20:00:00,22:50:00,0,170,0,1,0,2053,0,0,BLR,DEL,1708.6520853536679,0,0,0,0,0,0,0,0,0,0,5,6,19,2,1,1,3,3,0,1,0,1,Banglore_Delhi,1265,1,25,1,0,603.0536771836476,0.0994936309487559,1,0
Air Asia,24/05/2019,Banglore,Delhi,BLR → DEL,23:55,02:45 25 May,2h 50m,non-stop,No info,4483,2019-05-24,23:55:00,02:45:00,0,170,0,0,1,319,0,0,BLR,DEL,1708.6520853536679,0,0,0,0,0,0,0,0,0,0,5,24,21,2,1,1,3,0,0,1,0,1,Banglore_Delhi,1265,1,7,0,1,603.0536771836476,0.0994936309487559,1,0
Air India,12/06/2019,Banglore,Delhi,BLR → DEL,06:10,08:55,2h 45m,non-stop,No info,6961,2019-06-12,06:10:00,08:55:00,0,165,0,1,0,1752,0,0,BLR,DEL,1708.6520853536679,0,0,0,0,0,0,0,0,0,0,6,12,24,2,1,0,1,1,1,0,0,1,Banglore_Delhi,1265,1,18,0,0,621.3280310376974,0.09656734768555719,1,0
Jet Airways,12/05/2019,Kolkata,Banglore,CCU → BOM → BLR,18:55,10:05 13 May,15h 10m,1 stop,In-flight meal not included,9663,2019-05-12,18:55:00,10:05:00,0,910,1,0,0,3849,0,0,CCU,BLR,1546.4372901474003,0,0,0,0,0,0,0,0,0,0,5,12,19,2,1,1,3,1,0,1,1,0,Kolkata_Banglore,2871,1,19,0,0,101.96289825147694,0.5884493382290739,1,0
Jet Airways,18/05/2019,Delhi,Cochin,DEL → AMD → BOM → COK,23:05,04:25 20 May,29h 20m,2 stops,No info,16704,2019-05-18,23:05:00,04:25:00,0,1760,1,0,1,3849,0,0,DEL,COK,2047.882109458646,0,0,0,0,0,0,0,0,0,0,5,18,20,2,1,1,3,0,0,1,2,0,Delhi_Cochin,4537,0,13,0,0,69.81416282245384,0.8594244716876075,1,0
IndiGo,12/05/2019,Mumbai,Hyderabad,BOM → HYD,09:10,10:40,1h 30m,non-stop,No info,4049,2019-05-12,09:10:00,10:40:00,0,90,1,1,0,2053,0,0,BOM,HYD,622.9702752863186,0,0,0,0,0,0,0,0,0,0,5,12,19,2,1,1,1,1,1,0,0,1,Mumbai_Hyderabad,697,1,19,0,0,415.3135168575457,0.14446917223881314,0,0
SpiceJet,24/03/2019,Chennai,Kolkata,MAA → CCU,08:20,10:35,2h 15m,non-stop,No check-in baggage included,3807,2019-03-24,08:20:00,10:35:00,0,135,1,1,0,818,0,0,MAA,CCU,1385.198425287915,0,0,0,0,1,0,0,0,0,1,3,24,12,1,1,1,1,1,1,0,0,1,Chennai_Kolkata,381,1,7,0,1,615.6437445724066,0.09745896150000323,1,0
IndiGo,9/06/2019,Delhi,Cochin,DEL → HYD → COK,06:50,22:30,15h 40m,1 stop,No info,6442,2019-06-09,06:50:00,22:30:00,0,940,1,1,0,2053,0,0,DEL,COK,2047.882109458646,0,1,0,0,0,0,0,0,0,1,6,9,23,2,1,0,1,3,1,0,1,0,Delhi_Cochin,4537,0,21,1,0,130.7158793271476,0.45901079737860856,1,0
Jet Airways,15/03/2019,Banglore,New Delhi,BLR → BOM → DEL,07:00,07:40 16 Mar,24h 40m,1 stop,In-flight meal not included,7832,2019-03-15,07:00:00,07:40:00,0,1480,0,0,0,3849,0,0,BLR,DEL,1708.6520853536679,0,0,0,0,1,0,0,0,0,1,3,15,11,1,1,1,1,1,1,0,1,0,Banglore_New Delhi,932,0,16,0,0,69.2696791359595,0.8661798459068161,1,0
IndiGo,24/06/2019,Delhi,Cochin,DEL → HYD → COK,08:35,22:30,13h 55m,1 stop,No info,6442,2019-06-24,08:35:00,22:30:00,0,835,0,1,0,2053,0,0,DEL,COK,2047.882109458646,0,0,0,0,0,0,0,0,0,0,6,24,26,2,1,0,1,3,1,0,1,0,Delhi_Cochin,4537,0,6,0,1,147.15320547008236,0.4077383146927001,1,0
IndiGo,21/04/2019,Banglore,Delhi,BLR → DEL,20:00,22:50,2h 50m,non-stop,No info,4823,2019-04-21,20:00:00,22:50:00,0,170,1,1,0,2053,0,0,BLR,DEL,1708.6520853536679,0,0,0,0,0,0,0,0,0,0,4,21,16,2,1,1,3,3,0,1,0,1,Banglore_Delhi,1265,1,9,0,1,603.0536771836476,0.0994936309487559,1,0
Jet Airways,06/03/2019,Banglore,New Delhi,BLR → BOM → DEL,05:45,05:05 07 Mar,23h 20m,1 stop,No info,13555,2019-03-06,05:45:00,05:05:00,0,1400,0,0,1,3849,0,0,BLR,DEL,1708.6520853536679,0,0,0,0,0,0,0,0,0,0,3,6,10,1,1,1,0,0,0,0,1,0,Banglore_New Delhi,932,0,25,1,0,73.2279465151572,0.8193593136956369,1,0
GoAir,6/04/2019,Delhi,Cochin,DEL → BOM → COK,10:35,19:35,9h,1 stop,No info,5135,2019-04-06,10:35:00,19:35:00,0,540,1,1,0,194,0,0,DEL,COK,2047.882109458646,0,0,0,0,0,0,0,0,0,0,4,6,14,2,1,1,1,3,1,0,1,0,Delhi_Cochin,4537,0,24,1,0,227.54245660651623,0.2636870538132432,1,0
Air Asia,15/05/2019,Banglore,Delhi,BLR → DEL,23:55,02:45 16 May,2h 50m,non-stop,No info,3383,2019-05-15,23:55:00,02:45:00,0,170,0,0,1,319,0,0,BLR,DEL,1708.6520853536679,0,0,0,0,0,0,0,0,0,0,5,15,20,2,1,1,3,0,0,1,0,1,Banglore_Delhi,1265,1,16,0,0,603.0536771836476,0.0994936309487559,1,0
GoAir,15/06/2019,Delhi,Cochin,DEL → AMD → COK,07:25,13:35,6h 10m,1 stop,No info,5842,2019-06-15,07:25:00,13:35:00,0,370,1,1,0,194,0,0,DEL,COK,2047.882109458646,0,0,0,0,0,0,0,0,0,0,6,15,24,2,1,0,1,2,1,0,1,0,Delhi_Cochin,4537,0,15,0,0,332.08899072302364,0.18067446279796293,1,0
Jet Airways,18/05/2019,Delhi,Cochin,DEL → AMD → BOM → COK,13:25,04:25 19 May,15h,2 stops,No info,16704,2019-05-18,13:25:00,04:25:00,0,900,1,0,1,3849,0,0,DEL,COK,2047.882109458646,0,0,0,0,0,0,0,0,0,0,5,18,20,2,1,1,2,0,0,0,2,0,Delhi_Cochin,4537,0,13,0,0,136.52547396390975,0.439478423022072,1,0
Air India,1/05/2019,Kolkata,Banglore,CCU → BOM → BLR,16:50,07:55 02 May,15h 5m,1 stop,No info,8366,2019-05-01,16:50:00,07:55:00,0,905,0,0,0,1752,0,0,CCU,BLR,1546.4372901474003,0,0,0,0,0,0,0,0,0,0,5,1,18,2,1,1,2,1,0,0,1,0,Kolkata_Banglore,2871,1,30,1,0,102.5262291810431,0.5852161001069361,1,0
SpiceJet,9/05/2019,Mumbai,Hyderabad,BOM → HYD,05:45,07:15,1h 30m,non-stop,No check-in baggage included,1965,2019-05-09,05:45:00,07:15:00,0,90,0,1,0,818,0,0,BOM,HYD,622.9702752863186,0,0,0,0,0,0,0,0,0,0,5,9,19,2,1,1,0,1,0,0,0,1,Mumbai_Hyderabad,697,1,22,1,0,415.3135168575457,0.14446917223881314,0,0
SpiceJet,6/06/2019,Kolkata,Banglore,CCU → BLR,17:10,19:40,2h 30m,non-stop,No info,3873,2019-06-06,17:10:00,19:40:00,0,150,0,1,0,818,0,0,CCU,BLR,1546.4372901474003,0,1,0,0,0,0,0,0,0,1,6,6,23,2,1,0,2,3,0,0,0,1,Kolkata_Banglore,2871,1,24,1,0,618.5749160589601,0.09699714366413306,1,0
Jet Airways,01/03/2019,Banglore,New Delhi,BLR → BOM → DEL,08:00,20:20,12h 20m,1 stop,No info,27992,2019-03-01,08:00:00,20:20:00,0,740,0,1,0,3849,0,0,BLR,DEL,1708.6520853536679,0,0,0,0,0,0,0,0,0,0,3,1,9,1,1,1,1,3,1,0,1,0,Banglore_New Delhi,932,0,30,1,0,138.539358271919,0.43308992295340804,1,0
Multiple carriers,6/06/2019,Delhi,Cochin,DEL → BOM → COK,04:55,12:35,7h 40m,1 stop,No info,10678,2019-06-06,04:55:00,12:35:00,0,460,0,1,0,1196,0,0,DEL,COK,2047.882109458646,0,1,0,0,0,0,0,0,0,1,6,6,23,2,1,0,0,2,0,0,1,0,Delhi_Cochin,4537,0,24,1,0,267.1150577554756,0.22462230510017014,1,0
Air India,21/03/2019,Banglore,New Delhi,BLR → BOM → DEL,08:50,23:15,14h 25m,1 stop,No info,6824,2019-03-21,08:50:00,23:15:00,0,865,0,1,0,1752,0,0,BLR,DEL,1708.6520853536679,0,0,0,0,1,0,0,0,0,1,3,21,12,1,1,1,1,3,1,0,1,0,Banglore_New Delhi,932,0,10,0,1,118.51921979331802,0.5062470045333756,1,0
Air India,12/06/2019,Delhi,Cochin,DEL → AMD → BOM → COK,05:00,19:15 13 Jun,38h 15m,2 stops,No info,9443,2019-06-12,05:00:00,19:15:00,0,2295,0,0,0,1752,0,0,DEL,COK,2047.882109458646,0,0,0,0,0,0,0,0,0,0,6,12,24,2,1,0,0,3,0,0,2,0,Delhi_Cochin,4537,0,18,0,0,53.5394015544744,1.1206699787062837,1,0
Multiple carriers,21/03/2019,Delhi,Cochin,DEL → BOM → COK,07:05,19:15,12h 10m,1 stop,No info,13378,2019-03-21,07:05:00,19:15:00,0,730,0,1,0,1196,0,0,DEL,COK,2047.882109458646,0,0,0,0,1,0,0,0,0,1,3,21,12,1,1,1,1,3,1,0,1,0,Delhi_Cochin,4537,0,10,0,1,168.31907748975175,0.3564658320067917,1,0
IndiGo,1/05/2019,Banglore,Delhi,BLR → DEL,04:00,06:50,2h 50m,non-stop,No info,3943,2019-05-01,04:00:00,06:50:00,0,170,0,1,1,2053,0,0,BLR,DEL,1708.6520853536679,0,0,0,0,0,0,0,0,0,0,5,1,18,2,1,1,0,1,0,0,0,1,Banglore_Delhi,1265,1,30,1,0,603.0536771836476,0.0994936309487559,1,0
IndiGo,18/05/2019,Delhi,Cochin,DEL → BOM → COK,11:25,21:00,9h 35m,1 stop,No info,7191,2019-05-18,11:25:00,21:00:00,0,575,1,1,0,2053,0,0,DEL,COK,2047.882109458646,0,0,0,0,0,0,0,0,0,0,5,18,20,2,1,1,1,3,1,0,1,0,Delhi_Cochin,4537,0,13,0,0,213.69204620438046,0.28077788137521265,1,0
SpiceJet,27/06/2019,Banglore,Delhi,BLR → DEL,05:55,08:35,2h 40m,non-stop,No info,3625,2019-06-27,05:55:00,08:35:00,0,160,0,1,0,818,0,0,BLR,DEL,1708.6520853536679,0,0,0,0,0,0,0,0,0,0,6,27,26,2,1,0,0,1,0,0,0,1,Banglore_Delhi,1265,1,3,0,1,640.7445320076254,0.09364106442235849,1,0
GoAir,27/05/2019,Delhi,Cochin,DEL → AMD → COK,07:25,13:35,6h 10m,1 stop,No info,6841,2019-05-27,07:25:00,13:35:00,0,370,0,1,0,194,0,0,DEL,COK,2047.882109458646,0,0,0,0,0,0,0,0,0,0,5,27,22,2,1,1,1,2,1,0,1,0,Delhi_Cochin,4537,0,4,0,1,332.08899072302364,0.18067446279796293,1,0
Jet Airways,24/03/2019,Kolkata,Banglore,CCU → BOM → BLR,16:55,23:25,6h 30m,1 stop,In-flight meal not included,11134,2019-03-24,16:55:00,23:25:00,0,390,1,1,0,3849,0,0,CCU,BLR,1546.4372901474003,0,0,0,0,1,0,0,0,0,1,3,24,12,1,1,1,2,3,0,0,1,0,Kolkata_Banglore,2871,1,7,0,1,237.9134292534462,0.25219257352674596,1,0
Jet Airways,6/06/2019,Kolkata,Banglore,CCU → BOM → BLR,18:55,20:45 07 Jun,25h 50m,1 stop,No info,14571,2019-06-06,18:55:00,20:45:00,0,1550,0,0,0,3849,0,0,CCU,BLR,1546.4372901474003,0,1,0,0,0,0,0,0,0,1,6,6,23,2,1,0,3,3,0,1,1,0,Kolkata_Banglore,2871,1,24,1,0,59.86208865086711,1.0023038178627082,1,0
Air India,01/03/2019,Banglore,New Delhi,BLR → CCU → BBI → HYD → DEL,05:50,12:15 02 Mar,30h 25m,3 stops,No info,12346,2019-03-01,05:50:00,12:15:00,0,1825,0,0,0,1752,0,0,BLR,DEL,1708.6520853536679,0,0,0,0,0,0,0,0,0,0,3,1,9,1,1,1,0,2,0,0,3,0,Banglore_New Delhi,932,0,30,1,0,56.17486308012059,1.0680933910675265,1,0
Jet Airways,21/04/2019,Banglore,Delhi,BLR → DEL,17:45,20:45,3h,non-stop,In-flight meal not included,4544,2019-04-21,17:45:00,20:45:00,0,180,1,1,0,3849,0,0,BLR,DEL,1708.6520853536679,0,0,0,0,0,0,0,0,0,0,4,21,16,2,1,1,2,3,0,0,0,1,Banglore_Delhi,1265,1,9,0,1,569.5506951178893,0.10534619747515331,1,0
Jet Airways,9/06/2019,Delhi,Cochin,DEL → NAG → BOM → COK,14:35,04:25 10 Jun,13h 50m,2 stops,No info,13376,2019-06-09,14:35:00,04:25:00,0,830,1,0,1,3849,0,0,DEL,COK,2047.882109458646,0,1,0,0,0,0,0,0,0,1,6,9,23,2,1,0,2,0,0,0,2,0,Delhi_Cochin,4537,0,21,1,0,148.03967056327562,0.40529676789813307,1,0
Jet Airways,12/03/2019,Banglore,New Delhi,BLR → BOM → DEL,18:55,12:25 13 Mar,17h 30m,1 stop,In-flight meal not included,11087,2019-03-12,18:55:00,12:25:00,0,1050,0,0,0,3849,0,0,BLR,DEL,1708.6520853536679,0,0,0,0,0,0,0,0,0,0,3,12,11,1,1,1,3,2,0,1,1,0,Banglore_New Delhi,932,0,19,0,0,97.63726202020959,0.6145194852717276,1,0
SpiceJet,3/03/2019,Kolkata,Banglore,CCU → BLR,09:00,11:30,2h 30m,non-stop,No info,5515,2019-03-03,09:00:00,11:30:00,0,150,1,1,0,818,0,0,CCU,BLR,1546.4372901474003,0,0,0,0,0,0,0,0,0,0,3,3,9,1,1,1,1,1,1,0,0,1,Kolkata_Banglore,2871,1,28,1,0,618.5749160589601,0.09699714366413306,1,0
IndiGo,27/06/2019,Kolkata,Banglore,CCU → BLR,04:40,07:15,2h 35m,non-stop,No info,4804,2019-06-27,04:40:00,07:15:00,0,155,0,1,0,2053,0,0,CCU,BLR,1546.4372901474003,0,0,0,0,0,0,0,0,0,0,6,27,26,2,1,0,0,1,0,0,0,1,Kolkata_Banglore,2871,1,3,0,1,598.6208865086711,0.10023038178627082,1,0
IndiGo,12/06/2019,Chennai,Kolkata,MAA → CCU,13:15,15:35,2h 20m,non-stop,No info,3597,2019-06-12,13:15:00,15:35:00,0,140,0,1,0,2053,0,0,MAA,CCU,1385.198425287915,0,0,0,0,0,0,0,0,0,0,6,12,24,2,1,0,2,2,0,0,0,1,Chennai_Kolkata,381,1,18,0,0,593.656467980535,0.10106855266667002,1,0
Multiple carriers,6/03/2019,Delhi,Cochin,DEL → BOM → COK,06:00,19:15,13h 15m,1 stop,No info,15353,2019-03-06,06:00:00,19:15:00,0,795,0,1,0,1196,0,0,DEL,COK,2047.882109458646,0,0,0,0,0,0,0,0,0,0,3,6,10,1,1,1,1,3,1,0,1,0,Delhi_Cochin,4537,0,25,1,0,154.5571403365016,0.3882059403361636,1,0
Jet Airways,12/06/2019,Kolkata,Banglore,CCU → BOM → BLR,06:30,16:20,9h 50m,1 stop,In-flight meal not included,9899,2019-06-12,06:30:00,16:20:00,0,590,0,1,0,3849,0,0,CCU,BLR,1546.4372901474003,0,0,0,0,0,0,0,0,0,0,6,12,24,2,1,0,1,2,1,0,1,0,Kolkata_Banglore,2871,1,18,0,0,157.26480916753223,0.3815220984122567,1,0
IndiGo,24/03/2019,Banglore,New Delhi,BLR → DEL,18:25,21:20,2h 55m,non-stop,No info,7303,2019-03-24,18:25:00,21:20:00,0,175,1,1,0,2053,0,0,BLR,DEL,1708.6520853536679,0,0,0,0,1,0,0,0,0,1,3,24,12,1,1,1,3,3,0,1,0,1,Banglore_New Delhi,932,0,7,0,1,585.8235721212576,0.10241991421195461,1,0
Jet Airways,12/03/2019,Banglore,New Delhi,BLR → BOM → DEL,08:55,21:20,12h 25m,1 stop,No info,13817,2019-03-12,08:55:00,21:20:00,0,745,0,1,0,3849,0,0,BLR,DEL,1708.6520853536679,0,0,0,0,0,0,0,0,0,0,3,12,11,1,1,1,1,3,1,0,1,0,Banglore_New Delhi,932,0,19,0,0,137.60956392110077,0.43601620621660675,1,0
Jet Airways,6/03/2019,Delhi,Cochin,DEL → AMD → BOM → COK,19:10,19:45 07 Mar,24h 35m,2 stops,No info,19329,2019-03-06,19:10:00,19:45:00,0,1475,0,0,0,3849,0,0,DEL,COK,2047.882109458646,0,0,0,0,0,0,0,0,0,0,3,6,10,1,1,1,3,3,0,1,2,0,Delhi_Cochin,4537,0,25,1,0,83.30367902882628,0.7202563043972847,1,0
Jet Airways,12/06/2019,Delhi,Cochin,DEL → BOM → COK,07:05,12:35,5h 30m,1 stop,No info,16289,2019-06-12,07:05:00,12:35:00,0,330,0,1,0,3849,0,0,DEL,COK,2047.882109458646,0,0,0,0,0,0,0,0,0,0,6,12,24,2,1,0,1,2,1,0,1,0,Delhi_Cochin,4537,0,18,0,0,372.3422017197538,0.1611420884414264,1,0
Jet Airways,15/05/2019,Kolkata,Banglore,CCU → BOM → BLR,18:55,10:05 16 May,15h 10m,1 stop,In-flight meal not included,9663,2019-05-15,18:55:00,10:05:00,0,910,0,0,0,3849,0,0,CCU,BLR,1546.4372901474003,0,0,0,0,0,0,0,0,0,0,5,15,20,2,1,1,3,1,0,1,1,0,Kolkata_Banglore,2871,1,16,0,0,101.96289825147694,0.5884493382290739,1,0
Air India,3/06/2019,Delhi,Cochin,DEL → HYD → MAA → COK,09:45,09:25 04 Jun,23h 40m,2 stops,No info,10975,2019-06-03,09:45:00,09:25:00,0,1420,0,0,0,1752,0,0,DEL,COK,2047.882109458646,0,1,0,0,0,0,0,0,0,1,6,3,23,2,1,0,1,1,1,0,2,0,Delhi_Cochin,4537,0,27,1,0,86.53022997712588,0.6933992896570469,1,0
Air Asia,18/03/2019,Kolkata,Banglore,CCU → BLR,10:20,12:55,2h 35m,non-stop,No info,4384,2019-03-18,10:20:00,12:55:00,0,155,0,1,0,319,0,0,CCU,BLR,1546.4372901474003,0,0,0,0,1,0,0,0,0,1,3,18,12,1,1,1,1,2,1,0,0,1,Kolkata_Banglore,2871,1,13,0,0,598.6208865086711,0.10023038178627082,1,0
Jet Airways,12/06/2019,Delhi,Cochin,DEL → BOM → COK,09:00,19:00,10h,1 stop,No info,14714,2019-06-12,09:00:00,19:00:00,0,600,0,1,0,3849,0,0,DEL,COK,2047.882109458646,0,0,0,0,0,0,0,0,0,0,6,12,24,2,1,0,1,3,1,0,1,0,Delhi_Cochin,4537,0,18,0,0,204.7882109458646,0.292985615348048,1,0
Jet Airways,12/06/2019,Delhi,Cochin,DEL → NAG → BOM → COK,14:35,04:25 13 Jun,13h 50m,2 stops,In-flight meal not included,10919,2019-06-12,14:35:00,04:25:00,0,830,0,0,1,3849,0,0,DEL,COK,2047.882109458646,0,0,0,0,0,0,0,0,0,0,6,12,24,2,1,0,2,0,0,0,2,0,Delhi_Cochin,4537,0,18,0,0,148.03967056327562,0.40529676789813307,1,0
Jet Airways,21/05/2019,Kolkata,Banglore,CCU → BOM → BLR,14:05,04:40 22 May,14h 35m,1 stop,No info,14388,2019-05-21,14:05:00,04:40:00,0,875,0,0,1,3849,0,0,CCU,BLR,1546.4372901474003,0,0,0,0,0,0,0,0,0,0,5,21,21,2,1,1,2,0,0,0,1,0,Kolkata_Banglore,2871,1,10,0,1,106.04141418153601,0.5658166713741095,1,0
Multiple carriers,15/06/2019,Delhi,Cochin,DEL → BOM → COK,11:25,19:00,7h 35m,1 stop,No info,10877,2019-06-15,11:25:00,19:00:00,0,455,1,1,0,1196,0,0,DEL,COK,2047.882109458646,0,0,0,0,0,0,0,0,0,0,6,15,24,2,1,0,1,3,1,0,1,0,Delhi_Cochin,4537,0,15,0,0,270.05038806048077,0.22218075830560308,1,0
Jet Airways,9/05/2019,Delhi,Cochin,DEL → AMD → BOM → COK,23:05,12:35 10 May,13h 30m,2 stops,No info,15129,2019-05-09,23:05:00,12:35:00,0,810,0,0,1,3849,0,0,DEL,COK,2047.882109458646,0,0,0,0,0,0,0,0,0,0,5,9,19,2,1,1,3,2,0,1,2,0,Delhi_Cochin,4537,0,22,1,0,151.69497107101083,0.3955305807198648,1,0
IndiGo,6/05/2019,Delhi,Cochin,DEL → BOM → COK,07:30,21:00,13h 30m,1 stop,No info,7191,2019-05-06,07:30:00,21:00:00,0,810,0,1,0,2053,0,0,DEL,COK,2047.882109458646,0,0,0,0,0,0,0,0,0,0,5,6,19,2,1,1,1,3,1,0,1,0,Delhi_Cochin,4537,0,25,1,0,151.69497107101083,0.3955305807198648,1,0
GoAir,1/05/2019,Kolkata,Banglore,CCU → BOM → BLR,23:30,07:45 02 May,8h 15m,1 stop,No info,6686,2019-05-01,23:30:00,07:45:00,0,495,0,0,1,194,0,0,CCU,BLR,1546.4372901474003,0,0,0,0,0,0,0,0,0,0,5,1,18,2,1,1,3,1,0,1,1,0,Kolkata_Banglore,2871,1,30,1,0,187.44694426029093,0.3200905740916391,1,0
Multiple carriers,3/06/2019,Delhi,Cochin,DEL → BOM → COK,12:50,01:30 04 Jun,12h 40m,1 stop,No info,7530,2019-06-03,12:50:00,01:30:00,0,760,0,0,1,1196,0,0,DEL,COK,2047.882109458646,0,1,0,0,0,0,0,0,0,1,6,3,23,2,1,0,2,0,0,0,1,0,Delhi_Cochin,4537,0,27,1,0,161.67490337831416,0.3711151127741941,1,0
IndiGo,15/06/2019,Delhi,Cochin,DEL → HYD → COK,07:35,22:30,14h 55m,1 stop,No info,6442,2019-06-15,07:35:00,22:30:00,0,895,1,1,0,2053,0,0,DEL,COK,2047.882109458646,0,0,0,0,0,0,0,0,0,0,6,15,24,2,1,0,1,3,1,0,1,0,Delhi_Cochin,4537,0,15,0,0,137.2881861089595,0.4370368762275049,1,0
Jet Airways,27/06/2019,Delhi,Cochin,DEL → BOM → COK,09:00,12:35 28 Jun,27h 35m,1 stop,In-flight meal not included,10262,2019-06-27,09:00:00,12:35:00,0,1655,0,0,0,3849,0,0,DEL,COK,2047.882109458646,0,0,0,0,0,0,0,0,0,0,6,27,26,2,1,0,1,2,1,0,1,0,Delhi_Cochin,4537,0,3,0,1,74.24346016164276,0.808151989001699,1,0
Jet Airways,12/03/2019,Banglore,New Delhi,BLR → BOM → DEL,18:55,09:30 13 Mar,14h 35m,1 stop,No info,13817,2019-03-12,18:55:00,09:30:00,0,875,0,0,0,3849,0,0,BLR,DEL,1708.6520853536679,0,0,0,0,0,0,0,0,0,0,3,12,11,1,1,1,3,1,0,1,1,0,Banglore_New Delhi,932,0,19,0,0,117.16471442425151,0.512099571059773,1,0
Jet Airways,12/06/2019,Kolkata,Banglore,CCU → BOM → BLR,14:05,23:35,9h 30m,1 stop,No info,13626,2019-06-12,14:05:00,23:35:00,0,570,0,1,0,3849,0,0,CCU,BLR,1546.4372901474003,0,0,0,0,0,0,0,0,0,0,6,12,24,2,1,0,2,3,0,0,1,0,Kolkata_Banglore,2871,1,18,0,0,162.78287264709476,0.3685891459237056,1,0
Jet Airways,12/05/2019,Kolkata,Banglore,CCU → BOM → BLR,18:55,10:05 13 May,15h 10m,1 stop,No info,14388,2019-05-12,18:55:00,10:05:00,0,910,1,0,0,3849,0,0,CCU,BLR,1546.4372901474003,0,0,0,0,0,0,0,0,0,0,5,12,19,2,1,1,3,1,0,1,1,0,Kolkata_Banglore,2871,1,19,0,0,101.96289825147694,0.5884493382290739,1,0
IndiGo,27/04/2019,Kolkata,Banglore,CCU → BLR,04:40,07:15,2h 35m,non-stop,No info,4804,2019-04-27,04:40:00,07:15:00,0,155,1,1,0,2053,0,0,CCU,BLR,1546.4372901474003,0,0,0,0,0,0,0,0,0,0,4,27,17,2,1,1,0,1,0,0,0,1,Kolkata_Banglore,2871,1,3,0,1,598.6208865086711,0.10023038178627082,1,0
IndiGo,21/03/2019,Delhi,Cochin,DEL → COK,14:30,17:35,3h 5m,non-stop,No info,5406,2019-03-21,14:30:00,17:35:00,0,185,0,1,0,2053,0,0,DEL,COK,2047.882109458646,0,0,0,0,1,0,0,0,0,1,3,21,12,1,1,1,2,2,0,0,0,1,Delhi_Cochin,4537,0,10,0,1,664.1779814460473,0.09033723139898146,1,0
SpiceJet,3/04/2019,Delhi,Cochin,DEL → BLR → COK,17:55,22:50,4h 55m,1 stop,No info,4611,2019-04-03,17:55:00,22:50:00,0,295,0,1,0,818,0,0,DEL,COK,2047.882109458646,0,0,0,0,0,0,0,0,0,0,4,3,14,2,1,1,2,3,0,0,1,0,Delhi_Cochin,4537,0,27,1,0,416.5183951441314,0.14405126087945694,1,0
IndiGo,9/06/2019,Kolkata,Banglore,CCU → MAA → BLR,08:10,13:00,4h 50m,1 stop,No info,5069,2019-06-09,08:10:00,13:00:00,0,290,1,1,0,2053,0,0,CCU,BLR,1546.4372901474003,0,1,0,0,0,0,0,0,0,1,6,9,23,2,1,0,1,2,1,0,1,0,Kolkata_Banglore,2871,1,21,1,0,319.95254278911733,0.18752781108399058,1,0
GoAir,6/06/2019,Banglore,Delhi,BLR → DEL,07:45,10:40,2h 55m,non-stop,No info,3898,2019-06-06,07:45:00,10:40:00,0,175,0,1,0,194,0,0,BLR,DEL,1708.6520853536679,0,1,0,0,0,0,0,0,0,1,6,6,23,2,1,0,1,1,1,0,0,1,Banglore_Delhi,1265,1,24,1,0,585.8235721212576,0.10241991421195461,1,0
IndiGo,6/06/2019,Mumbai,Hyderabad,BOM → HYD,12:00,13:30,1h 30m,non-stop,No info,2754,2019-06-06,12:00:00,13:30:00,0,90,0,1,0,2053,0,0,BOM,HYD,622.9702752863186,0,1,0,0,0,0,0,0,0,1,6,6,23,2,1,0,2,2,0,0,0,1,Mumbai_Hyderabad,697,1,24,1,0,415.3135168575457,0.14446917223881314,0,0
Multiple carriers,27/05/2019,Delhi,Cochin,DEL → BOM → COK,15:00,01:30 28 May,10h 30m,1 stop,In-flight meal not included,6943,2019-05-27,15:00:00,01:30:00,0,630,0,0,1,1196,0,0,DEL,COK,2047.882109458646,0,0,0,0,0,0,0,0,0,0,5,27,22,2,1,1,2,0,0,0,1,0,Delhi_Cochin,4537,0,4,0,1,195.0363913770139,0.3076348961154504,1,0
Jet Airways,18/05/2019,Kolkata,Banglore,CCU → BOM → BLR,05:45,18:15,12h 30m,1 stop,No info,14781,2019-05-18,05:45:00,18:15:00,0,750,1,1,0,3849,0,0,CCU,BLR,1546.4372901474003,0,0,0,0,0,0,0,0,0,0,5,18,20,2,1,1,0,3,0,0,1,0,Kolkata_Banglore,2871,1,13,0,0,123.71498321179202,0.4849857183206653,1,0
Jet Airways,21/05/2019,Delhi,Cochin,DEL → BOM → COK,13:00,19:00,6h,1 stop,No info,16079,2019-05-21,13:00:00,19:00:00,0,360,0,1,0,3849,0,0,DEL,COK,2047.882109458646,0,0,0,0,0,0,0,0,0,0,5,21,21,2,1,1,2,3,0,0,1,0,Delhi_Cochin,4537,0,10,0,1,341.31368490977434,0.1757913692088288,1,0
IndiGo,15/03/2019,Banglore,New Delhi,BLR → DEL,16:55,19:45,2h 50m,non-stop,No info,8033,2019-03-15,16:55:00,19:45:00,0,170,0,1,0,2053,0,0,BLR,DEL,1708.6520853536679,0,0,0,0,1,0,0,0,0,1,3,15,11,1,1,1,2,3,0,0,0,1,Banglore_New Delhi,932,0,16,0,0,603.0536771836476,0.0994936309487559,1,0
IndiGo,09/03/2019,Banglore,New Delhi,BLR → DEL,18:25,21:20,2h 55m,non-stop,No info,6860,2019-03-09,18:25:00,21:20:00,0,175,1,1,0,2053,0,0,BLR,DEL,1708.6520853536679,0,0,0,0,0,0,0,0,0,0,3,9,10,1,1,1,3,3,0,1,0,1,Banglore_New Delhi,932,0,22,1,0,585.8235721212576,0.10241991421195461,1,0
Multiple carriers,27/03/2019,Delhi,Cochin,DEL → BOM → COK,11:40,19:15,7h 35m,1 stop,No info,6953,2019-03-27,11:40:00,19:15:00,0,455,0,1,0,1196,0,0,DEL,COK,2047.882109458646,0,0,0,0,0,0,0,0,0,0,3,27,13,1,1,1,1,3,1,0,1,0,Delhi_Cochin,4537,0,4,0,1,270.05038806048077,0.22218075830560308,1,0
IndiGo,12/05/2019,Banglore,Delhi,BLR → DEL,07:10,10:05,2h 55m,non-stop,No info,4823,2019-05-12,07:10:00,10:05:00,0,175,1,1,0,2053,0,0,BLR,DEL,1708.6520853536679,0,0,0,0,0,0,0,0,0,0,5,12,19,2,1,1,1,1,1,0,0,1,Banglore_Delhi,1265,1,19,0,0,585.8235721212576,0.10241991421195461,1,0
IndiGo,9/04/2019,Kolkata,Banglore,CCU → BLR,04:40,07:15,2h 35m,non-stop,No info,4174,2019-04-09,04:40:00,07:15:00,0,155,0,1,0,2053,0,0,CCU,BLR,1546.4372901474003,0,0,0,0,0,0,0,0,0,0,4,9,15,2,1,1,0,1,0,0,0,1,Kolkata_Banglore,2871,1,21,1,0,598.6208865086711,0.10023038178627082,1,0
Jet Airways,27/06/2019,Delhi,Cochin,DEL → AMD → BOM → COK,13:25,19:00 28 Jun,29h 35m,2 stops,No info,12819,2019-06-27,13:25:00,19:00:00,0,1775,0,0,0,3849,0,0,DEL,COK,2047.882109458646,0,0,0,0,0,0,0,0,0,0,6,27,26,2,1,0,2,3,0,0,2,0,Delhi_Cochin,4537,0,3,0,1,69.2241839817007,0.8667491120713087,1,0
Jet Airways,15/05/2019,Kolkata,Banglore,CCU → BOM → BLR,21:10,04:40 16 May,7h 30m,1 stop,In-flight meal not included,9663,2019-05-15,21:10:00,04:40:00,0,450,0,0,1,3849,0,0,CCU,BLR,1546.4372901474003,0,0,0,0,0,0,0,0,0,0,5,15,20,2,1,1,3,0,0,1,1,0,Kolkata_Banglore,2871,1,16,0,0,206.19163868632003,0.29099143099239916,1,0
SpiceJet,3/05/2019,Kolkata,Banglore,CCU → BLR,06:55,09:30,2h 35m,non-stop,No check-in baggage included,3841,2019-05-03,06:55:00,09:30:00,0,155,0,1,0,818,0,0,CCU,BLR,1546.4372901474003,0,0,0,0,0,0,0,0,0,0,5,3,18,2,1,1,1,1,1,0,0,1,Kolkata_Banglore,2871,1,28,1,0,598.6208865086711,0.10023038178627082,1,0
IndiGo,27/06/2019,Delhi,Cochin,DEL → COK,05:35,08:50,3h 15m,non-stop,No info,5000,2019-06-27,05:35:00,08:50:00,0,195,0,1,0,2053,0,0,DEL,COK,2047.882109458646,0,0,0,0,0,0,0,0,0,0,6,27,26,2,1,0,0,1,0,0,0,1,Delhi_Cochin,4537,0,3,0,1,630.1175721411219,0.0952203249881156,1,0
Air India,01/03/2019,Banglore,New Delhi,BLR → CCU → GAU → DEL,05:50,22:10,16h 20m,2 stops,Change airports,13366,2019-03-01,05:50:00,22:10:00,0,980,0,1,0,1752,0,0,BLR,DEL,1708.6520853536679,0,0,0,0,0,0,0,0,0,0,3,1,9,1,1,1,0,3,0,0,2,0,Banglore_New Delhi,932,0,30,1,0,104.61135216451028,0.5735515195869458,1,0
Vistara,6/03/2019,Mumbai,Hyderabad,BOM → DEL → HYD,21:55,16:45 07 Mar,18h 50m,1 stop,No info,12395,2019-03-06,21:55:00,16:45:00,0,1130,0,0,1,479,0,0,BOM,HYD,622.9702752863186,0,0,0,0,0,0,0,0,0,0,3,6,10,1,1,1,3,2,0,1,1,0,Mumbai_Hyderabad,697,1,25,1,0,33.0780677143178,1.8138907181095427,1,0
